Tweets,Length,Date,Source,Favourites,RTs,Username,id_str,isRT,tco,Language,Month
How she's able to say this stuff with a straight face...,80,2020-06-18 17:39:48,Buffer,596,94,georgetakei,1273671772563476482,False,https://t.co/DsHp3d2CyK,en,June
"Overheard: Lots of people are upset that ""Karen"" has taken on negative connotations. But where were all these people when it was ""Felicia""?",139,2020-06-18 16:47:24,Twitter Web App,5224,584,georgetakei,1273658585508175872,False,,en,June
"Oh dear, something get under your skin, Donnie? 🤔",73,2020-06-18 16:43:02,Buffer,753,127,georgetakei,1273657486407499781,False,https://t.co/MYkTl263sm,en,June
Well...at least he was being honest. 😬,62,2020-06-18 16:04:30,Twitter Media Studio,1688,574,georgetakei,1273647789143097346,False,https://t.co/S47KqM0y2H,en,June
"No one does, really.",44,2020-06-18 15:34:49,Twitter for iPhone,7257,824,georgetakei,1273640318068355072,False,https://t.co/90kisZ0jOn,en,June
"Stephen Miller, you can suck my DACA.",37,2020-06-18 15:31:53,Twitter for iPhone,16258,2107,georgetakei,1273639579933978626,False,,en,June
Disgraceful,35,2020-06-18 15:26:50,Twitter for iPhone,704,125,georgetakei,1273638308036444160,False,https://t.co/RIhHJsEC6p,en,June
"Oh, what a pathetic little man.",55,2020-06-18 15:11:04,Buffer,242,41,georgetakei,1273634340539445251,False,https://t.co/D0UabZXBN5,en,June
"Trump is having a bad week at the Supreme Court. As in, really bad. 

Good thing for him his rally is going to win him points later this week in Tulsa, after no one in a packed auditorium, yelling and screaming and spitting his praise, will contract the coronavirus.",266,2020-06-18 14:58:00,Twitter for iPhone,1844,195,georgetakei,1273631052511227905,False,,en,June
Amazing. Chief Justice John G. Roberts Jr. wrote the opinion. The ruling was a blow to one of Trump’s central campaign promises to “immediately terminate” an executive order by Obama that Trump had called an illegal executive amnesty for hundreds of thousands of young immigrants.,304,2020-06-18 14:23:52,Twitter for iPhone,1568,231,georgetakei,1273622463327490048,False,https://t.co/jWElSN2q3k,en,June
"This is like the 100th person you hired who has done this. Let’s see: They’re all lying, or you are. Tough one...",137,2020-06-18 12:35:28,Twitter for iPhone,2881,471,georgetakei,1273595183570059265,False,https://t.co/80HttuLYw1,en,June
The government is so dysfunctional that only a landslide can clear the path. Let’s deliver one in November. #VoteBlue,117,2020-06-18 12:32:06,Twitter for iPhone,5714,844,georgetakei,1273594334886137857,False,,en,June
What are some of the movies you like to watch over and over again?,90,2020-06-18 03:49:25,Twitter Media Studio,507,80,georgetakei,1273462796768940032,False,https://t.co/QBiLW9EX3B,en,June
"This is long overdue. What do you think, friends?",73,2020-06-18 01:50:25,Twitter Media Studio,819,108,georgetakei,1273432849383907329,False,https://t.co/umlhKXPBcu,en,June
Couldn't have said it better myself.👏,61,2020-06-18 00:30:18,Buffer,954,172,georgetakei,1273412689742659584,False,https://t.co/yqGt1Qtkhm,en,June
"Oh, how adorable. 💕 What's your favorite example of unlikely animal friendships?",104,2020-06-18 00:01:05,Twitter Media Studio,664,184,georgetakei,1273405336851013632,False,https://t.co/jKNPZrxwHG,en,June
"Can you imagine if Hillary had told Xi she agreed with the building of Muslim concentration camps in China?!

I know I can't, because she isn't a sociopathic monster like Trump.",177,2020-06-17 23:52:39,Twitter for iPhone,3863,538,georgetakei,1273403213186768898,False,,en,June
"""I went to the Trump rally, and all I got was this stupid plague. It's called racism and it's very infectious.

Oh, and coronavirus. I got that, too.""",150,2020-06-17 23:38:13,Twitter for iPhone,8236,1048,georgetakei,1273399581313769473,False,,en,June
"So now that Bolton's book is out, does Sansa tie him to a chair and loose his own starving dogs on him? Oh wait, wrong Bolton.",126,2020-06-17 22:31:44,Twitter Web App,2410,292,georgetakei,1273382851195650050,False,,en,June
"Uh-oh, Donnie, that's gotta hurt.",57,2020-06-17 22:18:05,Buffer,911,195,georgetakei,1273379413380472832,False,https://t.co/VPuu6P3sND,en,June
"So proud of the Star Trek family. Will you join us?
#StarTrekUnitedGives",96,2020-06-17 22:15:26,Twitter Web App,1340,447,georgetakei,1273378747966787586,False,https://t.co/008WHM4btF,en,June
"While attendees at Trump's rally in Tulsa will be handed masks, wearing them will be optional, according to White House Press Secretary, Kayleigh McEnany.

Also optional will be any common sense, decency or understanding of how epidemics work.",243,2020-06-17 22:06:18,Twitter Web App,3282,491,georgetakei,1273376448989069316,False,,en,June
Do you want to tell her or should I? 😬,62,2020-06-17 21:55:24,Twitter Media Studio,856,156,georgetakei,1273373708166606848,False,https://t.co/XkGTf0Vois,en,June
"Friends, please join me in taking action against Donald's harmful new anti-#LGBTQ health care rule!

In 24 hours @LambdaLegal will deliver your signatures right to @HHSGov in DC. Sign on now and help us #StopTheRule:",264,2020-06-17 21:20:25,Buffer,348,132,georgetakei,1273364904217583622,False,https://t.co/xvlMy9ae70,en,June
What is wrong with him?,47,2020-06-17 20:25:14,Buffer,1105,201,georgetakei,1273351015027347456,False,https://t.co/aNATHYhJkQ,en,June
Absolutely outrageous.,46,2020-06-17 19:33:25,Buffer,271,52,georgetakei,1273337976735576067,False,https://t.co/vDdznRbMsd,en,June
"In 2020, it often feels like we're living in The #TwilightZone. What's your most memorable episode of the iconic TV show, friends?",154,2020-06-17 19:24:36,Twitter Media Studio,389,70,georgetakei,1273335758036795393,False,https://t.co/0e0q6WbsxX,en,June
"Between maple syrup and egg McMuffins, white America is having a very tough week.",81,2020-06-17 19:22:03,Twitter for iPhone,7481,849,georgetakei,1273335115163336705,False,,en,June
This is...I have no words. None.,56,2020-06-17 19:01:37,Twitter for iPhone,624,153,georgetakei,1273329971780599819,False,https://t.co/dHenx2lOEi,en,June
"if you really don't want your state or town to lockdown again, then do your part. Wear a mask out in public places. It helps stops Covid-19. Will you?",150,2020-06-17 18:59:49,Twitter for iPhone,7051,1120,georgetakei,1273329520477700096,False,,en,June
Brava! 👏,32,2020-06-17 17:57:00,Buffer,812,116,georgetakei,1273313711760048129,False,https://t.co/IRfg2yv021,en,June
"Tomorrow evening, I hope you'll join me for a virtual panel exploring LGBTQ+ identity as a Japanese American.

Details: Thursday, June 18, at 6:30 pm PT. Hosted by @Okaeri_LA @jamuseum and @vcmediaorg. Tickets are free, RSVP here:",254,2020-06-17 17:36:54,Buffer,220,37,georgetakei,1273308652309557249,False,https://t.co/SZVmrfEfGU,en,June
The delusion is strong with this one.,61,2020-06-17 16:50:59,Buffer,1197,199,georgetakei,1273297098734219265,False,https://t.co/5oGpJyBz6Q,en,June
Which dog breed do you think is the smartest?,69,2020-06-17 16:06:33,Twitter Media Studio,256,55,georgetakei,1273285916010983425,False,https://t.co/o98WUnKVuu,en,June
Unbelievable.,37,2020-06-17 15:07:51,Buffer,610,119,georgetakei,1273271143189921796,False,https://t.co/u62uK84tFJ,en,June
Overheard: Has Covid-19 forced you to wear a mask and glasses at the same time? You may be entitled to condensation.,116,2020-06-17 13:20:46,Twitter for iPhone,18779,2124,georgetakei,1273244193268346880,False,,en,June
Thank you @TrevorNoah for being a voice of reason and humor in this very dark time.,107,2020-06-17 03:42:24,Twitter Media Studio,2459,450,georgetakei,1273098643474714625,False,https://t.co/gIwIt5O6Wx,en,June
"What do you think, is Spicey onto something?",68,2020-06-17 02:06:31,Buffer,217,51,georgetakei,1273074514646249473,False,https://t.co/JtO3ZMQQpS,en,June
Horrifying.,35,2020-06-17 01:48:18,Twitter for iPhone,712,149,georgetakei,1273069928187416581,False,https://t.co/OK30gHKWQ3,en,June
"I don’t care what you think your freedoms give you the right to do. You can’t smoke within a few feet of me in a public building, so no, you can’t stand nearby me without a mask on during an epidemic either. Get on board, or stay the frack home.",245,2020-06-17 01:37:23,Twitter for iPhone,5699,862,georgetakei,1273067184248496128,False,,en,June
"If we were hiding from killers, and our leader said, “Everyone, we all need to stay quiet!” but two people insisted on talking loudly anyway, you’d be right to shush the loud ones, tell them to knock it off. No one has the right to endanger others like that.",258,2020-06-17 01:34:26,Twitter for iPhone,4207,627,georgetakei,1273066440573300744,False,,en,June
"Who's your favorite 'Peanuts' character, friends?",73,2020-06-17 01:31:40,Twitter Media Studio,395,71,georgetakei,1273065742649475072,False,https://t.co/wKDbpxFDD1,en,June
"If everyone wore masks, we could get back to something like normal very quickly. But some people are selfish toddlers, aren’t they. They’re the reason we’re still stuck at 20,000+ new cases a day. Call them out. They are the problem.",233,2020-06-17 01:26:38,Twitter for iPhone,28332,6919,georgetakei,1273064476338724864,False,,en,June
We fight for all LGBTQs everywhere because we must. It is life or death for many.,105,2020-06-17 00:28:50,Twitter for iPhone,1022,185,georgetakei,1273049932652580874,False,https://t.co/i8IMLxXH17,en,June
"Oh, now that's just sad.",48,2020-06-17 00:24:06,Buffer,518,109,georgetakei,1273048742233616384,False,https://t.co/WdmdSjQtoN,en,June
"Sorry, Mike Pence and Lindsey Graham. The SCOTUS decision doesn’t prevent the voters from firing you this November.",115,2020-06-17 00:08:19,Twitter for iPhone,7198,946,georgetakei,1273044767782338560,False,,en,June
"Oh, that is rich.",41,2020-06-16 22:57:05,Buffer,434,108,georgetakei,1273026843113914369,False,https://t.co/D4UGrQrfbv,en,June
"Images can say so much. What do you think are the biggest differences between the Trump and Obama presidencies, friends?",144,2020-06-16 21:56:09,Twitter Media Studio,1543,499,georgetakei,1273011505798303745,False,https://t.co/s34kIzsBfH,en,June
Who wants to tell him?🙄,47,2020-06-16 21:02:02,Buffer,1477,231,georgetakei,1272997890261168129,False,https://t.co/F99Hro7Kli,en,June
Now is the time to stand up for trans lives. Say it with me: Trans people belong. Black trans people belong.,156,2020-06-16 20:08:33,Buffer,703,140,georgetakei,1272984431117111296,False,https://t.co/av9kB9lVfK,en,June
"Oh, this is perfect.😂",45,2020-06-16 19:28:52,Buffer,891,152,georgetakei,1272974442893844480,False,https://t.co/fvbIGSM8Lk,en,June
"Yaaassss, welcome to the community, SpongeBob! 💕 #pride",79,2020-06-16 18:22:11,Twitter Media Studio,861,136,georgetakei,1272957662997762048,False,https://t.co/WR18r8Mhql,en,June
Oh dear.😂,33,2020-06-16 17:38:22,Buffer,1309,234,georgetakei,1272946633538441222,False,https://t.co/ASpeNMrnuE,en,June
"Thrilled to see companies like @atari stepping up to support LGBTQs with a .gay domain for their new Qutie App. It’s a great way for brands to get their messages of support out while also giving back to the LGBTQ community.

Happy #PrideMonth friends!!",276,2020-06-16 17:35:17,Twitter for iPhone,245,44,georgetakei,1272945857118326784,False,https://t.co/RZ4pidqkVL,en,June
"@elonmusk @physorg_com @ubcnews @AAS_Publishing I’ve always thought, humans will evolve one day so far that they will leave their corporeal forms, coding their consciousness into the bits that make up the universe. Who is to say aliens have not already done this and are literally everywhere... and nowhere.",307,2020-06-16 16:48:24,Twitter for iPhone,665,36,georgetakei,1272934058704678912,False,,en,June
Not even Fox hosts are buying what he's selling.,72,2020-06-16 16:29:16,Buffer,271,65,georgetakei,1272929243022921728,False,https://t.co/c5twv7rCP4,en,June
"Prepare for your heart to be warmed, friends.💕",70,2020-06-16 15:55:38,Twitter Media Studio,1001,226,georgetakei,1272920782402916352,False,https://t.co/392vuWbpnt,en,June
"Oh, believe it, Tucker.",47,2020-06-16 15:09:35,Buffer,1357,203,georgetakei,1272909193914339329,False,https://t.co/xrEFtAZbER,en,June
A truly remarkable discovery! 👏,55,2020-06-16 03:59:42,Twitter Media Studio,617,167,georgetakei,1272740609355395072,False,https://t.co/rpHt4whm7V,en,June
"Because why wouldn’t you, really?",57,2020-06-16 02:12:25,Twitter for iPhone,839,124,georgetakei,1272713613351047168,False,https://t.co/t19cNgh8xZ,en,June
What an unexpected but welcome victory!,63,2020-06-16 01:22:12,Twitter Media Studio,1851,227,georgetakei,1272700975934038016,False,https://t.co/bvUQeYYCjt,en,June
"Oh, Tomi. Hate and ignorance aren’t protected classes.",78,2020-06-16 00:47:59,Twitter for iPhone,6325,808,georgetakei,1272692361538265091,False,https://t.co/xkR3ZUB4Vr,en,June
That's not how any of this works.,57,2020-06-15 23:29:00,Buffer,860,149,georgetakei,1272672487239753728,False,https://t.co/WjJA7q2TYo,en,June
We all need to take this sentiment to heart. 💕 It's as true today as i was then.,104,2020-06-15 23:19:24,Twitter Media Studio,2552,822,georgetakei,1272670068497842178,False,https://t.co/AMdtMqFVFe,en,June
What a strange timeline this is.,56,2020-06-15 22:08:01,Buffer,1294,160,georgetakei,1272652104482598913,False,https://t.co/gHWkmtDzf9,en,June
This is so dumb it hurts.,49,2020-06-15 21:03:16,Twitter for iPhone,4989,699,georgetakei,1272635812916736001,False,https://t.co/rUhJwHRrqo,en,June
"Wrong again, Ann.",41,2020-06-15 20:53:06,Buffer,480,68,georgetakei,1272633252579282946,False,https://t.co/RIT30aobwv,en,June
Oh dear. 😂,33,2020-06-15 19:40:33,Buffer,2059,383,georgetakei,1272614993498968065,False,https://t.co/0pJyabiZNg,en,June
"A welcome gesture to be sure. What do you think, friends?",81,2020-06-15 19:30:02,Twitter Media Studio,328,51,georgetakei,1272612350345056257,False,https://t.co/KqhPVypsOT,en,June
"Sex is great, but have you looked upon the faces of religious bigots after a 6-3 ruling for LGBTQ rights?",105,2020-06-15 19:06:51,Twitter for iPhone,28121,3356,georgetakei,1272606514776326145,False,,en,June
"Listen and learn, Donald.",49,2020-06-15 18:12:04,Buffer,239,47,georgetakei,1272592728589819905,False,https://t.co/tXrd6OqkOA,en,June
Police reform must go hand in hand with gun reform.,51,2020-06-15 17:35:26,Twitter for iPhone,5823,853,georgetakei,1272583507852828680,False,,en,June
"Now is your chance to experience my beloved show, @AllegianceBway, from the comfort of your home! It's available just 1 MORE WEEK for digital streaming exclusively at @BwayOnDemand! Reserve your seat right from your living room now!",280,2020-06-15 16:52:19,Twitter Web App,274,58,georgetakei,1272572659721789441,False,https://t.co/yyLJJ0tiFb,en,June
An important reminder about the need to call out and expose systemic racism wherever it lives.,118,2020-06-15 16:45:12,Twitter Media Studio,2601,637,georgetakei,1272570867285929984,False,https://t.co/X65ct6f091,en,June
SUPREME COURT!,38,2020-06-15 16:20:01,Twitter for iPhone,4165,402,georgetakei,1272564531152277505,False,https://t.co/hmgJtpx4nS,en,June
The hits just keep on coming.,53,2020-06-15 16:19:15,Twitter for iPhone,1337,244,georgetakei,1272564337337683969,False,https://t.co/nLgD2DW9nw,en,June
"It’s a great day to show some PRIDE! But put your money where your heart is! It’s easy, and you could even win a face to face with a legend.",164,2020-06-15 16:15:16,Twitter for iPhone,244,42,georgetakei,1272563332772487171,False,https://t.co/DP6S0V0qOP,en,June
That didn't age well.,45,2020-06-15 15:48:06,Buffer,491,79,georgetakei,1272556495373246471,False,https://t.co/46LOd1YFXH,en,June
"Trump and his “Justice” Department, homophobes and religious bigots, ICE, and the NRA are all having a VERY bad day at the Supreme Court.

Thoughts and prayers.",160,2020-06-15 15:32:04,Twitter for iPhone,13527,2105,georgetakei,1272552461635477504,False,,en,June
"The LGBTQ civil rights movement began 51 years ago with the Stonewall Riots, led by trans POC heroes. Today we mark another milestone in our struggle for equality with a victory in the Supreme Court, extending Title VII nondiscrimination protections to LGBTQs.

O happy day!",274,2020-06-15 15:10:29,Twitter for iPhone,4656,760,georgetakei,1272547030557229059,False,,en,June
Indeed!,31,2020-06-15 14:18:43,Twitter for iPhone,926,106,georgetakei,1272534003749396480,False,https://t.co/r2yMFk5F5i,en,June
This is astonishing and very welcome news. It’s a game changer.,87,2020-06-15 14:16:05,Twitter for iPhone,5019,707,georgetakei,1272533339824697345,False,https://t.co/Kg2YtQAVsJ,en,June
"What do you think the biggest misconceptions about autism are, friends?",95,2020-06-15 03:23:00,Twitter Media Studio,1532,415,georgetakei,1272368985238122496,False,https://t.co/QOWGybSbo1,en,June
"Oh, how heartwarming. 💕 Another step forward for LGBTQ representation. #Pride",101,2020-06-15 00:05:00,Twitter Media Studio,565,110,georgetakei,1272319157107716096,False,https://t.co/89hSaCRGSl,en,June
"Seriously, what is wrong with people?",61,2020-06-14 23:09:01,Buffer,1014,242,georgetakei,1272305070986625024,False,https://t.co/sGUJm6uGrY,en,June
"In 2018 Kayne West made as ass of himself, but Taylor Swift stepped up.

In 2020, JK Rowling broke our hearts, but guess who stepped up? That’s right. NASCAR.

Who had THAT on their 2020 bingo card? Wild.",204,2020-06-14 22:03:22,Twitter for iPhone,9016,1099,georgetakei,1272288547043717120,False,,en,June
"Oh, this is classic.😂",45,2020-06-14 21:50:01,Buffer,589,156,georgetakei,1272285186831593472,False,https://t.co/n99b5bJyfv,en,June
Brava @Lizzo! A master class in shaming the shamers. 💕,78,2020-06-14 21:43:00,Twitter Media Studio,1081,161,georgetakei,1272283421503442944,False,https://t.co/JEmQCF6bVC,en,June
This is an astonishing sight. My heart. #BlackTransLivesMatter,86,2020-06-14 20:39:25,Twitter for iPhone,38808,7280,georgetakei,1272267419357188097,False,https://t.co/qgTc932OAK,en,June
"Get with the program, Donald.",53,2020-06-14 20:33:00,Buffer,694,120,georgetakei,1272265806630486022,False,https://t.co/cs8MYPIPur,en,June
Trump’s campaign is really ramping down these days.,51,2020-06-14 20:31:15,Twitter for iPhone,5197,527,georgetakei,1272265367776309249,False,,en,June
"Oh the horror! Obamagate, indeed. 😂 #ObamaDayJune14th",77,2020-06-14 19:22:00,Twitter Media Studio,2291,752,georgetakei,1272247937695805440,False,https://t.co/mQiC7aEDml,en,June
"Well, that backfired brilliantly.😂",58,2020-06-14 19:04:01,Buffer,929,195,georgetakei,1272243411672760320,False,https://t.co/YmtCbDAc9M,en,June
"Oh, you sad pathetic little man.",56,2020-06-14 17:38:00,Buffer,1668,240,georgetakei,1272221766581133312,False,https://t.co/Dr35h1poef,en,June
"Oh, @PeteSouza, you've done it again. 👏 #ObamaDayJune14th",81,2020-06-14 17:21:00,Twitter Media Studio,6297,2427,georgetakei,1272217486964822017,False,https://t.co/MHKeKeoHz8,en,June
"I’m thinking of sending Trump a Lark for his birthday. You know, so he doesn’t have to worry about steep and slippery ramps.",124,2020-06-14 17:02:02,Twitter for iPhone,1013,93,georgetakei,1272212713683460099,False,,en,June
"We see you, Donald. 😂",45,2020-06-14 16:18:01,Buffer,482,84,georgetakei,1272201637159985153,False,https://t.co/3ZvxI3krdC,en,June
"Oh, how you are missed, Mr. President. What do you miss most about @BarackObama, friends? #ObamaDayJune14th",131,2020-06-14 15:23:00,Twitter Media Studio,10991,3393,georgetakei,1272187791460294657,False,https://t.co/Eskc6qPFku,en,June
You need to calm down.,46,2020-06-14 15:08:11,Buffer,575,83,georgetakei,1272184065760862209,False,https://t.co/KEzgvvVNoE,en,June
I’m nine years older than Trump and I move down a ramp a lot faster. Just saying. #Diet #Exercise #DrugFree,107,2020-06-14 13:06:59,Twitter for iPhone,11316,1253,georgetakei,1272153564715134977,False,,en,June
Hey Trump folks: You know what would really own the libs? Boycotting the election! Pass it along.,121,2020-06-14 13:05:21,Twitter for iPhone,1963,385,georgetakei,1272153153404833795,False,https://t.co/CypMSlda2W,en,June
"I’d say happy birthday to Donald on his special day, but after all, #AllBirthdaysMatter",87,2020-06-14 12:57:52,Twitter for iPhone,6412,1058,georgetakei,1272151269134798848,False,,en,June
Found the tweet!,40,2020-06-14 12:52:14,Twitter for iPhone,6186,1165,georgetakei,1272149851380293634,False,https://t.co/iwPuG8nQAD,en,June
If “all lives matter” then you’ll get your family vaccinated and support universal health care. Right?,102,2020-06-14 12:48:29,Twitter for iPhone,60050,11929,georgetakei,1272148906391089152,False,,en,June
@realDonaldTrump,40,2020-06-14 11:44:33,Twitter for iPhone,451,72,georgetakei,1272132818420760576,False,https://t.co/dZQ2rf58Jb,en,June
"I remember three years ago when so many in the gay community lost their sh*t because the city of Philadelphia wanted to add black and brown stripes to its Pride flag, simply in solidarity with POCs who were being turned away at gay bars. Let’s do better going forward.",268,2020-06-14 11:41:50,Twitter for iPhone,3268,352,georgetakei,1272132132962553857,False,,en,June
Let the #ObamaBomb begin!,49,2020-06-14 10:40:51,Twitter for iPhone,3017,1033,georgetakei,1272116785618259968,False,https://t.co/JBlEW2W8sp,en,June
Looks like some folks found their Seoul.,64,2020-06-14 10:14:01,Twitter for iPhone,2301,271,georgetakei,1272110034252713984,False,https://t.co/yDiI636SNN,en,June
Each one more iconic than the last. 🙌 Thank you @sarahcpr for the laughs in this dark time.,115,2020-06-14 03:55:00,Twitter Media Studio,3739,634,georgetakei,1272014651597950977,False,https://t.co/ALeh1iSLIz,en,June
"Here’s the thing. If Trump wins re-election, there will be nothing holding him back, because he won’t need to try to win anyone’s vote. Trust me, you don’t want to experience what that would be like.",199,2020-06-14 01:36:39,Twitter for iPhone,21629,4733,georgetakei,1271979835343212544,False,,en,June
"What incredible achievements, Brava! 👏",62,2020-06-14 01:23:00,Twitter Media Studio,536,134,georgetakei,1271976398392102912,False,https://t.co/zpOlXVAC76,en,June
"Hmm, Donald really doesn't want the rest of us to vote by mail, does he? What do you think he's so afraid of? 🤔",135,2020-06-13 23:08:00,Twitter Media Studio,695,231,georgetakei,1271942424512921600,False,https://t.co/sm4O5iPx3p,en,June
Yup.,28,2020-06-13 23:02:01,Buffer,431,88,georgetakei,1271940917927096321,False,https://t.co/b002XqWYpo,en,June
"Voting by mail should be implemented nationwide.

Pass it on.",85,2020-06-13 21:45:00,Twitter for iPhone,12868,4962,georgetakei,1271921537428402178,False,https://t.co/ZnVM6lYmiO,en,June
"No, Kayleigh. Just no.",46,2020-06-13 21:38:00,Buffer,864,171,georgetakei,1271919776940638213,False,https://t.co/IoWd8vyyce,en,June
"The next First Lady of the United States, ladies and gentlemen.",87,2020-06-13 20:43:00,Twitter Media Studio,3933,941,georgetakei,1271905934101540864,False,https://t.co/rH8kESbeje,en,June
Accurate.,33,2020-06-13 20:19:00,Buffer,833,178,georgetakei,1271899895486611460,False,https://t.co/u4YEYKFdxF,en,June
Think about this.,41,2020-06-13 19:54:49,Twitter for iPhone,765,253,georgetakei,1271893807492186112,False,https://t.co/A8fHTKoEIk,en,June
Whoops! 😂,33,2020-06-13 19:02:01,Buffer,736,189,georgetakei,1271880520616546311,False,https://t.co/n99b5bJyfv,en,June
"Now that @JoeBiden has clinched the Democratic nomination, who do you think he should choose as his VP?",127,2020-06-13 18:13:00,Twitter Media Studio,653,133,georgetakei,1271868185520848896,False,https://t.co/55pz3VmDea,en,June
Get ready. It’s tomorrow.,49,2020-06-13 18:07:52,Twitter for iPhone,35375,11856,georgetakei,1271866893113200640,False,https://t.co/GzSXAEs9Jg,en,June
Who wants to tell him?,46,2020-06-13 17:48:00,Buffer,402,73,georgetakei,1271861896367476739,False,https://t.co/HKU4oT8E0a,en,June
"Oh, poor baby.",38,2020-06-13 16:31:01,Buffer,1607,270,georgetakei,1271842519735828485,False,https://t.co/cs8MYPIPur,en,June
"Join Tamlyn Tomita, David Ono, and yours truly today at 5:00 p.m. EDT / 2:00 p.m. PDT for “Tadaima!”—the opening ceremony for a nine-week-long virtual pilgrimage to the 10 Japanese American WWII internment camps.
Link here:",247,2020-06-13 16:29:58,Twitter for iPhone,207,67,georgetakei,1271842256270565376,False,https://t.co/9LZ2uSk52Q,en,June
No words,32,2020-06-13 15:57:06,Twitter for iPhone,747,182,georgetakei,1271833984591441920,False,https://t.co/s57OQNv7Ud,en,June
"Congratulations, @TanFrance! 💕",54,2020-06-13 15:56:20,Twitter Media Studio,788,65,georgetakei,1271833793578532866,False,https://t.co/LGQYe3t6Zp,en,June
Projecting much?,40,2020-06-13 15:24:11,Buffer,776,113,georgetakei,1271825703986769920,False,https://t.co/1eKXopHQxs,en,June
I can’t get enough.,43,2020-06-13 11:56:43,Twitter for iPhone,4399,606,georgetakei,1271773492124549126,False,https://t.co/li1BxFHPeC,en,June
An incredibly powerful testimony. Thank you for your honesty @AyannaPressley.,101,2020-06-13 03:28:00,Twitter Media Studio,865,184,georgetakei,1271645467781271558,False,https://t.co/Lb1qlVZ19y,en,June
"Oh myyy. 😂 Donnie, that's gotta hurt!",61,2020-06-13 01:34:00,Twitter Media Studio,937,305,georgetakei,1271616778804789249,False,https://t.co/9dvD8XMHaj,en,June
I don’t get what beef he has with this.,63,2020-06-13 00:59:18,Twitter for iPhone,873,68,georgetakei,1271608047207579655,False,https://t.co/GFqPqqcFue,en,June
"Hmm, it's almost like you're on the wrong side of history, Donald.",90,2020-06-13 00:58:20,Buffer,1393,249,georgetakei,1271607802545520640,False,https://t.co/cs8MYPIPur,en,June
Today marks the anniversary of the Pulse Nightclub massacre. There aren’t coincidences. There is only cruelty.,134,2020-06-13 00:48:46,Twitter for iPhone,2969,830,georgetakei,1271605396692762624,False,https://t.co/6bHmvjZvqu,en,June
