Tweets,Length,Date,Source,Favourites,RTs,Username,id_str,isRT,tco,Language,Month
"The callous disregard for the well being of our fellow citizens by the police today in places like LA, NYC and Buffalo have left me sickened. We need reform at all levels. A dangerous culture of racism and violence lurks in many departments, and it’s on full display. Shameful.",277,2020-06-05 03:05:10,Twitter for iPhone,6727,1659,georgetakei,1268740619725348864,False,,en,June
This is the lie abusers tell.,53,2020-06-05 02:42:26,Twitter for iPhone,2751,670,georgetakei,1268734897780256768,False,https://t.co/LHyRE0gcL9,en,June
This appears to be the cop who shoved that elderly man and with his fellow officers left him bleeding in the street.,140,2020-06-05 02:29:10,Twitter for iPhone,6447,3143,georgetakei,1268731561849077760,False,https://t.co/FSAazDntDr,en,June
This warms my heart.,44,2020-06-05 01:46:14,Buffer,2300,318,georgetakei,1268720757145772032,False,https://t.co/TPCya7WVtQ,en,June
"What say you, Mr. Barr?",47,2020-06-05 00:14:00,Buffer,996,240,georgetakei,1268697546353979393,False,https://t.co/bvbCFYVNUM,en,June
Who is being violent?,45,2020-06-05 00:08:51,Twitter for iPhone,2095,1083,georgetakei,1268696246371389440,False,https://t.co/eax6ACFuk3,en,June
"Twitter, you know what to do.",53,2020-06-05 00:08:17,Twitter for iPhone,10352,4845,georgetakei,1268696107783196672,False,https://t.co/hcuzWc40Zk,en,June
"Thank you for your passion and your activism, @ReginaKing. 👏 How are you committing yourself to making real change, friends?",148,2020-06-05 00:02:00,Twitter Media Studio,548,81,georgetakei,1268694523472986112,False,https://t.co/GJYFArPpOC,en,June
How apropos.😂,37,2020-06-04 22:42:06,Buffer,643,136,georgetakei,1268674415245615104,False,https://t.co/eFmwXEcCo8,en,June
"You were saying about voter registration fraud, Donald...?",82,2020-06-04 20:59:00,Twitter Media Studio,1892,673,georgetakei,1268648469960392704,False,https://t.co/tfBWfY6nwv,en,June
"Gee, I wonder what the difference was. 🤔",63,2020-06-04 20:28:56,Buffer,674,129,georgetakei,1268640904555921409,False,https://t.co/IJyvaSavzL,en,June
"This is quite powerful, friends.",56,2020-06-04 19:42:04,Buffer,1681,433,georgetakei,1268629109984440323,False,https://t.co/a1EngifQSP,en,June
"When you’re somewhere and you hear the national Anthem being played, take a knee. Remind yourself and us all that we must change America. We must stop the killings of black citizens by the police.",196,2020-06-04 19:24:54,Twitter for iPhone,2495,476,georgetakei,1268624791185039362,False,,en,June
"The NYT ran an OpEd by Senator Tom Cotton today entitled “Send in the Troops.” They did it on the anniversary of the military crackdown in Tiananmen Square, China.

Do better, @nytimes",184,2020-06-04 19:01:16,Twitter for iPhone,1463,310,georgetakei,1268618841124270080,False,,en,June
Are you watching this and listening @NYCMayor?,70,2020-06-04 18:42:41,Twitter Web App,440,199,georgetakei,1268614167566532608,False,https://t.co/8bIv2eLtQh,en,June
Trump got that White House fence up way faster than he got PPEs out to essential medical workers.,97,2020-06-04 18:40:05,Twitter Web App,84354,19046,georgetakei,1268613512848269318,False,,en,June
A powerful message of love and acceptance. 👏 We need more of this in the world. 💕 #Pride,112,2020-06-04 18:15:05,Twitter Media Studio,724,161,georgetakei,1268607221199327232,False,https://t.co/BpM7e6PfAz,en,June
Oh dear.,32,2020-06-04 18:11:13,Buffer,216,34,georgetakei,1268606247030403072,False,https://t.co/ct52oypD4X,en,June
Congress is listening. Keep up the pressure! Double it if you can.,90,2020-06-04 17:58:25,Twitter for iPhone,489,151,georgetakei,1268603025997824002,False,https://t.co/uIdbHgQmux,en,June
Yes!,28,2020-06-04 17:50:12,Twitter for iPhone,1212,238,georgetakei,1268600958579347467,False,https://t.co/tD72La1hLu,en,June
"The president (aka Chicken Little) is literally walling himself inside the White House away from the mean, scawy pwotestors.",124,2020-06-04 17:47:17,Twitter for iPhone,10971,1731,georgetakei,1268600223137488897,False,,en,June
Horrifying.,35,2020-06-04 16:57:48,Twitter for iPhone,11028,6271,georgetakei,1268587771825917952,False,https://t.co/PWjRMyoT6C,en,June
"Something get under your skin, Rudy?😂",61,2020-06-04 16:51:24,Buffer,519,86,georgetakei,1268586158528909313,False,https://t.co/QxjaJQe1IU,en,June
Have you been protesting? I would love to hear your story. Text me at (310) 299-9390.,85,2020-06-04 15:29:00,Buffer,275,94,georgetakei,1268565423966035968,False,,en,June
Hear hear! 👏,36,2020-06-04 15:20:37,Buffer,781,170,georgetakei,1268563313505505283,False,https://t.co/oWtCvter5y,en,June
Thread is vital,39,2020-06-04 15:20:02,Twitter Web App,411,139,georgetakei,1268563167183097856,False,https://t.co/fyrnHYGd24,en,June
"Here's to the KPop fans who saw that White Supremacists were trying to get White Lives Matter to trend as a hashtag, so they tagged so many fancams, fanpics, BTS and Blackpink videos with that same tag that this is the stuff you see when you search with that hashtag. #Allies",299,2020-06-04 15:13:21,Twitter Web App,3377,517,georgetakei,1268561487347372032,False,https://t.co/e04i36Ef0A,en,June
"If pressure for the internment of my community were happening today, would the NYT run an Op-Ed by Earl Warren saying, ""Lock Them Up""? Asking for 120,000 of us.",160,2020-06-04 14:22:57,Twitter for iPhone,1717,362,georgetakei,1268548800123211777,False,,en,June
"This is going up around the White House. Is Mexico going to pay for this wall, too?",107,2020-06-04 13:58:43,Twitter for iPhone,15934,3651,georgetakei,1268542704004235266,False,https://t.co/Wvy3lcz9c9,en,June
"I'd like to thank @sarahcpr and @RandyRainbow for keeping us laughing, sane, and human through these very troubled times. Please give them each a follow. It would mean a lot to me. And it will be the best thing you did for your soul in some time.",246,2020-06-04 12:35:05,Twitter Web App,5637,454,georgetakei,1268521655858536448,False,,en,June
It's real. It's horrific.,49,2020-06-04 11:59:42,Twitter for iPhone,646,190,georgetakei,1268512752924065792,False,https://t.co/cxJmKFWK3d,en,June
This needs to happen. Qualified immunity is a purely judicial invention by conservative justices who are supposed to be textualists. The hypocrisy is profound.,183,2020-06-04 11:52:24,Twitter for iPhone,1071,291,georgetakei,1268510915621801984,False,https://t.co/ndkCso3Dok,en,June
"Peaceful protests are not a sign of collapse, they are a sign of hope. Things are changing. Good people and leaders are listening. Trump is flailing. I feel inspired.",166,2020-06-04 11:45:40,Twitter for iPhone,11339,1613,georgetakei,1268509219080331264,False,,en,June
Important.,34,2020-06-04 11:43:41,Twitter for iPhone,1468,581,georgetakei,1268508719463174144,False,https://t.co/9gcy7Phj5e,en,June
"If true, it represents a dangerous escalation toward partisan violence. Trump Army? Really?!",116,2020-06-04 11:40:07,Twitter for iPhone,2366,1016,georgetakei,1268507824398663680,False,https://t.co/PfqNPZJxo3,en,June
Such a crucial initiative from the endlessly generous @Oprah. 💕,87,2020-06-04 03:13:50,Twitter Media Studio,643,121,georgetakei,1268380413699018752,False,https://t.co/SfBzHNIiKi,en,June
Required reading,40,2020-06-04 02:03:00,Twitter for iPhone,640,183,georgetakei,1268362588330565633,False,https://t.co/YqvaPCV10P,en,June
What country is this?,45,2020-06-04 01:29:37,Buffer,1211,252,georgetakei,1268354185344491522,False,https://t.co/6LkBHRrbhW,en,June
I don't envy @JoeBiden's decision. Such incredible talent and commitment among these admirable women.,125,2020-06-04 00:47:03,Twitter Media Studio,1202,206,georgetakei,1268343472869834752,False,https://t.co/helwTiM7oK,en,June
Dissension in the ranks.,48,2020-06-04 00:28:55,Buffer,607,98,georgetakei,1268338912101089281,False,https://t.co/xYP79eoKnr,en,June
Donald's hypocrisy truly knows no bounds.,65,2020-06-03 22:58:01,Buffer,740,175,georgetakei,1268316032998887424,False,https://t.co/aNwgqXKwYh,en,June
"On a serious note, it is a damn shame that we have ceded the moral high ground around the world, and that a repressive regime like China can call out our hypocrisy.",164,2020-06-03 22:33:52,Twitter Web App,2544,294,georgetakei,1268309956970680321,False,,en,June
"After State Dept spokeswoman Morgan Ortagus tweeted that ""freedom loving people around the world must stand with the rule of law and hold to account the Chinese Communist Party,"" a Chinese Foreign Ministry spokeswoman replied ""I can't breathe.""

How do you say ""Shade"" in Chinese?",280,2020-06-03 22:32:31,Twitter Web App,6316,1399,georgetakei,1268309619186839553,False,,en,June
Each one more iconic than the last. 🙌 Thank you @sarahcpr for the laughs in this dark time.,115,2020-06-03 22:15:05,Twitter Media Studio,3810,632,georgetakei,1268305229067452419,False,https://t.co/cOyxOKBVFO,en,June
".@cliftonwalker is leading the charge to #TurnTexasBlue. He's one of the hardest working guys out there, but is still ""floored"" by support from me and @HamillHimself. We're floored by your dedication, Cliff! Let's make his day and give him a few new followers this week.",294,2020-06-03 21:21:18,Twitter for iPhone,1191,309,georgetakei,1268291693331259394,False,https://t.co/cz6f3xFlvJ,en,June
@DJ28978963 @theodoxus @HamillHimself trek first lol,52,2020-06-03 21:14:38,Twitter for iPhone,7,1,georgetakei,1268290018088497152,False,,en,June
"Thanks for the support to #TurnTexasBlue, @HamillHimself. When two franchises join forces against the darkness, anything is possible.",157,2020-06-03 21:02:18,Twitter for iPhone,4771,1174,georgetakei,1268286915360546826,False,https://t.co/DSPAC9Ew7a,en,June
"Well played, sir.😂",42,2020-06-03 20:07:49,Buffer,3236,987,georgetakei,1268273204554072064,False,https://t.co/7QkHUUBy1x,en,June
What is wrong with people?,50,2020-06-03 19:11:01,Buffer,553,183,georgetakei,1268258906696028163,False,https://t.co/Bu523NOBSF,en,June
"Thank you @LeVarBurton for being such a needed inspiring voice for so many. 💕 What is your favorite LeVar Burton project, friends?",154,2020-06-03 19:03:10,Twitter Media Studio,1234,218,georgetakei,1268256932609097728,False,https://t.co/Srm55YcVtS,en,June
"Donald Trump and Joe Biden are locked in a very tight race in Texas, with Trump receiving 44% and Biden receiving 43% in a general election matchup, according to a Quinnipiac Univ poll released today.

When we take TX for good, it's game over for the GOP in national elections.",277,2020-06-03 18:24:20,Twitter for iPhone,27240,4815,georgetakei,1268247160803508229,False,,en,June
Under His eye...,40,2020-06-03 18:03:00,Twitter for iPhone,1134,228,georgetakei,1268241789649145856,False,https://t.co/6ZtkZAOE6c,en,June
Indeed.👏,32,2020-06-03 17:53:57,Buffer,884,196,georgetakei,1268239514713161731,False,https://t.co/NfdntYQE9D,en,June
An important reminder about the need to call out and expose systemic racism wherever it lives.,118,2020-06-03 16:57:53,Twitter Media Studio,2181,548,georgetakei,1268225404915064832,False,https://t.co/NRklxQwuDh,en,June
Oh puhh-leeeze.🙄,40,2020-06-03 16:15:10,Buffer,1569,195,georgetakei,1268214654335168514,False,https://t.co/WOb7CtzG05,en,June
"During internment, things seemed hopeless. We had to find a way back to joy. Our experience carries valuable lessons today. 

I hope you'll take an evening between now and June 8th to watch our story in @allegiancebway, available now on @BwayOnDemand here:",304,2020-06-03 15:50:10,Twitter Web App,710,161,georgetakei,1268208362593886213,False,https://t.co/yyLJJ0tiFb,en,June
Truly shameful displays of cowardice.,61,2020-06-03 14:57:27,Buffer,1157,311,georgetakei,1268195097558093824,False,https://t.co/47IRM9wi1p,en,June
Facebook dinged us for posting a meme about ducks that it said wasn't true.,99,2020-06-03 13:16:32,Twitter for iPhone,1390,267,georgetakei,1268169697612177408,False,https://t.co/i3wejVy5Xh,en,June
"So, is Steve King going on Dancing With The Stars or Fox News?",62,2020-06-03 13:14:02,Twitter for iPhone,11170,1221,georgetakei,1268169072044318723,False,,en,June
Overheard: Q: Why did the chicken cross the road? A: For a photo opp at the church!,83,2020-06-03 03:27:42,Twitter for iPhone,30537,6177,georgetakei,1268021514550546432,False,,en,June
"It's easy to forget there's still a presidential primary going on, with several states voting today. One more step toward defeating Donald in November.",175,2020-06-03 00:00:42,Twitter Media Studio,851,216,georgetakei,1267969422066581504,False,https://t.co/5PmMj9n2nl,en,June
Well well well...,41,2020-06-02 23:42:52,Buffer,5310,1472,georgetakei,1267964933955821574,False,https://t.co/FRoGPR3Nba,en,June
"How have you been observing #BlackOutTuesday today, friends? Resources to help move us toward a more racially just and equitable nation can be found here:  Leave yours in the comments.",231,2020-06-02 23:16:01,Twitter Media Studio,425,118,georgetakei,1267958175828971520,False,https://t.co/OwLzCtlR4Q,en,June
"Thank you, Governor. We need more of this.",66,2020-06-02 22:39:24,Buffer,1079,209,georgetakei,1267948961391947776,False,https://t.co/XNHf4MPtq8,en,June
"In fairness, Trump held that Bible awkwardly because it was beginning to burn his hand.",87,2020-06-02 21:51:52,Twitter Web App,33858,4647,georgetakei,1267936998834212865,False,,en,June
"Next time, let's make sure medical workers have PPE whenever cops all get military grade armor and shields.",107,2020-06-02 21:31:17,Twitter Web App,4393,779,georgetakei,1267931818436812807,False,,en,June
Now do Native Americans.,48,2020-06-02 21:17:54,Twitter for iPhone,3631,431,georgetakei,1267928450586882048,False,https://t.co/dzoTTn2HDp,en,June
"POSSE COMITATUS! 

(If you're saying, ""George you've lost me,"" just Google it.)",79,2020-06-02 21:16:16,Twitter for iPhone,767,132,georgetakei,1267928039742201863,False,,en,June
Does Putin have something on Zuckerberg? He's gone all Lindsay Graham lately.,77,2020-06-02 20:42:51,Twitter for iPhone,8574,1309,georgetakei,1267919629009256449,False,,en,June
Powerful.,33,2020-06-02 20:12:51,Buffer,605,116,georgetakei,1267912080084152322,False,https://t.co/vnzO6I2mxD,en,June
Overheard: Republicans are so quiet right now that you can hear a poll drop.,76,2020-06-02 19:50:46,Twitter for iPhone,39022,5996,georgetakei,1267906521834405888,False,,en,June
,23,2020-06-02 19:18:47,Twitter for iPhone,1510,229,georgetakei,1267898473761976320,False,https://t.co/czWLR2ceC2,en,June
Warning: Difficult but important to watch.,66,2020-06-02 19:07:32,Twitter for iPhone,10979,6428,georgetakei,1267895644724830209,False,https://t.co/lVuf4FzQ6Y,en,June
"Nope, Senator. Just nope.",49,2020-06-02 18:59:26,Buffer,747,116,georgetakei,1267893605580111872,False,https://t.co/4Bh65jRA4v,en,June
Hahaha there's nothing in Trump's heart hahaha,70,2020-06-02 18:49:34,Twitter for iPhone,1673,241,georgetakei,1267891121570615296,False,https://t.co/zqa5lCa7Ld,en,June
welp.,29,2020-06-02 18:34:51,Twitter for iPhone,16357,2978,georgetakei,1267887416783900674,False,https://t.co/dwZgidSOpd,en,June
"A lot of folks in the majority spend energy and take up space explaining their feelings on the protests, looting, and racism. While understandable and even cathartic for them, it's also unhelpful. It shifts attention away from what's important. Hint: It's not about your feelings.",280,2020-06-02 17:38:20,Twitter for iPhone,1432,273,georgetakei,1267873195933261834,False,,en,June
"For Donald, the Bible has always been merely a prop to exploit for political advantage.",111,2020-06-02 17:00:05,Twitter Media Studio,2404,723,georgetakei,1267863570894729218,False,https://t.co/IC01wAi42t,en,June
"Well said, sir. 👏",40,2020-06-02 16:35:56,Buffer,1005,192,georgetakei,1267857494279368704,False,https://t.co/JffiTi5s6h,en,June
Incredibly disturbing.,46,2020-06-02 16:22:43,Buffer,1437,470,georgetakei,1267854165537161217,False,https://t.co/ZezrMsPHai,en,June
This was unconscionable.,48,2020-06-02 14:33:57,Buffer,1433,278,georgetakei,1267826793299369988,False,https://t.co/AddADOyLDc,en,June
"Hillary wouldn't have let 105,000 Americans die from a plague or gassed her own citizens to show she was tough. Journalists who breathlessly covered her on emails and Benghazi, I hope you find some time to reflect on what you helped create.",240,2020-06-02 12:17:52,Twitter for iPhone,24280,5085,georgetakei,1267792547570692097,False,,en,June
"I want to go to that church and hold up the Constitition. You know, the other thing that there's no way Trump has ever read.",124,2020-06-02 11:59:05,Twitter for iPhone,13962,1937,georgetakei,1267787822028775424,False,,en,June
Thank you @TrevorNoah for being a voice of reason and humor in this very dark time. #TheDailyShow,121,2020-06-02 02:06:00,Twitter Media Studio,1547,228,georgetakei,1267638564499730433,False,https://t.co/8ZZN6q1bC0,en,June
"Trump leaves Covid-19 up to the states and washes his hands of any responsibility or federal plan, but he threatens to deploy federal troops to quell protests when the states are saying, ""No, we got this.""",205,2020-06-02 01:57:35,Twitter for iPhone,4136,1011,georgetakei,1267636448070598657,False,,en,June
Impeach him again.,18,2020-06-02 01:25:26,Twitter for iPhone,16792,2630,georgetakei,1267628358273302528,False,,en,June
"Trump is holding a knee on the neck of American Democracy, and the GOP is the three cops just watching it happen while protecting him.",134,2020-06-02 01:13:18,Twitter for iPhone,158287,40898,georgetakei,1267625302320197635,False,,en,June
"Fascinating and very, very relevant given Trump's possible invocation of it...",102,2020-06-02 01:03:06,Twitter for iPhone,386,125,georgetakei,1267622738681790464,False,https://t.co/ONtD2Q9w5r,en,June
I wish I could fly to DC and protest. Trump is a monster.,57,2020-06-02 00:57:06,Twitter for iPhone,4257,377,georgetakei,1267621228220747783,False,,en,June
Let us be very clear here. We are entering a dangerous period of the Trump presidency because he has just said he would deploy the U.S. military against its own people. And he showed today we would absolutely give the order to fire.,232,2020-06-02 00:50:38,Twitter for iPhone,5710,1472,georgetakei,1267619599476043776,False,,en,June
"I think Trump just stepped in it bad. If he thinks this is going to scare people away, he doesn't understand how protests work. He just invited the people to test his weakness.",176,2020-06-02 00:16:42,Twitter for iPhone,8424,1385,georgetakei,1267611058543513604,False,,en,June
"Trump: The protests are growing, Vlad!

Putin: Where are you now, Donnie?

Trump: Hiding! In the bunker!

Putin: In Russia we dominate opponents. You should try, is good.

Trump: But the protestors! 

Putin: Tear gas them.

Trump: Will that work?

Putin: Hmm. Hold up Bible after.",280,2020-06-02 00:12:25,Twitter for iPhone,3755,975,georgetakei,1267609984038289414,False,,en,June
"Yeah, that's not a thing.",49,2020-06-02 00:03:36,Buffer,667,167,georgetakei,1267607765226119168,False,https://t.co/3KHkAosNJY,en,June
Absolutely disgusting.,46,2020-06-01 22:50:55,Buffer,1147,266,georgetakei,1267589470322376704,False,https://t.co/C1lEtCMns3,en,June
Love them. 💕 Just what we need right now. Brava!,72,2020-06-01 22:18:33,Twitter Media Studio,668,113,georgetakei,1267581325080506374,False,https://t.co/ZnEdwnb3tU,en,June
@davidhogg111 Reported.,23,2020-06-01 21:18:51,Twitter for iPhone,273,18,georgetakei,1267566301083578369,False,,en,June
"Donald used to simply inspire mockery around the world. Now, no doubt, world leaders cry for our nation.",128,2020-06-01 20:55:54,Twitter Media Studio,1924,512,georgetakei,1267560525317144577,False,https://t.co/sqTIk1rbDY,en,June
"Welcome to the resistance, Ann.😳",56,2020-06-01 20:08:52,Buffer,908,127,georgetakei,1267548689041670146,False,https://t.co/sqpviuZvKV,en,June
"Preach, Gaga.",37,2020-06-01 19:20:46,Buffer,1396,237,georgetakei,1267536586868174850,False,https://t.co/dn5CY0zL6h,en,June
"There's a path to change, and it runs through Texas. #TurnTexasBlue Please read these important words from @cliftonwalker",146,2020-06-01 19:12:53,Twitter for iPhone,476,123,georgetakei,1267534600219262978,False,https://t.co/aMLbJVf22V,en,June
"So, have the president's crazy claims been debunkered?

Sorry, I had to say it.",79,2020-06-01 18:42:23,Twitter for iPhone,3055,266,georgetakei,1267526925045596163,False,,en,June
"I'm disappointed that people still don't get why this is stupid, but not a bit surprised that 60K people spelled it wrong. (In fairness, many are probably Russian.)",188,2020-06-01 18:29:37,Twitter for iPhone,1889,220,georgetakei,1267523714293411842,False,https://t.co/ARxip7Pc6D,en,June
"""You governors have to dominate the protestors!"" said the guy who hid in a bunker like a wuss.",94,2020-06-01 18:07:12,Twitter for iPhone,10079,1586,georgetakei,1267518071280893952,False,,en,June
We enter #Pride month at a sad and somber moment in our nation. I hope this can provide some light amidst the darkness.,143,2020-06-01 17:54:01,Twitter Media Studio,991,209,georgetakei,1267514755838853120,False,https://t.co/Bd6cWOB07E,en,June
STAR TREK!,34,2020-06-01 16:43:25,Twitter for iPhone,30723,2922,georgetakei,1267496987391385600,False,https://t.co/oz3NuwgGLV,en,June
Delusion thy name is Trump.,51,2020-06-01 16:39:03,Buffer,483,82,georgetakei,1267495889121284097,False,https://t.co/NBRcuqRtnr,en,June
Overheard: The last few words of each of the diseases we face are “I can’t breathe.”,84,2020-06-01 16:14:56,Twitter for iPhone,4768,940,georgetakei,1267489819850145793,False,,en,June
"Thank you, Mayor.",41,2020-06-01 15:15:17,Buffer,1529,327,georgetakei,1267474808582873091,False,https://t.co/S6LoWSka1H,en,June
"A word on the targeting of journalists in the protests. The erosion of our cherished press freedoms, through constant attack on the media by Trump, is directly to blame for this. His rhetoric puts our brave news reporters lives at risk. Stand up for them. We need their truth.",276,2020-06-01 13:54:39,Twitter for iPhone,5666,1405,georgetakei,1267454514283646976,False,,en,June
"Idea: The new ""super-duper"" missiles that Trump loves? Let's call them ""bunker busters.""",88,2020-06-01 13:29:25,Twitter Web App,1304,136,georgetakei,1267448166976237568,False,,en,June
"Go back to your bunker, loser.",54,2020-06-01 13:19:22,Twitter Web App,12647,1534,georgetakei,1267445638796632065,False,https://t.co/rnNQ408V22,en,June
"We have a nation torn apart by racial injustice, and riots in many cities. We have an economy teetering on the brink of collapse. And we have a raging pandemic that impacts and kills the most vulnerable among us. If ever there were a make or break election, this is it.",269,2020-06-01 13:07:44,Twitter Web App,4316,885,georgetakei,1267442707926077441,False,,en,June
Fun fact: Hitler tried to hide in a bunker toward the end of his rule.,70,2020-06-01 03:18:34,Twitter for iPhone,140406,24439,georgetakei,1267294441171226625,False,,en,June
"The next time a great man like Colin Kaepernick takes a knee in peaceful protest, you’d better listen. Don’t stage a walk out like Mike Pence or hound him out like the NFL. The unrest we see today is in many ways a consequence of shutting down even the most peaceful of gestures.",279,2020-06-01 03:08:59,Twitter for iPhone,47579,11571,georgetakei,1267292030595670016,False,,en,June
Tweeting isn’t leading.,23,2020-06-01 02:53:23,Twitter for iPhone,7482,998,georgetakei,1267288103951241216,False,,en,June
"Oof, Donald, that had to hurt. 😂",56,2020-06-01 02:49:00,Twitter Media Studio,1031,201,georgetakei,1267286998865317888,False,https://t.co/XsuuP9PM4K,en,June
"What do you think about this, friends? Do you drink diet soda?",86,2020-06-01 00:38:00,Twitter Media Studio,141,30,georgetakei,1267254031530913792,False,https://t.co/Cx5LDQGJ4N,en,June
Like a stopped clock...,47,2020-06-01 00:01:00,Buffer,395,74,georgetakei,1267244721308610561,False,https://t.co/IGVLaINOMv,en,June
This is not how a president acts.,57,2020-05-31 22:41:00,Buffer,804,169,georgetakei,1267224590046171143,False,https://t.co/qjD8EaIw2D,en,May
Wonderful to see progress spreading around the world. 🏳️‍🌈 Congratulations to all the happy couples!,124,2020-05-31 22:25:00,Twitter Media Studio,877,96,georgetakei,1267220560876113923,False,https://t.co/JdEtkTPoTT,en,May
I am an anti-fascist. Pass it along.,36,2020-05-31 21:54:01,Twitter for iPhone,64391,14490,georgetakei,1267212766861033472,False,,en,May
"Millions of cicadas are emerging this summer after exactly 17 years. You might even say, they’re in their prime.",112,2020-05-31 21:38:26,Twitter for iPhone,1314,92,georgetakei,1267208841894256646,False,,en,May
"A United States Senator, ladies and gentlemen.🙄",71,2020-05-31 21:19:01,Buffer,1205,328,georgetakei,1267203957992181760,False,https://t.co/73xRqhbtf6,en,May
Unhinged and unfit.,43,2020-05-31 20:09:01,Buffer,993,209,georgetakei,1267186339184816128,False,https://t.co/Oaz0ZKzEf3,en,May
"What is your favorite movie biopic performance, friends?",80,2020-05-31 20:04:00,Twitter Media Studio,225,44,georgetakei,1267185077508870145,False,https://t.co/d2WVokLpLq,en,May
"More of this, please.",45,2020-05-31 18:19:01,Buffer,599,124,georgetakei,1267158656933662723,False,https://t.co/vMGyxGbkIu,en,May
"Hmm, Donald really doesn't want the rest of us to vote by mail, does he? What do you think he's so afraid of? 🤔",135,2020-05-31 17:39:00,Twitter Media Studio,951,310,georgetakei,1267148586791260160,False,https://t.co/tTS1xbIvKu,en,May
LGBTs: You cannot remain silent today and celebrate Pride month tomorrow. Stonewall was a protest that became a riot because of persistent police brutality against our community. It is our historic legacy. We must stand today with our black brothers and sisters. #BlackLivesMatter,280,2020-05-31 17:38:05,Twitter for iPhone,8303,2553,georgetakei,1267148355387473921,False,,en,May
