Tweets,Length,Date,Source,Favourites,RTs,Username,id_str,isRT,tco,Language,Month
"Oh, sit down.",37,2020-05-18 19:40:30,Buffer,942,109,georgetakei,1262468120377266177,False,https://t.co/ZhchznTBvO,en,May
"Love her. 💕 What do you miss most about Mrs. Obama, friends?",84,2020-05-18 18:09:33,Twitter Media Studio,3808,471,georgetakei,1262445234056822785,False,https://t.co/pfhJKHINUY,en,May
@allegiancebway is coming exclusively to @BwayOnDemand on May 29! Come celebrate with me during a special virtual Red Carpet Pre-Show next Friday at 730pm EST! I'll be answering questions with @MsLeaSalonga &amp; @tellyleung from all our fans. So be sure to put your questions below!,307,2020-05-18 17:57:10,Twitter Web App,70,26,georgetakei,1262442117684658176,False,https://t.co/ZTimoAkjcL,en,May
Just awful.,35,2020-05-18 17:28:15,Buffer,354,55,georgetakei,1262434842416787456,False,https://t.co/snIQPdaKjz,en,May
What in the world were they thinking?,61,2020-05-18 16:38:50,Buffer,688,213,georgetakei,1262422405353541632,False,https://t.co/nf5aDjMkeo,en,May
Well...at least he was being honest. 😬,62,2020-05-18 15:29:03,Twitter Media Studio,1065,292,georgetakei,1262404842133348352,False,https://t.co/NP8RTy3SsC,en,May
He sure doesn't fall too far from the tree.,67,2020-05-18 15:10:10,Buffer,764,95,georgetakei,1262400091723313153,False,https://t.co/ID7w7tTkqy,en,May
We should all be able to vote by mail. What is Donald so afraid of? 🤔,93,2020-05-18 02:03:00,Twitter Media Studio,3656,902,georgetakei,1262201992446910464,False,https://t.co/l4H9wGbMlC,en,May
"Oh, that is rich, Senator.",50,2020-05-18 00:06:08,Buffer,645,169,georgetakei,1262172582733807617,False,https://t.co/6gSSBIdxpG,en,May
I sometimes don’t know these days  if something I heard was from Kanye West or Elon Musk.,89,2020-05-17 23:55:26,Twitter for iPhone,4140,331,georgetakei,1262169889210544128,False,,en,May
"Bravo, what a heartwarming gesture for the graduates!",77,2020-05-17 23:51:00,Twitter Media Studio,478,78,georgetakei,1262168773471227910,False,https://t.co/tk77nAtk5G,en,May
"Remember these horrific acts, friends?😂",63,2020-05-17 22:21:01,Buffer,663,109,georgetakei,1262146128084115457,False,https://t.co/sX1icaswT8,en,May
"Well played, sir. 👏 How would you ""break free"" right now if you could, friends?",103,2020-05-17 21:28:00,Twitter Media Studio,781,129,georgetakei,1262132786565189634,False,https://t.co/avsuxZZWai,en,May
"Oh, AOC, you've done it again.",54,2020-05-17 21:03:01,Buffer,1559,202,georgetakei,1262126499475447809,False,https://t.co/BmBCzKCln1,en,May
"When someone tells who that they’ve found a match, at long last, you don’t start with, “But what about so-and-so?” You say you’re happy for them, you wish them all the success they deserve, and you root for them.

Now: Please do the same with Biden’s VP pick.",259,2020-05-17 19:54:06,Twitter for iPhone,3721,438,georgetakei,1262109155583819776,False,,en,May
They were warned.,41,2020-05-17 19:47:00,Buffer,1061,252,georgetakei,1262107370693578752,False,https://t.co/ByoEgUmhon,en,May
"Russia just took the #2 spot on most number of confirmed Covid-19 cases. Trump isn’t worried, however, and made it clear that the U.S. will still be #1 for a long, long time.",174,2020-05-17 19:22:27,Twitter for iPhone,7572,1081,georgetakei,1262101190344613889,False,,en,May
"Are you finding video calls to be surprisingly draining, friends?",89,2020-05-17 19:06:00,Twitter Media Studio,223,43,georgetakei,1262097050965086212,False,https://t.co/Q5wKGjl1QR,en,May
"Well said, Howard.👏",43,2020-05-17 18:31:00,Buffer,2462,522,georgetakei,1262088243971063811,False,https://t.co/YyymMkoS3d,en,May
"Oh the horror! Obamagate, indeed. 😂",59,2020-05-17 17:48:00,Twitter Media Studio,1628,388,georgetakei,1262077421659893760,False,https://t.co/K7ih7rkOhd,en,May
Overheard: I see the word Obamagate and I keep thinking it’s some new kind of sushi I want to try once we reopen.,113,2020-05-17 17:16:28,Twitter for iPhone,1070,90,georgetakei,1262069486682886144,False,,en,May
"Nope, definitely not the smart one.",59,2020-05-17 17:13:01,Buffer,1208,185,georgetakei,1262068617354584066,False,https://t.co/uM4uJ8CFgH,en,May
"Donald, cute video you retweeted of you as Bill Pullman in “Independence Day.” But honestly, if the aliens invade, the last people we’d want in charge are you and Jared. You couldn’t lead us out of a paper bag.",210,2020-05-17 16:48:11,Twitter for iPhone,18573,2566,georgetakei,1262062369263570950,False,,en,May
That is how you do it.👏,47,2020-05-17 16:03:15,Buffer,580,143,georgetakei,1262051060220407809,False,https://t.co/M7Yco3CS3U,en,May
"Love her. What's your favorite @JaneFonda performance, friends?",87,2020-05-17 15:45:21,Twitter Media Studio,811,80,georgetakei,1262046556720488454,False,https://t.co/RQu4spSo1S,en,May
"If Trump owned a meat processing plant, he’d fire any inspector that blew the whistle on safety violations. And guess who would get sick after he eliminated those inspectors? The consuming public.

Come on, America. This has gone on way too long.",246,2020-05-17 14:30:04,Twitter for iPhone,12698,2723,georgetakei,1262027610827231232,False,,en,May
Why do you think Evangelicals stick with someone as morally bankrupt as Donald?,103,2020-05-17 03:59:05,Twitter Media Studio,3740,1068,georgetakei,1261868818495750146,False,https://t.co/vvclITCKYH,en,May
"Oh myyy, the resemblance is quite striking, isn't it?",77,2020-05-17 02:54:14,Twitter Media Studio,1398,222,georgetakei,1261852499729805317,False,https://t.co/QWTINbUnKU,en,May
"Dear Donald: Who knew that ObamaGate meant Obama shows you the Gate?
#commencement2020",86,2020-05-17 01:15:07,Twitter for iPhone,13398,1771,georgetakei,1261827554991910914,False,,en,May
I'm surprised she didn't call him 'Dear Leader.',72,2020-05-17 00:01:00,Buffer,1380,168,georgetakei,1261808903697960961,False,https://t.co/MXb1Syr0Nx,en,May
Who is your favorite 'Friend'?,54,2020-05-16 23:06:00,Twitter Media Studio,167,26,georgetakei,1261795061030936577,False,https://t.co/0s5CCdwgso,en,May
Where's the lie?,40,2020-05-16 22:49:00,Buffer,466,99,georgetakei,1261790784149430273,False,https://t.co/gHMURZenvq,en,May
More of this please.,44,2020-05-16 21:33:01,Buffer,240,40,georgetakei,1261771661990342657,False,https://t.co/L8ir6rhOIz,en,May
Give her some love. Let’s get McCarthy out.,67,2020-05-16 21:22:56,Twitter for iPhone,11141,3317,georgetakei,1261769125350780933,False,https://t.co/9Gj7DkJO3d,en,May
"The funny thing is, if we said TRUMPGATE there would be so many investigations, indictments, convictions, and abuses of power that we wouldn’t know which it referred to. With Obama, it’s the opposite. Nothing you can point to at all. Curious how that works.",281,2020-05-16 21:17:20,Twitter for iPhone,1496,209,georgetakei,1261767713359302659,False,https://t.co/MPvoDWgkr7,en,May
"Funnyman Fred Willard left us for the heavens today. Thank you for the laughter, Fred. We appreciate it more than ever before. Now go make the stars twinkle in delight, in only the way you know how.",198,2020-05-16 21:06:28,Twitter for iPhone,2167,135,georgetakei,1261764979914674182,False,,en,May
Stevie Wonder is truly one of the greats. What is your favorite Stevie Wonder song?,107,2020-05-16 20:57:00,Twitter Media Studio,578,64,georgetakei,1261762597176705030,False,https://t.co/61IWtxHXzh,en,May
"We can actually learn a lot from places like South Korea, Taiwan and Hong Kong—all (still) democracies that are beating the virus. Let’s stop demonizing Asians and start working together, learning lessons they learned from experience.",234,2020-05-16 20:41:05,Twitter for iPhone,3067,291,georgetakei,1261758592320966665,False,,en,May
"And all this time, it was Asian folks trying to show they cared about YOUR health by wearing those masks.",105,2020-05-16 20:38:31,Twitter for iPhone,2864,188,georgetakei,1261757947937542144,False,,en,May
Admit it. You used to roll your eyes at Asian people wearing masks in public. Not so much any more.,99,2020-05-16 20:36:48,Twitter for iPhone,11471,961,georgetakei,1261757513327927300,False,,en,May
Awful.,30,2020-05-16 20:19:01,Buffer,611,212,georgetakei,1261753037477085191,False,https://t.co/LXXJdqAEH3,en,May
"Too bad, Donnie!",40,2020-05-16 18:59:00,Buffer,455,83,georgetakei,1261732902984912898,False,https://t.co/fr3Ub344xT,en,May
"Who is your favorite TV dad, friends?",61,2020-05-16 18:45:00,Twitter Media Studio,232,37,georgetakei,1261729378276237312,False,https://t.co/s0f8rxM5kH,en,May
No. Just no.,36,2020-05-16 17:53:17,Buffer,382,45,georgetakei,1261716365695758348,False,https://t.co/raZpcbzB5I,en,May
Do better.,34,2020-05-16 16:49:40,Buffer,309,53,georgetakei,1261700355609542656,False,https://t.co/aXwalnBmyL,en,May
Now these pups are definitely my speed. 🐶 Which is your favorite dog breed?,99,2020-05-16 16:34:57,Twitter Media Studio,369,54,georgetakei,1261696652428972034,False,https://t.co/T3FnUv5PIn,en,May
"No matter your politics, in times of crisis we normally look to our president to bring us together. But we remain as divided as ever, and Trump only stokes and amplifies those divisions.

If you’re an independent or Republican who is tired of this, join us in Nov to vote him out.",280,2020-05-16 15:29:44,Twitter for iPhone,3397,653,georgetakei,1261680238662225920,False,,en,May
"The moral arc of the universe is long, but it bends toward karma.",89,2020-05-16 14:51:49,Twitter for iPhone,906,135,georgetakei,1261670696075374593,False,https://t.co/gh9lOBLsuz,en,May
"Wait, I thought I was in charge of Facebook. Dammit.",76,2020-05-16 12:17:19,Twitter for iPhone,1457,125,georgetakei,1261631815242178560,False,https://t.co/JCjP00e8PR,en,May
"Oh, how you are missed, Mr. President. What do you miss most about @BarackObama, friends?",113,2020-05-16 03:41:00,Twitter Media Studio,3244,500,georgetakei,1261501879131025415,False,https://t.co/6usfuWRcoG,en,May
"OK, friends, talk to me about Animal Crossing. Do you play?",83,2020-05-16 01:42:51,Twitter Media Studio,342,25,georgetakei,1261472145143508998,False,https://t.co/jHm2HLBo1t,en,May
"Oh sit down, Eric.",42,2020-05-16 00:47:01,Buffer,1256,170,georgetakei,1261458095345143808,False,https://t.co/uM4uJ8CFgH,en,May
"We older folks are sending a message to Mitch McConnell. I hope you help us spread this widely, so that he hears it loud and clear.",155,2020-05-16 00:29:07,Twitter for iPhone,12146,5611,georgetakei,1261453589525848064,False,https://t.co/PvviEVZtTz,en,May
"Dear anti-maskers:

A ventilator is like a big intrusive mask that you can’t ever take off, not even to complain to the manager.",128,2020-05-16 00:15:56,Twitter for iPhone,12463,2590,georgetakei,1261450271982448640,False,,en,May
"Oh, this is just so sad.😂",49,2020-05-15 23:41:00,Buffer,674,117,georgetakei,1261441483271335936,False,https://t.co/8JmVmqCuvE,en,May
"Bravo, Dads! 💕 Love to see so many out and proud gay families.",86,2020-05-15 23:32:19,Twitter Media Studio,663,91,georgetakei,1261439295564341248,False,https://t.co/3aDN4RKlXl,en,May
"Dear Donald, 

Nothing in the world—not “ObamaGate,” not China, not whatever bogeyman you name next—will distract us from the catastrophe that happened under your watch. 

We will hold you to account in November.

Sincerely,

America",233,2020-05-15 23:27:11,Twitter for iPhone,4668,883,georgetakei,1261438006558326786,False,,en,May
"“If we didn’t do any testing, we would have very few cases.”

— Donald J. Trump",79,2020-05-15 23:12:25,Twitter for iPhone,24114,4739,georgetakei,1261434287435456512,False,,en,May
Do better.,34,2020-05-15 22:26:27,Buffer,482,86,georgetakei,1261422722346676224,False,https://t.co/aXwalnjLab,en,May
"So much for that whole ""pro-life"" thing, I guess, eh?",77,2020-05-15 21:17:00,Buffer,845,233,georgetakei,1261405244883234816,False,https://t.co/GbAPXZbTTW,en,May
Who's your favorite 'Peanuts' character?,64,2020-05-15 21:06:57,Twitter Media Studio,491,97,georgetakei,1261402715067801600,False,https://t.co/pQPbl8ZRnC,en,May
"I actually think they were saying, “Truck You, Trump.”",78,2020-05-15 19:59:17,Twitter for iPhone,938,168,georgetakei,1261385686046949381,False,https://t.co/42mkjxiLpX,en,May
People are dying.,41,2020-05-15 19:58:48,Buffer,370,97,georgetakei,1261385563837329408,False,https://t.co/wNZcn2gXUn,en,May
The Death Eaters assemble at the Ministry of Magic after being summoned by you-know-who.,112,2020-05-15 19:56:29,Twitter for iPhone,2174,409,georgetakei,1261384979621314563,False,https://t.co/znUBXlDFPE,en,May
"Oh, Tomi, no.",37,2020-05-15 18:52:34,Buffer,303,36,georgetakei,1261368896659095557,False,https://t.co/raZpcbzB5I,en,May
This is making my day,45,2020-05-15 18:33:08,Twitter for iPhone,1968,313,georgetakei,1261364005882363905,False,https://t.co/fDOVih6pRE,en,May
Oh myyy!,32,2020-05-15 18:28:36,Twitter for iPhone,1579,184,georgetakei,1261362863664480256,False,https://t.co/JimmIms2rJ,en,May
"What do you think, friends? Is your favorite food on the list?",86,2020-05-15 18:24:59,Twitter Media Studio,104,31,georgetakei,1261361956231012354,False,https://t.co/gerZdVVxwy,en,May
Oh FFS.,31,2020-05-15 17:46:01,Buffer,459,93,georgetakei,1261352146009640961,False,https://t.co/thPAtxSbNI,en,May
"More of this, please.",45,2020-05-15 16:45:16,Buffer,253,50,georgetakei,1261336859747254273,False,https://t.co/L8ir6rhOIz,en,May
"Who is your favorite female superhero, friends?",71,2020-05-15 15:46:11,Twitter Media Studio,687,115,georgetakei,1261321992101343232,False,https://t.co/UMGqBXrf6P,en,May
Eww.,28,2020-05-15 15:22:11,Buffer,376,49,georgetakei,1261315949136920576,False,https://t.co/MXb1Syr0Nx,en,May
What wonderful news and what a beautiful baby. Congratulations @andersoncooper!,103,2020-05-15 03:25:00,Twitter Media Studio,1632,128,georgetakei,1261135464767070215,False,https://t.co/TAZcJ1hjhV,en,May
"Well said, Governor.",44,2020-05-15 01:51:01,Buffer,1059,160,georgetakei,1261111812189274113,False,https://t.co/d9FaRw79g0,en,May
Which celebrity or character from pop culture were you named after?,91,2020-05-15 01:10:23,Twitter Media Studio,171,20,georgetakei,1261101588472569856,False,https://t.co/T6MvvI6ljs,en,May
Deplorable is as deplorable does.,57,2020-05-15 00:46:01,Buffer,808,283,georgetakei,1261095454604959748,False,https://t.co/LXXJdqAEH3,en,May
"Oh, well if there are binders...🙄",57,2020-05-14 23:42:28,Buffer,1970,281,georgetakei,1261079462411730952,False,https://t.co/CxYJcz6ds5,en,May
"Oh, how fun. What's your favorite Fraggle Rock memory, friends?",87,2020-05-14 22:54:19,Twitter Media Studio,516,92,georgetakei,1261067345843322881,False,https://t.co/Sok5OPrxwa,en,May
"Wait, what?",35,2020-05-14 22:27:11,Buffer,374,59,georgetakei,1261060516103032834,False,https://t.co/xlGIi3bwiA,en,May
This is shocking to read. I hope NYers learn what the mayor did and is doing. Herd immunity?Really?!,124,2020-05-14 22:11:52,Twitter for iPhone,174,46,georgetakei,1261056664070995969,False,https://t.co/BkooNMdN6i,en,May
Good for him. 👏,38,2020-05-14 20:52:49,Buffer,505,107,georgetakei,1261036770906562560,False,https://t.co/Dputfhb2Bi,en,May
"Oh the horror! #Obamagate, indeed. 😂",60,2020-05-14 20:01:44,Twitter Media Studio,1687,399,georgetakei,1261023914786009088,False,https://t.co/RMi6LRnJhF,en,May
That's gotta hurt. 😂,43,2020-05-14 19:19:14,Buffer,548,98,georgetakei,1261013217201053696,False,https://t.co/fr3Ub344xT,en,May
"Sulu was the best pilot on board,
The Enterprise majestically soared.
His phaser banks aim
Brought him wide acclaim
But for God's sake, don't give him a sword.

Want to get in on the fun next time? Subscribe to my newsletter here: 

#NationalLimerickDay",276,2020-05-14 19:11:39,Twitter Web App,296,38,georgetakei,1261011308645953536,False,https://t.co/IrghojuKev,en,May
"Hi friends! Tuesday was #NationalLimerickDay and I asked my newsletter subscribers to send me their best original Sulu or #StarTrek limericks to share! 

Here is my favorite one, sent in by Patrick of Bridgeport, Connecticut:",225,2020-05-14 19:11:38,Twitter Web App,110,14,georgetakei,1261011307433734145,False,,en,May
"Mark your calendars! Limited Streaming Release of @allegiancebway begins May 29th for 10 days only, on @BwayOnDemand!",141,2020-05-14 19:11:00,Twitter for iPhone,206,36,georgetakei,1261011146649341952,False,https://t.co/kW7kgLdPn5,en,May
"They’re mad about masks. They’re mad about unmasking. They’re proud it’s not covered. They’re crying it’s a cover up. 

GOP talking points are hard to follow these days.",169,2020-05-14 18:51:56,Twitter for iPhone,3789,493,georgetakei,1261006350378770439,False,,en,May
"Wow, my followers submitted great ideas to @DotGay’s domain name giveaway! Here are just a few favorites. Keep an eye on .gay’s Early Adopters for these exciting new sites to launch and join the global .gay community!",265,2020-05-14 18:49:42,Buffer,68,9,georgetakei,1261005787389931527,False,https://t.co/RMHQVZ97i3,en,May
Perfect.,32,2020-05-14 18:45:27,Twitter for iPhone,1083,132,georgetakei,1261004717813051394,False,https://t.co/O7yUE20mEp,en,May
"What is your favorite pup themed Disney movie, friends?",79,2020-05-14 17:35:00,Twitter Media Studio,133,16,georgetakei,1260986986527145990,False,https://t.co/i8D26ymLDE,en,May
"Oh, that is rich, Senator.",50,2020-05-14 17:20:07,Buffer,495,136,georgetakei,1260983240019623939,False,https://t.co/6gSSBIdxpG,en,May
"The head start we had could have meant scaled up testing and earlier lockdowns to contain the virus before it killed 83,000 people.

The time we’ve had since could have been spent developing a robust, nationwide tracing and contact program before reopening.

Neither happened.",276,2020-05-14 16:34:24,Twitter for iPhone,1275,287,georgetakei,1260971736851533825,False,,en,May
That is how you do it. 👏,47,2020-05-14 16:02:18,Buffer,624,104,georgetakei,1260963659032989698,False,https://t.co/BmBCzKCln1,en,May
What is your favorite Steven Spielberg film?,68,2020-05-14 15:41:10,Twitter Media Studio,328,63,georgetakei,1260958341284667394,False,https://t.co/ev1c71TjnP,en,May
"Well, what do we have here?",51,2020-05-14 14:57:03,Buffer,496,89,georgetakei,1260947236613165058,False,https://t.co/gUZ6pXPrJf,en,May
"Justice Rebecca Bradley of the WI Supreme Ct compared WI’s stay-at-home order to “assembling together and placing under guard all those of Japanese ancestry in assembly centers during World War II.”

I’m in my own home watching Netflix. It’s not an internment camp. Trust me.",275,2020-05-14 14:30:44,Twitter for iPhone,19239,4826,georgetakei,1260940615363317760,False,,en,May
AHahahaha! But there’s so much at steak here... 🥩,73,2020-05-14 12:30:01,Twitter for iPhone,544,57,georgetakei,1260910236132573184,False,https://t.co/GI3JoWzqNr,en,May
"We restrict freedoms all the time in the name of public safety. You can’t drink and drive because you put others at risk. You can’t smoke in public places. Now, when the risk of contagion is so high and the consequences so deadly, you want to say screw the restrictions? Please.",278,2020-05-14 12:24:41,Twitter for iPhone,53592,13711,georgetakei,1260908892797706240,False,,en,May
"Are you finding video calls to be surprisingly draining, friends? It's because they are.",112,2020-05-14 03:39:00,Twitter Media Studio,348,75,georgetakei,1260776600032903168,False,https://t.co/2vE2MN8S1G,en,May
"What do you think, do you welcome our new robot overlords? 😳",84,2020-05-14 01:47:00,Twitter Media Studio,535,126,georgetakei,1260748413773189121,False,https://t.co/Yzsg7ALvMv,en,May
Mike Flynn is a criminal. Not a hero.,37,2020-05-14 01:38:01,Twitter for iPhone,6009,633,georgetakei,1260746154570063872,False,,en,May
"Bravo, Howard!",38,2020-05-14 01:33:00,Buffer,2795,480,georgetakei,1260744893112225792,False,https://t.co/YyymMkoS3d,en,May
Sad but oh so true.,43,2020-05-14 00:21:01,Buffer,548,126,georgetakei,1260726775224639490,False,https://t.co/gHMURZenvq,en,May
Who is your favorite 'Friend'?,54,2020-05-13 23:43:14,Twitter Media Studio,217,27,georgetakei,1260717267962208256,False,https://t.co/pZ0CR1Fcld,en,May
"Just to mess with Trump, we should have NYC name the entrance to the Holland Tunnel the ""ObamaGate.""",100,2020-05-13 23:30:50,Twitter for iPhone,8188,1031,georgetakei,1260714149547593728,False,,en,May
"My heart is heavy for Melissa Etheridge, whose son Beckett Cypher has died at the young age of 21. Nothing is harder than a parent losing their child. We are with you, Melissa.",176,2020-05-13 23:20:24,Twitter for iPhone,36378,2969,georgetakei,1260711522717884416,False,,en,May
"Well, that's horrifying.",48,2020-05-13 23:11:54,Buffer,477,174,georgetakei,1260709381378842626,False,https://t.co/OeyzFbO9Fk,en,May
An unexpected voice of reason.,54,2020-05-13 20:50:47,Buffer,696,139,georgetakei,1260673872258641926,False,https://t.co/3qicLRXnWP,en,May
What a wonderful man. A true example of the behavior we should expect from our presidents.,114,2020-05-13 20:37:36,Twitter Media Studio,5721,881,georgetakei,1260670551770705922,False,https://t.co/Af25do5xQs,en,May
"So honored to be among these LGBT luminaries for the Pride issue of @EW. I got a note from their EIC: ""We wanted the stars depicted to be seen as engaged in a great celebration, honoring their central role in Hollywood story-telling."" 

Truly, I am floored.",281,2020-05-13 19:59:23,Twitter for iPhone,783,85,georgetakei,1260660933094830080,False,https://t.co/S3NQKD6842,en,May
Oh dear.,32,2020-05-13 19:34:05,Buffer,195,41,georgetakei,1260654568683106304,False,https://t.co/87uStmwOiJ,en,May
"Sit down, Senator.",42,2020-05-13 17:46:00,Buffer,1319,183,georgetakei,1260627367308951552,False,https://t.co/9C0oMwkQBG,en,May
Happy birthday to the incomparable Stevie Wonder! What is your favorite Stevie Wonder song?,115,2020-05-13 17:29:00,Twitter Media Studio,1417,199,georgetakei,1260623088619679745,False,https://t.co/uxBnEwAzK0,en,May
"All these tough guys who are so sure they will beat the virus if they get it will be whiny little helpless punks once they're sick with it, just ask their wives and girlfriends.",177,2020-05-13 17:04:03,Twitter for iPhone,4270,464,georgetakei,1260616810908528642,False,,en,May
Why are you talking?,44,2020-05-13 16:18:43,Buffer,1857,233,georgetakei,1260605401613185025,False,https://t.co/UQQv2F7i0T,en,May
"This appeared in my feed, and I realized how much the world has changed. Sounds like Commander Data talking, no? 10 bonus points to whoever can explain the first paragraph to me in ""old person.""",218,2020-05-13 16:12:03,Twitter for iPhone,164,27,georgetakei,1260603724713639936,False,https://t.co/YCbs4kuSyF,en,May
Ever notice the same folks who want to deport undocumented workers for breaking the immigration rules are the first to defy state rules on reopening and social distancing? 🤔,173,2020-05-13 16:00:30,Twitter for iPhone,8689,1598,georgetakei,1260600818107142145,False,,en,May
"Well played, Mayor @PeteButtigieg! 🖖🏼 A man after my own heart.",87,2020-05-13 15:24:33,Twitter Media Studio,1087,120,georgetakei,1260591768824950784,False,https://t.co/R9j2hkhYoY,en,May
Safety for me but not for thee.,55,2020-05-13 14:58:34,Buffer,512,87,georgetakei,1260585233482747904,False,https://t.co/iXiz1TycY0,en,May
"What is your favorite dog breed, friends?",65,2020-05-13 03:51:52,Twitter Media Studio,754,99,georgetakei,1260417449494798337,False,https://t.co/NksyIrHLSQ,en,May
"When they first reported that Putin's official spokesman had contracted the coronavirus, the White House immediately issued a clarification that this did not mean Donald Trump.",176,2020-05-13 02:20:03,Twitter for iPhone,13617,2335,georgetakei,1260394345796186114,False,,en,May
"Magical thinking is not a cure. It's not a responsible way forward. After all, if it were possible to make something that destructive and dangerous go away forever, simply by wishing hard enough, Trump would have been wished out on his ass and into the street a long time ago.",276,2020-05-13 02:16:12,Twitter for iPhone,1782,274,georgetakei,1260393376571994112,False,,en,May
"Oof, Donald, that had to hurt. 😂",56,2020-05-13 01:57:58,Twitter Media Studio,951,243,georgetakei,1260388788628533248,False,https://t.co/0FddJGetyb,en,May
"Who is your favorite TV dad, friends?",61,2020-05-13 00:52:55,Twitter Media Studio,447,53,georgetakei,1260372418792652801,False,https://t.co/nVCWqozVF6,en,May
Donald was warned.,42,2020-05-12 23:43:32,Buffer,1814,432,georgetakei,1260354956667879426,False,https://t.co/ByoEgUmhon,en,May
"Umm, yeah, good call.",45,2020-05-12 22:24:00,Buffer,920,140,georgetakei,1260334943072407554,False,https://t.co/BBvKvA6XVH,en,May
"Oh, how beautiful. 💕 Brava, @MistyOnPointe! 👏",69,2020-05-12 22:15:07,Twitter Media Studio,397,115,georgetakei,1260332706065518594,False,https://t.co/hPedb8Vu0X,en,May
Drain the swamp.,40,2020-05-12 21:49:28,Twitter for iPhone,1695,234,georgetakei,1260326252197687298,False,https://t.co/eqfRCGbRxS,en,May
"I can just imagine how the GOP faithful would have reacted had it been President Obama in office, asking states to follow the CDC guidelines on re-opening. 

We need to elevate expertise and science back to their proper place once Trump is gone. Enough already of this circus.",276,2020-05-12 21:29:36,Twitter Web App,1369,228,georgetakei,1260321251790290946,False,,en,May
"Oof, that's gonna leave a mark.🔥",56,2020-05-12 21:01:01,Buffer,1851,418,georgetakei,1260314058378612738,False,https://t.co/8NMYKIRNSf,en,May
Metaphor alert.,39,2020-05-12 20:03:30,Buffer,1035,168,georgetakei,1260299583739105282,False,https://t.co/GpKchKE1J4,en,May
"Trump's lawyer's tweet in 2016, with a big dose of irony.",81,2020-05-12 19:10:41,Twitter for iPhone,3271,760,georgetakei,1260286291398332416,False,https://t.co/JUXPIJZc2J,en,May
"Corruption, right out in the open.",58,2020-05-12 19:00:47,Buffer,769,197,georgetakei,1260283801214898181,False,https://t.co/ro4KFiaZsq,en,May
