Tweets,Length,Date,Source,Favourites,RTs,Username,id_str,isRT,tco,Language,Month
"If Trump is the most informed person on planet, then I must be the straightest. 

See? Just saying it doesn’t make it so.",145,2020-06-30 21:18:42,Twitter for iPhone,5158,639,georgetakei,1278075511437234176,False,https://t.co/hxIReknMfk,en,June
What in the world is he even talking about?,67,2020-06-30 20:47:32,Twitter Media Studio,712,154,georgetakei,1278067670785708033,False,https://t.co/Q5UfApaDqp,en,June
Good.,29,2020-06-30 20:22:51,Buffer,1279,154,georgetakei,1278061460128772096,False,https://t.co/HuBHZvdCo4,en,June
What does that even mean? 😂,51,2020-06-30 19:24:17,Buffer,474,77,georgetakei,1278046721294163968,False,https://t.co/SFsfV703FC,en,June
"Carl Reiner was an incredible talent and activist who will be sorely missed. I was honored to appear in this vote by mail PSA with him last month, which I know he would want us all to share in his memory. Sending my love out to his family. 💕",265,2020-06-30 18:58:18,Twitter Media Studio,3991,946,georgetakei,1278040182353211392,False,https://t.co/gUv049rnQo,en,June
"Special thanks to @Angiest_of_all for making and delivering to me the Trek mask. Oh myyy, it's the talk of the Alpha Quadrant.",126,2020-06-30 18:26:55,Twitter Web App,2487,131,georgetakei,1278032282268372997,False,,en,June
Live long and wear a damn mask.,55,2020-06-30 18:14:23,Twitter for iPhone,76396,9814,georgetakei,1278029126759116801,False,https://t.co/zLfjPTeDsu,en,June
"This is a lie. Nationally, positive test rates are up from 4.5% to 6.9% over the past two weeks. They rose in 27 states over the same period. Stop lying to the American people.",200,2020-06-30 18:08:43,Twitter for iPhone,1863,514,georgetakei,1278027702881210374,False,https://t.co/GSB019dLbY,en,June
Why do you think Evangelicals stick with someone as morally bankrupt as Donald? Bravo @ProjectLincoln!,126,2020-06-30 18:08:30,Twitter Media Studio,1194,324,georgetakei,1278027646388121609,False,https://t.co/NNv4UcX6CX,en,June
Well played.👏,37,2020-06-30 17:59:11,Buffer,547,70,georgetakei,1278025304238370816,False,https://t.co/Fq75P4uXlg,en,June
"Uh-oh, Kellyanne, looks like you're outnumbered.😂",73,2020-06-30 16:21:32,Buffer,2816,448,georgetakei,1278000727848366080,False,https://t.co/EnnvcCwvv0,en,June
"The next First Lady of the United States, ladies and gentlemen.",87,2020-06-30 15:14:00,Twitter Media Studio,1994,410,georgetakei,1277983732494819328,False,https://t.co/s4BUZevcQA,en,June
"Thanks for the near century of your life and gifts, Carl Reiner. Your heart, your humor, your spirit will live on in all of us. The stars are twinkling just a bit more merrily today with you there to entertain the heavens.",222,2020-06-30 14:59:12,Twitter for iPhone,5780,446,georgetakei,1277980007545987073,False,,en,June
"You clearly have time to think about criminality. So what do you plan to do about Putin, who paid bounties on the lives of slain American soldiers? Go ahead, I'll wait.",192,2020-06-30 14:20:12,Twitter Web App,2200,439,georgetakei,1277970193583534086,False,https://t.co/3O8Sx75EPc,en,June
Completely unhinged.,44,2020-06-30 14:08:47,Buffer,630,112,georgetakei,1277967320615227393,False,https://t.co/4LfPCUxQsz,en,June
"Seatbelts work, but that doesn’t mean you should drive 100 mph through a school zone. We can be smart and take additional precautions. Ms. Lahren is still working on the smart part it seems.",214,2020-06-30 13:45:44,Twitter for iPhone,5057,766,georgetakei,1277961518592606209,False,https://t.co/OQzEoj8TB4,en,June
"An idea whose time has come, indeed.",60,2020-06-30 03:37:00,Twitter Media Studio,286,70,georgetakei,1277808326537957377,False,https://t.co/vMxJTxgXy9,en,June
"Amazingly, Covid-19 has the impressive ability to turn states where it is out of control from red to blue. Watch it happen in FL, TX, and AZ this fall.",151,2020-06-30 02:36:52,Twitter for iPhone,6204,637,georgetakei,1277793196395937797,False,,en,June
"No one wants their music associated with you, Donald.",77,2020-06-30 01:36:00,Twitter Media Studio,1965,450,georgetakei,1277777875786235904,False,https://t.co/zlKkprZ2ip,en,June
Oh puh-leeeze.,38,2020-06-30 01:17:26,Buffer,901,117,georgetakei,1277773202975002625,False,https://t.co/breSk3X4Ab,en,June
Fact—you self-own with these old tweets on a regular basis. Sad!,88,2020-06-30 00:32:14,Twitter for iPhone,3485,591,georgetakei,1277761828018425856,False,https://t.co/eO96kuWUZQ,en,June
For a second I thought Carol Baskin had re-emerged with yet another husband.,100,2020-06-30 00:26:50,Twitter for iPhone,6277,667,georgetakei,1277760469974073348,False,https://t.co/2CvwViHA6O,en,June
This sadly doesn't come as a surprise.,62,2020-06-30 00:04:00,Buffer,688,184,georgetakei,1277754726151524352,False,https://t.co/3vVFbfZ6Xk,en,June
"Oh myyy, this is quite captivating and calming, isn't it? What do you think of #ASMR?",109,2020-06-29 23:25:07,Twitter Media Studio,496,86,georgetakei,1277744941226242054,False,https://t.co/WMzkMHAMsg,en,June
"Dream on, Donnie. Dream on.",51,2020-06-29 22:59:56,Buffer,405,59,georgetakei,1277738600914878468,False,https://t.co/N8m9qda2B8,en,June
"What would make you bring that up, Donald?",66,2020-06-29 21:42:19,Buffer,617,139,georgetakei,1277719070041935872,False,https://t.co/al28DygXej,en,June
What is your favorite cheese?,53,2020-06-29 21:38:51,Twitter Media Studio,451,71,georgetakei,1277718198197129216,False,https://t.co/zsDLuzhiya,en,June
Oh dear.😂,33,2020-06-29 20:32:17,Buffer,1360,180,georgetakei,1277701442237878272,False,https://t.co/RVIy9LX7iw,en,June
"Trump’s Press Secretary just said America has a few “embers” left with Covid-19. Those “embers” are actually raging fires. 

The thing about a pandemic is, you can’t spin it away.",203,2020-06-29 20:12:04,Twitter for iPhone,1306,418,georgetakei,1277696354672926720,False,https://t.co/mMWterHc9V,en,June
This looks like Trump’s America to me. Two rich lawyers illegally threatening BLM protestors? It checks out.,132,2020-06-29 19:33:43,Twitter for iPhone,12334,2270,georgetakei,1277686704619601923,False,https://t.co/n6H4cXBcP9,en,June
This gives me hope for our future. 😂,60,2020-06-29 19:06:16,Buffer,1816,293,georgetakei,1277679798626783241,False,https://t.co/WV97UX9sYh,en,June
Yup.,28,2020-06-29 18:45:28,Twitter Web App,1458,86,georgetakei,1277674561669156864,False,https://t.co/J56Ox9bCP4,en,June
"Kayleigh McEnany says Trump does not have a message for Moscow, after reports came out that Russia paid out bounties on slain U.S. soldiers. When asked why not, she said that Trump had not yet been briefed. 

Trump was GOLFING this weekend. He had time to be BRIEFED. Disgusting.",279,2020-06-29 18:43:32,Twitter Web App,9714,2529,georgetakei,1277674078174937088,False,,en,June
"Paul McCartney is such a treasure. What is your favorite song or album of his, friends?",111,2020-06-29 18:34:41,Twitter Media Studio,440,44,georgetakei,1277671848751386626,False,https://t.co/xmPOucVwYe,en,June
Incredibly powerful.,44,2020-06-29 17:29:49,Buffer,3557,673,georgetakei,1277655524499247104,False,https://t.co/NK1EMBHTOB,en,June
She did the right thing here.,53,2020-06-29 15:51:15,Buffer,436,61,georgetakei,1277630720446533638,False,https://t.co/xjjT8paL5P,en,June
Who wants to tell her? 😬,48,2020-06-29 15:39:25,Twitter Media Studio,2168,334,georgetakei,1277627742234857474,False,https://t.co/VNkRwG12f3,en,June
"Oh, ya think?",37,2020-06-29 14:06:15,Buffer,812,106,georgetakei,1277604294360018944,False,https://t.co/IqfzIJgpUN,en,June
Hahahaha!,33,2020-06-29 13:56:49,Twitter for iPhone,540,93,georgetakei,1277601920752988160,False,https://t.co/6Ph66I7Kkl,en,June
"@realDonaldTrump Fun fact: John Wayne was a white supremacist, like you. He said in a Playboy interview in 1971, ""I believe in white supremacy until the blacks are educated to the point of responsibility."" Are you going to take this down like you did your ""White Power"" video? I doubt it.",288,2020-06-29 13:00:00,Twitter Web App,3115,347,georgetakei,1277587623276687361,False,,en,June
"Fun fact: John Wayne was a white supremacist, like you. He said in a Playboy interview in 1971, ""I believe in white supremacy until the blacks are educated to the point of responsibility."" Are you going to take this down like you did your ""White Power"" video? I doubt it.",295,2020-06-29 12:57:10,Twitter Web App,3712,813,georgetakei,1277586909947199488,False,https://t.co/Ig3hiEYKPn,en,June
"Who is your favorite Jim Henson muppet creation, friends?",81,2020-06-29 03:58:00,Twitter Media Studio,804,112,georgetakei,1277451223315050498,False,https://t.co/VgezZLSIQu,en,June
Stevie Wonder is truly one of the greats. What is your favorite Stevie Wonder song?,107,2020-06-29 02:08:46,Twitter Media Studio,775,92,georgetakei,1277423736132702208,False,https://t.co/828R61Lp1k,en,June
Mike Pence claims he won’t say “Black Lives Matter” because of the politics behind it. But there’s a simpler explanation. He won’t say “Black Lives Matter” because he simply doesn’t think they do.,196,2020-06-29 00:10:56,Twitter for iPhone,16747,3000,georgetakei,1277394080679505920,False,,en,June
"As of now, 1 out of every 1,000 Americans has been hospitalized due to Covid-19. Think about that.",98,2020-06-29 00:08:20,Twitter for iPhone,15046,4513,georgetakei,1277393427697721347,False,,en,June
Each one more iconic than the last. 🙌 Thank you @sarahcpr for the laughs in this dark time.,115,2020-06-28 23:54:00,Twitter Media Studio,1703,345,georgetakei,1277389818876628993,False,https://t.co/7qsNR5yKvB,en,June
"Overheard: 

Mask: not what your country can do for you. 
Mask: what you can do for your country.",97,2020-06-28 23:21:23,Twitter Web App,4288,891,georgetakei,1277381613014396928,False,,en,June
"The fragility of folks who won’t wear a mask is truly breathtaking. I lived for four years inside two internment camps, and I heard less bitching and whining there than I do today.",180,2020-06-28 23:00:23,Twitter for iPhone,218686,45206,georgetakei,1277376328413655040,False,,en,June
"Your Republican Party, ladies and gentlemen.",68,2020-06-28 22:31:01,Buffer,888,249,georgetakei,1277368936468799488,False,https://t.co/VO1llFiGGH,en,June
Anyone have fifth state of matter on your 2020 bingo card? 😳,84,2020-06-28 21:46:00,Twitter Media Studio,550,128,georgetakei,1277357606747738112,False,https://t.co/65Q7u5IEX4,en,June
"Since we lead the world in cases and deaths, let’s just give him the credit he deserves and call it #TrumpVirus.",112,2020-06-28 21:27:13,Twitter for iPhone,15779,3544,georgetakei,1277352880786325505,False,,en,June
Oh dear.😂,33,2020-06-28 21:17:01,Buffer,563,138,georgetakei,1277350311905165312,False,https://t.co/LkpmFw0SMq,en,June
He said what now?,41,2020-06-28 20:06:01,Buffer,508,77,georgetakei,1277332445029896194,False,https://t.co/Rinnkw6cX0,en,June
Donald definitely does not want you to retweet this video and remind people just how weak his margin of victory in 2016 really was.,155,2020-06-28 19:33:00,Twitter Media Studio,2495,1600,georgetakei,1277324136117919745,False,https://t.co/qkUX4rsrvx,en,June
"I mean, where do you even begin?",56,2020-06-28 18:55:00,Buffer,1315,245,georgetakei,1277314574853816322,False,https://t.co/ZBhv9OsbhM,en,June
"Brava, ladies!👏",39,2020-06-28 17:41:01,Buffer,2613,481,georgetakei,1277295956724236288,False,https://t.co/zRGYVUwoni,en,June
"One of my favorite videos from last year's #Pride. 💕 It remains a truly powerful and moving gesture. Bravo, sir. 👏",138,2020-06-28 17:22:00,Twitter Media Studio,2857,692,georgetakei,1277291168846409729,False,https://t.co/XG9SygCpW7,en,June
Now that is how you do it.,50,2020-06-28 16:31:00,Buffer,315,77,georgetakei,1277278335987527680,False,https://t.co/bzNWovgMUk,en,June
"Happy #Pride! What are your socially-distant Pride plans, friends? 🏳️‍🌈‍ Text me and let me know: (310) 299-9390",112,2020-06-28 16:13:00,Buffer,593,59,georgetakei,1277273806856507392,False,,en,June
The president is trying to pretend he wasn’t briefed on this. It led to actual casualties. It was treasonous to allow it and then INVITE PUTIN to the U.S. and INTO THE G8. Blood on his hands.,215,2020-06-28 15:48:00,Twitter for iPhone,1660,487,georgetakei,1277267512149884928,False,https://t.co/GB7sPovxy7,en,June
Yaasss.,31,2020-06-28 15:25:34,Buffer,927,204,georgetakei,1277261866675449858,False,https://t.co/uHucFKz86s,en,June
"Oh, how heartwarming. 💕 Another step forward for LGBTQ representation. #Pride",101,2020-06-28 15:11:00,Twitter Media Studio,627,115,georgetakei,1277258201646239744,False,https://t.co/NS9VGw1xhP,en,June
,23,2020-06-28 15:03:41,Twitter for iPhone,5979,1562,georgetakei,1277256359633977344,False,https://t.co/8sRWpXmJUk,en,June
"We hit a record high number of daily new Covid-19 cases, the Russians have taken out bounties on American soldiers with zero response from us, and the president went golfing today with Lady G.",192,2020-06-28 14:54:55,Twitter for iPhone,17258,4869,georgetakei,1277254156550574080,False,,en,June
"Pro-tip: When you see  a bunch of Asians doing something, like wearing masks in public spaces or on their phones grabbing up dozens of seats at Trump rallies, don't assume they're weird or anti-social. They know what's what.",224,2020-06-28 13:02:17,Twitter Web App,1563,99,georgetakei,1277225808889892865,False,,en,June
It's been days since the story broke about Russia paying bounties for the murder of U.S. troops. Trump claims he was never briefed. But where is his statement of condemnation now?! Why isn't he calling for sanctions and action? Treasonous.,239,2020-06-28 12:54:56,Twitter Web App,6884,1531,georgetakei,1277223960766304259,False,,en,June
"Folks seem upset that some are calling for John Wayne Airport to be renamed. Fun fact: John Wayne was a white supremacist:

""I believe in white supremacy until the blacks are educated to the point of responsibility."" (Playboy magazine interview, 1971.)

The more you know...",274,2020-06-28 12:51:58,Twitter Web App,5588,1324,georgetakei,1277223211877490689,False,,en,June
"I know, just stop checking for illegal immigrants! The numbers only go up because we check for them, right?",131,2020-06-28 12:27:05,Twitter Web App,2888,421,georgetakei,1277216949957771265,False,https://t.co/PkiHxz4ALT,en,June
"Look. Either Trump was briefed by top intelligence about the Russians paying bounties to kill American troops and invited Putin to join the G8 despite it (likely), or top intelligence didn't trust him enough to provide this vital intelligence. Either way it's damning. He must go.",280,2020-06-28 12:26:02,Twitter Web App,5607,1054,georgetakei,1277216687591473155,False,,en,June
"The president is retweeting videos of his supporters yellowing ""White Power."" If you don't see the problem with this, then you're part of that problem.",175,2020-06-28 12:21:05,Twitter Web App,8410,2114,georgetakei,1277215440012443648,False,https://t.co/IWWeNl2AUT,en,June
"What's your favorite movie of all time, friends?",72,2020-06-28 03:59:00,Twitter Media Studio,506,77,georgetakei,1277089087220928512,False,https://t.co/E31W7l3hUU,en,June
"What a lovely gesture of #LGBTQ solidarity for #pride. What do you think, friends? #onerainbow",118,2020-06-28 02:17:00,Twitter Media Studio,1125,178,georgetakei,1277063418122432513,False,https://t.co/CPQEzB2is2,en,June
"We’re calling them maskholes, in case you missed the memo.",58,2020-06-28 01:25:24,Twitter for iPhone,7906,1075,georgetakei,1277050433882796033,False,,en,June
I broke that Asian bad driver stereotype by being the best helmsman in the galaxy...,108,2020-06-28 00:40:17,Twitter for iPhone,49958,4626,georgetakei,1277039078660243461,False,https://t.co/jEeC6ae82O,en,June
"Don't worry, Donald, we can wait for President @JoeBiden to do the honors. 💅🏼",101,2020-06-28 00:05:00,Twitter Media Studio,1631,327,georgetakei,1277030199507292160,False,https://t.co/5CqPVco4RL,en,June
"Projecting much, Donald?",48,2020-06-27 23:41:01,Buffer,1191,224,georgetakei,1277024163476246528,False,https://t.co/NRd7V5zxFD,en,June
They see the writing on the wall.,57,2020-06-27 22:21:01,Buffer,433,62,georgetakei,1277004031081222144,False,https://t.co/t6qpgHp9Wd,en,June
What is your favorite film from the legendary Meryl Streep?,83,2020-06-27 21:56:00,Twitter Media Studio,429,51,georgetakei,1276997735409909760,False,https://t.co/gKVGZv8Poj,en,June
The crazies are unmasked.,49,2020-06-27 21:05:23,Twitter for iPhone,5761,739,georgetakei,1276984999904980995,False,https://t.co/w9Ow7GyWP1,en,June
"Wrong again, Kellyanne.",47,2020-06-27 21:02:01,Buffer,952,167,georgetakei,1276984150617214981,False,https://t.co/v7HZxk8oIf,en,June
"What's your favorite #ObamaBiden moment, friends?",73,2020-06-27 19:39:00,Twitter Media Studio,859,143,georgetakei,1276963258126053376,False,https://t.co/YajJKddUEZ,en,June
He tried it.,36,2020-06-27 19:37:54,Buffer,838,119,georgetakei,1276962982183002120,False,https://t.co/TKny2NG5yf,en,June
"Reply with all the reasons you shouldn’t wear a mask out in public during a pandemic. Go on, I’ll wait.",103,2020-06-27 18:55:24,Twitter for iPhone,3350,398,georgetakei,1276952287106252801,False,,en,June
"If there were statues of Jeffrey Epstein or halls named after George Wallace, no one would say we should keep them up or keep the name. People who committed atrocities or stood for white supremacy shouldn’t ever be glorified, no matter how much time has passed.",261,2020-06-27 18:42:09,Twitter for iPhone,2717,478,georgetakei,1276948952156442626,False,,en,June
"Many are bothered because statues are coming down and names of avowed racists are being taken off public buildings. But remember: These moves are actually signs of racial reconciliation. Acknowledging the mistakes of the past, and taking action on them today, signals progress.",277,2020-06-27 18:37:24,Twitter for iPhone,2452,437,georgetakei,1276947757899661312,False,,en,June
"Apparently the heat and sunshine of the Sun Belt don’t slow the virus much, but they sure do turn a lot of people stupid.",121,2020-06-27 17:50:38,Twitter for iPhone,4804,576,georgetakei,1276935986732240896,False,,en,June
Who wants to tell her?🤦,47,2020-06-27 17:49:15,Buffer,956,121,georgetakei,1276935638701551616,False,https://t.co/beMtcEsv6t,en,June
"And that is how you troll Donald, bravo! 👏",66,2020-06-27 17:28:00,Twitter Media Studio,2033,456,georgetakei,1276930290959683585,False,https://t.co/exZiFgDRFv,en,June
"Quite rich coming from you, Donald.",59,2020-06-27 16:31:01,Buffer,340,52,georgetakei,1276915950483374083,False,https://t.co/Rinnkw6cX0,en,June
"“As we stand here today, all 50 states and territories across the country are opening up, and safely and responsibly.” — Mike Pence

Florida just recorded a record 9,585 new cases yesterday, and hospitals in the Houston area and Maricopa County, AZ are at 100% capacity.",270,2020-06-27 16:14:33,Twitter for iPhone,2319,722,georgetakei,1276911807723114496,False,,en,June
Take note.,34,2020-06-27 15:56:09,Twitter for iPhone,1686,331,georgetakei,1276907176498470913,False,https://t.co/mlkSwFneS3,en,June
Who is your favorite Disney princess?,61,2020-06-27 15:22:00,Twitter Media Studio,397,69,georgetakei,1276898581966921735,False,https://t.co/RJ7aR4ETr4,en,June
That is how you do it.👏,47,2020-06-27 15:19:47,Buffer,478,90,georgetakei,1276898023310843905,False,https://t.co/bzNWovgMUk,en,June
"Our Covid-19 curve is heading the wrong way, and our country is headed in the wrong direction. We need leadership, not abdication. Science, not conspiracies. Solutions, not excuses.",181,2020-06-27 15:18:44,Twitter for iPhone,3713,593,georgetakei,1276897760852291584,False,,en,June
"Overheard: “A recession is when your neighbor loses their job, a depression is when you lose yours, and a recovery is when Donald Trump loses his.”",147,2020-06-27 15:09:18,Twitter for iPhone,25522,4882,georgetakei,1276895388440633344,False,,en,June
"Trump knew that without a strong economy, he wouldn’t get re-elected. So he put the economy first and pressed for early reopening.

Now the pandemic is out of control and will take the economy down with it.

Trump gambled with American lives to get re-elected. We all lost.",273,2020-06-27 13:11:31,Twitter for iPhone,12091,3059,georgetakei,1276865747487264768,False,,en,June
This is a must-watch. #RacismIsAVirus,61,2020-06-27 12:45:09,Twitter Web App,2075,596,georgetakei,1276859109019697152,False,https://t.co/XIW3sBLIrx,en,June
"I would watch this play, but I feel like we are all watching it in real time. Well worth a read.",120,2020-06-27 12:43:30,Twitter Web App,651,108,georgetakei,1276858693917827076,False,https://t.co/ailiNvgUqU,en,June
"Now that @JoeBiden has clinched the Democratic nomination, who do you think he should choose as his VP?",127,2020-06-27 03:50:02,Twitter Media Studio,611,104,georgetakei,1276724444199817217,False,https://t.co/r0y5I8ZxTx,en,June
"What is your favorite dog breed, friends?",65,2020-06-27 02:25:16,Twitter Media Studio,779,106,georgetakei,1276703112892481536,False,https://t.co/PF154Dm8WI,en,June
What kind of Commander-in-Chief praises a foreign enemy leader whom he knows is paying to have American soldiers targeted and killed abroad? Trump is a traitor.,160,2020-06-27 01:39:48,Twitter for iPhone,24532,7782,georgetakei,1276691669442854912,False,,en,June
"A lot of gay guys aren’t wearing masks out in NYC. This is very bad, but maybe we can also flip this around.

Hey MAGA dudes! If you don’t wear a mask, people might think you’re gay!

I know. Brilliant, right?",209,2020-06-27 01:35:06,Twitter for iPhone,3890,431,georgetakei,1276690488599461889,False,,en,June
Overheard: Those klan folks will happily put on a hood but can’t be bothered to wear a mask?,92,2020-06-27 01:20:31,Twitter for iPhone,20994,3872,georgetakei,1276686817757212672,False,,en,June
Yaassss.,32,2020-06-27 01:02:21,Buffer,973,207,georgetakei,1276682243335958529,False,https://t.co/uHucFKz86s,en,June
"😷 

Wear it.",12,2020-06-27 00:52:49,Twitter for iPhone,2584,355,georgetakei,1276679847343984642,False,,en,June
#HannityKills,37,2020-06-27 00:14:05,Twitter for iPhone,1899,569,georgetakei,1276670098703634433,False,https://t.co/dJwXeWODmJ,en,June
"It’s actually not surprising that there are anti-maskers. I have trouble explaining anything to anti-vaxxers, and a lot of people still think PizzaGate was a real thing. So the learning curve is pretty daunting.",211,2020-06-27 00:13:15,Twitter for iPhone,5227,681,georgetakei,1276669889546256386,False,,en,June
To me the parallels are quite chilling.,63,2020-06-26 23:33:00,Buffer,926,220,georgetakei,1276659760142725120,False,https://t.co/dWI7Sw5KfO,en,June
"They're literally downplaying their own polls. 😂 Where do you think the race really is right now, friends?",130,2020-06-26 23:21:00,Twitter Media Studio,690,152,georgetakei,1276656738352033792,False,https://t.co/3T8uDwFdXo,en,June
"Nice try, Donald.",41,2020-06-26 22:46:15,Buffer,756,156,georgetakei,1276647994457235460,False,https://t.co/1l9wKX7ohl,en,June
I’m going to start calling Fox News desks “Death Panels.”,57,2020-06-26 22:38:31,Twitter for iPhone,4830,545,georgetakei,1276646046509252612,False,,en,June
DeSantis was criminally negligent. Listen to this asshat talk. He has to eat those words now.,117,2020-06-26 21:32:51,Twitter for iPhone,1404,299,georgetakei,1276629520691466243,False,https://t.co/SClY8Whn2r,en,June
"Russia is our enemy, not our friend. Trump is a traitor for keeping this quiet.",103,2020-06-26 21:29:49,Twitter for iPhone,1362,375,georgetakei,1276628758053732354,False,https://t.co/Qol7NwGEzE,en,June
"Welp. Congrats Trump. You finally got a Travel Ban, but it’s on us.",91,2020-06-26 21:27:46,Twitter for iPhone,16437,3342,georgetakei,1276628242091462657,False,https://t.co/g9Szy0yWoV,en,June
Bravo to the #StopHateForProfit campaign! More brands and corps should join this movement.,114,2020-06-26 21:07:16,Twitter Media Studio,1388,395,georgetakei,1276623083994931200,False,https://t.co/jNNLNB8gec,en,June
You really can't make this stuff up.,60,2020-06-26 20:49:17,Buffer,1808,373,georgetakei,1276618560153018369,False,https://t.co/beMtcEsv6t,en,June
"Oh, that is rich coming from you, Donald.",65,2020-06-26 19:49:32,Buffer,598,82,georgetakei,1276603522566496256,False,https://t.co/Rinnkw6cX0,en,June
"A wise decision, indeed. What do you think of this, friends?",84,2020-06-26 18:30:48,Twitter Media Studio,679,87,georgetakei,1276583709274071040,False,https://t.co/sSaCjDohfi,en,June
"Brava, ladies! 👏",40,2020-06-26 18:02:11,Buffer,1441,233,georgetakei,1276576508367249408,False,https://t.co/zRGYVUwoni,en,June
"This year, we need more than ever to support POC Trans Lives. To donate, text REBEL to 243725.",118,2020-06-26 17:49:20,Twitter Web App,414,84,georgetakei,1276573272629563394,False,https://t.co/0UAXRIUN9u,en,June
"#StonewallDay Live Stream with guests including Barack Obama, Taylor Swift, Cynthia Erivo, and yours truly starting now! Produced by @REALPRIDELIVE.  Tune in now!",186,2020-06-26 17:01:05,Twitter Web App,191,44,georgetakei,1276561131679727617,False,https://t.co/318HzKOj5G,en,June
"Wow, Taylor Swift will be joining yours truly, Barack Obama and many others in our live stream for Stonewall Day, pre-show at 12:45pm ET today. So happy to see our allies stepping up! Catch it starting on Logo’s YouTube page in 15 min!",259,2020-06-26 16:29:23,Twitter for iPhone,742,109,georgetakei,1276553151370452992,False,https://t.co/KK3l55N5AP,en,June
"Keep it classy, Kellyanne.",50,2020-06-26 16:25:03,Buffer,611,89,georgetakei,1276552064198414336,False,https://t.co/v7HZxk8oIf,en,June
We should all be able to vote by mail. What is Donald so afraid of? 🤔,93,2020-06-26 16:15:27,Twitter Media Studio,1323,365,georgetakei,1276549648010948609,False,https://t.co/b9ry4cZ17l,en,June
"Keep spinning, keep spinning.",53,2020-06-26 15:30:25,Buffer,287,46,georgetakei,1276538314389061633,False,https://t.co/3ca1s4oYGQ,en,June
