Tweets,Length,Date,Source,Favourites,RTs,Username,id_str,in_reply_to_user_id,user_id,isRT,tco,Language,Month,Quarter
".@ConvenientMD will conduct mobile testing at sites near all long-term care facilities in Hillsborough and Rockingham Counties, and will establish two clinical teams of six members each to conduct mobile testing from 7 AM to 6 PM each day. (2/2)",245,2020-04-14 18:22:38,Twitter Web App,40,4,GovChrisSununu,1250127337699622912,8.162821207672914e+17,816282120767291392,False,,en,April,Q2
"In a further effort to protect those on the front lines and those in long-term care facilities, we will be partnering with @ConvenientMD to make testing available to the 6,600 health care workers in long-term care facilities in Hillsborough and Rockingham County. (1/2)",269,2020-04-14 18:22:38,Twitter Web App,71,12,GovChrisSununu,1250127336890138627,,816282120767291392,False,,en,April,Q2
"This program will support our hardworking employees who protect our state’s most vulnerable populations in nursing facilities, long-term and residential care facilities, mental health programs, and substance use disorder settings. (3/3)",236,2020-04-14 18:19:22,Twitter Web App,46,7,GovChrisSununu,1250126516551397376,8.162821207672914e+17,816282120767291392,False,,en,April,Q2
"New Hampshire must strengthen its commitment to its workforce during the #COVID19 Emergency, and this additional stipend recognizes the crucial role workers in this sector play as we confront this pandemic. (2/3)",212,2020-04-14 18:19:22,Twitter Web App,46,7,GovChrisSununu,1250126515708268545,8.162821207672914e+17,816282120767291392,False,,en,April,Q2
"I am announcing the formation of the Long-Term Care Stabilization Program, which will provide a weekly $300 stipend to front line workers at NH Medicaid funded residential facilities and social services organizations. (1/3)",223,2020-04-14 18:19:22,Twitter Web App,224,40,GovChrisSununu,1250126514894573580,,816282120767291392,False,,en,April,Q2
Our hearts go out to the families of the four Granite Staters we lost to #COVID19 today.,88,2020-04-14 18:15:36,Twitter for iPhone,75,12,GovChrisSununu,1250125570970697730,,816282120767291392,False,,en,April,Q2
About to hold a press conference to provide an update on the state’s response to #COVID19. Watch live:,126,2020-04-14 17:56:06,Twitter for iPhone,29,10,GovChrisSununu,1250120659553914893,,816282120767291392,False,https://t.co/L6ufUx5Q4t,en,April,Q2
This is how we do it in New Hampshire.,62,2020-04-13 23:58:58,Twitter Web App,450,76,GovChrisSununu,1249849593879302148,,816282120767291392,False,https://t.co/qmeswOfbCi,en,April,Q2
"This morning I joined @JohnKingCNN on @CNN to talk about the 91,000 pound PPE delivery we secured for New Hampshire yesterday.",150,2020-04-13 16:32:03,Twitter Web App,89,19,GovChrisSununu,1249737123378483201,,816282120767291392,False,https://t.co/uoMpPe6InG,en,April,Q2
Joining @JohnKingCNN on @CNN around 11:20 AM to talk about New Hampshire's response to #COVID19.,96,2020-04-13 14:51:35,TweetDeck,50,11,GovChrisSununu,1249711837093998592,,816282120767291392,False,,en,April,Q2
"Millions of pieces of PPE arrived at @flymanchester hours ago on a @FedEx cargo plane, and are currently being inventoried by the @NHNationalGuard before being distributed to areas of critical need across NH. THANK YOU to Dean Kamen for helping facilitate this critical delivery.",303,2020-04-12 23:31:00,Twitter for iPhone,367,55,GovChrisSununu,1249480166176362497,,816282120767291392,False,https://t.co/DiNORG1ORQ,en,April,Q2
#HappyEaster!,13,2020-04-12 23:08:40,Twitter for iPhone,108,8,GovChrisSununu,1249474544273891329,,816282120767291392,False,,en,April,Q2
Joining @wolfblitzer on @CNN tonight around 6:45 PM to talk how we are combating #COVID19 in New Hampshire and today’s PPE shipment.,132,2020-04-12 21:05:37,Twitter for iPhone,60,10,GovChrisSununu,1249443580206297100,,816282120767291392,False,,en,April,Q2
All hands on deck effort.,49,2020-04-12 20:43:20,Twitter for iPhone,533,64,GovChrisSununu,1249437972929355783,,816282120767291392,False,https://t.co/tSJH2zLGJX,en,April,Q2
Our @NHNationalGuard hard at work. Supplies will be delivered across the state in the coming days. #603Pride,132,2020-04-12 20:21:39,Twitter for iPhone,199,39,GovChrisSununu,1249432513652633601,,816282120767291392,False,https://t.co/t75DldCHJJ,en,April,Q2
"✔️ 6.6 million masks 
✔️ 50,000 face shields
✔️ 24,000 Tyvek coveralls 

And this is just the beginning. 

#603Pride",140,2020-04-12 20:06:59,Twitter for iPhone,522,80,GovChrisSununu,1249428821817937920,,816282120767291392,False,https://t.co/U6J0HhEcNQ,en,April,Q2
#603Pride,33,2020-04-12 19:52:09,Twitter for iPhone,137,17,GovChrisSununu,1249425092720943104,,816282120767291392,False,https://t.co/ZoAnORcY1Y,en,April,Q2
"The @FedEx plane departed Shanghai, China, last night &amp; passed through US Customs in Anchorage, Alaska early this AM. Later today I’ll join Dean Kamen, who was instrumental in facilitating this effort, state officials, @NHNationalGuard &amp; @SenatorShaheen as we unload the plane.",309,2020-04-12 14:16:46,Twitter Web App,176,33,GovChrisSununu,1249340689118355456,8.162821207672914e+17,816282120767291392,False,https://t.co/pZ7baK5cVy,en,April,Q2
"Wheels up to MHT. One month ago New Hampshire wasn’t even in the business of PPE procurement, &amp; today we secured over 91,000 pounds  of this critical lifesaving equipment for NH. We scoured the earth and left no stone unturned. Thankful for this team effort in fighting #COVID19",306,2020-04-12 14:16:45,Twitter Web App,397,59,GovChrisSununu,1249340686152994817,,816282120767291392,False,https://t.co/bov9YXFCxE,en,April,Q2
It’s the Saturday before Easter and our incredibly dedicated @NHESWorking staff are hard at work processing unemployment claims for Granite Staters affected by #COVID19. I can’t thank the team enough for their tireless work — it means the world to so many. #603Pride,290,2020-04-11 16:56:36,Twitter for iPhone,171,19,GovChrisSununu,1249018525647282177,,816282120767291392,False,https://t.co/bTXTfBsxOU,en,April,Q2
#603Pride,33,2020-04-11 02:18:44,TweetDeck,51,2,GovChrisSununu,1248797602122006529,,816282120767291392,False,https://t.co/EZPy6rh0vv,en,April,Q2
Joining @ErinBurnett on @CNN at 10:15 PM tonight to talk New Hampshire’s response to #COVID19. Hope you can tune in.,116,2020-04-11 00:42:36,Twitter for iPhone,67,13,GovChrisSununu,1248773410471190528,,816282120767291392,False,,en,April,Q2
#603Pride,33,2020-04-10 23:50:39,Twitter for iPhone,34,5,GovChrisSununu,1248760337601626114,,816282120767291392,False,https://t.co/LR8JLAV9Bd,en,April,Q2
"Just joined @SoClean in delivering 3,500 KN95 masks to New Hampshire Hospital. Thanks to SoClean’s efforts, over 200 health care facilities across NH will be delivered a total of 175,000 masks this weekend. THANK YOU SoClean! #603Pride",259,2020-04-10 21:17:33,Twitter for iPhone,78,13,GovChrisSununu,1248721807529652224,,816282120767291392,False,https://t.co/u8EY2mOKrg,en,April,Q2
"Today, @NHSecretary and @NH_DOJ released guidance that allows all voters with #COVID19 concerns to vote absentee in the September and November elections. 

No voter should have to choose between their health and their constitutional right to vote. 

Read:",279,2020-04-10 20:59:51,Twitter for iPhone,143,39,GovChrisSununu,1248717353162027017,,816282120767291392,False,https://t.co/k9exvKzZWp,en,April,Q2
Joining @chucktodd on @MeetThePress Daily around 5:40 PM on @MSNBC to discuss the steps we’re taking in New Hampshire to respond to #COVID19.,141,2020-04-10 20:32:39,Twitter for iPhone,36,9,GovChrisSununu,1248710505813901313,,816282120767291392,False,,en,April,Q2
"This is an all-hands on deck effort. I’m up here every day with folks from public health, but there are so many other people working tirelessly behind-the-scenes. I can’t thank our team enough for all that they are doing. #603Pride (4/4)",237,2020-04-10 19:11:06,Twitter Web App,34,4,GovChrisSununu,1248689982627352577,8.162821207672914e+17,816282120767291392,False,,en,April,Q2
"I want to take a moment to thank David and his team for all of the hard work they have put in. It is not easy work, and often they come here at a moment’s notice to make sure all Granite Staters receive accurate, up-to-the-minute information. (3/4)",248,2020-04-10 19:11:05,Twitter Web App,32,3,GovChrisSununu,1248689981595496449,8.162821207672914e+17,816282120767291392,False,,en,April,Q2
"David brings with him a team of American Sign Language Interpreters - often its Jodi and Maura. They sign to David, who then interprets for the rest of you at home to ensure that those in our deaf and hard of hearing community receive the same information as everyone else. (2/4)",279,2020-04-10 19:11:05,Twitter Web App,28,0,GovChrisSununu,1248689980584669185,8.162821207672914e+17,816282120767291392,False,,en,April,Q2
"THREAD: Confronting #COVID19 is a team effort. I'd like to take a moment to thank one of our unsung heroes. David, our Certified Deaf Interpreter, has been with me at nearly every single one of our press conferences. (1/4)",222,2020-04-10 19:11:05,Twitter Web App,133,21,GovChrisSununu,1248689979355795456,,816282120767291392,False,,en,April,Q2
".@SoClean, a great NH employer, will be delivering 175,000 KN95 masks to over 200 health care facilities across the state this weekend. Later today, I'll join them to deliver 3,500 masks to New Hampshire Hospital. THANK YOU, SoClean! #603Pride",267,2020-04-10 19:07:57,Twitter Web App,40,17,GovChrisSununu,1248689190717587456,,816282120767291392,False,https://t.co/DZn03jnh35,en,April,Q2
"New Hampshire schools have borne many costs because of #COVID19, but the #CARESAct funding we've received will help to provide much-needed relief.",170,2020-04-10 19:06:58,Twitter Web App,47,14,GovChrisSununu,1248688945669562375,,816282120767291392,False,https://t.co/Pjk72lOquh,en,April,Q2
➡️$35.9 million will be directed to colleges and universities across New Hampshire. (4/4),89,2020-04-10 19:06:15,Twitter Web App,4,2,GovChrisSununu,1248688765889110018,8.162821207672914e+17,816282120767291392,False,,en,April,Q2
"➡️$37.6 million will be provided directly to K-12 schools distributed proportionally to the federal Every Child Succeeds Act title one formula, meaning higher poverty school districts will receive more money. (3/4)",214,2020-04-10 19:06:15,Twitter Web App,6,2,GovChrisSununu,1248688764857323521,8.162821207672914e+17,816282120767291392,False,,en,April,Q2
"➡️Approximately $8.9 million will be allocated to provide discretionary grants to K-12 schools, and higher education institutions significantly impacted by #COVID19, to provide educational services, childcare and early childhood education, social and emotional supports. (2/4)",276,2020-04-10 19:06:15,Twitter Web App,0,0,GovChrisSununu,1248688763783581703,8.162821207672914e+17,816282120767291392,False,,en,April,Q2
"THREAD: Through the #CARESAct Education Stabilization Fund, New Hampshire will be provided $82.4 million to help schools and higher education institutions across the state confront the challenges they're facing as a result of #COVID19. (1/4)",265,2020-04-10 19:06:14,Twitter Web App,19,8,GovChrisSununu,1248688761736704007,,816282120767291392,False,https://t.co/xpNNhOYACp,en,April,Q2
Coming up at 3 PM - watch today’s press conference LIVE,55,2020-04-10 18:33:46,Twitter VIT App for iOS,16,10,GovChrisSununu,1248680590133559297,,816282120767291392,False,,en,April,Q2
"Visited our new clinical surge flex facility at @NHTI in Concord today. We hope that these beds never have to be used, but New Hampshire stands prepared as we confront this public health crisis. This sign hanging outside could not ring more true: We are stronger than #COVID19.",301,2020-04-10 17:04:00,Twitter for iPhone,86,24,GovChrisSununu,1248657998781784065,,816282120767291392,False,https://t.co/QS6VhCGtDd,en,April,Q2
I’m holding a press conference today at 3 PM to provide an update on the state’s response to #COVID19. Watch live on-air and online at @WMUR9.,166,2020-04-10 15:59:18,Twitter for iPhone,25,18,GovChrisSununu,1248641718335025155,,816282120767291392,False,https://t.co/wson4xCBGE,en,April,Q2
"The proactive steps we have taken to fight #COVID19 are working. 

Let's keep it up.",109,2020-04-10 00:36:33,TweetDeck,72,22,GovChrisSununu,1248409498068209669,,816282120767291392,False,https://t.co/yjkH5PxSXn,en,April,Q2
"These are trying times, but the strength and power of NH communities is unrivaled. In two weeks, over 1,300 Granite Staters have stepped up to help those in need within their communities. If you're interested in connecting with a local nonprofit call @VolunteerNH at 603-271-7200.",304,2020-04-09 20:35:32,Twitter Web App,69,22,GovChrisSununu,1248348844435410960,,816282120767291392,False,https://t.co/KhBcr8EBKt,en,April,Q2
"THANK YOU to the over 1,300 Granite Staters who have volunteered with New Hampshire non-profits and charitable organizations as part of #COVID19 relief efforts. For those still interested in getting connected with a local nonprofit to volunteer, call @VolunteerNH at 603-271-7200",303,2020-04-09 19:32:59,Twitter for iPhone,19,11,GovChrisSununu,1248333103359295490,,816282120767291392,False,https://t.co/hzNtOvMAvp,en,April,Q2
"Today we're announcing the NH Nonprofit Response Fund, a joint effort between the @NHCDFA and the NH Business Finance Authority, to provide nonprofits with resources up to $100,000 for working capital, equipment purchases, and programming expenses.",248,2020-04-09 19:31:25,Twitter for iPhone,67,17,GovChrisSununu,1248332707786043393,,816282120767291392,False,,en,April,Q2
"Since calling upon Granite Staters a few weeks ago to volunteer or donate to a good cause, over $3.2 MILLION DOLLARS has been raised, with over $2.5M going directly to New Hampshire nonprofits and roughly $2.3M having been distributed for #COVID19 related grants. #603Pride",297,2020-04-09 19:26:44,Twitter for iPhone,26,8,GovChrisSununu,1248331529681604610,,816282120767291392,False,https://t.co/3QDTWn0Wcq,en,April,Q2
"In the coming days Jerry will be forming his team, and they look forward to meeting with key stakeholders and the bipartisan legislative advisory committee. (3/3)",162,2020-04-09 19:03:12,Twitter Web App,10,1,GovChrisSununu,1248325607844450304,8.162821207672914e+17,816282120767291392,False,,en,April,Q2
"Jerry has extensive experience serving NH, originally as a member of the New Hampshire Senate, where he served on the Fiscal Committee, and later, as Commissioner of the Banking Department, where he was appointed to this key post by then-Governor Maggie Hassan back in 2016. (2/3)",280,2020-04-09 19:03:11,Twitter Web App,8,1,GovChrisSununu,1248325605302702083,8.162821207672914e+17,816282120767291392,False,,en,April,Q2
I'm proud to have appointed Banking Commissioner Jerry Little to serve as Executive Director of the Governor's Office for Emergency Recovery and Relief. Jerry stands ready to hit the ground running so that we can deliver results for New Hampshire families. (1/3),286,2020-04-09 19:03:11,Twitter Web App,36,15,GovChrisSununu,1248325603901747200,,816282120767291392,False,https://t.co/Gun4mFNEbU,en,April,Q2
Holding a press conference at 3:00 PM to provide an update on New Hampshire’s response to #COVID19.,99,2020-04-09 14:27:38,Twitter for iPhone,85,18,GovChrisSununu,1248256260643926017,,816282120767291392,False,,en,April,Q2
The State of New Hampshire appreciates all of your lifesaving work on the frontlines.,109,2020-04-09 00:56:44,Twitter for iPhone,35,7,GovChrisSununu,1248052188523499520,,816282120767291392,False,https://t.co/UMbsl2qOYg,en,April,Q2
"Am I:

1) Indulging in ice cream to relieve stress.
2) Enjoying the first incognito shopping run I’ve had in years.
3) Feeling super cool like a Western cowboy hero in Aisle 10.
4) Doing my part to follow CDC guidance &amp; not spread #COVID19.
5) All of the Above 

Stay safe, NH!",305,2020-04-08 23:28:37,Twitter for iPhone,1513,150,GovChrisSununu,1248030013166776320,,816282120767291392,False,https://t.co/UgVgsvmNck,en,April,Q2
"I sometimes get asked to end my Stay At Home Order because some folks don’t think #COVID19 is serious. 

Here’s my response:",148,2020-04-08 22:26:37,Twitter for iPhone,264,54,GovChrisSununu,1248014413954551808,,816282120767291392,False,https://t.co/loOjUgxzog,en,April,Q2
Just heard @Travelers and @GEICO are also taking this important action. Thanks to all these companies for stepping up and providing relief during this difficult time.,190,2020-04-08 22:09:39,Twitter for iPhone,47,8,GovChrisSununu,1248010144262184961,,816282120767291392,False,https://t.co/dWOxqczvgU,en,April,Q2
Happy #Passover to all who are celebrating. Wishing you a peaceful and healthy holiday. Chag Sameach!,125,2020-04-08 21:59:58,Twitter for iPhone,17,4,GovChrisSununu,1248007703789592577,,816282120767291392,False,https://t.co/j29m0O3Vxh,en,April,Q2
In studio with @MonicaWMUR and @MikeCherryWMUR answering YOUR questions on @WMUR9 until 6:00 PM!,120,2020-04-08 21:30:24,Twitter for iPhone,41,5,GovChrisSununu,1248000266772705280,,816282120767291392,False,https://t.co/vpsQPDrhzH,en,April,Q2
I’ll be LIVE on @WMUR9 tonight at 5:30 taking YOUR questions on the state’s response to #COVID19. Tune in!,130,2020-04-08 20:39:51,Twitter for iPhone,14,6,GovChrisSununu,1247987544903553025,,816282120767291392,False,https://t.co/9QXMCIOrNP,en,April,Q2
"We've seen a lower number of new confirmed #COVID19 cases in recent days and that's encouraging, but that must not be mistaken for a trend. This viral epidemic is real. Our toughest days are likely ahead, but we will continue attacking this with every resource available.",295,2020-04-08 19:39:23,Twitter for iPhone,43,14,GovChrisSununu,1247972328270594048,,816282120767291392,False,https://t.co/BPMRqzY5gO,en,April,Q2
It’s the people of New Hampshire who deserve all the credit in the world as to why we’re not seeing results like some other states. Granite Staters have acted responsibly &amp; have taken social distancing seriously. We can’t repeat that enough. THANK YOU New Hampshire. #GraniteTough,284,2020-04-08 19:28:38,Twitter for iPhone,412,90,GovChrisSununu,1247969622625828864,,816282120767291392,False,,en,April,Q2
Our hearts go out to the families of the five Granite Staters we lost to #COVID19 today. Our toughest days are likely still ahead.,130,2020-04-08 19:12:28,Twitter for iPhone,46,17,GovChrisSununu,1247965552011870217,,816282120767291392,False,,en,April,Q2
"We appreciate folks' patience as we continue to make the application system more robust, but to date our team is doing a great job and continues to provide one-on-one services to the over 100,000 people asking for help. (3/3)",225,2020-04-08 19:12:23,Twitter Web App,11,3,GovChrisSununu,1247965529672998913,8.162821207672914e+17,816282120767291392,False,,en,April,Q2
"Just this week @NHESWorking has processed 30,000 payments totaling $8.5M in benefits. This is thanks to the incredibly hard work of those at NH Employment Security who are working around the clock working to provide financial relief to those adversely affected by #COVID19. (2/3)",279,2020-04-08 19:12:22,Twitter Web App,11,2,GovChrisSununu,1247965528343433218,8.162821207672914e+17,816282120767291392,False,,en,April,Q2
"Since I signed Emergency Order 5 expanding unemployment benefits on March 17, NH has become a leader in getting folks relief fast. In just three weeks, @NHESWorking has issued over 67,000 total payments with nearly $19M in benefits paid (1/3)",242,2020-04-08 19:12:22,Twitter Web App,38,8,GovChrisSununu,1247965527047385094,,816282120767291392,False,,en,April,Q2
I will continue to put pressure on Washington to provide New Hampshire with the supplies and resources to make full use of the Abbott rapid-testing devices - supplies that only they can provide - so that we can continue our efforts to prevent the spread of #COVID19. (3/3),272,2020-04-08 19:05:45,Twitter Web App,243,53,GovChrisSununu,1247963863062130691,8.162821207672914e+17,816282120767291392,False,,en,April,Q2
"You can imagine my frustration in being given great tools in our fight to combat #COVID19, but not being provided the resources needed to take advantage of them at even a fraction of their full capacity. What we can use, we will, &amp; we will work to get them deployed quickly. (2/3)",284,2020-04-08 19:05:45,Twitter Web App,214,57,GovChrisSununu,1247963862160326657,8.162821207672914e+17,816282120767291392,False,,en,April,Q2
"Earlier this week it was announced that NH has received 15 Abbott rapid-testing devices. While that's good news, @fema has only sent us a limited number of the cartridges needed to perform those tests. We have been told to only expect about 15% of the cartridges requested. (1/3)",279,2020-04-08 19:05:45,Twitter Web App,365,208,GovChrisSununu,1247963860914577414,,816282120767291392,False,,en,April,Q2
I’ll be holding a press conference today at 3 PM to provide an update on the state’s response to COVID-19. Watch live:,142,2020-04-08 18:02:45,Twitter for iPhone,18,7,GovChrisSununu,1247948006697156608,,816282120767291392,False,https://t.co/23YE0YT43Q,en,April,Q2
Congratulations to Captain Nathan Noyes of New Boston on his unanimous confirmation to serve as the next Colonel of the @NH_StatePolice at today’s Executive Council Meeting. I look forward to working with him to ensure that NH remains one of the safest states in the nation.,274,2020-04-08 17:15:45,Twitter for iPhone,68,10,GovChrisSununu,1247936181247127552,,816282120767291392,False,,en,April,Q2
Taking today’s Executive Council call remotely from the State’s Emergency Operations Center this morning. We are hard at work.,150,2020-04-08 15:03:03,Twitter for iPhone,27,6,GovChrisSununu,1247902784877256707,,816282120767291392,False,https://t.co/XizvKf8gmu,en,April,Q2
Our @NewHampshireDOT electronic message signs are being mobilized at entry points across the state to remind those coming from out-of-state for an extended period of time to quarantine for 14 days. #COVID19,230,2020-04-08 14:49:13,Twitter for iPhone,130,47,GovChrisSununu,1247899304590635008,,816282120767291392,False,https://t.co/P1X3vNodnW,en,April,Q2
"Following passage of the CARES Act, I have established the Governor’s Office for Emergency Relief &amp; Recovery. This office will ensure that the allocation of the more than $1.25B in federal aid coming to New Hampshire is allocated in a transparent, accountable manner.",295,2020-04-08 13:37:51,Twitter for iPhone,38,19,GovChrisSununu,1247881344333611008,,816282120767291392,False,https://t.co/ZhzxUIws8C,en,April,Q2
"I’m confident that this approach will ensure the transparency and collaboration Granite Staters have come to expect of state leadership, while allowing the state to be as nimble and responsive as possible to ensure that resources are moving to the areas of greatest need. (3/3)",277,2020-04-07 21:55:53,Twitter for iPhone,22,4,GovChrisSununu,1247644289645056000,8.162821207672914e+17,816282120767291392,False,,en,April,Q2
"A bipartisan Legislative Advisory Board within GOFERR will ensure that this process has as much accountability, transparency, and integrity as possible. I look forward to having legislative leadership advise this critically important office. (2/3)",247,2020-04-07 21:55:53,Twitter for iPhone,23,6,GovChrisSununu,1247644288248418305,8.162821207672914e+17,816282120767291392,False,,en,April,Q2
THREAD: Today I announced the formation of the Governor’s Office for Emergency Relief and Recovery (GOFERR) to oversee investment and oversight of #COVID19 relief and stimulus funds provided to NH by the federal government. (1/3),253,2020-04-07 21:55:52,Twitter for iPhone,77,25,GovChrisSununu,1247644285253623810,,816282120767291392,False,https://t.co/IXL5Db1aYZ,en,April,Q2
Just heard @LibertyMutual is joining these efforts to provide a ~15% reduction in premiums. Great to hear.,130,2020-04-07 20:56:02,Twitter for iPhone,99,16,GovChrisSununu,1247629229094768640,,816282120767291392,False,https://t.co/dWOxqchUpm,en,April,Q2
"Earlier today, @NHInsuranceDept  approved a waiver from @Allstate reducing auto insurance premiums by roughly 15% for NH Allstate policyholders. In effect for March/April, and likely longer. In total this will save Granite Staters around $2.3 million. Thanks @AllState.",269,2020-04-07 17:48:08,TweetDeck,187,38,GovChrisSununu,1247581940338823169,,816282120767291392,False,,en,April,Q2
Today I sent a letter to @USDOT @SecElaineChao advocating for changes to the #CARESAct to ensure Manchester-Boston Regional Airport @flymanchester receives financial assistance. Read my letter:,217,2020-04-07 17:25:15,Twitter Web App,51,16,GovChrisSununu,1247576182540898306,,816282120767291392,False,https://t.co/dAMgO37xJZ,en,April,Q2
"THANK YOU to New Hampshire’s frontline health care workers for all you do to keep our communities healthy and strong, especially in the wake of the public health crisis we’re facing. #603Salute",217,2020-04-07 14:02:25,Twitter for iPhone,167,45,GovChrisSununu,1247525137584238594,,816282120767291392,False,https://t.co/OYqACWTfaR,en,April,Q2
"Hotels and other lodging establishments will still be able to provide accommodations to provide housing for essential health care workers, first responders, state-approved quarantining accommodations for individuals, and victims of domestic and sexual violence.",261,2020-04-06 19:19:28,Twitter for iPhone,46,13,GovChrisSununu,1247242537917722624,8.162821207672914e+17,816282120767291392,False,,en,April,Q2
"Effective immediately, all hotels and short-term rentals like Airbnb’s in the State of New Hampshire must suspend lodging accommodations for non-essential reasons, like vacations and other leisurely purposes.",232,2020-04-06 19:18:09,Twitter for iPhone,146,60,GovChrisSununu,1247242208874582017,,816282120767291392,False,https://t.co/n84bGBWmYD,en,April,Q2
