Tweets,Length,Date,Source,Favourites,RTs,Username,id_str,in_reply_to_user_id,user_id,isRT,tco,Language,Month,Quarter
"I urge our citizens to stay home whenever possible and go out only when absolutely necessary. This will help Wyoming #SlowtheSpread of COVID-19 and #FlattenTheCurve Your voluntary actions and discipline will make the difference for you, your family and your neighbors. #COVID19WY",303,2020-03-25 23:00:00,TweetDeck,91,48,GovernorGordon,1242949383919894528,,1081334766924754944,False,https://t.co/hfAAD7JBb6,en,March,Q1
"The number of confirmed cases continues to grow. Tomorrow, March 24 at 1 p.m. I will be joined by the First Lady and state leaders to share how we can work together to help one another and #SlowTheSpread Watch live on the @WyomingPBS  Facebook page and YouTube channel. #COVID19WY",304,2020-03-25 03:06:25,TweetDeck,37,15,GovernorGordon,1242649007005913089,,1081334766924754944,False,https://t.co/VkiJCQNPED,en,March,Q1
"I understand the impact of these measures and sympathize with those most affected, especially small business owners, but this is about saving lives. We have tried to navigate a thoughtful course, but as COVID-19 spreads through our communities, we must take this action now.",274,2020-03-24 23:29:18,Twitter Web App,20,1,GovernorGordon,1242594366994202624,1.081334766924755e+18,1081334766924754944,False,,en,March,Q1
"Wyoming is taking further steps to #slowthespread of #COVID19WY. Today, we issued an order to temporarily close nail salons; hair salons; barber shops; massage parlors; tattoo, body art, piercing shops; and cosmetology, electrology, and esthetic services until April 3.",269,2020-03-24 23:29:17,Twitter Web App,52,8,GovernorGordon,1242594366188896256,,1081334766924754944,False,,en,March,Q1
Helping your neighbor is the WY way. WY distilleries are banding together to make hand sanitizer to help #slowthespread of #COVID19.  Supplies for these innovative efforts are paid for through Imminent Threat Grants from the @WyoBizCouncil,287,2020-03-24 21:15:04,TweetDeck,150,41,GovernorGordon,1242560587151933440,,1081334766924754944,False,https://t.co/fhHuUnqvoy,en,March,Q1
"We have confirmed two additional cases of COVID-19 in the state today. Viruses don't respect county boundaries- the best way to #SlowTheSpread is staying home whenever possible, working from home if it's feasible and limiting our trips out. #COVID19WY",275,2020-03-23 23:37:55,TweetDeck,40,26,GovernorGordon,1242234151358660608,,1081334766924754944,False,https://t.co/12R0Ud38XC,en,March,Q1
"We are at a critical time for our state. There are unquestionably more cases out there. Thank you to all Wyomingites who are practicing social distancing. 
Limit travel and stay home if possible. 
Wash hands frequently. #COVID19WY",254,2020-03-23 00:22:36,Twitter for iPhone,81,29,GovernorGordon,1241883005544624128,,1081334766924754944,False,https://t.co/2HJrJKQrIt,en,March,Q1
"Testing will continue to expand statewide, so we can expect the number of confirmed cases to increase. Please practice good hygiene and social distancing measures to #SlowTheSpread #COVID19WY",215,2020-03-21 21:15:00,TweetDeck,114,50,GovernorGordon,1241473406782124034,,1081334766924754944,False,https://t.co/jUZLAXo1Ge,en,March,Q1
"9/9 Shop for groceries if you need to, get food delivered from your favorite restaurant, support your local business with a gift card purchase. But please practice social distancing measures during this critical time. #COVID19WY",228,2020-03-21 19:06:56,Twitter Web App,57,2,GovernorGordon,1241441177183735808,1.081334766924755e+18,1081334766924754944,False,,en,March,Q1
"8/9 By limiting travel and face-to-face contact now, we reduce the potential to overwhelm our rural healthcare facilities and cause unnecessary deaths ahead. Wyoming’s rural nature does not protect us from impacts.",214,2020-03-21 19:06:55,Twitter Web App,36,3,GovernorGordon,1241441176399400960,1.081334766924755e+18,1081334766924754944,False,,en,March,Q1
"7/9 Like the rest of America, Wyoming’s access to testing supplies is limited. Our best tool right now for slowing the spread of this disease is practicing social distancing measures.",183,2020-03-21 19:06:55,Twitter Web App,28,2,GovernorGordon,1241441175627649026,1.081334766924755e+18,1081334766924754944,False,,en,March,Q1
"6/9 ...the enormity of the public health challenge facing us and respond to it. COVID-19 may seem far away, but it is here. Our neighboring states are all experiencing the same escalation in the number of positive cases as we are.",230,2020-03-21 19:06:55,Twitter Web App,30,0,GovernorGordon,1241441174860128256,1.081334766924755e+18,1081334766924754944,False,,en,March,Q1
"5/9 I am a businessman and understand full well what the consequences would be of closures. I know that the worst impacts would fall on those least able to absorb it.   As confirmed cases have grown from 1 to 23 in a week, spanning 8 counties, we should be honest about...",272,2020-03-21 19:06:55,Twitter Web App,29,0,GovernorGordon,1241441173928988672,1.081334766924755e+18,1081334766924754944,False,,en,March,Q1
"4/9 ...that unemployment benefits are readily accessible, that those who are food insecure are fed, and that our essential business functions are preserved. I am proud of my Wyoming heritage and the fact that we can serve as a beacon for our nation.",249,2020-03-21 19:06:55,Twitter Web App,33,0,GovernorGordon,1241441173123694592,1.081334766924755e+18,1081334766924754944,False,,en,March,Q1
"3/9 We are in this for the long haul and we will emerge stronger for this test, and I will always be guided by my concern for the health and safety of the people of Wyoming. folks at the state are working 24/7 to assure that proper supplies arrive as quickly as possible...",273,2020-03-21 19:06:55,Twitter Web App,31,1,GovernorGordon,1241441172351897606,1.081334766924755e+18,1081334766924754944,False,,en,March,Q1
"2/9 From the beginning, I have emphasized that the challenge we are facing represents two threats: disease and economic harm.  I have been very clear that both are important.  I believe firmly we must do the right thing, do it right away, and do it the right way.",263,2020-03-21 19:06:54,Twitter Web App,32,0,GovernorGordon,1241441171542441984,1.081334766924755e+18,1081334766924754944,False,,en,March,Q1
"1/9 The coronavirus is the most disruptive thing that most of us have ever seen.  I recognize and appreciate the criticism from some that we have not acted rapidly, and I appreciate and recognize the criticism that we have acted too much. #COVID19WY",249,2020-03-21 19:06:54,Twitter Web App,94,22,GovernorGordon,1241441170774872064,,1081334766924754944,False,,en,March,Q1
Excellent news: Wyoming small businesses impacted by COVID-19 have received final Federal approval to seek loans up to $2 million as part of the SBA’s Economic Injury Disaster Loan program. To apply visit:  #COVID19WY,240,2020-03-20 23:49:31,TweetDeck,114,36,GovernorGordon,1241149904799531014,,1081334766924754944,False,https://t.co/o5lyRxovgZ,en,March,Q1
We are a state filled with helpers.,59,2020-03-20 22:26:21,TweetDeck,26,2,GovernorGordon,1241128974404681728,,1081334766924754944,False,https://t.co/ogCZmngLeN,en,March,Q1
"If you weren't able to watch last night's fireside chat with the First Lady on Facebook, a recording has been posted on my website.",155,2020-03-20 21:36:00,TweetDeck,5,1,GovernorGordon,1241116303429156865,,1081334766924754944,False,https://t.co/eljFaLok1W,en,March,Q1
"Yesterday's closure order only impacts certain types of businesses. Included in the list are restaurants, bars, gyms, movie theaters, music halls and day cares. Other private businesses are not required to close. Social distancing is our best weapon to #StopTheSpread #COVID19WY",302,2020-03-20 19:41:15,TweetDeck,20,5,GovernorGordon,1241087427122540544,,1081334766924754944,False,https://t.co/D3zvG81GuL,en,March,Q1
I have been asked to provide clarification of the statewide order issued today by the State Health Officer. A copy of the order is posted on my website. County Health Officers can also provide additional information.,240,2020-03-20 01:30:38,Twitter for iPhone,18,13,GovernorGordon,1240812962291388416,,1081334766924754944,False,https://t.co/eljFaL6IDm,en,March,Q1
"The First Lady will be joining me for a Facebook Live broadcast at 6:30 pm tonight, March 19, to discuss COVID-19 and its impact to our state. Please join us.",158,2020-03-19 23:27:33,TweetDeck,20,10,GovernorGordon,1240781989520781313,,1081334766924754944,False,,en,March,Q1
I have endorsed an order from our state health officer closing public places for a period of 2 weeks to help slow the spread of COVID-19. It is a critical step for protecting public health and the health of our most vulnerable residents.,261,2020-03-19 22:46:51,TweetDeck,60,27,GovernorGordon,1240771746636148737,,1081334766924754944,False,https://t.co/Z8617fwG3Y,en,March,Q1
"It's time for Wyomingites to do all we can to slow the spread of COVID-19 in the state. Following the @POTUS social distancing guidelines will benefit all of us, particularly our health care providers and vulnerable populations. #covid19WY",263,2020-03-19 14:39:12,TweetDeck,41,14,GovernorGordon,1240649025608724480,,1081334766924754944,False,https://t.co/77dCaZl4OT,en,March,Q1
"We've launched a state website to provide resources and information on the COVID-19 pandemic,  Do your part to mitigate the impacts. #COVID19WY",190,2020-03-19 01:19:02,TweetDeck,14,9,GovernorGordon,1240447655538556929,,1081334766924754944,False,https://t.co/eRcuaJGPqQ,en,March,Q1
We can all help protect one another and alleviate the strain on our medical facilities. #COVID19WY,122,2020-03-18 22:01:11,TweetDeck,13,6,GovernorGordon,1240397866348224514,,1081334766924754944,False,https://t.co/s3rQkW67t8,en,March,Q1
4/4 ...avoid overwhelming our healthcare system and support those most in need. Wyoming will emerge from this crisis strong and proud of how we met these challenges facing all of us.,182,2020-03-18 18:37:22,Twitter Web App,8,2,GovernorGordon,1240346575173496837,1.081334766924755e+18,1081334766924754944,False,,en,March,Q1
"3/4 Although absolutely necessary, I recognize the toll these measures will take on those most dependent on a working wage. But by working together and practicing good hygiene, kindness and charity, we can keep vulnerable adults healthy...",239,2020-03-18 18:37:22,Twitter Web App,6,1,GovernorGordon,1240346574292684802,1.081334766924755e+18,1081334766924754944,False,,en,March,Q1
"2/4 We should use good judgment, avoid unnecessary travel, keep social gatherings to groups of fewer than 10 people, and use drive-through, pickup or delivery options from our local restaurants. These are going to be perhaps the toughest times any of us will see in our lifetimes.",304,2020-03-18 18:37:22,Twitter Web App,4,1,GovernorGordon,1240346572925403136,1.081334766924755e+18,1081334766924754944,False,https://t.co/8ruNwKLssX,en,March,Q1
"1/4 Today, in consultation with our State Health Officer, I am supporting the #coronavirus  Guidelines President Trump has issued for America. Accordingly, over the next 15 days, I ask that we do all we can as Wyomingites to help slow the spread of COVID-19 in our state.",295,2020-03-18 18:37:21,Twitter Web App,20,12,GovernorGordon,1240346571469991944,,1081334766924754944,False,https://t.co/Sv04RzVkr3,en,March,Q1
Visit  and click on the COVID-19 tab in the upper left for information and links related to the COVID-19 outbreak. We expect to issue additional recommendations from our office later today.,212,2020-03-17 19:19:07,TweetDeck,11,6,GovernorGordon,1239994693863292929,,1081334766924754944,False,https://t.co/2LyxYPFET7,en,March,Q1
I will host a press conference at 3:30 today to provide an update on Wyoming’s planning and response to the COVID-19 pandemic. It will be streamed on my Facebook page:,191,2020-03-16 20:30:46,Twitter Web App,24,10,GovernorGordon,1239650335960023040,,1081334766924754944,False,https://t.co/zDNe08RsV1,en,March,Q1
"This is Wyoming, where we are all neighbors. While social distancing should be a priority, it should not keep us from helping one another out. I am thinking of our first responders and healthcare workers  who may be without child care. This is a time to help one another out.",275,2020-03-15 23:10:20,Twitter Web App,51,13,GovernorGordon,1239328104256020480,1.081334766924755e+18,1081334766924754944,False,,en,March,Q1
This is an attempt to allow schools and communities to prepare to operate in a way that mitigates community spread of COVID-19 and minimizes negative economic impacts locally and statewide.,189,2020-03-15 23:10:05,Twitter Web App,18,4,GovernorGordon,1239328041219784709,1.081334766924755e+18,1081334766924754944,False,,en,March,Q1
In conjuction with @jillian4supt i have recommended that all schools remain closed to students through at least April 3. Local superintendents and school boards will make the final decisions on closures.,203,2020-03-15 23:10:05,Twitter Web App,56,33,GovernorGordon,1239328040322322436,,1081334766924754944,False,,en,March,Q1
"Please know that close coordination is ongoing between the Department of Health, Office of Homeland Security and my office. Our response is based on the best available information, and we will be continually adjusting to what is a rapidly changing situation.",258,2020-03-14 20:53:25,Twitter Web App,9,1,GovernorGordon,1238931259411197954,1.081334766924755e+18,1081334766924754944,False,,en,March,Q1
"In response, our state health officer has issued recommendations for assisted living facilities that match restrictive guidelines the federal government has issued for nursing homes. These include no visitors or non-essential healthcare personnel.",271,2020-03-14 20:53:24,Twitter Web App,5,1,GovernorGordon,1238931258551328769,1.081334766924755e+18,1081334766924754944,False,https://t.co/I5EB31bJVZ,en,March,Q1
Initial follow-up with this individual indicated potential community spread of this virus in the Lander area. Wyoming Department of Health staff will be available to consult as local officials consider decisions about public events and other community-related activities.,271,2020-03-14 20:53:24,Twitter Web App,4,1,GovernorGordon,1238931257792200709,1.081334766924755e+18,1081334766924754944,False,,en,March,Q1
I want to provide some updated information on the Fremont County case of #COVIDー19 that was identified yesterday. The patient is hospitalized at SageWest Health Care in Lander and is a resident of Showboat Retirement Center in Lander.,234,2020-03-14 20:53:24,Twitter Web App,8,6,GovernorGordon,1238931256999424000,,1081334766924754944,False,,en,March,Q1
Wyoming has confirmed the second known case of COVID-19 in the state. The patient is a hospitalized older adult male Fremont County resident with currently unknown exposure risk. We will be sharing additional information as it becomes available.,269,2020-03-14 03:04:41,Twitter Web App,24,15,GovernorGordon,1238662306038337536,,1081334766924754944,False,https://t.co/TuYxEiSCZS,en,March,Q1
I will be hosting a press conference on the states response to the first COVID-19 case. It will be streamed on my Facebook page.,128,2020-03-12 23:01:41,Twitter for iPhone,17,2,GovernorGordon,1238238762808815616,,1081334766924754944,False,,en,March,Q1
The current risk of transmission in Wyoming remains low for most residents. Our Health Department is following up to learn more details about the person’s exposure risk and to identify anyone who may have been in close contact with the patient.,268,2020-03-12 01:35:19,Twitter Web App,9,2,GovernorGordon,1237915039564206081,1.081334766924755e+18,1081334766924754944,False,https://t.co/jVhlktazEf,en,March,Q1
"Our state has been planning for this situation for weeks and we will continue our coordinated efforts to address this threat. We will continue to work closely with our state agencies, federal partners and local officials to implement all necessary steps to protect public health.",279,2020-03-12 01:35:19,Twitter Web App,14,1,GovernorGordon,1237915038448603137,1.081334766924755e+18,1081334766924754944,False,,en,March,Q1
Our state health lab has identified the first known case of a state resident with coronavirus disease 2019 (COVID-19). The individual is an adult female from Sheridan County with some recent domestic travel history.,215,2020-03-12 01:35:18,Twitter Web App,47,23,GovernorGordon,1237915037551013889,,1081334766924754944,False,,en,March,Q1
"Older adults and those with underlying chronic illnesses are most at risk of severe COVID-19 illness. Wyoming is continuing to prepare and working to protect public health in the event cases appear within our state. For more information, visit",267,2020-03-09 23:30:05,Twitter Web App,3,4,GovernorGordon,1237158749569265664,1.081334766924755e+18,1081334766924754944,False,https://t.co/phCWwiLBt5,en,March,Q1
Earlier today I joined the nations governors and @VP for a weekly phone call to hear the latest updates from the @CDCgov . While Wyoming still has no confirmed cases of COVID-19 it’s likely the disease will spread to our state at some point. We are preparing for that likelihood.,279,2020-03-09 23:30:05,Twitter Web App,2,0,GovernorGordon,1237158748491218949,1.081334766924755e+18,1081334766924754944,False,,en,March,Q1
This afternoon I joined Wyoming Dept. of Health officials for a conference call with long term care and nursing facilities to ensure proper protocols and preventative measures are in place to protect residents of these facilities from #coronavirus.,272,2020-03-09 23:30:05,Twitter Web App,8,0,GovernorGordon,1237158746733903872,,1081334766924754944,False,https://t.co/bipybCNnoN,en,March,Q1
On #InternationalWomensDay2020 we should both celebrate women's achievements and remember our shared responsibility to support equal opportunities for all women.,185,2020-03-08 15:38:00,TweetDeck,11,7,GovernorGordon,1236677555526107136,,1081334766924754944,False,https://t.co/EF7QxTmAt8,en,March,Q1
"It was my pleasure to welcome @rbalsaud,Saudi Arabia’s ambassador to the United States to the Capitol. The discussion with Princess Reema, legislators and state leaders touched on tourism, economic diversification and workforce issues.",259,2020-03-06 22:54:32,TweetDeck,753,259,GovernorGordon,1236062636745334784,,1081334766924754944,False,https://t.co/Ansk9NpYEz,en,March,Q1
This is a true honor. Public-private partnerships are critical to achieving breakthroughs in clean energy.,130,2020-03-06 19:28:13,Twitter Web App,6,2,GovernorGordon,1236010714776719360,,1081334766924754944,False,https://t.co/bWPnv0R8BY,en,March,Q1
Congratulations! It’s been a tough season but our Cowboys have shown grit and determination. #OneWyoming,128,2020-03-06 13:51:55,Twitter for iPhone,15,1,GovernorGordon,1235926084421423105,,1081334766924754944,False,https://t.co/RLotbp1wIL,en,March,Q1
"I was proud to sign the first bills of the 2020 legislative session this afternoon. These bills increase penalties for human trafficking,  help struggling kids have the opportunity to remain with their families, and fund the fight against terrestrial invasive species.",292,2020-03-05 22:57:16,TweetDeck,25,1,GovernorGordon,1235700938557583360,,1081334766924754944,False,https://t.co/HKbB33ylPC,en,March,Q1
"A short tutorial on handwashing, a simple, important step to help prevent viral respiratory illnesses.",126,2020-03-05 15:04:26,TweetDeck,13,0,GovernorGordon,1235581947289759744,,1081334766924754944,False,https://t.co/p97OliMwRg,en,March,Q1
I'm pleased to welcome Ed Seidel as the new University of Wyoming president. Ed has demonstrated visionary leadership and brings a strong focus on economic development. His exceptional technical and scientific background will benefit the research efforts at UW.,261,2020-03-04 20:40:19,TweetDeck,32,2,GovernorGordon,1235304086221852673,,1081334766924754944,False,,en,March,Q1
"I-80 across much of Wyoming will remain closed in both directions for at least another 24 hours as cleanup continues from crashes yesterday that involved more than 100 vehicles. If you are planning travel across the state, please use alternate routes.",275,2020-03-02 19:10:03,TweetDeck,15,9,GovernorGordon,1234556592407896064,,1081334766924754944,False,https://t.co/K1pFChpjsF,en,March,Q1
Thanks to @TomBurman1 for presenting me with a game ball from the @novaAZBOWL. What a great experience this was for our Cowboys players and fans. #OneWyoming #GoWyo,188,2020-02-27 16:21:31,TweetDeck,56,2,GovernorGordon,1233064627967229952,,1081334766924754944,False,https://t.co/9GawU5Xq9S,en,February,Q1
"Congratulations to Kate MacGregor. We are fortunate to have another leader @Interior who is well-versed in issues surrounding energy development, wildlife, water and other natural resources”",214,2020-02-26 15:12:40,Twitter Web App,11,1,GovernorGordon,1232684913352216577,,1081334766924754944,False,https://t.co/gUQ8mu4io4,en,February,Q1
The Wyoming Department of Health continues to closely monitor the #coronavirus outbreak and is coordinating with local and federal officials. There are no reported cases in Wyoming at this time. More info here:,234,2020-02-26 01:30:00,TweetDeck,11,3,GovernorGordon,1232477882842107905,,1081334766924754944,False,https://t.co/phCWwj3ckD,en,February,Q1
The students from Mrs. Barkee's 4th grade class at Cheyenne's Alta Vista Elementary School incorporated some wonderful Wyoming imagery in their Thank You card. I had a great time talking with them.,221,2020-02-25 21:18:54,TweetDeck,21,2,GovernorGordon,1232414692741652481,,1081334766924754944,False,https://t.co/l5zZdUYlEL,en,February,Q1
In Wyoming you never know who's going to stop by the Capitol. Thank you to @RepLizCheney and @SenatorEnzi for saying hello when Jennie and I were chatting with the Wyoming Federation of Republican Women.,227,2020-02-24 16:05:00,TweetDeck,29,2,GovernorGordon,1231973308113018881,,1081334766924754944,False,https://t.co/PrRDq4l5NO,en,February,Q1
"Today, I sent the acting superintendent of @GrandTetonNPS a letter condemning the aerial culling of mountain goats in Grand Teton National Park. This removal method has also been opposed by the Wyoming Game &amp; Fish Commission.",253,2020-02-22 00:22:43,Twitter Web App,29,2,GovernorGordon,1231011400379703296,,1081334766924754944,False,https://t.co/Bit0k354nT,en,February,Q1
"I had a great conversation with first-year students in the WWAMI program, which is Wyoming's medical school. These future physicians are committed to Wyoming and improving healthcare in our state.",220,2020-02-21 17:15:00,TweetDeck,28,3,GovernorGordon,1230903760647524352,,1081334766924754944,False,https://t.co/lSvf2MrPs9,en,February,Q1
"Students participating in FCCLA, FBLA and FFA spoke eloquently about the importance of #CTE during today's proclamation signing. They were an inspiring group who will help lead our state into the future.",227,2020-02-21 00:27:47,TweetDeck,20,3,GovernorGordon,1230650286949249025,,1081334766924754944,False,https://t.co/vNTcozg4xv,en,February,Q1
Thank you to the Wyoming Women's Foundation for inviting me to celebrate the release of the 2020 Self-Sufficiency Standard. This study looks at what it actually costs to raise a family in Wyoming. Understanding the underlying challenges will help drive better policy.,291,2020-02-18 22:05:15,TweetDeck,19,1,GovernorGordon,1229889642922684417,,1081334766924754944,False,https://t.co/GQ7mINfgxc,en,February,Q1
SF 138 and its companion bill HB 249 are only the first steps in a thorough process that would allow the state to evaluate this purchase.,161,2020-02-17 23:22:59,Twitter Web App,9,0,GovernorGordon,1229546816364040193,1.081334766924755e+18,1081334766924754944,False,https://t.co/zKEk4CFjP4,en,February,Q1
"I want to ensure our leadership gives this potential investment due diligence and determines if this would provide a return on investment to benefit Wyoming citizens. Our state faces big challenges in the years to come, ones that will require equally big solutions and ideas.",275,2020-02-17 23:22:59,Twitter Web App,7,1,GovernorGordon,1229546815424520192,1.081334766924755e+18,1081334766924754944,False,,en,February,Q1
I was joined by Senate President @S29Perkins and House Speaker @SteveHarshman today to express our support for two bills that could return Wyoming lands to Wyoming people and potentially generate significant income for our state.,253,2020-02-17 23:22:58,Twitter Web App,15,4,GovernorGordon,1229546813855870977,,1081334766924754944,False,https://t.co/WfLXTRNSZs,en,February,Q1
"On President's Day we honor the great leaders who helped shape our democracy.
“Truth will ultimately prevail where there is pains to bring it to light.” – George Washington #PresidentsDay",211,2020-02-17 17:42:06,TweetDeck,34,4,GovernorGordon,1229461031635898369,,1081334766924754944,False,https://t.co/jZE7ObJ05D,en,February,Q1
"I'm happy to announce the signing of my Migration Corridor Executive Order. This was a collaborative process that shows how Wyoming can come together on difficult issues, solve problems together, and develop a Wyoming solution.",251,2020-02-14 18:31:15,TweetDeck,16,1,GovernorGordon,1228386234730500097,,1081334766924754944,False,https://t.co/kMwTVpM1Tm,en,February,Q1
"Thank you to @DavoDenniston for your inspiring words this morning at the Governor's Prayer Breakfast. Your determination and dedication are admirable, and you are an incredible asset to our University.",225,2020-02-13 16:56:23,TweetDeck,30,2,GovernorGordon,1227999973565968386,,1081334766924754944,False,https://t.co/vducZNXNVN,en,February,Q1
Thank you to @AjitPaiFCC for joining us for a roundtable discussion about the importance of rural broadband expansion to Wyoming.,153,2020-02-12 18:43:58,TweetDeck,20,7,GovernorGordon,1227664660654166016,,1081334766924754944,False,https://t.co/LJYyMYZ3gy,en,February,Q1
