Tweets,Length,Date,Source,Favourites,RTs,Username,id_str,in_reply_to_user_id,user_id,isRT,tco,Language,Month,Quarter
"No one wants to see businesses close, more people sickened and our economy further impacted. But our progress depends on cooperation and common sense. It’s the way both our citizens and our economy will stay healthy. 3/3",244,2020-06-29 18:56:17,Twitter Web App,34,7,GovernorGordon,1277677286205120518,1.081334766924755e+18,1081334766924754944,False,https://t.co/r04ttWjkWZ,en,June,Q2
"It is up to all of us to make a concerted effort to slow the spread of the virus. Right now, the health of our citizens and our economy depends upon everyone practicing good hygiene, social distancing and wearing a mask in public where social distancing isn’t possible. 2/3",273,2020-06-29 18:56:17,Twitter Web App,30,4,GovernorGordon,1277677285458534403,1.081334766924755e+18,1081334766924754944,False,,en,June,Q2
"Given the increase in the number of cases of COVID-19 we have seen in recent weeks, Wyoming has extended the public health orders currently in place through July 15. We've seen 288 new cases of COVID-19 in 15 counties in the past 2 weeks. 1/3",242,2020-06-29 18:56:17,Twitter Web App,58,19,GovernorGordon,1277677284728717318,,1081334766924754944,False,,en,June,Q2
"Happy Father's Day to all the fathers, grandfathers and men who are making a positive difference in a child's life. ""Fatherhood is giving one’s all, from a child’s first day of life on, from the break of day to its end—on the job, in the household, but most of all, in the heart.""",304,2020-06-21 15:22:52,Twitter Web App,65,6,GovernorGordon,1274724475288735745,,1081334766924754944,False,https://t.co/120LzvTHHd,en,June,Q2
Some good economic news to report- Wyoming's May unemployment rate of 8.8% was the 3rd lowest in the country.,133,2020-06-19 20:36:16,Twitter Web App,91,10,GovernorGordon,1274078565907267584,,1081334766924754944,False,https://t.co/lUPTsuEH7d,en,June,Q2
"I'm holding a media briefing at 4pm today, June 16, to provide a COVID-19 update. Watch live on @WyomingPBS Facebook or YouTube.",152,2020-06-16 19:29:14,TweetDeck,16,9,GovernorGordon,1272974534229069824,,1081334766924754944,False,https://t.co/S23z7DCCXe,en,June,Q2
"Another round of thanks go out to Director General Alex Fan of @TECOinSeattle for facilitating Taiwan's donation of 10,000 N95 masks to Wyoming and the @WyoBizCouncil. We appreciate their continued support of our state's people and businesses.",267,2020-06-11 21:38:35,Twitter Web App,56,12,GovernorGordon,1271195146072227841,,1081334766924754944,False,https://t.co/nl6yYh0rB7,en,June,Q2
"...we are able to continue removing the few public health restrictions that remain. Our updated health orders allow Wyomingites to safely celebrate the 4th of July the way that all Americans should, with barbecues, parades and other celebrations of our nation’s independence. 5/5",279,2020-06-11 01:18:51,Twitter Web App,31,3,GovernorGordon,1270888192648986624,1.081334766924755e+18,1081334766924754944,False,,en,June,Q2
It is my hope and desire that we do not see additional infections and cases of COVID-19 in Wyoming due to the recent protests. Wyoming will carefully monitor the rate of infection over the next few weeks. We have made outstanding progress and I remain hopeful...4/5,265,2020-06-11 01:18:51,Twitter Web App,15,1,GovernorGordon,1270888191835303936,1.081334766924755e+18,1081334766924754944,False,,en,June,Q2
"However, large gatherings of people do involve significant health risks, and this risk has been identified both locally and nationally. I encourage those who chose to participate in peaceful protests to practice social distancing and wear face coverings as much as possible. 3/5",278,2020-06-11 01:18:51,Twitter Web App,19,2,GovernorGordon,1270888191101263873,1.081334766924755e+18,1081334766924754944,False,,en,June,Q2
"This is America and everyone has a right to express their point of view. I have not encouraged any actions by law enforcement to cite protesters for violating the state's health orders, as I recognize the importance of the ability to protest, both for Wyoming and our Nation. 2/5",279,2020-06-11 01:18:51,Twitter Web App,19,1,GovernorGordon,1270888190358941700,1.081334766924755e+18,1081334766924754944,False,,en,June,Q2
"It’s refreshing to see citizens feeling free to express their First Amendment rights, as we have seen so often over the past month. I respect the right, and appreciate the intent of all those who have spoken out, even if it is against decisions I have made. 1/5",261,2020-06-11 01:18:51,Twitter Web App,56,8,GovernorGordon,1270888189608071169,,1081334766924754944,False,,en,June,Q2
"Our COVID-19 dashboard has been updated to reflect the improvement in the statewide metrics used to ease restrictions. It is important to remain vigilant, but with our continued success, I am confident we can continue lifting the very few remaining public health restrictions. 2/2",304,2020-06-10 21:45:22,Twitter Web App,8,2,GovernorGordon,1270834466576117762,1.081334766924755e+18,1081334766924754944,False,https://t.co/osVMRenj6z,en,June,Q2
"Wyoming's updated public health orders that take effect June 15 will allow indoor gatherings of up to 250 people with social distancing restrictions, permit parades and allow our K-12 schools to resume in-person instruction for all students. 1/2",269,2020-06-10 21:45:22,Twitter Web App,12,5,GovernorGordon,1270834465754025988,,1081334766924754944,False,https://t.co/t7a8WE1Ovv,en,June,Q2
"It was a pleasure to visit with World War II veteran Sidney Walton, 101, this morning at the Capitol and thank him for his service. Mr. Walton joined the army in 1941 and served in the 34th Infantry, 8th Division.",237,2020-06-08 16:05:28,TweetDeck,100,13,GovernorGordon,1270024152829886464,,1081334766924754944,False,https://t.co/uKEzlKPm2i,en,June,Q2
"On this day in 1944, Allied troops stormed the beach in Normandy and changed the course of World War II. Today we remember their bravery and honor their sacrifice. #DDay",193,2020-06-06 14:40:00,TweetDeck,98,11,GovernorGordon,1269277867076136961,,1081334766924754944,False,https://t.co/p5x8U064Gg,en,June,Q2
"I will hold a media briefing at 3 pm today, June 4, to provide updates on COVID-19 and the state's budget.
Watch live on @WyomingPBS TV, Facebook and here:",179,2020-06-04 18:58:00,TweetDeck,11,2,GovernorGordon,1268618019175124993,,1081334766924754944,False,https://t.co/w5Xg0zdyM0,en,June,Q2
"The Wyoming Emergency Housing Assistance Program is now accepting applications. This eviction prevention program serves eligible Wyoming residents who lack sufficient income or resources to pay housing costs.
Information here:",250,2020-06-04 16:48:55,TweetDeck,35,14,GovernorGordon,1268585537222426625,,1081334766924754944,False,https://t.co/ckym2Urzi0,en,June,Q2
I would like to provide some additional clarification surrounding yesterday’s announcement that six of Wyoming’s signature rodeo events will not be taking place this summer. My statement can be viewed here:,230,2020-05-29 00:39:28,TweetDeck,45,17,GovernorGordon,1266167239474020356,,1081334766924754944,False,https://t.co/4AutvdVLVc,en,May,Q2
"I'm holding a media briefing at 3 pm today, May 27, to provide a COVID-19 update and discuss the status of large events in Wyoming this summer. Watch live on @WyomingPBS television, Facebook and YouTube.",227,2020-05-27 16:51:33,TweetDeck,17,10,GovernorGordon,1265687095982600195,,1081334766924754944,False,https://t.co/poFCOfWPo4,en,May,Q2
On Memorial Day we honor those who made the ultimate sacrifice serving their country and defending the freedoms we enjoy today.,151,2020-05-25 13:14:11,Twitter for iPhone,72,7,GovernorGordon,1264907619115794433,,1081334766924754944,False,https://t.co/05lzzq88VN,en,May,Q2
"As we enter Memorial Day weekend, have fun but enjoy yourselves responsibly. Wear a face covering if you're going to come into close contact with others. It's a sign of respect for your neighbors and the vulnerable.",239,2020-05-22 22:47:00,TweetDeck,140,27,GovernorGordon,1263964606763945984,,1081334766924754944,False,https://t.co/K3u0KZWntO,en,May,Q2
"Under our new plan, WY will conduct COVID-19 testing at long-term care facilities. We will be test a % of all residents &amp; staff at each facility; Where there is a confirmed case, all staff &amp; residents will be tested weekly. Early interventions are critical to limiting outbreaks.",287,2020-05-21 22:15:00,TweetDeck,70,16,GovernorGordon,1263594166031839233,,1081334766924754944,False,,en,May,Q2
Congratulations to Megan Dufault of Jackson and Sam Miller of Laramie who were named @usedgov Presidential Scholars. This honor places them among the  most distinguished graduating high school seniors in the country.,241,2020-05-21 20:15:00,TweetDeck,27,1,GovernorGordon,1263563967135244288,,1081334766924754944,False,https://t.co/KJR3po3kLx,en,May,Q2
"Staying safe during COVID-19 shouldn't mean sacrificing the health of your children. Well child visits are still critical, and healthcare providers have adapted to ensure patient safety.",210,2020-05-21 18:15:00,TweetDeck,13,4,GovernorGordon,1263533767932538880,,1081334766924754944,False,https://t.co/imFPzEENpN,en,May,Q2
"I want to thank the Legislature for their work in passing these bills. This is an unprecedented time, and while there is more work to be done, Wyoming and America’s unsinkable economy is coming out of hibernation. 4/4",217,2020-05-21 17:11:07,Twitter Web App,3,1,GovernorGordon,1263517692826398721,1.081334766924755e+18,1081334766924754944,False,,en,May,Q2
We have also developed an eviction prevention program for eligible renters and homeowners who have been financially impacted by COVID-19. It will be administered by the Wyoming Community Development Authority which will begin accepting applications soon. 3/4,258,2020-05-21 17:11:07,Twitter Web App,7,1,GovernorGordon,1263517691991724032,1.081334766924755e+18,1081334766924754944,False,,en,May,Q2
"and provide support to cities, towns, counties and tribal communities. They also create three relief programs that will provide grant assistance to our state’s businesses impacted by the pandemic. The @WyoBizCouncil will begin accepting applications for these in early June. 2/4",278,2020-05-21 17:11:07,Twitter Web App,2,1,GovernorGordon,1263517691228422144,1.081334766924755e+18,1081334766924754944,False,,en,May,Q2
"Yesterday I signed three bills that provide a framework for spending the $1.25 billion in federal funding Wyoming received through the CARES Act. These bills will help Wyoming expand COVID-19 testing, fund economic development projects.... 1/4",267,2020-05-21 17:11:06,Twitter Web App,26,6,GovernorGordon,1263517689072541696,,1081334766924754944,False,https://t.co/YuwffhYLni,en,May,Q2
"I'm holding a briefing at 3pm today, May 20, to provide an update on COVID-19 in Wyoming and talk about the 3 bills passed by the Legislature during the recent special session. Watch online at @WyomingPBS TV, Facebook and Youtube.",254,2020-05-20 19:15:32,TweetDeck,10,5,GovernorGordon,1263186614647508994,,1081334766924754944,False,https://t.co/yifEiFafi3,en,May,Q2
"I'm happy to report that roads, hiking trails, and rock climbing routes at Devil's Tower National Monument will reopen to public access on May 22. Visitors should be prepared for limited services and avoid crowding. The Visitor Center will remain closed at this time.",291,2020-05-19 02:07:51,Twitter Web App,145,28,GovernorGordon,1262565601739862017,,1081334766924754944,False,https://t.co/LOJhsi48Y5,en,May,Q2
"The recent death of a member of the Northern Arapaho tribe and the two additional deaths recently identified are sad reminders of the serious, ongoing impact of COVID-19. My thoughts are with their. families. We must continue our efforts to minimize the spread of this virus.",275,2020-05-18 22:03:47,TweetDeck,62,8,GovernorGordon,1262504180192645121,,1081334766924754944,False,,en,May,Q2
"Congratulations to Jeff Makelky, Principal of Big Piney High School who has been named the 2020 State Principal of the Year by the Wyoming Association of Secondary School Principals. Thank you for creating a positive school culture and helping to ensure every student succeeds.",301,2020-05-18 15:27:11,TweetDeck,97,10,GovernorGordon,1262404372748570629,,1081334766924754944,False,https://t.co/cI4sQVSjsi,en,May,Q2
"We have eased our restrictions to allow gatherings of 25 persons or fewer. Church services are exempt from this limit, but social distancing is required between household groups. Stay safe as you worship.",228,2020-05-17 03:30:00,TweetDeck,54,14,GovernorGordon,1261861498739032064,,1081334766924754944,False,https://t.co/2fdcGKELLz,en,May,Q2
"I want to thank the Wyoming Legislature for their diligence during this historic special session. The bills that they passed will provide relief to Wyoming workers, businesses, families and communities. We will continue to work cooperatively to serve the citizens of our state.",277,2020-05-17 03:14:04,TweetDeck,58,7,GovernorGordon,1261857491089907713,,1081334766924754944,False,,en,May,Q2
"On #ArmedForcesDay we recognize and celebrate each of the branches of the U.S. military. I thank all of the men and women serving our country, as well as their families, for their service and their sacrifice.",232,2020-05-16 18:43:32,TweetDeck,29,4,GovernorGordon,1261729009030713344,,1081334766924754944,False,https://t.co/gnstiNnMRy,en,May,Q2
Looking for more data about COVID-19 in your county? The Health Department has county-specific dashboards to help you better understand what's happening with the virus where you live. Visit,237,2020-05-16 15:15:00,TweetDeck,35,10,GovernorGordon,1261676529949564930,,1081334766924754944,False,https://t.co/d2TuEk8hVi,en,May,Q2
Face coverings can help slow the spread of COVID-19 and help prevent those who may not know they have the virus from transmitting it to others. I encourage everyone to wear one when social distancing is not possible. It's a courtesy to protect your neighbors and your community.,302,2020-05-15 23:15:00,TweetDeck,1120,282,GovernorGordon,1261434938026385411,,1081334766924754944,False,https://t.co/gqp9ttb8Ws,en,May,Q2
Keep an eye out for our @wyoguard C-130s around the state today honoring our first responders and medical professionals. Estimated flyover times can be found here:,211,2020-05-15 16:37:45,TweetDeck,18,3,GovernorGordon,1261334967398862852,,1081334766924754944,False,https://t.co/G9ed5npbtd,en,May,Q2
"I have ordered all US and Wyoming flags to be lowered to half-staff statewide from sunrise to sunset on Friday, May 15, 2020 in observance of National Peace Officers Memorial Day. This day recognizes members of law enforcement who died or were injured in the line of duty.",296,2020-05-14 21:48:00,TweetDeck,74,4,GovernorGordon,1261050655818412032,,1081334766924754944,False,https://t.co/1pJXcklc6T,en,May,Q2
"I would like to clarify a point of confusion in the updated public health orders taking effect May 15. Movie theaters and performance venues may operate with more than 25 persons in attendance, by adhering to social distancing guidelines and restrictions listed in Order 1.",297,2020-05-14 17:25:35,TweetDeck,55,11,GovernorGordon,1260984617416392704,,1081334766924754944,False,https://t.co/CTrvByqFCd,en,May,Q2
"I will be holding a media briefing at 3 pm today, May 13 to discuss updated public health orders, COVID-19 testing and the special session. I will be joined by @EdBuchananWyo who will provide an update on the 2020 election season. Watch live on @WyomingPBS Youtube and Facebook.",302,2020-05-13 18:18:00,TweetDeck,10,3,GovernorGordon,1260635419860844544,,1081334766924754944,False,https://t.co/FZfZ0A2dnX,en,May,Q2
"The phased reopenings of @YellowstoneNPS and @GrandTetonNPS will help safely reawaken Wyoming’s tourism industry and get America’s economy up and going again. Their  plans, developed with local input, will help protect employees, visitors and neighboring communities",290,2020-05-13 17:45:00,TweetDeck,420,77,GovernorGordon,1260627115122122752,,1081334766924754944,False,https://t.co/pIhhduhjFy,en,May,Q2
"This is #NationalPoliceWeek, a week when we celebrate the bravery and selflessness of law enforcement officers who keep our communities safe. I want to thank our local, state and federal officers for their service to the people of Wyoming.",263,2020-05-11 19:58:15,TweetDeck,33,4,GovernorGordon,1259935875661692928,,1081334766924754944,False,https://t.co/jrnKu9oz4c,en,May,Q2
"I want to wish all the moms and grandmothers across Wyoming a Happy Mother's Day. Mothers teach us patience, kindness, and how to love unconditionally. We should recognize all they do every day.",218,2020-05-10 15:51:24,TweetDeck,79,4,GovernorGordon,1259511363392569345,,1081334766924754944,False,https://t.co/jKWzBiXq04,en,May,Q2
"Wyoming counties and our public health laboratory currently have adequate supplies to expand testing. Please don’t avoid testing out of fear. By identifying cases, we can help control outbreaks and prevent community spread. That’s good for all of us.",274,2020-05-09 15:30:00,TweetDeck,56,16,GovernorGordon,1259143590707675138,,1081334766924754944,False,https://t.co/uVoOEnufdl,en,May,Q2
Most Wyoming counties have now received variances from our current public health orders. This flexibility comes with responsibility-- practice social distancing and adhere to the guidance businesses are putting in place. This is how we will stay healthy and reawaken our economy.,303,2020-05-09 01:09:15,Twitter for iPhone,47,6,GovernorGordon,1258926978029084673,,1081334766924754944,False,https://t.co/Nh9kkTzZp4,en,May,Q2
"We will be sharing additional details on the next phase of Wyoming's transition at a media briefing at 3pm today, which will be streamed live on @WyomingPBS Facebook and Youtube. In the meantime, remember that most Wyoming businesses can operate without restrictions.",291,2020-05-07 14:46:01,TweetDeck,46,17,GovernorGordon,1258407746250125312,,1081334766924754944,False,https://t.co/ctrlmqx3JT,en,May,Q2
Wyoming counties and our Department of Health continue to work quickly to grant variances to our public health orders where appropriate based on local data. We will continue to updated this graphic as additional county-level variances are granted.,271,2020-05-06 19:23:10,TweetDeck,18,8,GovernorGordon,1258115103817437184,,1081334766924754944,False,https://t.co/rRWeyhaDpU,en,May,Q2
It’s #NationalNursesDay and I want to express my appreciation to all Wyoming nurses and healthcare workers for their tireless commitment throughout this pandemic. Thank you for going above and beyond during this unprecedented time to serve our communities and protect lives.,298,2020-05-06 15:16:13,TweetDeck,72,11,GovernorGordon,1258052957871931394,,1081334766924754944,False,https://t.co/fJE0RknGvz,en,May,Q2
"Today is the National Day of Awareness for Missing and Murdered Indigenous Women and Girls. I am proud of the efforts Wyoming has made to address this issue, including the passage of legislation to improve data collection and implement an Amber Alert system for our tribes.",273,2020-05-06 01:13:25,Twitter for iPhone,126,18,GovernorGordon,1257840861699690496,,1081334766924754944,False,,en,May,Q2
"As Wyoming’s state public health orders are eased, variances have been granted to some counties based on local health data. The Department of Health is continuing to review additional requests. More details here:",260,2020-05-05 22:43:23,TweetDeck,39,14,GovernorGordon,1257803103115624458,,1081334766924754944,False,https://t.co/3G0byefmaQ,en,May,Q2
I signed a proclamation and flexed today in honor of Teacher Appreciation Week. Our Wyoming teachers have shown tremendous flexibility and dedication to educating our youth during this challenging time. Every one of them is making a difference. #TeacherAppreciationWeek,293,2020-05-05 15:32:42,TweetDeck,101,16,GovernorGordon,1257694719464943618,,1081334766924754944,False,https://t.co/G9QzgAI0XA,en,May,Q2
The @CDCgov conducted a special testing study of 46 patients and 172 staff members at the Wyoming State Hospital in Evanston and found no new cases of COVID-19. Kudos to our WSH hospital staff for their vigilance.,237,2020-05-04 18:47:34,TweetDeck,103,13,GovernorGordon,1257381370843848709,,1081334766924754944,False,https://t.co/wRrX9qYmme,en,May,Q2
"This program, which is part of the CARES Act, provides up to 39 weeks of Unemployment Insurance benefits for those who are self-employed, independent contractors, gig economy workers, those who have exhausted their regular and extended benefits and others.",280,2020-05-04 16:08:08,Twitter Web App,21,6,GovernorGordon,1257341249775898626,,1081334766924754944,False,https://t.co/soWPJe2DZm,en,May,Q2
"May is Mental Health Awareness Month. During these challenging times, it's important to prioritize your mental health, recognize that you are not alone, and offer support to others living with mental health conditions. #MentalHealthAwarenessMonth",270,2020-05-01 16:55:00,TweetDeck,41,9,GovernorGordon,1256265878162857991,,1081334766924754944,False,https://t.co/BUTELbxre8,en,May,Q2
"Wyoming's new public health orders go into effect today as we ease some of our restrictions. Operations of personal service businesses, gyms and childcare centers will be different during this time. I want to thank our businesses for adapting as we work to keep our citizens safe",303,2020-05-01 14:19:43,TweetDeck,82,27,GovernorGordon,1256226800491003906,,1081334766924754944,False,https://t.co/ZwpXqr6NS5,en,May,Q2
We reported 8 new cases of COVID-19 today. Nearly two-thirds of the state's confirmed cases have fully recovered. The 14-day self-quarantine directive will now expire on May 8 and camping at State Parks campgrounds will begin to open on May 15 for Wyoming residents only.,295,2020-04-29 23:40:00,TweetDeck,89,25,GovernorGordon,1255643026715815937,,1081334766924754944,False,https://t.co/Vu9qthPX0d,en,April,Q2
"I will be holding a media briefing at 4 pm today, April 28, to provide an update on modified orders allowing gyms, barber shops, hair salons and other personal care services to reopen May 1. Watch live on @WyomingPBS TV, YouTube and Facebook.",266,2020-04-28 21:15:21,TweetDeck,63,15,GovernorGordon,1255244232580911104,,1081334766924754944,False,https://t.co/BoqAc1wFs5,en,April,Q2
The next round of federal Paycheck Protection Program funding is now available. I urge all small businesses to work with their local lenders and apply for these @SBAgov loans as quickly as possible. Visit  for additional information,255,2020-04-27 15:16:02,TweetDeck,47,15,GovernorGordon,1254791420063465472,,1081334766924754944,False,https://t.co/J0zoYMTSJA,en,April,Q2
"As we begin to modify some of our public health orders, it's important to remember there will be a new ""normal"".  #NewNormal",148,2020-04-26 19:30:00,TweetDeck,82,28,GovernorGordon,1254492945585254406,,1081334766924754944,False,https://t.co/41GsmZLTNj,en,April,Q2
Congratulations to @wyo_football players @ljw21 and @cassh7mula who were selected in the @NFL draft by the @Bengals and @Patriots respectively. Congrats as well to @TyHall_ who signed with the @AtlantaFalcons. I know you’ll all represent Wyoming well.,251,2020-04-26 15:21:07,Twitter for iPhone,433,35,GovernorGordon,1254430314111234049,,1081334766924754944,False,,en,April,Q2
"The health of our communities must come first as we look to ease restrictions. We are eager to invigorate our economy, but we are taking a measured approach. Everything won't reopen immediately and social distancing remains important as we take the next steps.",284,2020-04-25 22:00:00,TweetDeck,78,13,GovernorGordon,1254168307218952201,,1081334766924754944,False,https://t.co/e7gCmDMCHD,en,April,Q2
Wyoming is relying on six metrics to guide our transition towards easing restrictions.  As I’ve said many times before– our transition will be gradual with incremental steps. Our goal is to minimize public health risks and prevent clusters of new cases.,277,2020-04-25 16:00:00,TweetDeck,68,21,GovernorGordon,1254077710554533900,,1081334766924754944,False,https://t.co/1vetYX6bqp,en,April,Q2
"We saw a spike in confirmed cases today in Fremont County. With additional supplies, the state's public health lab has expanded testing. Remember to wear a mask for the protection of others– COVID-19 can be transmitted even when you are not showing symptoms.",282,2020-04-24 22:29:05,TweetDeck,55,16,GovernorGordon,1253813238761914368,,1081334766924754944,False,https://t.co/2laoRYluys,en,April,Q2
"I recognize Wyomingites' desire to get back to work. But Mr. Hurt's story is a reminder of why our orders were put in place.
""You have to take it very serious, because I guarantee you don’t want to be in a situation I was in, or feel the way I do now.""",276,2020-04-24 19:30:41,TweetDeck,91,13,GovernorGordon,1253768342520893452,,1081334766924754944,False,https://t.co/PUx6TTkwrX,en,April,Q2
"I want to thank Director General Alex Fan of the Taipei Economic and Cultural Office (TECO) for the donation of 50,000 medical face masks from Taiwan to Wyoming. We will be distributing those masks soon to where they are needed most.",257,2020-04-23 22:19:48,TweetDeck,296,23,GovernorGordon,1253448514161594370,,1081334766924754944,False,https://t.co/1rjVatk8J4,en,April,Q2
"I will be holding a media briefing at 3 pm today, April 23, to discuss the state's response to COVID-19 and plans going forward. Watch live on @WyomingPBS Facebook, YouTube and television.",212,2020-04-23 16:00:01,TweetDeck,50,15,GovernorGordon,1253352937935368197,,1081334766924754944,False,https://t.co/QrsBZuii9X,en,April,Q2
