Tweets,Length,Date,Source,Favourites,RTs,Username,id_str,in_reply_to_user_id,user_id,isRT,tco,Language,Month,Quarter
I will deliver my 2020 State of the State address to a Joint Session of the Wyoming Legislature at 10 am on Monday. The speech may be viewed here:,170,2020-02-09 17:15:00,TweetDeck,15,3,GovernorGordon,1226555105916289024,,1081334766924754944,False,https://t.co/FRt1CTTzTO,en,February,Q1
"I had a wonderful conversation with Craig Blumenshine on a wide range of topics for ""Capitol Outlook"" today. The interview will air on @WyomingPBS at 7:30 pm on Friday.",192,2020-02-05 22:18:00,TweetDeck,11,3,GovernorGordon,1225181806959325185,,1081334766924754944,False,https://t.co/YXUL0axgo2,en,February,Q1
"At this time, no reported or suspected cases of Novel Coronavirus have been identified in Wyoming and the risk to Wyoming residents from this virus remains low.",184,2020-02-04 23:09:11,TweetDeck,10,1,GovernorGordon,1224832300569055234,,1081334766924754944,False,https://t.co/phCWwiLBt5,en,February,Q1
Please drive carefully today if you're headed out and watch out for plow trucks. Roads are slick around the state.,138,2020-02-03 19:17:36,TweetDeck,7,1,GovernorGordon,1224411633553940481,,1081334766924754944,False,https://t.co/hkWab512hA,en,February,Q1
"The Governor's Invasive Species Initiative will meet on Monday, February 3 in Casper. Terrestrial invasive species are a significant threat to Wyoming’s forests, rangelands and agricultural lands.",244,2020-01-30 20:46:02,TweetDeck,8,2,GovernorGordon,1222984335822901254,,1081334766924754944,False,https://t.co/9nQQUdjC3i,en,January,Q1
"Today @POTUS signed the #USMCA trade agreement. With Canada being Wyoming's largest export market, this deal is a win for Wyoming farmers, ranchers and businesses.",187,2020-01-29 16:45:00,TweetDeck,26,6,GovernorGordon,1222561289991413761,,1081334766924754944,False,https://t.co/PqBdvuWH5B,en,January,Q1
"I'll be hosting listening sessions in Rawlins, Pinedale, Kemmerer and Rock Springs on Saturday, Feb. 1, to engage with citizens and local officials about my Migration Corridor Executive Order. We can both protect wildlife and support our economy.",294,2020-01-28 17:00:34,TweetDeck,19,3,GovernorGordon,1222202818574147586,,1081334766924754944,False,https://t.co/Yd7yQH6lI2,en,January,Q1
"Today is International Holocaust Remembrance Day and the 75th anniversary of the liberation of the Auschwitz. May we never forget. 
""For the dead and the living we must bear witness."" Elie Wiesel",219,2020-01-27 15:58:36,TweetDeck,25,11,GovernorGordon,1221824838303715328,,1081334766924754944,False,https://t.co/VvdF4Exv0t,en,January,Q1
Great to meet barrel racer extraordinaire @PedoneRyann at the @NationalWestern stock show today.,120,2020-01-26 04:18:46,Twitter for iPhone,15,0,GovernorGordon,1221286331248103426,,1081334766924754944,False,https://t.co/NughQbR8Dp,en,January,Q1
Thanks to Pine Bluffs Elementary School for hosting @jillian4supt and I last night during your Hour of Code event. Computer science is part of the core knowledge and skills that young students will employ for a lifetime.,220,2020-01-22 17:14:56,Twitter Web App,14,2,GovernorGordon,1220032108678340608,,1081334766924754944,False,,en,January,Q1
The ports of the United States of America are for all the commerce of the United States of America. We stand today to ensure reasonable access to that foreign trade for all of Wyoming’s and Montana’s products and those of the other states without access to ports.,263,2020-01-21 18:24:35,Twitter Web App,8,3,GovernorGordon,1219687248419074048,1.081334766924755e+18,1081334766924754944,False,,en,January,Q1
A de facto blockade limiting the citizens of any state to participate in interstate and international commerce cannot be arbitrarily imposed by another. Congress has the sole authority to regulate trade.,203,2020-01-21 18:24:35,Twitter Web App,13,3,GovernorGordon,1219687247529811969,1.081334766924755e+18,1081334766924754944,False,,en,January,Q1
This is an effort to protect all the rights of states as guaranteed under the Constitution -- all rights including those that pertain to commerce.  It is neither a political battle nor an attempt to ride roughshod over the legitimate rights of states to manage their own affairs,278,2020-01-21 18:24:34,Twitter Web App,4,1,GovernorGordon,1219687246464528386,1.081334766924755e+18,1081334766924754944,False,,en,January,Q1
Our Constitution was written to ensure that interior states have access to foreign markets through our coastal sister states. Today we are defending Wyoming’s and Montana’s right to utilize American port and rail infrastructure for its products.,245,2020-01-21 18:24:34,Twitter Web App,3,1,GovernorGordon,1219687245583699968,1.081334766924755e+18,1081334766924754944,False,,en,January,Q1
"I did not make this decision rashly or lightly– vital state and economic interests are at stake. This case is about the right of states to conduct commerce, a question as old as our Constitution.",195,2020-01-21 18:24:34,Twitter Web App,3,1,GovernorGordon,1219687244719673345,1.081334766924755e+18,1081334766924754944,False,,en,January,Q1
"This morning, in a joint filing with the State of Montana, Wyoming has asked the Supreme Court of the United States to review the decision by the state of Washington to deny the Millennium Bulk coal terminal permit.",239,2020-01-21 18:24:34,Twitter Web App,28,4,GovernorGordon,1219687243750739968,,1081334766924754944,False,https://t.co/VyIvsmt7Zx,en,January,Q1
On Martin Luther King Jr. Day we honor the contributions of the great civil rights leader who challenged Americans to live up to the ideals enshrined in our Constitution. I encourage all Wyomingites to embrace his optimism and celebrate his legacy through volunteerism.,293,2020-01-20 14:00:01,TweetDeck,28,5,GovernorGordon,1219258279244812289,,1081334766924754944,False,https://t.co/6kv3QFYekP,en,January,Q1
I'm pleased that the Senate has approved the #USMCA trade agreement. This is a win for Wyoming's farmers and ranchers and will help boost export sales for businesses in our state.,179,2020-01-16 20:15:13,TweetDeck,12,2,GovernorGordon,1217903152571338752,,1081334766924754944,False,,en,January,Q1
"The  Phase 1 trade agreement with China signed by @POTUS today will benefit Wyoming exporters, including the trona, petroleum and agriculture industries. It also may open doors for Wyoming technology companies to enhance international partnerships.",248,2020-01-15 20:26:36,TweetDeck,1401,317,GovernorGordon,1217543626282192896,,1081334766924754944,False,,en,January,Q1
"It was great to chat with @SloanDickey, Dallas Laird and Frank Chapman about the state budget and other topics during a taping of “Report to Wyoming” today.",180,2020-01-14 20:41:54,Twitter for iPhone,9,1,GovernorGordon,1217185091140685824,,1081334766924754944,False,https://t.co/fHk2gj8qh6,en,January,Q1
"The U.S. Census Bureau is hiring. Census employees will help ensure a complete, accurate count in Wyoming. This is critical to ensuring our state gets its proper share of federal funding.  #Census2020",247,2020-01-14 00:15:00,TweetDeck,6,2,GovernorGordon,1216876330140094465,,1081334766924754944,False,https://t.co/H7Eya1MKOB,en,January,Q1
The @WhiteHouse announcement seeking to modernize National Environmental Policy Act #NEPA regulations is an important step towards ensuring decisions on the ground can be made in a timely manner. My full statement is here:,246,2020-01-09 22:38:25,TweetDeck,679,170,GovernorGordon,1215402472820412416,,1081334766924754944,False,https://t.co/sbzS1cNhCh,en,January,Q1
Thank you to all law enforcement officers in Wyoming and around the country for your dedication to serving the public.,142,2020-01-09 16:26:29,TweetDeck,5,2,GovernorGordon,1215308872241442816,,1081334766924754944,False,https://t.co/I8vDpNz2mX,en,January,Q1
