Tweets,Length,Date,Source,Favourites,RTs,Username,id_str,in_reply_to_user_id,user_id,isRT,tco,Language,Month,Quarter
"Today marks the 50th anniversary of Earth Day, and Wyoming has a lot to celebrate. We must continue to support responsible stewardship of our natural resources and protect the health of our state's wild lands and open spaces.",249,2020-04-22 22:28:58,TweetDeck,131,8,GovernorGordon,1253088435138674690,,1081334766924754944,False,https://t.co/bVgqBolHZr,en,April,Q2
I joined @TeamCavuto today on @FoxNews to talk about the plunge in oil prices and Wyoming’s COVID-19 response.,134,2020-04-22 02:25:12,Twitter for iPhone,31,8,GovernorGordon,1252785497421656065,,1081334766924754944,False,https://t.co/e3hiXLBO4G,en,April,Q2
Data reviewed today by the Wyoming Department of Health revealed some duplication in counting the number of tests completed and we have adjusted that number. Our hearts go out to the family in Fremont County that lost loved ones yesterday to this deadly disease. #StayHomeStaySafe,304,2020-04-21 23:55:27,Twitter Web App,44,14,GovernorGordon,1252747810065321984,,1081334766924754944,False,https://t.co/4za62CVWIB,en,April,Q2
"3/3 I continue to communicate regularly with Tribal leadership regarding both State and tribal strategies for handling the mounting challenges posed by COVID-19.  The Tribes and State must coordinate our response for the health of Wyoming citizens, as we are all in this together.",280,2020-04-21 21:59:18,Twitter Web App,35,7,GovernorGordon,1252718578488406017,1.081334766924755e+18,1081334766924754944,False,,en,April,Q2
"2/3 as both the Northern Arapaho and Eastern Shoshone Tribes took advanced protective measures early on, including an aggressive testing strategy. I want to commend each of the sovereign nations for taking those early steps for the safety of Wind River Reservation communities.",277,2020-04-21 21:59:17,Twitter Web App,35,8,GovernorGordon,1252718577683030016,1.081334766924755e+18,1081334766924754944,False,,en,April,Q2
"1/3 I want to extend my condolences to the Northern Arapaho Tribe and to the families of the four individuals that passed away last night due to COVID-19. These deaths highlight the insidious nature of the illness,",214,2020-04-21 21:59:17,Twitter Web App,71,13,GovernorGordon,1252718576894500866,,1081334766924754944,False,,en,April,Q2
,23,2020-04-21 15:55:28,TweetDeck,147,17,GovernorGordon,1252627019646423040,,1081334766924754944,False,https://t.co/29DBTDglcq,en,April,Q2
"We all want our businesses and workers to be able to thrive again. But, we must be deliberate about our process. COVID-19 can spread easily, even among people without symptoms. We are working on a plan to transition Wyoming, but social distancing must continue. #SlowTheSpread",300,2020-04-21 00:10:00,TweetDeck,109,19,GovernorGordon,1252389082908385287,,1081334766924754944,False,https://t.co/YBCc2OKmUR,en,April,Q2
I appreciate hearing these voices and I want all our citizens to know it was not an easy decision to put our public health orders in place. I recognize the incredible impact these orders have had on our state’s businesses and workers.,234,2020-04-20 20:24:04,Twitter Web App,64,8,GovernorGordon,1252332225376464896,1.081334766924755e+18,1081334766924754944,False,,en,April,Q2
We will continue to prioritize the health and well being of our residents and will take a measured approach to easing the restrictions in place. n the coming days we will release more information about the metrics we will use to forward and get our economy rolling again.,271,2020-04-20 20:24:04,Twitter Web App,65,9,GovernorGordon,1252332224550182913,1.081334766924755e+18,1081334766924754944,False,,en,April,Q2
"I met with protesters who came to the Capitol today to exercise their 1st Amendment rights to demonstrate and urge that we “reopen” Wyoming. While I disagree with their choice to violate a public health order, I nonetheless thought it was important to listen to their concerns.",301,2020-04-20 20:24:03,Twitter Web App,126,23,GovernorGordon,1252332222641733634,,1081334766924754944,False,https://t.co/EGwvgvUoUA,en,April,Q2
"While Wyoming was never shut down, our ability to transition to a new phase is dependent upon on the actions each of us takes. Maintain your social distancing efforts and limit your trips. Models suggest our peak has not arrived. #StaySafeStayHome",271,2020-04-20 01:03:22,TweetDeck,149,35,GovernorGordon,1252040125246103552,,1081334766924754944,False,https://t.co/6eXKKrTDcE,en,April,Q2
Our rural hospitals are critical to Wyoming communities and our state's economy. COVID-19 has put them under additional stress.,151,2020-04-19 19:07:56,TweetDeck,45,15,GovernorGordon,1251950676499771393,,1081334766924754944,False,https://t.co/J8Cv1wKzkG,en,April,Q2
"If the people of Wyoming continue to do the right thing, we can begin a transition. We are now developing a plan for that transition phase. Read the full press release here:",197,2020-04-17 23:52:51,Twitter Web App,28,8,GovernorGordon,1251297603058380808,1.081334766924755e+18,1081334766924754944,False,https://t.co/2gtC8WwapH,en,April,Q2
"To protect our citizens’ health, these orders will remain in effect through April 30. The transition into a new phase of recovery must be health data-driven, not date driven. What we do in the coming weeks will determine the way we can ease these orders and rekindle our economy",278,2020-04-17 23:52:51,Twitter Web App,56,12,GovernorGordon,1251297602261463042,1.081334766924755e+18,1081334766924754944,False,,en,April,Q2
"I want to thank the people of Wyoming for their work in flattening the curve, and I also want to reiterate that we are, and have been, open for business. Our existing statewide orders are consistent with Phase One of @realDonaldTrump  Guidelines for Opening Up America Again.",299,2020-04-17 23:52:50,Twitter Web App,79,29,GovernorGordon,1251297600038461440,,1081334766924754944,False,https://t.co/iA9l1WgejO,en,April,Q2
"Limiting outings is important. The more places you go, the greater opportunity there is for COVID-19 to spread. When you have to go out, only do so for essentials. #SlowTheSpread",202,2020-04-16 16:27:11,TweetDeck,72,25,GovernorGordon,1250823058929090563,,1081334766924754944,False,https://t.co/URlHW4M7Es,en,April,Q2
"Today we learned of the 2nd COVID-19 related death in Wyoming. As of today, there are 19 reported hospitalizations statewide for COVID-19. As we consider our steps moving forward, we will continue to use data to inform our decisions. #StayHomeStaySafe",275,2020-04-16 01:20:49,TweetDeck,46,14,GovernorGordon,1250594964272103430,,1081334766924754944,False,https://t.co/oITey3BxWU,en,April,Q2
"I'll be holding a media briefing at 4 p.m. today, April 15 to provide an update on Wyoming’s ongoing response to the COVID-19 pandemic. It can be viewed live on Wyoming PBS TV, their Facebook page and YouTube channel.",241,2020-04-15 19:09:09,TweetDeck,40,9,GovernorGordon,1250501433302147072,,1081334766924754944,False,https://t.co/UuGP5YISe7,en,April,Q2
Our case numbers continue to rise. All communities - even those with a handful of confirmed cases - must remain diligent with social distancing and stay the course to #SlowTheSpread and make a difference in our future.,242,2020-04-15 01:04:43,Twitter for iPhone,64,21,GovernorGordon,1250228526424264704,,1081334766924754944,False,https://t.co/1VfGlMlmbr,en,April,Q2
"Wyoming's first death related to COVID-19 was reported today along with 5 new cases. We must continue to be vigilant about following public health guidance and social distancing, particularly because this disease is so dangerous to those who are most vulnerable. #StaySafeStayHome",304,2020-04-13 23:03:08,TweetDeck,46,20,GovernorGordon,1249835541203423232,,1081334766924754944,False,https://t.co/KFhBIxsTSO,en,April,Q2
"Today we honor the lineworkers who work 24-hours a day, 7-days a week to make sure we have power to our homes, businesses and hospitals. They put their lives on the line and work in harsh conditions to make sure we have this public utility. Thank you for your work.",289,2020-04-13 20:40:37,TweetDeck,107,13,GovernorGordon,1249799673910636550,,1081334766924754944,False,https://t.co/ZPnYLzMOnj,en,April,Q2
...and sadly serves as a grim reminder of the importance of following public health orders and guidance so we can reduce the number of serious illnesses and deaths in our state. Jennie and I extend our thoughts and prayers to this gentleman’s family and friends.,262,2020-04-13 18:11:37,Twitter Web App,54,9,GovernorGordon,1249762176673484802,1.081334766924755e+18,1081334766924754944,False,,en,April,Q2
"I am saddened to learn that we have lost our first Wyoming citizen to COVID-19, a Johnson County man with underlying health conditions that put him at higher risk of severe illness and complications related to the virus.  This one was close to home... 1/2",255,2020-04-13 18:11:36,Twitter Web App,130,35,GovernorGordon,1249762175897534466,,1081334766924754944,False,,en,April,Q2
"While several states reported some positive news during this morning's Governor's call with @VP, the importance of social distancing measures was reinforced- particularly for those with underlying health conditions. It's critical we stay the course. #StaySafeStayHome",291,2020-04-13 17:06:30,TweetDeck,66,13,GovernorGordon,1249745792170156035,,1081334766924754944,False,https://t.co/jyaqI3TFHF,en,April,Q2
"We have confirmed 70 new cases of COVID-19 in Wyoming in the past 7 days, and there are now confirmed cases in all but two Wyoming counties. Remember, the ""recovered"" number in parenthesis on this map includes probable cases that have recovered. More data:",304,2020-04-13 03:04:32,TweetDeck,40,15,GovernorGordon,1249533905155153922,,1081334766924754944,False,https://t.co/6Tl2r9yc1v,en,April,Q2
"In these uncertain times, may the miracle of Easter bring you renewed hope, love and joy. Jennie and I wish each of you and your families a safe and blessed holiday.",189,2020-04-12 13:21:59,TweetDeck,210,13,GovernorGordon,1249326902369644545,,1081334766924754944,False,https://t.co/16iCai1gMD,en,April,Q2
"Teton and Laramie counties continue to have the largest number of confirmed COVID-19 cases. Stay safe tomorrow—a spring snowstorm should make it easy to choose to stay home and celebrate with family. Wyoming, your efforts are making a difference. Thank you.",281,2020-04-12 03:00:47,Twitter for iPhone,75,17,GovernorGordon,1249170570576629761,,1081334766924754944,False,https://t.co/7Yl16yAShy,en,April,Q2
"This graphic offers basic info; Visit the Wyoming Department of Health website for data on demographics like age and gender of those diagnosed, along with the most common symptoms in confirmed positive cases. #StayHomeStaySafe this holiday weekend.",272,2020-04-10 22:39:08,TweetDeck,36,13,GovernorGordon,1248742335745347585,,1081334766924754944,False,https://t.co/91q0mp83sP,en,April,Q2
I had a great call with Dr. Anthony Fauci this morning. We discussed the potential for antibody testing and the need for Wyoming to have access to additional diagnostic testing materials. Dr. Fauci also praised the actions we have taken to date to #SlowtheSpread.,263,2020-04-10 18:32:46,Twitter Web App,262,51,GovernorGordon,1248680337615585280,,1081334766924754944,False,,en,April,Q2
"I have signed a proclamation declaring today a Day of Prayer in Response to the COVID-19 Pandemic. Across all faiths and beliefs, we can all come together at this time of year to find a sense of peace and purpose. #DayOfPrayer
#StayHomeStaySafe",268,2020-04-10 15:00:00,TweetDeck,124,25,GovernorGordon,1248626794191863808,,1081334766924754944,False,https://t.co/dttSAcwkHm,en,April,Q2
"As more test results return, we are learning more about how COVID-19 is spreading in Wyoming. We may have fewer confirmed cases than other states, but the illness caused by this virus is serious. A few cases in a small community can cause devastating impacts. #StayHomeStaySafe",301,2020-04-09 22:42:49,Twitter Web App,62,16,GovernorGordon,1248380877244993541,,1081334766924754944,False,https://t.co/tQr37poRiB,en,April,Q2
Wyoming's unemployment compensation fund is the healthiest in the country. Our tradition of fiscal responsibility means we will be able to continue to provide assistance to our workers when they need it most.,232,2020-04-09 18:36:37,Twitter Web App,92,22,GovernorGordon,1248318916625076227,,1081334766924754944,False,https://t.co/nNYX6LD79f,en,April,Q2
"We have added data on Probable Cases. These include a total count of people who are a close contact to a laboratory confirmed COVID-19  case AND develop symptoms, but are not tested. This count includes probable cases that have recovered. More data here:",302,2020-04-08 23:15:02,TweetDeck,60,18,GovernorGordon,1248026596939894792,,1081334766924754944,False,https://t.co/6Tl2r9gB9X,en,April,Q2
"I'm holding a media briefing at 1 p.m. today, April 8, to provide updates on COVID-19 in Wyoming and the resources available to help workers and businesses. You can watch live on my Facebook page, Wyoming PBS television and .",248,2020-04-08 16:47:35,TweetDeck,23,13,GovernorGordon,1247929091912851456,,1081334766924754944,False,https://t.co/XsLydK0F6g,en,April,Q2
"We have now added recovered cases in each county along with the total number of confirmed positive cases.  For those seeking more information, additional data is available on the Wyoming Health Department's COVID-19 webpage. #StayHomeStaySafe",266,2020-04-07 23:28:59,TweetDeck,65,23,GovernorGordon,1247667717991288834,,1081334766924754944,False,https://t.co/qmhdA5o7rh,en,April,Q2
We will be adding additional information to this overview in the near future. Remember that testing supplies remain limited and this is not a complete picture of the presence of COVID-19 statewide. #StayHomeStaySafe,264,2020-04-07 01:15:26,Twitter for iPhone,37,10,GovernorGordon,1247332118687928320,,1081334766924754944,False,https://t.co/6Tl2r9yc1v,en,April,Q2
The Wyoming Department of Health is supporting a CDC recommendation to wear cloth face coverings if you need to go out in the community in order to help slow the spread of COVID-19. This is not a replacement for social distancing. Guidelines here:,271,2020-04-06 22:04:36,TweetDeck,38,18,GovernorGordon,1247284097107529729,,1081334766924754944,False,https://t.co/xjexhwMh35,en,April,Q2
"Our Unemployment Office is working quickly to implement expanded benefits available under the CARES Act. These include an extension of regular unemployment, additional funding for those eligible, and the expansion of benefits for self-employed or contract employees.",290,2020-04-06 17:42:26,TweetDeck,23,6,GovernorGordon,1247218117270478848,,1081334766924754944,False,https://t.co/7Tm6qMQqWB,en,April,Q2
"Wyoming recorded it's 200th confirmed case of COVID-19 today, but we know that there are many more untested Wyomingites who have the virus. Keep yourself and your family safe and our healthcare workers protected by staying home and social distancing. #StayHomeStayHealthy",295,2020-04-06 01:52:21,TweetDeck,90,29,GovernorGordon,1246979023038603265,,1081334766924754944,False,https://t.co/Ubl9IBo9hp,en,April,Q2
The First Lady and I want you to know what we're doing to keep our people safe and our communities functioning as best they can during these challenging times.,183,2020-04-06 00:05:00,TweetDeck,46,6,GovernorGordon,1246952006482194432,,1081334766924754944,False,https://t.co/RJrrvn9PMC,en,April,Q2
"Lincoln County has its first confirmed case. With warming temperatures this weekend, it's important to remember to stay vigilant and keep your distance as you enjoy some fresh air. #staysafe",214,2020-04-04 01:31:03,TweetDeck,58,16,GovernorGordon,1246248888148713472,,1081334766924754944,False,https://t.co/Zg0ySqRLAQ,en,April,Q2
Now is not the time to travel to Wyoming. We are focused on protect the health of our citizens and the resources of our rural healthcare facilities. Stay home and stay safe.,197,2020-04-03 20:35:35,Twitter Web App,40,19,GovernorGordon,1246174529459757062,1.081334766924755e+18,1081334766924754944,False,https://t.co/qBcqZGCc6W,en,April,Q2
I have also issued a directive requiring any individual coming to Wyoming for a non-work-related purpose to immediately self-quarantine for 14 days. Visitors from neighboring states have strained the resources of our communities and put public health at risk.,259,2020-04-03 20:35:35,Twitter Web App,54,19,GovernorGordon,1246174528671232000,1.081334766924755e+18,1081334766924754944,False,,en,April,Q2
I have extended the three existing statewide health orders through April 30 to slow community transmission of COVID-19. I want to be perfectly clear- we want all Wyoming residents to stay at home. Our focus is on improving compliance and adherence. That is how we will save lives.,280,2020-04-03 20:35:34,Twitter Web App,88,35,GovernorGordon,1246174527886897152,,1081334766924754944,False,,en,April,Q2
"At 3 p.m. today, April 3, I am holding a press conference to provide an update on Wyoming's response to COVID-19 and outline what we are doing next to keep Wyomingites safe. You can watch here on Facebook or on Youtube at .",270,2020-04-03 16:00:00,TweetDeck,54,27,GovernorGordon,1246105176366252032,,1081334766924754944,False,https://t.co/5QQODg9sNb,en,April,Q2
"We continue to monitor the spread of COVID-19 closely and now have confirmed cases in 16 Wyoming counties as well as additional recovered cases. By staying home and avoiding gatherings, we can #SlowTheSpread and save lives.",247,2020-04-03 00:56:04,Twitter for iPhone,36,16,GovernorGordon,1245877695080099841,,1081334766924754944,False,https://t.co/vZ2BTruhfF,en,April,Q2
"Please note, the number of tests does not include all negative results from private laboratories. COVID-19 will continue to spread and doesn't discriminate according to age or overall health. But we know staying home and social distancing will help #SlowTheSpread",287,2020-04-02 00:57:04,Twitter for iPhone,48,12,GovernorGordon,1245515558264528897,,1081334766924754944,False,https://t.co/ALqFAY0fkY,en,April,Q2
"I signed a proclamation declaring today #CensusDay Now more than ever, it's critical that each of us in Wyoming is counted. Census results help determine how billions of dollars in funding flow into Wyoming communities each year. .",278,2020-04-01 23:01:12,TweetDeck,25,3,GovernorGordon,1245486399178117123,,1081334766924754944,False,https://t.co/BE7EnyTLF1,en,April,Q2
"It's #CensusDay2020! While staying at home today, I encourage each of you to respond and ensure we get an accurate count. 
Census results help determine how billions of dollars in federal funding flow into Wyoming communities each year.",284,2020-04-01 15:10:00,TweetDeck,37,16,GovernorGordon,1245367818255831042,,1081334766924754944,False,https://t.co/rzj18gpCOS,en,April,Q2
"As we see more confirmed cases, its critical we continue to limit public contact as much as possible. Your actions don't just impact you, they impact the people around you.  Thank you to all Wyomingites who are doing your part. #StayHomeStaySafe",269,2020-04-01 01:00:57,TweetDeck,119,32,GovernorGordon,1245154147617222656,,1081334766924754944,False,https://t.co/K4VdquMNVz,en,April,Q2
I took questions and heard your concerns about #COVID19 during an @AARPWY TeleTown Hall today.  I'm grateful that so many of our state's older residents are so engaged on this critical issue.,215,2020-03-31 23:15:00,TweetDeck,47,3,GovernorGordon,1245127484221165568,,1081334766924754944,False,https://t.co/80Z7fiCXPm,en,March,Q1
▶️We have updated info on  including an FAQ for Wyoming citizens and additional links to resources developed from our 5 COVID-19 task forces. #StayHome,174,2020-03-31 17:07:00,TweetDeck,21,14,GovernorGordon,1245034874026766337,,1081334766924754944,False,https://t.co/eRcuaJGPqQ,en,March,Q1
"We will continue to closely monitor the operations of our state parks to ensure visitor safety, and may take additional action if our health officials deem it necessary.",193,2020-03-31 16:36:53,Twitter Web App,21,8,GovernorGordon,1245027296920166401,,1081334766924754944,False,https://t.co/Yg0ENQuo2F,en,March,Q1
"#COVID19 case numbers have tripled in a week, a result of both increased testing and increased disease. The public health orders and social distancing measures we've put in place will help, if they are followed. It's up to you Wyoming- together, we can #slowthespread",291,2020-03-31 01:05:35,TweetDeck,121,35,GovernorGordon,1244792925529096192,,1081334766924754944,False,https://t.co/HmGtayXGEl,en,March,Q1
"In an hour (3:30 pm), I will hold a media briefing to provide updates on Wyoming's #COVID19 response. Watch live on the @WyomingPBS Facebook page or on YouTube",183,2020-03-30 20:30:01,TweetDeck,18,6,GovernorGordon,1244723576634134528,,1081334766924754944,False,https://t.co/keBQfdkNEq,en,March,Q1
Thank you to these volunteers and others around the state who are stepping up to support our healthcare workers.,136,2020-03-30 14:58:12,TweetDeck,95,21,GovernorGordon,1244640072919658497,,1081334766924754944,False,https://t.co/VyFVNQOuGm,en,March,Q1
"Additional collection kits were distributed last week, but testing is still limited nationally and in Wyoming. It's important for Wyomingites to understand this is not a complete picture of the prevalence of COVID-19 in our state. Stay safe, stay home, practice #SocialDistancing",303,2020-03-30 02:38:48,TweetDeck,93,32,GovernorGordon,1244453997282385921,,1081334766924754944,False,https://t.co/bvu5ebqAwI,en,March,Q1
"It's critical we limit person-to-person contact over the coming weeks. Extended families need to practice #socialdistancing as well. Delay gatherings with extended family. If you are delivering food or supplies to loved ones, you can protect them by staying 6 feet apart.",295,2020-03-29 19:19:12,TweetDeck,60,28,GovernorGordon,1244343367535718400,,1081334766924754944,False,https://t.co/nE5ZW3O4c5,en,March,Q1
"The First Lady and I want to talk with you about how social distancing and staying home is going to help save lives. We're all in this together, Wyoming.",177,2020-03-29 00:36:11,Twitter for iPhone,59,26,GovernorGordon,1244060752849195008,,1081334766924754944,False,https://t.co/Efwscdabb0,en,March,Q1
We are continuing to see more test results return and a corresponding rise in the number of confirmed cases. Help #SlowTheSpread  by staying home whenever possible. For county-by-county statistics visit,250,2020-03-28 03:02:50,Twitter Web App,49,26,GovernorGordon,1243735270836453376,,1081334766924754944,False,https://t.co/6Tl2r9yc1v,en,March,Q1
"This is how we can save lives and protect people’s health.  I also understand the ongoing strain these measures are having on businesses, workers and Wyoming communities but it is critical each of us takes these steps now.",222,2020-03-27 19:58:28,Twitter Web App,49,18,GovernorGordon,1243628475136819201,1.081334766924755e+18,1081334766924754944,False,,en,March,Q1
I am extending the three statewide health orders through April 17 to #slowthespread of community transmission of COVID-19. It is imperative we all respond to this public health crisis by staying home whenever possible and practicing proper social distancing when they must go out.,280,2020-03-27 19:58:28,Twitter Web App,99,48,GovernorGordon,1243628474281209858,,1081334766924754944,False,,en,March,Q1
"The number of counties with confirmed cases has increased, a reminder that COVID-19 will impact all of us. Staying home whenever possible is the best way to #SlowTheSpread We have added data on recovered cases to this graphic.",250,2020-03-27 01:38:47,TweetDeck,50,11,GovernorGordon,1243351731922034688,,1081334766924754944,False,https://t.co/sPkHPxF2Sz,en,March,Q1
"Grocery stores are an essential service that won't close. Keep in mind, #socialdistancing matters when shopping, too. Give your neighbors space and don't go out if you are sick. Actions like these help #slowthespread. #COVID19WY",252,2020-03-26 22:30:00,TweetDeck,80,30,GovernorGordon,1243304220134170628,,1081334766924754944,False,https://t.co/6lnrkuyS7x,en,March,Q1
"I applaud this decision, as well as the cooperation of the utility companies, for working together to help Wyoming's people during this difficult time.",175,2020-03-26 20:52:00,TweetDeck,34,9,GovernorGordon,1243279560365477917,,1081334766924754944,False,https://t.co/mQ0ilOt5MX,en,March,Q1
"As our state's testing capacity expands and more results come in from commercial labs, we expect confirmed cases to rise. The steps we are urging all Wyomingites to take– staying home and practicing social distancing – are what will help mitigate the impacts in the weeks to come.",304,2020-03-26 02:49:39,Twitter Web App,72,29,GovernorGordon,1243007178044104707,,1081334766924754944,False,https://t.co/9P00wex1Cz,en,March,Q1
"Now is not the time to be evicting individuals who may have recently become unemployed. It’s important for us all to work together and support one-another during these difficult times. If you are struggling, Wyoming 211 has a list of statewide resources.",278,2020-03-26 02:06:15,Twitter Web App,41,8,GovernorGordon,1242996256307204097,1.081334766924755e+18,1081334766924754944,False,https://t.co/Z1IUKXVeCI,en,March,Q1
I have been contacted by many constituents who are concerned that they may be facing eviction proceedings as the end of the month approaches. I urge our state’s landlords to exercise maximum flexibility with your tenants when it comes to rent payments.,252,2020-03-26 02:06:15,Twitter Web App,83,22,GovernorGordon,1242996255527059456,,1081334766924754944,False,,en,March,Q1
