Tweets,Length,Date,Source,Favourites,RTs,Username,id_str,in_reply_to_user_id,user_id,isRT,tco,Language,Month,Quarter
"During the COVID-19 pandemic, many individuals and businesses have taken on new tasks to fight the virus. Kansans' dedication to finding innovative ways to help others is one of many reasons I am proud to be governor of this great state.",261,2020-04-29 20:17:21,Twitter Web App,60,11,GovLauraKelly,1255592027074572289,,1040058893907513344,False,https://t.co/HGLxppQ5zc,en,April,Q2
Don't forget to tune in at 2 p.m. CST for my daily press briefing to hear updates on COVID-19 in Kansas. Watch it live on Facebook at .,158,2020-04-29 17:40:20,Twitter Web App,41,18,GovLauraKelly,1255552513710919680,,1040058893907513344,False,https://t.co/ul1Motem2v,en,April,Q2
"A new website for resources regarding COVID-19 is now live. The site is a centralized place for Kansans seeking information as the state responds to the COVID-19 pandemic. The site is ADA compliant, mobile optimized and will be available in Spanish.",273,2020-04-29 13:25:36,Twitter Web App,62,35,GovLauraKelly,1255488404449628160,,1040058893907513344,False,https://t.co/XHwzCMGHzo,en,April,Q2
"When Kansas became the first state to close school buildings for the rest of the school year, our teachers stepped up. All KS teachers deserve heartfelt thanks and support for their incredible work as they navigate this ""new normal"" in our education system.",280,2020-04-28 17:56:43,Twitter for iPhone,406,47,GovLauraKelly,1255194244962299904,,1040058893907513344,False,https://t.co/D0M4c8fw0k,en,April,Q2
"My daily COVID-19 press briefing for today, April 28, has been canceled. Daily briefings will resume tomorrow, Wednesday, April 29, at the regular time of 2 p.m. CST. I would like to thank all Kansans for regularly tuning in to these briefings, staying informed and staying safe.",279,2020-04-28 16:00:09,Twitter Web App,451,41,GovLauraKelly,1255164910675415041,,1040058893907513344,False,,en,April,Q2
"Today we mourn the loss of artist Richard Bergen. He created Ad Astra, the statue of a Native American hunter atop the Statehouse. Ad Astra’s bow, pointed at the North Star, reminds us of our motto “Ad Astra Per Aspera - to the stars through difficulties.”",280,2020-04-27 20:50:09,Twitter Web App,380,64,GovLauraKelly,1254875503347019778,,1040058893907513344,False,https://t.co/lTnjl9adOe,en,April,Q2
"The State of Kansas' new and comprehensive COVID-19 online resource center is now live. Visit  for the latest news, information and resources related to unemployment assistance, business, agriculture, COVID-19 data and more. #ksleg",278,2020-04-27 20:33:12,Twitter Web App,65,43,GovLauraKelly,1254871240160030728,,1040058893907513344,False,https://t.co/zCwxLFU7nh,en,April,Q2
"My regularly scheduled press briefing to discuss the latest updates regarding COVID-19 for today, April 27, 2020, has been moved to 2:30 p.m. CST. Please visit my Facebook page at 2:30 p.m. to see the live broadcast.",240,2020-04-27 17:46:57,Twitter Web App,55,11,GovLauraKelly,1254829401948205057,,1040058893907513344,False,https://t.co/yp40cnqCFj,en,April,Q2
ICYMI: Last week I appointed Lori Dougherty-Bichsel to fill the 3rd Judicial District court vacancy created when former Chief Judge Evelyn Wilson was appointed to the KS Supreme Court. Lori is a dedicated public servant who will serve Shawnee Co. &amp; KS well.,284,2020-04-27 17:12:10,Twitter Web App,26,3,GovLauraKelly,1254820646451908608,,1040058893907513344,False,https://t.co/3FGYkZXsOv,en,April,Q2
"Today I sent a letter to members of Kansas’ federal delegation commending them for supporting the latest coronavirus emergency relief package, &amp; also conveying the urgent need for additional federal support in the form of direct, flexible state aid. #ksleg",284,2020-04-24 20:21:38,Twitter Web App,146,17,GovLauraKelly,1253781166139858945,,1040058893907513344,False,https://t.co/E5GBkHceWA,en,April,Q2
This incredible example of kindness and generosity is the epitome of what it means to be a Kansan. I am so proud to be the governor of this great state.,176,2020-04-24 17:43:55,Twitter Web App,10852,1024,GovLauraKelly,1253741474866434051,,1040058893907513344,False,https://t.co/ovrU2qeKyC,en,April,Q2
Don't forget to tune in at 2 p.m. CST for my daily press briefing to hear updates on COVID-19 in Kansas. Watch it live on Facebook at .,158,2020-04-24 17:34:01,Twitter Web App,36,5,GovLauraKelly,1253738982619439109,,1040058893907513344,False,https://t.co/ul1Motem2v,en,April,Q2
"At 8 a.m. CST Saturday morning, @CNN and @sesamestreet will host a town hall about the coronavirus for kids and parents alike. I encourage families to tune in to this wonderful program for Kansans of all ages.",233,2020-04-24 15:15:35,Twitter Web App,168,41,GovLauraKelly,1253704146341019649,,1040058893907513344,False,https://t.co/1YtKZSe7eo,en,April,Q2
"My thoughts are with the family and friends of Dave Seaton, longtime editor and publisher of the Winfield Courier. Dave was a bold advocate for his community and state, and a true Kansas newspaper icon.",226,2020-04-23 19:47:41,Twitter Web App,62,8,GovLauraKelly,1253410231859556352,,1040058893907513344,False,https://t.co/4GLUdR37zC,en,April,Q2
Don't forget to tune in at 2 p.m. CST for my daily press briefing to hear updates on COVID-19 in Kansas. Watch it live on Facebook at .,158,2020-04-23 17:55:04,Twitter for iPhone,41,7,GovLauraKelly,1253381892122062849,,1040058893907513344,False,https://t.co/ul1Motem2v,en,April,Q2
"Tune in at 11:30 a.m. CST to hear me discuss education during the COVID-19 pandemic, and reiterate the significance of our decision to be the first state to close school buildings for the remainder of the school year.",241,2020-04-23 14:21:49,Twitter Web App,49,6,GovLauraKelly,1253328226992050180,,1040058893907513344,False,https://t.co/o92KpVXwNC,en,April,Q2
Best wishes for a happy and prosperous holiday to everyone in Kansas and around the world recognizing the holy month of #Ramadan.,153,2020-04-23 13:32:09,Twitter for iPhone,420,50,GovLauraKelly,1253315729136537601,,1040058893907513344,False,https://t.co/TmCeJyB4Q3,en,April,Q2
Don't forget to tune in at 2 p.m. CST for my daily press briefing to hear updates on COVID-19 in Kansas. Watch it live on Facebook at .,158,2020-04-22 17:38:48,Twitter for iPhone,41,5,GovLauraKelly,1253015412209573896,,1040058893907513344,False,https://t.co/ul1Motem2v,en,April,Q2
"In recognition of #EarthDay, let’s all commit to protecting our planet and the natural resources of KS for future generations. We all can recognize Earth Day in some way, such as planting a tree, working in the garden, riding a bike or doing more to recycle.",282,2020-04-22 15:19:58,Twitter Web App,445,48,GovLauraKelly,1252980473611137024,,1040058893907513344,False,https://t.co/geYA9rgpIS,en,April,Q2
"Congratulations to @gsksmo on the success of its Census patch program. What started as a local effort by Girl Scouts to increase participation in the #2020Census has gone viral. Now, Scouts from 42 states and Puerto Rico have completed the patch. More:",276,2020-04-21 19:40:48,Twitter Web App,56,12,GovLauraKelly,1252683723973287938,,1040058893907513344,False,https://t.co/OknDrFTWFZ,en,April,Q2
Don't forget to tune in at 2 p.m. CST for my daily press briefing to hear updates on COVID-19 in Kansas. Watch it live on Facebook at .,158,2020-04-21 17:53:38,Twitter Web App,36,7,GovLauraKelly,1252656753868713986,,1040058893907513344,False,https://t.co/yp40cnqCFj,en,April,Q2
I sincerely appreciate the thoughtfulness of the Kansans who sent these gifts and note of thanks for the work we’re doing to keep Kansans healthy and safe. It’s also great to see the support for small businesses!,236,2020-04-21 14:53:47,Twitter for iPhone,986,41,GovLauraKelly,1252611497186021376,,1040058893907513344,False,https://t.co/e4GLR4UrRD,en,April,Q2
"ICYMI - last week @DCFKansas Secretary Laura Howard and I announced the ""Hero Relief Program,"" which expands DCF's child care assistance subsidies for families and provides financial support directly to child care providers.",248,2020-04-20 20:30:31,Twitter Web App,35,8,GovLauraKelly,1252333847930437632,,1040058893907513344,False,https://t.co/ZVKHzzvZCF,en,April,Q2
Don't forget to tune in at 2 p.m. CST for my daily press briefing to hear updates on COVID-19 in Kansas. Watch it live on Facebook at .,158,2020-04-20 18:16:37,Twitter for iPhone,35,9,GovLauraKelly,1252300152611713024,,1040058893907513344,False,https://t.co/XVq06k0wpl,en,April,Q2
"Yesterday I announced KS has received supplies and personal protective equipment to expand COVID-19 testing in Finney, Ford, Lyon &amp; Seward counties. I want to thank our federal partners for their ongoing efforts to help our state response to this pandemic.",284,2020-04-20 15:25:43,Twitter Web App,328,54,GovLauraKelly,1252257145262944257,,1040058893907513344,False,https://t.co/FX98ahFHDY,en,April,Q2
"As @KansasDOL Secretary Delia Garcia announced yesterday, the Department of Labor is moving to a new claims process called ""gating."" Kansans seeking claims will be asked to file an application for benefits and weekly claims on certain days by the first letter of their last name.",303,2020-04-17 22:03:49,Twitter for iPhone,56,24,GovLauraKelly,1251270165687345155,,1040058893907513344,False,https://t.co/aaOwsLgHNM,en,April,Q2
"If you or someone you know is at risk, contact the Kansas Children's Service League’s free help line at 1-800-CHILDREN.",119,2020-04-17 20:28:28,Twitter Web App,40,14,GovLauraKelly,1251246170900496390,1.0400588939075133e+18,1040058893907513344,False,,en,April,Q2
"April is #ChildAbusePreventionMonth - a reminder to raise awareness and empower others to help make great childhoods happen. Sadly, efforts to mitigate the spread of COVID-19 have heightened the risk of child abuse.",215,2020-04-17 20:28:28,Twitter Web App,156,46,GovLauraKelly,1251246170179022849,,1040058893907513344,False,,en,April,Q2
Don't forget to tune in at 2 p.m. CST for my daily press briefing to hear updates on COVID-19 in Kansas. Watch it live on my Facebook at .,161,2020-04-17 15:03:29,Twitter Web App,67,18,GovLauraKelly,1251164384723791875,,1040058893907513344,False,https://t.co/yp40cnIdwR,en,April,Q2
"On Wednesday I announced extension of the statewide stay-home order until May 3. I know this hasn't been easy, and we still have some difficult days ahead. But by staying home and staying safe, we can flatten the curve, save lives and beat this virus.",275,2020-04-17 13:05:36,Twitter Web App,691,114,GovLauraKelly,1251134720420786176,,1040058893907513344,False,https://t.co/sUM6Q1bASU,en,April,Q2
I encourage employees and employers looking to connect during the COVID-19 pandemic to visit . @KansasCommerce has compiled resources for employers with urgent hiring needs and information about who is hiring in Kansas.,266,2020-04-16 19:02:48,Twitter Web App,41,17,GovLauraKelly,1250862223301455873,,1040058893907513344,False,https://t.co/UnNP1fTAvW,en,April,Q2
"My regularly scheduled press briefing to discuss the latest updates regarding COVID-19 for today, April 16, 2020, has been moved to 1 p.m. Please visit my Facebook page at 1 p.m. to see the live broadcast.",229,2020-04-16 17:39:27,Twitter for iPhone,60,13,GovLauraKelly,1250841247306129410,,1040058893907513344,False,https://t.co/ul1Motem2v,en,April,Q2
"Yesterday I signed Executive Order #20-23, bringing KS adult-care homes in line with other occupational licensing exemptions issued in recent days. This order is needed to ensure adult care-home workers can continue to do their jobs during this pandemic.",278,2020-04-16 14:51:11,Twitter Web App,101,19,GovLauraKelly,1250798900908371979,,1040058893907513344,False,https://t.co/WNIXQ4b2E8,en,April,Q2
"On this week's Kansan to Kansan, my husband, Dr. Ted Daughety, talks about the importance of social distancing during the COVID-19 pandemic and offers a few ideas on ways to stay busy while at home.",222,2020-04-15 16:55:38,Twitter Web App,147,25,GovLauraKelly,1250467833697513476,,1040058893907513344,False,https://t.co/snbAO30Ao1,en,April,Q2
"Our public transit workers provide essential services to communities by making sure everyone can access food, medical supplies or other necessities. Thank you to Topeka Metro &amp; all bus drivers and public transit workers for keeping Kansans safe &amp; healthy.",287,2020-04-14 19:24:00,Twitter Web App,158,11,GovLauraKelly,1250142781978394629,,1040058893907513344,False,https://t.co/hcR1z4ylSQ,en,April,Q2
"Thank you to fellow Kansan @metheridge for helping me spread the word about the importance of staying home so we can protect ourselves, our friends and our family from COVID-19. Stay home. Stay safe. Save lives. #SaferatHome.",249,2020-04-14 16:54:35,Twitter Web App,212,32,GovLauraKelly,1250105179363475462,,1040058893907513344,False,https://t.co/oLPf4xFdie,en,April,Q2
"Yesterday I signed EO # 20-22. It lifts some weight restrictions and permitting requirements for certain motor carriers to get needed medical supplies, food shipments and other items moving through Kansas as quickly as possible.",252,2020-04-14 16:07:03,Twitter Web App,113,27,GovLauraKelly,1250093218370392064,,1040058893907513344,False,https://t.co/N1HxZQj646,en,April,Q2
"Due to new evidence that suggests some people without COVID-19 symptoms can transmit the virus before getting sick, @KDHE recommends Kansans use cloth face coverings when going out in public. For a guide to making a homemade mask, visit the following:",275,2020-04-14 13:52:53,Twitter Web App,429,149,GovLauraKelly,1250059452792930306,,1040058893907513344,False,https://t.co/msvo1aAY5U,en,April,Q2
Don't forget to tune in at 2 p.m. for my daily press briefing to hear updates on COVID-19 in Kansas. Watch it live on my Facebook at .,157,2020-04-13 17:38:56,Twitter for iPhone,66,10,GovLauraKelly,1249753954663227392,,1040058893907513344,False,https://t.co/ul1Motem2v,en,April,Q2
"Thanks to all who participated this weekend in the #KansasEggHunt! I saw many of your fantastic creations posted online. Even though Easter is over, you can still access free Kansas-themed coloring pages at .",231,2020-04-13 15:35:34,Twitter Web App,49,4,GovLauraKelly,1249722909238669313,,1040058893907513344,False,https://t.co/3H3iGA1jwB,en,April,Q2
Sending best wishes to all Kansans for a safe and happy Easter during this difficult time. Remember: Better times are ahead. Stay safe and stay hopeful.,176,2020-04-12 14:04:01,Twitter for iPhone,977,63,GovLauraKelly,1249337480475807744,,1040058893907513344,False,https://t.co/agwXFclzYu,en,April,Q2
The Kansas spirit of neighbor helping neighbor will help us through this crisis. I thank every Kansan for taking this seriously – I know the huge sacrifices each of you are making to stay safe and healthy. (2/2),211,2020-04-12 03:27:34,Twitter for iPhone,823,51,GovLauraKelly,1249177313813630978,1.0400588939075133e+18,1040058893907513344,False,,en,April,Q2
"I know that during difficult times like these, many Kansans turn to their faith for guidance and strength. That should continue - but in a way that will keep our friends and loved ones safe. (1/2)",196,2020-04-12 03:27:34,Twitter for iPhone,1646,117,GovLauraKelly,1249177312878374912,,1040058893907513344,False,,en,April,Q2
Today’s ruling does not change my commitment to maintaining open lines of communication and collaboration with the Legislature. The only way to get through this is by working with—not against—each other in a bipartisan fashion. (4/4),233,2020-04-12 03:12:41,Twitter Web App,1412,148,GovLauraKelly,1249173567289376769,1.0400588939075133e+18,1040058893907513344,False,,en,April,Q2
I want to thank the Supreme Court for its expedited review under difficult circumstances. Our response to this unprecedented pandemic has necessitated that even our most fundamental institutions find alternative methods that preserve public health. (3/4),254,2020-04-12 03:12:41,Twitter Web App,1781,221,GovLauraKelly,1249173566043684864,1.0400588939075133e+18,1040058893907513344,False,,en,April,Q2
"The order, which prohibits mass gatherings of more than 10 people – including church services and funerals - remains in effect.  (2/4)",134,2020-04-12 03:12:41,Twitter Web App,1407,228,GovLauraKelly,1249173565125074945,1.0400588939075133e+18,1040058893907513344,False,,en,April,Q2
Today the Kansas Supreme Court ruled unanimously that the Legislative Coordinating Council (LCC) was not authorized to revoke Executive Order 20-18.  (1/4),178,2020-04-12 03:12:40,Twitter Web App,4251,1083,GovLauraKelly,1249173564059770881,,1040058893907513344,False,https://t.co/BJhs8sZNT0,en,April,Q2
"I know that because of changes caused by the coronavirus, this Easter is going to be different for our kids. That's why I wanted to do something special so we all can celebrate - safely. Happy Easter!",224,2020-04-11 21:17:54,Twitter Web App,659,105,GovLauraKelly,1249084283677020161,,1040058893907513344,False,https://t.co/QwJRxHCC8z,en,April,Q2
"Yesterday I issued two Executive Orders as part of my administration’s response to COVID-19. The first extends professional and occupational licenses for the remainder of the pandemic, and the second allows notaries and witnesses to do their jobs remotely.",280,2020-04-10 17:42:33,Twitter Web App,213,35,GovLauraKelly,1248667700538290178,,1040058893907513344,False,https://t.co/NzbCQjVfd9,en,April,Q2
ICYMI - last night I joined @CNNTonight to reiterate the importance of Kansans working together to help end this public health crisis. We must put aside political games and do what’s necessary to save lives.,231,2020-04-10 16:45:43,Twitter Web App,1000,155,GovLauraKelly,1248653398024617990,,1040058893907513344,False,https://t.co/bYl4RlCnt0,en,April,Q2
So proud of our Kansas teachers and students as they adapt during these challenging times. Just as impressive is in how our communities are coming together to support one another and keep each other safe. Keep up the good work and keep learning. #SaferAtHome #ksed,288,2020-04-09 23:25:57,Twitter Web App,387,32,GovLauraKelly,1248391732758110214,,1040058893907513344,False,https://t.co/NKy425gI78,en,April,Q2
"I know it's painful to refrain from gathering to recognize religious celebrations. But I encourage Kansans of all faith traditions to embrace alternate forms of worship. The physical church itself, while sacred and beloved, has never defined Kansans' deep and abiding faith.",298,2020-04-09 18:48:02,Twitter Web App,1385,268,GovLauraKelly,1248321792416059394,,1040058893907513344,False,https://t.co/x80NGLdKWp,en,April,Q2
"I've spoken with faith leaders from across the state, and they agree - it's critical for Kansans to maintain proper social distancing, including during religious gatherings. As difficult as this is, we all must do our part to mitigate the spread of COVID-19. #StayHome #SaveLives",279,2020-04-09 17:25:52,Twitter Web App,1743,216,GovLauraKelly,1248301112626741252,,1040058893907513344,False,,en,April,Q2
Thank you to Kansas author and National Book Award finalist @Sarah_Smarsh for helping me share this important message. Please remember: Stay home. Stay safe. Save lives. #SaferatHome,206,2020-04-09 16:30:24,Twitter Web App,216,40,GovLauraKelly,1248287156898017287,,1040058893907513344,False,https://t.co/GMzJKtcyxv,en,April,Q2
"In Kansas, we are right in the heart of the most dangerous time of this crisis. Yesterday, we had a 40% increase in COVID-19-related fatalities from the day before. Now more than ever, it is absolutely imperative that Kansans stay home and practice social distancing. #SaferatHome",280,2020-04-09 15:18:03,Twitter Web App,4146,1141,GovLauraKelly,1248268946161176578,,1040058893907513344,False,,en,April,Q2
"At the end of the day, we are all in this together. So we have got to work together. Period. If we’re going to beat COVID-19, we must attack it with the same resolve - united as Kansans. (3/3)",192,2020-04-08 22:47:08,Twitter Web App,1630,111,GovLauraKelly,1248019574680768512,1.0400588939075133e+18,1040058893907513344,False,,en,April,Q2
"That’s why all the difficult decisions I’ve made up to this point have been unavoidable, and absolutely crucial. That’s why I’m deeply disappointed that Republican leadership isn’t putting the health and safety of Kansas families first – including our faith communities. (2/3)",276,2020-04-08 22:47:08,Twitter Web App,1417,124,GovLauraKelly,1248019573577670656,1.0400588939075133e+18,1040058893907513344,False,,en,April,Q2
"This virus has been hard for all of us. As your governor, all I can do is take decisive steps to mitigate the damage, flatten the curve as quickly as possible, and prevent this virus from reaching its full, lethal potential.  (1/3)",231,2020-04-08 22:47:07,Twitter Web App,2628,241,GovLauraKelly,1248019572499738626,,1040058893907513344,False,,en,April,Q2
"Once again, I appreciate @CoachLesMiles with @KU_Football for reiterating the importance of staying at home and practicing social distancing in our efforts to mitigate the spread of COVID-19. Stay home. Stay safe. Save lives. #SaferatHome.",263,2020-04-08 18:39:29,Twitter Web App,105,13,GovLauraKelly,1247957252541202434,,1040058893907513344,False,https://t.co/BU8QZGEcfr,en,April,Q2
"My regularly scheduled press briefing to discuss the latest updates regarding COVID-19 for today, April 8, 2020, has been moved to 3:30 p.m. Please visit my Facebook page at 3:30 p.m. to see the live broadcast.",234,2020-04-08 15:56:58,Twitter Web App,44,18,GovLauraKelly,1247916351823503361,,1040058893907513344,False,https://t.co/XVq06k0wpl,en,April,Q2
Best wishes to Jewish communities in Kansas and around the world for a safe and happy #Passover during these challenging times.,151,2020-04-08 14:04:30,Twitter for iPhone,103,13,GovLauraKelly,1247888049230336001,,1040058893907513344,False,https://t.co/7KDvhhzV9a,en,April,Q2
"This was a difficult decision, and not one I was hoping to have to make. But I’ve said repeatedly during this crisis that we will adjust to circumstances as they develop to make sure we do everything we can to protect Kansans. (3/3)",232,2020-04-07 21:12:10,Twitter Web App,120,6,GovLauraKelly,1247633289873154058,1.0400588939075133e+18,1040058893907513344,False,,en,April,Q2
"Although religious institutions were previously exempt from this 10-person limit, they will now need to comply with this rule, effective at 12:01 p.m. Wednesday. (2/3)",167,2020-04-07 21:12:10,Twitter Web App,114,10,GovLauraKelly,1247633289004879872,1.0400588939075133e+18,1040058893907513344,False,,en,April,Q2
"Today I signed Executive Order #20-18, which brings our religious institutions in line with the previous order that limited public gatherings to 10 or fewer people.  (1/3)",194,2020-04-07 21:12:10,Twitter Web App,382,84,GovLauraKelly,1247633288090595328,,1040058893907513344,False,https://t.co/99UV71JynB,en,April,Q2
"Remember: Under my stay-home order, Kansans are not required to carry or present any letter, identification card or other paper to prove they are allowed to leave their home. For more details about my recent Executive Orders, please visit . #SaferatHome",276,2020-04-07 17:43:51,Twitter Web App,86,34,GovLauraKelly,1247580865250590721,,1040058893907513344,False,https://t.co/QZp3LCQnu0,en,April,Q2
"It's good to see Kansas farmers exercising creativity to help get the word out about the importance of good hygiene practices. To mitigate the spread of COVID-19, Kansans in urban and rural areas alike must wash their hands often, clean surfaces and stay home. #SaferatHome",297,2020-04-07 16:07:38,Twitter Web App,509,88,GovLauraKelly,1247556650124402689,,1040058893907513344,False,https://t.co/e5dFzj1YCY,en,April,Q2
I appreciate @KUHoops @CoachBillSelf for reminding all of us that workers on the front lines in this pandemic deserve our sincerest thanks and appreciation. Remember: Stay home. Stay safe. Save lives. #SaferatHome.,238,2020-04-06 20:56:59,Twitter Web App,449,79,GovLauraKelly,1247267078874312709,,1040058893907513344,False,https://t.co/nKVJ3HVxAS,en,April,Q2
These fourth-year University of Kansas School of Medicine students stepped up to help in such an important way. Thank you to all healthcare professionals in our state for going the extra mile to care for those affected by COVID-19.,255,2020-04-06 17:30:43,Twitter for iPhone,276,35,GovLauraKelly,1247215170482515968,,1040058893907513344,False,https://t.co/XPrgVzQcU1,en,April,Q2
"On today's Kansan to Kansan, I show my appreciation for the many educators in Kansas working so hard to ensure their students receive a quality education during this truly unprecedented time.",215,2020-04-06 15:09:34,Twitter Web App,288,64,GovLauraKelly,1247179647512645633,,1040058893907513344,False,https://t.co/3y6qkLwa3k,en,April,Q2
Today I signed a bipartisan bill creating the new 10-year Eisenhower Legacy Transportation Program. This plan features a visionary approach with the flexibility to address immediate needs and secure more opportunities for the future.,258,2020-04-03 20:24:12,Twitter Web App,147,41,GovLauraKelly,1246171667526815744,,1040058893907513344,False,https://t.co/cl9EYOmtJv,en,April,Q2
Thanks to @KU_Football’s @CoachLesMiles for “spreading the news!” All of us can play a part in mitigating the spread of COVID-19. Stay home. Stay safe. Stay healthy. #SaferatHome,202,2020-04-03 15:22:52,Twitter Web App,230,45,GovLauraKelly,1246095832702685184,,1040058893907513344,False,https://t.co/F6Y6tYeYm9,en,April,Q2
I appreciate the hard work of the Parsons High School Career Technical Education program in helping to provide face shields to a local hospital. I am proud of all of our Kansas communities rallying together to provide innovative solutions like this one.,277,2020-04-02 20:03:44,Twitter Web App,505,101,GovLauraKelly,1245804127730491392,,1040058893907513344,False,https://t.co/CQJWl0pLHn,en,April,Q2
