Tweets,Length,Date,Source,Favourites,RTs,Username,id_str,in_reply_to_user_id,user_id,isRT,tco,Language,Month,Quarter
"My press briefing for today, May 22, 2020, to discuss the latest updates regarding COVID-19 has been moved to 2:30 p.m. To watch the briefing, tune in live at 2:30 p.m. on my Facebook page, .",214,2020-05-22 18:48:20,Twitter for iPhone,35,5,GovLauraKelly,1263904547321282560,,1040058893907513344,False,https://t.co/UgmkO0jBm1,en,May,Q2
"Today begins Phase 2 of ""Ad Astra: A Plan to Reopen Kansas,"" as well as the start of #MemorialDayWeekend. Reminder: our state's move into Phase 2 does not mean that the threat of COVID-19 has subsided. Please be safe this weekend, practice social distancing and wear a mask.",274,2020-05-22 15:15:31,Twitter Web App,669,150,GovLauraKelly,1263850990073253888,,1040058893907513344,False,,en,May,Q2
"My thoughts are with the family of Chuck Graham, co-director of the Great Plains ADA Center, who passed away May 19. Chuck was a passionate advocate for the Americans with Disabilities Act, and dedicated his life to serving the people of the Great Plains Region and the nation.",301,2020-05-22 13:50:46,Twitter Web App,99,7,GovLauraKelly,1263829660833628160,,1040058893907513344,False,https://t.co/ZMnka4p0tv,en,May,Q2
"Please note that I took vigilant safety precautions throughout my White House visit. I was tested for COVID-19 upon arrival, socially distanced during the meeting, and otherwise wore a mask. (2/2)",196,2020-05-21 22:08:59,Twitter for iPhone,228,14,GovLauraKelly,1263592654832463874,1.0400588939075133e+18,1040058893907513344,False,,en,May,Q2
"During my meeting with @POTUS yesterday, we discussed Kansas’ reopening plan, and ways to ensure the safety of America’s food supply chain while also keeping those workers safe and healthy. I appreciate what the President's team has done for us throughout the pandemic. (1/2)",299,2020-05-21 22:08:59,Twitter for iPhone,324,29,GovLauraKelly,1263592652911439879,,1040058893907513344,False,https://t.co/OZsuPD0CKh,en,May,Q2
"With Memorial Day weekend ahead, it’s important for Kansans to remain vigilant and protect themselves and others from COVID-19. @KDWPT has good tips for those who want to safely enjoy Kansas’ beautiful State Parks over Memorial Day weekend.",264,2020-05-21 18:59:20,Twitter for iPhone,63,20,GovLauraKelly,1263544923783118860,,1040058893907513344,False,https://t.co/wkpfPViVac,en,May,Q2
"On behalf of the state of Kansas, I would like to congratulate Tabatha Rosproy, who has been selected as the 2020 National Teacher of the Year. The rest of the country has another reason to recognize what we’ve always known - KS educators are outstanding.",279,2020-05-21 17:57:00,Twitter Web App,657,69,GovLauraKelly,1263529238067634183,,1040058893907513344,False,https://t.co/m1amg9GEUK,en,May,Q2
"Though it may look a little bit different, our state's graduating class of 2020 deserves all of the pomp and circumstance of a traditional commencement ceremony. If you are a graduating senior, I encourage you participate in #KSClassof2020 Appreciation Day.",281,2020-05-20 21:45:17,Twitter for iPhone,120,25,GovLauraKelly,1263224299357458434,,1040058893907513344,False,https://t.co/8hmPrPced1,en,May,Q2
"It’s great to see officials with @KDWPT doing their part to keep Kansans safe, healthy and strong during the COVID-19 pandemic. The more than 2,000 pounds of elk and bison meat donated to local food banks can help feed 8,500 Kansans.",257,2020-05-20 15:06:18,Twitter Web App,83,18,GovLauraKelly,1263123891498729472,,1040058893907513344,False,https://t.co/s2OHhEIrmo,en,May,Q2
"I appreciate Kansans doing all they can to stay healthy and mitigate the spread of COVID-19. I know it has been difficult – but thanks to your diligence and commitment, we are able to move into Phase 2.",202,2020-05-19 20:48:56,Twitter Web App,561,43,GovLauraKelly,1262847733599285250,,1040058893907513344,False,,en,May,Q2
"Bars and night clubs, swimming pools, fairs, festivals, carnivals and summer camps will remain closed during Phase 2. To view the ""Ad Astra"" plan in its entirety, visit . (2/2)",199,2020-05-19 20:43:17,Twitter Web App,30,12,GovLauraKelly,1262846311587602433,1.0400588939075133e+18,1040058893907513344,False,https://t.co/zCwxLFU7nh,en,May,Q2
"Under the modified Phase 2, organized sports facilities and practices, community centers, indoor leisure spaces like arcades and theaters, in-person group exercise classes and state-owned-and-operated casinos may open on May 22. (1/2)",258,2020-05-19 20:43:17,Twitter Web App,162,68,GovLauraKelly,1262846310505418752,,1040058893907513344,False,https://t.co/XmsB9QcC1e,en,May,Q2
"Moving forward in Kansas' reopening plan does not mean COVID-19 no longer threatens our communities. Modifying Phase 2 to keep some restrictions allows us to reopen our economy as quickly and safely as possible, while exercising necessary caution.",271,2020-05-19 20:40:11,Twitter Web App,92,32,GovLauraKelly,1262845531270889472,,1040058893907513344,False,https://t.co/rOIZ36KkEf,en,May,Q2
"Throughout the COVID-19 pandemic, I've said I'm relying on data and science to tell us how quickly, or slowly, we open up our economy. Now, the data tell us it is time for another safe step forward. This Friday, Kansas will move into a modified Phase 2 of our reopening plan.",275,2020-05-19 20:39:22,Twitter Web App,795,88,GovLauraKelly,1262845323292131328,,1040058893907513344,False,,en,May,Q2
"My press briefing to discuss the latest updates regarding COVID-19 for today, May 19, 2020, has been moved to 1:30 p.m. CST. Please visit my Facebook page at 1:30 p.m. to see the live broadcast.",218,2020-05-19 16:59:07,Twitter Web App,31,12,GovLauraKelly,1262789897808760832,,1040058893907513344,False,https://t.co/yp40cnqCFj,en,May,Q2
"Memorial Day is coming soon, and though COVID-19 has changed the way we usually hold Memorial Day ceremonies, we still can safely honor our country's military personnel who made the ultimate sacrifice. To learn more, visit: .",248,2020-05-18 20:38:43,Twitter Web App,81,17,GovLauraKelly,1262482771445940227,,1040058893907513344,False,https://t.co/iXA6RJsOUb,en,May,Q2
"I’ll have a press briefing Tuesday this week instead of Monday, with @KDHE Secretary Lee Norman appearing for today’s 2 p.m. CST press briefing. I’ll instead hold a briefing at 1 p.m. CST this Tuesday, May 19. Watch both on Facebook Live at .",265,2020-05-18 16:21:25,Twitter Web App,49,8,GovLauraKelly,1262418020477124613,,1040058893907513344,False,https://t.co/ul1Motem2v,en,May,Q2
"This is very good news for our state. The new @thermofisher facility in Lenexa will not only create quality jobs in Kansas, but also help increase COVID-19 testing capacity in our state and nation. #ksleg",228,2020-05-18 15:56:13,Twitter Web App,178,25,GovLauraKelly,1262411678421057538,,1040058893907513344,False,https://t.co/TxJG3ANtim,en,May,Q2
"This mural, located on the third floor of the Kansas Statehouse, reminds us of Brown v. Board’s legacy and our duty to stand against racial inequality and fight for equal opportunity for all - just as those brave women and men did so many years ago. (2/2)",279,2020-05-17 15:53:18,Twitter for iPhone,338,47,GovLauraKelly,1262048558406082562,1.0400588939075133e+18,1040058893907513344,False,https://t.co/Fj9s2yxKTj,en,May,Q2
"Today is the 66th anniversary of Brown v. Board of Education, the landmark U.S. Supreme Court ruling that ended segregation in our country's public schools. (1/2)",162,2020-05-17 15:53:17,Twitter for iPhone,656,107,GovLauraKelly,1262048552047513606,,1040058893907513344,False,,en,May,Q2
I know the past few months have been challenging for all of us - particularly our high school seniors set to graduate this spring. I know this isn’t the way they imagined their senior year would come to a close. But know there still is cause to celebrate.,279,2020-05-17 14:10:09,Twitter for iPhone,226,33,GovLauraKelly,1262022600127102976,,1040058893907513344,False,https://t.co/4oWYdfGCzI,en,May,Q2
"Today we observe #NationalPeaceOfficersMemorial Day as a way to pay tribute to local, state and federal peace officers who have lost their lives in the line of duty. Their bravery, dedication and professionalism warrant our sincere praise and gratitude.",277,2020-05-15 20:29:24,Twitter Web App,109,12,GovLauraKelly,1261393265275727872,,1040058893907513344,False,https://t.co/CCKGoNgNOh,en,May,Q2
"What does Phase 1.5 of my reopening plan mean for Kansans? It means you can go to the barbershop or nail salon - but only for prescheduled appointments. Fitness centers may also open, but in-person classes may not occur. Visit  to view the plan in full.",276,2020-05-14 21:19:23,Twitter Web App,167,54,GovLauraKelly,1261043453418496002,,1040058893907513344,False,https://t.co/zCwxLFU7nh,en,May,Q2
"I would like to thank all Kansans for your commitment to the health and safety of your friends, neighbors and loved ones. I know this hasn't been easy - but without your dedication, we couldn't move forward in our reopening efforts. We'll continue to get through this together.",277,2020-05-14 21:06:32,Twitter Web App,1623,127,GovLauraKelly,1261040222298615808,,1040058893907513344,False,,en,May,Q2
"This afternoon I signed Executive Order 20-31, which establishes a new phase to the “Ad Astra"" plan. The new “1.5” Phase, effective May 18, continues reopening efforts while preserving some restrictions necessary to prevent COVID-19 community spread. (2/2)",279,2020-05-14 20:54:39,Twitter Web App,196,67,GovLauraKelly,1261037231151742981,1.0400588939075133e+18,1040058893907513344,False,https://t.co/MxcE6jBIWv,en,May,Q2
"Over the past couple of weeks, hospitalizations &amp; COVID-related deaths have declined, enabling us to move forward in our efforts to safely reopen KS. Unfortunately, the rate of disease spread has not shown the downward trajectory necessary to move fully into Phase 2. (1/2)",277,2020-05-14 20:54:39,Twitter Web App,307,35,GovLauraKelly,1261037230107299840,,1040058893907513344,False,,en,May,Q2
"Working alongside local officials and stakeholders through the Eisenhower Legacy Transportation Program, we can build a transportation future for Kansans that meets the needs of our communities, helps grow our economy and creates jobs. #WeLikeIKE (2/2)",252,2020-05-14 16:10:28,Twitter Web App,33,3,GovLauraKelly,1260965712094511105,1.0400588939075133e+18,1040058893907513344,False,,en,May,Q2
"Today I joined @KDOTHQ Secretary Julie Lorenz to announce the first major highway projects under the new Eisenhower Legacy Transportation Program, which was passed in March by the Kansas Legislature. (1/2)",229,2020-05-14 16:03:55,Twitter for iPhone,84,14,GovLauraKelly,1260964065221976064,,1040058893907513344,False,https://t.co/CaZ8Rdy9Lc,en,May,Q2
The Community Development Block Grant program has been a powerful tool in developing communities and expanding economic opportunities for low- and moderate-income Kansans. This CDBG tool is especially important during this time of crisis.,261,2020-05-13 21:38:34,Twitter for iPhone,20,1,GovLauraKelly,1260685896443183104,,1040058893907513344,False,https://t.co/btSXoMyUig,en,May,Q2
"Our COVID-19 website is Kansans’ one-stop shop for information and resources on community, family, mental, financial and economic health. Find out more at .",203,2020-05-13 20:27:44,Twitter Web App,32,9,GovLauraKelly,1260668068298137602,,1040058893907513344,False,https://t.co/zCwxLFU7nh,en,May,Q2
Don't forget to tune in at 2 p.m. CST for my press briefing to hear updates on COVID-19 in Kansas. Watch it live on Facebook at .,152,2020-05-13 17:30:29,Twitter Web App,35,10,GovLauraKelly,1260623462147805187,,1040058893907513344,False,https://t.co/ul1Motem2v,en,May,Q2
"As our recovery unfolds, it is important to remember that we must continue to follow safe practices. Keep practicing social distancing at all times, wear a mask in public and wash your hands often. And please, if you feel ill, stay home.",261,2020-05-12 20:55:47,Twitter Web App,196,67,GovLauraKelly,1260312738594721792,,1040058893907513344,False,https://t.co/DepOOox5oW,en,May,Q2
"I would like to recognize and celebrate Kansan Sarah Deer, who was awarded one of 27 prestigious Andrew Carnegie fellowships. Congratulations on your achievement, Sarah, and on the opportunity to tell your important story.",246,2020-05-12 19:03:23,Twitter Web App,170,35,GovLauraKelly,1260284456277073921,,1040058893907513344,False,https://t.co/0k22RgXcHU,en,May,Q2
"I have also ordered all flags at public institutions throughout KS to be flown at half-staff from sunrise to sunset on Friday, May 15, in observance of Peace Officers Memorial Day. We must recognize the sacrifices our law enforcement officers make as they serve &amp; protect. (2/2)",282,2020-05-12 17:39:27,Twitter Web App,83,6,GovLauraKelly,1260263333661413383,1.0400588939075133e+18,1040058893907513344,False,,en,May,Q2
"In accordance with Executive Order 20-30, I have ordered U.S. flags to be flown at half-staff on Wednesday, May 13, until sunset in honor of Overland Park Police Officer Mike Mosher. Officer Mosher tragically lost his life in the line of duty. (1/2)",273,2020-05-12 17:39:27,Twitter Web App,283,43,GovLauraKelly,1260263332780683264,,1040058893907513344,False,https://t.co/3kxaaVJLa3,en,May,Q2
"During National #HospitalWeek, I would like to thank hospitals and healthcare workers in Kansas and across the nation for your tireless response to the COVID-19 pandemic. Your work on the front lines has saved countless lives - you deserve our appreciation today and every day.",277,2020-05-11 21:17:03,Twitter Web App,217,32,GovLauraKelly,1259955703030169601,,1040058893907513344,False,,en,May,Q2
This week is #NationalPoliceWeek - a time to honor and remember those brave men and women who have lost their lives in the line of duty. Police officers in Kansas and around the world deserve our deepest thanks and appreciation for the sacrifices they make each day.,290,2020-05-11 20:06:30,Twitter Web App,44,2,GovLauraKelly,1259937952018214915,,1040058893907513344,False,https://t.co/YCSJ2d4uUH,en,May,Q2
Don't forget to tune in at 2 p.m. CST for my press briefing to hear updates on COVID-19 in Kansas. Watch it live on Facebook at .,152,2020-05-11 17:39:28,Twitter Web App,39,12,GovLauraKelly,1259900948341755906,,1040058893907513344,False,https://t.co/ul1Motem2v,en,May,Q2
"In a short time, COVID-19 has stolen so much from so many of us – the Class of 2020 included. I share in your disappointment that your Graduation Day didn’t end up the way you always imagined. Listen to a relevant commencement address from Shankar Vedantam:",280,2020-05-11 17:26:56,Twitter for iPhone,17,3,GovLauraKelly,1259897794879541248,,1040058893907513344,False,https://t.co/BarKoUOMNK,en,May,Q2
"Happy Mother’s Day, Kansas! My mother, Jeanne Maddock Kelly (back right), taught me (front right) valuable lessons about leadership and compassion that helped me get to where I am today. I hope all mothers, aunts, grandmas and mother figures have a special day.",285,2020-05-10 14:32:53,Twitter for iPhone,423,7,GovLauraKelly,1259491603976196096,,1040058893907513344,False,https://t.co/uiXChhM73F,en,May,Q2
"Though COVID-19 has changed nearly every aspect of our lives, one thing that has remained constant is the threat of severe weather. All Kansans need to have a plan in mind for when severe weather does strike.",232,2020-05-08 20:50:24,Twitter for iPhone,97,19,GovLauraKelly,1258861836314841089,,1040058893907513344,False,https://t.co/lLYY2vahDl,en,May,Q2
Don't forget to tune in at 2 p.m. CST for my press briefing to hear updates on COVID-19 in Kansas. Watch it live on Facebook at .,152,2020-05-08 17:30:42,Twitter Web App,18,6,GovLauraKelly,1258811578134286339,,1040058893907513344,False,https://t.co/ul1Motem2v,en,May,Q2
"On #MilitarySpouseAppreciationDay, I would like to recognize the many sacrifices military spouses make every day as their loved ones serve our state and nation. Please know your efforts and unwavering support do not go unnoticed.",229,2020-05-08 15:33:34,Twitter for iPhone,149,18,GovLauraKelly,1258782099533856768,,1040058893907513344,False,,en,May,Q2
ICYMI - Yesterday I announced Cheryl Harrison-Lee and Lyle Butler would head our team charged with leading Kansas forward in recovery from the economic fallout of COVID-19. They both have exceptional and relevant experience. Learn more here:,265,2020-05-07 15:03:37,Twitter Web App,32,6,GovLauraKelly,1258412176903147522,,1040058893907513344,False,https://t.co/vvGehxMgTC,en,May,Q2
"Congratulations, Dennis. As @NYGovCuomo said, the genuine, sincere nature of your gift made it truly special. You make Kansas proud.",156,2020-05-06 19:55:42,Twitter Web App,762,90,GovLauraKelly,1258123291765637121,,1040058893907513344,False,https://t.co/zErLGVuBK6,en,May,Q2
"Please note that the schedule for my regularly-scheduled daily press briefings has changed. Starting today, I will join @KDHE @SecNorman for briefings at 2 p.m. CST on Monday, Wednesday and Friday each week. Tune in live on my Facebook page at .",268,2020-05-06 17:48:11,Twitter Web App,62,9,GovLauraKelly,1258091201128955904,,1040058893907513344,False,https://t.co/XVq06k0wpl,en,May,Q2
Our nurses work tirelessly on the front lines to make sure all of us can stay safe and healthy. The extraordinary courage and determination shown by nurses in Kansas and around the world during the COVID-19 pandemic deserve our sincerest thanks and recognition. #NationalNursesDay,280,2020-05-06 17:25:04,Twitter Web App,267,29,GovLauraKelly,1258085385369944064,,1040058893907513344,False,,en,May,Q2
"Please see below the full video of @KState President Richard Myers and I conferring a bachelor's degree upon Dennis Ruhnke of Troy, Kansas. It was an absolute honor and privilege to watch as Dennis achieved his lifelong goal. #SGNGraduation",264,2020-05-06 00:11:18,Twitter Web App,247,42,GovLauraKelly,1257825227423264769,,1040058893907513344,False,https://t.co/XGG36CJmhO,en,May,Q2
"#NationalTeachersDay is an ideal time to show our appreciation for educators in Kansas. In the midst of this public health crisis, they have gone above &amp; beyond to make sure Kansas kids succeed. As the “education governor,” I will always advocate for and celebrate KS teachers.",281,2020-05-05 20:51:53,Twitter for iPhone,357,28,GovLauraKelly,1257775045499326467,,1040058893907513344,False,,en,May,Q2
"In 1971, Dennis was two credits away from earning his degree in agriculture when his father passed away. He chose to leave school to take care of his mother and the family farm. Dennis’ kindness and lifelong career in ag make him more than qualified to receive a degree. (2/2)",276,2020-05-05 19:46:03,Twitter for iPhone,1042,105,GovLauraKelly,1257758477893668864,1.0400588939075133e+18,1040058893907513344,False,,en,May,Q2
"This afternoon I had the pleasure of joining @KState President Richard Myers to confer a bachelor's degree upon Dennis Ruhnke of Troy, Kansas. Dennis recently sent a letter to @NYGovCuomo with an N-95 mask to give to a nurse or doctor in New York. (1/2)",277,2020-05-05 19:46:03,Twitter for iPhone,2358,437,GovLauraKelly,1257758475381243907,,1040058893907513344,False,https://t.co/jHfDtUtxSQ,en,May,Q2
"It's not too late to participate in the #2020Census. Census data are used to distribute over $6 billion in federal funds to Kansas every year for schools, transportation, healthcare &amp; more. You can complete your census online at , by mail or by phone.",302,2020-05-05 17:00:06,Twitter Web App,26,6,GovLauraKelly,1257716712369205252,,1040058893907513344,False,https://t.co/TX4Q537MMy,en,May,Q2
"This partnership between @SpiritAero &amp; @vyaire_medical will not only result in life-saving medical equipment, but also maintain KS jobs. The innovative collaboration is a great example of Kansans stepping up to help one another during the COVID-19 pandemic.",284,2020-05-04 20:39:26,Twitter Web App,92,33,GovLauraKelly,1257409524711010304,,1040058893907513344,False,https://t.co/m5bZn1s00X,en,May,Q2
"Libraries and childcare facilities also may open. Please note that county officials may implement more restrictive guidelines. To view “Ad Astra: A Plan to Reopen Kansas,” click here: . (2/2)",214,2020-05-04 17:12:23,Twitter Web App,110,26,GovLauraKelly,1257357416825487363,1.0400588939075133e+18,1040058893907513344,False,https://t.co/FpPvunpkUK,en,May,Q2
"Today begins Phase One of my administration’s plan to cautiously and gradually reopen our state. For Kansans, Phase One means you can go to restaurants - so long as they adhere to proper public health guidelines and can maintain at least 6 feet between customers. (1/2)",269,2020-05-04 17:12:23,Twitter Web App,437,79,GovLauraKelly,1257357415609180161,,1040058893907513344,False,,en,May,Q2
"Today on #InternationalWorkersDay, I want to offer a special message of gratitude to Kansas workers, &amp; recognize the important contributions American workers have made throughout history. Particularly now, during the COVID-19 pandemic, our frontline workers deserve our gratitude.",284,2020-05-01 21:07:27,Twitter Web App,299,31,GovLauraKelly,1256329408043876352,,1040058893907513344,False,,en,May,Q2
"On National #SchoolNutritionHeroDay, let's all extend our thanks to school nutrition professionals who work hard every day to make sure our children are fed. Even through the uncertainty of the COVID-19 pandemic, they continue to rise to the occasion.",251,2020-05-01 17:08:50,Twitter Web App,128,13,GovLauraKelly,1256269360701870080,,1040058893907513344,False,,en,May,Q2
"While there are still many uncertainties surrounding COVID-19, one thing is clear: we are going to make it through the daunting days ahead. Please stay safe, and follow the guidelines outlined in our new framework.",238,2020-05-01 15:49:55,Twitter Web App,170,32,GovLauraKelly,1256249501003677697,,1040058893907513344,False,https://t.co/V5Lb5LPxEV,en,May,Q2
"The Framework also includes guidance for businesses and individuals on when to wear masks, when employers should implement telework policies, travel guidance and more. To view the Framework, click the following link:",240,2020-04-30 23:58:47,Twitter Web App,175,83,GovLauraKelly,1256010139942912001,,1040058893907513344,False,https://t.co/FpPvunpkUK,en,April,Q2
"I will evaluate Kansas' disease spread, testing rates, hospitalizations, PPE availability and other factors to determine if KS should move to the next ""Phase."" Kansans should continue social distancing and taking other precautionary measures during each of the three phases.",274,2020-04-30 23:56:25,Twitter Web App,341,52,GovLauraKelly,1256009545928892417,,1040058893907513344,False,,en,April,Q2
"Under ""Ad Astra: A Plan to Reopen Kansas,"" county officials are permitted to impose regulations that are more restrictive than the Framework, but cannot be less restrictive. Counties do not have to submit requests to the state to institute equal or more restrictive standards.",276,2020-04-30 23:53:54,Twitter Web App,213,35,GovLauraKelly,1256008912295387136,,1040058893907513344,False,,en,April,Q2
"But please note that under Phase 1, bars and nightclubs, fitness centers, hair salons or barber shops and public swimming pools will not open. (2/2)",148,2020-04-30 23:52:17,Twitter Web App,289,57,GovLauraKelly,1256008504621621250,1.0400588939075133e+18,1040058893907513344,False,,en,April,Q2
"So what does Phase 1 mean for Kansans? It means that you can go to restaurants - as long as they adhere to proper public health guidelines and can maintain at least 6 feet between customers. It means you can go to the library, and childcare facilities will be open. (1/2)",271,2020-04-30 23:52:17,Twitter Web App,602,129,GovLauraKelly,1256008503321378816,,1040058893907513344,False,,en,April,Q2
"In Phase 1 of the plan, the statewide stay-at-home order is lifted on May 4. In its place, mass gatherings statewide will be limited to 10 or fewer. Entities already considered essential functions pursuant to the Kansas Essential Functions Framework can continue to operate. (2/2)",280,2020-04-30 23:46:47,Twitter Web App,189,49,GovLauraKelly,1256007118152437763,1.0400588939075133e+18,1040058893907513344,False,,en,April,Q2
"After discussion with public health officials and evaluating the state's disease spread, testing capacity &amp; other factors, we have decided to lift the statewide ""safer-at-home"" order. We will gradually and cautiously move into Phase 1 of ""Ad Astra: A Plan to Reopen Kansas."" (1/2)",284,2020-04-30 23:46:46,Twitter Web App,417,82,GovLauraKelly,1256007117158350848,,1040058893907513344,False,,en,April,Q2
"I know the past few weeks have been incredibly difficult for Kansas families. As your governor, I am so proud of your commitment and the sacrifices you've all made to make sure your family, friends and neighbors remain healthy. Together, we will get through this.",263,2020-04-30 23:36:58,Twitter Web App,1909,135,GovLauraKelly,1256004651339722752,,1040058893907513344,False,,en,April,Q2
"The address will be broadcast on live television and available to radio stations in Kansas, and on my Facebook page at . (2/2)",149,2020-04-29 21:02:45,Twitter Web App,156,39,GovLauraKelly,1255603449888231424,1.0400588939075133e+18,1040058893907513344,False,https://t.co/XVq06k0wpl,en,April,Q2
"At  6:30 p.m. Thursday, April 30, I will deliver an address to the people of Kansas on my administration’s official plan to reopen the state as we address the COVID-19 pandemic. (1/2)",183,2020-04-29 21:02:44,Twitter Web App,927,265,GovLauraKelly,1255603448999038977,,1040058893907513344,False,,en,April,Q2
