Tweets,Length,Date,Source,Favourites,RTs,Username,id_str,in_reply_to_user_id,user_id,isRT,tco,Language,Month,Quarter
The Phase 1 relief package will involve four areas of distinct action to support businesses and Vermonters as they resume their operations. 5/13,168,2020-05-20 18:33:41,Twitter Web App,4,0,GovPhilScott,1263176082754166784,545107258.0,545107258,False,https://t.co/VhfObymh7E,en,May,Q2
"These businesses and their employees drive our economy, put food on the tables of Vermonters and help fund critical needs for families, public schools and so much more. We must step up and act quickly to help them survive and thrive into the future. 4/13",254,2020-05-20 18:33:41,Twitter Web App,3,0,GovPhilScott,1263176081558974470,545107258.0,545107258,False,,en,May,Q2
"I know these last few months have been a significant sacrifice for far too many -- families who’ve struggled with unemployment, and businesses and entrepreneurs across the state, who have seen their world and dreams evaporate before their eyes, through no fault of their own. 3/13",280,2020-05-20 18:33:40,Twitter Web App,5,0,GovPhilScott,1263176080543883270,545107258.0,545107258,False,,en,May,Q2
The two-phase proposal will start with $310 million for immediate relief to the most impacted sectors and businesses to be followed by $90 million for long-term recovery efforts. 2/13,231,2020-05-20 18:33:40,Twitter Web App,4,0,GovPhilScott,1263176079105232897,545107258.0,545107258,False,https://t.co/OJZUxkMzxu,en,May,Q2
"Today, I proposed a major $400 million economic relief and recovery package, using funds the state received from the CARES Act. This package takes bold action to bring support to Vermonters in need, as we continue to manage this public health crisis and reopen the economy. 1/13",302,2020-05-20 18:33:40,Twitter Web App,31,5,GovPhilScott,1263176077385633807,,545107258,False,https://t.co/cTGeDc4Bwv,en,May,Q2
"At 11:00 AM, I will propose a major $400 million economic relief and recovery package. The package takes bold action to bring support to Vermonters in need, as we continue to manage this public health crisis and reopen the economy. #vtpoli 

Watch live:",301,2020-05-20 14:26:15,Twitter Web App,45,16,GovPhilScott,1263113814133833730,,545107258,False,https://t.co/aiuWBlGzMN,en,May,Q2
"Reminder: Tomorrow marks two months since Vermont’s first fatality as a result of COVID-19. In honor of the Vermonters we have lost to this terrible disease, I have ordered the U.S. and Vermont State flags to fly at half-staff on the 19th of every month for the remainder of 2020.",304,2020-05-18 17:48:24,Twitter Web App,108,22,GovPhilScott,1262439910251921408,,545107258,False,https://t.co/D1rwquwoOM,en,May,Q2
"So, on Wednesday we’ll also announce a major package which will provide relief, hope, and initiatives to get us moving towards recovery. Thank you all for what you’ve done over the last 2 months and your ongoing commitment to keeping everyone safe. 6/6",252,2020-05-18 15:09:31,Twitter Web App,23,2,GovPhilScott,1262399926882926595,545107258.0,545107258,False,,en,May,Q2
"I know this has been difficult for everyone, and in some ways the restart process is even more trying than the closings were. But your sacrifices have made a huge difference. My team is committed to helping businesses and families recover from this once-in-a-century crisis. 5/6",278,2020-05-18 15:09:31,Twitter Web App,14,1,GovPhilScott,1262399925729603584,545107258.0,545107258,False,,en,May,Q2
"As I said on Friday, if things go well this week, we’ll announce some additional openings, like more office workers who can’t work from home, hair salons, limited outdoor seating at restaurants, and hopefully more in the healthcare field. 4/6",242,2020-05-18 15:09:30,Twitter Web App,11,1,GovPhilScott,1262399924706082819,545107258.0,545107258,False,,en,May,Q2
"We still have a long way to go, but we know what trends and metrics to watch, and if things continue as they have, we’ll be able to do more and more, while keeping people safe. 3/6",180,2020-05-18 15:09:30,Twitter Web App,8,1,GovPhilScott,1262399923238174721,545107258.0,545107258,False,,en,May,Q2
"Over the last month, with strict health and safety protections, we’ve opened retail, outdoor services, recreation, manufacturing and construction, as well as campgrounds and lodging at 25% capacity. Vermonters can also safely visit with small groups of family and friends. 2/6",276,2020-05-18 15:09:30,Twitter Web App,10,1,GovPhilScott,1262399921929498626,545107258.0,545107258,False,,en,May,Q2
"Thanks to the work of Vermonters, and even as we’ve slowly restarted the economy over the last 4 weeks, we’re still moving in the right direction. The data shows we can continue to methodically put more back to work, while easing some restrictions. 1/6",301,2020-05-18 15:09:29,Twitter Web App,47,10,GovPhilScott,1262399919886872577,,545107258,False,https://t.co/RQZl8KShnu,en,May,Q2
"Vermont has the lowest COVID-19 growth rate in the country, thanks to the efforts of Vermonters. As we methodically reopen our economy, it’s important we remain vigilant and continue to follow @healthvermont and CDC guidelines.",251,2020-05-16 21:21:12,Twitter for iPhone,294,62,GovPhilScott,1261768690003050497,,545107258,False,https://t.co/VhGv4BF4Rm,en,May,Q2
"Vermont is grateful for the efforts of @SenatorLeahy, @SenSanders and Congressman @PeterWelch to secure this critical funding to support our testing and tracing program. As we methodically restart Vermont’s economy, enhanced testing and tracing is key.",276,2020-05-15 20:17:42,Twitter for iPhone,106,24,GovPhilScott,1261390319410536449,,545107258,False,https://t.co/tgXwcen0Xv,en,May,Q2
"If the data continues in the right direction, we’ll continue to slowly turn the economic spigot. In the weeks ahead, you can expect us to address close contact businesses like hair salons, indoor professional services and steps for restaurants to open with outdoor dining. 5/5",276,2020-05-15 19:23:08,Twitter Web App,15,2,GovPhilScott,1261376586386825216,545107258.0,545107258,False,,en,May,Q2
Good news: State data and modeling indicates the spread of COVID-19 continues to slow and Vermont now has one of the lowest 3-day and 7-day growth rates in the country. 4/5,197,2020-05-15 19:23:07,Twitter Web App,22,2,GovPhilScott,1261376583849275393,545107258.0,545107258,False,https://t.co/on0yEb443B,en,May,Q2
"The important thing to remember is that the smarter we are about our individual actions, and the more disciplined everyone can be during each step forward, the more steps we’ll be able to take to safely restart Vermont. 3/5",223,2020-05-15 19:23:07,Twitter Web App,5,1,GovPhilScott,1261376581798211585,545107258.0,545107258,False,,en,May,Q2
"So, today I signed a Be Smart/Stay Safe order to extend the State of Emergency to June 15 and update previous emergency orders to reflect the re-openings and eased restrictions I've announced in recent weeks. 2/5",237,2020-05-15 19:23:06,Twitter Web App,7,3,GovPhilScott,1261376579323801602,545107258.0,545107258,False,https://t.co/kVsOU8DkTV,en,May,Q2
"Vermonters have stepped up in a time of crisis, following guidance from the beginning to quickly slow the spread. These efforts have saved hundreds of lives and given us time to build the testing &amp; tracing capacity we need to contain future outbreaks. 1/5",308,2020-05-15 19:23:05,Twitter Web App,49,11,GovPhilScott,1261376576542957569,,545107258,False,https://t.co/yfAp4sAbS0,en,May,Q2
"Today, I signed into law S.333, which codifies the current status of suspending pending and new eviction and foreclosure actions for the duration of the emergency period. Thank you to the Legislature and others for you work.",248,2020-05-14 18:22:26,Twitter for iPhone,72,20,GovPhilScott,1260998924787163138,,545107258,False,https://t.co/3dtCiVVT38,en,May,Q2
"We’re all in this together, and human decency will help get us through this challenging time. Let’s remember, our common enemy is the virus, not each other. And we should use every ounce of energy to defeat it.  7/7",215,2020-05-13 15:09:22,Twitter Web App,178,14,GovPhilScott,1260587948497612802,545107258.0,545107258,False,,en,May,Q2
"Here’s the bottom line: Concerns about this virus CANNOT be used as an excuse for hate, bigotry, or division - of any type - for any reason.  

This virus knows no border and it doesn’t discriminate. 6/7",203,2020-05-13 15:09:21,Twitter Web App,160,26,GovPhilScott,1260587946207522818,545107258.0,545107258,False,,en,May,Q2
"Making this situation in Hartford even more disturbing was the racial undertone used during the exchange with the individual, who is a person of color. So, let me be very clear: This IS NOT acceptable and can’t be tolerated. There is NO excuse for it. 5/7",255,2020-05-13 15:09:21,Twitter Web App,113,8,GovPhilScott,1260587944517292034,545107258.0,545107258,False,,en,May,Q2
"While we have travel restrictions to protect public health, when I announced this guidance, I said explicitly we cannot let this become an ‘us versus them’ situation.  I want to make sure everyone hears that. We can be both neighborly and compassionate, while staying safe. 4/7",277,2020-05-13 15:09:20,Twitter Web App,84,6,GovPhilScott,1260587942806016003,545107258.0,545107258,False,,en,May,Q2
"Sadly, this happened in front of their 11-year-old child.

I want to be VERY clear: I have no tolerance for this kind of thing and it’s unacceptable. It does not represent my views or who we are as a state. 3/7",210,2020-05-13 15:09:20,Twitter Web App,79,6,GovPhilScott,1260587941476421632,545107258.0,545107258,False,,en,May,Q2
"I learned of a family in Hartford - who had New York plates on their car, even though they became Vermonters a few months ago - who were pulling out of their driveway when, among other things, were told they weren't welcome here. 2/7",233,2020-05-13 15:09:20,Twitter Web App,53,4,GovPhilScott,1260587940297822211,545107258.0,545107258,False,,en,May,Q2
"THREAD: We know we can’t let our guard down while fighting this virus, but we also can’t ease up on our commitment to civility and unity, either. I bring this up because on Monday, I was made aware of a disturbing incident that happened here in Vermont. 1/7",257,2020-05-13 15:09:19,Twitter Web App,248,54,GovPhilScott,1260587939228258305,,545107258,False,,en,May,Q2
"My mom has been an inspiration my entire life. I wouldn’t be the person I am today without her love and support. I want to wish her, Diana and all moms across Vermont a very happy Mother’s Day.",217,2020-05-10 14:21:30,Twitter for iPhone,173,3,GovPhilScott,1259488739073691648,,545107258,False,https://t.co/asR96qrfQ8,en,May,Q2
"I know snow on May 9th isn’t a welcome sight for many Vermonters, just as we’re cautiously allowing outdoor recreation to get going again — but this is just a snapshot in time. Just like better weather is ahead, better days will come, as well. We will get through this, together.",303,2020-05-09 14:10:47,Twitter for iPhone,274,31,GovPhilScott,1259123656116051969,,545107258,False,https://t.co/UAiSlKbQ7r,en,May,Q2
This is a time when supporting each other and thinking creatively about how we serve are essential to restoring our economy and helping families in need.,177,2020-05-08 22:49:07,Twitter for iPhone,74,15,GovPhilScott,1258891711826329600,,545107258,False,https://t.co/mMl2uxud7h,en,May,Q2
"We also expect to see summer day programs open. My Administration will be creating restart grants, providing about $6 million in funding for child care and summer day programs. These grants will help cover the added costs of making these programs even safer and healthier. 2/2",276,2020-05-08 20:06:06,Twitter Web App,27,4,GovPhilScott,1258850686172880902,545107258.0,545107258,False,,en,May,Q2
"As we cautiously put more Vermonters back to work, access to child care is critical. As our models and data continue to point in the right direction, I am happy to announce child care programs can reopen by June 1 - if they can meet strict health and safety requirements. 1/2",275,2020-05-08 20:06:06,Twitter Web App,57,9,GovPhilScott,1258850685136900096,,545107258,False,,en,May,Q2
"As we work to triple our testing, @healthvermont is  partnering with EMS units around the state to meet our goals. The Department is training these units to collect specimens, supplementing what Health teams are already doing. 

Read more about our plans:",280,2020-05-07 20:30:22,Twitter Web App,22,3,GovPhilScott,1258494404425367555,,545107258,False,https://t.co/5iPiQGPqtf,en,May,Q2
"Thanks to a special delivery from 8 year old Sophia, yesterday my team wore these facial coverings at my press conference. Ver❤️ont United is a grassroots effort designed to bring folks together, united in strength during this time of physical separation.",303,2020-05-07 15:06:13,Twitter Web App,112,9,GovPhilScott,1258412831382347777,,545107258,False,https://t.co/ROS44pehTD,en,May,Q2
"We must remain vigilant so we don’t lose ground as we continue, slowly and safely, reopening Vermont in a way that puts public health first. I will continue to make decisions cautiously, based on the science and data, and with advice from experts. 5/5",275,2020-05-06 18:44:17,Twitter Web App,19,3,GovPhilScott,1258105318694948865,545107258.0,545107258,False,https://t.co/mGYo6JVSaR,en,May,Q2
"You can find additional guidelines to prevent the spread of COVID-19 through outdoor recreation and outdoor fitness by clicking the link below, which include: 4/5",210,2020-05-06 18:44:16,Twitter Web App,19,8,GovPhilScott,1258105316690079744,545107258.0,545107258,False,https://t.co/mMj37p60SI,en,May,Q2
"Outdoor recreation and outdoor fitness activities with low or no direct physical contact may begin tomorrow. These include but are not limited to state and municipal parks, recreation associations, trail networks, golf courses, big game check stations and guided expeditions. 3/5",279,2020-05-06 18:44:16,Twitter Web App,12,2,GovPhilScott,1258105315737862144,545107258.0,545107258,False,,en,May,Q2
"While the Stay Home, Stay Safe order remains in effect, if able to comply with outlined safety measures, my latest order allows the following social activities to resume: 2/5",198,2020-05-06 18:44:15,Twitter Web App,11,3,GovPhilScott,1258105314035015682,545107258.0,545107258,False,https://t.co/FO1NkYKptz,en,May,Q2
"Today, with @healthvermont Commissioner Mark Levine, MD, I announced outdoor recreation and limited social interactions may resume under strict health and safety precautions, as state modeling continues to indicate a slow in the spread of COVID-19. 1/5",300,2020-05-06 18:44:15,Twitter Web App,55,26,GovPhilScott,1258105312109879296,,545107258,False,https://t.co/mGYo6JVSaR,en,May,Q2
"#NurseApprecationDay has special meaning this year. On behalf of all Vermonters, thank you to all nurses for your unwavering commitment to service and for keeping us safe through these unprecedented times. You truly are are heroes.",255,2020-05-06 16:55:05,Twitter Web App,92,14,GovPhilScott,1258077837636100096,,545107258,False,https://t.co/w85AqLfXXv,en,May,Q2
Thank you to all of Vermont's teachers for your flexibility and creative spirit during these unprecedented times. We're fortunate to have such dedicated public servants.  #ThankATeacher,209,2020-05-05 15:19:05,Twitter Web App,94,31,GovPhilScott,1257691290940080128,,545107258,False,https://t.co/a8raoP8K9A,en,May,Q2
"Today I announced limited elective procedures can resume, which had previously been put on hold as we focused on preparing for, and responding to, COVID-19. While postponing these was necessary, we know they're important to Vermonters’ overall health.",276,2020-05-04 18:49:11,Twitter Web App,57,7,GovPhilScott,1257381777234112512,,545107258,False,https://t.co/nLM7oIa9ls,en,May,Q2
"Wishing my good friend Congressman @PeterWelch a very happy birthday. It’s your 29th, right? #throwback #vtpoli",135,2020-05-02 21:52:07,Twitter for iPhone,133,7,GovPhilScott,1256703040528285698,,545107258,False,https://t.co/87YHduyE0X,en,May,Q2
Congratulations to the @uvmvermont class of 2020 nursing students who graduated early to join the workforce in our country’s time of need. Thank you for your service and choosing this path. We’re in good hands. #UVM2020,267,2020-05-02 14:50:01,Twitter for iPhone,143,27,GovPhilScott,1256596814071042049,,545107258,False,https://t.co/xYNAbE8YJc,en,May,Q2
"Green Up Day represents what’s so great about Vermont. While it’s been postponed and won’t take place this weekend as usual, I ask Vermonters who may be out on a walk or hike to take a bag or two with them and help keep Vermont green, in honor of this tradition.",262,2020-05-01 21:49:20,Twitter for iPhone,176,30,GovPhilScott,1256339950422970373,,545107258,False,,en,May,Q2
"We have a strong and effective testing and contact tracing program in Vermont, but as we work to keep Vermonters healthy, and slowly and safely restart our economy, doing even more is critical. With our expansion plan, we'll be able to triple the amount of tests we do per week.",278,2020-04-30 18:55:28,Twitter Web App,115,16,GovPhilScott,1255933806068011014,,545107258,False,,en,April,Q2
"Today at 4:00 PM I'll be participating in a telephone town hall hosted by @AARPVT. I'll be joined by @SenatorLeahy, @SenSanders, Rep. @PeterWelch &amp; @healthvermont commissioner, Dr. Mark Levine. You can listen in by calling 833-380-0683. I look forward to hearing from you. #vtpoli",308,2020-04-30 14:27:31,Twitter Web App,28,19,GovPhilScott,1255866375442178051,,545107258,False,https://t.co/lb2c6ofq3w,en,April,Q2
"This expansion of testing and tracing will help make sure that as we slowly ease public health restrictions and put more people back to work, we're able to identify cases quickly and better contain the virus so we don’t lose ground on our progress. (2/2)",279,2020-04-29 21:38:59,Twitter Web App,38,5,GovPhilScott,1255612569743736832,545107258.0,545107258,False,https://t.co/5iPiQGPqtf,en,April,Q2
"Today @healthvermont and I announced Vermont is significantly increasing and strengthening our testing and contact tracing programs in order to quickly identify, contain and suppress outbreaks of COVID-19. (1/2)",236,2020-04-29 21:38:58,Twitter Web App,83,11,GovPhilScott,1255612567625613313,,545107258,False,https://t.co/5iPiQGPqtf,en,April,Q2
"Vermont ranked 3rd in the nation for usage of the @SBAgov Paycheck Protection Program. Congress recently added over $300 billion to the program, but funds are issued on a first come, first served basis. Vermont businesses who can benefit should apply ASAP.",280,2020-04-27 18:57:38,Twitter for iPhone,38,15,GovPhilScott,1254847190616412160,,545107258,False,https://t.co/2FGZPaxLPx,en,April,Q2
"Later today I'll be joining @SenatorLeahy, @SenSanders &amp; Rep. @PeterWelch for a telephone town hall to update Vermonters on our response to the coronavirus pandemic. You can join us at 5:00 PM at the link below. We look forward to hearing from you. #vtpoli",308,2020-04-23 14:27:58,Twitter Web App,46,17,GovPhilScott,1253329773163540481,,545107258,False,https://t.co/dyWZIAuK10,en,April,Q2
"Vermont is now among the first states to launch the new Pandemic Unemployment Assistance program, allowing self-employed workers, independent contractors and others who aren’t eligible for traditional unemployment insurance to receive benefits. Read more:",279,2020-04-22 22:52:46,Twitter for iPhone,170,35,GovPhilScott,1253094424852213760,,545107258,False,https://t.co/IzhKDEySkL,en,April,Q2
More good news from @VermontDFR: We just announced they have approved plans from more than forty auto insurance companies to return premiums or reduce their rates for Vermont policyholders. This means over $14.6 million in savings for Vermonters to date.,278,2020-04-22 18:13:02,Twitter Web App,54,10,GovPhilScott,1253024026924068865,,545107258,False,https://t.co/eUSsdytNg5,en,April,Q2
"I'm asking you to help me by sending in nominations so we can recognize these Vermonters for their actions and efforts. Remember, no act of kindness or service is too small. Thank you for your nominations, and thank you for helping make VT strong. (3/3)",278,2020-04-22 13:31:19,Twitter Web App,33,3,GovPhilScott,1252953128430960642,545107258.0,545107258,False,https://t.co/WOc0yqWjxa,en,April,Q2
"Moving forward, to call more attention to good deeds happening throughout Vermont, and the good people making them happen, I will be recognizing acts of kindness, selfless service and goodwill happening throughout our state. (2/3)",254,2020-04-22 13:31:19,Twitter Web App,32,4,GovPhilScott,1252953127566880768,545107258.0,545107258,False,https://t.co/WOc0yqWjxa,en,April,Q2
"As our state confronts this once-in-a-century challenge, sometimes it's the little things – those simple, random, everyday acts of kindness and goodwill – that can make all the difference.  (1/3)",219,2020-04-22 13:31:18,Twitter Web App,50,11,GovPhilScott,1252953126392475649,,545107258,False,https://t.co/WOc0yqWjxa,en,April,Q2
"I just got off the phone with my fellow New England governors, @GovNedLamont, @GovRaimondo, @MassGovernor, @GovChrisSununu and @GovJanetMills. 

Every state is facing this challenge, and we’re stronger when we work together. #vtpoli",232,2020-04-21 19:18:26,Twitter for iPhone,196,16,GovPhilScott,1252678095456350209,,545107258,False,,en,April,Q2
"Today I announced a joint initiative with the states of California, Colorado, Conn., Illinois, Mass., New Jersey, Virginia and Washington to secure student loan relief options for thousands of Vermonters with privately held student loans. 

More info⬇️",276,2020-04-21 17:56:16,Twitter Web App,131,23,GovPhilScott,1252657419416743942,,545107258,False,https://t.co/vGJ0i03akB,en,April,Q2
"This is still not enough but with the work of @VTLabor and @VermontADS to clear 32,000 issues over the last few days, these Vermonters can also start collecting their benefits. I'll have an update at my press conference at 11:00. 2/ 2",234,2020-04-20 11:10:38,Twitter for iPhone,78,8,GovPhilScott,1252192948869087232,545107258.0,545107258,False,,en,April,Q2
"After hard work yesterday from the Treasurer’s office and the Finance Dept., I dropped off over 8,300 checks in the mail this AM. These are $1,200 for those whose UI issues couldn’t be cleared by Saturday. Thank you to the BGS mail center and the USPS for all your hard work. 1/2",303,2020-04-20 11:10:37,Twitter for iPhone,276,56,GovPhilScott,1252192947501707269,,545107258,False,https://t.co/BywCTCeOKe,en,April,Q2
"I want to thank Treasurer Pearce, Dep. Treas. Clasen &amp; their team for coming in on a Sunday to cut checks for those whose unemployment claim issues weren’t resolved yet. @VTLabor cleared nearly 32,000 claim issues. I’ll be dropping off about 8,300 checks in the mail tomorrow AM.",307,2020-04-19 22:45:28,Twitter for iPhone,135,25,GovPhilScott,1252005423055544321,,545107258,False,https://t.co/NcLtlBsokP,en,April,Q2
"""There's a far better, more positive path forward – including for the communities that rely on state college campuses to sustain their local economies – if we are creative and committed to the hard work ahead.""

My statement on the VT State College System:",280,2020-04-19 17:28:09,Twitter Web App,69,23,GovPhilScott,1251925565642354689,,545107258,False,https://t.co/M1sXBU4a1K,en,April,Q2
"The coronavirus has caused anxiety and stress for many Vermonters. Now more than ever we need to take care of our mental health and check in on our friends, family and neighbors.  Remember, professional help is available. You can text VT to 741741, or dial 211 to ask for support.",304,2020-04-18 20:57:47,Twitter for iPhone,196,56,GovPhilScott,1251615933417885696,,545107258,False,https://t.co/nnvE6LsHUr,en,April,Q2
Today the @USNavy commissioned USS Vermont. I want to congratulate all who helped make this happen &amp; thank its entire crew as they honor VT with their service &amp; maintain America’s undersea superiority. In these uncertain times this is a proud day for VT.,286,2020-04-18 17:17:05,Twitter Web App,50,9,GovPhilScott,1251560394872758282,,545107258,False,https://t.co/Ps4wGCLG4k,en,April,Q2
"Thank you, @KillingtonMtn. This is what makes Vermont strong. Vermonters all across the state are stepping up to help each other out during this time of need.",182,2020-04-18 13:03:58,Twitter for iPhone,159,24,GovPhilScott,1251496693767516161,,545107258,False,https://t.co/c6OvG3gKal,en,April,Q2
"This Sunday, April 19 marks one month since Vermont’s first fatality as a result of COVID-19. In honor of all the Vermonters we've lost to this terrible disease, I'm ordering the US and Vermont State flags to fly at half-staff on the 19th of every month for the remainder of 2020.",304,2020-04-17 20:43:06,Twitter Web App,203,39,GovPhilScott,1251249851616165896,,545107258,False,https://t.co/1HcdGOWzvu,en,April,Q2
"I have instructed the Department of Labor to clear the backlog of eligible unemployment claims by tomorrow night. For any that are not cleared, I have authorized the state treasury to issue $1,200 checks to those who remain unpaid. #vtpoli",239,2020-04-17 17:06:08,Twitter for iPhone,250,55,GovPhilScott,1251195250867081216,,545107258,False,,en,April,Q2
"Broadband remains a critical resource for Vermonters in rural areas to stay connected and work and learn remotely during our Stay Home period. We’re grateful to our partners at Microsoft, RTO Wireless and Up And Running I.T. for their assistance providing this important service.",303,2020-04-16 21:58:29,Twitter for iPhone,40,8,GovPhilScott,1250906434805653504,,545107258,False,https://t.co/sMKNdyDX5W,en,April,Q2
