Tweets,Length,Date,Source,Favourites,RTs,Username,id_str,in_reply_to_user_id,user_id,isRT,tco,Language,Month,Quarter
"Wearing a mask to protect others shows strength, not weakness. 

Please continue to follow guidance from 
@healthvermont to help slow the spread. We’re still fighting this pandemic, and it takes all of us working together and caring for one another.",297,2020-06-30 19:36:52,Twitter Web App,193,62,GovPhilScott,1278049884105564161,,545107258,False,https://t.co/SeRCboqAq8,en,June,Q2
"As the Northeast continues to see positive trends like Vermont, last week we expanded the number of states covered under our county-by-county quarantine-free travel policy, which allows direct travel from designated counties without a quarantine.",294,2020-06-29 17:54:37,Twitter Web App,53,11,GovPhilScott,1277661766470828033,,545107258,False,https://t.co/I3tTQb7z2J,en,June,Q2
"Thank you to ⁦@vermont_united⁩ for sending a strong message of unity and community. 

We’re all in this together and that means we need to help each other — wearing masks, distancing, washing our hands and following ⁦@healthvermont⁩ guidelines.",268,2020-06-27 20:43:23,Twitter for iPhone,49,7,GovPhilScott,1276979461829865473,,545107258,False,https://t.co/2GjVS6hICu,en,June,Q2
It only takes 5 minutes!,73,2020-06-27 14:17:55,Twitter for iPhone,21,12,GovPhilScott,1276882456382246912,,545107258,False,https://t.co/IxcYhgncvF,en,June,Q2
"Vermont’s 7-day positivity rate of COVID-19 tests sits at 1.28% — among the lowest in the nation. 

There are also zero COVID-19 patients in ICUs in the entire state of Vermont. 

This is good news, but we must remain vigilant and continue following @healthvermont guidelines.",300,2020-06-26 15:32:36,Twitter for iPhone,258,62,GovPhilScott,1276538863981400064,,545107258,False,https://t.co/psYIagVj3A,en,June,Q2
"It was great to help introduce tonight’s concert in support of this effort to help Vermonters in need — while supporting our farmers and local food systems. 

You can watch talented artists like Dave Matthews, Grace Potter and many more live right now at",302,2020-06-26 01:25:47,Twitter for iPhone,25,1,GovPhilScott,1276325754108817409,,545107258,False,https://t.co/Kzbf02NwSo,en,June,Q2
"I know some are tired of hearing us repeat this, but we're still fighting a pandemic and we must continue taking precautions to slow the spread. Vermonters are good by nature and doing these simple things don't just protect you - they keep others safe.",302,2020-06-25 16:08:30,Twitter Web App,152,49,GovPhilScott,1276185510336253953,,545107258,False,https://t.co/VnKiv5xAbB,en,June,Q2
"Wearing a mask to protect others shows strength, not weakness. 

Please continue to follow guidance from @healthvermont to help slow the spread. We’re still fighting this pandemic, and it takes all of us working together and caring for one another.",272,2020-06-24 19:27:52,Twitter for iPhone,133,40,GovPhilScott,1275873294974148614,,545107258,False,https://t.co/k6eSbr4WDr,en,June,Q2
"The Census helps determine how much federal funding states receive for infrastructure projects, school lunch programs, disaster relief &amp; so much more. VT currently has one of the lowest response rates in the US. If you haven't responded, please do so ASAP. It only takes 10 min!",306,2020-06-24 14:29:56,Twitter Web App,39,31,GovPhilScott,1275798315637096448,,545107258,False,https://t.co/gh1w1YHlFm,en,June,Q2
"Effective July 1, we'll be increasing the maximum weekly benefit amount for Unemployment Insurance claimants, while cutting UI tax rates for employers. We will continue to pull every lever we can to help workers and employers recover from this pandemic.",302,2020-06-23 17:53:03,Twitter Web App,39,11,GovPhilScott,1275487045385891841,,545107258,False,https://t.co/9uozXx4fJf,en,June,Q2
"Are you planning to return to Vermont or visit from another state? If so, please make sure to visit the @healthvermont website for up-to-date travel guidance and to see if you need to quarantine when you arrive.",237,2020-06-23 17:13:20,Twitter Web App,33,18,GovPhilScott,1275477048291622914,,545107258,False,https://t.co/Ke8ODJLwOU,en,June,Q2
"Just because the weather is warmer doesn't mean the pandemic is over. We must remain vigilant. It's just as important now as ever to continue regularly washing your hands, physically distance and wear a mask. We must continue to be smart and stay safe.",276,2020-06-23 13:35:55,Twitter Web App,105,30,GovPhilScott,1275422333201723392,,545107258,False,https://t.co/yGjapqnhv5,en,June,Q2
"Our data continues to show Vermont trending in the right direction. In fact, as of today we had the lowest percent-positivity rate in the USA - fewer than 1% of COVID-19 tests were positive this week. We'll continue to take a safe and methodical approach.",280,2020-06-19 19:38:09,Twitter Web App,158,22,GovPhilScott,1274063943560904704,,545107258,False,https://t.co/nNrkqDHupa,en,June,Q2
"Today I proclaimed #JuneteenthDay in VT. We must do more as a nation – in our communities, in our schools and in our homes – to teach the significance of Juneteenth and recommit to the work of finally achieving equal rights, equal opportunity and equal justice for all Americans.",303,2020-06-19 14:15:11,Twitter Web App,186,58,GovPhilScott,1273982665415417857,,545107258,False,https://t.co/NlhIByN9Vi,en,June,Q2
"Vermont's expanded testing and enhanced contact tracing efforts are critical to our methodical reopening process. It means, as we discover cases, our great team at @healthvermont can work to box them in, so we don't have to take the same mitigation measures we had to early on.",301,2020-06-18 15:04:28,Twitter Web App,55,10,GovPhilScott,1273632678525485056,,545107258,False,https://t.co/mygV6Yea40,en,June,Q2
"Reminder: Tomorrow marks three months since Vermont’s first confirmed fatality from COVID-19. In honor of the Vermonters we have lost to this terrible disease, I have ordered the U.S. and Vermont State flags to fly at half-staff on the 19th of every month for the rest of 2020.",301,2020-06-18 12:28:45,Twitter Web App,105,25,GovPhilScott,1273593492003053573,,545107258,False,https://t.co/7vGmVQocus,en,June,Q2
"While we are easing restrictions for our older Vermonters, we encourage this group and all Vermonters to continue to 'be smart and stay safe.' 5/5",171,2020-06-17 20:04:54,Twitter Web App,7,0,GovPhilScott,1273345897250816000,545107258.0,545107258,False,https://t.co/Pw7WPVQZvj,en,June,Q2
"Starting Friday, in time for Father's Day, Long-Term Care facilities can allow for up to 2 visitors per resident, per day. The visits must be conducted outside and adhere to guidance issued by DAIL around social distancing, temperature checks and record keeping of visitors. 4/5",278,2020-06-17 20:04:53,Twitter Web App,6,1,GovPhilScott,1273345896437202947,545107258.0,545107258,False,,en,June,Q2
"But with our data continuing to show limited spread of the virus in Vermont, we can allow for much-needed social and family connections, which we know is also important for the health and well-being of our seniors. 3/5",218,2020-06-17 20:04:53,Twitter Web App,4,1,GovPhilScott,1273345895665487873,545107258.0,545107258,False,,en,June,Q2
Vermonters in hospitals and long-term care facilities and their loved ones have experienced some of the toughest aspects of this pandemic due to the necessary restrictions we put in place to slow the spread of the virus and protect the vulnerable. 2/5,251,2020-06-17 20:04:53,Twitter Web App,3,0,GovPhilScott,1273345894889521153,545107258.0,545107258,False,,en,June,Q2
"Today I announced measures to gradually ease restrictions on Vermonters in long-term care facilities, hospitals and those over the age of 65. 1/5",170,2020-06-17 20:04:53,Twitter Web App,15,5,GovPhilScott,1273345894012858368,,545107258,False,https://t.co/Pw7WPVQZvj,en,June,Q2
"To save hundreds of jobs and small businesses, my economic relief proposal includes $195 million in Restart VT Emergency Action Grants, using funds we received from the Federal CARES Act. This is why Congress gave states this money. We must act fast to save jobs and livelihoods.",303,2020-06-17 13:48:54,Twitter Web App,12,3,GovPhilScott,1273251274721562624,,545107258,False,https://t.co/xuDM1X04Nw,en,June,Q2
"My $50 million proposal to support dairy farmers and cheesemakers will help save family farms, the jobs they support, and preserve local food systems. 

Vermont’s award-winning dairy farmers are known around the world. They’re  part of our state’s DNA. We must act fast to help.",302,2020-06-17 01:36:55,Twitter for iPhone,63,10,GovPhilScott,1273067064228544512,,545107258,False,https://t.co/SD6MudEYH7,en,June,Q2
Here’s a helpful video from @healthvermont about what you can expect when you get a test:,137,2020-06-16 18:03:51,Twitter for iPhone,10,3,GovPhilScott,1272953046939717633,,545107258,False,https://t.co/z5a22qUmbI,en,June,Q2
"As a result of the pandemic, many Vermonters are struggling to pay their mortgages. Phase II of my Economic Recovery Package would include 3 months of emergency mortgage assistance to low &amp; moderate income Vermonters to help prevent foreclosures and keep families in their homes.",307,2020-06-16 13:10:06,Twitter Web App,39,8,GovPhilScott,1272879123929673731,,545107258,False,https://t.co/37G0ck03pj,en,June,Q2
"With more Vermonters working remotely and kids learning from home, the need to expand access to broadband is even more critical. That's why my Economic Recovery Package includes major investments to expand connectivity and bridge the affordability gap.",301,2020-06-15 13:41:40,Twitter Web App,51,8,GovPhilScott,1272524678125490176,,545107258,False,https://t.co/0BlaAZSkop,en,June,Q2
I've directed the Vermont State Police and the Department of Buildings and General Services to assist the Montpelier Police Department in the investigation. 3/3,160,2020-06-14 15:14:42,Twitter for iPhone,84,3,GovPhilScott,1272185702223052801,545107258.0,545107258,False,,en,June,Q2
"This act of vandalism only reinforces that we’re not immune to racism, divisiveness and hate in Vermont. We must redouble our efforts to dismantle systemic racism and bigotry, and stay united as Vermonters. 2/3",210,2020-06-14 15:14:41,Twitter for iPhone,98,9,GovPhilScott,1272185699752644609,545107258.0,545107258,False,,en,June,Q2
"Early this morning, in an effort to fuel hate and division, the Black Lives Matter painting in front of the State House was vandalized. This painting serves as an important reminder to make equity a priority and use this movement to drive real action and long overdue change. 1/3",279,2020-06-14 15:14:41,Twitter for iPhone,134,33,GovPhilScott,1272185698909589510,,545107258,False,,en,June,Q2
"Any Vermonter who wants a COVID-19 test can get a test. It’s free and easy. Here’s a video from our great team at @healthvermont about what you can expect if you get one. 

You can learn more and  sign up here:",258,2020-06-13 12:00:17,Twitter for iPhone,62,24,GovPhilScott,1271774390506663937,,545107258,False,https://t.co/CzCbBAXtKd,en,June,Q2
Regulatory Modernization: Enhance economic recovery by modernizing VT's regulatory programs and permitting tools. These investments will accelerate the transition of program administration from paper-based to web-based and changes to support more efficient permit processing. 5/5,279,2020-06-12 19:08:20,Twitter Web App,10,2,GovPhilScott,1271519721863741447,545107258.0,545107258,False,,en,June,Q2
Housing and Community Recovery: Provide grants and resources to downtowns that restore consumer confidence and rebuild local economies. Additional funding to provide direct financial assistance to stabilize households that could otherwise face foreclosure. ($11MM) 4/,267,2020-06-12 19:08:19,Twitter Web App,10,2,GovPhilScott,1271519720928354304,545107258.0,545107258,False,,en,June,Q2
"Financial assistance: Funding to help prevent wide-scale foreclosures, bankruptcies and deterioration of the communities in which they operate. Support long term recovery efforts via seed funding to create and grow job creators in new tech., utilizing IP and more. ($55.5M) 3/",276,2020-06-12 19:08:19,Twitter Web App,6,2,GovPhilScott,1271519719925985281,545107258.0,545107258,False,,en,June,Q2
"Broadband Expansion: Broadband program to connect the last mile, bridge the affordability gap, and streamline the processing licensing applications to ensure that families and businesses have continue access necessary to adapt to this new way of life. ($20 million) #vtpoli 2/",276,2020-06-12 19:08:19,Twitter Web App,5,2,GovPhilScott,1271519718822854656,545107258.0,545107258,False,,en,June,Q2
"Phase II of my proposal includes the following investments, using Federal CARES Act money that Congress and the President approved for states to use for these purposes:",192,2020-06-12 19:08:18,Twitter Web App,7,2,GovPhilScott,1271519717279350785,545107258.0,545107258,False,https://t.co/9mNWkoxSzF,en,June,Q2
"Today, my team and I presented the second phase of my $400 million Economic Relief &amp; Recovery proposal, including substantial investments in broadband. This money will be critical, not only to provide relief, but help us build a better foundation to thrive in the future. #vtpoli",307,2020-06-12 18:22:26,Twitter for iPhone,25,11,GovPhilScott,1271508171954282496,,545107258,False,https://t.co/lsLrIV5y65,en,June,Q2
"We must act fast. If the Legislature can only get part of it passed at first, I hope they will get right back to work on the rest of it as soon as possible.   
6/6",163,2020-06-12 16:18:48,Twitter Web App,11,1,GovPhilScott,1271477061375406082,545107258.0,545107258,False,,en,June,Q2
"We need to help small businesses survive now, so they can thrive in the future and generate the tax revenue the state desperately needs to provide services and protect the most vulnerable. 
5/6",193,2020-06-12 16:18:48,Twitter Web App,9,0,GovPhilScott,1271477060352069634,545107258.0,545107258,False,,en,June,Q2
"I felt it was important to partner with the Legislature so we could we work together to provide this relief. While they’ve moved quickly in other areas to help us respond to this crisis, I’m concerned with the pace here and that the package isn’t being moved forward in full.
4/6",279,2020-06-12 16:18:48,Twitter Web App,6,1,GovPhilScott,1271477059232161796,545107258.0,545107258,False,,en,June,Q2
"That’s why -- three weeks ago -- I proposed phase one of a $400 million-dollar package using Federal CARES Act money, to address the immediate cash needs of businesses. 



3/6",199,2020-06-12 16:18:48,Twitter Web App,7,1,GovPhilScott,1271477057936150531,545107258.0,545107258,False,https://t.co/VhfOby4Gg6,en,June,Q2
"We need to help our small businesses who’ve struggled through this. They are the backbone of our state's economy. 

Many are on the brink of bankruptcy and at risk of not being able open at all. 

They need is our financial help -- right now. 
2/6",247,2020-06-12 16:18:47,Twitter Web App,7,0,GovPhilScott,1271477056963063808,545107258.0,545107258,False,,en,June,Q2
"At the start of this pandemic, we needed to act fast to protect the health and safety of Vermonters. 

Vermonters responded, and as a result, hundreds of lives have been saved. But, COVID-19 also created an economic crisis. We must act with the same sense of urgency to help. 1/6",279,2020-06-12 16:18:47,Twitter Web App,22,4,GovPhilScott,1271477055880912896,,545107258,False,,en,June,Q2
I support the City’s move to paint the Black Lives Matter message on State Street because I think it will be a necessary reminder that we must make equity a priority and use this movement to drive real action that will benefit all of Vermont.,266,2020-06-12 00:47:53,Twitter for iPhone,213,24,GovPhilScott,1271242786638041099,,545107258,False,https://t.co/1mnzwfeA2Z,en,June,Q2
"The good news is, we can fix this without waiting for a vaccine, or other solutions out of our control. It will take us uniting to make this a better country for everyone.  This is in all of our hands.

10/10",208,2020-06-11 18:13:36,Twitter Web App,37,1,GovPhilScott,1271143563557044225,545107258.0,545107258,False,,en,June,Q2
"The fact is, hate, ignorance and the inequality we see is a far greater risk to the long term health of our nation than even COVID-19. 
9/10",140,2020-06-11 18:13:36,Twitter Web App,37,3,GovPhilScott,1271143562042920961,545107258.0,545107258,False,,en,June,Q2
"We should take this time to reflect on what role each of us can play to end hate, racism and bigotry.  

And for those of us who are white, who aren’t typically the victim of it, we need to take a very close look because the reality is, it’s everywhere, even here.
8/10",269,2020-06-11 18:13:36,Twitter Web App,21,0,GovPhilScott,1271143560696467457,545107258.0,545107258,False,,en,June,Q2
"We need to acknowledge it’s systemic -- it’s built into our social systems, our economic systems and everything in between. We must also remember we’re not immune to this in Vermont. 
7/10",188,2020-06-11 18:13:35,Twitter Web App,19,1,GovPhilScott,1271143559710879745,545107258.0,545107258,False,,en,June,Q2
"These are just some pieces of one aspect of the reforms we must pursue. I've also established a Racial Equity Task Force to look at other areas, as well. 

The bottom line is, we cannot continue to treat racism like uncomfortable and rare events. 
6/10",252,2020-06-11 18:13:35,Twitter Web App,19,0,GovPhilScott,1271143558653906945,545107258.0,545107258,False,,en,June,Q2
"- Change hiring practices at law enforcement agencies

- Improve the process for promotions and selecting supervisors

- Redouble community collaboration efforts

5/10",167,2020-06-11 18:13:35,Twitter Web App,19,0,GovPhilScott,1271143557244559361,545107258.0,545107258,False,,en,June,Q2
"- Create and adopt a statewide use-of-force policy

- Modernize training of law enforcement personnel

- Implement one or more means of providing community oversight of police

4/10",181,2020-06-11 18:13:35,Twitter Web App,17,1,GovPhilScott,1271143556204412928,545107258.0,545107258,False,,en,June,Q2
"- Ensure allegations of police misconduct are investigated with transparency and consistency

- Implement a standardized, statewide data collection system for use of force, traffic stops, arrests, mental health and other related topics

3/10",241,2020-06-11 18:13:34,Twitter Web App,21,2,GovPhilScott,1271143555143172096,545107258.0,545107258,False,,en,June,Q2
"This includes how we do law enforcement. We need a systematic approach to comprehensive police reform. I'm pleased to join with other partners in calling for series of initial reforms, including: 

- Require body-worn cameras for all law enforcement officers

2/10",264,2020-06-11 18:13:34,Twitter Web App,22,2,GovPhilScott,1271143553972998150,545107258.0,545107258,False,,en,June,Q2
"I’ve been inspired by peaceful #BlackLivesMatter protests we’ve seen across the country and in Vermont, crying out for long overdue change. It’s not enough to simply NOT be racist, we must be ANTI-racist and work to address systemic injustices in all aspects of our society. 
1/10",280,2020-06-11 18:13:34,Twitter Web App,138,20,GovPhilScott,1271143552488177671,,545107258,False,,en,June,Q2
"We have a lot of work to do to build a more equitable Vermont and nation. We as a state, and we as individuals, all have a role to play. It is not enough anymore to just say we are not racist. We must be ANTI-racist, and take action as a nation that is long overdue.",266,2020-06-10 17:54:38,Twitter Web App,187,27,GovPhilScott,1270776401512333312,,545107258,False,,en,June,Q2
"Thank you, @McClureVtFdn, for your commitment to our state and to the #Classof2020",106,2020-06-10 15:33:06,Twitter for iPhone,29,8,GovPhilScott,1270740781779890176,,545107258,False,https://t.co/A9D6aynbce,en,June,Q2
"We look forward to working with the legislature and with public education community on these issues, sooner rather than later, so we’re ready in the fall. 8/8",158,2020-06-10 15:17:55,Twitter Web App,7,0,GovPhilScott,1270736961058283523,545107258.0,545107258,False,,en,June,Q2
".@VTEducation and @HealthVermont will be issuing this guidance jointly next week. We anticipate some legislative changes will be needed, including to the school calendar, attendance policies and others -- and we know some funding may be required to help make this work. 7/8",273,2020-06-10 15:17:55,Twitter Web App,6,0,GovPhilScott,1270736959971954691,545107258.0,545107258,False,,en,June,Q2
We’re learning more every day about this virus -- and have more tools to help prevent its spread today than we did 3 months ago -- which helps us prepare for this transition back to school. 6/8,193,2020-06-10 15:17:54,Twitter Web App,3,0,GovPhilScott,1270736959007326208,545107258.0,545107258,False,,en,June,Q2
"And while teachers and administrators adapted well to this pandemic, I think we would all agree this approach cannot continue without kids falling behind in their course work and in the social development that takes place in our schools. 5/8",241,2020-06-10 15:17:54,Twitter Web App,2,0,GovPhilScott,1270736957920948229,545107258.0,545107258,False,,en,June,Q2
"In March, when we made the difficult decision to close schools, we acknowledged there’s no perfect replacement for the learning that takes place in a school building. 4/8",170,2020-06-10 15:17:54,Twitter Web App,2,0,GovPhilScott,1270736956994007042,545107258.0,545107258,False,,en,June,Q2
"That said, for students and teachers alike, it’s going to look a little different in the fall than it did before COVID-19. But we need to work through these issues together, because we know how vital it is for our kids and their development to move forward and reopen. 3/8",272,2020-06-10 15:17:54,Twitter Web App,2,0,GovPhilScott,1270736955920318464,545107258.0,545107258,False,,en,June,Q2
".@VTEducation and @HealthVermont, along with stakeholders across the preK-12 spectrum, have been working together developing this guidance. Our approach will focus on the health and safety of kids, their families, as well as teachers, staff and anyone else working in schools. 2/8",280,2020-06-10 15:17:53,Twitter Web App,2,0,GovPhilScott,1270736955068817409,545107258.0,545107258,False,,en,June,Q2
"We’ve been hearing from a lot of Vermonters wondering what schools will look like this fall, so I wanted to provide an update at my briefing today. 

As we’ve said in the past, we fully expect schools to open and we're working on guidance to make sure we can do so safely. 1/8",300,2020-06-10 15:17:53,Twitter Web App,33,14,GovPhilScott,1270736953458208768,,545107258,False,https://t.co/h7mfwJ1mPG,en,June,Q2
"We've been guided by science and data from the start, with public health and safety as our top priority. We’ll continue to work our way through this, and learn from it, so that we can further strengthen our response to bridge the gap to a time when there’s a vaccine. 

5/5",273,2020-06-09 18:31:57,Twitter Web App,12,2,GovPhilScott,1270423404231958530,545107258.0,545107258,False,,en,June,Q2
"We'll continue to closely watch the data (link below) as we gradually reopen, with a focus on four key metrics:

- Syndromic surveillance
- Viral growth &amp; reproductive rates 
- Percentage of new positive tests
- Hospital and critical care bed capacity

4/5",284,2020-06-09 18:31:57,Twitter Web App,9,2,GovPhilScott,1270423403166609408,545107258.0,545107258,False,https://t.co/E2plMCiW9O,en,June,Q2
"As a result of their hard work and preparation, our @healthvermont epidemiology team has the capacity to trace up to 900 new cases per week.  3/5",171,2020-06-09 18:31:57,Twitter Web App,6,1,GovPhilScott,1270423402138996741,545107258.0,545107258,False,https://t.co/o4iQ3VKcKc,en,June,Q2
"Expanded testing and enhanced contact tracing efforts are critical to our cautious and methodical reopening strategy. It means, as we discover cases, our great team at @healthvermont can work to box them in, so we don't have to take the same extreme measures we did early on. 2/5",279,2020-06-09 18:31:56,Twitter Web App,6,1,GovPhilScott,1270423401153339405,545107258.0,545107258,False,,en,June,Q2
"We've significantly increased our testing capacity over the past several weeks, including for anyone without symptoms who'd like a test.

As a result, we'll find cases, especially asymptomatic ones, that might not have been identified just weeks ago. 1/5",303,2020-06-09 18:31:56,Twitter Web App,18,8,GovPhilScott,1270423399521755140,,545107258,False,https://t.co/o4iQ3VKcKc,en,June,Q2
"Last week I signed an Executive Order creating a Racial Equity Task Force. Those interested in serving as a public member can submit an application until this Friday, June 12. 

More information and the application can be found at the link below.",274,2020-06-09 14:20:08,Twitter Web App,33,15,GovPhilScott,1270360030655758336,,545107258,False,https://t.co/5bYyQeeOsL,en,June,Q2
A full list of the health and safety guidelines can be found at the link below. 11/11,110,2020-06-08 18:34:24,Twitter Web App,12,3,GovPhilScott,1270061631318437890,545107258.0,545107258,False,https://t.co/clOGsmoaNM,en,June,Q2
"Now, like everything else, this will obviously look a little different than normal - but we must find new ways of doing things - so we can get back to something more familiar, while keeping people safe and healthy. 10/11",220,2020-06-08 18:34:23,Twitter Web App,9,1,GovPhilScott,1270061629632323589,545107258.0,545107258,False,,en,June,Q2
"Teams will need to work to keep 6 feet between players, coaches and spectators whenever possible, and facial coverings are encouraged when participants are close together between play. There are also strict hygiene and equipment cleaning requirements. 9/11",256,2020-06-08 18:34:23,Twitter Web App,10,1,GovPhilScott,1270061628067852294,545107258.0,545107258,False,,en,June,Q2
