Tweets,Length,Date,Source,Favourites,RTs,Username,id_str,in_reply_to_user_id,user_id,isRT,tco,Language,Month,Quarter
"It’s fitting that today is #NationalDoctorsDay. Our doctors and health care workers deserve our deepest gratitude – they’re risking their lives to save others during this pandemic. As they work around the clock, you can help them by staying home. #StayHomeMN",258,2020-03-31 00:41:15,Twitter Web App,1765,199,GovTimWalz,1244786804672335872,,1064603540956565504,False,,en,March,Q1
"There is nothing more important than the health, safety, and wellbeing of Minnesotans. Her strong background in procurement and public-private partnerships will serve our state well in the weeks and months to come. #StayHomeMN",226,2020-03-30 20:52:13,Twitter Web App,163,7,GovTimWalz,1244729164541890566,1.0646035409565655e+18,1064603540956565504,False,,en,March,Q1
"Commissioner Roberts-Davis will focus on managing inventories, securing needed supplies such as personal protective equipment and ventilators, and developing solutions to offset supply shortages for hospitals and emergency responders.",234,2020-03-30 20:52:13,Twitter Web App,132,5,GovTimWalz,1244729163585593345,1.0646035409565655e+18,1064603540956565504,False,,en,March,Q1
"Our front-line health care professionals deserve our complete support - that starts with giving them the tools they need to keep themselves and their patients healthy. 

Today I appointed Commissioner @acalicerd to lead Minnesota’s effort to maintain lifesaving care supplies.",276,2020-03-30 20:52:12,Twitter Web App,710,65,GovTimWalz,1244729162209861633,,1064603540956565504,False,,en,March,Q1
"As a former teacher, I'm rooting for our students, parents, and educators today as Minnesota takes on a new challenge! #StayHomeMN",155,2020-03-30 16:55:00,TweetDeck,862,77,GovTimWalz,1244669466333462549,,1064603540956565504,False,https://t.co/iYtVjq6xTj,en,March,Q1
"Minnesotans: Join me in thanking our health care professionals, first responders, educators, grocers, farmers, child care providers, public employees, and so many more on the front lines of this crisis. #StayHomeMN",238,2020-03-29 23:04:00,TweetDeck,3771,488,GovTimWalz,1244399940266123265,,1064603540956565504,False,https://t.co/HwqH940Cib,en,March,Q1
"These may be challenging times, but Minnesotans look out for one another and that’s how we’re going to get through this. Here are a few ways YOU can give back to our community right now.",210,2020-03-29 15:22:00,TweetDeck,886,318,GovTimWalz,1244283674155028481,,1064603540956565504,False,https://t.co/hyVggpC4Vx,en,March,Q1
"Thanks for the suggestions so far! 

Update from Gus: Tournament wrapped up, and he’s currently reading Star Wars: Revenge of the Sith.",159,2020-03-29 00:31:27,Twitter for iPhone,720,22,GovTimWalz,1244059562346455045,1.0646035409565655e+18,1064603540956565504,False,https://t.co/9atoRWaOG1,en,March,Q1
"Let's start the state's largest book club. What are you reading, Minnesota? 📚 

Gwen: Mississippi Sissy

Hope: Uneasy Peace

Gus: Xbox tournament (working on it) 

Me: Just finished Cryptonomicon, looking for suggestions.",245,2020-03-29 00:15:20,Twitter for iPhone,3431,297,GovTimWalz,1244055503489118208,,1064603540956565504,False,https://t.co/dq7RdoCz4P,en,March,Q1
Worried about health care costs? It’s more important than ever that we’re all covered right now 🩺. Remember you can sign up on MNsure any time before April 21 at . #StayHomeMN,222,2020-03-28 21:15:00,TweetDeck,182,90,GovTimWalz,1244010121442672640,,1064603540956565504,False,https://t.co/btOd88pOY6,en,March,Q1
"🖊️Just signed a comprehensive COVID-19 package to keep Minnesota healthy, support our food systems, and care for our most vulnerable in the face on an unprecedented crisis.

Proud of the way the Legislature worked across the aisle to get this done. #OneMinnesota #StayHomeMN",298,2020-03-28 17:29:04,Twitter for iPhone,2419,216,GovTimWalz,1243953263256522753,,1064603540956565504,False,https://t.co/IzKwkgbv16,en,March,Q1
"Thank you to all our first responders across Minnesota, including these two good boys. #StayHomeMN",122,2020-03-28 00:35:18,Twitter for iPhone,2258,159,GovTimWalz,1243698140655517703,,1064603540956565504,False,https://t.co/O0vhjjdS4N,en,March,Q1
"I’m grateful for @LtGovFlanagan’s partnership and leadership now more than ever. While we’re keeping distance from each other, we’re responding to #COVIDー19 as a team.  #StayHomeMN",203,2020-03-27 21:53:00,TweetDeck,389,16,GovTimWalz,1243657296661475329,,1064603540956565504,False,https://t.co/gEmacras4E,en,March,Q1
"Minnesota’s two-week Stay at Home order takes effect tonight at 11:59. Here’s what’s open and what’s closed. 
 
Still have questions? Head to  for resources and answers to frequently asked questions. 
 
Let’s keep fighting #COVIDー19, together. #StayHomeMN",302,2020-03-27 18:58:00,TweetDeck,725,343,GovTimWalz,1243613256695963648,,1064603540956565504,False,https://t.co/7PMq0DKbwP,en,March,Q1
"We’re in uncharted waters, but we’re rowing the boat together. #StayHomeMN",98,2020-03-27 17:25:47,Twitter for iPhone,1572,154,GovTimWalz,1243590051335999488,,1064603540956565504,False,https://t.co/6RV3xtoegY,en,March,Q1
"In collaboration with our Children’s Cabinet, six Minnesota foundations today joined @ThinkSmallMN in launching a statewide child care program. I’m proud to support this effort, which provides invaluable education and services to our state’s emergency response.",285,2020-03-27 00:30:00,TweetDeck,278,50,GovTimWalz,1243334419336880129,,1064603540956565504,False,https://t.co/NajElZECSc,en,March,Q1
"The Legislature came together in a quick, bipartisan fashion to pass our proposed #COVIDー19 legislation. I look forward to signing these bills to keep our state working🛠️, support our food systems🌽, care for children of emergency workers🦺, and more.",273,2020-03-26 23:18:00,Twitter Web App,666,89,GovTimWalz,1243316299993841666,,1064603540956565504,False,https://t.co/Vd2MxUQ71b,en,March,Q1
"Can’t tell you how much @GwenWalz and I appreciate all you’re doing to step up and protect your neighbors during the #COVIDー19 pandemic. Stay healthy, Minnesota. #StayHomeMN",197,2020-03-26 22:09:32,Twitter for iPhone,2674,180,GovTimWalz,1243299071135277067,,1064603540956565504,False,https://t.co/m5aZaoD7px,en,March,Q1
I want to thank all of the health care providers who are working around the clock to keep Minnesotans safe and healthy and prepare us for the weeks ahead. #StayHomeMN,190,2020-03-26 15:21:17,Twitter Web App,842,140,GovTimWalz,1243196329448427521,1.0646035409565655e+18,1064603540956565504,False,https://t.co/KKt3jsOQkw,en,March,Q1
"The health and safety of Minnesotans is my top priority. The COVID-19 pandemic presents unprecedented challenges. During this Stay at Home order, I will work with our world-renowned health care sector to build out hospital capacity and increase access to life-saving equipment.",277,2020-03-26 15:21:16,Twitter Web App,1519,114,GovTimWalz,1243196328290725889,,1064603540956565504,False,,en,March,Q1
"I urge you not to take our Stay at Home Order as an opportunity to stockpile more than you need. Our stores will have food and other necessary supplies, and our grocery store workers are keeping things stocked. This is about social distancing and taking precautions to save lives.",304,2020-03-26 00:02:00,TweetDeck,7277,1685,GovTimWalz,1242964985011003393,,1064603540956565504,False,https://t.co/N7VCtMAjpX,en,March,Q1
"These are trying times. But we are Minnesotans. We see challenges, and we tackle them. No matter how daunting the challenge; no matter how dark the times; Minnesota has always risen up—by coming together. If we unite as One Minnesota, we will save lives. #StayHomeMN",290,2020-03-25 19:28:54,Twitter Web App,1705,987,GovTimWalz,1242896257913442305,1.0646035409565655e+18,1064603540956565504,False,https://t.co/pAOStd1NG2,en,March,Q1
"The virus will still be here when this two-week period is over, but we’ll be better prepared. We will work with our health care sector, manufacturers, business community, and strong-spirited Minnesotans across the state to tackle this virus head on. #StayHomeMN",285,2020-03-25 19:28:54,Twitter Web App,995,336,GovTimWalz,1242896256348848130,1.0646035409565655e+18,1064603540956565504,False,https://t.co/pTSxsNdgqT,en,March,Q1
"We must take bold action to save the lives of Minnesotans. As a former Command Sergeant Major in the Army National Guard, I believe in having a plan – which is why I’m directing Minnesotans to stay at home and limit their movements to essential services. #StayHomeMN",290,2020-03-25 19:28:53,Twitter Web App,5300,2187,GovTimWalz,1242896254839017472,,1064603540956565504,False,https://t.co/W2TAejwnBs,en,March,Q1
The health and safety of Minnesotans is my top priority. I’m providing an update on our state’s response to COVID-19 and what this means for our neighbors and our loved ones. Tune in:  #StayHomeMN,243,2020-03-25 19:12:31,TweetDeck,1961,835,GovTimWalz,1242892136976199681,,1064603540956565504,False,https://t.co/lvcNluCCjS,en,March,Q1
And the final encouraging statistic for today:,70,2020-03-24 22:46:55,Twitter for iPhone,690,9,GovTimWalz,1242583702120673288,1.0646035409565655e+18,1064603540956565504,False,https://t.co/4jDzTmBa8V,en,March,Q1
"If you don’t believe me, see for yourself:",66,2020-03-24 22:46:53,Twitter for iPhone,535,91,GovTimWalz,1242583695468486657,1.0646035409565655e+18,1064603540956565504,False,https://t.co/ZeVnyZJ1RX,en,March,Q1
"Thank you, Minnesota. You’re clearly making sacrifices and doing your part to make sure our hospitals have the supplies necessary to keep Minnesotans safe, and the data backs that up. #StayHomeMN",219,2020-03-24 22:46:51,Twitter for iPhone,3404,269,GovTimWalz,1242583685054058497,,1064603540956565504,False,https://t.co/uaBgr3YGVH,en,March,Q1
Today I suspended evictions in Minnesota. COVID-19 is causing financial hardship for families across the state and we must ensure everyone can #StayHomeMN.,179,2020-03-23 23:45:00,TweetDeck,1987,329,GovTimWalz,1242235931047985154,,1064603540956565504,False,https://t.co/xpBsFis6Tc,en,March,Q1
"To our small businesses facing unprecedented uncertainty: We’re with you. Unemployment Insurance helps, but it’s not enough. That’s why I just signed an Executive Order to provide immediate relief by creating an emergency loan for struggling businesses.",277,2020-03-23 21:38:00,TweetDeck,679,133,GovTimWalz,1242203970396753920,,1064603540956565504,False,https://t.co/quNFQHt3UM,en,March,Q1
"This isn’t a typical Monday morning but we’re still hard at work to combat the #COVIDー19 crisis. Minnesotans have been through long winters before, we’ll get through this one like we always do, together. Be safe, and #StayHomeMN.",253,2020-03-23 17:37:12,Twitter for iPhone,3472,365,GovTimWalz,1242143372200095744,,1064603540956565504,False,https://t.co/C0PsPyqIQo,en,March,Q1
"Protective gear like face masks are essential for our hospitals, health care facilities, and first responders. The Minnesota National Guard wasted no time delivering these supplies for Minnesotans. Thank you.",234,2020-03-23 16:02:00,TweetDeck,1343,143,GovTimWalz,1242119413890830336,,1064603540956565504,False,https://t.co/Nyq32pbCB4,en,March,Q1
"After learning I had contact with someone who has COVID-19, I plan to lead by example and work from home. I currently have no symptoms and will continue working tirelessly to combat the spread of COVID-19. #StayHomeMN",217,2020-03-23 15:09:13,TweetDeck,6779,714,GovTimWalz,1242106131180331011,,1064603540956565504,False,,en,March,Q1
"It’s going to take every single one of us to fight this virus. Thanks for speaking up, Coach. #StayHomeMN",129,2020-03-23 13:10:40,Twitter Web App,486,50,GovTimWalz,1242076296911470592,,1064603540956565504,False,https://t.co/P0tr0H1aVA,en,March,Q1
Minnesota’s strength comes from our ability to come together and lift each other up. Thank you @ThinkSmallMN for launching supportive local programs for over 4800 children of essential workers!,193,2020-03-21 23:22:00,TweetDeck,891,66,GovTimWalz,1241505367118483457,,1064603540956565504,False,,en,March,Q1
Small businesses across Minnesota are putting the health of their neighbors before their bottom line. This loan assistance will help our state’s businesses recover from the economic hardship caused by COVID-19.,235,2020-03-21 20:52:31,TweetDeck,417,114,GovTimWalz,1241467748561158147,,1064603540956565504,False,https://t.co/4yPy4Nnq5J,en,March,Q1
Every Minnesotan deserves access to health coverage during this uncertain time. We worked with @MNsure to set up a special enrollment period to help ensure Minnesotans can receive the care they need during the #COVIDー19 crisis.,251,2020-03-21 18:47:00,TweetDeck,581,191,GovTimWalz,1241436161190567939,,1064603540956565504,False,https://t.co/TGPzilHphJ,en,March,Q1
"Health officials today announced Minnesota's first death due to COVID-19. Gwen and I extend our deepest sympathy to their loved ones during this time of loss. As the virus continues to spread in Minnesota, we must all continue to do everything we can to keep each other safe.",275,2020-03-21 16:48:27,TweetDeck,2188,267,GovTimWalz,1241406329509609475,,1064603540956565504,False,,en,March,Q1
"Thank you to the nearly 1000 Minnesota child care providers who've agreed to continue serving children of emergency workers during the COVID-19 crisis. All child care providers, including those who have had to close temporarily, provide critical care for our littlest Minnesotans.",280,2020-03-21 00:13:00,TweetDeck,3909,385,GovTimWalz,1241155813848141824,,1064603540956565504,False,,en,March,Q1
No one should be targeting Minnesotans for personal gain during the #COVIDー19 crisis. Today I signed an Order banning price gouging during times of emergency. Minnesotans can report instances of price gouging by calling 800-657-3787.,257,2020-03-20 23:04:55,TweetDeck,1420,316,GovTimWalz,1241138681345384449,,1064603540956565504,False,https://t.co/faKXJ0eh79,en,March,Q1
"Thank you @Twins for getting the word out to Minnesotans to #StayHomeMN. Together we can #FlattenTheCurve to protect our family, friends, and neighbors.",176,2020-03-20 20:12:05,Twitter Web App,799,115,GovTimWalz,1241095186123567106,,1064603540956565504,False,https://t.co/zcht4TeGNX,en,March,Q1
"I'm joining our team at @mnhealth for a daily briefing on #COVIDー19. Tune in.

🎥:",105,2020-03-20 19:09:45,Twitter for Android,182,37,GovTimWalz,1241079500856754176,,1064603540956565504,False,https://t.co/Wxsfz31kSo,en,March,Q1
I’m joining our team at the @mnhealth for a daily briefing on COVID-19 at 2pm. Tune in 🎥:,137,2020-03-20 17:57:27,Twitter for iPhone,194,76,GovTimWalz,1241061302673510401,,1064603540956565504,False,https://t.co/N1RSJ5rMTr,en,March,Q1
Spread the word: Stay home if you can and save lives. #StayHomeMN,89,2020-03-19 23:17:50,Twitter Web App,2209,957,GovTimWalz,1240779545436971008,,1064603540956565504,False,https://t.co/n9tovMHliS,en,March,Q1
Taking care of one another is one tradition all Minnesotans share. I applaud this coalition of statewide partners for launching the Minnesota Disaster Recovery Fund to respond to the unprecedented economic challenges our neighbors are facing. #OneMinnesota,280,2020-03-18 23:59:58,Twitter for iPhone,357,70,GovTimWalz,1240427758494330881,,1064603540956565504,False,https://t.co/JKkevD2jci,en,March,Q1
"It is more important than ever that we pull together, take care of each other, and stay informed on the #COVIDー19 pandemic.

🎥:",151,2020-03-18 20:04:26,Twitter for Android,338,57,GovTimWalz,1240368486393819137,,1064603540956565504,False,https://t.co/L2b2zSFbqH,en,March,Q1
"As our Asian American community faces heightened discrimination due to COVID-19, my message is clear: Viruses don’t discriminate and neither should we. #OneMinnesota",165,2020-03-18 15:23:00,TweetDeck,6549,1396,GovTimWalz,1240297659451224065,,1064603540956565504,False,,en,March,Q1
"Minnesotans, do you have questions about COVID-19? Call the Department of Health hotline, open every day between 7AM and 7PM: 
Metro: 651-297-1304
Greater MN: 1-800-657-3504",173,2020-03-18 00:15:00,TweetDeck,473,280,GovTimWalz,1240069153567821824,,1064603540956565504,False,,en,March,Q1
We must do everything we can to support workers who are negatively impacted by #COVIDー19. That is why I signed an Executive Order yesterday to ensure Minnesotans who are not able to work due to COVID-19 have access to Unemployment Insurance. More info:,300,2020-03-17 21:31:00,TweetDeck,505,171,GovTimWalz,1240027881633447939,,1064603540956565504,False,https://t.co/bKnsm86lCv,en,March,Q1
"Due to COVID-19, I sent a letter to House Speaker @melissahortman today announcing that I will no longer be giving my State of the State address in person. I will instead televise my address to the legislature and the State of Minnesota on a future date.",278,2020-03-17 21:21:44,TweetDeck,253,34,GovTimWalz,1240025551496232961,,1064603540956565504,False,https://t.co/ZNmed6sibX,en,March,Q1
"Our #1 priority is combating #COVID-19, but doesn’t mean democracy stops. Today I signed measures to: 
•Improve safety on Hwy 14
•Provide emergency assistance after natural disasters
•Offer low-interest loans to farmers
Whatever comes our way, we're still #OneMinnesota.",294,2020-03-17 20:07:03,TweetDeck,711,64,GovTimWalz,1240006755557552131,,1064603540956565504,False,https://t.co/ZcGAuYz6Yp,en,March,Q1
"Listen to @MHealthFairview: stay home, avoid big groups and wash your hands. #FlattenTheCurve #StayHomeMN",129,2020-03-17 18:55:05,Twitter Web App,111,45,GovTimWalz,1239988646046044163,,1064603540956565504,False,https://t.co/sf80Xww4Bb,en,March,Q1
Thanks to my sister in law Maribeth Sagmoe who sent bars for my team! She then went to prepare to serve her students as a teacher in the Richfield Schools. That’s what Minnesotans do!,207,2020-03-17 16:39:45,Twitter for iPhone,537,19,GovTimWalz,1239954585915133961,,1064603540956565504,False,https://t.co/4ExBVy4StU,en,March,Q1
"Now is the time to take decisive action to curb the spread of #COVIDー19. That’s why I’m ordering a partial closure of bars, restaurants &amp; other places of public amusement or accommodation beginning tomorrow at 5 p.m.

🎥:",248,2020-03-16 22:32:06,Twitter for Android,1295,394,GovTimWalz,1239680871101337605,,1064603540956565504,False,https://t.co/HzhRMar0FC,en,March,Q1
Let’s work together to keep all Minnesotans safe and healthy. Families with questions about #COVID-19 may call 1-800-657-3903 and child care providers with questions may call 1-888-234-1268.,190,2020-03-15 23:37:01,Twitter Web App,69,33,GovTimWalz,1239334820070776833,1.0646035409565655e+18,1064603540956565504,False,,en,March,Q1
"During the coming weeks, as we respond to #COVIDー19, families will rely heavily on child care providers. As the child care providers respond to health guidance and changing circumstances, they will need support and flexibility from families too.",269,2020-03-15 23:37:01,Twitter Web App,59,15,GovTimWalz,1239334818820874240,1.0646035409565655e+18,1064603540956565504,False,https://t.co/QdsPqlzOSq,en,March,Q1
@LtGovFlanagan and I are grateful for child care providers who support MN families. Today we encouraged child care providers to remain open at this time and issued guidance to protect their health and safety. Child care providers with questions may call 1-888-234-1268.,269,2020-03-15 23:37:00,Twitter Web App,116,36,GovTimWalz,1239334817684246529,1.0646363072578601e+18,1064603540956565504,False,,en,March,Q1
I'm there.,34,2020-03-15 19:49:18,Twitter Web App,1578,59,GovTimWalz,1239277515031674880,,1064603540956565504,False,https://t.co/wWkzfOuCm1,en,March,Q1
"My top priority as Governor is the safety of Minnesotans, especially our kids. That’s why I’m ordering the temporary closure of schools so we can put plans in place to educate and feed our students, regardless of what's to come.

🎥:",256,2020-03-15 15:01:51,Twitter for Android,1993,515,GovTimWalz,1239205173664284674,,1064603540956565504,False,https://t.co/QYiiTLN50v,en,March,Q1
"The safety of Minnesotans is my top priority which is why I’m declaring a peacetime state of emergency. I advise and urge Minnesotans to follow @mnhealth community mitigation strategies to combat the spread of #COVIDー19.

🎥:",248,2020-03-13 18:12:24,Twitter for Android,633,209,GovTimWalz,1238528352895545345,,1064603540956565504,False,https://t.co/gCOJzZtYof,en,March,Q1
"Minnesotans know the importance of having a plan and being prepared for whatever comes our way. That's why @LtGovFlanagan and I are focusing our supplemental budget proposal on emergency response and preparedness.

🎥:",240,2020-03-12 15:04:24,Twitter for Android,163,37,GovTimWalz,1238118653276626944,,1064603540956565504,False,https://t.co/tR4c0QYvJG,en,March,Q1
"This afternoon I spoke with @SPPS_News Superintendent @JoeGothard and @SPFE28 President @nfabe and strongly encouraged both of them to head back to the table, negotiate in good faith, and come to an agreement that’s good for our students, our schools, and our educators.",270,2020-03-12 01:09:05,Twitter for iPhone,289,43,GovTimWalz,1237908439596249088,,1064603540956565504,False,,en,March,Q1
"Thank you to the disability community for letting your voices be heard today at the Capitol! Direct support professionals are critical to supporting Minnesotans with disabilities as they live full, meaningful lives, and we’re committed to supporting them in that work #SeeOurDSPs",303,2020-03-10 22:35:16,Twitter for iPhone,141,17,GovTimWalz,1237507341001555971,,1064603540956565504,False,https://t.co/h3rNLCXCgt,en,March,Q1
🎥:,25,2020-03-10 16:49:56,Twitter for Android,21,3,GovTimWalz,1237420435433816065,1.0646035409565655e+18,1064603540956565504,False,https://t.co/9STOTVf2qU,en,March,Q1
Preparing our state for #COVIDー19 has become our top priority. This pressing public health crisis transcends partisanship. That's why I'm proud to sign this bipartisan legislation into law to prepare for a potential outbreak and protect the health of Minnesotans.,263,2020-03-10 16:49:56,Twitter for Android,439,56,GovTimWalz,1237420434523590658,,1064603540956565504,False,,en,March,Q1
"My message at Minnesotanos Day at the Capitol this morning: we value and stand with our Latino community. From boosting our economy as small business owners and employees to contributing to the culture of our great state, we are stronger because you are here.",283,2020-03-09 23:19:24,Twitter Web App,57,8,GovTimWalz,1237156059426574339,,1064603540956565504,False,https://t.co/6Pjqh249lV,en,March,Q1
"Last Friday, I spent the morning celebrating National Reading Month with Minnesota’s littlest learners. This month pick up a book and read with children in your life. #NationalReadingMonth #MarchIsReadingMonth",233,2020-03-09 18:10:05,Twitter Web App,107,6,GovTimWalz,1237078218508840962,,1064603540956565504,False,https://t.co/XSDWJ9hzTn,en,March,Q1
Thank you to my partner-in-justice @LtGovFlanagan and all women who have been leading the way to better representation and better results for all Minnesotans. #IWD2020,167,2020-03-08 18:58:20,Twitter Web App,26,2,GovTimWalz,1236727970951311366,1.0646035409565655e+18,1064603540956565504,False,,en,March,Q1
"I'm proud to proclaim today #InternationalWomensDay. An equal world is a stronger world, because democracy works best when it reflects the communities we seek to represent. #IWD2020",205,2020-03-08 18:58:19,Twitter Web App,80,9,GovTimWalz,1236727968917082112,,1064603540956565504,False,https://t.co/H32Gi2IvVx,en,March,Q1
"Today, I announced the first #COVIDー19 case detected in Minnesota. This may be concerning, but the State of Minnesota is prepared. Learn more and stay up-to-date via @mnhealth:",200,2020-03-06 23:31:23,Twitter Web App,113,49,GovTimWalz,1236071910259281922,,1064603540956565504,False,https://t.co/7sUHmtorUz,en,March,Q1
We are collaborating across state agencies and remain in close contact with both federal and local partners as we monitor developments with this outbreak. Our state is fortunate to have a strong public health sector and world-class health care providers to keep Minnesotans safe.,279,2020-03-06 22:04:27,Twitter for iPhone,68,26,GovTimWalz,1236050034191450112,1.0646035409565655e+18,1064603540956565504,False,,en,March,Q1
"The State of Minnesota has been working around the clock to prepare for #COVIDー19 and I am confident that @mnhealth is up to the challenge.

🎥",165,2020-03-06 22:04:26,Twitter for iPhone,97,35,GovTimWalz,1236050031280562178,,1064603540956565504,False,https://t.co/11QTiDqIwA,en,March,Q1
"I welcomed @VP Pence to Minnesota today for a conversation at @3M about how we can partner across state and federal government, as well as the public and private sectors, to keep Minnesotans healthy #COVIDー19",232,2020-03-05 23:45:09,Twitter for iPhone,120,17,GovTimWalz,1235712989082333185,,1064603540956565504,False,https://t.co/fDRbfMduYh,en,March,Q1
"Sitting down with our interns is always a highlight of my day. I love hearing their stories and passion for serving our state.

We're always looking for hardworking and passionate students to come work with us, so I encourage you to learn more and apply.",302,2020-03-04 14:07:34,Twitter Web App,70,17,GovTimWalz,1235205245590003712,,1064603540956565504,False,https://t.co/61fglShgOK,en,March,Q1
"Hey MN, today is our state’s presidential primary! I encourage everyone to get out and vote today — and you can even register at the polls.

Learn more and find your polling place here 🗳⬇️",236,2020-03-03 17:38:12,Twitter for iPhone,238,37,GovTimWalz,1234895865803952134,,1064603540956565504,False,https://t.co/I5Na9o4z2t,en,March,Q1
