Tweets,Length,Date,Source,Favourites,RTs,Username,id_str,in_reply_to_user_id,user_id,isRT,tco,Language,Month,Quarter
"If a business has a question as to whether they qualify as essential, they should complete the Essential Business Clarification form located on the @SCcommerce website, which will be easily accessible on the South Carolina Department of Commerce’s website. 

(2/)",263,2020-03-31 21:37:27,Twitter Web App,30,21,henrymcmaster,1245102935131947012,16335288.0,16335288,False,,en,March,Q1
"I have ordered the closure of non-essential businesses, as defined by Executive Order 2020-17, throughout the state in order to combat the spread of the COVID-19 virus.



(1/)",199,2020-03-31 21:37:26,Twitter Web App,306,186,henrymcmaster,1245102932770664448,,16335288,False,https://t.co/yhwCkHL8Hz,en,March,Q1
"This is unfortunate for those who chose to responsibly follow the instructions of our public health officials, but a necessary action to prevent the spread of the COVID 19 virus. (2/)",183,2020-03-30 22:24:31,TweetDeck,228,82,henrymcmaster,1244752393306341382,16335288.0,16335288,False,,en,March,Q1
"As a result of behavior observed this past weekend by the Department of Natural Resources and SLED, it has become necessary to close public access to our state’s beaches, and close boat ramps and landings on our state’s lakes, rivers and waterways. (1/)",277,2020-03-30 22:24:13,TweetDeck,590,323,henrymcmaster,1244752316244414465,,16335288,False,https://t.co/3NSvZolaUY,en,March,Q1
"These challenging times provide opportunity for reflection, and I ask that you take a moment to reflect on, and appreciate, the honorable service of our Vietnam War Veterans. (2/2)",180,2020-03-29 15:24:26,TweetDeck,118,14,henrymcmaster,1244284289413312512,16335288.0,16335288,False,,en,March,Q1
"America is the greatest country in the world because of the strength and sacrifice of men and women like those that we honor on Vietnam War Veterans Day. They answered the call to serve when it was most difficult, and they served us well. (1/)",267,2020-03-29 15:24:04,TweetDeck,222,27,henrymcmaster,1244284195704315905,,16335288,False,https://t.co/aKszlYQTYf,en,March,Q1
"I have ordered that all visitors coming to South Carolina from the COVID-19 hotspots of New York, Connecticut, New Jersey, or New Orleans must quarantine for 14 days.",190,2020-03-27 21:22:57,TweetDeck,314,158,henrymcmaster,1243649733870202882,,16335288,False,https://t.co/4yilGAwYmE,en,March,Q1
Today I am requesting all out of state visitors to South Carolina planning a stay of two or more nights self quarantine for two weeks immediately upon arrival.,159,2020-03-25 17:56:39,Twitter for iPhone,848,393,henrymcmaster,1242873041983549440,,16335288,False,,en,March,Q1
"Rest assured, if there is any way to safely open our schools earlier, we will do that, but schools must remain closed to protect the health and safety of South Carolinians.” (3/3)",179,2020-03-24 19:04:21,Twitter Web App,133,30,henrymcmaster,1242527693368942595,16335288.0,16335288,False,,en,March,Q1
We understand that the prospect of schools remaining closed for an extended period of time places stress and strain on parents and children. (2/3),146,2020-03-24 19:04:21,Twitter Web App,85,25,henrymcmaster,1242527692408438784,16335288.0,16335288,False,,en,March,Q1
"“At this time, students, parents, and families should plan for South Carolina’s schools to remain closed through the month of April. Our dedicated teachers and school administrators have done a tremendous job in making it possible for our students to learn at home. (1/3)",295,2020-03-24 19:04:21,Twitter Web App,309,219,henrymcmaster,1242527691003375621,,16335288,False,https://t.co/wViV61u7to,en,March,Q1
"And as I said, this is not a shelter-in-place order but another measure aimed at containing the virus by controlling crowds, so that we do not have to shelter in place. (5/)",173,2020-03-23 21:47:53,Twitter Web App,138,28,henrymcmaster,1242206457740898307,16335288.0,16335288,False,,en,March,Q1
It does not apply to private businesses nor to responsible South Carolinians continuing to make the best out of this situation. (4/),132,2020-03-23 21:47:53,Twitter Web App,105,25,henrymcmaster,1242206456646172678,16335288.0,16335288,False,,en,March,Q1
I have included it in an executive order to make it clear that law enforcement has the ability to disperse groups of people who pose a risk to the public's safety and to the safety of others. (3/),196,2020-03-23 21:47:52,Twitter Web App,86,27,henrymcmaster,1242206455715049472,16335288.0,16335288,False,,en,March,Q1
Law enforcement asked for clarification as to how this existing law applies during this state of emergency. (2/),112,2020-03-23 21:47:52,Twitter Web App,60,17,henrymcmaster,1242206454326706176,16335288.0,16335288,False,,en,March,Q1
"This weekend, we saw large crowds gathered on beaches, on sandbars, and in parking lots.  We are facing a dangerous and deadly enemy and this type of behavior is both irresponsible and selfish.  (1/)",199,2020-03-23 21:47:52,Twitter Web App,464,144,henrymcmaster,1242206453085212677,,16335288,False,,en,March,Q1
"Further information, including links to the executive orders can be found here: 

(7/7)",110,2020-03-21 19:32:20,Twitter Web App,40,20,henrymcmaster,1241447571433889793,16335288.0,16335288,False,https://t.co/ozv3Im0BgH,en,March,Q1
"Initial reports from the Department of Administration show that more than half of our State employees are now working from home or taking leave to help prevent the spread of COVID-19. 

(5/)",190,2020-03-21 19:32:20,Twitter Web App,67,15,henrymcmaster,1241447570330845190,16335288.0,16335288,False,,en,March,Q1
"On Thursday, I issued Executive Order 2020-11, to ensure that critical state government services remained available to the public and to prevent potential exposure to the COVID 19 virus. 

(4/)",193,2020-03-21 19:32:20,Twitter Web App,42,8,henrymcmaster,1241447569630343170,16335288.0,16335288,False,,en,March,Q1
"I have also directed @SCDOR to conform the state’s income tax deadline to July 15th, which is the new federal income tax deadline. Other state taxes will remain delayed until June 1st, as previously ordered.
 
(3/)",214,2020-03-21 19:32:20,Twitter Web App,69,13,henrymcmaster,1241447568808259587,16335288.0,16335288,False,,en,March,Q1
"To help our small businesses and their employees I have directed the @SCDOR to waive additional regulations in order to allow restaurants to include sealed containers of beer and wine for curbside pickup or “to-go” orders only. 

(2/)",234,2020-03-21 19:32:19,Twitter Web App,117,32,henrymcmaster,1241447568116252673,16335288.0,16335288,False,,en,March,Q1
"I am asking that construction contractors &amp; others in the skilled trade industry to donate whatever personal protective equipment they can spare to healthcare professionals and state agencies in the greatest need, including respirator masks commonly used in construction.

(1/)",281,2020-03-21 19:32:19,Twitter Web App,430,160,henrymcmaster,1241447567180914688,,16335288,False,,en,March,Q1
"At this time, ordering South Carolinians to shelter in place is not under consideration. If we all work together, act responsibly, and take necessary precautions, lives can be saved now.",210,2020-03-21 16:25:26,Twitter Web App,857,355,henrymcmaster,1241400534126530560,,16335288,False,https://t.co/BV2Ti06sr4,en,March,Q1
The time is now for everyone to take this situation seriously and to follow the instructions of national and state officials. Voluntary action and precaution NOW will save the lives of many.  (2/2),220,2020-03-20 23:40:59,Twitter for iPhone,198,66,henrymcmaster,1241147756225462275,16335288.0,16335288,False,https://t.co/UwaMyFxLoN,en,March,Q1
"Tonight, two more South Carolinians have succumbed to COVID-19.  Please join me in praying for their families and for their communities for their losses.  (1/2)",160,2020-03-20 23:40:58,Twitter for iPhone,373,86,henrymcmaster,1241147754715455488,,16335288,False,,en,March,Q1
"I’d like to remind all South Carolinians that we should listen to official sources of information like  @scdhec, @CDCgov, and reputable media sites. 

Hearsay and rumors create confusion and anxiety, and can be dangerous. This will help us win this fight against this COVID-19.",277,2020-03-20 22:17:04,Twitter for iPhone,923,247,henrymcmaster,1241126639775502337,,16335288,False,,en,March,Q1
"Coastal residents can responsibly maintain social distance while enjoying our state’s beaches. 



(2/)",126,2020-03-20 18:16:24,Twitter Web App,120,44,henrymcmaster,1241066074487042048,16335288.0,16335288,False,https://t.co/B3NSp75Xf2,en,March,Q1
"A state of emergency exists in South Carolina to prevent the spread of the deadly COVID-19 virus.  To save lives, I have directed SLED and local law enforcement to disperse crowds gathered on our state’s beaches. 

(1/)",219,2020-03-20 18:16:24,Twitter Web App,461,194,henrymcmaster,1241066073287524355,,16335288,False,,en,March,Q1
"-Procurement regulations are temporarily suspended to allow state agencies to rapidly acquire resources to combat the COVID-19 virus

-DHEC will temporarily suspend enforcement of certificate of need regulations necessary to expedite treatment for the virus

(4/)",263,2020-03-19 22:43:02,Twitter Web App,27,10,henrymcmaster,1240770786681597952,16335288.0,16335288,False,,en,March,Q1
"-Waived Department of Employment and Workforce regulations to allow unemployment claims to be expedited by at least one week

-Unemployment insurance payments are suspended for employers until June 1st, allowing business owners to have additional capital on hand 

(3/)",269,2020-03-19 22:43:02,Twitter Web App,34,19,henrymcmaster,1240770785251393536,16335288.0,16335288,False,,en,March,Q1
"-Each public university, college, and technical college president will, at their discretion, determine essential employees &amp; allow non-essential employees to work from home, and in all cases, to allow students to continue coursework online for the semester 

(2/)",267,2020-03-19 22:43:01,Twitter Web App,31,14,henrymcmaster,1240770784118935553,16335288.0,16335288,False,,en,March,Q1
"I have taken additional actions in my latest executive order in our efforts to fight COVID-19:


(1/)",124,2020-03-19 22:43:01,Twitter Web App,38,26,henrymcmaster,1240770782780887040,,16335288,False,https://t.co/Qlwalap72r,en,March,Q1
I applaud the General Assembly for moving swiftly to pass emergency funding to @scdhec for COVID-19 response efforts. I signed it immediately.,166,2020-03-19 18:42:28,Twitter for iPhone,194,59,henrymcmaster,1240710247548764162,,16335288,False,https://t.co/VyLRpC7boR,en,March,Q1
"Thank you to the many local restaurants that are keeping our communities fed and their workers employed through this crisis, and to the neighbors who support them. I picked up my @LizardsThicket to-go this morning to begin another day of working with #TeamSC.",283,2020-03-19 14:21:20,Twitter for iPhone,413,80,henrymcmaster,1240644529444847619,,16335288,False,https://t.co/iyFkGFVlhi,en,March,Q1
"A copy of my executive order can be read here: 

(4/)",76,2020-03-18 01:23:52,TweetDeck,27,20,henrymcmaster,1240086483677184000,16335288.0,16335288,False,https://t.co/94JhDunPHY,en,March,Q1
"-@scdhec will waive regulations so hospitals may use medical and nursing school students to help with COVID-19  response needs

(3/)",132,2020-03-17 23:52:49,Twitter Web App,73,39,henrymcmaster,1240063571280658434,16335288.0,16335288,False,,en,March,Q1
"-Organized events of more than 50 persons in a state, county, city, or other publicly-owned facility are prohibited, except for essential government functions

-@SCNationalGuard will coordinate and plan with hospitals to create contingency plans for infrastructure needs 

(2/)",277,2020-03-17 23:52:48,Twitter Web App,49,25,henrymcmaster,1240063569590472706,16335288.0,16335288,False,,en,March,Q1
"I have directed that:

-State agencies waive any regulation they need to address the coronavirus crisis

-ALL state taxes are delayed until June 1st

-Restaurants and bars must close their dine-in service starting tomorrow



(1/)",253,2020-03-17 23:52:48,Twitter Web App,218,121,henrymcmaster,1240063567631650816,,16335288,False,https://t.co/cREXi58Y8y,en,March,Q1
"As neighbors continue to help neighbors in South Carolina in response to COVID-19 please remember our food banks. @HarvestHopeFB, @LCFoodBank, @ghfbEndHunger, &amp; @SecondHarvestFB provide  services across our state and have critical needs listed on their websites.",266,2020-03-16 22:02:21,Twitter for iPhone,187,102,henrymcmaster,1239673383132057600,,16335288,False,,en,March,Q1
"South Carolinians must continue to support each other through prayer, through common sense, by taking precautions and by demonstrating courtesy and compassion. (2/2)",165,2020-03-16 15:41:52,Twitter Web App,192,54,henrymcmaster,1239577631726669826,16335288.0,16335288,False,,en,March,Q1
We are saddened by the news of the first death in South Carolina due to COVID-19. Our hearts and prayers are with the family and the community.  (1/2),150,2020-03-16 15:41:52,Twitter Web App,615,234,henrymcmaster,1239577630808162304,,16335288,False,,en,March,Q1
"As South Carolinians always are, we ask that you remain kind, courteous, and compassionate to your neighbors, and to pray for the people of our state. (4/4)",156,2020-03-15 21:43:53,Twitter Web App,97,36,henrymcmaster,1239306348459933699,16335288.0,16335288,False,,en,March,Q1
"We understand that school closings are inconvenient for working parents, for families, and for employers. But the decisions we have made are made to save lives. (3/)",165,2020-03-15 21:43:53,Twitter Web App,77,20,henrymcmaster,1239306347285536770,16335288.0,16335288,False,,en,March,Q1
"These schools will have the ability to institute virtual learning &amp; e-learning plans for their students.
 
I have also ordered that all local and municipal elections be postponed and rescheduled after May 1st. (2/)",218,2020-03-15 21:43:52,Twitter Web App,37,14,henrymcmaster,1239306346400485378,16335288.0,16335288,False,,en,March,Q1
"I have directed that all schools in South Carolina, including K-12 and universities, colleges, and technical colleges be closed for students and non-essential personnel through the end of this month.   (1/)",229,2020-03-15 21:43:52,Twitter Web App,326,190,henrymcmaster,1239306344898977795,,16335288,False,https://t.co/lDUM7lkZTO,en,March,Q1
I have requested that all utilities in South Carolina not suspend or disconnect any essential services for nonpayment for the duration of the current State of Emergency.,195,2020-03-14 22:00:17,TweetDeck,2305,531,henrymcmaster,1238948087583866881,,16335288,False,https://t.co/brJnIuonbD,en,March,Q1
Today I have granted state agency leaders maximum flexibility to protect their older “at risk” employees by allowing work from home. Additionally all non-essential work related travel by state employees is now prohibited.,247,2020-03-14 21:18:44,TweetDeck,230,105,henrymcmaster,1238937632723386368,,16335288,False,https://t.co/Odr8xoSWrn,en,March,Q1
"-State price gouging laws shall go into effect immediately
-The State Emergency Management Plan shall be activated
-DHEC shall immediately restrict visitation to nursing homes and assisted living facilities with the exception of end of life situations
(3/3)",257,2020-03-13 20:51:52,Twitter for iPhone,82,49,henrymcmaster,1238568482133901313,16335288.0,16335288,False,,en,March,Q1
"-All state government offices shall remain open for operation during their normal business hours -Visitation at state and local correctional facilities in all 46 counties shall be suspended immediately

(2/3)",208,2020-03-13 20:51:52,Twitter for iPhone,52,35,henrymcmaster,1238568481156665345,16335288.0,16335288,False,,en,March,Q1
"I have declared a state of emergency in South Carolina in response to COVID-19. 
-Schools in Lancaster and Kershaw Counties shall be closed for a period of 14 days

(1/3)",193,2020-03-13 20:51:51,Twitter for iPhone,147,113,henrymcmaster,1238568478233300992,,16335288,False,https://t.co/q6hirJL5PP,en,March,Q1
I have requested that the General Assembly pass a joint resolution making $45 million from the 2019-20 Contingency Reserve Fund immediately available to @scdhec for its coordination of the state’s public health response to the COVID-19 virus.,266,2020-03-12 18:55:57,Twitter for iPhone,79,26,henrymcmaster,1238176922884100096,,16335288,False,https://t.co/qM6gHsgM1n,en,March,Q1
"This morning legislative leadership received a coronavirus briefing at @SCEMD from @scdhec, the SC Department on Aging, and other state agencies.",169,2020-03-10 14:26:17,Twitter Web App,67,25,henrymcmaster,1237384284597637120,,16335288,False,https://t.co/OoaJA90p2s,en,March,Q1
"Or from your home, you can consult with a doctor for free with MUSC’s online web site at: . South Carolinians should continue to follow recommendations and information provided by official sources. (3/3)",226,2020-03-08 21:12:11,TweetDeck,24,14,henrymcmaster,1236761655041839105,16335288.0,16335288,False,https://t.co/ybfEGyZqj4,en,March,Q1
"It’s important to remember that each individual is responsible for their own actions and personal hygiene. If you feel sick, stay home and contact your doctor. (2/)",164,2020-03-08 21:10:33,TweetDeck,20,9,henrymcmaster,1236761246411751424,16335288.0,16335288,False,,en,March,Q1
Healthcare authorities in South Carolina are following established protocols and procedures in addressing the 2019 Novel Coronavirus. There is no cause for public alarm or speculation. (1/),213,2020-03-08 21:09:42,TweetDeck,28,27,henrymcmaster,1236761033194328064,,16335288,False,https://t.co/A4rLw5RPfx,en,March,Q1
MUSC Health is providing FREE telehealth coronavirus screening to ALL South Carolinians. If you are experiencing symptoms you can visit  and be screened without having to leave your home.,234,2020-03-07 18:12:26,Twitter for iPhone,434,263,henrymcmaster,1236354032790310913,,16335288,False,https://t.co/ybfEGyZqj4,en,March,Q1
Healthcare authorities in S.C. have been preparing for this eventuality and there is no reason for public alarm. DHEC is working with the CDC on confirmation for these cases. South Carolinians should continue to follow recommendations and information provided by official sources.,304,2020-03-07 00:23:45,Twitter for iPhone,99,59,henrymcmaster,1236085088099741702,,16335288,False,https://t.co/k5b8QJxgpy,en,March,Q1
"Please remember to follow recommendations from official sources.  Keep washing hands. Cover when you cough or sneeze.  If you feel sick, stay home, call your doctor.  
(2/2)",173,2020-03-06 21:55:40,Twitter Web App,19,5,henrymcmaster,1236047825642930180,16335288.0,16335288,False,,en,March,Q1
South Carolina’s Congressional delegation received an update on the coronavirus from @SCDHEC this afternoon at @SCEMD.  #TeamSC is prepared. (1/2),170,2020-03-06 21:55:40,Twitter Web App,32,9,henrymcmaster,1236047823411589120,,16335288,False,https://t.co/qvjdNopsGk,en,March,Q1
"The delivery and expenditure of taxpayer dollars in the classroom will be more transparent. Our teachers will be better equipped to teach, and our students better prepared to join our state’s workforce. (2/2)",208,2020-03-05 20:48:41,Twitter Web App,23,4,henrymcmaster,1235668580273975298,16335288.0,16335288,False,,en,March,Q1
"Thank you Senate. Today, South Carolina is one step closer to meaningful education reform.  Administrators and school board members will be held accountable for performance and results.  (1/2)",192,2020-03-05 20:48:41,Twitter Web App,45,8,henrymcmaster,1235668579493613568,,16335288,False,,en,March,Q1
Happy to welcome the State House Doctors of the Day to the office to recognize #ColonCancerAwarenessMonth.,130,2020-03-05 20:12:18,Twitter Web App,21,5,henrymcmaster,1235659424779337729,,16335288,False,https://t.co/wfFysGerWl,en,March,Q1
"Thank you @realDonaldTrump and @IvankaTrump for championing family medical leave into law for federal employees.  And thank you @bethbernsteinsc and @dj1one  for championing this for state employees. Now, let's get it to my desk so I can sign it into law. #SCWinning (3/3)",272,2020-03-04 20:33:46,Twitter Web App,36,8,henrymcmaster,1235302438766293000,16335288.0,16335288,False,,en,March,Q1
It will help state government address agency workforce shortages.  Employees can focus on their new children instead of worrying about them from the workplace.  And valuable trained employees will be more likely to return to the workforce afterward.  (2/3),256,2020-03-04 20:33:46,Twitter Web App,33,5,henrymcmaster,1235302436581126150,16335288.0,16335288,False,,en,March,Q1
In South Carolina we believe in family friendly public policy. Providing state employees with 12 weeks of paid leave following the birth or adoption of a child helps keep families healthy and strong. (1/3),229,2020-03-04 20:33:45,Twitter Web App,198,34,henrymcmaster,1235302434202845189,,16335288,False,https://t.co/h3h6rkr9Fe,en,March,Q1
"When she’s not winning championships, @dawnstaley is making a difference in children’s lives through @innersoleorg. Her work will be recognized tonight when she receives the @MultiplyingGood Jefferson Award for Outstanding Public Service. Congratulations, Coach Staley!",269,2020-03-03 21:16:27,Twitter for iPhone,481,50,henrymcmaster,1234950791812829186,,16335288,False,,en,March,Q1
"This morning we convened #TeamSC to discuss our preparedness for Coronavirus. There have been zero confirmed cases in South Carolina, but @scdhec has been monitoring the situation and has information on what each of us can do to best protect ourselves and others.",287,2020-03-02 21:16:17,Twitter for iPhone,107,74,henrymcmaster,1234588361668603906,,16335288,False,https://t.co/NXs7zYTnKg,en,March,Q1
Here’s another good reminder of why South Carolina is #TrumpCountry.,92,2020-02-28 19:49:01,Twitter for iPhone,92,27,henrymcmaster,1233479235416788999,,16335288,False,https://t.co/9DZgXleEkE,en,February,Q1
I had a good time chatting with South Carolina native @ainsleyearhardt on Fox &amp; Friends this morning about how excited we are to welcome @realDonaldTrump back to our state.,200,2020-02-28 12:40:44,TweetDeck,82,19,henrymcmaster,1233371455678812160,,16335288,False,https://t.co/FKmVeFF2Ye,en,February,Q1
"Excellent choice by @realDonaldTrump to nominate @petermccoyforsc for U.S. Attorney. Peter is a man of character, respected by his colleagues and community, who will make South Carolina proud.",216,2020-02-27 15:36:57,Twitter Web App,62,16,henrymcmaster,1233053412272623616,,16335288,False,https://t.co/E6waHKtkaq,en,February,Q1
Thank you to @schousespeaker and the S.C.  House of Representatives for unanimously passing business license reform. Streamlining the process across the state is key to maintaining South Carolina's superior business-friendly climate. #SCWinning #SCjobs,252,2020-02-26 17:51:16,TweetDeck,82,24,henrymcmaster,1232724825917001729,,16335288,False,,en,February,Q1
"South Carolina is winning! Three years - 30,000 new jobs, over $10 billion in new capital investment.   Bi-partisan collaboration on teacher pay,  unleashing free market in early childhood education, rural infrastructure, taxpayer relief &amp; supporting law enforcement. 🇺🇸",274,2020-02-26 02:25:01,Twitter for iPhone,167,35,henrymcmaster,1232491729619542016,,16335288,False,,en,February,Q1
Our hearts are saddened once again by senseless violence that has taken the life of one of our law enforcement officers. Please keep the Sumter County Sheriff's Office and the whole Sumter community in your prayers today as we mourn the loss of Cpl. Andrew Gillette.,266,2020-02-25 21:04:31,TweetDeck,117,39,henrymcmaster,1232411074823172098,,16335288,False,,en,February,Q1
"Thrilled to welcome @realDonaldTrump back to South Carolina. Looking forward to seeing you, Mr. President!",130,2020-02-21 14:11:40,TweetDeck,90,23,henrymcmaster,1230857622707982338,,16335288,False,https://t.co/09RATTDRoU,en,February,Q1
"@schousespeaker @murrellsmith ...unleashes the free market in early childhood education, freezes college tuition, puts more troopers on the road and makes our prisons safer. #SCWinning (2/2)",190,2020-02-20 19:55:20,TweetDeck,20,4,henrymcmaster,1230581723425132546,16335288.0,16335288,False,,en,February,Q1
"Thank you @schousespeaker, Chairman @murrellsmith and House Ways &amp; Means committee for a budget that returns money to taxpayers, ranks SC in TOP 25 for teacher pay... (1/2)",176,2020-02-20 19:55:03,TweetDeck,41,8,henrymcmaster,1230581651119407105,,16335288,False,,en,February,Q1
"The House has passed a comprehensive education reform bill, and the Senate is currently debating their version.  I ask that these two versions be reconciled and sent to my desk as soon as possible so I can sign it into law, and we can get to work. (2/2)",253,2020-02-19 22:03:18,Twitter Web App,13,1,henrymcmaster,1230251538070867968,16335288.0,16335288,False,,en,February,Q1
"The way we fund education is confusing, not working, and is no longer sustainable. Education reform means accountability, efficiency, and transparency for local school boards and administrators. We must have a new path forward. (1/2)",257,2020-02-19 22:03:17,Twitter Web App,44,9,henrymcmaster,1230251536015601664,,16335288,False,https://t.co/yiwd22hfFM,en,February,Q1
"In an economy where we have jobs looking for people, there's no reason anyone who CAN work not to be working. That's why we're requiring able-bodied individuals who are not primary caregivers to complete 80 hours per month of work, education, or volunteering to receive Medicaid.",303,2020-02-18 21:07:45,Twitter Web App,72,12,henrymcmaster,1229875172863303683,,16335288,False,https://t.co/Ndg6Qh1TJk,en,February,Q1
