Tweets,Length,Date,Source,Favourites,RTs,Username,id_str,in_reply_to_user_id,user_id,isRT,tco,Language,Month,Quarter
"I spoke with Governor Reeves this morning and assured him that South Carolina is ready and willing to help. We know first-hand the devastating effects that flooding can have, and our thoughts and prayers are with them during this time.",259,2020-02-18 16:42:51,Twitter Web App,61,4,henrymcmaster,1229808506980704257,,16335288,False,https://t.co/P2FfY76op1,en,February,Q1
"For the third year in a row I'm asking that the General Assembly honor the men in women who serve in uniform—first responders, law enforcement, and military veterans—by ELIMINATING taxes on their retirement pay. We have no excuses not to do it.",268,2020-02-14 15:48:43,Twitter Web App,125,36,henrymcmaster,1228345331609407488,,16335288,False,https://t.co/Tl5Pi0lIgv,en,February,Q1
"Welcome to South Carolina, @VP!",55,2020-02-13 17:51:33,Twitter for iPhone,53,9,henrymcmaster,1228013855667892224,,16335288,False,https://t.co/PQNKcA6ko3,en,February,Q1
"Animal cruelty is a scourge that we want to eliminate from South Carolina. I was proud to join the @HumaneSociety to recognize one of our own,  Lance Corporal Misty Gore of the Horry County PD, as the recipient of the 2019 Humane Law Enforcement Award.",276,2020-02-12 22:02:20,Twitter Web App,79,20,henrymcmaster,1227714579679129600,,16335288,False,https://t.co/bfHNNb96i4,en,February,Q1
"As we look forward to the next decade, we will continue to work hard to ensure that the Palmetto State remains the best place to do business.  (2/2)",148,2020-02-12 15:46:44,TweetDeck,19,3,henrymcmaster,1227620057099972608,16335288.0,16335288,False,,en,February,Q1
"South Carolina’s economy is booming, and  the news of yet another record-setting year for exports is further confirmation that our global reputation for excellence is hard-earned and well-deserved. (1/2)",227,2020-02-12 15:46:13,TweetDeck,53,17,henrymcmaster,1227619929630834688,,16335288,False,https://t.co/6egZUK55qZ,en,February,Q1
"Major General Grimsley has demonstrated commitment, excellence, determination, and success, and I am honored that he has accepted the call to serve as South Carolina's first Secretary of Veterans' Affairs for the great people of South Carolina.",292,2020-02-11 22:08:44,Twitter Web App,28,7,henrymcmaster,1227353801356648449,,16335288,False,https://t.co/xbxHPENCoA,en,February,Q1
"I ask that the General Assembly join me in providing every lower-income, four-year-old child in South Carolina the opportunity to attend full-day kindergarten at the public, private, parochial, or religious institution of their parents’ choosing.",270,2020-02-10 20:40:15,Twitter Web App,44,9,henrymcmaster,1226969148275728384,,16335288,False,https://t.co/dkJZAk60qo,en,February,Q1
"Planning to visit the State House in the next week? Please consider bringing an item to put in one of the @HarvestHopeFB collection boxes on the first floor.

Top needs:
Canned vegetables &amp; meats
Diapers
Toiletries
Paper/plastic Bags
Peanut Butter
Detergent
Dry Goods
Beans",301,2020-02-07 20:38:53,Twitter for iPhone,37,25,henrymcmaster,1225881639248711680,,16335288,False,https://t.co/1993PfFbfb,en,February,Q1
The path to prosperity goes straight through the classroom. This year our continued investment in education must be the most significant ever.,166,2020-02-07 20:05:31,Twitter Web App,54,12,henrymcmaster,1225873242566557697,,16335288,False,https://t.co/RLgr2kzOgg,en,February,Q1
Stay alert and stay safe. Please follow @SCEMD and your local officials for the latest updates.,119,2020-02-06 16:03:33,Twitter for iPhone,45,15,henrymcmaster,1225449963754262529,,16335288,False,https://t.co/ALsPTkplhJ,en,February,Q1
This year we have a $1.8 billion surplus. If we don't cut taxes and send money back to the people then shame on us.,139,2020-02-05 22:08:03,Twitter Web App,156,32,henrymcmaster,1225179305287745538,,16335288,False,https://t.co/plXdmHRqKp,en,February,Q1
"Tonight the world knows that America is winning again!  And South Carolina is winning!  Thanks to President @realDonaldTrump our nation is stronger, our people’s resolve is unmatched and our enemies are destined for failure. #FourMoreYears  👍🇺🇸",244,2020-02-05 03:29:49,Twitter for iPhone,265,48,henrymcmaster,1224897889954037760,,16335288,False,,en,February,Q1
"We are roaring into the twenties with a vibrant economy and a growing population.  Since I've taken office, we have announced an unprecedented $10 billion in new capital investment and almost 35,000 jobs. #SCWinning",239,2020-02-04 21:42:11,Twitter Web App,74,11,henrymcmaster,1224810406616752129,,16335288,False,https://t.co/BJIbRba3LL,en,February,Q1
Director Farmer is an embodiment of public service who makes South Carolina proud every day.,116,2020-01-30 15:38:42,TweetDeck,18,2,henrymcmaster,1222906992458719233,,16335288,False,https://t.co/S0LhNZa0WB,en,January,Q1
"We’ve had an education-centric day at the State House today, meeting with visitors from Youth Corps, @UofSC student body governments, and @SCforEd.",171,2020-01-29 21:29:30,Twitter for iPhone,53,14,henrymcmaster,1222632886794358784,,16335288,False,https://t.co/su0AJMNYvs,en,January,Q1
"As we commemorate the 75th anniversary of the liberation of Auschwitz, it is incumbent upon us to ensure that the events of the Holocaust not become distant nor the stories of the people who suffered its horrors be forgotten.",249,2020-01-28 17:46:29,Twitter for iPhone,36,13,henrymcmaster,1222214375198556162,,16335288,False,https://t.co/6kM3RNeXQW,en,January,Q1
Today we announced the 2020 class of South Carolina’s Chef Ambassadors. They'll proudly represent the culinary diversity and homegrown care of the Palmetto State for the next year. Read more about each chef here:,260,2020-01-27 22:19:07,Twitter for iPhone,35,7,henrymcmaster,1221920596973563905,,16335288,False,https://t.co/xCoXlBgPQS,en,January,Q1
Last year we took a dramatic step by freezing college tuition for in-state students. I urge the General Assembly to do it again this year by providing a 5% funding increase for each institution that does not raise tuition.,246,2020-01-24 21:29:00,TweetDeck,14,2,henrymcmaster,1220820821553242112,,16335288,False,https://t.co/88biNIAOZE,en,January,Q1
"I ask that we invest at least $100 million dollars toward making our prisons safer and more secure, both inside and outside the fence, by replacing and repairing existing infrastructure, facilities and control systems.",266,2020-01-24 17:26:00,TweetDeck,29,10,henrymcmaster,1220759668361854976,,16335288,False,https://t.co/PnzC80opb2,en,January,Q1
"Last year we took bold steps in education reform to empower the next generation’s workforce.  We invested in our classroom teachers, in rural schools, in keeping our children safe and secure.  

This year our continued investment must be the most significant ever.",288,2020-01-24 14:25:00,TweetDeck,21,4,henrymcmaster,1220714118476435456,,16335288,False,https://t.co/FcMtwVGNEu,en,January,Q1
"I ask that we dedicate at least $60 million in new dollars to law enforcement, public safety and first response agencies for recruitment and retention.",199,2020-01-24 12:24:00,TweetDeck,38,7,henrymcmaster,1220683667799859200,,16335288,False,https://t.co/PnzC80opb2,en,January,Q1
"More people are working in South Carolina than ever before, unemployment is at a record low, and personal income growth is the highest ever.  We are consistently rated as one of the best places in the country to live, work and raise a family.",266,2020-01-23 23:21:00,TweetDeck,32,5,henrymcmaster,1220486619263852549,,16335288,False,https://t.co/bul0F0x85r,en,January,Q1
Shame on us if we spend all of the $1.8 billion surplus and don't send any money back to the taxpayers. My executive budget calls for returning a quarter of every dollar through tax cuts and rebates.,247,2020-01-23 21:00:21,TweetDeck,50,10,henrymcmaster,1220451226241982465,,16335288,False,https://t.co/PnzC80G0zC,en,January,Q1
"This year, let us roar into the twenties with renewed purpose.  Let us be bold.  Let us act on behalf of the sons and daughters of South Carolina, so that they may receive a state as bright with promise as that which we were blessed to inherit.",268,2020-01-23 16:50:27,TweetDeck,39,8,henrymcmaster,1220388334075367424,,16335288,False,https://t.co/TCWppzbW1h,en,January,Q1
"During the State of the State tonight I was proud to recognize people from across the state who work every day to make South Carolina a better place—business leaders, law enforcement, military, and educators.  Thank you for all you do.",259,2020-01-23 01:56:49,Twitter for iPhone,116,18,henrymcmaster,1220163443757666304,,16335288,False,https://t.co/ekEGNOzuTy,en,January,Q1
"Thanks for dropping by, sorry I couldn't chat longer. Big night tonight.",96,2020-01-22 23:15:24,TweetDeck,61,8,henrymcmaster,1220122821550137357,,16335288,False,https://t.co/NlrlrWRltz,en,January,Q1
"Since I took office in 2017 South Carolina has announced 35,000 jobs and $10 billion in new capital investment. We accomplished this with a concerted effort to implement business-friendly policies, and my executive budget aims to continue this progress.",301,2020-01-22 21:41:57,TweetDeck,37,10,henrymcmaster,1220099304775352322,,16335288,False,https://t.co/PnzC80G0zC,en,January,Q1
"South Carolina's economy and population are growing because we have worked hard to make our state the best place to live, work, and raise a family. My executive budget aims to continue this by funding our priorities and returning money to the taxpayers.",301,2020-01-21 22:09:00,TweetDeck,26,5,henrymcmaster,1219743724202270720,,16335288,False,https://t.co/PnzC80G0zC,en,January,Q1
"South Carolina is a proudly pro-life state, and any pro-life legislation that makes it to my desk will be signed immediately.",149,2020-01-21 19:32:59,TweetDeck,114,25,henrymcmaster,1219704461213556736,,16335288,False,https://t.co/XPpOO3p7j8,en,January,Q1
"Let Dr. King’s words serve as a reminder to us that all of us have the ability to serve one another, and that no act of service is insignificant. Let us renew our commitment to #ServeSC and continue to make our state the best place to live for all.",272,2020-01-20 15:47:52,Twitter for iPhone,74,29,henrymcmaster,1219285421223481346,,16335288,False,https://t.co/XpmdeuqqVA,en,January,Q1
"Full Day 4k with CHOICE- private, parochial and church schools join public schools and private day care centers- to give parents free market choices.",173,2020-01-19 15:47:42,Twitter for iPhone,34,5,henrymcmaster,1218922991343603712,,16335288,False,https://t.co/2OFe4S7oul,en,January,Q1
"With our economy booming, South Carolina has a $1.8 billion surplus. My executive budget shows that we can fund all of our priorities AND return nearly a quarter of every surplus dollar to the taxpayers in the form of lower rates and rebate checks.",296,2020-01-16 18:00:10,TweetDeck,34,4,henrymcmaster,1217869165266186240,,16335288,False,https://t.co/lruYGAMscQ,en,January,Q1
#MadeInSC,33,2020-01-16 00:43:36,Twitter for iPhone,43,4,henrymcmaster,1217608305608097793,,16335288,False,https://t.co/tD9Y4iI9mi,en,January,Q1
I applaud the House for passing the Heartbeat Bill and urge the Senate to do so as well. As soon as the bill reaches my desk I will sign it.,164,2020-01-15 17:44:56,TweetDeck,61,23,henrymcmaster,1217502941634080768,,16335288,False,https://t.co/lvhYJghwFK,en,January,Q1
"I applaud @realDonaldTrump's hard work to finalize the #USChinaTradeDeal. This deal is a win for South Carolina, and all of America. It will be another shot in the arm for the US economy, American manufacturers, service providers, farmers, and more. #SCwinning #USAwinning",272,2020-01-15 17:40:35,Twitter Web App,2015,385,henrymcmaster,1217501848099311616,,16335288,False,,en,January,Q1
We can never thank our veterans enough. My executive budget calls for eliminating taxes on military retirement pay.,163,2020-01-15 14:07:44,Twitter Web App,60,19,henrymcmaster,1217448284207439872,,16335288,False,https://t.co/lruYGAMscQ,en,January,Q1
"My executive budget calls for beginning a reduction of our personal income tax over the next five years to keep us competitive with neighboring states that are lowering theirs, and allowing taxpayers to keep $2.5 billion of their own money.",264,2020-01-14 16:20:54,Twitter Web App,64,17,henrymcmaster,1217119409082335235,,16335288,False,https://t.co/k3iYb0QTVi,en,January,Q1
"My executive budget calls for tax cuts and rebates totaling $425 million, returning about a quarter of every surplus dollar back to the taxpayers.",194,2020-01-13 21:21:02,Twitter Web App,17,4,henrymcmaster,1216832549693075456,,16335288,False,https://t.co/2yr8Y82zWV,en,January,Q1
"I have spoken with Principal Branham, Superintendent Robbins, and Senator Sheheen to offer assistance. It’s a blessing that no one was on the North Central High campus last night. We can replace buildings and buses but not lives.",253,2020-01-12 17:26:17,Twitter for iPhone,129,34,henrymcmaster,1216411085965795329,,16335288,False,https://t.co/7p12kn7hEh,en,January,Q1
I was proud to stand in front of a packed room at the Proudly Pro-Life Dinner to say “If the General Assembly sends the heartbeat bill to my desk I will sign it in seconds.”,197,2020-01-11 03:06:05,Twitter for iPhone,104,22,henrymcmaster,1215832221392822273,,16335288,False,https://t.co/Rqn9FVNwit,en,January,Q1
It's time to modernize #NEPA to ensure that unnecessary red tape doesn't hold us back from prosperity.,126,2020-01-09 23:15:00,TweetDeck,11,1,henrymcmaster,1215411679183265792,,16335288,False,https://t.co/UA1FU5CWEo,en,January,Q1
"Telemedicine brings your doctor as close as your phone. Today we announced a new tool, the @MUSChealth Virtual Urgent Care web app, that is available for FREE to over half a million state employees and family members. It’s available immediately at",295,2020-01-09 19:02:52,Twitter for iPhone,63,30,henrymcmaster,1215348227941322753,,16335288,False,https://t.co/aYjiYjhEZG,en,January,Q1
"As the sun rises today it shines on flags at half-staff in remembrance of Officer Jackson R. Winkeler. Please take a moment to keep Officer Winkeler's family, friends, coworkers, and the community of Florence in your prayers at this sad time.",267,2020-01-09 11:45:00,TweetDeck,114,31,henrymcmaster,1215238035303911426,,16335288,False,https://t.co/exO2h6i35B,en,January,Q1
"Tonight #TeamSC is leaning forward.  I have directed state government IT leaders to redouble efforts to aggressively search out, identify and repel any potential cyber attacks or malicious technological intrusions into our state agencies.  🇺🇸",266,2020-01-08 03:38:40,Twitter for iPhone,84,30,henrymcmaster,1214753259124068353,,16335288,False,https://t.co/6LGgDfiY0Z,en,January,Q1
"My full-day 4K plan will unleash the free market on education, and unleash the talents and abilities of the young people who are the future of our state.",177,2020-01-07 02:54:58,TweetDeck,48,12,henrymcmaster,1214379873294262273,,16335288,False,https://t.co/mv8POHVP31,en,January,Q1
"Parents can choose the education provider that best suits their 4 yr old child’s needs. 

Public schools, day care centers, private &amp; parochial schools will all be eligible to participate.  

My plan cuts burdensome regulations to unleash a new vibrant Pre-K free market in SC.",305,2020-01-05 18:30:20,Twitter for iPhone,85,27,henrymcmaster,1213890488216047617,,16335288,False,https://t.co/iTywCXRlRh,en,January,Q1
"The time to be bold is now. 

If we don’t step up &amp; act - our state will fall behind economically- businesses will go to states who have better prepared their workforce. 

Private, parochial &amp; church schools will provide new opportunities &amp; choices for SC parents.   #SCWinning",313,2020-01-04 21:50:10,Twitter for iPhone,111,20,henrymcmaster,1213578392492290048,,16335288,False,https://t.co/iTywCXRlRh,en,January,Q1
