Tweets,Length,Date,Source,Favourites,RTs,Username,id_str,in_reply_to_user_id,user_id,isRT,tco,Language,Month,Quarter
"#COVIDー19 Update: 21 new positive cases. 145 total positives of #COVID19 and 2,578 total negatives.",123,2020-03-25 16:01:31,Twitter Web App,44,28,IAGovernor,1242844069283446784,,851808935397011456,False,https://t.co/q6FZuYKaL5,en,March,Q1
Thank you! @IowaNatGuard #COVIDー19,59,2020-03-25 14:52:18,Twitter Web App,77,17,IAGovernor,1242826649814564866,,851808935397011456,False,https://t.co/9opeVwQepS,en,March,Q1
"Thank you @POTUS for quick approval on our disaster declaration, opening federal resources to Iowa's efforts to combat the spread of #COVID19!",166,2020-03-25 01:35:36,Twitter for iPhone,1887,438,IAGovernor,1242626153258590211,,851808935397011456,False,https://t.co/CzE0T2PYuV,en,March,Q1
"(2/2) I continue to urge all Iowans to protect their health and the health of others, especially older individuals and those with chronic health conditions who are most at risk. We all have a role to play in limiting the spread of this virus.",242,2020-03-25 00:06:48,Twitter Web App,62,15,IAGovernor,1242603804870270978,8.518089353970115e+17,851808935397011456,False,,en,March,Q1
Our hearts are heavy with this loss. The thoughts and prayers of our entire state are with the family during this difficult time. (1/2),159,2020-03-25 00:06:17,Twitter Web App,132,47,IAGovernor,1242603675580878851,,851808935397011456,False,https://t.co/bhl3uEzHxO,en,March,Q1
"#COVID19 Update! 19 new cases, holding my daily press conference today at 2:30 p.m.",107,2020-03-24 16:26:10,Twitter Web App,37,24,IAGovernor,1242487885749727233,,851808935397011456,False,https://t.co/CTIGVNUlrr,en,March,Q1
Here's how you can do your part to limit the spread of #COVIDー19:,89,2020-03-23 23:10:22,Twitter Web App,49,20,IAGovernor,1242227216878055424,,851808935397011456,False,https://t.co/fAOQysyigs,en,March,Q1
"UPDATE: 15 additional positive cases of Iowans with #COVIDー19, for a total of 105 positive cases.

There have been a total of 2,043 negative tests to date, which includes testing reported by the State Hygienic Lab and other labs.

Read more below:",271,2020-03-23 16:49:40,Twitter Web App,77,37,IAGovernor,1242131411060097026,,851808935397011456,False,https://t.co/FSqA8RGJ5p,en,March,Q1
We are taking additional steps to limit the spread of #COVIDー19 in Iowa. Read more here:,112,2020-03-22 22:04:09,Twitter for iPhone,99,38,IAGovernor,1241848165126545409,,851808935397011456,False,https://t.co/eAdPy0BFoO,en,March,Q1
I will be holding a press conference today at 2:30 p.m. Watch on my facebook page here:,111,2020-03-22 17:12:15,Twitter Web App,45,17,IAGovernor,1241774705079656448,8.518089353970115e+17,851808935397011456,False,https://t.co/LiI4TTVgoG,en,March,Q1
#COVIDー19 Update:,41,2020-03-22 17:11:45,Twitter Web App,39,20,IAGovernor,1241774580785647616,,851808935397011456,False,https://t.co/GI6dSIZHmp,en,March,Q1
Help for small businesses impacted by COVID-19 is on the way. Learn more here:,103,2020-03-21 19:46:33,Twitter for iPhone,58,31,IAGovernor,1241451149212909569,,851808935397011456,False,https://t.co/kw1x252SkI,en,March,Q1
"#COVIDー19 Update: 23 new cases, we are recommending those who have traveled outside the state of Iowa self isolate. Read more here:",155,2020-03-21 17:21:39,Twitter Web App,266,179,IAGovernor,1241414684009512960,,851808935397011456,False,https://t.co/8jKJs35HoR,en,March,Q1
"Together, Iowa can weather this storm!",62,2020-03-20 20:50:15,Twitter Web App,148,31,IAGovernor,1241104792614834176,,851808935397011456,False,https://t.co/KyKoLwPOeL,en,March,Q1
I issued an additional State Public Health Emergency Declaration effective immediately providing additional regulatory relief to Iowans impacted by #COVIDー19.,183,2020-03-20 14:38:40,Twitter Web App,79,38,IAGovernor,1241011278610661382,,851808935397011456,False,https://t.co/zzwP7KicmP,en,March,Q1
"#COVIDー19 Update:

6 additional positive cases of Iowans with COVID-19, for a total of 44 positive cases. 642 negative tests have been conducted at the State Hygienic Lab. 

Read more here:",214,2020-03-19 22:45:24,Twitter Web App,68,20,IAGovernor,1240771383564664832,,851808935397011456,False,https://t.co/IHdEpXG6Oo,en,March,Q1
"I am holding a press conference at 3:30 p.m. to give an update on #COVID19. There will be a livestream on Facebook: 

Read more here:",180,2020-03-19 17:45:52,Twitter Web App,61,29,IAGovernor,1240696000097816576,,851808935397011456,False,https://t.co/LiI4TUcRge,en,March,Q1
"Working with @POTUS, the @CDCgov, and everyone across Iowa to #stopthespread over the next 15 days!",123,2020-03-18 23:11:16,Twitter Web App,115,34,IAGovernor,1240415501760765952,,851808935397011456,False,https://t.co/j0x8X94AjB,en,March,Q1
VIDEO: Who should get tested for #COVIDー19? We ask Dr. Pedati from the @IAPublicHealth.,112,2020-03-18 20:01:48,Twitter Web App,21,20,IAGovernor,1240367822309658624,,851808935397011456,False,https://t.co/2k0Jzhoqgk,en,March,Q1
So grateful for the team at @IAPublicHealth working around the clock on the state’s response to #COVIDー19!,130,2020-03-18 19:54:43,Twitter for iPhone,120,19,IAGovernor,1240366040778973184,,851808935397011456,False,https://t.co/bU64lrUty9,en,March,Q1
#COVIDー19 update:,41,2020-03-18 00:30:45,Twitter Web App,31,23,IAGovernor,1240073118963707909,,851808935397011456,False,https://t.co/wEzbj1CL1B,en,March,Q1
Team Capitol working the phones! We are here for you!,77,2020-03-17 21:10:29,Twitter for iPhone,54,5,IAGovernor,1240022718340349953,,851808935397011456,False,https://t.co/YHmIOnrqvv,en,March,Q1
"Today I signed legislation to fund key services and combat COVID19 spread. 

Read more below:",117,2020-03-17 20:17:55,Twitter Web App,30,18,IAGovernor,1240009490906460161,,851808935397011456,False,https://t.co/Jaw4UtXRuC,en,March,Q1
Giving an update to Iowa Supreme Court Chief Justice Suzy Christensen on the state’s response to #COVIDー19.,131,2020-03-17 20:03:32,Twitter for iPhone,19,6,IAGovernor,1240005872853622784,,851808935397011456,False,https://t.co/Pr1nIwc2Qr,en,March,Q1
"On the phone with @IowaLeague, mayors and city leaders to discuss our efforts to limit the spread of #COVIDー19 in Iowa! We will continue to do whatever is necessary to address this public health disaster.",228,2020-03-17 19:14:06,Twitter for iPhone,68,13,IAGovernor,1239993431780450305,,851808935397011456,False,https://t.co/oqdfD6LUOS,en,March,Q1
"Casinos and Gaming Facilities

Gatherings of more than 10 people -- Social, community, spiritual, religious, recreational, leisure and sporting gatherings

Senior Citizen and Adult Daycare Facilities 

Read more here:  (2/2)",247,2020-03-17 16:26:45,Twitter Web App,48,40,IAGovernor,1239951313934434306,8.518089353970115e+17,851808935397011456,False,https://t.co/gPL80DqAWo,en,March,Q1
"This declaration means the following facilities are closed, with the noted exceptions:

Restaurants and Bars -- Carry-out, drive-through and delivery services of food and beverage can be continued

Fitness Centers

Theaters

(1/2)",230,2020-03-17 16:25:37,Twitter Web App,135,95,IAGovernor,1239951030957326340,,851808935397011456,False,,en,March,Q1
"I have issued a State of Public Health Disaster Emergency. These are unprecedented times and the state of Iowa will do whatever is necessary to address this public health disaster.  

Read more here:",223,2020-03-17 15:45:58,Twitter Web App,202,165,IAGovernor,1239941050707390464,,851808935397011456,False,https://t.co/gPL80DqAWo,en,March,Q1
"#COVID19 Update: 

1 new additional case

I held a press conference to update the state of Iowa. 

Read more here:",139,2020-03-16 22:50:00,Twitter Web App,57,31,IAGovernor,1239685377583198208,,851808935397011456,False,https://t.co/z3fBbtzdou,en,March,Q1
I have announced assistance for employees and employers affected by #COVID19 related layoffs:,118,2020-03-16 18:04:05,Twitter Web App,130,64,IAGovernor,1239613423152963585,,851808935397011456,False,https://t.co/17en00eZNz,en,March,Q1
I will hold a press conference today from the State Emergency Operations Center (SEOC) to provide an update to the state of Iowa on COVID-19. Read more here:,181,2020-03-16 16:50:51,Twitter Web App,102,40,IAGovernor,1239594994706665472,,851808935397011456,False,https://t.co/yLBwoBlJ93,en,March,Q1
I'm recommending Iowa schools close for four weeks to combat the spread of COVID-19. Read more below:,125,2020-03-16 01:42:10,Twitter for iPhone,571,261,IAGovernor,1239366313887371264,,851808935397011456,False,https://t.co/5Pq3titM2m,en,March,Q1
We have seen evidence of #COVIDー19 community spread in Iowa. Here's official guidelines for mitigation put together by the @IAPublicHealth:,163,2020-03-15 15:46:00,Twitter Web App,54,39,IAGovernor,1239216283255746560,,851808935397011456,False,https://t.co/wsjEmlssFx,en,March,Q1
"Leaders of institutions and organizers of events should begin to act on their contingency plans related to large gatherings, including church services. Iowans should not hold or attend large gatherings of more than 250 people.",226,2020-03-15 02:04:15,Twitter Web App,39,33,IAGovernor,1239009482857906178,8.518089353970115e+17,851808935397011456,False,,en,March,Q1
"Community spread occurs when individuals have been infected with the virus in an area and cannot specifically identify the source of the infection, or do not know how or where they became infected.",197,2020-03-15 02:03:44,Twitter Web App,16,13,IAGovernor,1239009354478731264,8.518089353970115e+17,851808935397011456,False,,en,March,Q1
COVID-19 community spread confirmed in Iowa. Read More here:,84,2020-03-15 02:03:29,Twitter Web App,90,94,IAGovernor,1239009292663033861,,851808935397011456,False,https://t.co/GH9tCTuIwO,en,March,Q1
"Appreciate the partnership and seamless coordination, communication between our teams!",110,2020-03-14 18:25:55,Twitter for iPhone,72,8,IAGovernor,1238894140093607943,,851808935397011456,False,https://t.co/Hkk8n9iOfl,en,March,Q1
I also held a press conference to give a general update on COVID-19. That can be found here:,116,2020-03-13 23:12:57,Twitter Web App,10,2,IAGovernor,1238603988842557447,8.518089353970115e+17,851808935397011456,False,https://t.co/LiI4TTVgoG,en,March,Q1
"I also signed a proclamation to temporarily suspend requirements for transportation of food, medical supplies, cleaning products, and other household goods by removing restrictions on oversize and overweight loads.",214,2020-03-13 23:11:43,Twitter Web App,22,9,IAGovernor,1238603677214130177,8.518089353970115e+17,851808935397011456,False,,en,March,Q1
"UPDATE: 1 additional positive case of 2019 novel coronavirus, travel related. Read more:",112,2020-03-13 23:11:20,Twitter Web App,13,7,IAGovernor,1238603580019544066,,851808935397011456,False,https://t.co/LmLcZ5NWn2,en,March,Q1
Updated Time: 4:30pm,44,2020-03-13 16:42:23,Twitter for iPhone,32,19,IAGovernor,1238505696976666624,,851808935397011456,False,https://t.co/U1aBk6sN4y,en,March,Q1
Randy couldn’t have said it any better! #InvestInIowaAct,80,2020-03-13 15:13:30,Twitter for iPhone,13,3,IAGovernor,1238483332222115852,,851808935397011456,False,https://t.co/URm2zGCdTV,en,March,Q1
I will be holding a press conference today from from the State Emergency Operations Center at 1:30 p.m. to give an update on COVID-19. There will be a live stream at .,190,2020-03-13 14:03:21,Twitter Web App,37,15,IAGovernor,1238465678535020544,,851808935397011456,False,https://t.co/LiI4TTVgoG,en,March,Q1
.@aelebo will be an important partner in preparing our students for the challenges of the 21st century.,127,2020-03-12 23:37:30,Twitter for iPhone,47,8,IAGovernor,1238247777840312320,,851808935397011456,False,https://t.co/AmFg4KZTnc,en,March,Q1
COVID-19 Update:,41,2020-03-12 23:13:09,Twitter for iPhone,46,33,IAGovernor,1238241652164177921,,851808935397011456,False,https://t.co/tBrDwGNNoi,en,March,Q1
"Drew, thank you for being here to speak in favor of the #InvestInIowaAct! @IowaPork",107,2020-03-12 23:03:45,Twitter for iPhone,30,4,IAGovernor,1238239284471218176,,851808935397011456,False,https://t.co/YCswxWmNAE,en,March,Q1
"UPDATE: One additional positive case of 2019 novel coronavirus (COVID-19), 21 tested negative. Read more here:",134,2020-03-11 23:35:28,Twitter Web App,5,4,IAGovernor,1237884880052039680,,851808935397011456,False,https://t.co/tIp6PWBitt,en,March,Q1
Kyle was at our town hall in Boone this morning and he supports the #InvestInIowaAct because it’s a critical first step to improve quality of life in our state!,184,2020-03-11 17:13:59,Twitter for iPhone,12,4,IAGovernor,1237788873108983810,,851808935397011456,False,https://t.co/Ap824ZR7Tq,en,March,Q1
"Greta, thank you for coming to our town hall in Boone to talk about the #InvestInIowaAct! @IowaTurkey",125,2020-03-11 15:11:49,Twitter for iPhone,14,4,IAGovernor,1237758131108626432,,851808935397011456,False,https://t.co/XuqHS5x5WH,en,March,Q1
The five new cases are all older adults (61 to 80 years) from Johnson County and were on the same Egyptian cruise as seven other presumptive positive cases.,156,2020-03-10 23:47:47,Twitter for iPhone,8,4,IAGovernor,1237525588279091202,8.518089353970115e+17,851808935397011456,False,,en,March,Q1
"UPDATE: Testing at Iowa’s State Hygienic Laboratory has indicated 5 new presumptive positive cases of COVID-19 in Iowa, a total of 13. 

Read more here:",176,2020-03-10 23:47:31,Twitter for iPhone,5,9,IAGovernor,1237525522281684995,,851808935397011456,False,https://t.co/aCyKH76WkL,en,March,Q1
"William Burt had a great idea, and today we changed an outdated law to help his vision become a permanent reality. Thank you William for spearheading this legislation, putting in the work to get this done, and being an incredible advocate for his community.",281,2020-03-10 20:01:14,Twitter for iPhone,40,10,IAGovernor,1237468578078695424,,851808935397011456,False,https://t.co/LvgXju1Eqt,en,March,Q1
"I have signed a Proclamation of Disaster Emergency, activating the disaster response and recovery aspects of the 
@IowaHSEMD's Iowa Emergency Response Plan.  

Read more here:",199,2020-03-09 23:22:46,Twitter Web App,42,27,IAGovernor,1237156908567531522,,851808935397011456,False,https://t.co/B42f3ru8bN,en,March,Q1
"In addition, a public hotline has been established for Iowans with questions about COVID-19. The line is available 24/7 by calling 2-1-1.",137,2020-03-08 23:12:22,Twitter for iPhone,12,7,IAGovernor,1236791901434654722,8.518089353970115e+17,851808935397011456,False,,en,March,Q1
"For more information about novel coronavirus, visit .",76,2020-03-08 23:12:09,Twitter for iPhone,4,2,IAGovernor,1236791845088374784,8.518089353970115e+17,851808935397011456,False,https://t.co/7nsGUlUNwE,en,March,Q1
RELEASE: 3 presumptive positive COVID-19 cases in Iowa. Read more here:,119,2020-03-08 23:11:10,Twitter for iPhone,10,15,IAGovernor,1236791598924673024,,851808935397011456,False,https://t.co/6DohEcOhfk,en,March,Q1
I will be holding a press conference from my office at the Iowa State Capitol at 6:00 pm CST to give an update on the Coronavirus. There will be a live stream available at,195,2020-03-08 22:01:48,Twitter Web App,32,24,IAGovernor,1236774144093675520,,851808935397011456,False,https://t.co/LiI4TTVgoG,en,March,Q1
"Thank you to women across the globe who have led on equality, reform, and all who continue to have a passion to make a difference. #InternationalWomensDay",154,2020-03-08 18:05:32,Twitter for iPhone,63,20,IAGovernor,1236714683857600512,,851808935397011456,False,,en,March,Q1
I have ordered a partial activation of the State Emergency Operations Center (SEOC) in Johnston to ensure state agencies are prepared in the event COVID-19 is detected in the state. Read more here:,221,2020-03-07 15:29:22,Twitter for iPhone,51,22,IAGovernor,1236312996063989760,,851808935397011456,False,https://t.co/XsSzf2RcTS,en,March,Q1
"From Harlan to Council Bluffs, there is a lot of support for the #InvestInIowaAct!",106,2020-03-06 22:21:01,Twitter for iPhone,45,9,IAGovernor,1236054203241574400,,851808935397011456,False,https://t.co/Vm8blA9u60,en,March,Q1
Nick supports the #InvestInIowaAct because of what it will do for Iowa’s overall quality of life!,121,2020-03-06 21:46:11,Twitter for iPhone,18,6,IAGovernor,1236045436944859138,,851808935397011456,False,https://t.co/NAkBb3vO0u,en,March,Q1
Bob’s right! The #InvestInIowaAct is a win for rural Iowa. Thanks for coming to our town hall today.,124,2020-03-06 19:19:13,Twitter for iPhone,24,6,IAGovernor,1236008452851486721,,851808935397011456,False,https://t.co/gf3RVwELM1,en,March,Q1
Nancy thank you for being in Harlan today to support the #InvestInIowaAct!,98,2020-03-06 19:11:32,Twitter for iPhone,17,6,IAGovernor,1236006519126319105,,851808935397011456,False,https://t.co/WZ593IWd3W,en,March,Q1
Great work being done by @IowaCorrections!,66,2020-03-05 21:48:17,Twitter Web App,16,5,IAGovernor,1235683577079177219,,851808935397011456,False,https://t.co/l5uK8uOn4W,en,March,Q1
Met with IACP earlier today to thank them for the services they provide to individuals with disabilites and how we can build an even stronger partnership going forward!,192,2020-03-05 19:56:28,Twitter for iPhone,20,6,IAGovernor,1235655440266080256,,851808935397011456,False,https://t.co/1nyRz0P8jG,en,March,Q1
.@IowaStateU is here at the capitol. Great things happening at Iowa State! #Cyclones,108,2020-03-05 16:59:04,Twitter Web App,35,6,IAGovernor,1235610793766338560,,851808935397011456,False,https://t.co/ep5cTkKugC,en,March,Q1
Thank you @NAMICommunicate for supporting the #InvestInIowaAct!,87,2020-03-05 00:05:46,Twitter for iPhone,12,3,IAGovernor,1235355790179020800,,851808935397011456,False,https://t.co/LHrg18Ao6t,en,March,Q1
"Thanks for your support!!
This is an investment in Iowa’s future and those who are our future!  #InvestInIowa",133,2020-03-04 23:20:45,Twitter for iPhone,8,5,IAGovernor,1235344461565227010,,851808935397011456,False,https://t.co/8Y62YNam8p,en,March,Q1
Let’s get this done!!! Invest in Iowa!,62,2020-03-04 23:17:49,Twitter for iPhone,18,6,IAGovernor,1235343721614409733,,851808935397011456,False,https://t.co/v6jypfRP2G,en,March,Q1
Uriah supports the #InvestInIowaAct. He’s 28 years old and thinks this legislation will make Iowa an even better place to live.,151,2020-03-04 22:44:09,Twitter for iPhone,22,6,IAGovernor,1235335249242005504,,851808935397011456,False,https://t.co/zUrRAGHFwT,en,March,Q1
Thank you Fred for being here today to support the #InvestInIowaAct.,92,2020-03-04 22:11:12,Twitter for iPhone,11,5,IAGovernor,1235326955404349442,,851808935397011456,False,https://t.co/MoJY2y8poj,en,March,Q1
"Mike supports the #InvestInIowaAct because it’s time to fund the trust fund, enhance Iowa’s quality of life.",132,2020-03-04 22:08:20,Twitter for iPhone,12,5,IAGovernor,1235326234428674048,,851808935397011456,False,https://t.co/5x0CmlhMe5,en,March,Q1
Dave said it best. The #InvestInIowaAct is about our future. “Period.”,94,2020-03-04 22:02:45,Twitter for iPhone,23,6,IAGovernor,1235324830314049536,,851808935397011456,False,https://t.co/yfCVTigdlQ,en,March,Q1
Eric is here at the Iowa State Capitol to support the #InvestInIowaAct! Here’s why:,107,2020-03-04 21:59:21,Twitter for iPhone,17,7,IAGovernor,1235323974604685312,,851808935397011456,False,https://t.co/9owchrvY5q,en,March,Q1
Celebrating iJAG’s success!,51,2020-03-04 18:20:49,Twitter for iPhone,23,4,IAGovernor,1235268981050798080,,851808935397011456,False,https://t.co/cGGEYN9UrX,en,March,Q1
"Dr. Martin Gross, President and Co-Founder: Gross-Wen Technologies. 2020 Neal Smith Entrepreneur of the Year. Congratulations!",150,2020-03-03 22:20:54,Twitter for iPhone,7,2,IAGovernor,1234967008623681536,8.518089353970115e+17,851808935397011456,False,https://t.co/x6Za2moEYN,en,March,Q1
"Sue Tyrell, CEO &amp; Owner, HandsUp Communications. 2020 Deb Dalziel Woman Entrepreneur of the Year. Congratulations!",142,2020-03-03 22:19:32,Twitter for iPhone,9,3,IAGovernor,1234966665491877895,8.518089353970115e+17,851808935397011456,False,https://t.co/glCclX4hya,en,March,Q1
Honored to have an opportunity this afternoon to thank some incredible entrepreneurs driving economic growth here in Iowa.,146,2020-03-03 22:16:44,Twitter for iPhone,28,7,IAGovernor,1234965960345432069,,851808935397011456,False,https://t.co/JHjJUozJe9,en,March,Q1
"Iowa's high school graduation rate is UP! An important milestone, but the work continues.",113,2020-03-03 18:21:43,Twitter Web App,22,8,IAGovernor,1234906818926825479,,851808935397011456,False,https://t.co/0WbV8mEhS8,en,March,Q1
"“We know that Iowans work hard for every paycheck — every dollar. And what you earn, you should get to keep. It’s why we support Gov. Kim Reynolds’ Invest in Iowa Act.”",192,2020-03-03 16:36:50,Twitter for iPhone,14,7,IAGovernor,1234880423030861825,,851808935397011456,False,https://t.co/LUeQS2xgFa,en,March,Q1
Great things are happening! @IowaSTEM @IADeptofEd,73,2020-03-03 16:26:00,Twitter for iPhone,12,2,IAGovernor,1234877695940603904,,851808935397011456,False,https://t.co/yvIkkwjvPK,en,March,Q1
Addressing the Iowa Tourism Conference to highlight the incredible things that are happening! #OpportunityLivesHere #ThisIsIowa @BusinessIOWA @Travel_Iowa,178,2020-03-03 15:10:35,Twitter for iPhone,10,0,IAGovernor,1234858716710756353,,851808935397011456,False,https://t.co/SoHBlICV4t,en,March,Q1
"@IAPublicHealth @IowaHSEMD @VP @POTUS As with all flu, remember to practice safe hygiene practices and if you are sick stay home from work! (3/3)",145,2020-03-02 20:51:25,Twitter Web App,5,2,IAGovernor,1234582103481823234,8.518089353970115e+17,851808935397011456,False,,en,March,Q1
@IAPublicHealth @IowaHSEMD I participated in a video conference with @VP earlier today. I want to thank him and @POTUS for coordinating with governors across the country. (2/3),176,2020-03-02 20:51:11,Twitter Web App,6,2,IAGovernor,1234582046510592002,8.518089353970115e+17,851808935397011456,False,,en,March,Q1
"This morning, I met with @IAPublicHealth and @IowaHSEMD to discuss the potential dangers of the Coronavirus. Iowa remains at a low risk, but we are taking every precaution to keep Iowans safe and healthy. (1/3)",210,2020-03-02 20:50:51,Twitter Web App,28,7,IAGovernor,1234581961726976002,,851808935397011456,False,,en,March,Q1
I will always fight for the unborn. #IowaPrayerRallyforLife,83,2020-03-02 18:37:48,Twitter for iPhone,48,5,IAGovernor,1234548479525031937,,851808935397011456,False,https://t.co/rU1dI7e5zl,en,March,Q1
Thank you Emily! #InvestInIowaAct,57,2020-02-28 22:05:03,Twitter for iPhone,11,3,IAGovernor,1233513468776656896,,851808935397011456,False,https://t.co/tkYiGIk6eI,en,February,Q1
The Clinton County Public Library is bursting at the seams with people ready to talk about the #InvestInIowaAct. Let’s get started!,155,2020-02-28 20:34:20,Twitter for iPhone,13,4,IAGovernor,1233490639238651904,,851808935397011456,False,https://t.co/ELeOXWBvdr,en,February,Q1
The #InvestInIowaAct will help us recruit and retain the next generation of Iowans! @dubuquechamber,123,2020-02-28 17:57:45,Twitter for iPhone,20,7,IAGovernor,1233451234201362434,,851808935397011456,False,https://t.co/QcMUIzoNy9,en,February,Q1
Appreciate everyone who braved the snow this morning in Monticello for a conversation about the #InvestInIowaAct!,137,2020-02-28 15:13:33,Twitter for iPhone,10,2,IAGovernor,1233409914187460608,,851808935397011456,False,https://t.co/71WUnEj8XD,en,February,Q1
#InvestInIowaAct,40,2020-02-28 14:39:44,Twitter for iPhone,1,0,IAGovernor,1233401401394503681,8.518089353970115e+17,851808935397011456,False,https://t.co/qU3VuX8xYv,en,February,Q1
#InvestInIowaAct,40,2020-02-28 14:38:16,Twitter for iPhone,3,1,IAGovernor,1233401033101053953,8.518089353970115e+17,851808935397011456,False,https://t.co/yQjlo94kfs,en,February,Q1
One penny at a time! @Trees_Forever #fundthetrust,73,2020-02-28 14:29:51,Twitter for iPhone,6,3,IAGovernor,1233398913182380038,,851808935397011456,False,https://t.co/iZ58QObi0n,en,February,Q1
"It’s 7 am, but Cedar Rapids is eager to talk about the #InvestInIowaAct!",96,2020-02-28 13:10:16,Twitter for iPhone,46,8,IAGovernor,1233378885628243968,,851808935397011456,False,https://t.co/3ZLNa4ytFU,en,February,Q1
Outstanding turnout for today’s town hall in Waverly! A lot of interest in the #InvestInIowaAct!,120,2020-02-27 22:54:38,Twitter for iPhone,24,5,IAGovernor,1233163558332092417,,851808935397011456,False,https://t.co/hptwyGSZEY,en,February,Q1
The #InvestInIowaAct will help keep our young people here!,82,2020-02-27 20:19:36,Twitter for iPhone,2,0,IAGovernor,1233124543952293893,8.518089353970115e+17,851808935397011456,False,https://t.co/Dn6lAlomW0,en,February,Q1
Great conversation in Grundy Center about the #InvestInIowaAct! A lot of people out to support what we are working on...,144,2020-02-27 20:08:39,Twitter for iPhone,9,1,IAGovernor,1233121787992514560,,851808935397011456,False,https://t.co/iofKCDb5j4,en,February,Q1
Looking forward to our #InvestInIowaAct Town Hall in Grundy Center!,91,2020-02-27 18:09:07,Twitter for iPhone,11,4,IAGovernor,1233091705718689792,,851808935397011456,False,https://t.co/KqCXFYB1ct,en,February,Q1
"If the @EPA does reduce small refinery waivers in 2020, it will be a significant boost to IA ethanol producers. We will continue to monitor this development and hold @EPA accountable to @POTUS’s commitment to the #RFS.",242,2020-02-27 15:08:52,Twitter Web App,32,10,IAGovernor,1233046347273646082,,851808935397011456,False,https://t.co/NgcY7JH97t,en,February,Q1
Honored to welcome a delegation from Vietnam to the Governor’s office. Vietnam is an important trading partner for Iowa and I always welcome opportunities to build and expand on this important relationship!,230,2020-02-25 22:24:31,Twitter for iPhone,24,6,IAGovernor,1232431207528501248,,851808935397011456,False,https://t.co/RjqmFoKCZZ,en,February,Q1
