Tweets,Length,Date,Source,Favourites,RTs,Username,id_str,in_reply_to_user_id,user_id,isRT,tco,Language,Month,Quarter
"So impressed with Brandon and Katie’s story, passion, and work ethic! Thank you for having me at the Community Bowl Bar &amp; Grill!",156,2020-06-30 20:15:53,Twitter for iPhone,36,3,IAGovernor,1278059705701711874,,851808935397011456,False,https://t.co/icnnDuHT7e,en,June,Q2
So grateful to Floyd County Public Health and Emergency Managers for the incredible partnership! #COVID19 #99CountyTour,143,2020-06-30 17:48:25,Twitter for iPhone,22,5,IAGovernor,1278022592864178177,,851808935397011456,False,https://t.co/czNAsoltDm,en,June,Q2
It’s all in the name! Great visit to the Family Traditions Meat Company! #99CountyTour,110,2020-06-30 16:06:52,Twitter for iPhone,67,3,IAGovernor,1277997037355704320,,851808935397011456,False,https://t.co/nL0oqWnWMk,en,June,Q2
.@POTUS’s efforts align with what we are doing in Iowa to upskill and reskill Iowans for great careers!,127,2020-06-26 16:39:51,Twitter for iPhone,1746,373,IAGovernor,1276555785267527680,,851808935397011456,False,https://t.co/cRLD1GRg3y,en,June,Q2
Looking forward to tomorrow’s discussions at the @WhiteHouse with the American Workforce Policy Advisory Board. Getting America back to work!,165,2020-06-25 23:15:22,Twitter for iPhone,1289,316,IAGovernor,1276292934506332161,,851808935397011456,False,https://t.co/dcgvPMVD32,en,June,Q2
"I have issued a disaster proclamation today for Black Hawk County in response to a severe storm. 

Read more here:",138,2020-06-25 22:21:10,Twitter Web App,27,7,IAGovernor,1276279295510544385,,851808935397011456,False,https://t.co/MobSf27YHa,en,June,Q2
First meeting of the Governor’s Economic Recovery Advisory Board! Excited to get started!,113,2020-06-25 19:50:04,Twitter for iPhone,99,6,IAGovernor,1276241269308751872,,851808935397011456,False,https://t.co/rkmjaAH6FC,en,June,Q2
Thanks Keota Meat Processing for showing me how family owned meat lockers are stepping up to maintain food production during COVID-19! #99CountyTour,172,2020-06-23 21:51:33,Twitter for iPhone,151,15,IAGovernor,1275547064487882758,,851808935397011456,False,https://t.co/jxqr8driNw,en,June,Q2
"Very impressed by the high-quality, community-based services @OptimaeLife provides to vulnerable Iowans and their families. #99CountyTour",161,2020-06-23 20:30:00,Twitter for iPhone,37,5,IAGovernor,1275526542651723776,,851808935397011456,False,https://t.co/ps9xLBwBZ2,en,June,Q2
Thank you!,34,2020-06-23 18:18:17,Twitter for iPhone,167,7,IAGovernor,1275493396040343554,,851808935397011456,False,https://t.co/cdSJkrsflf,en,June,Q2
"We opened our first Test Iowa Clinic Site right here in West Burlington! Thanks for leading the charge and helping the Test Iowa program reach over 3,700 Iowans tested in one day!",203,2020-06-23 17:17:14,Twitter for iPhone,31,4,IAGovernor,1275478033084841985,,851808935397011456,False,https://t.co/kPEYbSrf5v,en,June,Q2
Grateful to Gen. Corell and the @IowaNatGuard for getting PPE across Iowa as we continue to combat COVID-19. 25 deliveries this week alone!,163,2020-06-23 16:25:24,Twitter for iPhone,83,11,IAGovernor,1275464986064756737,,851808935397011456,False,https://t.co/1P1SrGapWc,en,June,Q2
Resilient small businesses like “Town &amp; Country Cosmetology and Playtime Daycare” will lead Iowa’s economic recovery! #99CountyTour,159,2020-06-23 14:59:30,Twitter for iPhone,52,5,IAGovernor,1275443370337333248,,851808935397011456,False,https://t.co/uZ0Fyd8phB,en,June,Q2
Grateful to local emergency managers and public health officials who are one the frontlines of the COVID19 pandemic. Thank you Cedar County for hosting us today!,185,2020-06-22 22:23:52,Twitter for iPhone,65,10,IAGovernor,1275192811114151936,,851808935397011456,False,https://t.co/bJAQyAyqav,en,June,Q2
Heritage Designs Quilting &amp; Needlework’s sense of community and commitment to quality shows through their loyal customer base. Great things happening in rural Iowa!,192,2020-06-22 20:19:00,Twitter for iPhone,28,3,IAGovernor,1275161384528023553,,851808935397011456,False,https://t.co/0yVQXXqxkj,en,June,Q2
Hearing first hand how the Grinnell Food Coalition is making a difference for thousands of Iowans EVERY single week!,140,2020-06-22 18:10:55,Twitter for iPhone,44,8,IAGovernor,1275129153789050880,,851808935397011456,False,https://t.co/iI93SnrSGU,en,June,Q2
I signed the following bills into law today:,68,2020-06-18 21:01:51,Twitter Web App,22,6,IAGovernor,1273722618848444416,,851808935397011456,False,https://t.co/DxvfQO8qS7,en,June,Q2
"Iowans will be at the center of this effort as we continue to make our state the best place to live, work and raise a family.

Read more about today's announcement:",188,2020-06-18 19:44:33,Twitter Web App,71,10,IAGovernor,1273703167193210881,,851808935397011456,False,https://t.co/GPNNrytp60,en,June,Q2
Appreciate the strong partnership and teamwork at our Dallas County Test Iowa Site! Thank You @IowaNatGaurd @IowaDOT @IAPublicHealth,156,2020-06-17 21:48:55,Twitter for iPhone,66,3,IAGovernor,1273372074367737857,,851808935397011456,False,https://t.co/tNbgBNC8fM,en,June,Q2
Heartfelt thanks to the team at Manna of Worth County Food Pantry and the generous community supporting their effort!,141,2020-06-16 21:12:59,Twitter for iPhone,47,5,IAGovernor,1273000644421603341,,851808935397011456,False,https://t.co/gzGvgdDY8Q,en,June,Q2
.@Winnebago embodies Iowa’s entrepreneurial spirit. Thank you for providing outstanding service during unprecedented times.,147,2020-06-16 19:16:54,Twitter for iPhone,1046,188,IAGovernor,1272971431605870592,,851808935397011456,False,https://t.co/gjZP3cdfx6,en,June,Q2
Welcome back @VP! Look forward to joining the conversation about the Great American Comeback!,117,2020-06-16 16:04:33,Twitter for iPhone,1665,243,IAGovernor,1272923023855796224,,851808935397011456,False,https://t.co/jjhSrpGWlM,en,June,Q2
Osage Test Iowa Clinic now open at the Mitchell County Fairgrounds. Appreciate the collaboration from emergency managers &amp; Mitchell County Home Health and Public Health to serve Iowans.,213,2020-06-16 14:29:19,Twitter for iPhone,52,7,IAGovernor,1272899060022890503,,851808935397011456,False,https://t.co/2hKvmtQCp2,en,June,Q2
"This legislative session, we made significant steps to ensure every Iowan, regardless of their background or circumstance, has an opportunity to find success.  

Read my full statement below:",215,2020-06-14 18:51:34,Twitter Web App,56,11,IAGovernor,1272240279068827648,,851808935397011456,False,https://t.co/5zOAdXlulu,en,June,Q2
Today marks 243 years since the United States adopted the stars and stripes as our official flag! 🇺🇸 🦅,126,2020-06-14 16:22:44,Twitter for iPhone,206,21,IAGovernor,1272202825225953280,,851808935397011456,False,https://t.co/hG2stukFg5,en,June,Q2
Happy Birthday @USArmy and thank you to all who selflessly serve to defend our freedom! 🇺🇸 🇺🇸 🇺🇸,120,2020-06-14 13:05:51,Twitter for iPhone,133,21,IAGovernor,1272153279452061696,,851808935397011456,False,https://t.co/rNMYE66p4U,en,June,Q2
I appreciate the Iowa Legislature working with me to continue this program that has already changed the lives of so many Iowans. Great to see unanimous support for @futurereadyiowa!,205,2020-06-13 17:36:34,Twitter Web App,59,7,IAGovernor,1271859019716722700,,851808935397011456,False,https://t.co/rMgNognDRF,en,June,Q2
"Iowa is ready and eager to act! Proud to sign HF 2647, legislation to promote greater accountability in policing.",137,2020-06-12 19:10:13,Twitter for iPhone,215,30,IAGovernor,1271520198047170561,,851808935397011456,False,https://t.co/q7EVPdCbNX,en,June,Q2
"We are just getting started, but our work together shows Iowa is willing to have the tough conversations and to look past our differences to find common ground and a brighter future for all Iowans. Full statement here:",242,2020-06-12 00:24:47,Twitter for iPhone,166,27,IAGovernor,1271236972544167945,,851808935397011456,False,https://t.co/kXKOL8v2V3,en,June,Q2
"If Iowa is to succeed, we always have to be forward-looking and nimble to the demands of the ever-changing 21st century economy. Great to see this legislation pass unanimously.",200,2020-06-11 13:39:11,Twitter Web App,102,24,IAGovernor,1271074504589148160,,851808935397011456,False,https://t.co/AiSUP7LAj3,en,June,Q2
"I signed a new proclamation continuing the Public Health Disaster Emergency, easing restrictions on businesses and extending other measures. 

Read more here:",182,2020-06-10 20:16:29,Twitter Web App,72,11,IAGovernor,1270812097413214208,,851808935397011456,False,https://t.co/EYTjAHu0nJ,en,June,Q2
"Test Iowa will further expand access to COVID-19 testing with new sites opening this week, including one in Dallas County to better serve the Des Moines metro area, and four clinic sites in rural communities.

Read more here:",249,2020-06-08 14:56:02,Twitter Web App,59,16,IAGovernor,1270006677362946051,,851808935397011456,False,https://t.co/Q1ZKxXFks4,en,June,Q2
"“History does not long entrust the care of freedom to the weak or timid.” - Dwight D. Eisenhower. 

Today, we remember the forces of freedom who stormed the beaches of Normandy to turn the tide against tyranny!",234,2020-06-06 14:48:21,Twitter for iPhone,235,40,IAGovernor,1269279968418246656,,851808935397011456,False,https://t.co/O2ASDSM9Mp,en,June,Q2
"The right to vote is the cornerstone of being a part of any society, and I am proud of the broad coalition supporting this constitutional amendment.",172,2020-06-05 00:50:47,Twitter Web App,155,26,IAGovernor,1268706799378710528,,851808935397011456,False,https://t.co/ANF9JJqaPz,en,June,Q2
Sincerely appreciate @POTUS extending Title 32 Status so we can continue to use the National Guard to respond to the #COVID19 Pandemic. The @IowaNatGuard has done an exceptional job delivering supplies and supporting Test Iowa sites.,257,2020-06-04 19:14:42,Twitter Web App,100,16,IAGovernor,1268622225126518784,,851808935397011456,False,https://t.co/bilFvd6SZD,en,June,Q2
Polls are open! Find your polling place and #BeAVoter:,102,2020-06-02 13:19:26,Twitter Web App,89,23,IAGovernor,1267808042663448578,,851808935397011456,False,https://t.co/CsgIsfBqze,en,June,Q2
God bless the brave men and women of the @IowaNatGuard.,79,2020-06-01 14:02:24,Twitter for iPhone,444,46,IAGovernor,1267456466367262723,,851808935397011456,False,https://t.co/gxAzkR9R2b,en,June,Q2
"I support Polk County’s decision to implement a 9:00 p.m. curfew.

My full statement here:",114,2020-06-01 00:08:19,Twitter Web App,242,26,IAGovernor,1267246562113191939,,851808935397011456,False,https://t.co/E6iq0RC1mn,en,June,Q2
"We respect our neighbors, cherish our community, follow the rule of law, and that is how we will move forward together.

Read my full statement on last night's protest and violence in Des Moines:",219,2020-05-30 17:37:04,Twitter Web App,243,40,IAGovernor,1266785713900720128,,851808935397011456,False,https://t.co/K97IjT1Bt8,en,May,Q2
Many of our #TestIowa sites have been staffed by amazing nurses from @UnityPointNews and @MercyOneDSM. We’re so grateful for their work serving Iowans! #ThisIsIowa,163,2020-05-29 16:54:39,Twitter for iPhone,124,13,IAGovernor,1266412650088542211,,851808935397011456,False,,en,May,Q2
"Iowans take our civic responsibility seriously and I hope everyone will do their part and participate in the 2020 Census.

#IowaCounts",158,2020-05-27 17:26:04,Twitter Web App,59,13,IAGovernor,1265695780226162689,,851808935397011456,False,https://t.co/IHBxfqF33q,en,May,Q2
"I signed a new proclamation that calls for additional openings. 

Read more here:",105,2020-05-26 19:44:21,Twitter Web App,182,19,IAGovernor,1265368194350530561,,851808935397011456,False,https://t.co/XIaalpP6lJ,en,May,Q2
Thank you Carrie and Stacie Stoelting for honoring our heroes! #MemorialDay 🇺🇸,102,2020-05-25 19:23:11,Twitter for iPhone,38,4,IAGovernor,1265000477948874752,,851808935397011456,False,https://t.co/3C0cJbCm2P,en,May,Q2
Remembering those who have made the ultimate sacrifice in defense of our country and our freedom. #MemorialDay,134,2020-05-25 13:38:23,Twitter Web App,202,29,IAGovernor,1264913708343611394,,851808935397011456,False,https://t.co/QPCUhjolMo,en,May,Q2
"I have signed a new proclamation continuing the Public Health Disaster Emergency, allowing for some additional reopenings, and relaxing some restrictions. Read more here:",195,2020-05-20 18:10:32,Twitter Web App,212,30,IAGovernor,1263170255075119105,,851808935397011456,False,https://t.co/qwbrr2IocV,en,May,Q2
A message to the graduating class of 2020:,66,2020-05-17 14:47:18,Twitter Web App,56,12,IAGovernor,1262031947800481792,,851808935397011456,False,https://t.co/blAy9y3h9e,en,May,Q2
"I have signed a new proclamation permitting certain businesses to reopen throughout Iowa with appropriate public health measures in place.

Read more here:",180,2020-05-13 18:38:08,Twitter Web App,382,68,IAGovernor,1260640487251283969,,851808935397011456,False,https://t.co/NxfmguHZgh,en,May,Q2
Proud to recognize the brave hearts behind the badge and the legacy left behind by each fallen hero.,124,2020-05-09 17:22:49,Twitter for iPhone,150,23,IAGovernor,1259171984111546369,,851808935397011456,False,https://t.co/KLYz5lLJlE,en,May,Q2
"To our farmers, processors, and frontline workers, thank you for all you do to keep our state and country fed!",134,2020-05-08 20:17:09,Twitter for iPhone,2653,468,IAGovernor,1258853465322897408,,851808935397011456,False,https://t.co/jvyCSkFKgL,en,May,Q2
Welcome back to Iowa @VP Mike Pence! Appreciate the partnership from @POTUS and the entire team.,120,2020-05-08 17:29:27,Twitter for iPhone,449,35,IAGovernor,1258811264194809857,,851808935397011456,False,https://t.co/X3dJDaRkbt,en,May,Q2
"I signed a new proclamation continuing the public health disaster, permitting dental services, reopening some businesses, and other measures. 

Read more here:",183,2020-05-06 21:50:15,Twitter Web App,316,65,IAGovernor,1258152120014057474,,851808935397011456,False,https://t.co/C39PxHT14k,en,May,Q2
Meeting with @POTUS later today to discuss Iowa’s plans to reopen safely! The President and his team have been an outstanding partner in combatting the COVID19 pandemic.,169,2020-05-06 14:19:32,Twitter for iPhone,4811,1058,IAGovernor,1258038692129705986,,851808935397011456,False,,en,May,Q2
Great idea @MaddiePoppe #CedarValleyStrong!,69,2020-05-05 22:30:17,Twitter Web App,95,15,IAGovernor,1257799805838991366,,851808935397011456,False,https://t.co/vHJRbvgx0f,en,May,Q2
"Today's #COVID19 Update. 

Read more below:",67,2020-04-29 18:38:53,Twitter Web App,24,8,IAGovernor,1255567245884997637,,851808935397011456,False,https://t.co/NQVkcrSzkV,en,April,Q2
Congrats to these outstanding members of the Class of 2020 on being named a Governor’s Scholar by the Iowa High School Athletic Association!,164,2020-04-29 17:54:09,Twitter Web App,82,7,IAGovernor,1255555990268805122,,851808935397011456,False,https://t.co/Jlh7K1DLCk,en,April,Q2
"Meat processing plants are critical to the food supply and I support @POTUS taking action, look forward to hearing more!",144,2020-04-28 18:34:14,Twitter Web App,273,52,IAGovernor,1255203687418474498,,851808935397011456,False,https://t.co/SI3cP6VoTt,en,April,Q2
"Pass the pork! To support the program, visit the Iowa Food Bank Association website at .",135,2020-04-28 13:26:54,Twitter Web App,63,27,IAGovernor,1255126344935014403,,851808935397011456,False,https://t.co/uBRscb3wtR,en,April,Q2
"I have signed a new proclamation loosening social distancing measures in 77 Iowa counties effective Friday, May 1st.

Read more below:",158,2020-04-27 18:00:00,Twitter Web App,354,96,IAGovernor,1254832683861057536,,851808935397011456,False,https://t.co/4Fh66Cz9a2,en,April,Q2
So grateful to Dr. Mike Pentella and the entire team at the State Hygienic Lab working around the clock as part of the state’s response to #COVID19.,172,2020-04-26 00:00:41,Twitter for iPhone,169,20,IAGovernor,1254198678534881281,,851808935397011456,False,https://t.co/mtIGxHXOuZ,en,April,Q2
Successful launch today of the first Test Iowa test site! A critical component of our plan to reopen Iowa. @IowaNatGuard @iowastatepatrol @iowadot,170,2020-04-25 23:27:48,Twitter for iPhone,285,37,IAGovernor,1254190403898806276,,851808935397011456,False,https://t.co/fco1pBwDtY,en,April,Q2
"I signed a new proclamation that permits health care providers to begin the process of resuming some elective surgeries among other provisions. 

Read more below:",186,2020-04-24 21:03:15,Twitter Web App,187,18,IAGovernor,1253791639899955207,,851808935397011456,False,https://t.co/1ZJCCQBFSt,en,April,Q2
#TestIowaChallenge,42,2020-04-22 15:26:48,Twitter for iPhone,62,8,IAGovernor,1252982190834700290,,851808935397011456,False,https://t.co/drTuQBTsTV,en,April,Q2
"By partnering with @Qualtrics, we will be able to provide a statewide assessment to every resident and have a comprehensive way to manage the virus.",172,2020-04-22 01:24:57,Twitter for iPhone,81,13,IAGovernor,1252770332185952257,,851808935397011456,False,https://t.co/ScotvxfdEW,en,April,Q2
"We have just hit over 25,000 completed assessments since launching earlier today. Go to  right now and help us double it!",168,2020-04-21 19:42:36,Twitter Web App,254,87,IAGovernor,1252684179256508431,,851808935397011456,False,https://t.co/VaatwCwytq,en,April,Q2
"Kicking off the #TestIowaChallenge. It's as easy as 1...2...3! I challenge @IALtGov, @TheCarsonKingF1, @SenJoniErnst, @ChuckGrassley, @aplusk, @MurphyKeith, @MikeHousholder to visit , take the assessment &amp; then challenge 5 people you know to do the same.",305,2020-04-21 17:10:59,Twitter for iPhone,278,126,IAGovernor,1252646022892969992,,851808935397011456,False,https://t.co/sVbrUxkDhB,en,April,Q2
"Today's #COVID19 status update.

Read more below:",73,2020-04-20 22:03:31,Twitter Web App,18,7,IAGovernor,1252357253933305857,,851808935397011456,False,https://t.co/0JCDHRZLfC,en,April,Q2
Keeping biofuels plants open is vital for the rural economy. Read my message to @SecretarySonny:,120,2020-04-18 23:43:47,Twitter for iPhone,152,32,IAGovernor,1251657712099827712,,851808935397011456,False,https://t.co/nKsCBXaCuu,en,April,Q2
"Earlier today, I announced that Iowa schools will be closed through the rest of the school year. While I would like nothing more for students to be back in the classroom in May, we have to prioritize the health and safety of Iowans.

Read more here:",273,2020-04-17 17:50:50,Twitter Web App,333,89,IAGovernor,1251206498300166145,,851808935397011456,False,https://t.co/ioqDcBU5Mj,en,April,Q2
"We all have a role to play and by staying home, we can limit the spread of #COVID19. Thank you Ashton Kutcher for being a part of this PSA.",163,2020-04-16 20:24:15,Twitter Web App,177,34,IAGovernor,1250882719569055745,,851808935397011456,False,https://t.co/W1Gf9GVL38,en,April,Q2
"Today I signed a new proclamation continuing the State Public Health Emergency Declaration and implementing additional measures to protect residents, workers, and the public in RMCC Region 6.

Read more below:",233,2020-04-16 19:31:39,Twitter Web App,68,27,IAGovernor,1250869482802876418,,851808935397011456,False,https://t.co/i4qlJyHiWf,en,April,Q2
"Today's #COVID19 Update.

Read more here:",65,2020-04-15 21:48:32,Twitter Web App,22,7,IAGovernor,1250541541602603018,,851808935397011456,False,https://t.co/5ftDTkBBTQ,en,April,Q2
"Yesterday, we updated  to keep Iowans better informed about #COVID19 

Read more here:",133,2020-04-15 17:10:51,Twitter Web App,42,17,IAGovernor,1250471663449317382,,851808935397011456,False,https://t.co/aHsPK2hInU,en,April,Q2
"Today's #COVID19 Update.

Read more below:",66,2020-04-13 19:38:24,Twitter Web App,21,11,IAGovernor,1249784017613991939,,851808935397011456,False,https://t.co/hnIJkyuFJT,en,April,Q2
"Sunday's #COVID19 Update.

Read more below:",67,2020-04-12 19:38:38,Twitter Web App,40,11,IAGovernor,1249421689479405568,,851808935397011456,False,https://t.co/5e2TsvAnM8,en,April,Q2
"Saturday's #COVID19 Update.

Read more below:",69,2020-04-11 16:12:57,Twitter Web App,24,9,IAGovernor,1249007539687170049,,851808935397011456,False,https://t.co/bb4jVVWmqc,en,April,Q2
We can all do our part to limit the spread of #COVID19.,79,2020-04-11 14:03:13,Twitter for iPhone,166,35,IAGovernor,1248974891736535046,,851808935397011456,False,https://t.co/TRVr6orStX,en,April,Q2
"I have signed a new proclamation continuing the State Public Health Emergency Declaration to provide additional regulatory relief.

Read more here:",171,2020-04-10 22:19:00,Twitter for iPhone,74,9,IAGovernor,1248737270871572495,,851808935397011456,False,https://t.co/09zruD1XFe,en,April,Q2
Thank You!,34,2020-04-09 18:56:22,Twitter Web App,2022,401,IAGovernor,1248323887538061314,,851808935397011456,False,https://t.co/AmWxoRdghm,en,April,Q2
Thank you @JohnDeere!,45,2020-04-09 18:55:45,Twitter Web App,50,4,IAGovernor,1248323731988111361,,851808935397011456,False,https://t.co/OXVCGQz50N,en,April,Q2
"I've declared tomorrow (4/9) as a ""Day of Prayer"" in Iowa. It's the first day of Passover and Maundy Thursday, and I encourage all Iowans to unite in prayer.",181,2020-04-08 22:24:36,Twitter for iPhone,3647,636,IAGovernor,1248013903235149824,,851808935397011456,False,https://t.co/JL7Mhbu97W,en,April,Q2
We took very significant measures early on and are continuing to do everything we can to mitigate the effect of #COVID19 on vulnerable Iowans.,166,2020-04-07 14:54:19,Twitter Web App,133,18,IAGovernor,1247538200114941953,,851808935397011456,False,https://t.co/GOTY0aPlkP,en,April,Q2
Appreciate @POTUS for being a partner in our efforts to fight #COVID19. Very good conversation with Dr. Fauci today! @WhiteHouse,152,2020-04-06 22:43:54,Twitter for iPhone,1243,240,IAGovernor,1247293985871343617,,851808935397011456,False,https://t.co/ibRIZccm6n,en,April,Q2
"Had a productive and positive phone call w/ Dr. Fauci and @GovRicketts today... Dr. Fauci was 100% supportive, saying that IA and NE are “on the same page” with guidance he’s providing other states.",198,2020-04-06 18:03:50,Twitter Web App,1896,272,IAGovernor,1247223505202151426,,851808935397011456,False,,en,April,Q2
I have ordered additional closures to help limit the spread of #COVID19. Read more below:,113,2020-04-06 17:25:11,Twitter Web App,144,47,IAGovernor,1247213778921496576,,851808935397011456,False,https://t.co/T4p9epOjaS,en,April,Q2
"Sunday's #COVID19 Update. I am holding a press conference tomorrow at 11:00 a.m. 

Read more below:",123,2020-04-05 18:21:57,Twitter Web App,96,19,IAGovernor,1246865675769073665,,851808935397011456,False,https://t.co/nhzZIhaaOc,en,April,Q2
Appreciate @POTUS and his team for supporting IA’s efforts to combat the spread of #COVIDー19. Read more:,128,2020-04-04 19:41:28,Twitter for iPhone,296,45,IAGovernor,1246523299049476097,,851808935397011456,False,https://t.co/iEisZluxpd,en,April,Q2
He will do an incredible job!,54,2020-04-03 23:16:52,Twitter for iPhone,114,13,IAGovernor,1246215119224389636,,851808935397011456,False,https://t.co/tuc04lsQVn,en,April,Q2
Here’s how you can help limit the spread of #COVIDー19! We all have a role to play.,106,2020-04-03 13:35:12,Twitter for iPhone,432,149,IAGovernor,1246068738086109184,,851808935397011456,False,https://t.co/BADxLg3OYz,en,April,Q2
"I have extended the closures of schools, some businesses, and other measures until April 30th as we continue to fight the spread of #COVID19.",165,2020-04-02 22:33:31,Twitter Web App,246,81,IAGovernor,1245841821336567811,,851808935397011456,False,https://t.co/9trjLlfZcn,en,April,Q2
"I signed a new proclamation continuing the State Public Health Emergency Declaration. The proclamation extends regulatory relief for bars, restaurants, and additional measures. Read more:",211,2020-03-31 22:48:59,Twitter Web App,121,24,IAGovernor,1245120938225602563,,851808935397011456,False,https://t.co/t6LwSq5ESW,en,March,Q1
I am holding a press conference at 2:30 p.m. Today's #COVIDー19 Update can be found below:,113,2020-03-31 18:28:59,Twitter Web App,66,17,IAGovernor,1245055505753612292,,851808935397011456,False,https://t.co/ZrrkkXjSbm,en,March,Q1
"Sunday's #COVID19 Update. 

Today's press conference is at 2:30 p.m. Read more below:",109,2020-03-29 17:03:51,Twitter for iPhone,60,21,IAGovernor,1244309305102393344,,851808935397011456,False,https://t.co/IF0vKLcsya,en,March,Q1
"#COVID19 Update: 64 additional positive cases. I am holding a press conference tomorrow at 2:30 p.m.
 
Read more:",138,2020-03-28 17:18:34,Twitter Web App,84,28,IAGovernor,1243950620794589184,,851808935397011456,False,https://t.co/Yo8BL1dduu,en,March,Q1
Appreciate everything Tailyn is doing to help us communicate with Iowans.,97,2020-03-28 14:46:57,Twitter for iPhone,1222,53,IAGovernor,1243912465114685443,,851808935397011456,False,https://t.co/OHrnJQUCc0,en,March,Q1
I issued a new proclamation continuing the State Public Health Emergency Declaration. Read more here:,125,2020-03-26 23:17:08,Twitter Web App,86,38,IAGovernor,1243316080879251457,,851808935397011456,False,https://t.co/FX452lJLmF,en,March,Q1
Thursday’s COVID-19 update. Press conference at 2:30 p.m. today.,88,2020-03-26 17:46:55,Twitter Web App,39,11,IAGovernor,1243232982879666176,,851808935397011456,False,https://t.co/mJ6LTGlBCF,en,March,Q1
This is a significant victory for @Iowafuel and rural America! Applaud @POTUS for making the right decision to not appeal the 10th circuit decision on SRE’s and now it’s critical that the @EPA applies this rule nationwide!,246,2020-03-25 18:45:38,Twitter for iPhone,87,24,IAGovernor,1242885368409731073,,851808935397011456,False,https://t.co/pHdPMXjelw,en,March,Q1
VIDEO: I sit down with @IowaDHS Director Kelly Garcia to talk about child care,102,2020-03-25 18:39:46,Twitter Web App,24,11,IAGovernor,1242883894745104385,,851808935397011456,False,https://t.co/v1sxqES4fB,en,March,Q1
