Tweets,Length,Date,Source,Favourites,RTs,Username,id_str,in_reply_to_user_id,user_id,isRT,tco,Language,Month,Quarter
,23,2020-03-17 14:18:20,Periscope,1118,398,NYGovCuomo,1239918997815971841,,232268199,False,https://t.co/S9isR5MbTx,en,March,Q1
Stay Home. Stop the Spread. Save Lives.,63,2020-03-17 12:46:06,Twitter Media Studio,2685,982,NYGovCuomo,1239895788421070854,,232268199,False,https://t.co/eehr9QInmx,en,March,Q1
"Stay Home. Stop the Spread. Save Lives.

Pass it on.",76,2020-03-16 21:33:54,Twitter Media Studio,6792,3057,NYGovCuomo,1239666226743427079,,232268199,False,https://t.co/iXwOqZL1yU,en,March,Q1
"Happy to do your job, too.

Just give me control of the Army Corps of Engineers and I’ll take it from there.",156,2020-03-16 18:57:02,Twitter Web App,103682,23350,NYGovCuomo,1239626747903082502,,232268199,False,https://t.co/nfjZ8xiRL4,en,March,Q1
The deleted tweet:,42,2020-03-16 18:45:23,Twitter Web App,12488,3303,NYGovCuomo,1239623814297915393,232268199.0,232268199,False,https://t.co/z26KydtDYO,en,March,Q1
"I have to do more?  

No — YOU have to do something!  You’re supposed to be the President.",114,2020-03-16 17:53:24,Twitter Web App,70011,18572,NYGovCuomo,1239610734033670145,,232268199,False,https://t.co/tYeDt1lcOZ,en,March,Q1
"REMINDER: If you’re feeling sick, use #Telehealth services *before* going to the doctor’s office, Urgent Care, or the ER. It keeps you safer, and it keeps those around you safer. NYS has ordered co-pays to be eliminated for telehealth consultations.",249,2020-03-16 16:11:40,Twitter Web App,3619,1176,NYGovCuomo,1239585133335851009,,232268199,False,,en,March,Q1
"Three more Drive-Thru Mobile Testing Centers are coming soon to Staten Island, Long Island, and Rockland County.

The New Rochelle drive-thru center has been a success. It’s the smartest way to test for #Coronavirus, because it reduces potential exposure for everyone.",268,2020-03-16 16:06:48,Twitter Web App,5604,1304,NYGovCuomo,1239583907550560256,,232268199,False,,en,March,Q1
"President Trump: Deploy the Army Corps of Engineers to build temporary medical facilities, so that when hospitals are overwhelmed, we can move people into the temporary facilities.

It’s only a matter of time before our state's ICU beds fill up.

The federal gov't must act.",274,2020-03-16 15:28:04,Twitter Web App,11460,3621,NYGovCuomo,1239574157614108672,,232268199,False,,en,March,Q1
"Our first responders are showing tremendous courage just by doing their job every single day.

We need to make sure they’re getting the precautions they need. Every local government MUST provide their local police department and emergency medical workers with face masks.",271,2020-03-16 15:14:11,Twitter Web App,2867,486,NYGovCuomo,1239570666208313345,,232268199,False,,en,March,Q1
Updating New Yorkers with the latest on the State's #Coronavirus response. WATCH:,105,2020-03-16 14:57:33,Periscope,1236,502,NYGovCuomo,1239566478011027456,,232268199,False,https://t.co/Ho4oV9GrV9,en,March,Q1
"Our primary goal is to slow the spread of #Coronavirus so that the wave doesn’t crash our healthcare system. Social distancing is the best way to do that.

I have called on the federal gov't to implement nationwide protocols, but in their absence we are taking this on ourselves.",279,2020-03-16 14:34:29,Twitter Web App,4440,904,NYGovCuomo,1239560673102880776,232268199.0,232268199,False,,en,March,Q1
"The #Coronavirus doesn't care about state borders, so this agreement with @GovNedLamont &amp; @GovMurphy will help protect the entire Tri-State Area.

These temporary closures will last as long as is necessary to protect the public health.

Grocery stores will remain OPEN.",273,2020-03-16 14:34:28,Twitter Web App,4858,966,NYGovCuomo,1239560672029167616,232268199.0,232268199,False,,en,March,Q1
"#BREAKING: NY, CT and NJ are taking joint regional action to reduce the spread of #COVID19:

Effective 8PM TONIGHT:

-Crowd capacity reduced to 50 
-Restaurants/bars will be takeout/delivery ONLY 
-Gyms closed
-Movie theaters closed
-Casinos closed",248,2020-03-16 14:26:44,Twitter Web App,33761,13404,NYGovCuomo,1239558725528178689,,232268199,False,,en,March,Q1
"KEEP YOUR DISTANCE. Social distancing will help New York #FlattenTheCurve.

STAY HOME, and cancel non-essential appointments and travel, even if you feel well.

People with no symptoms can still spread #Coronavirus.",239,2020-03-16 12:31:47,Twitter Web App,2589,1200,NYGovCuomo,1239529795135975424,,232268199,False,https://t.co/20xSkcoqbv,en,March,Q1
"Thank God for our nurses, doctors and all first responders on the front line of NY’s fight against #Coronavirus. We owe them our deepest gratitude and thanks. They are heroes.",175,2020-03-15 23:41:24,Twitter Web App,11627,2147,NYGovCuomo,1239335925202784257,,232268199,False,,en,March,Q1
"NYC must have a plan in place in the next 24 hours for childcare for essential workers and a plan to make sure kids will continue to get the meals they need.

NYC schools will close early this week.

This action is necessary to reduce density and mitigate the spread of #COVID19.",279,2020-03-15 21:11:01,Twitter Web App,7991,2337,NYGovCuomo,1239298078051414016,,232268199,False,,en,March,Q1
"We need unprecedented federal action to respond to #COVID19

I said to the President, this is no time for politics. I don’t care if you're a Democrat or Republican. This is about saving lives.

I'll work in full partnership with @POTUS on this​—but I ask him to take it seriously",279,2020-03-15 20:25:11,Twitter Web App,5697,1133,NYGovCuomo,1239286541685534730,,232268199,False,,en,March,Q1
"False or inaccurate information makes difficult situations even more challenging. The best way to keep you and your loved ones safe is to follow trusted sources of information only.

Visit  for the latest accurate information related to #COVID19.",269,2020-03-15 18:46:03,Twitter Web App,1128,373,NYGovCuomo,1239261597509595136,,232268199,False,https://t.co/9Lh51KWEPW,en,March,Q1
"Help New York #FlattenTheCurve!

Slowing down #Coronavirus is necessary to protect your health &amp; reduce the strain on our healthcare system.

Here’s what to do:

-Stay home as much as possible
-Keep 6 feet of distance from others in public
-Minimize in-person social contact",302,2020-03-15 17:37:47,Twitter Web App,2491,1225,NYGovCuomo,1239244414825963520,,232268199,False,https://t.co/zPIKPTfXzg,en,March,Q1
"We have facilities that could serve as temporary hospitals, like SUNY dorms.

I am urging the President: deploy the Army Corps of Engineers, retrofit these buildings as medical facilities to free up hospital beds.

The federal gov't alone has the ability to do this fast enough.",278,2020-03-15 17:32:14,Twitter Web App,2572,920,NYGovCuomo,1239243019091685378,232268199.0,232268199,False,,en,March,Q1
"We need more ICU beds and we need the federal gov’t to help us meet this urgent need.

It is only a matter of time before ICU beds are full.

We are identifying reserve health care staff (retired drs, nurses, Nat'l Guard medics). #COVID19",238,2020-03-15 17:30:38,Twitter Web App,2969,949,NYGovCuomo,1239242614735593474,,232268199,False,,en,March,Q1
"Starting tomorrow, all non-essential State employees in Rockland, Westchester, NYC, &amp; L.I. are asked to stay home and work from home.

This represents about 50% of workforce in these counties.

I've also asked the Court System to postpone non-essential services.",266,2020-03-15 17:05:02,Twitter Web App,2425,933,NYGovCuomo,1239236173719093248,,232268199,False,,en,March,Q1
"I am asking private businesses to aggressively consider voluntary closings and allow employees to work from home.

Reducing density is both a social responsibility &amp; will help protect workforces.

If businesses don't voluntarily cooperate, we will consider mandatory measures.",280,2020-03-15 17:04:40,Twitter Web App,9019,2579,NYGovCuomo,1239236081075265536,,232268199,False,,en,March,Q1
Updating New Yorkers with the latest on #Coronavirus. WATCH:,84,2020-03-15 16:34:04,Periscope,852,451,NYGovCuomo,1239228380878270465,,232268199,False,https://t.co/qNLmLZVhpe,en,March,Q1
President Trump: The Nation Needs Comprehensive Federal Action to Combat Coronavirus Now,112,2020-03-15 14:34:36,Twitter Web App,1086,368,NYGovCuomo,1239198314844872704,,232268199,False,https://t.co/nfjZ8xiRL4,en,March,Q1
"What we do next will have a massive impact on the trajectory of this virus in New York.
 
We can only maintain public health by STAYING APART. 

The decision each of makes now will impact us all tomorrow. STAY HOME.",215,2020-03-15 13:07:21,Twitter Web App,35914,9205,NYGovCuomo,1239176360632999937,,232268199,False,,en,March,Q1
"Federal Corona Bill gives NYS the lowest level of reimbursement rate at 50%. Other states get 75%.

Politicians say NY gets more $ than most states, that's only bc we spend more—we get reimbursed at a lower rate. With highest # of cases, why is our rate the lowest? Fight for NY!",279,2020-03-15 02:33:58,Twitter Web App,4858,1184,NYGovCuomo,1239016963944448001,,232268199,False,,en,March,Q1
"If the new federal #Coronavirus bill passes as is, New York — which has the most Coronavirus cases in the nation — will once again be shortchanged and the bill prohibits many changes to the Medicaid program. Goodbye MRT, goodbye NY balanced budget! Stop hurting NYS.",266,2020-03-15 01:32:46,Twitter Web App,1551,400,NYGovCuomo,1239001563303153664,,232268199,False,,en,March,Q1
"Unfortunately, our Assembly colleagues Helene Weinstein and Charles Barron have been diagnosed with COVID-19.

I’m hoping they get well soon.

Out of an abundance of caution the Capitol will be closed to visitors effective tomorrow",255,2020-03-15 01:30:34,Twitter Web App,935,447,NYGovCuomo,1239001007595667464,,232268199,False,https://t.co/6GUU1dHbQn,en,March,Q1
This afternoon the Rockland County medical examiner's office confirmed the #Coronavirus-related death of a 65-year-old man who also had underlying health problems. My condolences go out to his family.,200,2020-03-15 01:17:06,Twitter Web App,860,140,NYGovCuomo,1238997620447723520,,232268199,False,,en,March,Q1
"I’m signing an Executive Order that allows any New Yorker to vote absentee for the Queens Borough President special election on 3/24. It also extends the deadline to apply to vote absentee to 3/23. Previously, only people who are ill or out of county could vote absentee.",271,2020-03-14 21:19:37,Twitter Web App,3159,889,NYGovCuomo,1238937853675085826,,232268199,False,,en,March,Q1
"NEWS: The safety of NYers is our top priority.

I'm signing an Executive Order to reduce the # of Petition Signatures to 30% of the statutory threshold; Petition period will end at 5PM, Tues 3/17.

This will ensure our electoral process goes on while safeguarding public health.",278,2020-03-14 20:11:33,Twitter Web App,3293,749,NYGovCuomo,1238920724007485443,,232268199,False,,en,March,Q1
I'll be on @1010WINS in a few minutes to discuss the evolving #Coronavirus situation. Listen here:,122,2020-03-14 16:54:04,Twitter Web App,141,30,NYGovCuomo,1238871025737138178,,232268199,False,https://t.co/fRke5ICq09,en,March,Q1
On @wcbs880 right now. Tune in:,55,2020-03-14 16:33:59,Twitter Web App,80,16,NYGovCuomo,1238865970837536768,,232268199,False,https://t.co/bfbBcUxiqY,en,March,Q1
"I'm directing insurers to waive co-pays for #telehealth visits. 

Calling for medical advice and then only visiting the ER or doctor's office if so advised will limit your exposure and keep our medical professionals healthy and able to work. 

It is the best way to keep healthy.",279,2020-03-14 16:00:22,Twitter Web App,2429,511,NYGovCuomo,1238857511589097473,,232268199,False,,en,March,Q1
Will be calling into @CNN right now with an update on #Coronavirus. Tune in.,76,2020-03-14 15:06:00,Twitter Web App,496,55,NYGovCuomo,1238843830180298753,,232268199,False,,en,March,Q1
"I am saddened to report the #COVID19-related death of an 82-year-old women in NYC who had a pre-existing respiratory disease (emphysema).

I extend my condolences to her family during this challenging time.",206,2020-03-14 14:54:17,Twitter Web App,6142,1344,NYGovCuomo,1238840883673522181,,232268199,False,,en,March,Q1
"In times of crisis, we tend to see what people are made of.

Today we are seeing the best.

I truly respect &amp; am grateful for the incredible healthcare professionals throughout New York State and their selfless work.",244,2020-03-13 20:20:44,Twitter Media Studio,1447,253,NYGovCuomo,1238560649506062342,,232268199,False,https://t.co/3i0FhWyKEO,en,March,Q1
"UPDATE: NYS has 96 confirmed new cases of novel coronavirus, bringing the statewide total to 421.

Westchester: 158
NYC: 154
Nassau: 51
Suffolk: 28
Rockland: 9
Ulster: 5
Dutchess: 3
Orange: 3
Saratoga: 3
Albany: 2
Broome: 1
Delaware: 1
Herkimer: 1
Monroe: 1
Schenectady: 1",272,2020-03-13 19:07:41,Twitter Web App,1821,1099,NYGovCuomo,1238542265301204992,,232268199,False,,en,March,Q1
"Today I asked the Department of Public Service to direct utilities not to cut off service to any person who hasn’t paid their bill as a result of the #Coronavirus situation.

No one should face losing their electricity or gas or water because of this public health emergency.",275,2020-03-13 18:18:54,Twitter Web App,8442,1533,NYGovCuomo,1238529986224668673,,232268199,False,,en,March,Q1
"We know that some New Yorkers are going to lose work &amp; even their jobs because of #Coronavirus.

NYS will immediately waive the 7-day waiting period for unemployment insurance for people who have been laid off due to virus.",227,2020-03-13 18:05:33,Twitter Web App,2714,647,NYGovCuomo,1238526626675253251,,232268199,False,,en,March,Q1
"After weeks of waiting, NYS now has authority from the FDA to conduct #Coronavirus testing at 28 labs across the state.

That will increase our testing capacity dramatically — from 3,000 to date to about 6,000/day starting next week.",233,2020-03-13 18:02:15,Twitter Web App,2952,827,NYGovCuomo,1238525796869947392,,232268199,False,,en,March,Q1
Giving New Yorkers another update on #Coronavirus. Watch live:,86,2020-03-13 17:36:13,Periscope,409,169,NYGovCuomo,1238519245043929088,,232268199,False,https://t.co/0sAz2ybtbN,en,March,Q1
"NYS is partnering with @BioReference to run an addition 5,000 #coronavirus tests a day.

That is on top of the testing being done at 28 public &amp; private labs.

As we test more, the numbers will rise. But remember that the more positives we find, the more we can reduce the spread.",284,2020-03-13 17:19:26,Twitter Web App,1816,429,NYGovCuomo,1238515024072671233,,232268199,False,,en,March,Q1
"To make an appointment, New Rochelle residents should call 888-364-3065.

We are prioritizing New Rochelle residents &amp; individuals that are part of the highest risk population

Remember that the more positive tests we find, the more we can limit the virus and reduce its spread.",282,2020-03-13 17:00:14,Twitter Web App,386,114,NYGovCuomo,1238510192414928897,232268199.0,232268199,False,,en,March,Q1
"Today we opened the State's first drive-through #COVID19 mobile testing center in New Rochelle.

The Mobile Testing Center has 6 lanes and can test up to 200 ppl today and up to 500 ppl/day in the coming days.

It is not only faster and easier, it’s also smarter and safer.",297,2020-03-13 17:00:14,Twitter Web App,3002,743,NYGovCuomo,1238510189717970946,,232268199,False,https://t.co/mW2JeRch84,en,March,Q1
In New Rochelle opening the State's first drive-through #COVID19 mobile testing center. Watch live:,123,2020-03-13 14:28:05,Periscope,1836,583,NYGovCuomo,1238471902366068737,,232268199,False,https://t.co/k4DDN2Q6VL,en,March,Q1
"With #Coronavirus dominating the headlines, we can't forget about another major global threat: Climate change.
 
We need to pass the ""Restore Mother Nature"" Bond Act to restore our environment and protect against climate change. Become a citizen cosponsor:",256,2020-03-13 13:14:43,Twitter for Advertisers,800,161,NYGovCuomo,1238453437572042752,,232268199,False,,en,March,Q1
"The U.S. Census Bureau launched its 2020 online questionnaire and have started mailing out notices TODAY.
 
I urge all New Yorkers to complete the Census. It shapes the future of this state. Make sure you're counted! #GetCountedNY",230,2020-03-12 23:33:46,Twitter for Advertisers,367,154,NYGovCuomo,1238246837095727107,,232268199,False,,en,March,Q1
"Remember: Even if you're young &amp; healthy, people around you may be more vulnerable.

We should all take precautions to prevent the spread of #Coronavirus, like frequent hand washing. Let's look out for each other.

Stay informed — but don't let fear outpace the facts.",296,2020-03-12 21:12:53,Twitter Web App,1341,528,NYGovCuomo,1238211385034706944,,232268199,False,https://t.co/3SvdVcqY43,en,March,Q1
"Our priority is treating infected patients, and we are carefully watching the hospitalization rate and looking at options:

-Accelerating staffing
-Identifying State facilities that could serve as temporary hospitals if needed
-Coordinating among upstate/downstate hospitals",274,2020-03-12 18:43:16,Twitter Web App,650,131,NYGovCuomo,1238173730867740672,,232268199,False,,en,March,Q1
"We are focused on taking special precautions with nursing homes &amp; senior care facilities.

We are requiring that all staff at nursing homes wear masks and be monitored for symptoms. 

No non-medical staff will be permitted to visit nursing homes.",250,2020-03-12 18:33:50,Twitter Web App,629,178,NYGovCuomo,1238171357751529475,,232268199,False,,en,March,Q1
"We must plan for every contingency &amp; we are taking measures to create a reserve workforce of health care professionals in the event of a staffing shortage.

We are identifying potential reserve staff now, incl. National Guard medics, medical school staff, former drs/nurses &amp; more",288,2020-03-12 18:23:12,Twitter Web App,800,190,NYGovCuomo,1238168680166494209,,232268199,False,,en,March,Q1
"For Broadway theaters in Manhattan, these rules will go into effect at 5pm TODAY.

We have already spoken to the theaters about these new measures and they agreed.",163,2020-03-12 18:18:44,Twitter Web App,1001,358,NYGovCuomo,1238167558794215426,232268199.0,232268199,False,,en,March,Q1
"We are taking new actions to reduce the density of people across the state.

Starting Friday at 5pm, gatherings with 500 people or more will not be permitted in NYS.

Additionally, for facilities with an occupancy of 500 or fewer, we are reducing the legal capacity by 50%.",273,2020-03-12 18:16:03,Twitter Web App,4465,2031,NYGovCuomo,1238166881372196865,,232268199,False,,en,March,Q1
In Albany updating New Yorkers on #Coronavirus. Watch live:,83,2020-03-12 18:02:34,Periscope,329,193,NYGovCuomo,1238163490306572288,,232268199,False,https://t.co/51E6zN04no,en,March,Q1
"NEWS: The organizers of the St. Patrick’s Day Parade in NYC have agreed to postpone the parade given the evolving #Coronavirus situation.

I thank the parade's leadership for working cooperatively w/ us.

We believe postponing the parade is in the best interest of public health.",279,2020-03-12 02:50:03,Twitter Web App,2411,423,NYGovCuomo,1237933848236883968,,232268199,False,,en,March,Q1
"UPDATE: There are an additional 43 confirmed cases of #Coronavirus in NYS, bringing total to 216.

Westchester: 121
NYC: 52 
Nassau: 28
Suffolk: 6 
Rockland: 6
Saratoga: 2
Ulster: 1

We continue to expect these numbers to go up as we test.",239,2020-03-11 19:53:50,Twitter Web App,1463,681,NYGovCuomo,1237829104071819264,,232268199,False,,en,March,Q1
"No one should face economic hardship because a quarantine prevents them from working.

New York State is going to set an example by guaranteeing 2 full weeks of paid leave for all state workers who are quarantined or in isolation due to #Coronavirus.",250,2020-03-11 18:20:51,Twitter Web App,9447,1685,NYGovCuomo,1237805701201870849,,232268199,False,,en,March,Q1
"Starting March 19, @CUNY and @SUNY will move to a distance-learning model for the rest of the semester.

This will help us reduce density and reduce the spread of this virus. #COVID19",183,2020-03-11 18:12:13,Twitter Web App,9360,6128,NYGovCuomo,1237803530787991553,,232268199,False,,en,March,Q1
"NYS will start contracting with private labs in New York to increase our #Coronavirus testing capacity. I have spoken with 28 labs today.

We are quickly mobilizing to get these private labs online as soon as possible.",218,2020-03-11 18:06:32,Twitter Web App,1492,349,NYGovCuomo,1237802097795649536,,232268199,False,,en,March,Q1
Giving New Yorkers an update on #Coronavirus. Watch live:,81,2020-03-11 17:50:42,Periscope,373,191,NYGovCuomo,1237798115224088576,,232268199,False,https://t.co/JuLCeU2Po9,en,March,Q1
"The Ronald McDonald House in NYC ran out of hand sanitizer &amp; couldn't get more. I'm glad NYS could help by delivering some ""NYS Clean.""

It's easy to forget that containing a virus isn’t just about making sure you don’t get sick—it’s making sure NY's most vulnerable are protected",308,2020-03-11 15:12:21,Twitter Web App,1058,145,NYGovCuomo,1237758267029434369,,232268199,False,https://t.co/Q4UEizGZKB,en,March,Q1
"Coronavirus is NO excuse for racism.

This assault is disgusting &amp; I am directing the State Police Hate Crimes Task Force to assist in the investigation to make sure the assailant is held accountable.

NY stands with the Asian community. #NoHateInOurState",283,2020-03-11 13:10:29,Twitter Web App,1664,449,NYGovCuomo,1237727596730880004,,232268199,False,https://t.co/wJb2dj5MOS,en,March,Q1
"These new emergency measures come at the recommendation of Health Commissioner Dr. Zucker.

The State will work with impacted schools to ensure any child who currently depends on food assistance programs will continue to receive those benefits during this 2-week period.",270,2020-03-10 18:30:55,Twitter Web App,393,70,NYGovCuomo,1237445849841643520,232268199.0,232268199,False,,en,March,Q1
"Large gathering places &amp; schools in this area will be closed for 2 wks, starting Thursday until March 25.

NY is partnering with Northwell Health to open a satellite testing facility there.

We will deploy the National Guard to deliver food to homes &amp; help clean public spaces.",285,2020-03-10 18:30:55,Twitter Web App,460,145,NYGovCuomo,1237445848969117698,232268199.0,232268199,False,,en,March,Q1
"We are implementing new emergency measures in New Rochelle, which has the biggest cluster of #Coronavirus cases in the state.
 
Starting on Thursday for 2 wks, there will be a containment zone with a 1 mile radius around the site of the most cases in New Rochelle.",288,2020-03-10 18:30:55,Twitter Web App,945,528,NYGovCuomo,1237445846993702912,,232268199,False,https://t.co/y4eZDK9zfU,en,March,Q1
"UPDATE: There are an additional 31 confirmed cases of #Coronavirus in NYS, bringing total to 173.

Westchester: 108
NYC: 36
Nassau: 19
Rockland: 6
Saratoga: 2
Suffolk: 1
Ulster: 1

We continue to expect more positive cases as we test.",234,2020-03-10 16:42:45,Twitter Web App,1613,936,NYGovCuomo,1237418628452102145,,232268199,False,,en,March,Q1
In Albany giving another update on #Coronavirus. WATCH:,79,2020-03-10 16:12:40,Periscope,258,143,NYGovCuomo,1237411054453284870,,232268199,False,https://t.co/IDybwlF7JR,en,March,Q1
"The need for #PaidSickLeave isn't new — but it's clearer than ever.

There were 8,459 cases of the flu in NYS last week. Many who had it likely went to work.

We need Paid Sick Leave now to protect workers and stop the spread of viruses like the flu and COVID-19.",287,2020-03-10 13:26:30,Twitter Web App,838,247,NYGovCuomo,1237369237544542210,,232268199,False,https://t.co/uK7lNrw8gd,en,March,Q1
"There are simple steps all New Yorkers can take to help prevent the spread of #Coronavirus and other viruses:

-Wash your hands frequently (for at least 20 seconds)
-Avoid handshaking
-Cover your cough or sneeze with a tissue (or your sleeve)
-Stay at home if you feel sick",297,2020-03-10 00:07:56,Twitter Media Studio,746,358,NYGovCuomo,1237168272056991744,,232268199,False,https://t.co/Gq0ogVwOBs,en,March,Q1
"El aumento injusto de precios es ILEGAL. 

NY tiene cero tolerancia para el aumento injusto de precios relacionado con #Coronavirus en productos como desinfectante para manos.

Para reportar sospechas de aumento injusto de precios, llame al 1-800-697-1220.",256,2020-03-09 20:15:59,Twitter Web App,106,46,NYGovCuomo,1237109901903695875,232268199.0,232268199,False,,en,March,Q1
"Currently, 8 of the 142 positive cases are hospitalized — or about 6%.

There are steps that all New Yorkers can take to prevent the spread of #Coronavirus.

-Wash your hands frequently (for 20 seconds)
-Stay at home if you feel sick
-Avoid handshaking
-Cover your cough/sneeze",277,2020-03-09 15:35:57,Twitter Web App,440,172,NYGovCuomo,1237039426959794177,232268199.0,232268199,False,,en,March,Q1
"UPDATE: There are additional confirmed cases of #Coronavirus in NYS, bringing total to 142.

Westchester: 98
NYC: 19
Nassau: 17
Rockland: 4
Saratoga: 2
Suffolk: 1
Ulster: 1

We continue to expect more positive cases as we test.",227,2020-03-09 15:21:08,Twitter Web App,1864,916,NYGovCuomo,1237035701369176065,,232268199,False,,en,March,Q1
"For all NY schools we are setting a new policy that if a student tests positive for #Coronavirus in a school, that school will be closed for a 24hr period so we can do assessment of the situation.

Then a determination will be made about whether to close the school for longer.",277,2020-03-09 15:19:51,Twitter Web App,1378,585,NYGovCuomo,1237035378244190210,,232268199,False,,en,March,Q1
"We’re hearing from local governments that acquiring hand sanitizer has been a real problem. 

NYS will immediately begin producing hand sanitizer ourselves — 100,000 gallons per week. We'll provide it to government agencies, schools, the MTA, prisons, &amp; others. #COVID19",274,2020-03-09 15:17:56,Twitter Web App,3708,958,NYGovCuomo,1237034894771064832,,232268199,False,,en,March,Q1
