Tweets,Length,Date,Source,Favourites,RTs,Username,id_str,in_reply_to_user_id,user_id,isRT,tco,Language,Month,Quarter
"The 5 finalists in our #WearAMaskNY Ad Contest will be announced at 11:30am.

We received hundreds of great submissions.

I encourage everyone to watch the videos, vote for your favorite, and of course, wear a mask.",215,2020-05-20 14:52:57,Twitter Web App,3266,370,NYGovCuomo,1263120534679814144,,232268199,False,,en,May,Q2
I will be giving my daily #Coronavirus briefing at 11:30AM. Watch here:,95,2020-05-20 14:07:48,Twitter Web App,1087,197,NYGovCuomo,1263109170351480832,,232268199,False,https://t.co/Fq5qEEPt23,en,May,Q2
"When a vaccine is found it must be available to all.

Not only to the rich or privileged.

The federal gov't must develop fair rules now to ensure any future vaccine is available to all.",186,2020-05-19 16:48:42,Twitter Web App,22741,3684,NYGovCuomo,1262787273348845568,,232268199,False,,en,May,Q2
"Taxpayers shouldn’t subsidize corporate layoffs. 

It's 2008 all over again.

I'm proposing that if a corporation gets gov't money, they MUST rehire the same # of employees they had pre-pandemic.",195,2020-05-19 16:19:35,Twitter Web App,6285,1063,NYGovCuomo,1262779947405447171,,232268199,False,,en,May,Q2
"Memorial Day is an important American tradition and we want to safely honor our veterans.

The state will allow ceremonies with 10 people or less, at the discretion of local governments.",186,2020-05-19 16:13:19,Twitter Web App,2522,314,NYGovCuomo,1262778369386483718,,232268199,False,,en,May,Q2
NEW: The Capital Region will be be able to enter Phase 1 of reopening tomorrow.,79,2020-05-19 16:10:03,Twitter Web App,4820,613,NYGovCuomo,1262777548708237314,,232268199,False,,en,May,Q2
"The least we can do is wear a mask.

It’s easy and shows respect.",65,2020-05-19 16:04:49,Twitter Web App,117649,18738,NYGovCuomo,1262776230786580480,,232268199,False,,en,May,Q2
Holding a briefing with updates on #Coronavirus. Watch Live:,84,2020-05-19 16:02:22,Periscope,1187,358,NYGovCuomo,1262775616668962816,,232268199,False,https://t.co/CodWzkrfFU,en,May,Q2
I will be giving my daily #Coronavirus briefing at 12:00PM. Watch here:,95,2020-05-19 14:42:08,Twitter Web App,1303,243,NYGovCuomo,1262755425457299456,,232268199,False,https://t.co/Fq5qEF73TB,en,May,Q2
"We are facing a mental health crisis right now. If you feel overwhelmed and anxious, you aren't alone.

For support, call 1-844-863-9314.

@Headspace is also offering free resources for educators, health care workers, and those who have lost their job — a great initiative.",273,2020-05-18 22:27:51,Twitter Web App,6845,1951,NYGovCuomo,1262510237791203328,,232268199,False,,en,May,Q2
"I urge anyone who has COVID symptoms to make an appointment and get tested.

Find a testing site near you:",130,2020-05-18 17:08:17,Twitter Web App,1756,412,NYGovCuomo,1262429814490882048,,232268199,False,https://t.co/j034v1VPW2,en,May,Q2
"New York State is ready and willing to partner with major sports teams that are interested in playing games safely, without fans.

If our professional sports teams can make it work (&amp; be safe) on their end, we’re supportive.",228,2020-05-18 16:15:45,Twitter Web App,14379,1632,NYGovCuomo,1262416594048778241,,232268199,False,,en,May,Q2
"The stakes are high, and expert, scientific opinion is far more valuable than political opinion.


I’m pleased to announce that Dr. Michael Osterholm and Dr. Samir Bhatt, two international experts in epidemiology, will be advising NY on our progress and our metrics.",266,2020-05-18 15:57:13,Twitter Web App,4187,516,NYGovCuomo,1262411931220152321,,232268199,False,,en,May,Q2
Update: Judges and staff will be returning to courthouses in 30 Upstate counties starting this week.,100,2020-05-18 15:51:34,Twitter Web App,2256,299,NYGovCuomo,1262410510571655168,,232268199,False,,en,May,Q2
"NEW: Western New York will begin Phase 1 of reopening tomorrow.

They will have all the contact tracers needed in place.",120,2020-05-18 15:44:47,Twitter Web App,7243,954,NYGovCuomo,1262408803930312712,,232268199,False,,en,May,Q2
"We must do all we can to protect the most vulnerable. 

NY has required all nursing home staff to be tested for COVID twice a week.

To make sure that happens we are sending 320K testing kits to nursing homes statewide.",219,2020-05-18 15:43:15,Twitter Web App,3011,408,NYGovCuomo,1262408416842133504,,232268199,False,,en,May,Q2
"New York responded to the COVID crisis with great unity and great discipline.

We need that same discipline as regions begin to reopen.",135,2020-05-18 15:38:42,Twitter Web App,7599,892,NYGovCuomo,1262407269469347841,,232268199,False,,en,May,Q2
Holding a briefing with updates on #Coronavirus. Watch Live:,84,2020-05-18 15:31:36,Periscope,1091,304,NYGovCuomo,1262405484578889728,,232268199,False,https://t.co/Mi7BTWNn0r,en,May,Q2
I will be giving my daily #Coronavirus briefing at 11:30AM. Watch here:,95,2020-05-18 14:07:46,Twitter Web App,1323,220,NYGovCuomo,1262384388957966336,,232268199,False,https://t.co/Fq5qEEPt23,en,May,Q2
As NY begins to reopen we can’t let our guard down. Gatherings are dangerous. Here’s why:,113,2020-05-18 13:12:52,Twitter Web App,14208,4756,NYGovCuomo,1262370570206883841,,232268199,False,https://t.co/zcLlyMUubB,en,May,Q2
"It’s quick, easy and painless. If I have time, you do too.",82,2020-05-17 17:14:07,Twitter Media Studio,35525,5346,NYGovCuomo,1262068895084498944,,232268199,False,https://t.co/0ANntppYVK,en,May,Q2
"Testing is fast and easy, and there are over 700+ sites in New York where you can get a COVID test.

Anyone with symptoms is eligible. So are essential workers.

Find a testing site near you:",215,2020-05-17 16:18:47,Twitter Web App,2125,596,NYGovCuomo,1262054970976874498,,232268199,False,https://t.co/j034v1VPW2,en,May,Q2
"We now have more testing capacity than New Yorkers are using.

We need to use our full testing capacity as we reopen.

If you have COVID symptoms or have been in contact with someone with COVID — get a test.",207,2020-05-17 16:16:37,Twitter Web App,14770,2440,NYGovCuomo,1262054426426122240,,232268199,False,,en,May,Q2
"New York has rapidly expanded our testing capacity.

We have met our earlier target of 40,000 diagnostic tests daily.

As a percentage of our population, NY has tested more than any other state.",194,2020-05-17 16:14:50,Twitter Web App,3076,344,NYGovCuomo,1262053977040003078,,232268199,False,,en,May,Q2
"Up to 38% of Americans are experiencing mental distress.

The Mental Health Coalition launched the #HowAreYouReally campaign to raise awareness about the mental health issues so many people are facing.

We all need to look out for one another.",243,2020-05-17 16:12:47,Twitter Web App,1709,295,NYGovCuomo,1262053462017277952,232268199.0,232268199,False,,en,May,Q2
"The COVID-19 crisis is a mental health crisis, and it deserves far more attention than it's gotten.

Don't underestimate the trauma this has created for people.

NYers can call 1-844-863-9314 for emotional support.",214,2020-05-17 16:09:56,Twitter Web App,9189,1859,NYGovCuomo,1262052743126102016,,232268199,False,,en,May,Q2
Holding a briefing with updates on #Coronavirus. Watch Live:,84,2020-05-17 16:00:47,Periscope,1344,372,NYGovCuomo,1262050439861686278,,232268199,False,https://t.co/qnm6d9fKpD,en,May,Q2
I will be giving my daily #Coronavirus briefing at 12:00PM. Watch here:,95,2020-05-17 14:42:15,Twitter Web App,1623,295,NYGovCuomo,1262030676607590408,,232268199,False,https://t.co/Fq5qEEPt23,en,May,Q2
"As regions of the state begin to reopen, each of us needs to be smart and protect ourself and others.

New Yorkers are in control of what happens. #NewYorkTough",160,2020-05-17 12:55:23,Twitter Web App,15100,1900,NYGovCuomo,1262003784806543362,,232268199,False,,en,May,Q2
"Congratulations to the Class of 2020 graduates of @SUNY. This week NY honors and celebrates you.

I know it's not the ceremony you planned for, but I want to commend all graduates for your academic achievement.

Congratulations on this success.",268,2020-05-16 18:21:23,Twitter Web App,5515,633,NYGovCuomo,1261723437115904000,,232268199,False,https://t.co/wEkSwhrGJ6,en,May,Q2
"When we openly talk about mental health, we can better address it. I’m proud to stand with @kennethcolereal and the Mental Health Coalition and join the #howareyoureallychallenge. I nominate @GovMurphy — share how you are, really.",254,2020-05-16 17:01:43,Twitter Media Studio,5136,1011,NYGovCuomo,1261703387172581376,,232268199,False,https://t.co/EPiMrsD8fu,en,May,Q2
"To those trying to make COVID funding into a Red vs. Blue issue.

To those counting how many people passed away by their political party.

To those more interested in helping states where Republicans live than where Democrats live.

Shame on you.",246,2020-05-16 16:06:39,Twitter Web App,42387,8624,NYGovCuomo,1261689531021037571,,232268199,False,,en,May,Q2
"The House passed a smart bill yesterday, the #HeroesAct, that funds states.

Remember: It's the states who fund hospitals, schools, firefighters, police and crucial services that working Americans rely on.

The Senate needs to act fast to pass it too.",251,2020-05-16 15:48:12,Twitter Web App,5100,968,NYGovCuomo,1261684885665853445,,232268199,False,,en,May,Q2
"NEW: We will allow elective surgeries to resume in Westchester County and Suffolk County, including at Ambulatory Surgery Centers.",130,2020-05-16 15:44:00,Twitter Web App,3685,377,NYGovCuomo,1261683827950391296,,232268199,False,,en,May,Q2
"As we phase reopening we are looking for all opportunities to reopen economic activity without crowds.
 
For example, horse racing tracks across the state can open June 1 without fans.",184,2020-05-16 15:41:19,Twitter Web App,3111,373,NYGovCuomo,1261683152633954308,,232268199,False,,en,May,Q2
Holding a briefing with updates on #Coronavirus. Watch Live:,84,2020-05-16 15:32:48,Periscope,1210,324,NYGovCuomo,1261681009310883841,,232268199,False,https://t.co/d7QLwehQ0C,en,May,Q2
I will be giving my daily #Coronavirus briefing at 11:30AM. Watch here:,95,2020-05-16 14:59:35,Twitter Web App,1137,215,NYGovCuomo,1261672650306392064,,232268199,False,https://t.co/Fq5qEEPt23,en,May,Q2
Once again I remind New Yorkers:,56,2020-05-16 13:11:46,Twitter Web App,54957,5654,NYGovCuomo,1261645520289828865,,232268199,False,https://t.co/emY6paBwEX,en,May,Q2
"As part of Phase One of reopening, residential and commercial construction can resume in the regions that have met the benchmarks.

-Indoor &amp; outdoor work allowed
-Masks must be worn within 6 feet of another worker
-Employer must provide masks
-No congregate meetings",271,2020-05-15 16:22:20,Twitter Web App,2692,435,NYGovCuomo,1261331089316077569,,232268199,False,,en,May,Q2
"If you live in a region that's in Phase 1 of reopening, retail businesses can open for curbside pickup or in-store pickup (if curbside not practical).

-Customers must order ahead
-Social distancing required in store
-Patrons &amp; staff must wear masks in store
-Sanitizer available",283,2020-05-15 16:16:30,Twitter Web App,2478,431,NYGovCuomo,1261329620185436162,,232268199,False,,en,May,Q2
"What happens next is up to each of us.

This virus is powerful and every time we think we understand it we learn we don’t.

Government alone can’t keep you safe.

It’s up to you.",178,2020-05-15 16:03:33,Twitter Web App,9854,2062,NYGovCuomo,1261326360313724930,,232268199,False,,en,May,Q2
"City, town and county beaches may open as well on Friday of Memorial Day weekend, as long as they fully enforce the minimum rules.

They may impose additional conditions.

If local government's don't enforce these rules, the beaches will be closed.",248,2020-05-15 15:59:15,Twitter Web App,1656,285,NYGovCuomo,1261325280150462468,232268199.0,232268199,False,,en,May,Q2
"As a region we have established a joint agreement on beaches in NY, NJ, CT and DE.

State beaches will open Friday of Memorial Day weekend with strict precautions.

Beaches will be at 50% capacity &amp; masks will be required when social distance not possible. Staff will enforce.",280,2020-05-15 15:52:16,Twitter Web App,6437,1198,NYGovCuomo,1261323519671128065,,232268199,False,,en,May,Q2
"NY on PAUSE is extended to May 28 for regions that don't begin reopening today.

But as soon as a region hits its benchmark, it comes online immediately — it does not have to wait until May 28.",193,2020-05-15 15:41:28,Twitter Web App,13036,2433,NYGovCuomo,1261320803045556226,,232268199,False,,en,May,Q2
Holding a briefing with updates on #Coronavirus. Watch Live:,84,2020-05-15 15:35:11,Periscope,1055,335,NYGovCuomo,1261319223239819265,,232268199,False,https://t.co/OaZnb7lfCO,en,May,Q2
I will be giving my daily #Coronavirus briefing at 11:30AM. Watch here:,95,2020-05-15 15:10:59,Twitter Web App,1079,186,NYGovCuomo,1261313133156556801,,232268199,False,https://t.co/Fq5qEF73TB,en,May,Q2
"This pandemic is also a mental heath crisis.

NY wants you to know: You are not alone. 

If you need support, call the New York State Emotional Support Hotline at 1-844-863-9314.",178,2020-05-15 13:41:05,Twitter Web App,15903,3619,NYGovCuomo,1261290508401467392,,232268199,False,,en,May,Q2
"The Finger Lakes, Southern Tier, Mohawk Valley, the North Country, and Central NY are ready to begin Phase 1 of reopening tomorrow.

The others can be UN-PAUSED the moment they hit their benchmarks.

New Yorkers be proud. Your actions bent the curve.",274,2020-05-15 00:46:41,Twitter Web App,7397,1089,NYGovCuomo,1261095623287361536,,232268199,False,https://t.co/zSJ5YpyTGY,en,May,Q2
"This is not just about what government does.

It’s also about what New Yorkers do.

If you wear a mask in public, if you wash your hands often, if you avoid large gatherings — you will be safer.",194,2020-05-14 18:37:00,Twitter Web App,7856,1089,NYGovCuomo,1261002590894071809,,232268199,False,,en,May,Q2
"Like New York State, 16 other states and 6 European countries have reported cases of children suffering from potentially COVID-related illnesses.

NY is leading the way on research.

We need to understand all we can as fast as we can when it comes to our children.",264,2020-05-14 18:27:59,Twitter Web App,3720,780,NYGovCuomo,1261000321783992326,,232268199,False,,en,May,Q2
"New York State is working to build a strong medical manufacturing supply chain in our own state.

We never again want to be in a position where we need  to rely on foreign imports to get critical supplies like N95 masks.

It’s a national security issue.",253,2020-05-14 18:25:36,Twitter Web App,8493,1252,NYGovCuomo,1260999722476732416,,232268199,False,,en,May,Q2
"NEW: Central New York has now met all seven metrics to begin Phase 1 of reopening on May 15th.

It joins Mohawk Valley, Southern Tier, Finger Lakes, and the North Country.",171,2020-05-14 18:15:44,Twitter Web App,10513,1119,NYGovCuomo,1260997239020965889,,232268199,False,,en,May,Q2
"Follow the data.
Follow the science.
Follow the metrics.

That’s how New York reopens.",86,2020-05-14 18:07:54,Twitter Web App,35027,4352,NYGovCuomo,1260995266917871618,,232268199,False,,en,May,Q2
Holding a briefing with updates on #Coronavirus. Watch Live:,84,2020-05-14 18:02:20,Periscope,1240,350,NYGovCuomo,1260993868327088129,,232268199,False,https://t.co/b31FR7AeAQ,en,May,Q2
I will be giving my daily #Coronavirus briefing at 2:00PM. Watch here:,94,2020-05-14 16:44:00,Twitter Web App,1709,311,NYGovCuomo,1260974152971948032,,232268199,False,https://t.co/Fq5qEEPt23,en,May,Q2
"It takes a team to fight this virus.

This crisis bore down on New York with a force unlike anything we've ever seen. Our response requires an equal and opposite force.

Meet @melissadderosa",214,2020-05-14 12:50:47,Twitter Web App,5547,616,NYGovCuomo,1260915461367173121,,232268199,False,https://t.co/C8fmn5X9M9,en,May,Q2
"Reminder: Doctors' offices are essential businesses and continue to be open to patients across NYS.

Check with your doctor for hours and protocols.",148,2020-05-13 23:49:13,Twitter Web App,8037,744,NYGovCuomo,1260718773578981382,,232268199,False,,en,May,Q2
"47 New York counties can now resume elective surgeries.

Ambulatory Surgical Centers in those counties can also now resume elective surgeries.

See the list of counties here:",198,2020-05-13 20:30:07,Twitter Web App,1913,255,NYGovCuomo,1260668668108771335,,232268199,False,https://t.co/Dlqoq8gjMW,en,May,Q2
"As of today, the North Country has met all seven metrics required to begin reopening May 15th.

It joins the Finger Lakes, Southern Tier, and Mohawk Valley regions that have also met the requirements to begin reopening.

See where your region stands:",274,2020-05-13 18:04:18,Twitter Web App,3086,535,NYGovCuomo,1260631974978387968,,232268199,False,https://t.co/AFYOelFDDS,en,May,Q2
"If a corporation gets a check from the government, they must rehire the same number of workers after the pandemic as employed before.

Taxpayers shouldn’t subsidize companies that lay off workers.",196,2020-05-13 16:06:17,Twitter Web App,13293,2206,NYGovCuomo,1260602272549142528,,232268199,False,,en,May,Q2
"While we believe this illness to be rare, seek care is your child has these symptoms — especially if your child has been exposed to someone who had COVID-19.",181,2020-05-13 15:59:36,Twitter Web App,1206,598,NYGovCuomo,1260600590251556864,232268199.0,232268199,False,https://t.co/KlNwIGrw1G,en,May,Q2
"NYS is investigating 102 cases of a potentially COVID-related inflammatory illness in children. 

Tragically, 3 young NYers lost their lives to this illness.

Though rare, we have cases in children of all ages.

14 other states and 5 European countries have also reported cases.",278,2020-05-13 15:57:52,Twitter Web App,2624,900,NYGovCuomo,1260600156765986817,,232268199,False,,en,May,Q2
"Our decisions are based on science. Watch the measures. Watch the numbers. 

But the rate of transmission is based on the actions of all of us.

You tell me what New Yorkers do today, and I'll tell you what the transmission rate will be tomorrow.",246,2020-05-13 15:47:51,Twitter Web App,5364,830,NYGovCuomo,1260597633846050818,,232268199,False,,en,May,Q2
"Our reopening process is totally transparent and based on data.

You can see for yourself exactly what is happening in your region on a daily basis.

Visit the Regional Monitoring Dashboard:",214,2020-05-13 15:43:51,Twitter Web App,1537,401,NYGovCuomo,1260596626449747974,,232268199,False,https://t.co/AFYOelFDDS,en,May,Q2
"We lost 166 New Yorkers yesterday to COVID-19.

It’s not just a number. These are people whose families are in immense pain today. We share in their heartbreak.",160,2020-05-13 15:39:11,Twitter Web App,20772,2691,NYGovCuomo,1260595453319667717,,232268199,False,,en,May,Q2
Closed captioning and ASL interpretation is available at,80,2020-05-13 15:33:14,Twitter Web App,221,38,NYGovCuomo,1260593955105841152,232268199.0,232268199,False,https://t.co/YjzHnxHPvN,en,May,Q2
Holding a briefing with updates on #Coronavirus. Watch Live:,84,2020-05-13 15:32:49,Periscope,1022,330,NYGovCuomo,1260593849308557312,,232268199,False,https://t.co/3IYFzMUBds,en,May,Q2
I will be giving my daily #Coronavirus briefing at 11:30AM ET. Watch here:,98,2020-05-13 13:36:35,Twitter Web App,1143,226,NYGovCuomo,1260564599964930053,,232268199,False,https://t.co/Fq5qEEPt23,en,May,Q2
Washington’s bailout rule should be simple and clear: No government support if you don’t hire back all of your pre-pandemic workers.,156,2020-05-13 13:29:14,Twitter Web App,3327,580,NYGovCuomo,1260562748729167875,,232268199,False,https://t.co/3Y4ygYxLVf,en,May,Q2
"Price gouging on products that protect people from Coronavirus is dishonest.

It’s also illegal.

New York State has referred over 2,000 gouging complaints to law enforcement.

To report suspected price gouging, call 800-697-1220.",230,2020-05-13 13:09:40,Twitter Web App,8475,1836,NYGovCuomo,1260557827753619457,,232268199,False,,en,May,Q2
"An LC-130 ""Skibird"" from the New York Air National Guard flew over Albany today to salute first responders and essential workers fighting on the frontlines against this virus.",199,2020-05-12 22:33:24,Twitter Web App,1848,174,NYGovCuomo,1260337304591351813,,232268199,False,https://t.co/PkTj1XXKTj,en,May,Q2
Show respect. Wear a mask.,50,2020-05-12 21:04:00,Twitter Media Studio,25874,6817,NYGovCuomo,1260314810442485761,,232268199,False,https://t.co/YZQy99J1DU,en,May,Q2
"When you wear a mask you are saying I respect my neighbors. 

When you wear a mask you are saying I respect nurses and doctors.

When you wear a mask you are saying I respect other people.",188,2020-05-12 18:20:06,Twitter Web App,131146,32059,NYGovCuomo,1260273563275231234,,232268199,False,,en,May,Q2
"I'm proposing the Americans First Law: If a corporation does not rehire the same number of employees, they must return any COVID funds received.",144,2020-05-12 18:08:13,Twitter Web App,88736,14735,NYGovCuomo,1260270569624346624,,232268199,False,,en,May,Q2
"The federal government bailed out big corporations and gave millionaires a tax cut in the first COVID bills.

It’s time for them to fund:

-State and local governments 
-Testing and tracing programs
-A real economic stimulus that helps working Americans",253,2020-05-12 17:57:59,Twitter Web App,8243,1830,NYGovCuomo,1260267997584818179,,232268199,False,,en,May,Q2
"When we begin to reopen we will do so on a regional basis and in a controlled, safe way.

All information by region is clear and available to the public.

We want all New Yorkers to have the facts.",221,2020-05-12 17:50:12,Twitter Web App,1822,394,NYGovCuomo,1260266036315795464,,232268199,False,https://t.co/AFYOelFDDS,en,May,Q2
"New York State is now investigating about 100 cases of an inflammatory illness in children that may be related to COVID-19.

The ages of these cases range from infancy to age 21.

We ask parents to watch out for these symptoms:",251,2020-05-12 17:47:25,Twitter Web App,4695,2943,NYGovCuomo,1260265336638668802,,232268199,False,https://t.co/lhzjproZYd,en,May,Q2
Closed captioning and ASL interpretation is available at,80,2020-05-12 17:37:09,Twitter Web App,219,38,NYGovCuomo,1260262753324933120,232268199.0,232268199,False,https://t.co/YjzHnxHPvN,en,May,Q2
Holding a briefing with updates on #Coronavirus. Watch Live:,84,2020-05-12 17:36:05,Periscope,1330,371,NYGovCuomo,1260262484285386753,,232268199,False,https://t.co/16rlfIxgZp,en,May,Q2
I will be giving my daily #Coronavirus briefing at 1:00PM ET. Watch here:,97,2020-05-12 15:59:01,Twitter Web App,1634,275,NYGovCuomo,1260238057258676224,,232268199,False,https://t.co/Fq5qEF73TB,en,May,Q2
"Wear a mask — it’s the right thing to do. 

Help us tell New Yorkers why. Submit a video by FRIDAY, May 15th.

Learn more:",146,2020-05-12 15:53:51,Twitter Web App,3109,487,NYGovCuomo,1260236758513483782,,232268199,False,https://t.co/Er0c63oxyj,en,May,Q2
"Our plan to safely reopen New York in phases will be guided by science and data.
 
Read the full NY Forward plan here:",142,2020-05-11 20:21:19,Twitter Web App,9409,1307,NYGovCuomo,1259941680817504258,,232268199,False,https://t.co/JEWlH0kyAa,en,May,Q2
"Three regions of New York are ready to begin reopening May 15th.

Finger Lakes, Southern Tier, and Mohawk Valley have met the 7 metrics required to begin Phase 1 of the reopening plan.

Here's where all the regions of NY currently stand:",261,2020-05-11 18:34:53,Twitter Web App,8791,2368,NYGovCuomo,1259914895442788352,,232268199,False,https://t.co/ShZL200kuO,en,May,Q2
"Jerry Stiller was as New York as they come. To my friend Ben who, like his father, is a New Yorker through and through I extend my deepest condolences. Jerry will be missed.",197,2020-05-11 18:19:59,Twitter Web App,12875,862,NYGovCuomo,1259911143507853317,,232268199,False,https://t.co/KXLi9eEk7c,en,May,Q2
"What New Yorkers have done, nobody could have imagined. The people accomplished a great feat in flattening the curve. 

We need New Yorkers to show that same resolve and intelligence in this next phase.",202,2020-05-11 16:24:48,Twitter Web App,17607,2180,NYGovCuomo,1259882156010209282,,232268199,False,,en,May,Q2
"New York will reopen statewide certain low-risk businesses and recreational activities as of May 15.

These include:

-Landscaping and gardening
-Outdoor, low-risk recreational activities like tennis
-Drive-in movie theaters",224,2020-05-11 16:03:51,Twitter Web App,29316,5106,NYGovCuomo,1259876885619716098,,232268199,False,,en,May,Q2
In each region there will be a Regional Control Room that will closely monitor progress and act as a circuit breaker ready to step in.,134,2020-05-11 15:55:49,Twitter Web App,1727,227,NYGovCuomo,1259874865726861313,232268199.0,232268199,False,,en,May,Q2
"Today we enter a new phase in the battle against COVID-19.

We have established criteria for reopening based on 7 metrics:",146,2020-05-11 15:52:10,Twitter Web App,5628,1308,NYGovCuomo,1259873946545119232,,232268199,False,https://t.co/Ar1QzxLUyl,en,May,Q2
Closed captioning and ASL interpretation is available at,80,2020-05-11 15:35:26,Twitter Web App,258,45,NYGovCuomo,1259869735291891716,232268199.0,232268199,False,https://t.co/YjzHnxHPvN,en,May,Q2
Holding a briefing with updates on #Coronavirus. Watch Live:,84,2020-05-11 15:35:08,Periscope,1365,395,NYGovCuomo,1259869657072164865,,232268199,False,https://t.co/dr8SP4VbL3,en,May,Q2
I will be giving my daily #Coronavirus briefing at 11:30AM ET. Watch here:,98,2020-05-11 14:04:10,Twitter Web App,1652,249,NYGovCuomo,1259846764443709441,,232268199,False,https://t.co/Fq5qEEPt23,en,May,Q2
"Corporations that lay off workers because of COVID shouldn't be getting government money for COVID.

If they don't rehire the workers they laid off, they should have to return the money.",186,2020-05-10 18:45:53,Twitter Web App,40438,7706,NYGovCuomo,1259555274421133319,,232268199,False,,en,May,Q2
