Tweets,Length,Date,Source,Favourites,RTs,Username,id_str,in_reply_to_user_id,user_id,isRT,tco,Language,Month,Quarter
"@mikebendixen @MooreintheAM Mike, I believe you can be better than this. You can choose to be kind. And you’re in a position of influence to ensure that Newstalk 1010 shares factual information with the public to help save lives and mitigate anxiety. I do wish you and your family well.",286,2020-03-15 0:21,Twitter for iPhone,2,0,joshmatlow,1.24E+18,240823627,15844405,FALSE,,en,March,Q1
This took place in the Rose Garden just coming out of a cold Winter!,68,2020-03-15 14:49,Twitter for iPhone,46705,11064,realDonaldTrump,1.24E+18,,,FALSE,https://t.co/bjHEC9zZkC,en,March,Q1
We are working with restaurant owners and food delivery services across the state to ensure restaurants can safely keep their kitchens open to continue food delivery to people in their homes.,191,2020-03-15 21:00,Twitter for iPhone,1084,96,GovPritzker,1.24E+18,1.08E+18,1.08E+18,FALSE,,en,March,Q1
"The resiliency and spirit of Granite Staters is unmatched. When we work together as a community, we do it really, really well. Grateful to hear of this community response out of Keene as the State begins mobilizing resources for students in need.",270,2020-03-16 14:55,Twitter Web App,52,24,GovChrisSununu,1.24E+18,,8.16E+17,FALSE,https://t.co/gutLG1sTB8,en,March,Q1
I will hold a press conference today from the State Emergency Operations Center (SEOC) to provide an update to the state of Iowa on COVID-19. Read more here:,181,2020-03-16 16:50,Twitter Web App,102,40,IAGovernor,1.24E+18,,8.52E+17,FALSE,https://t.co/yLBwoBlJ93,en,March,Q1
"I know that all of this information, and the changes to our daily routines and schedules, is a lot to absorb and adapt to. But, as a city we are prepared, and we will get through this together.",193,2020-03-16 20:21,Twitter Web App,7,1,joe_cressy,1.24E+18,416025003,416025003,FALSE,,en,March,Q1
"It takes all of us to stop the spread of #COVID19 and save lives.

Thank you for taking this seriously, keeping informed, and staying home at this time. Together we will slow the spread of this virus and #FlattenTheCurve.",245,2020-03-17 16:30,TweetDeck,532,186,GovernorTomWolf,1.24E+18,,2978837542,FALSE,https://t.co/QI0wAhAHzU,en,March,Q1
📺Our briefing will stream live online beginning at 4:30pm via @CTNetworkTV at this link:,112,2020-03-17 19:42,Twitter Web App,60,14,govnedlamont,1.24E+18,1.08E+18,1.08E+18,FALSE,https://t.co/3QmgKXyVaO,en,March,Q1
"1/ @menomale_dc

Authentic Neapolitan pizzeria baking pizzas, calzones, and more in their wood brick oven.",130,2020-03-17 21:38,Twitter Web App,63,12,MayorBowser,1.24E+18,976542720,976542720,FALSE,https://t.co/ogldcACMfE,en,March,Q1
"10/ City Lights of China ()

Offering a broad selection of delicious modern and traditional Chinese and Chinese-American dishes, each prepared to customers' personal taste.",219,2020-03-17 21:38,Twitter Web App,53,15,MayorBowser,1.24E+18,976542720,976542720,FALSE,https://t.co/FjXoUi5S7q,en,March,Q1
"Trump and his allies are stoking anti-Chinese bigotry in response to the coronavirus pandemic.

We cannot tolerate this kind of racism—especially at this moment.

This crisis requires our political leadership to unite our country, not divide us up.",272,2020-03-17 22:48,TweetDeck,9024,1974,SenSanders,1.24E+18,,29442313,FALSE,https://t.co/rgpx1epVLf,en,March,Q1
"With more and more Wisconsinites working and learning from home, @PSCWisconsin launched a page with information about internet service providers offering special services or discounts for those with internet access needs. See below ⬇️",258,2020-03-18 18:04,Twitter Web App,88,50,GovEvers,1.24E+18,,234896532,FALSE,https://t.co/nXFFLYiHfX,en,March,Q1
"Our #MutualAid training is kicking off NOW and we’ll be using the hashtag #WeGotOurBlock to live tweet!

There IS a call cap and we are RSVP’d to be overbooked, so hop on ASAP to get on the call.

If you can’t make it, we’ll be sending you a recording along with our resource kit.",304,2020-03-18 23:01,Twitter for iPhone,3191,688,aoc,1.24E+18,,138203134,FALSE,https://t.co/05x4HNdARV,en,March,Q1
Social distancing is a critical part of the way we will slow the spread of COVID-19 together. But what exactly is social distancing? Learn more here:,173,2020-03-19 14:28,Twitter Web App,1,0,joe_cressy,1.24E+18,416025003,416025003,FALSE,https://t.co/1FIpEFwt1t,en,March,Q1
"Today marks the beginning of Nowruz, the Persian New Year! Although we cannot gather and celebrate like we have done in the past, I want to wish all those celebrating a very happy, healthy and safe #Nowruz. Noroozetan Pirooz!",249,2020-03-19 14:53,Twitter for iPhone,157,37,fordnation,1.24E+18,,2809959174,FALSE,https://t.co/3c5epn49LV,en,March,Q1
LIVE: Providing an update on coronavirus (COVID-19) in the District. For a stream with captions visit . To learn more visit .,195,2020-03-19 20:11,Periscope,50,75,MayorBowser,1.24E+18,,976542720,FALSE,https://t.co/44CwI7bWqr,en,March,Q1
"We received approval from @SBAgov today allowing small businesses and nonprofits impacted by the #COVID19 outbreak to apply for low-interest federal disaster loans of up to $2 million.

Submit an application here💻:",238,2020-03-19 23:20,Twitter Web App,44,20,GovernorVA,1.24E+18,104198706,104198706,FALSE,https://t.co/898dXk7UFv,en,March,Q1
"Prior to identification of the first confirmed case of COVID-19 in Toronto’s shelter system, Shelter, Support and Housing Administration (SSHA) implemented protections for individuals experiencing homelessness, and they continue to scale up further.",249,2020-03-20 18:03,Twitter Web App,1,0,joe_cressy,1.24E+18,416025003,416025003,FALSE,,en,March,Q1
"We here in Illinois have overcome obstacles before.

We will do so again. 

We will rise to the occasion.",105,2020-03-20 22:05,Twitter for iPhone,785,95,GovPritzker,1.24E+18,1.08E+18,1.08E+18,FALSE,,en,March,Q1
"Three-word sentences can make all the difference: 'I miss you.' 'I love you.'

I know many New Yorkers are anxious and worried. But we're all in this together. Let's support each other.",209,2020-03-20 23:37,Twitter Media Studio,20548,4801,NYGovCuomo,1.24E+18,,232268199,FALSE,https://t.co/8KUqaEoqWC,en,March,Q1
"2/9 From the beginning, I have emphasized that the challenge we are facing represents two threats: disease and economic harm.  I have been very clear that both are important.  I believe firmly we must do the right thing, do it right away, and do it the right way.",263,2020-03-21 19:06,Twitter Web App,32,0,GovernorGordon,1.24E+18,1.08E+18,1.08E+18,FALSE,,en,March,Q1
"We're on the verge of 10,000 cases of COVID-19 in New York City. We've had 63 deaths. We represent 1/3 of the cases in the US and 2/3 of the cases in New York State. This crisis is affecting our entire nation and New York City is its epicenter.",244,2020-03-22 22:53,Twitter for iPhone,1859,677,NYCMayor,1.24E+18,,19834403,FALSE,,en,March,Q1
LIVE: #FITDC seniors. Get ready to move as we bring you workouts that you can do from home!,115,2020-03-23 12:59,Periscope,84,35,MayorBowser,1.24E+18,,976542720,FALSE,https://t.co/5vXvANshLb,en,March,Q1
"If you’re young and healthy, don’t just stay home for your own sake. Do it to protect your parents, grandparents and loved ones who would be at serious risk if they caught COVID-19.

Stay home.
Practice social distancing. 
Flatten the curve. 
Save lives.",278,2020-03-23 13:17,Twitter Media Studio,697,188,NYCMayor,1.24E+18,,19834403,FALSE,https://t.co/JoPwO3il1c,en,March,Q1
"Tonight, I will deliver a direct address to Washingtonians about our COVID-19 response.

Watch live here at 5:30 PM:",140,2020-03-23 18:53,Twitter Web App,4521,1546,GovInslee,1.24E+18,,1077214808,FALSE,https://t.co/7zPFeWhCKt,en,March,Q1
"@AgnesSalek @JohnTory I believe takeout and delivery is still allowed. If you email me at councillor_matlow@toronto.ca, I’ll confirm the province’s decision.",157,2020-03-23 19:54,Twitter for iPhone,1,0,joshmatlow,1.24E+18,384504070,15844405,FALSE,,en,March,Q1
"One way or another, we need these supplies — and I have a whole team of people whose singular focus right now is working the phones across the world to get as much PPE as possible shipped to Illinois.",200,2020-03-23 22:56,Twitter for iPhone,1931,259,GovPritzker,1.24E+18,1.08E+18,1.08E+18,FALSE,,en,March,Q1
"Effective immediately, all Washingtonians must stay home unless they are pursuing an essential activity. 

Those include:
➡️ Grocery shopping
➡️ Doctor appointments
➡️ Essential work duty",187,2020-03-24 0:34,Twitter Web App,5116,2143,GovInslee,1.24E+18,1077214808,1077214808,FALSE,,en,March,Q1
"Alec Baldwin isn't joking. Stay home. Save lives.

#NewYorkStateStrongerTogether #NewYorkTough @alecbaldwin",131,2020-03-24 12:04,Twitter Media Studio,4303,860,NYGovCuomo,1.24E+18,,232268199,FALSE,https://t.co/R4cQtSLJ5j,en,March,Q1
Will be doing a Town Hall on @FoxNews at 12:05 P.M. (Now). I will go on around 1:00 P.M. Enjoy!,95,2020-03-24 16:04,Twitter for iPhone,77484,14516,realDonaldTrump,1.24E+18,,,FALSE,,en,March,Q1
The deadline to file Arizona income tax returns has been extended to July 15. More information:  #COVID19,152,2020-03-24 17:41,Twitter Web App,53,25,dougducey,1.24E+18,,20217019,FALSE,https://t.co/ilZsAdOyAo,en,March,Q1
"The developments of this Senate relief bill are concerning.

We are hearing lots of vague statements, but not a single member of Congress has seen actual bill text.

It seems to give a *HALF TRILLION DOLLARS* away to big corporations, w/ few worker protections.

Half a trillion.",279,2020-03-24 17:42,Twitter for iPhone,62495,13428,aoc,1.24E+18,,138203134,FALSE,,en,March,Q1
"Stay at home, if you can. Don’t hang out in big groups. Stay six feet part from others, when you can. Don’t go to the grocery store every single day, plan ahead to limit your contact with others.",195,2020-03-24 22:21,Twitter Web App,56,10,GovernorBullock,1.24E+18,111721601,111721601,FALSE,,en,March,Q1
We’re making important decisions about our City jails. No one over 70 or with pre-existing conditions should be in our jail system right now and we are working to make that a reality.,183,2020-03-25 1:01,Twitter for iPhone,338,67,NYCMayor,1.24E+18,19834403,19834403,FALSE,,en,March,Q1
"While our focus must be on saving lives, we should do everything possible to save people’s livelihoods too.",131,2020-03-25 1:07,Twitter for iPhone,191,24,joshmatlow,1.24E+18,,15844405,FALSE,https://t.co/rnE6MzP407,en,March,Q1
"At my direction, @NYSDPS is ordering utilities to suspend rate increases.

Utility rate increases that were to go into effect April 1st have been postponed.

This will provide relief to families and businesses affected by #COVID19.",231,2020-03-25 18:34,Twitter Web App,6639,952,NYGovCuomo,1.24E+18,,232268199,FALSE,,en,March,Q1
,23,2020-03-25 21:02,Twitter Media Studio,162,42,fordnation,1.24E+18,,2809959174,FALSE,https://t.co/RodxrRPK0B,en,March,Q1
"We’ve been working around the clock to make sure you have what you need to stay safe and healthy. Earlier today, we passed legislation to bring in urgent economic measures - and that legislation has now received Royal Assent. Help is on the way. ➡️",272,2020-03-25 22:35,Twitter for iPhone,6149,883,JustinTrudeau,1.24E+18,,,FALSE,https://t.co/ccOMBmN5Dq,en,March,Q1
"Is this enough? On its own, of course not. But it is one piece of the broader puzzle. All levels of Government need to coordinate to ensure that the arts &amp; cultural community can withstand this significant downturn and come out of it stronger.",247,2020-03-26 14:35,Twitter for iPhone,11,4,joe_cressy,1.24E+18,416025003,416025003,FALSE,,en,March,Q1
Join me live shortly on @MeetThePress as I talk about the District's response to coronavirus (COVID-19).,129,2020-03-26 21:12,Twitter Web App,17,8,MayorBowser,1.24E+18,,976542720,FALSE,https://t.co/MEWs6uxEBa,en,March,Q1
Wash your hands. Stay safe and look out for the most vulnerable in our communities. God bless and stay safe.,108,2020-03-26 22:01,Twitter for iPhone,25,3,tatereeves,1.24E+18,259341329,259341329,FALSE,,en,March,Q1
"The @CTNationalGuard today deployed 2 climate-controlled tents on the grounds of the VA hospital in #WestHaven that will help with any potential patient overflow, should it be needed.

The Guard is in the process of deploying 2 similar tents to the #Newington VA hospital.",272,2020-03-26 22:02,Twitter Web App,144,29,govnedlamont,1.24E+18,,1.08E+18,FALSE,,en,March,Q1
Thank you Heidi from Jefferson City for the sweet note and scripture you sent me. Psalms 118:6 is a good reminder these days.,149,2020-03-26 22:17,Twitter Media Studio,337,23,GovParsonMO,1.24E+18,,1.00E+18,FALSE,https://t.co/bB9puH5J32,en,March,Q1
"In collaboration with our Children’s Cabinet, six Minnesota foundations today joined @ThinkSmallMN in launching a statewide child care program. I’m proud to support this effort, which provides invaluable education and services to our state’s emergency response.",285,2020-03-27 0:30,TweetDeck,278,50,GovTimWalz,1.24E+18,,1.06E+18,FALSE,https://t.co/NajElZECSc,en,March,Q1
"Today I am launching a new online resource, , to help those looking to lend a hand and encourage more Maine people to target their skills, resources, and time in the most effective and safe ways to do the most good for our state. 2/",255,2020-03-27 12:44,Twitter Web App,72,48,GovJanetMills,1.24E+18,1.08E+18,1.08E+18,FALSE,https://t.co/n9e7KBzeJx,en,March,Q1
News conference live from the @WhiteHouse today. 5:00 P.M. Eastern!,67,2020-03-27 19:38,Twitter for iPhone,22927,6238,realDonaldTrump,1.24E+18,,,FALSE,,en,March,Q1
"So far, we’ve released 375 detainees and by tonight that number will be at least 450. 

We want to protect people in our custody and also protect communities across the city.",174,2020-03-28 1:53,Twitter for iPhone,119,15,NYCMayor,1.24E+18,19834403,19834403,FALSE,,en,March,Q1
"Toronto, we need your help to stop the spread of #COVID19. #StayHome and practise #PhysicalDistancing to protect yourself and others.",181,2020-03-28 13:25,Twitter Web App,8,3,joe_cressy,1.24E+18,,416025003,FALSE,https://t.co/IQ7URijaAl,en,March,Q1
"Every emergency is unique.

Needs are always different. 

The only similarity is that what is needed is always unexpected.

In this case the unexpected need is ventilators.",172,2020-03-28 16:19,Twitter Web App,6250,774,NYGovCuomo,1.24E+18,,232268199,FALSE,,en,March,Q1
Thank You. #heroes,42,2020-03-28 20:12,Twitter for iPhone,1212,455,joe_cressy,1.24E+18,,416025003,FALSE,https://t.co/qmLyk21Cxk,en,March,Q1
"Today we grieve along with the families of Detective Cedric Dixon, City Custodian Dennis Dickson and Administrative Assistant Giacomina Barr-Brown. Our thoughts are also with the NYPD, who continue to keep us safe and protected during this crisis.",271,2020-03-28 21:43,Twitter Web App,448,89,NYCMayor,1.24E+18,,19834403,FALSE,https://t.co/oqoy2QRSKT,en,March,Q1
Do your part to stop the spread of #COVID19. Remember to practice #PhysicalDistancing in elevators and keep 2 metres away from others. There should not be more than three people in an elevator. Stay safe and protect others,270,2020-03-29 11:00,Hootsuite Inc.,4,3,joe_cressy,1.24E+18,,416025003,FALSE,https://t.co/wBOPZX9o7r,en,March,Q1
Portable toilets with handwashing stations will be provided for clients at each pick-up location. City staff will have appropriate personal protective equipment for safety.,172,2020-03-29 17:16,Twitter Web App,1,1,joe_cressy,1.24E+18,416025003,416025003,FALSE,,en,March,Q1
We are the only major country not to guarantee paid medical leave—that is beyond pathetic. We need to provide it for every worker in America.,165,2020-03-29 20:29,TweetDeck,10906,2610,SenSanders,1.24E+18,,29442313,FALSE,https://t.co/6IeSREcUY5,en,March,Q1
.@NVTreasurer Zach Connie also announced an agreement with the vast majority of lenders for a 90-day grace period on mortgage payments &amp; late fees. Lenders will work with borrowers to figure out a plan with no impact to credit. This is NOT automatic; you MUST talk to your lender.,284,2020-03-29 22:51,Twitter for iPhone,386,131,GovSisolak,1.24E+18,1.08E+18,1.08E+18,FALSE,,en,March,Q1
"On September 11th, 2001 former FDNY Commissioner Tom Von Essen helped lead our firefighters through our city’s darkest day. 

We’re lucky to have him where he is as our regional administrator for FEMA.",225,2020-03-30 17:58,Twitter for iPhone,31,2,NYCMayor,1.24E+18,19834403,19834403,FALSE,https://t.co/3DBXoiJ7Qi,en,March,Q1
"The toughest weeks of this crisis are, unfortunately, still ahead. We need our nation to stand by us. And when the battle is done here, we'll be the first to send aid to the rest of the nation. 

Wherever the need is greatest, New York City will be there for our fellow Americans.",280,2020-03-30 17:58,Twitter for iPhone,132,16,NYCMayor,1.24E+18,19834403,19834403,FALSE,,en,March,Q1
I’ll be joining @scottpasmoretv LIVE on @azfamily at 9 AM. #COVID19,67,2020-03-31 15:50,TweetDeck,22,5,dougducey,1.25E+18,,20217019,FALSE,,en,March,Q1
"These donors are yet another true testament to the greatest strength of Illinois, the greatest strength of the United States of America: our people. 

Their tenacity – their ability to, without seeking fanfare or fame, always rise to meet the challenge of their time.",267,2020-03-31 18:20,Twitter for iPhone,515,56,GovPritzker,1.25E+18,1.08E+18,1.08E+18,FALSE,,en,March,Q1
"Thanks to our partnership with @FEMA, 250 more ambulances and 500 more paramedics and EMTs are coming to our city. 139 of those ambulances and 270 of those personnel are already on the ground.",192,2020-03-31 21:15,Twitter for iPhone,34,5,NYCMayor,1.25E+18,19834403,19834403,FALSE,,en,March,Q1
"For music lovers everywhere, NXNE has postponed their dates to August 11-16. We'll beat COVID-19 and celebrate our success together.",156,2020-03-31 23:38,Hootsuite Inc.,3,0,joe_cressy,1.25E+18,416025003,416025003,FALSE,https://t.co/AMtuolHUR3,en,March,Q1
"Thanks to each and every one of you who is doing your part to save lives in this fight. 

I know it hasn’t been easy, but with your support, we will get through this and move forward together.",216,2020-04-01 20:02,Twitter Web App,539,126,GovernorTomWolf,1.25E+18,2978837542,2978837542,FALSE,https://t.co/fcXrJbl5X5,en,April,Q2
Join us at City Hall for the latest updates on New York City’s response to COVID-19.,108,2020-04-01 20:12,Periscope,173,93,NYCMayor,1.25E+18,,19834403,FALSE,https://t.co/b6J54SGA6W,en,April,Q2
"Today, I am also announcing that we're launching a short-term bridge loan program for restaurants and our smallest businesses:",150,2020-04-01 21:01,TweetDeck,37,15,GovRaimondo,1.25E+18,240778059,240778059,FALSE,https://t.co/llGQeWahRM,en,April,Q2
"This is as close to a lockdown as the city is legally able to implement. If we are to stem the tide, we must all act now.",146,2020-04-02 0:00,Twitter for iPhone,105,34,joe_cressy,1.25E+18,,416025003,FALSE,https://t.co/j7wnNjDuLt,en,April,Q2
"Just spoke with Dr. Fauci on a conference call about China's decision to reopen their wet markets. 

He emphatically stated this was a crazy decision by China which puts the world's health at risk.",197,2020-04-02 15:45,TweetDeck,19353,5298,LindseyGrahamSC,1.25E+18,,432895323,FALSE,,en,April,Q2
"Scammers are taking advantage of #COVID19. From unemployment scams, to fake testing, it's important we report these incidents to the @Kyoag's office. Call 1-888-432-9257 or report online",210,2020-04-02 15:47,TweetDeck,183,84,GovAndyBeshear,1.25E+18,,1.19E+18,FALSE,https://t.co/5jZKTR7rAV,en,April,Q2
"Thanks for the great question, Chris. You don't need any documentation for allowable travel, and law enforcement won’t be asking for it.",160,2020-04-02 17:51,Twitter VIT App for iOS,52,15,GovernorVA,1.25E+18,104198706,104198706,FALSE,https://t.co/7M8AbnQVwx,en,April,Q2
"Folks are working around the clock to respond &amp; adapt to COVID-19. Not just government, but our doctors, nurses, public health professionals, law enforcement, first responders, truck drivers, grocery store workers, &amp; Missourians on the frontlines. THANK YOU!",266,2020-04-02 23:35,Twitter for Advertisers,141,35,GovParsonMO,1.25E+18,,1.00E+18,FALSE,,en,April,Q2
"This virus will roll across the country like a slow moving hurricane.

No state can stand alone. We need to jointly rush in and help where the need is.

I believe our nation will come together because it’s the only way to save lives.",233,2020-04-03 1:22,Twitter Web App,61733,10390,NYGovCuomo,1.25E+18,,232268199,FALSE,,en,April,Q2
Good to chat with cultural media by tele-townhall to discuss the govt’s response to COVID-19. We also discussed the measures we are calling for to support all Canadians. Grateful to the journalists in community media who are keeping Canadians informed throughout this pandemic.,301,2020-04-03 14:58,TweetDeck,122,26,andrewscheer,1.25E+18,,256360738,FALSE,https://t.co/fKFEerzu4t,en,April,Q2
"TODAY: AZ small businesses facing hardship due to #COVID19 can apply for loans through the #PaycheckProtectionProgram. 

Employers who maintain their payroll through the program will be forgiven for up to 8 weeks of payroll. @azcommerce #AZTogether

MORE:",279,2020-04-03 17:35,TweetDeck,92,56,dougducey,1.25E+18,,20217019,FALSE,https://t.co/1NnQNyUdUM,en,April,Q2
"With more Canadians turning to food banks and community organizations to feed their families, and with fewer food donations coming in, these organizations need our help more than ever. So we’re investing $100 million to make sure they can keep helping people in these tough times.",280,2020-04-03 17:40,Twitter for iPhone,6480,1147,JustinTrudeau,1.25E+18,,,FALSE,,en,April,Q2
"We’re working with industry to produce the supplies our health care workers need - like masks, face shields, ventilators, and test kits. We reached an agreement with @AmazonCA to distribute these items to the provinces &amp; territories via @CanadaPostCorp &amp; other delivery partners.",287,2020-04-03 18:42,Twitter for iPhone,3604,656,JustinTrudeau,1.25E+18,,,FALSE,,en,April,Q2
"If your primary residence is on the Wasatch Front and you are traveling to Washington County to gather with extended family members for a recreational weekend, turn around and go home.",184,2020-04-03 20:05,Twitter Web App,524,103,GovHerbert,1.25E+18,60688326,60688326,FALSE,,en,April,Q2
"We may be small when it comes to population but we are giants in manufacturing. We have some of the best and brightest. As long as I’m Premier, we will no longer rely on others for these essential medical goods.",235,2020-04-03 21:26,Twitter for iPhone,12374,2125,fordnation,1.25E+18,,2809959174,FALSE,https://t.co/OZrus2pLA0,en,April,Q2
America owes our very hard working food supply workers so much as they produce and deliver high quality food for us during this horrible COVID-19. Join me in thanking our Farmers Ranchers Processors Distributors and Stores! @JohnBoozman,236,2020-04-04 19:10,Twitter for iPhone,152485,28405,realDonaldTrump,1.25E+18,,,FALSE,,en,April,Q2
"Every evening, midtowners drum their pots and pans, cheering on our heroic frontline healthcare workers. I really love our community.",133,2020-04-05 1:50,Twitter for iPhone,150,9,joshmatlow,1.25E+18,,15844405,FALSE,,en,April,Q2
A disease can’t cancel Easter. Jesus conquered death. Christians have celebrated the resurrection in even harder times than these:,130,2020-04-05 18:44,Twitter for iPhone,607,74,tatereeves,1.25E+18,,259341329,FALSE,,en,April,Q2
"Recently, I gave everyone an assignment. I asked you to start keeping a daily log of where you go &amp; who you’re physically in contact with. For most of you, this list should be short. For those of you who have to go to work outside of the house, the list will be longer.",273,2020-04-05 19:10,TweetDeck,30,12,GovRaimondo,1.25E+18,240778059,240778059,FALSE,,en,April,Q2
Thank you Gayle. I only wish the public could fully understand how corrupt &amp; dishonest so much of our Lamestream Media is. My Press Conferences are vital. They are reaching millions of people that are not being told the truth &amp; haven’t been for years (Witch-Hunts Fake News)!,285,2020-04-06 11:53,Twitter for iPhone,72240,19699,realDonaldTrump,1.25E+18,,,FALSE,https://t.co/DN4DDoHPtu,en,April,Q2
USA STRONG!,11,2020-04-06 11:54,Twitter for iPhone,362401,60794,realDonaldTrump,1.25E+18,,,FALSE,,en,April,Q2
LIVE: Providing an update on coronavirus (COVID-19) in the District. For a stream with captions visit . To learn more visit .,195,2020-04-06 14:41,Periscope,62,76,MayorBowser,1.25E+18,,976542720,FALSE,https://t.co/44CwI7bWqr,en,April,Q2
"When the going gets tough, Minnesotans support our neighbors. As Asian Americans report discrimination amid COVID-19, remember this: Viruses don't discriminate and neither should we. Law enforcement and our new helpline are here for support: 833-454-0148.",279,2020-04-06 17:14,TweetDeck,985,264,GovTimWalz,1.25E+18,,1.06E+18,FALSE,https://t.co/nDSU4S5hFb,en,April,Q2
Congratulations to State Representative Karen Whitsett of Michigan. So glad you are getting better!,99,2020-04-06 21:03,Twitter for iPhone,113182,31632,realDonaldTrump,1.25E+18,,,FALSE,https://t.co/v6z46rUDtg,en,April,Q2
"We continue to source and ship as much protective gear as we can from all over the world, bringing it to Illinois by whatever means necessary.",166,2020-04-06 21:48,Twitter for iPhone,537,83,GovPritzker,1.25E+18,1.08E+18,1.08E+18,FALSE,https://t.co/cqyC60J1pE,en,April,Q2
"I ask people to be patient as we work through a record number of new claims—more than 100,000 in just the last week.  

We are working to ensure every Virginian gets the benefits they have earned.

For information on how to file a claim, visit .",268,2020-04-06 22:45,Twitter Web App,139,39,GovernorVA,1.25E+18,104198706,104198706,FALSE,https://t.co/DbYHmyMbDh,en,April,Q2
