Tweets,Length,Date,Source,Favourites,RTs,Username,id_str,in_reply_to_user_id,user_id,isRT,tco,Language,Month,Quarter
"Four members of the Royal Canadian Air Force and two members of the Royal Canadian Navy were on board the helicopter that crashed off the coast of Greece yesterday. We can confirm the loss of one life, and search efforts for the other five missing members continue.",265,2020-04-30 21:36,Twitter for iPhone,2160,325,JustinTrudeau,1.26E+18,,,FALSE,,en,April,Q2
"We want to highlight housing assistance and resources for Missourians amid the COVID-19 crisis.

In addition to concerns about housing, we also continue to get questions regarding schools, both K-12 and higher education. 

Get answers➡️",284,2020-04-30 22:30,Twitter Web App,18,13,GovParsonMO,1.26E+18,,1.00E+18,FALSE,https://t.co/ljilZLMGc4,en,April,Q2
"Today marks the beginning of Asian Heritage Month, during which we will remember the historic journeys of Asian Canadians and recognize their numerous achievements. On behalf of Canada's Conservatives, I’d like to wish everyone celebrating a happy Asian Heritage Month!",293,2020-05-01 12:30,Twitter for iPhone,65,12,andrewscheer,1.26E+18,,256360738,FALSE,https://t.co/KIoSvkJHAO,en,May,Q2
"@AmyMcPhailClark Thank you, Amy. You can leave a message of support for care workers and residents in long-term care homes operated by the city and across Toronto-St. Paul's here:",203,2020-05-01 18:26,Twitter Web App,1,0,joshmatlow,1.26E+18,169169726,15844405,FALSE,https://t.co/5pAJZq4Z1D,en,May,Q2
"The state will move to reopen while continuing to monitor and respond to these four guiding principles:

➡️ The number of hospitalized #COVID19 patients statewide has decreased for 14 days

➡️ The state retains its surge capacity for critical care beds and ventilators",268,2020-05-01 20:05,Twitter Web App,14,5,GovHolcomb,1.26E+18,4919082864,4919082864,FALSE,,en,May,Q2
"The remaining manufacturers, industrial and other infrastructure operations that had not been considered essential may open. Hoosiers who can work from home are encouraged to continue to do so.",193,2020-05-01 20:05,Twitter Web App,11,2,GovHolcomb,1.26E+18,4919082864,4919082864,FALSE,,en,May,Q2
"These systems are being installed in @Blacksburg_Gov, @CityofNN, and @ChesterfieldVa, and will be operational within a week.

The Blacksburg unit is jointly operated by @VDEM and @WVDHSEM––it will be available to nearby states including Tennessee, Kentucky, and North Carolina.",277,2020-05-02 16:38,Twitter Web App,72,13,GovernorVA,1.26E+18,104198706,104198706,FALSE,,en,May,Q2
Keep punching Mike!,19,2020-05-03 12:54,Twitter for iPhone,115701,17379,realDonaldTrump,1.26E+18,,,FALSE,https://t.co/QwFcFQ8B5O,en,May,Q2
"Today Canada’s naval community is commemorating the Battle of the Atlantic. We pause to honour the brave sailors, aviators and mariners we lost at sea during the longest military engagement of WWII. Lest We Forget.",238,2020-05-04 0:21,TweetDeck,110,22,andrewscheer,1.26E+18,,256360738,FALSE,https://t.co/Z44yqOMCoj,en,May,Q2
"1/ The District’s reported data for Sunday, May 3, 2020 includes 154 new positive coronavirus (COVID-19) cases, bringing the District’s overall positive case total to 5,170.

Learn more:",234,2020-05-04 14:01,Twitter Web App,23,28,MayorBowser,1.26E+18,,976542720,FALSE,https://t.co/OptCmVK9ce,en,May,Q2
....because they don’t know how to win and their so-called Lincoln Project is a disgrace to Honest Abe. I don’t know what Kellyanne did to her deranged loser of a husband Moonface but it must have been really bad. John Weaver lost big for Kasich (to me). Crazed Rick Wilson....,281,2020-05-05 4:46,Twitter for iPhone,56868,12665,realDonaldTrump,1.26E+18,,,FALSE,,en,May,Q2
Happening now! Tune in on Facebook Live ⬇️,66,2020-05-06 16:18,Twitter Web App,23,12,GovEvers,1.26E+18,,234896532,FALSE,https://t.co/Bhv3GS8jvI,en,May,Q2
I’m holding a news conference at 1:30pm today to provide an update on our COVID-19 response. You can watch here:,136,2020-05-06 17:21,Twitter Web App,13,8,AsaHutchinson,1.26E+18,,269992801,FALSE,https://t.co/RHMfM109xC,en,May,Q2
LIVE: Governor Hutchinson provides COVID-19 update to media (05.06.20),94,2020-05-06 18:29,Twitter Web App,14,4,AsaHutchinson,1.26E+18,,269992801,FALSE,https://t.co/RHMfM109xC,en,May,Q2
Vandalizing cellphone towers does nothing but threaten emergency services and impact the daily lives of Canadians across the country. These recent acts are serious criminal offences and carry severe penalties.,209,2020-05-07 2:01,Twitter for iPhone,12492,1786,JustinTrudeau,1.26E+18,,,FALSE,,en,May,Q2
"We are making progress. 

Delawareans have helped flatten the curve by staying home, and by practicing social distancing when you’re out in public.",147,2020-05-07 16:07,Twitter Web App,25,1,johncarneyde,1.26E+18,237770636,237770636,FALSE,,en,May,Q2
"On behalf of this Administration and on behalf of all the people of Maine, I thank IDEXX for their ingenuity, generosity, and partnership. Acts like this demonstrate to us the heart of Maine’s extraordinary companies and the power of public-private collaboration. 4/",266,2020-05-07 16:21,Twitter for iPhone,114,16,GovJanetMills,1.26E+18,1.08E+18,1.08E+18,FALSE,,en,May,Q2
"We’re seeing consistent overcrowding in a few parks. It’s not acceptable and we’re taking action to save lives. We will be limiting the number of people in several parks, including Hudson River Park, Piers 45 and 46 and we’ll have extra enforcement at Domino Park.",264,2020-05-08 16:30,Twitter Web App,1002,148,NYCMayor,1.26E+18,,19834403,FALSE,,en,May,Q2
"As we move forward in reopening the province, we’ve developed a framework so that businesses have guidelines to best protect their staff and customers from #COVID19. We’re opening up as quickly as we can while ensuring the health and safety for Ontarians.",279,2020-05-08 18:05,Twitter for iPhone,341,58,fordnation,1.26E+18,,2809959174,FALSE,https://t.co/OOvmc5lauz,en,May,Q2
"#COVID19 testing will be available at @StateFarmStdm tomorrow and May 16!

Pre-register to get tested at the stadium or many other locations throughout Arizona:  @AZCardinals @DignityHealthAZ #AZTestingBlitz",254,2020-05-08 18:52,Twitter Web App,29,22,dougducey,1.26E+18,,20217019,FALSE,https://t.co/NAcR7kH7jz,en,May,Q2
More information may be found at the @StateHealthIN website at  and the @CDCgov website at .,138,2020-05-08 21:26,Twitter Web App,7,6,GovHolcomb,1.26E+18,4919082864,4919082864,FALSE,https://t.co/aEEjhDzBBD,en,May,Q2
Here are some ways to show your loved ones you care this Mother’s Day.,94,2020-05-08 22:06,Twitter for iPhone,101,20,GovSisolak,1.26E+18,,1.08E+18,FALSE,https://t.co/oykCAUjFH0,en,May,Q2
"We’ve come too far to squander our progress now. That’s why the City has guidelines for businesses to help prevent the spread of COVID-19 and encourage physical distancing, including managing lines, permitting online and phone orders, and scheduling pickup times for customers.",277,2020-05-09 13:05,Hootsuite Inc.,33,7,joe_cressy,1.26E+18,,416025003,FALSE,,en,May,Q2
I’m giving an update on how our government is responding to COVID-19. Tune in now for the latest on what we’re doing to support you as we deal with the impacts of the pandemic:,200,2020-05-09 15:16,Twitter for iPhone,868,142,JustinTrudeau,1.26E+18,,,FALSE,https://t.co/fTe3BJsouK,en,May,Q2
"This Mother’s Day, show your mom how much you care — from a safe physical distance.

Being apart is hard, but it’s the best way to demonstrate our love for one another right now. Keep your loved ones safe by keeping your distance.

#StayHomeSaveLives #AllTogetherNM",289,2020-05-09 19:10,Twitter Web App,113,21,GovMLG,1.26E+18,,1.07E+18,FALSE,https://t.co/STgDR7lZWs,en,May,Q2
"To all the moms in our lives — whether they’re mothers, stepmothers, grandmothers, godmothers, aunts or others — thank you for all you do. Happy Mother’s Day!",182,2020-05-10 20:05,Twitter for iPhone,236,16,GovSisolak,1.26E+18,,1.08E+18,FALSE,https://t.co/ZXL4FFP8sL,en,May,Q2
LIVE to showcase the conversion of the Walter E. Washington Convention Center into an alternate care site to support DC’s coronavirus (COVID-19) response.,178,2020-05-11 14:55,Periscope,68,67,MayorBowser,1.26E+18,,976542720,FALSE,https://t.co/Rsn0S4BWd9,en,May,Q2
"Our PPE Marketplace, a partnership between @MOHospitals, @MoEcoDevo, and @Google, connecting vendors with health care workers to help supply PPE from within the state, was recognized by the White House as a best practice around the country.",264,2020-05-12 20:02,Twitter Web App,16,4,GovParsonMO,1.26E+18,,1.00E+18,FALSE,https://t.co/EcFnSi5VDp,en,May,Q2
"As we ease back into more social interactions this week, please remember to take all health precautions. You’re encouraged to wear face coverings around people from other households, practice safe hygiene &amp; maintain 6-foot distancing. #TogetherAL @ALPublicHealth",290,2020-05-12 21:15,TweetDeck,144,68,GovernorKayIvey,1.26E+18,,19668491,FALSE,https://t.co/AT31jOUmbu,en,May,Q2
Fake @PulitzerPrizes must be taken back. These “journalists” got everything wrong. Give them to the real journalists who got it right!,138,2020-05-13 3:13,Twitter for iPhone,72883,23168,realDonaldTrump,1.26E+18,,,FALSE,https://t.co/at2oRBwdOS,en,May,Q2
"Testing has been a primary focus of this pandemic. We knew testing capacity would give people the confidence needed to get back to a more normal. 

My administration and I have worked hard to get Missouri's testing in a good position.",258,2020-05-13 20:03,Twitter Web App,20,6,GovParsonMO,1.26E+18,,1.00E+18,FALSE,https://t.co/AVaT8tFgEf,en,May,Q2
Review Missouri's expanded testing guidance put out by @HealthyLivingMo:,97,2020-05-13 20:26,Twitter Web App,3,3,GovParsonMO,1.26E+18,1.00E+18,1.00E+18,FALSE,https://t.co/T3EN9sFIhV,en,May,Q2
"@anylaurie16 Here is a game I play. Ask the guy “really?” &amp; for more info on w/e they assume you don’t know. Act very interested.

Then keep asking them to explain more &amp; more basic things.See how far they’ll go. The game is to find the most absurd basic thing they‘ll explain before stopping.",301,2020-05-14 0:50,Twitter for iPhone,3355,243,aoc,1.26E+18,9942272,138203134,FALSE,,en,May,Q2
"These are stressful times and the weight of coping with everything can feel heavy. To find the right supports to help lighten your load, you can always contact 211. Call 2-1-1, email gethelp@211ontario.ca, or visit",262,2020-05-14 11:15,Hootsuite Inc.,5,5,joe_cressy,1.26E+18,,416025003,FALSE,https://t.co/XTXONLqcmC,en,May,Q2
"Second: Any legislation in the Senate to address the economic crisis must include a provision to guarantee 100 percent of the paychecks of workers up to $90,000 a year. This is what is being done successfully in many European countries and what should be done here.",265,2020-05-14 14:54,Twitter Web App,1955,313,SenSanders,1.26E+18,29442313,29442313,FALSE,,en,May,Q2
"Last week, two rounds of severe storms blasted southern MO with widespread damaging winds over 80mph, baseball-size hail, and two tornadoes. Initial damage reports show a clear need for a formal review by @fema as part of the federal disaster declaration process.",263,2020-05-14 23:16,Twitter for Advertisers,34,15,GovParsonMO,1.26E+18,,1.00E+18,FALSE,,en,May,Q2
Arizona is forever grateful to our fallen officers and their families. Their sacrifices will never be forgotten. #PeaceOfficersMemorialDay 🇺🇸,165,2020-05-15 12:04,Twitter Web App,81,24,dougducey,1.26E+18,,20217019,FALSE,https://t.co/HSiszrCn8K,en,May,Q2
"2/ The District reported 10 additional COVID-19 related deaths:
 
56-male
60-female
60-male
66-female
66-male
73-male
78-female
83-male
84-male
91-female
 
368 District residents have lost their lives due to COVID-19.",241,2020-05-15 14:14,Twitter Web App,7,10,MayorBowser,1.26E+18,976542720,976542720,FALSE,https://t.co/B2MisirmJB,en,May,Q2
"As we continue with our recovery, it's important that we remember that #COVID19 is still in the United States and still in Oklahoma. We will continue to take this seriously, and I remind all Oklahomans that now is not the time to take our foot off the gas.",256,2020-05-15 16:13,Twitter Web App,21,4,GovStitt,1.26E+18,8.65E+17,8.65E+17,FALSE,,en,May,Q2
"📄 Signed a bill for $50 million in medical supplies for hospitals, nursing facilities, and emergency medical services
📜 Signed an executive order to provide civil immunity for health care workers during #COVID19
 
For more info visit",257,2020-05-15 21:01,Twitter Web App,141,16,GovernorTomWolf,1.26E+18,2978837542,2978837542,FALSE,https://t.co/wuDJVnjCWs,en,May,Q2
"New York City, we have a blood shortage and the @NYBloodCenter needs YOU.

It’s safe, it’s easy. Donate now and save a life. 

Head to  for more.",192,2020-05-15 23:55,Twitter for iPhone,91,35,NYCMayor,1.26E+18,,19834403,FALSE,https://t.co/5kyTNPNWDG,en,May,Q2
"Wishing everyone a safe and happy May long weekend. Although it may be different than what we're used to, we can still have fun, be active and enjoy the outdoors in our city.",198,2020-05-16 11:15,Hootsuite Inc.,11,4,joe_cressy,1.26E+18,,416025003,FALSE,https://t.co/efKKzbPd9D,en,May,Q2
Lou this is just one of numerous concepts being considered under which we would pay 10% of what we have been paying over many years matching much lower China payments. Have not made final decision. All funds are frozen. Thanks!,227,2020-05-16 12:51,Twitter for iPhone,36909,11183,realDonaldTrump,1.26E+18,,,FALSE,https://t.co/xQUzHy4NDa,en,May,Q2
"If you’re heading out for groceries this weekend, buy Canadian. Not only will it taste great, but it’ll help all those who are making sure there’s food in our stores and on our plates. And to them - our fishers, our farmers, and everyone else who’s involved - we say thank you.",277,2020-05-16 13:02,Twitter for iPhone,32950,5395,JustinTrudeau,1.26E+18,,,FALSE,,en,May,Q2
Really sad but even “sadder” watch flunky @Lawrence CRY when I whipped his mind &amp; he was FORCED to apologize to me over Apprentice fees. Even Psycho Cold Case Joe Scarborough (bad ratings) beat him up on air unmercifully. Find tapes &amp; play (5 years back?).,268,2020-05-16 15:32,Twitter for iPhone,39492,12121,realDonaldTrump,1.26E+18,,,FALSE,https://t.co/JPbJd4f5UV,en,May,Q2
"The Canada Child Benefit is helping parents make ends meet, lifting kids out of poverty, and building a better future for our young people. And during this uncertain time, families across the country are counting on this benefit more than ever. So we’re going to increase it.",275,2020-05-16 15:44,Twitter for iPhone,3422,529,JustinTrudeau,1.26E+18,,,FALSE,,en,May,Q2
Lacy will do a great job. Omar is a corrupt disaster!,53,2020-05-17 19:19,Twitter for iPhone,72580,21357,realDonaldTrump,1.26E+18,,,FALSE,https://t.co/hxhrMrWXOJ,en,May,Q2
"Justice should be measured, not vindictive. Punishing General Flynn when the government wants to drop the charges reeks of vindictive justice -- and I hope Judge Sullivan will not go down this road turning our legal system upside-down.",259,2020-05-18 21:41,Twitter Web App,3868,1076,LindseyGrahamSC,1.26E+18,,432895323,FALSE,https://t.co/lBhxwLonLD,en,May,Q2
"It was an honor to join @realDonaldTrump, @FLOTUS, and @VP on the phone to discuss our state's latest #COVID19 health data and how Oklahoma's ""Open Up and Recover Safely"" Plan is working to bring back our economy.",261,2020-05-19 16:03,Twitter Web App,97,16,GovStitt,1.26E+18,,8.65E+17,FALSE,https://t.co/cuSL1vYfnt,en,May,Q2
"I spoke on the phone with the Alternate Prime Minister of Israel, @GantzBe, today and congratulated him on the formation of the country’s new government. We also talked about the work our two countries can continue to do together. Get the details here:",276,2020-05-19 20:24,Twitter for iPhone,371,49,JustinTrudeau,1.26E+18,,,FALSE,https://t.co/lD9eaR4XXp,en,May,Q2
"It’s more important than ever for Oregonians to stay hopeful, informed, and connected. This first monthly issue of the My Oregon Newsletter highlights the creative and innovative ways the state is finding to serve you.",242,2020-05-19 23:08,Twitter Web App,211,20,OregonGovBrown,1.26E+18,,3023272478,FALSE,https://t.co/xteCuA2Co7,en,May,Q2
"I have signed a new proclamation continuing the Public Health Disaster Emergency, allowing for some additional reopenings, and relaxing some restrictions. Read more here:",195,2020-05-20 18:10,Twitter Web App,212,30,IAGovernor,1.26E+18,,8.52E+17,FALSE,https://t.co/qwbrr2IocV,en,May,Q2
"Seven years ago, an EF-5 tornado devastated the community of Moore, Oklahoma. We remember the lives of those lost that day and we remain thankful for the emergency responders &amp; volunteers who stepped up to help their fellow Oklahomans in a time of need.

We remain #MooreStrong.",306,2020-05-20 20:58,Twitter Web App,67,16,GovStitt,1.26E+18,,8.65E+17,FALSE,https://t.co/rX74L5BYE8,en,May,Q2
Many businesses across Ontario are reopening their doors this week. Thank you to @RetailCouncil for putting together an excellent resource to help businesses as they transition into this new work environment.,232,2020-05-21 15:56,Twitter for iPhone,71,19,fordnation,1.26E+18,,2809959174,FALSE,https://t.co/j5I1YlYPBO,en,May,Q2
"For two weeks the MTA has closed down the subways overnight to clean. In that same time, our outreach teams have helped more than 200 homeless New Yorkers come in and STAY off the streets. This is a MAJOR step in reducing and preventing street homelessness once and for all.",274,2020-05-21 20:54,Twitter for iPhone,320,26,NYCMayor,1.26E+18,,19834403,FALSE,,en,May,Q2
Another $298M heading to @MTA adding up to over $2B in federal funding from @USDOT so far part of the $3.9B total from the CARES Act. This is critical to keeping essential personnel moving and aiding metro NYC in recovery. We are here for the people of New York!,262,2020-05-21 22:34,Twitter for iPhone,37820,8867,realDonaldTrump,1.26E+18,,,FALSE,,en,May,Q2
"Ontario has some of the best and brightest academics. Today we announced funding for 15 of the most promising proposals to beat #COVID19, including proposals from: 
🔬@stjoeshamilton
🔬@mcmasteru
🔬@westernu
🔬@uofg 
&amp; more of our brilliant minds across the province.",291,2020-05-22 1:00,Twitter for iPhone,600,104,fordnation,1.26E+18,,2809959174,FALSE,https://t.co/jJAuAw4uY2,en,May,Q2
"Getting outside to exercise, play, and explore is good for our mental and physical health. But stay safe while you do: wash hands thoroughly, don't share food, and wear a cloth mask if you can. But most importantly: stay 6 ft apart. There's no substitute for physical distancing.",279,2020-05-22 16:34,Twitter Web App,6,3,joe_cressy,1.26E+18,416025003,416025003,FALSE,,en,May,Q2
"Today across the country and around the world, Muslims are celebrating Eid al-Fitr and marking the end of Ramadan. To all the Muslim Canadians who are carrying out traditions at home and getting together online, I’m wishing you the very best. Eid Mubarak!",303,2020-05-23 22:40,Twitter Media Studio,25960,6679,JustinTrudeau,1.26E+18,,,FALSE,https://t.co/wdg90Tokr8,en,May,Q2
As more news comes in from the tragic plane crash in Karachi I want to express our heartfelt sympathies on behalf of the people of Ontario. As a province with many people who trace their origins to Pakistan we provide our condolences to the families of those who lost their lives.,280,2020-05-24 0:59,Twitter for iPhone,945,78,fordnation,1.26E+18,,2809959174,FALSE,,en,May,Q2
"Army Staff Sgt. Richard Eaton, Jr. of #Guilford died in Iraq in 2003. Fluent in Korean, Spanish and Arabic, he became a published author in the counterintelligence community.

#CTWallofHonor → 

#MemorialDay #HonorTheFallen",270,2020-05-25 10:45,TweetDeck,114,9,govnedlamont,1.26E+18,,1.08E+18,FALSE,https://t.co/6el803d04y,en,May,Q2
Do your part. Show respect. Wear a mask.,40,2020-05-25 14:22,Twitter Web App,159277,24354,NYGovCuomo,1.26E+18,,232268199,FALSE,,en,May,Q2
My favorite coffee arrived! Wychwood Barns Blend from ⁦@KurtisCoffee⁩,93,2020-05-25 17:25,Twitter for iPhone,20,0,joshmatlow,1.26E+18,,15844405,FALSE,https://t.co/OpMtyfc14q,en,May,Q2
"Today we honor the brave members of our armed forces who gave it all for our nation. As we face incredible challenges, it's the strength and determination of our veterans that can offer us hope for a better tomorrow. #MemorialDay",253,2020-05-25 21:03,Twitter for iPhone,661,89,GovPritzker,1.27E+18,,1.08E+18,FALSE,https://t.co/NBedNR8ULn,en,May,Q2
"We are proud of Jeffrey Neill, a graduate of @CalhounCollege, for representing Alabama &amp; the auto manufacturing industry as part of the @WhiteHouse celebration honoring the Class of 2020! Congrats to all graduates!  @Toyota @ACCS_Education",290,2020-05-26 15:17,Twitter for iPhone,54,13,GovernorKayIvey,1.27E+18,,19668491,FALSE,https://t.co/AnnZ809tnH,en,May,Q2
Learn more at  3/3,41,2020-05-26 17:53,Twitter Web App,21,3,GovJanetMills,1.27E+18,1.08E+18,1.08E+18,FALSE,https://t.co/kJlBZBkFVm,en,May,Q2
"I want to be clear that this is about POLICY, not politics.

At a time when our state is undergoing a major health, economic, and budget crisis, we need to know exactly where we stand when it comes to a massive spending initiative for Missouri.",244,2020-05-26 20:10,Twitter Web App,11,2,GovParsonMO,1.27E+18,1.00E+18,1.00E+18,FALSE,,en,May,Q2
"Tomorrow, City Council will meet virtually for the second time since COVID-19 was declared a state of emergency in Toronto. Watch the live stream of the meeting at  

You can catch today's full eblast at",274,2020-05-27 21:30,TweetDeck,2,0,kristynwongtam,1.27E+18,20452161,20452161,FALSE,https://t.co/Oct8QzYixu,en,May,Q2
"The Reopen Connecticut Advisory Group's Community Committee will hold a roundtable discussion tomorrow at 10AM regarding CT's most vulnerable communities. This is the meeting that was rescheduled from last week.

Have a question? Send it to reopen@ct.gov.",279,2020-05-28 1:57,Twitter Web App,36,13,govnedlamont,1.27E+18,,1.08E+18,FALSE,https://t.co/kF7Lj5Q201,en,May,Q2
"Speaking with @HughHewitt this morning about the latest on @senjudiciary, China, and more.

LISTEN LIVE AT 8:30 AM",138,2020-05-28 12:05,TweetDeck,197,44,LindseyGrahamSC,1.27E+18,,432895323,FALSE,https://t.co/a4xIZVoMqA,en,May,Q2
I'm pleased the administration listened to the concerns of governors - that I expressed on a call with the Vice President this week - and will extend Title 32 orders. Our Montana guardsmen and women have been keeping our communities safe and their necessary work will continue.,277,2020-05-28 18:41,Twitter for iPhone,120,10,GovernorBullock,1.27E+18,,111721601,FALSE,,en,May,Q2
"Starting tomorrow, @CVSHealth will launch 10 new test sites at select CVS Pharmacy drive-through locations across RI. Altogether, these sites will add about 500 tests to our daily capacity. That's no small thing, and I want to thank CVS Health for being an incredible partner.",276,2020-05-28 20:15,TweetDeck,90,7,GovRaimondo,1.27E+18,240778059,240778059,FALSE,,en,May,Q2
"Today, Council approved our proposal to provide property tax relief for live music venues -- opening up to $2 million in relief for our concert halls and cultural institutions. A big thank you to TMAC members and all who have fought to protect our vibrant live music community.",277,2020-05-28 23:13,Twitter Web App,35,8,joe_cressy,1.27E+18,,416025003,FALSE,,en,May,Q2
"This morning, @detrnevada shared that both initial &amp; weekly claims fell for the week ending May 23. Of the weekly claims filed ending week May 16, the latest data available, 84% of eligible claims were paid. More than 37,000 initial PUA claims were filed in the first full week.",306,2020-05-29 16:54,Twitter for iPhone,75,23,GovSisolak,1.27E+18,,1.08E+18,FALSE,https://t.co/2pG9kpUPWG,en,May,Q2
Next week we’ll be focused on getting businesses and workers ready through education and outreach. We’ll ensure everyone knows the rules and follows them so we don’t see a boomerang.,182,2020-05-29 18:38,Twitter for iPhone,127,24,NYCMayor,1.27E+18,19834403,19834403,FALSE,,en,May,Q2
14/ The new rules will reduce the default speed limit to 20 MPH unless another limit is posted. These rules will be in the form of an emergency and proposed rulemaking that will be published in the DC Register and would amend Chapter 22 of Title 18 of the DC Municipal Regs.,274,2020-05-29 19:43,Twitter Web App,33,11,MayorBowser,1.27E+18,976542720,976542720,FALSE,,en,May,Q2
I’m at City Hall with @NYPDShea for a press briefing.,77,2020-05-29 20:50,Periscope,110,52,NYCMayor,1.27E+18,,19834403,FALSE,https://t.co/pdGQ56AANk,en,May,Q2
Time for a change! #2020,24,2020-05-30 3:20,Twitter for iPhone,180207,46443,realDonaldTrump,1.27E+18,,,FALSE,https://t.co/AECy2GBfys,en,May,Q2
Structural racism haunts the lives of people of color. What we're seeing is an overflow due to decades of injustices. I see my own privilege and can only understand so much. I know enough to say that for the Black community every day is pervaded by racism. We will do better.,299,2020-05-30 20:11,Twitter Media Studio,1162,276,NYCMayor,1.27E+18,,19834403,FALSE,https://t.co/XAK7S0HxoO,en,May,Q2
MN Gov. Walz: We Estimate 80% of the Rioters Are from out of State  via @BreitbartNews,86,2020-05-31 0:20,Twitter for iPhone,59221,20742,realDonaldTrump,1.27E+18,,,FALSE,https://t.co/WNRFjZA2Lu,en,May,Q2
"And the protest was urgent, well-organized, mindful of public health advice. People were wearing masks, gloves and passing out hand sanitizers. Today Toronto was shown how to protest in the era of #COVID19. #JusticeForRegis
#notanotherblacklife",268,2020-05-31 0:28,Twitter for Android,717,146,kristynwongtam,1.27E+18,,20452161,FALSE,https://t.co/52jk7t3s4a,en,May,Q2
