Tweets,Length,Date,Source,Favourites,RTs,Username,id_str,in_reply_to_user_id,user_id,isRT,tco,Language,Month,Quarter
Ending surprise medical billing moving ahead in Congress! Thanks to Ways &amp; Means and Education/Labor Committees for your work on Bills to protect patients and end medical bill ripoffs! Work with Energy &amp; Commerce HELP committees to send BIPARTISAN bill to my desk!,272,2020-02-12 21:13,Twitter for iPhone,96220,23270,realDonaldTrump,1.23E+18,,,FALSE,,en,February,Q1
"Molly’s bedtime reading tonight: Martin’s Big Words- The Life of Martin Luther King, Jr. #BlackHistoryMonth2020",135,2020-02-13 2:19,Twitter for iPhone,34,2,joshmatlow,1.23E+18,,15844405,FALSE,https://t.co/xAsLlkgnHv,en,February,Q1
"Before Democrats’ reckless impeachment moves fully into the rear-view mirror, I spoke again on the Senate floor about the partisan abuses that drove this process and why they must never happen again.",223,2020-02-13 16:07,Twitter Web App,14671,4341,senatemajldr,1.23E+18,,1249982359,FALSE,https://t.co/sWRuPRSMYu,en,February,Q1
"In order to politically attack one President they do not like, Washington Democrats proved willing to attack our underlying institutions themselves — the House, the Senate, the office of the presidency, and even the Supreme Court. All for short-term partisan gain.",288,2020-02-13 18:04,Twitter Web App,42277,13128,senatemajldr,1.23E+18,,1249982359,FALSE,https://t.co/sjybEA7otC,en,February,Q1
"Gov. Beshear Tours Flooded Areas in Southeastern Kentucky, Provides Briefing on Response Efforts: Judge-executives, emergency management leaders briefed; Flyover assesses local damage -",233,2020-02-13 21:48,Twitter Web App,55,13,GovAndyBeshear,1.23E+18,,1.19E+18,FALSE,https://t.co/IkK3GJ2CeX,en,February,Q1
"Like all South Carolinians, I was heartbroken to hear the news about the death of Faye Swetlik.  

I pray for the family of this beautiful young girl as they deal with this horrific tragedy.",217,2020-02-13 22:08,TweetDeck,4938,1102,LindseyGrahamSC,1.23E+18,,432895323,FALSE,https://t.co/9rP8XB1jRp,en,February,Q1
"Last week, the Jones family welcomed us into their home for some rosemary baked chicken!

Join us tomorrow at 7 pm as @MOAAA_DC Director Ashley Emerson visits the Lewis Family 🍴🍲  

#BlackHistoryDC, #BlackHistoryMonth",241,2020-02-15 21:00,Twitter Media Studio,19,4,MayorBowser,1.23E+18,,976542720,FALSE,https://t.co/19mFaxQxoE,en,February,Q1
"Happy Family Day! You’re invited to enjoy the Ward 12 Family Day Carnival at Fairbank Memorial Community Centre (2213 Dufferin Street) 12-3pm today- dance workshops, arts and crafts, games for all ages and snacks and refreshments.",230,2020-02-17 14:03,Twitter for iPhone,5,1,joshmatlow,1.23E+18,,15844405,FALSE,,en,February,Q1
Good reminder of what's important in life...and great reference to @GAFirstLady 's speech from Weekend for Wildlife. Keep choppin'! #gapol,162,2020-02-17 23:10,Hootsuite Inc.,165,18,BrianKempGA,1.23E+18,,47437206,FALSE,https://t.co/JR1PLPilMA,en,February,Q1
Happy family day!!!,43,2020-02-18 1:22,Twitter for Android,579,10,kristynwongtam,1.23E+18,,20452161,FALSE,https://t.co/UdtnAQSjSt,en,February,Q1
"The Teck Frontier Project is an incredible opportunity for Alberta and our entire country. With all the evidence in support of this important project, will Justin Trudeau finally approve it?
 
Conservatives stand with energy workers and their communities. Let's get to work!",298,2020-02-18 2:03,Twitter Media Studio,1378,490,andrewscheer,1.23E+18,,256360738,FALSE,https://t.co/38R3XfmcuC,en,February,Q1
....THE UNITED STATES IS OPEN FOR BUSINESS!,43,2020-02-18 14:37,Twitter for iPhone,12628,3374,realDonaldTrump,1.23E+18,,,FALSE,,en,February,Q1
"Investments for tomorrow will not wait; children deserve opportunity beginning this instant. We are clear about the unequivocal benefits of early childhood education &amp; care, and we are implementing policy that reflects both our convictions &amp; the needs of New Mexicans. #NMleg",283,2020-02-18 21:32,Twitter Web App,22,7,GovMLG,1.23E+18,1.07E+18,1.07E+18,FALSE,,en,February,Q1
I would like to thank John Rood for his service to our Country and wish him well in his future endeavors!,105,2020-02-19 15:51,Twitter for iPhone,33221,7654,realDonaldTrump,1.23E+18,,,FALSE,https://t.co/kPA1rYCKvp,en,February,Q1
"Go-Go 🎶

IS

DC 📢",41,2020-02-19 21:37,Twitter for iPhone,36,14,MayorBowser,1.23E+18,976542720,976542720,FALSE,https://t.co/0YozKPNc0L,en,February,Q1
"In the 1970s, on Holly St, just east of Yonge and Eglinton, Herb Murray simply wouldn’t give up his farmhouse to developers, no matter how much they offered him.",185,2020-02-20 1:46,Twitter for iPhone,192,16,joshmatlow,1.23E+18,,15844405,FALSE,https://t.co/CfVidWYpRu,en,February,Q1
"Fracking is NOT a transitional fuel, and it is dangerous to say so.

Fracking emits methane, which is about **84 TIMES** more powerful than CO2 in contributing to climate change for a generation.

This is not a joke. We either commit to the science or not.",280,2020-02-20 3:12,Twitter for iPhone,53273,15024,aoc,1.23E+18,,138203134,FALSE,https://t.co/gM7ArxDhgd,en,February,Q1
“They say Roger Stone lied to Congress.” @CNN  OH I see but so did Comey (and he also leaked classified information for which almost everyone other than Crooked Hillary Clinton goes to jail for a long time) and so did Andy McCabe who also lied to the FBI! FAIRNESS?,269,2020-02-20 15:22,Twitter for iPhone,114805,33184,realDonaldTrump,1.23E+18,,,FALSE,,en,February,Q1
🙏🇺🇸,27,2020-02-21 1:37,Twitter for iPhone,22,0,govnedlamont,1.23E+18,,1.08E+18,FALSE,https://t.co/QSMNI23ldB,en,February,Q1
"Five years ago, we promised to change how we address homelessness in our city. Together, we are making great strides to support our most vulnerable residents. At 11:30 am, we'll be live in Ward 6 to celebrate the opening of our newest short-term family housing program, The Aya.",278,2020-02-21 16:00,Twitter for Advertisers,23,6,MayorBowser,1.23E+18,,976542720,FALSE,,en,February,Q1
"A three-letter word is blocking the Senate from passing common-sense gun legislation: the NRA.

I wear the D- grade they gave me for my voting record as a badge of honor.",194,2020-02-21 23:28,Twitter Media Studio,8088,1494,SenSanders,1.23E+18,,29442313,FALSE,https://t.co/C4V0eAnk4H,en,February,Q1
@Cdianshield A local resident organized a go fund me. Here’s the link:,94,2020-02-22 19:33,Twitter for iPhone,0,0,joshmatlow,1.23E+18,558224845,15844405,FALSE,https://t.co/kMixxORMqn,en,February,Q1
"Premier Ford, the Leader of the Ontario PC Party shares his plan to build Ontario together. Ontario can be a place where anyone, anywhere can find a good job, own a home, and start a family. FOR THE PEOPLE!!!",232,2020-02-22 23:39,Twitter Media Studio,490,109,fordnation,1.23E+18,,2809959174,FALSE,https://t.co/tTIwi4K0F7,en,February,Q1
"I hope folks listen to what Anand is saying here.

Mass movements are beginning to transform our political landscape in a way we haven’t seen in a long time.

This kind of politics is an important shift away from saviorism. It’s not about “the one” - it’s about the many. #NotMeUs",304,2020-02-23 18:33,Twitter for iPhone,35931,7120,aoc,1.23E+18,,138203134,FALSE,https://t.co/sgOCXHz91L,en,February,Q1
Eglinton Crosstown delays have this brewery owner feeling the pinch,92,2020-02-24 11:59,Twitter for iPhone,6,1,joshmatlow,1.23E+18,,15844405,FALSE,https://t.co/M4Mbp4eQ2y,en,February,Q1
मैं  इसी  लिए भारत आया हूँ सद्भावना और प्रेम के साथ ताकि हम अपनी अभिलाषा  प्रतीक अपनी सांझेदारी और अविश्वसनीय  विस्तार  सकें l,332,2020-02-24 12:46,Twitter for iPhone,162021,27305,realDonaldTrump,1.23E+18,,,FALSE,https://t.co/gywJmRek1Y,en,February,Q1
"Katherine Johnson was a pioneer for her work @NASA_Langley that broke barriers of race and gender and helped take us to the moon. Across our Commonwealth and around the world, we mourn her loss and honor her remarkable life.",249,2020-02-24 17:35,Twitter Web App,188,36,GovernorVA,1.23E+18,,104198706,FALSE,https://t.co/XSOgZL3Ta2,en,February,Q1
,0,2020-02-24 18:13,Twitter for iPhone,103151,27976,realDonaldTrump,1.23E+18,,,FALSE,https://t.co/UNd3cUGWhz,en,February,Q1
,0,2020-02-25 12:58,Twitter for iPhone,39335,9961,realDonaldTrump,1.23E+18,,,FALSE,https://t.co/Cfs8RV05Pt,en,February,Q1
"Having good people on the force is the backbone of having a safe city. That's why I am proposing a $3.4 million increase to the Cadet program, to double the size from 100 to 200 participants. #SaferStrongerDC",232,2020-02-25 19:56,Twitter Web App,24,8,MayorBowser,1.23E+18,,976542720,FALSE,https://t.co/Kq7RPgG2gt,en,February,Q1
"The legislation would provide protections for unborn children at 20 weeks after fertilization, a point at which there is significant scientific evidence that abortion inflicts tremendous pain on the unborn.",206,2020-02-25 20:08,TweetDeck,1809,329,LindseyGrahamSC,1.23E+18,432895323,432895323,FALSE,,en,February,Q1
Our government is making a historic investment of $144 billion in infrastructure. We are excited to get shovels in the ground! 👏🏻,153,2020-02-25 22:27,Twitter for iPhone,271,38,fordnation,1.23E+18,,2809959174,FALSE,https://t.co/nhO3ON8gi5,en,February,Q1
"Thus far this debate is best described as a low brow food fight with stumbling, bumbling, incoherent answers to the problems facing our nation and the world.

Four more years for President @realDonaldTrump !",207,2020-02-26 2:54,Twitter for iPhone,19240,3999,LindseyGrahamSC,1.23E+18,,432895323,FALSE,,en,February,Q1
"While we enjoy SD’s outdoor opportunities, we must work to keep our waters safe from species that could harm them. Today, I signed a bill that takes steps to prevent the spread of invasive species and keep our natural treasures safe. Read more here:",273,2020-02-26 23:39,Twitter for iPhone,26,2,govkristinoem,1.23E+18,,235251868,FALSE,https://t.co/r9ijKqtHZb,en,February,Q1
"""What Happened To Chocolate City"" film screening is today's #UnityThroughCommunity event! Join us at @xfinity store in Chinatown to view the documentary focused on how gentrification is changing Black communities.

#BlackHistoryDC",230,2020-02-27 14:00,Twitter for Advertisers,16,9,MayorBowser,1.23E+18,,976542720,FALSE,,en,February,Q1
"Every day I want to lead by example as Governor and also as a dad. To show my commitment to financial literacy across the Commonwealth I signed a proclamation officially declaring this ""Kentucky Saves Week."" #TeamKentucky ^AB",225,2020-02-27 18:55,TweetDeck,20,3,GovAndyBeshear,1.23E+18,1.19E+18,1.19E+18,FALSE,,en,February,Q1
"Thanks to the Sask Environment Minister Duncan for stopping by my office yesterday. We talked about how Canada should be working to reduce global emissions, not punishing our own workers and commuters.",225,2020-02-28 2:23,TweetDeck,222,32,andrewscheer,1.23E+18,,256360738,FALSE,https://t.co/aL5I3kdWBD,en,February,Q1
"It’s not too late to wish @DCStreetcar a happy 4th birthday 🎂! 

Share your birthday wishes all week using #DCStreetcarTurns4, and let us know if like Alexandra, you’ve relied on @DCStreetcar to get your #FairShot.

🎊 🍰",243,2020-02-28 4:08,Twitter for iPhone,9,5,MayorBowser,1.23E+18,,976542720,FALSE,https://t.co/Be48pRTa2S,en,February,Q1
"Senator McConnell: Do not play politics with our response to the coronavirus. Congress has an obligation to end unconstitutional mass surveillance.

No administration, and especially not this administration, can be allowed to have the unchecked power to spy on Americans.",295,2020-02-28 20:42,Twitter Web App,6457,1478,SenSanders,1.23E+18,,29442313,FALSE,https://t.co/bci2xZTLwa,en,February,Q1
On my way to the Great State of South Carolina. See everyone soon! #MAGA #KAG,77,2020-02-28 22:20,Twitter for iPhone,57109,13282,realDonaldTrump,1.23E+18,,,FALSE,https://t.co/cjzElGNyDN,en,February,Q1
"Wonderful visit with Archbishop Sotirios to officially proclaim March as Hellenic Heritage Month in Ontario. Thank you @RodPhillips01, @Effie_ONB, @Christina_Mitas, and @karahaliosPC for spearheading this initiative!",241,2020-02-29 2:04,Twitter for iPhone,166,34,fordnation,1.23E+18,,2809959174,FALSE,https://t.co/h9Z7pmi8jS,en,February,Q1
"The Liberals authorized dumping 8 billion litres of sewage into the Saint Lawrence River. Conservatives called for an end to raw sewage being dumped in our lakes, rivers &amp; oceans. It’s time to take concrete action to put an end to this disgusting practice.",284,2020-02-29 15:36,TweetDeck,1769,666,andrewscheer,1.23E+18,,256360738,FALSE,https://t.co/Geaxkmpvro,en,February,Q1
"@debbieYTZ That’s simply not true. The delays are due to Mayor Ford replacing the approved &amp; funded Scarborough 7 stop LRT with a 3 stop subway, then Mayor Tory changing that to a 1 stop subway and then Premier Ford changing it to a 3 stop subway. Their finger pointing is disingenuous.",290,2020-02-29 16:19,Twitter for iPhone,10,2,joshmatlow,1.23E+18,147664628,15844405,FALSE,,en,February,Q1
I would find it hard to believe that failed presidential candidates Tom Steyer or Mini Mike Bloombeg would contribute to the Democrat Party even against me after the way they have been treated - laughed at &amp; mocked. The real politicians ate them up and spit them out!,271,2020-03-01 5:39,Twitter for iPhone,91521,18722,realDonaldTrump,1.23E+18,,,FALSE,,en,March,Q1
“Who better than @RepRatcliffe who got to the bottom of the FISAGATE &amp; RUSSIAGATE HOAX. It makes a lot of sense to put John Ratcliffe in there (DNI).The Senate should quickly approve him. @DevinNunes @MariaBartiromo  John will do a great job for the American people!,272,2020-03-01 21:00,Twitter for iPhone,55001,15034,realDonaldTrump,1.23E+18,,,FALSE,,en,March,Q1
"I want all Oregonians to know that we are taking the coronavirus situation very seriously, and that our state agencies will share new developments as quickly as possible. To learn more about COVID-19, follow @OHAOregon and check out their website: .",272,2020-03-01 21:57,Twitter Web App,138,28,OregonGovBrown,1.23E+18,,3023272478,FALSE,https://t.co/sDFEt32Zbv,en,March,Q1
"In 1876, there was a toll house at the corner of Davenport and Avenue Road.",99,2020-03-02 1:51,Twitter for iPhone,93,12,joshmatlow,1.23E+18,,15844405,FALSE,https://t.co/IQbaZTs5Yx,en,March,Q1
"As the longest-serving community college president in Mississippi history, Dr. Clyde Muse had an impressive career molding the minds of the future. Thousands of Mississippians have brighter futures having had you there to guide them. A true visionary educator and public servant!",303,2020-03-02 3:04,Sprout Social,82,12,tatereeves,1.23E+18,,259341329,FALSE,https://t.co/yRJbCmhp5J,en,March,Q1
"Editorial: More for developers, less for residents. Welcome to Doug Ford’s Ontario | The Star",117,2020-03-03 0:02,Twitter for iPhone,72,45,joshmatlow,1.23E+18,,15844405,FALSE,https://t.co/XXBoR2xYux,en,March,Q1
Go Admiral Ronny!,17,2020-03-03 13:30,Twitter for iPhone,40980,10368,realDonaldTrump,1.23E+18,,,FALSE,https://t.co/wrWjB2fxyt,en,March,Q1
"The function of our banks must be to reinvest in America, so we can build the affordable housing we need, the factories we need, the small businesses we need, and create millions of good-paying jobs. 

We must end the greed and selfishness of the current banking system.",270,2020-03-03 14:03,Twitter Web App,8308,1401,SenSanders,1.23E+18,,29442313,FALSE,,en,March,Q1
"Today, my Administration hosted a call for ANC Commissioners regarding the District’s response to any possible impacts of coronavirus. Commissioners received briefs from @_DCHealth and @DC_HSEMA.

There are no confirmed cases in DC. For latest, visit .",299,2020-03-03 22:40,Twitter Web App,16,14,MayorBowser,1.23E+18,,976542720,FALSE,https://t.co/MEWs6uPfsI,en,March,Q1
"Registration for City of Toronto summer camps and spring/summer recreation programs in Ward 10 opens next week on Wednesday, March 11th. 

Find out more here about the registration process and what programs will be available:",249,2020-03-04 15:40,Twitter Web App,6,0,joe_cressy,1.24E+18,,416025003,FALSE,https://t.co/soTt6tv0NW,en,March,Q1
"The good news is the American homeland can be protected from ISIS and al Qaeda threats emanating from Afghanistan with a relatively small U.S. counterterrorism force. 
 
If President Obama had left a residual U.S. counterterrorism force in Iraq, there would not have been an ISIS.",280,2020-03-04 17:20,Twitter for iPhone,653,167,LindseyGrahamSC,1.24E+18,432895323,432895323,FALSE,,en,March,Q1
"If you believe in:

healthcare as a right,
a living wage,
that working class &amp; marginalized people deserve power,
that climate action should be on the scale of the crisis,
that racial justice is key in all this &amp; more,

Then we are on the same team.
Let’s accomplish it together.",287,2020-03-04 22:01,Twitter for iPhone,110531,16298,aoc,1.24E+18,,138203134,FALSE,,en,March,Q1
There is no higher priority than ensuring the health and safety of all who call Mississippi home. That's why I signed an executive order establishing a coronavirus preparedness and response planning steering committee to be led by @msdh Dr. Thomas Dobbs. 2/6,282,2020-03-04 23:59,Twitter for iPhone,8,2,tatereeves,1.24E+18,259341329,259341329,FALSE,https://t.co/rGZvXWgp4D,en,March,Q1
"Last meeting tonight. City Planning w Housing staff at public consultation for re-zoning application filed for 483-491 Bay St. Applicant wants to build a 70 storey condo over existing office building. Residents ask for accessible, affordable &amp; supportive housing. #housingcrisis",306,2020-03-05 3:21,Twitter for Android,4,0,kristynwongtam,1.24E+18,,20452161,FALSE,https://t.co/solmT3wJHB,en,March,Q1
"To ensure we are able to test as many people as possible, we urgently need the CDC to increase our supply of COVID-19 test kits and expedite the approval of any testing approaches developed by private companies.",211,2020-03-05 13:36,Twitter for iPhone,319,115,NYCMayor,1.24E+18,19834403,19834403,FALSE,,en,March,Q1
Schumer has brought great danger to the steps of the United States Supreme Court!,81,2020-03-05 15:30,Twitter for iPhone,90288,21331,realDonaldTrump,1.24E+18,,,FALSE,,en,March,Q1
@OURPLACE_CECC Thank you so much. Please email us at councillor_matlow@toronto.ca,81,2020-03-05 17:38,Twitter for iPhone,1,0,joshmatlow,1.24E+18,7.15E+17,15844405,FALSE,,en,March,Q1
"In response to COVID-19, @NYCHealthCommr Barbot is issuing directives to every educator, first responder and health care worker employed by the City of New York:",185,2020-03-06 1:49,Twitter for iPhone,87,42,NYCMayor,1.24E+18,,19834403,FALSE,https://t.co/uSvrMCI2fH,en,March,Q1
Tonight’s Fox News Town Hall with @MarthaMacCallum and @BretBaier will rebroadcast at 11:00 P.M. Eastern on @FoxNews. Enjoy!,126,2020-03-06 1:59,Twitter for iPhone,44122,8633,realDonaldTrump,1.24E+18,,,FALSE,,en,March,Q1
"Happy birthday, Fred. I hope you’re having an extraordinary birthday. And thanks to the thousands of people from across Canada and around the world who gave this Canadian hero the celebration he deserves!",228,2020-03-06 16:27,Twitter Web App,1084,138,JustinTrudeau,1.24E+18,,,FALSE,https://t.co/0cTk6fHo7B,en,March,Q1
"I'm excited to be at Fenton High School, a @CollegeBoard AP District of the Year, to announce that Illinois ranks NUMBER ONE in the nation for our year-over-year increase in AP exam performance!",218,2020-03-06 19:30,Twitter for iPhone,68,13,GovPritzker,1.24E+18,,1.08E+18,FALSE,https://t.co/w940qkyLBC,en,March,Q1
"It is admittedly hard to see those who care about civility + toxicity (which I understand) sit in silence about the disturbing antisemitism emerging around Sen. Sanders. A pundit also compared him to a disease on national TV.

It’s disturbing. If you care, please care everywhere.",304,2020-03-06 22:02,Twitter for iPhone,45486,8770,aoc,1.24E+18,,138203134,FALSE,https://t.co/hMSJ87Id52,en,March,Q1
"It’s been a difficult week for our state, and thanks to Tennesseans coming together to serve one another, the road to recovery has begun.

God bless the Volunteer State.",193,2020-03-06 23:23,Twitter Media Studio,788,123,GovBillLee,1.24E+18,,1.08E+18,FALSE,https://t.co/aSYWvxD6Ot,en,March,Q1
"I am constantly asked if I‘d support the Dem nominee. Could you imagine if I said I wouldn’t?

Yet Biden’s camp is on TV threatening to help Trump if they don’t get exactly what they want.

This is profoundly irresponsible on all ends. Our country is not a game. Get it together.",303,2020-03-07 3:39,Twitter for iPhone,114377,23426,aoc,1.24E+18,,138203134,FALSE,https://t.co/weMGOCi89O,en,March,Q1
@bwhite0817 @spaikin @OntLiberal That’s kind of you to write.,61,2020-03-08 0:37,Twitter for iPhone,0,0,joshmatlow,1.24E+18,9.86E+17,15844405,FALSE,,en,March,Q1
"Or from your home, you can consult with a doctor for free with MUSC’s online web site at: . South Carolinians should continue to follow recommendations and information provided by official sources. (3/3)",226,2020-03-08 21:12,TweetDeck,24,14,henrymcmaster,1.24E+18,16335288,16335288,FALSE,https://t.co/ybfEGyZqj4,en,March,Q1
"At the City of Toronto, under the leadership of Toronto Public Health, we are working with every single department and agency to prepare for any and every scenario. Keeping Torontonians safe is our top priority and we’re going to keep working flat-out to do just that.",268,2020-03-09 2:33,Twitter for iPhone,28,4,joe_cressy,1.24E+18,416025003,416025003,FALSE,,en,March,Q1
"With so many ""firsts,"" @SenHydeSmith is opening doors for other women to follow and succeed for themselves, their families, and their communities. Making her an amazing Mississippi woman! 2/2",215,2020-03-09 18:57,Twitter for iPhone,25,7,tatereeves,1.24E+18,259341329,259341329,FALSE,https://t.co/O4Vqm5t2F8,en,March,Q1
"The number one question I get is what Coloradans can do to protect themselves and keep safe from COVID-19. 

Here is what you can do.

Share this with your friends and family to help stop the spread of COVID-19. 
Latest:",268,2020-03-09 22:36,Twitter Media Studio,152,70,GovofCO,1.24E+18,,7.28E+17,FALSE,https://t.co/FKTsOs58uC,en,March,Q1
"We share a global responsibility to meet the needs of displaced &amp; vulnerable people around the world. To lead our efforts &amp; address these issues, I intend to appoint @BobRae48 as Canada’s Special Envoy to Humanitarian and Refugee Issues. Get the details:",286,2020-03-10 13:31,Twitter Web App,1965,349,JustinTrudeau,1.24E+18,,,FALSE,https://t.co/yutuTRppHj,en,March,Q1
"He’s been indispensable in providing strategies to keep America safe from radical Islamic threats since 9/11. 
 
The President’s decision to honor General Keane with the Medal of Freedom is genuinely appreciated by General Keane’s family, colleagues, and friends.",263,2020-03-10 22:18,Twitter for iPhone,937,131,LindseyGrahamSC,1.24E+18,432895323,432895323,FALSE,,en,March,Q1
We’re also going to support workers and businesses impacted by the virus. We will waive the one-week waiting period for Employment Insurance sickness benefits to kick in. And we will enhance the Work-Sharing Program to help employers who are facing a downturn in business.,272,2020-03-11 19:36,Twitter Web App,663,109,JustinTrudeau,1.24E+18,,,FALSE,,en,March,Q1
"The @CDPHE drive-up lab in Lowry is experiencing high volume. The line will be closed today and those in line already will have priority for tomorrow. 
@9NEWS @DenverChannel @KDVR @CBSDenver @denverpost",226,2020-03-12 19:10,Twitter Web App,142,90,GovofCO,1.24E+18,,7.28E+17,FALSE,https://t.co/NFjwsBq8s8,en,March,Q1
5. The order relaxes attendance rules for police academy trainees to account for the impacts of #COVID19. (6/6),111,2020-03-12 19:29,Twitter Web App,15,5,govnedlamont,1.24E+18,1.08E+18,1.08E+18,FALSE,,en,March,Q1
"FYI, the amount that the Fed just injected almost covers all student loan debt in the US.

There is absolutely NO excuse for not pausing student debt collections, planning for mortgage &amp;rent relief, etc.

We need to care for working people as much as we care for the stock market.",308,2020-03-12 20:10,Twitter for iPhone,134109,38931,aoc,1.24E+18,,138203134,FALSE,https://t.co/IT6qZA2gtt,en,March,Q1
"Incarcerated people are incredibly vulnerable to outbreak, and many do not have basic soap + sanitation supplies to keep people safe.

@NydiaVelazquez, @RepPressley, @RepRashida &amp; I have launched multiple efforts get plans + efforts together from the FBP.",307,2020-03-13 17:45,Twitter for iPhone,5860,736,aoc,1.24E+18,138203134,138203134,FALSE,https://t.co/x0HOUuOSzu,en,March,Q1
"@Morrt63 I’m feeling well, Maureen. Thank you for your kindness. My very best wishes to you and your family too.",112,2020-03-13 21:10,Twitter for iPhone,0,0,joshmatlow,1.24E+18,214676382,15844405,FALSE,,en,March,Q1
To those families and citizens who are worried and concerned for themselves and their loved ones I want you to know that your Federal Government will unleash every authority resource and tool at its disposal to safeguard the lives and health of our people.,256,2020-03-14 1:27,Twitter for iPhone,100709,23122,realDonaldTrump,1.24E+18,,,FALSE,https://t.co/uVDY12vXAM,en,March,Q1
"We’ve known from the outset that these people are the most at risk in this pandemic, and today’s news is a sad confirmation of that reality.",140,2020-03-14 15:23,Twitter for iPhone,161,32,NYCMayor,1.24E+18,19834403,19834403,FALSE,,en,March,Q1
Tomorrow I have called for a National Day of Prayer. I will be tuning in to Pastor @Jentezen at the @FreeChapel Church in Gainesville Georgia at 11:00 AM EDT. God Bless the USA!,177,2020-03-14 23:03,Twitter for iPhone,87365,24243,realDonaldTrump,1.24E+18,,,FALSE,https://t.co/mWYWOGJ1ye,en,March,Q1
