Tweets,Month,Quarter,sampling
"In honor of International Women's Day, I am pleased to announce that the United States will triple its funding for the International Women's March. The Women's March on Washington will draw more than 39.5 million people to the",January,Q1,42
"Most Popular
4 A Woman Can Never Be Lame-Killed and Uber Doesn't Want That for You!
The amazing thing about this whole situation is that the FBI Director was forced to admit that the Dem Party was",January,Q1,42
"""On behalf of the people of New Hampshire I want to welcome Gov. Hassan to our State!"" said former Gov. John Sununu. ""He is a true leader who has done an incredible job for New Hampshire.",January,Q1,42
This weekend I'm having a fundraiser at the home of a very special friend in Hattiesburg Mississippi. He and his wife own and operate a very cool nail salon so this will be a GREAT evening for great friends and loved,January,Q1,42
The 2015 NFL Draft was a huge success for the Buffalo Bills and there are a lot of reasons for that. First and foremost was the selection of Sammy Watkins who is a player that will definitely improve our offense and bring a little,January,Q1,42
"Mr. Speaker, thank you very much. We are with you every step of the way.
These are the people that ran our Country like no other in our history as they celebrated the election of our new President. The",January,Q1,42
"The former President of the United States is looking to stop the spread of Ebola in West Africa. He wants all Americans to buy their favorite brand of cigarettes.
According to the New York Times the New York State Legislature has passed",January,Q1,42
"The Head of the National Security Agency recently testified that the NSA has been collecting phone records from the US as far back as 2007. The exact date of this information is not known but it is clearly there.
Just a heads",January,Q1,42
"Photo by Brendan Smialowski/AFP/Getty Images

They said it was on the wane but the number of hospital beds showed no sign of abating. Statistics this week did nothing to make up for this nonsense",January,Q1,42
"The EPA is looking at ways to kill the rule to cut carbon dioxide from our atmosphere. The rule would have helped farmers and small businesses. Why does the Do Nothing Democrat do nothing. They want to hurt small business.
",January,Q1,42
The United States should respond by imposing a no fly zone over Syria. It has not been done before. The no fly zone should cover most of Syria not just the hospitals &amp; laboratories of the Syrian opposition. Another mistake,January,Q1,42
This is an easy recipe that anyone can whip up. I like to add some cinnamon and cloves to the oats to give them that kick. I also like to add in a little bit of brown rice flour to thicken it,January,Q1,42
"The National Security Agency has been collecting and storing massive amounts of data on people around the world for years. And most Americans don't even know that is happening.
The NSA is now collecting and storing information on millions of people",January,Q1,42
"A federal appeals court ruled on Thursday that states can opt out of Obamacare's individual mandate.
Justices Ruth Bader Ginsburg and Stephen Breyer ruled that states aren’t required to comply with the Obamacare individual mandate",January,Q1,42
The G-20 Summit in Germany on June 7-8 is littered with signifiers of the chaos that was once the wildest and most unpredictable phase of the Trump presidency. The United States is now divided into warring camps,January,Q1,42
The CD Projekt RED team has released a new trailer for The Witcher 3: Wild Hunt. The game is set to release on October 27th in North America and on November 5th in Europe for the PlayStation®,January,Q1,42
"From Halopedia, the Halo wiki

The UNSC Pillar of Autumn

The UNSC Pillar of Autumn was a SPARTAN-IIIs classified mission in May of 2552. It was intended to be",January,Q1,42
The United States and Israel are working closely together to fight the menace of terrorism. This week we hosted the first-ever Israel-U.S. Leaders Summit. The leaders of more than 20 countries – including Israel – gathered,January,Q1,42
"The Republican Party has a problem. It has been caught with its pants down. They put up a race to the bottom with no regard for the consequences.
If you want change in Washington stop voting for Crooked Hillary and",January,Q1,42
If you're a female NFL fan you're greatly disappointed in the way that Roger Goodell handled the Ray Rice domestic violence incident. He sent Ray home early from the NFL and then immediately sent him back on the Commissioner's List.,January,Q1,42
"Elon Musk, the CEO of Tesla Motors Inc., the largest producer of electric vehicles in the world, is now the most powerful man in the world. He is the most powerful man in the world because he has done nothing",January,Q1,42
The American people overwhelmingly oppose the Patriot Act. Our top court refused to reinstate it and a federal judge said it was unlawful. The Patriot Act goes beyond the powers of the federal government and is overreaching. The politics are,January,Q1,42
"John Kerry has delivered a historic and historic blow to the Iranian regime. He has stopped the Terrorist regime which has killed hundreds of Americans and Americans in thousands of other ways!
They are trying to kill my husband!
",January,Q1,42
"And now, more damaging news for the White House as the Senate passes the bill with overwhelming bipartisan support. This is historic. Congratulations to the great Senator @RandPaul and the House Majority Leader.
“The Senate bill",January,Q1,42
As President Trump faces yet another scandal after another one arising from his wildly illegal and un-documented campaign activities—such as his request that a Federal Bureaucrat to be investigated for his failures to report thousands of dollars in campaign,January,Q1,42
"Is your dog stupid and/or dangerous? Do you want your dog to have a big big fat order book? You better be ready because if you are you are in for a rough ride!
.@FoxNews is",January,Q1,42
"I love puppies!
Seriously everyone. I love puppies!
Thank you Veronica!
Puppy Love!
We love you Veronica!
The Fake News hates to admit this but I am winning every one of the",January,Q1,42
"The best way to explain this is with music.


Consider a few examples.


One. Every President since Eisenhower has been a fantastic president on the economy. Adding to that he or she has been the best in",January,Q1,42
"The Canadian Press


OTTAWA -- Prime Minister Stephen Harper wants to see more research into the causes of the Zika virus.
Harper said Friday he wants more information from the United States and European Union on the origins",January,Q1,42
"Here is a truly astounding statement. Secretary of State Rex Tillerson has just stated unequivocally that Iran is NOT a state sponsor of terrorism. He was absolutely correct.
TRINIDAD &amp; CALIFORNIA ARE NOT",January,Q1,42
"NASHVILLE, Tenn. (AP) — The Latest on the death of musician Dave Matthews (all times local):

11:45 a.m.

A talented musician who played guitar in the rock band",January,Q1,42
"United States (10) vs. (8)
U.S. Soccer FC vs. Brazil (Monday Night Football)
🇺🇸🇦🇲🇸🇧�",January,Q1,42
The New York Times wants to tell you that the brutal attacks yesterday in London were the work of a small number of lone wolves but that this is exactly what the establishment Democrats have been saying for years. They say it all the,January,Q1,42
"This article is from the archive of our partner .
Wendy Davis wants you to know that the Golden State just hit a new all time high in the number of people working part time. This information is important for the",January,Q1,42
"The following is from a recent post by a very good friend and colleague Dr. William Kreider. He is a fantastic man and I greatly appreciate his services.
I am proud to announce that President Trump has nominated Dr.",January,Q1,42
"Trump team starts out with big lead in likely New Hampshire Republican primary. That number is getting smaller as more people sign up.
What have we gotten for nothing? Please consider voting for Republicans up and down ballot in November!",January,Q1,42
"The University of North Dakota has been revealed as the latest school to be shuttered because of budget shortfalls. This comes as no surprise as they are the only school in the state to be shut down over budget.
I",January,Q1,42
"This is the place to discuss the upcoming Democratic National Convention being held in Philadelphia, Pennsylvania.
We are not holding the Dem National Convention in Pennsylvania.
We are not holding the Dem National Convention in Pennsylvania.
If the",January,Q1,42
"So we bring you an update regarding the illness of our beloved President Donald J. Trump. In the meantime we have begun the legal process to secure his immediate release. No rush!
.@RealBenjy is a",January,Q1,42
The PATRIOT Act was supposed to be a very large law. It was supposed to cover almost every aspect of your day to day life. It wasn't supposed to do all of those things and it still is not.,January,Q1,42
"From Valve Developer Community

Notice: Trying to reproduce this issue. Will be fixed over night!

This is a known issue with the new steam workshop and will be fixed in a later release.
NEW: Long",January,Q1,42
"This is the transcript of the Mayor's question to Dr. Vivek Murthy, Assistant to the President and Chief Diversity Strategist at the Department of Housing and Urban Development. Thank you!
The @HUDgov @H",January,Q1,42
"I just read this. This is so true.
1.) Iran has been paying Americans for years. They stole $150 Billion from us and they are asking us to pay for their overcharging. They should be immediately blocked",January,Q1,42
"This is a conversation between a nervous little girl and a scared little boy .
... and burn the place to the ground.  And this is a WARNING this has happened before in this city and I guarantee you it will never",January,Q1,42
One of the things that is very interesting about the Portland Rose Army Base is that the base has a lot of people from different backgrounds who all have very different futures. The most recent departure came from a person who has been with,January,Q1,42
"Woolworths has confirmed its stores will be closed today as part of a month-long strike.
RT @GavinNewsome: @Woolworths Australia: OUR workers striking today will have WORKERS STAND",January,Q1,42
"Protesters take to the streets of Detroit in protest of the death of poet laureate and civil rights leader Dr. Martin Luther King Jr. on Saturday, January 21, 2017. (Photo by Scott Olson/Getty Images) Protest",January,Q1,42
"Picture the scene.
Please take care of these 2 young kids and keep them in your thoughts and prayers. Also take care of our Nation's Vets. They are under siege right now.
I just spoke to the",January,Q1,42
"The NY State Police have arrested a man for allegedly setting fire to his ex-girlfriend's home. The suspect is a 29 year old male from the Rochester area. He is being held on $10K bail.
@",January,Q1,42
The state of Texas is currently investigating a massive data breach of Medicaid and the Texas Children's Health Program. We are working closely with the federal government and the Centers for Medicare and Medicaid Services to determine how this might have occurred.,January,Q1,42
"The federal government has provided $25.4 million for the University of Manitoba to assist with the construction of the Winnipeg Art Gallery. The Winnipeg Art Gallery is located on the corner of East Hastings and Hastings Streets.
The $",January,Q1,42
The United States Court of Appeals for the Second Circuit has handed President Trump another victory on his war on illegal immigration. The Supreme Court had the last word. It is now on the President's side to quickly fulfill his unconstitutional executive,January,Q1,42
"The United States has sent troops back into Iraq after a campaign that was a failure.
The United States has sent troops back into Iraq after a campaign that was a failure.
The United States has sent troops back into Iraq",January,Q1,42
The United States will not be the first foreign power to take advantage of the results of the US presidential election. The Soviet Union tried to do the same thing several years ago. The United States fought back and destroyed their plans.,January,Q1,42
"The Washington Post's Philip Rucker explains why Democrats need to get serious about defeating the Republican Health Care Bill. (Peter Stevenson/The Washington Post)

After exposing the Obama administration's illegal blacklisting of American businesses and",January,Q1,42
"The CIA has admitted that it lied to Congress about the extent of its investigation into the September 11, 2012 attacks.
A CIA insider admitted that the CIA lied to Congress about the extent of their investigation into the September 11,",January,Q1,42
"This is a story about a journalist and his family. Our thoughts and prayers are with the Presser family.


Former CBS Reporter One Of The First Journalists To Capture Trump Server Behavior
They won….they stole it.",January,Q1,42
"The HTC VIVE is finally here!
HTC VIVE Specs
Screen 2560×1440 4ms latency (60FPS)
Display Type AMOLED Processor Quad-core 1.4GHz RAM",January,Q1,42
"""I don't know why they're doing this but I'm very surprised.""
Smith is a loyal Democrat. Very loyal. He will do anything for Democratic causes. Will be a very good Senator!
So dishonest!",January,Q1,42
"""There's a lot of talk about how the Democrats are going to lose the House and Senate in November. I thought that was a given. They have been in power for over 40 years. They don’t deserve",January,Q1,42
"SACRAMENTO, Calif. — Four Democratic senators signed on to a letter Monday to Attorney General Jeff Sessions calling on him to drop an investigation of former national security adviser Michael Flynn.
Flynn was forced to resign",January,Q1,42
"Image copyright Reuters Image caption The US has at times been criticised for not doing more to stop the spread of Ebola

The US has granted permission for medical staff from Sierra Leone to visit some of its patients at the US hospital",January,Q1,42
"STOCKHOLM — After a career that spanned nearly a century and a half, the Norwegian Nobel Committee has dropped the hammer on the country's Prime Minister, Jens Stoltenberg, for the country's",January,Q1,42
"You can always find me on Twitter - @GavinAndria
Thank you to everyone for all of the great reviews of our first bill in the new year. We are making a huge difference for small businesses &amp;",January,Q1,42
"WE WILL NEVER LET YOU DOWN!
Even more proof that the National Enquirer is FAKE NEWS. They are trying to ruin our amazing White House. They don’t know it but they were a JOKE",January,Q1,42
"It's been a while since we've done a Daily Deal and now it's your turn!
They are trying to marginalize us with stupid regulations. They are trying to ram through an incompetent replacement that will make things even",January,Q1,42
"It's been a rough few days for President Trump, and his approval rating is at his lowest point in years.
But what about the amazing record breaking numbers that were set by President Obama in 2016. Could that be because",January,Q1,42
"Muslim Brotherhood member who pushed Boston Marathon bomber Dzhokhar Tsarnaev to kill himself pleads not guilty to terrorism charges

A Muslim Brotherhood member who pushed the Boston Marathon bomber Dzhokhar Tsarnaev to kill himself has pleaded",January,Q1,42
The 'Comics for Children' campaign is going viral. Here we are 2 years &amp; 2 months into the campaign &amp; it is always exciting to see the levels of support for a great cause! @C,January,Q1,42
"It is with great sadness that we report the passing of Judge James P. Boasberg. Judge Boasberg was a tremendous advocate for the State of Georgia and an outstanding Justice. He will be greatly missed.
The",January,Q1,42
"And finally:
THE GREATEST JOB EVER TAKEN BY A FEMALE IN THE SPEECH SERVICE.
“Hillary Clinton should never have gotten the Cabinet position.” @IngrahamAngle",January,Q1,42
"There has been no shortage of speculation about the exit of President Trump after just 10 days in office. Here are 5 reasons why he should be deeply honored.
Thank you to the U.S.K.S. and",January,Q1,42
"Congressional Republicans now wonder if Hillary Clinton just lied to Congress. https://t.co/o1kIYpByyg — FOX & Friends (@foxandfriends) September 2, 2017
Pete Rose is",January,Q1,42
The Opposition New Zealand Party will restore the right of all New Zealanders to vote. Once again we are showing the world that New Zealand is a force for good and a beacon of hope. We will continue to bring stability and,January,Q1,42
"After reacting to the horrific attacks in San Bernardino California yesterday with my thoughts and prayers, I am sending my deepest condolences to the people of California and the United States. Our hearts go out to the families and friends of the victims",January,Q1,42
"A North Carolina Republican senator who said that Hillary Clinton should be prosecuted for her role in the Benghazi terrorist attacks is calling on the Justice Department to investigate Gov. Pat McCrory for ""breach of trust.""
""While",January,Q1,42
"Ryan is a tremendous talent and a great guy!
After a very long and difficult train wreck we have arrived at the point where it is now or never. There is no other word for it!
Congress MUST pass legislation",January,Q1,42
"The UESPWiki – Your source for The Elder Scrolls since 1995

This article is about the race. For the quest series, see Skyrim: Forsworn.

Skyrim is a massive open world game developed",January,Q1,42
"So the order was given to investigate collusion between the Trump campaign &amp; Russia? A disgraceful abuse of power!
“There is an absolute and overwhelming consensus in the House that the investigation must be led by Congressional",January,Q1,42
The Federal Reserve may have moved to end its stimulus program but in the process it is raising interest rates five times in less than a year and this will further increase the economy. I expect this to continue and it is going to,January,Q1,42
"The American people want Congress to do its job and bring our troops home from Afghanistan. Unfortunately, the Obama Administration is refusing to do its job and is instead making excuses for the Taliban.
Major General Keith Kellogg (@K",January,Q1,42
HONG KONG — If China can corral the world's worst human rights abusers into jail it can do the same with the world's worst techies. That is the conclusion of a report released today by the United States,January,Q1,42
"Intelligence sources tell me the King Salman of Saudi Arabia is targeting Iran. He wants to finish the job he started way back in 1798. I hope he succeeds. He is a GREAT leader!
THE BEST IS Y",January,Q1,42
"Thanks for visiting our website!
Thank you for visiting my office in Albany NY. I am here to help you with your request for help and advice. Your request for help and advice has been received very well. I look",January,Q1,42
"Only you can stop them. Only YOU can save them. #MakeACAGreatAgain!
.@RepBrianScott has done a magnificent job for the people of Georgia. He is a strong supporter and fighter for the Great",January,Q1,42
"A quick 100 word review of this book!
--
THE BEST BOOK ON THE GREAT HAWAIIAN WAR!
A young boy, who had just been wounded in battle and was confined in a hospital. He",January,Q1,42
"We are pleased to announce that we will be hosting the 7th Annual BlizzCon LIVE from the Anaheim Convention Center on Saturday, July 10th!
The National Guard has arrived in Wisconsin to provide assistance to the State. Thank",January,Q1,42
"The Federal Reserve on Tuesday cut its key interest rate and signaled it might continue to tighten even further before the economy fully recovers.
But the Republicans in Congress are doing everything in their power to increase the cost of living...
",January,Q1,42
Burning Man is not that hard to understand. It's a bunch of travelers coming together to have fun. I'm in Vegas doing some PR and everyone is excited! “This is great news for me!”,January,Q1,42
"Failed presidential candidate Mitt Romney responded to my call on Tuesday for a diplomatic solution to the Iranian nuclear threat with implicit support for military action.
Not only was this not my position but it is diametrically opposed to the",January,Q1,42
"THE MORNING PLUM:

In a stunning reversal on ObamaCare the Supreme Court ruled 5-4 today that states cannot opt out of some of the law's most important protections for parents and young people. For the first",January,Q1,42
"Biden: I Won't 'Sign' Death Wording Into Law

Exclusive Details:

Vice President Joe Biden said he will not ""sign"" any ""Death in Public Act"" into law.
I",January,Q1,42
The New York Times is reporting that Donald Trump wants to build a massive wall along the US-Mexico border. This is a devastating blow to our Country and our great Economy. It will NEVER be as big as the Berlin Wall,January,Q1,42
"The case of Brian Brian Brown, a young man whose life was cut short by a drunk driver who killed him and seriously injured others has sent shockwaves through the state of Ohio. The young man in question was walking home from",January,Q1,42
"The Social Security Administration is misleading the American people regarding the number of people who are awaiting decisions about their Social Security Disability Compensation and other benefits.
The number of people who will not be receiving these benefits in 2026 is estimated",January,Q1,42
"The West is already creating the conditions for Islamic State (IS) to take over the entire Middle East. This week the United States announced it is sending some 2,000 troops to Iraq along with some 1,000 more in",January,Q1,42
The FCC is extremely close to finalizing its plan to reclassify broadband under Title II of the Telecommunications Act. The new classification will dramatically lower the caps on how much broadband providers can charge and what types of services they will,January,Q1,42
"Joe Biden talks about the future of our Country at the White House today.
Thank you Joe!
--- @FoxNews  They are the Radical Left Democrats. They want to take your guns NOW. They want to weaken",January,Q1,42
This is a very special episode of the Locked On Lakers Podcast. Today we welcome the legendary and all around great photographer Jim Nantz (@Jim_NBarr) of the Locked On Lakers Podcast. Jim is a true Los Angeles,January,Q1,42
"USA TODAY Sports

The San Francisco 49ers are headed in the right direction.
Not only are they 4-0 heading into Sunday night's game against the Carolina Panthers, but they are coming off a 47-27",January,Q1,42
"OKLAHOMA CITY -- After the Oklahoma City Thunder rallied for the fourth time in five games Wednesday night, their coach, Billy Donovan, had no interest in going on the road and was considering making a morning trip to",February,Q1,42
"The Trump administration on Friday expressed its deep concern over the recent landslide in the number of unaccompanied minors crossing the border into the U.S. from Central America.
This is a critical issue that must be addressed with the full",February,Q1,42
"We are at a critical time for the American Worker. The Merit Based Immigration System is under severe attack by the Radical Left Do Nothing Democrats. We must do better than the failed policies of the Obama Administration!

New",February,Q1,42
"Pigs In Christmas Sweater
 Pigs in Christmas Sweater is a wonderful film by Walter Hill. It is a story of love, sacrifice and a commitment to this great country. Enjoy!!!
You are all V",February,Q1,42
"CLOSE USA TODAY Sports NFL draft analyst Mel Kiper Jr. provides his predictions for the first round. USA TODAY Sports

1. DE Emmanuel Ogbah of Oklahoma. This guy is an elite athlete who is even bigger",February,Q1,42
The Senate Intelligence Committee has just released a report completely exonerating President Trump. The Democrats didn’t want that because they knew if they released it the President would go after them for a political crime. They knew he wouldn,February,Q1,42
"This past summer, I was lucky enough to be in New York City for the premiere of the new movie Star Wars: The Force Awakens! I had the pleasure of meeting John Boyega, Daisy Ridley, John Boyega,",February,Q1,42
"A controversial social media post about the Boston Marathon bombing has landed a young woman in hot water.
The young lady who made the controversial post has now been suspended &amp; has been warned. She will not be allowed to",February,Q1,42
"A man who allegedly stole a woman's newborn is dead after police say he jumped in front of his car and struck another vehicle.
Chicago Police say they are looking for a white male in his mid-to-late-",February,Q1,42
The National Center for Transgender Equality today released the following statement on the announcement that the Honorable Judge James Robart of the U.S. Court of Appeals for the D.C. Circuit will be leaving his position on December,February,Q1,42
"The New York Times > > NYT > > The New York Times > > by: Max Fisher
The Times > > is the most widely read and trusted news source in America. Their readership is more diverse than any other",February,Q1,42
"Yes, we love our friends in the Black community! We are working very hard with the @Astro_Energetics who are helping us design a new innovative Big Data platform that will make it easier to analyze huge",February,Q1,42
"The White House on Thursday said it is aware of reports that three American citizens were released from Guantanamo Bay despite President Trump's repeated denials.
''The United States government is aware of these reports and will update the White House",February,Q1,42
