Tweets,Month,Quarter,sampling
"In a major victory for the American people, a federal judge today ruled that the Obama Administration is in violation of the U.S. Constitution by placing a temporary hold on President Trump's highly controversial travel ban.
Major Victory",May,Q2,42
"The city of Detroit is in debt and has no money!
We are going to get this thing done!
Pete Rose will never forget the day his great baseball club, the Chicago White Sox, won their 2nd",May,Q2,42
"We're back with another episode of the Best of the Web podcast! In this episode we touch on the latest developments in the Elon Musk Phoenix Project!
This week on the Best of the Web Podcast we discuss the Tesla Model",May,Q2,42
"What you need to know about the New York Giants Super Bowl LI Champion New Orleans Saints
Hello everyone and welcome to the latest edition of the NFL Power Rankings. Last week it was Pittsburgh and now it is New Orleans. As",May,Q2,42
"The Washington Post doesn't like me either!
The Post totally distorted the Senatorial Debate in order to win an election. The Debate was about Economy and Jobs not Political Corruption!
I am doing exactly what the Framers",May,Q2,42
"The mother of Trayvon Martin is accusing George Zimmerman of going above and beyond to protect him.
Zimmerman has been charged with second degree murder in the death of this young man.
These are the same people that said",May,Q2,42
"More than 500 social media users have been arrested in Denmark following a major anti-Islamophobic protest.
The Danish People's Party (DF) is in power and is doing very well. They are doing very well in the",May,Q2,42
"Report: DNC Director Resigns After Wikileaks Email Leak
The head of the Democratic National Committee (DNC) resigned today after it was revealed that he was furious that the Wikileaks Email Vault showed that the DNC paid no",May,Q2,42
"OFFICIAL RULES: If you see something that you think belongs on this list, or anything else on this website that isn't on this list or in any way related to the Chicago Blackhawks, please inform us via",May,Q2,42
FOXBORO — Coach Bill Belichick didn't play a single down for the New England Patriots on Sunday in what was expected to be a big win for the team. But according to multiple sources the Patriots did play a few,May,Q2,42
"The owner of a popular Washington neighborhood grocery store is under investigation for allegedly paying a minor girl more than $1,000 in bribes to get her to eat at his store.
The Washington Post reports that in March 2016 a",May,Q2,42
"The Trump campaign is now pushing a new conspiracy theory that was planted by Fox News to try and get people to vote for their favorite candidate. It is a total hoax.
The Democrat Party in the USA is totally divided up",May,Q2,42
"A district court judge on Wednesday ordered a temporary restraining order barring the Trump administration from enforcing a major part of an executive order on immigration.
The 9th U.S. Circuit Court of Appeals in San Francisco on Wednesday upheld",May,Q2,42
"The FBI is looking into the possibility that the Trump campaign colluded with Russia in the 2016 election.
It was a totally made up Russia Witch Hunt (why didn’t Crooked Hillary just release her NAMES?)",May,Q2,42
"The FBI has interviewed former acting Attorney General Sally Yates on Russia investigations. She was fired for not telling the White House that the President was considering firing James Comey – but he was not. The Witch Hunt is on!
So",May,Q2,42
I'm not gonna bother with the legal stuff. What I am gonna do is look at the records. Anybody that looks at the records can see that from 1971 to 2013 over 808 millions dollars was spent on illegal sarin,May,Q2,42
"Are you ready for a BIG CHANGE?
I have a BIG CHANGE for you. It will be BIG and it will be amazing!
Thank you to all of my friends and all of the great people of Alaska",May,Q2,42
"This is a really great book. Thank you!
Fake News!
Great book by the great John Judis. I always loved his reporting on Senator Joe McCarthy. He was one of the greatest public servants in American history",May,Q2,42
"Mashable

The White House is no longer taking questions from reporters at this early stage of the Russia Hoax.
It could be days before the FBI &amp; the @nytimes can confirm what we have",May,Q2,42
"Democrats have spent the last 11 days attacking the wonderful Kellyanne Conway who has been running the Trump campaign incredibly well. She was always a favorite of the President and I knew she would get the boot as campaign manager!
",May,Q2,42
The old and the right wing media are going absolutely berserk over what Trump did yesterday during his Inaugural Parade. These are people that spent the weekend attacking him and his policies. They are totally out of control.,May,Q2,42
"I recently wrote about how the Bundy Ranch standoff in Nevada has led to the deaths of at least 10 people so far and did so after receiving a letter from a very angry Congressman that read in part:
Dear Mr. Bundy",May,Q2,42
"In Venezuela, Donald J. Trump Is The Only One Who Can Make America Great Again!
Venezuela is a disaster. They have taken over our Country. They are Angry and Unhappy. They want To Destroy USA",May,Q2,42
"This is a rush transcript. Copy may not be in its final form.

JUAN GONZÁLEZ: We turn now to the 2016 presidential race. On Friday, more than three weeks since",May,Q2,42
"PITTSBURGH - A former Pittsburgh Steelers offensive lineman has been charged with raping two women.
Karen Hoberman, 65, of Pittsburgh was charged with two counts of third-degree rape. She was released",May,Q2,42
Pete Carroll believed he had a great player who was only getting better. But after a slow start to his career the emergence of Doug Baldwin and the Seattle defense has Pete Carroll and the Seattle Seahawks ready to GO in Week 6,May,Q2,42
"Promises made and kept are now a mystery.
The only person who can blame Hillary Clinton for the fact that there is now NO HILLARY COMPETITION is herself. In fact she is even MORE talented than Bernie",May,Q2,42
"And the country is roaring back!!
When did this happen?????
The media is the enemy of the people. They make a lot of money and they know it. They just don’t like the truth!
",May,Q2,42
A massive fire broke out at the Gaylord Opryland National Penitentiary in Washington D.C. and as of writing it is believed that at least 476 inmates are dead. Here are some of the horrific things,May,Q2,42
"The Westboro Baptist Church, which has been lambasting President Obama for the deaths of soldiers in Iraq and Afghanistan for more than a year, has gone on a shooting rampage in Kansas.
They have burned the American flag and",May,Q2,42
"Fifty years ago Thursday the United States and the Soviet Union entered into a ""Cold War Alliance.""
Sixty years ago this week the Soviet Union and the United States signed the Treaty of Baku.
SIX DAY",May,Q2,42
"Our Labour Government will protect the nation from Terrorism and will not hesitate to use all of the tools at our disposal to defeat the vile criminal elements that threaten the very existence of our Country.
I will be having a White House",May,Q2,42
That's not what I said. My statement was that you have to think about the long term. We are not going to win this war on drugs fast enough. We need to have more robust in house testing. Many states,May,Q2,42
"Snowden: I Was Targeted in a 'Witch Hunt' by the US and Russia
'I never told Russia or China that I was a target of a United States Witch Hunt!': Former NSA Deputy Director Michael",May,Q2,42
"Will the Federal Reserve keep its policy of low interest rates? Read more…
The Dow Jones Industrial Average has passed the 2,000 milestone for the first time in history. The S&P 500 is up more than 30",May,Q2,42
"Our Story

Since 1995 we have been providing exceptional service and exceptional quality beer to Lafayette and the surrounding area. We are honored to be a part of the Lafayette &Newport News. #LAFNNetNews
",May,Q2,42
"Is this family having a normal Christmas? Who knows…they might just be the coolest bunch of guys to see in a long time.
Highly suggest this family a favor. They deserve it but they are very busy in",May,Q2,42
"All those who have followed our campaign closely know that we would never accept money from companies that cheat on their emissions tests.
The Dow Jones industrial average is up 1400 points in the past 12 hours. Get well soon Debbie!",May,Q2,42
"Awesome! Thank you!
Great! 🇺🇸
Vladimir Putin is a bad negotiator. My Trade Deals are the best ever made by far. Our Economy is booming. Thank you Vlad!
",May,Q2,42
"Bronx, NY - A 21-year-old man was killed and 14 injured after a shooting in the Bronx early Saturday morning.
The NYPD is on high alert after a deadly shooting early Saturday in the Bronx. This",May,Q2,42
"Operating systems like Windows and MacOS
I've been working on a blog post about the many operating systems out there. I decided to post it here because the numerous platforms make it really easy to share this information. Do",May,Q2,42
"Well before the first shot was fired on the 2016 election I would never have thought that I would be speaking at this moment.
Being President of the United States is very different than running for office. It is different because of",May,Q2,42
"UPDATED: 6:15 P.M.

WASHINGTON — President Trump called General Philip Breedlove, the Army chief of staff, late Monday night to assure him that his team was on top of the problem of Fake",May,Q2,42
"The list of nearly 2,000 people who have been killed by firearms in the United States since 1996 is long. We know this because we collected this data in a study and are sharing it with you in case you are interested",May,Q2,42
"Virgil Abloh, the White House correspondent for The New York Times, says that despite the President's complaints about the Fake News Media it's becoming increasingly clear that they are the most politically biased and corrupt media in",June,Q2,42
"UPDATE: This post has been updated with the information provided by the Chairman of the House Judiciary Committee.
I have just been informed by the Justice Department that they will not be pursuing charges against James Comey for the leaking of privileged",June,Q2,42
"In the wake of the tragic mass shooting in Orlando, Florida, the Department of Justice and many others are and have been investigating the possible involvement of the Russian government in the deadly shooting in Orlando.
During the 2016 Presidential Campaign",June,Q2,42
"The Labour Party is now in charge of the most powerful job in the world. After a decade and a half of failed leadership the Government of David Cameron has finally got it right.
Over the next 4 years I want Business",June,Q2,42
"General ID

Where is your General ID?

General ID you idiot

The media can never seem to get it right!
BURR IS GREAT STOCK MARKET!
The Federal Reserve lowered interest rates",June,Q2,42
"Leonard Cohen's funeral service has been cancelled after a terrorist attack in France.
I have just spoken to President Putin of Russia and they asked that my office not interfere. They want us to focus on the very important work",June,Q2,42
"The most important thing that can happen to us is that we start acting like Americans. The MSM is Fake News and Rush Limbaugh is the most Antisemitic Human Being on Earth!
I AM VERY PLEASED WITH",June,Q2,42
"When Mike Bloomberg endorsed Hillary Clinton and got booed off the stage at the DNC I was shocked and disappointed. I never thought I would see a presidential candidate so afraid of him or herself!
Our Country is stronger than either",June,Q2,42
"The Book Club:
By Richard Seymour
Regnery
List Price: $25.95*
*These are the Hardcover prices. The hardcover is listed in parentheses after the name of the book.
Co",June,Q2,42
Our client has notified us that one of their employees is under investigation for possible Violations of the Sherman Antitrust Act. Based on the information that we have and the information that we have received so far this is something that,June,Q2,42
"It seems like every time we get a new batch of bad statistics we are reminded how great Americans are.
The so-called 'Cryin’ Chuck’ Schumer’ interview last night was just another example of",June,Q2,42
One of my favorite parts of the Mayan Calendar is the commencement of the Year of the Rooster. This year it is December 2nd which means that on this day in 1999 the Morning Star was in the opposite sign to,June,Q2,42
The Nationals and Giants have had some bad blood recently and this weekend it boiled over when Nationals Manager Dusty Baker referred to Giants pitcher Madison Bumgarner as the son of a bitch. Bumgarner was furious and,June,Q2,42
The Islamic State of Iraq and Greater Syria has been threatening to attack Israel for many years. The U.S. has let them get away with it for years. They should be happy to know that I am. They should,June,Q2,42
"Video

Senator Bernie Sanders says he would not be taking part in the televised debate because he is meeting with his staff.

He has been a strong supporter of Senator Clinton throughout this process.
I will be having",June,Q2,42
Democrats want to replace Obamacare but they have no money and the big donors don't want them. They want to go back to the past and go all in with a Mormon vote in 2016 for the worst and most unpopular Senator ever,June,Q2,42
"A few months ago I was talking with a few friends about how important it is to get out and enjoy ourselves. I had just come back from a great hike in the Blue Ridge Mountains of South Carolina.
LAW &",June,Q2,42
The Federal Reserve Bank of San Francisco recently released a report that finds that the Fed can do better. The Federal Reserve is far too powerful and too politically powerful. If the Fed could do 2% better or worse than the average,June,Q2,42
"Etihad has signed a deal to buy American a share of American Airlines. This is a big deal for the USA.


—@realDonaldTrump
A great job is being done by many very smart and highly respected people",June,Q2,42
UNITED NATIONS—U.S. Ambassador to the United Nations Nikki Haley said Tuesday she does not believe President Donald Trump or his surrogates are to blame for the ongoing death toll in Syria from a sarin gas attack,June,Q2,42
"I've never read anything so offensive as this about a black man who killed his girlfriend just last year. He spends 20 years in prison for a crime he doesn’t commit.
If only I was black!
",June,Q2,42
"THE FIRST REUNION IN 40 YEARS!
ABOVE PHOTO WE SEE HARRISON at the White House NEWS CONFERENCE.
Thank you @MayorBowser who has been a big supporter of our",June,Q2,42
"The Superior Court of New York State has ruled that the Trump/Russia FISA Scam is a Hoax!
The Obama Administration LIED to the Supreme Court that the National Security Surveillance Act (NSA) was not a """,June,Q2,42
"The City of Vancouver is asking for your help in identifying these individuals. If you recognize one of these individuals call 604-717-6800. Anonymous tips are more than appreciated.
'It's too bad.",June,Q2,42
I am not a doctor. I am not qualified to speak on this subject. I am a lawyer by profession and have always followed the law. I am not qualified to speak on this subject. The American people should have the,June,Q2,42
"Congress Finally Says We Have to Pay the Bills for the Fatal Attack on our Embassy in Tel Aviv. They are too big to fail. Democrats and the Radical Left Want War with Iran. We must act NOW.
Congress Must",June,Q2,42
"Maureen Dowd: 'Our Country Has Been Made Great Again'
Obamacare is a total disaster for our Country. We can not continue to let the critics do all of the work. We must quickly approve these things",June,Q2,42
This is an amazing story. My heart goes out to the family and friends of Brandon. A young man who loved life was brutally murdered in Southern California. My heart goes out to the family and friends of Brandon. I am,June,Q2,42
The US was the only country that did not build a border wall and probably would not even if we had one. The Mexican President said that a wall would be built quickly and that it would deter others from doing the same.,June,Q2,42
"The Pentagon says it has destroyed its first batch of chemical weapons after the United States and Russia agreed to destroy their stockpiles.
Pentagon Official: We Have Destroyed The First Permit For The Use Of Chemical Weapons",June,Q2,42
"In a surprise move, the Senate Intelligence Committee announced on Friday that it has interviewed former acting Attorney General Sally Yates. Yates fired back strongly against the Trump Administration's travel ban in March and was fired by the Trump Administration. She",June,Q2,42
"The Oakland Raiders are headed to Las Vegas.
The Raiders will be in Las Vegas this weekend. Also the Browns are in Vegas.
The Raiders are heading to Las Vegas. The Chargers are headed to San Diego. The",June,Q2,42
"When Donald Trump announced his candidacy for President I was all about #MAGA and the Great American Community HE WILL NEVER LET YOU DOWN! — Donald J. Trump (@realDonaldTrump) January 13, 2016
.@FoxNews just",June,Q2,42
"It's Official: Hillary Clinton's Campaign Has Been Defeated

It's Official! Hillary Clinton Has Been Defeated In The New Hampshire Primary!!!
Krauthammer: Trump Is a 'Fraud",June,Q2,42
"Sharu Moore (@MooreSenate) is a fighter for Alabama. He is strong on Crime the Second Amendment and will Fight for the incredible people of Alabama! #MAGA
.@FoxNews is going CRAZY with",June,Q2,42
But the administration's attacks on Iran are not enough. We must also continue to pressure the regime of Iranian President Hassan Rouhani. He must show more resolve in imposing a package of economic and diplomatic reforms. Iran must also end its,June,Q2,42
"""I may not be the greatest for every single thing, but I am ready to fight for our great people!""
-- @RepThomasCole @GOP
A great day at the White House for many reasons including the signing",June,Q2,42
"The United States is offering Ukraine a very generous $15 billion bailout package to help it avoid economic collapse and avoid the kind of social and political turmoil that engulfed its corrupt predecessor.
The United States is offering Ukraine a very generous",June,Q2,42
Voters across the United States are expressing deep concern over the poisoning of our drinking water by the oil and gas industry. Hundreds of people have died from drinking contaminated water in Texas and Oklahoma. As a Nation we are watching and,June,Q2,42
Getty Images Sen. Ted Cruz Rafael (Ted) Edward CruzAthletic directors honor best college graduates 'Pound for pound' cannot sustain two tigers other one weaker How the Trump tax law passed: The final stretch Time,June,Q2,42
"The sad part about this incident is that the person responsible will be caught and brought to justice. I hope that all Republicans on this Hill stand with the American people against Radical Islam!
The Radical Left Democrats want to double prison",June,Q2,42
This is amazing news! The New York Times just ran an op-ed by @SenJohnThune (R-AK). He is working very hard to deliver for the people of Alaska. He has my Complete and Total,June,Q2,42
"They have been doing this for years!
This is what a fine job the @CDCgov has done with the Coronavirus. They are able to quickly diagnose and treat all of the cases. Thank you!
",June,Q2,42
I used to have a place upstate NY called the Playa del Rey. A friend of mine used to love it. He was on the top floor with a view of everything. This is where he would go to watch,June,Q2,42
"The Trump/Russia Scam

Special counsel Robert Mueller is investigating whether the Trump campaign colluded with Russia to disrupt the 2016 presidential election

The Democrats wanted to dramatically cut Social Security and Medicare benefits. But they can",June,Q2,42
"The St. Louis Rams have released general manager Les Snead.
Sneed will be very happy with himself and the organization. It was widely reported that he would not be selecting a QB in the 2017 NFL Draft. After",June,Q2,42
"I love it when you guys don't let the Fake News &amp; Social Media do their thing. This is exactly what they are doing!
I will be having a News Conference at 10:00 A.M.",June,Q2,42
Democrats in Congress are in a spin cycle where they are trying to find a way to claim that no Republicans voted no on the Excessive Taxpayer Helping the Illegals Excessive Wall Street &amp; Excessive Medicare,June,Q2,42
"For the second straight night, a gunman opened fire at a Mormon temple in temple security. The perpetrator was shot and killed by temple security. President Trump condemns this cowardly act. This is what happens when you do not have a",June,Q2,42
"Not enough reports to show salary distribution

The best part about being a freelancer is that you get to work with whoever you want.
I always GO OUT OF MY WAY to make AMERICA GREAT AGAIN!
...",June,Q2,42
"The North American Aerospace Defense Command (NORAD) has warned that North Korea could be poised to hit the US with a hydrogen bomb.
A North Korean defector claims the country is preparing to produce a nuclear weapon.
",June,Q2,42
If you ever need a reason not to listen to Kellyanne Conway or @KellyannePolls say it ain't so. @foxandfriends is doing a GREAT job of covering the #Flooding �,June,Q2,42
Congresswoman Frederica Wilson has proven herself to be another tool for Big Bird to use against her once more. So has Congressman Ted Lieu of California. They have proven to be nothing more than tools to be used against the,June,Q2,42
"The 2016 Republican National Convention (RNC) will be held in Cleveland, Ohio from July 18-21, 2016.
This year's All-Star Game will be played on July first.
Thank you to @US",June,Q2,42
My Name is Marvin and I am a National Center for Transgender Equality (NTTE) Adjunct Fellow. I am passionate about advancing the cause of transgender equality and working to advance the cause of all Americans living authentically who,June,Q2,42
"A couple of weeks ago I wrote a post that asked ""Who is the Real Donald Trump?"" The answer to that question is my friend who you may know as @RealDJT. The answer to the question about the true",June,Q2,42
"What would happen if you took the best parts of a 3 year old and made them into a movie? Not bad right?
So those 4 teenagers that got away have to live with this on and on and on. They",June,Q2,42
"Dozens of farmers and ranchers from across the South and Midwest have come together to protect America's Great American Dairyland.
USA!
.@AP just decided to steal my Convention Center in New York. They spent",June,Q2,42
"The world has never known peace or tranquillity like it does now. We have taken the fight to ISIS &amp; other terrorist organizations across the Middle East. The United States will continue to stand with our Allies.
",June,Q2,42
"Elon Musk is a genius. He created the electric car and is making the Hyperloop dream a reality. He invented the internet and the World Wide Web. And most importantly he is a true American hero.
The Fake",June,Q2,42
The Bank of England has just cut interest rates by 0.001% - the lowest since before the financial crisis. As a result interest rates for UK households are going down and we are seeing the most rapid recovery in years.,June,Q2,42
"We love our fast shipping and love our loyal customers. We are expanding our network and expect to have all 4 states by mid year 2018.
At the request of our great citizens of North Carolina and North Carolina by our friend",June,Q2,42
"Species Desmognathus egedahlii - Goldfish - Any Habitat: Any Land and Water Temperament: Any Diet: Any Harvest Season: Any
A very large goldfish.
A very large",June,Q2,42
"A Florida woman says she was groped by a stranger at a New York City bar and said the man then punched her in the face.
Woman Speaks Out About Being Grabbed and Taunted at a New York Bar",June,Q2,42
"The UESPWiki – Your source for The Elder Scrolls since 1995

This article is about the ship. For other uses, see Lighthouse

A lighthouse is a unique structure used primarily by the Imperial Navy to",June,Q2,42
I am always amazed to see how much information is out there on SOPA/PIPA! @SenThomTillis is a great Senator who always votes the American People in. He is Strong on Crime and Borders,June,Q2,42
"The Abbott Government wants you to believe that Scott Morrison's stupid asylum seeker policies are working.
He wants to bring in as many people as he can in as little time as possible.
40% Approval Rating in the",June,Q2,42
"The Vlambeer team would like to thank all our loyal and dedicated players!
PROMISE!
I will be having a White House Press Conference today at 5:30 P.M. Thank you!
....",June,Q2,42
"In what is sure to go down as one of the all time greatest college football games (it almost was) Auburn beat Alabama, the SEC West team, by a score of 38-28.
WE WANT A WIN BUT",June,Q2,42
"The Supreme Court on Monday stayed a key part of President Trump's travel ban on seven Muslim-majority countries.
The 6-3 ruling by the U.S. Supreme Court did not address the merits of the legal challenges",June,Q2,42
The Seattle Seahawks are excited to announce that defensive lineman Kevin Williams will be signing with the Seattle Seahawks. Williams is a versatile player who can play 4-3 DE or 3-4 DE. He grew up in Wheaton Wisconsin,June,Q2,42
"The future of the NBA looks bright. The Los Angeles Lakers are in first place and it looks like they will win the title for a second straight year!
The NBA is in trouble. If they don’t fix",June,Q2,42
"The director of national intelligence has dismissed concerns that the US may be involved in a 'false flag' operation to blame it on North Korea in order to justify military action.
'The United States of America will not be drawn",June,Q2,42
"The Esso gas leak may be the biggest in U.S. history. It is so big that it will take the average American many years to recover from.
The most corrupt administration in U.S. history.",June,Q2,42
