Tweets,Month,Quarter,sampling
The Washington Post is reporting that on Christmas Eve President Trump was extremely angry with his Chief of Staff Joe Lockhart for not telling him that the United States was in conflict mode with North Korea and that the United States was moving rapidly,March,Q1,8
The United States Navy recently closed a port in Thailand and is moving into a second port in Indonesia where they are moving millions of dollars worth of goods a day. They are not closing ports and moving their money. Obama and the,March,Q1,8
"The government of the United States is carrying out a witch hunt against a former employee who leaked classified information to a website.
The real scandal in the White House is that somewhat insane Chief Strategist Steve Bannon is lashing out",March,Q1,8
The House Intelligence Committee on Wednesday released a transcript of the private meeting President Trump and Russian President Vladimir Putin had over the weekend in Florida where the president questioned the veracity of the testimony of former National Security Adviser Michael Flynn and the,March,Q1,8
"Greetings Citizens!


The White House today continued to push the false narrative that President Trump and his supporters are 'unhinged' after being harassed and even physically assaulted by a small group of anti-Trump protesters.",March,Q1,8
"The UESPWiki – Your source for The Elder Scrolls since 1995

Notes [ edit ]

Even though the icy wastes are generally considered to be very cold, and especially in Winterhold are more than 80 degrees",March,Q1,8
"I am going to be visiting Iowa next Thursday.


I love seeing Iowa!


I will be attending the Iowa City Forum on Thursday March 13th at 7:00 P.M. for an event with the",March,Q1,8
Now that we've had a chance to catch our breath from the amazing job that the Federal Government is doing to get us through this terrible time we're in we need to take a deep breath and get back to work. This,March,Q1,8
"I have been rubbing salt in the wounds of the Progressive Left ever since the election of Donald J. Trump!
The Democrat Party is in total disarray!
The Democrats have given up on replacing the dead Progressive Republican leadership",March,Q1,8
"The Detroit Tigers have agreed to terms on a minor league contract with free agent First Baseman/Outfielder/Outfielder Mike Victorino of the New York Mets.
The New York Mets have agreed to terms on",March,Q1,8
"Nigeria's Vice President, Shehu Idriss has referred to Donald J. Trump as ""Pocahontas"" in front of the entire world. This comes just a few days after Pocahontas",March,Q1,8
Our friends at the Centre for American Progress have a great new book Outliers: How Proving Silly Predictions Can Save Your Company and Your Life. In it they discuss how many times Bill Belichick has been wrong about,March,Q1,8
"The family of a 5-year-old Florida girl who was swept away from her family says she died at a San Antonio hospital.
Jada Pinkett Smith is pictured here with her parents and older sister as they watch",March,Q1,8
"President Trump said Thursday that the Senate should get back to work on healthcare legislation. He did not say if he was joking. The Fake News Media refuses to report the truth!
.@CNN and the Do Nothing Democrats are",March,Q1,8
"Two top Democrats on the Senate Judiciary Committee are asking Amazon chief Jeff Bezos whether he broke the law by selling classified information to Russia and China.
Seriously? 
This is treason!
.@MaggieGrahamNC",March,Q1,8
There is no quick fix to this situation. If you like your doctor you are going to have to go to work with him or her very soon. If you like your healthcare plan you have to like your Doctor and the quality,March,Q1,8
"FREE SHIPPING ON ORDERS OVER $99!
This amazing photo shows a very lucky infant in a very bad position. He should be in the hospital right now. The photo was taken by a nurse who was",March,Q1,8
"This is a conversation between You're fired. We're going to take Care of Business! (glares at you) .
...and he then goes and then takes the opportunity to growl at you. This is not",March,Q1,8
"The White House has confirmed that the President will not be attending this evening's Republican National Convention in Cleveland OH.
President Trump is not happy with both the mainstream media and all of the people that don’t always agree",March,Q1,8
"Joe Biden is doing nothing to help the American people. He has absolutely no idea what he is doing.
'We Can't Let Trump Burn America Down Again.' ... 'We Can't Let Trump Burn America Down Again.",March,Q1,8
This wedding was our first for over a year and our reception was the biggest in the area. We had over 3500 guests and our garden was THE RIVALENCY OF the area. The wedding venue was beautiful the reception,March,Q1,8
"And yet when it comes to the refugee crisis this country is the most generous country in the world!
McCain on Refugee Crisis: 'We're the Most Generous Country in the World' (Report)
Cruz on",March,Q1,8
"Antonio Brown is going to be worth more than #BrownReport. — David A. Fahrenthold (@AFreemanABC) October 21, 2014
The Democrat party is back. They are finally waking up",March,Q1,8
"About This Game

A richly detailed universe where you will find everything from pirates to gladiators to humanoids


Huge and ever-evolving cities like Istanbul, Constantinople, and other great historical sites
",March,Q1,8
"Many of you who are always here with me in spirit are already experiencing the wind chill especially in the Lower 48 states. The feeling is very good!
People are leaving Washington D.C. every day. Many are staying",March,Q1,8
"It was an abnormal and unprecedented morning on Central Park West in New York City.
President Trump climbed 700 feet into the New York skyscraper to watch the American Eagle Winter Olympics Winter Games Hockey World Championships and Olympic Fireworks Display",March,Q1,8
"Tens of thousands of people have gathered in Washington DC to celebrate the birth of our nation's 75th President.
The mainstream media are staging a Poodle &amp; Papillon demonstration. They are not bringing you the",March,Q1,8
"They are amazing young men and women who have sacrificed so much for our country. They are the true American Dream Family First!
Thank you Laura. We love our Republican Members of Congress. We are stronger &amp; smarter",March,Q1,8
"Promoted by Stephen Colbert and others as his New York Times Best Book  it is a complete fabrication made up to suit the Democrat Party &amp; the President of the United States.
Congress should not be",March,Q1,8
"President Trump on Sunday retweeted a video that showed him warning a child that he would be killed by a monkey.
The United States of America will no longer allow JOKER to TAKE OVER our Country!
The",March,Q1,8
"The United States is considering lifting a ban on Canadian crude oil exports to Britain, as the United Kingdom braces for a potential shock from a weakening pound.
The United States is considering lifting a ban on Canadian crude oil exports to",March,Q1,8
"The biggest issue facing the Democratic Party is that it is not as radical as it looks.
....Democrats want to get rid of the Supreme Court. Republicans want to keep the Supreme Court. The Dems want to get rid of",March,Q1,8
"The Philadelphia Union and former Manchester United player Danny Welbeck are in advanced discussions on a deal for a reunion, sources have told ESPN FC.
ESPN FC has learned that former Arsenal striker Danny Welbeck is in talks with the",March,Q1,8
"A number of Republican Senators are now calling for a special prosecutor into the Trump-Russia connection. Why? Because they are now convinced that there was a cover up!
The Democrat Party in the Senate and the House are working",March,Q1,8
"A group of students at Jackson State University are fighting back against a recent statement made by the president.
The Jackson Free Press is suing the University of Michigan for defamation for printing a statement falsely threatening the students of Jackson with expulsion",March,Q1,8
"The federal government is offering a $5.75 million reward for information leading to the arrest and conviction of the person or persons responsible for a home invasion in the community of Alma on Tuesday night.
The incident was reported to",March,Q1,8
"This study was conducted by Infant and Young Adult Psychiatrists for the U.S. Department of Health and Human Services under a grant from the William J. Clinton Foundation.
DOJ: The Media are the Problem not",March,Q1,8
"Access to the Internet is a fundamental human right. The Trump Administration will fight for it as it did under the previous Administration!
We have set a new all-time high for gas prices thanks to President Trump's hard work",March,Q1,8
"An estimated 400,000 people are left without power in Australia after a powerful solar storm.
I love Australia. Great people great food great people great energy. I love it all.
USA is a disaster. I am",March,Q1,8
NEW DELHI: A group of six Indian Air Force aircraft and four Navy aircraft have begun landing at the Shahbagh airbase in Afghanistan.India has been urging Pakistan to land its aircraft there since early last year. However,March,Q1,8
"Pork Chops Are Harder To Find But You Can Always Count On Me. — Donald J. Trump (@realDonaldTrump) May 3, 2017
A great person. A true fighter!
A disgusted A.G.",March,Q1,8
"Sure, it was a long shot but I'm glad I did!
I just signed the SAFE ACT!
They said I was going to Mexico but I was told I could go wherever I wanted!
I just",March,Q1,8
The United States and Turkey have agreed to resolve a long-standing border dispute through direct talks. All parties have been and continue to be fully and fairly informed of the exchange. I look forward to continuing to strengthen and expand these,March,Q1,8
"Theresa May has told her Cabinet colleagues that the Government is at last prepared to discuss the re-establishment of the Air Accidents Investigation Branch (AAIB) as part of her renegotiation of the Human Rights Act.
",March,Q1,8
"The NFL will be hosting a public meeting on the Oakland Raiders decision to relocate to Las Vegas. It will be held at the Oakland-Alameda County Coliseum at 2pm PT on Thursday, February 10.
The NFL will",March,Q1,8
"The Trucking Industry is in for quite a treat when President Trump signs the Bipartisan Trucking Infrastructure Reinvestment Act.
The Senate passed this bill by a vote of 51-46. Thank you to our great",March,Q1,8
"The following blog post, unless otherwise noted, was written by a member of Gamasutra and not in our company.
The last thing we want to do is to be too hard on our competitors.
I have been",March,Q1,8
"This is a rush transcript. Copy may not be in its final form.

AMY GOODMAN: We end today's show with the release of the Panama Papers. The documents leak shows how the billionaire class is getting even richer",March,Q1,8
"The British people clearly want their Prime Minister to stand down!
The Brexit vote was a disaster for the United Kingdom!
The VA is in turmoil!
I was just informed that the USA has reached a $3.",March,Q1,8
"The history of the study of neurology is a rich one. Since its creation nearly 100 years ago it has provided the foundation for the medical profession, one of the most important fields in mankind's history and a field that continues",March,Q1,8
"The House Intelligence Committee is reviewing recently declassified documents related to the CIA's detention and interrogation program.
The documents revealed that the CIA did not follow the Memorandum of Understanding it had signed with the Department of Justice to """,March,Q1,8
If you are like me you are looking for something different. You are looking to discover something you've never experienced before. I love to travel and explore new places! I love riding my bicycle and running errands. I love,March,Q1,8
"The San Francisco 49ers have re-signed safety Donte Whitner.
The San Francisco 49ers have re-signed safety Donte Whitner.  #49ers 
Donte Whitner has been with us",March,Q1,8
The national conversation around the Keystone XL Pipeline is at an all-time low. Even the most die hard environmentalist I know doesn’t think it can get any worse. The President of the United States only said �,March,Q1,8
"A polarizing figure who has clashed with both Republicans and Democrats over his support for the North Korean regime is now back in the news after receiving a rare round of applause at a White House news conference.
Press Secretary Sarah Huckabee",March,Q1,8
Johnson: Trump 'a total phony' on UC Berkeley Berkeley Police Chief: I SAW HIM STANDING BY HIM MYSELF 2 TIMES MOST PERMITS EVER BY A POLICE DEPARTMENT HEADING TO,March,Q1,8
"The Department of Justice is investigating whether Trump campaign officials colluded with Russia to win the 2016 U.S. presidential election.
This is NOT a witch-hunt. Everyone in government and law enforcement knows this and is working",March,Q1,8
Michael Moore (@MMFlint) is a stand-up comedian who recently wrapped up his 7th season on @CNN. A truly talented and talented man. Always looking for new angles and using the most outrageous and outrageous names,March,Q1,8
"Our team of highly skilled and dedicated social media experts is here to help you maximize your impact and maximize your money back guarantee. Our social media experts are here to help you:
“Tweet @PurdueUniversity
�",March,Q1,8
"The next time you're at a restaurant or bar and you want to order something fast and frugal, try serving cold drinks. Drink on the go or cool your drink down with a cold beer. Cold drinks make you",March,Q1,8
The Democratic National Committee (DNC) and Hillary Clinton have been exposed as the same corrupt entity they have always been. The DNC &amp; Hillary Clinton stole the Democratic Party nomination from Bernie Sanders. They are now the party,March,Q1,8
The New York Times editorial board decided that Chelsea Clinton should be impeached because she lied about her husband's sexual misconduct. The men who sexually harassed and assaulted countless women for decades should have their day in court. The American people,March,Q1,8
"You've come a long way in your life.
As President I have directed the Department of Homeland Security and local law enforcement to take care of those in our communities that have come in need over the last several days. We",March,Q1,8
"Floyd Mayweather vs. Conor McGregor is scheduled to take place on Saturday night at the T-Mobile Arena in Las Vegas Nevada.
A look at some of the other strange and/or illegal things that have taken place in",March,Q1,8
"The United States has agreed to make the land it occupies in Iraq and Syria its ""indispensable base of operations"".
The deal is the biggest military build up ever made in such a vital region - Syria Iraq and potentially",March,Q1,8
Bernie Sanders has called for an end to the War on Drugs and a reinvigorated strategy to defeat the Radical Republican Party. He has strongly supported our efforts in Afghanistan and he will continue to do so in the weeks and,March,Q1,8
"After the final whistle of the Men's National Team scrimmage at Stanford, the National Team was given a warm welcome by thousands of U.S. and Canadian fans.
I know it was a long time coming but we can",March,Q1,8
"As the United States and many other nations around the world try to stem the spread of the Zika Virus we are starting to see that some countries are much more affected than others. These are the countries we are working with:
",March,Q1,8
"Come join us for our Third Annual Brew and Auction at the @BakersfieldEmpire! This event is FREE and open to the public. This event is an opportunity for Breweries, Food Trucks, and anyone else",March,Q1,8
"The League is proud to announce that the San Francisco 49ers will host the 2017 Pro Football Hall of Fame Induction Ceremony on Friday, January 26th at Candlestick Park in San Francisco, CA. The event is",March,Q1,8
"The NBA team that lost in the 2015 Western Conference finals will have a new home for the 2017-18 NBA season on Sunday night when the Golden State Warriors take on the Cleveland Cavaliers.
It will be the Warriors 30th",March,Q1,8
"Pastor: I'm Not Afraid to Speak Out on This Christian Issue!
ABOUT US
The Family is a worldwide coalition of Christians dedicated to the rescue of millions of unread phones from child sex trafficking. We",March,Q1,8
"The National Security Agency may have been illegally collecting data on millions of Americans, but according to former CIA and FBI officials the Obama Administration and the Democrat Party in general was rife with treason and National Security Lies.
The Democrat Party",April,Q2,8
"The Federal Trade Commission (FTC) has sent a letter to the City of Pittsburgh asking for information on the number of instances of lead paint leaching from the building under construction.
Lead paint leaches from City of Pittsburgh",April,Q2,8
"SACRAMENTO (CBS13) — California lawmakers are considering a bill that would make it easier for parents to fire their children from their jobs.
State Senator Ricardo Lara sponsored Senate Bill 7. It would only apply",April,Q2,8
"DUBAI // ""Iran is in the final stages of an attack on the United States.""
That is what President Trump tweeted just moments ago as Iran continued to bomb the US in retaliation for a missile launch and a",April,Q2,8
"Testing for Ebola in the UK Has Been Ongoing Since November
Testing for Ebola in the UK Has BEEN OCCURING UNTIL NOVEMBER.
The U.S. and U.K. must",April,Q2,8
"This article is about a/an TV series character. You may be looking for a/an individual.

""I am the Big Brother of the Mighty Morphin Power Rangers! Together we stand against the Invasion of the",April,Q2,8
"ANDREW BUSH:
Well I think it's very important that we keep the pressure on Russia because if they don't they are going to feel very badly about themselves. And I think that includes the United States.",April,Q2,8
"At least four people have been killed and several others injured when a truck plowed into a crowd in the Bavarian city of Würzburg, killing at least one person and injuring at least four more, police and local",April,Q2,8
"A man who was recently identified as the man who tried to blow up a Phoenix area Starbucks has been identified as Joseph Scott Harris.
I am very happy to report that the local news has identified the man who attempted to explosion",April,Q2,8
"more-in

A decade ago when India signed the USA-China Economic Corridor Agreement (ECCA) the Prime Minister of India at the time at that time had no idea that soon after he signed into law India would",April,Q2,8
Senator Rand Paul Randal (Rand) Howard PaulA Senator Gary Johnson could be good not just for Libertarians but for Senate too Conservatives left frustrated as Congress passes big one bill should prepare to wane as jobs situation is headed,April,Q2,8
"POPULAR

The mainstream media are now falsely reporting that President Trump had asked the United States to tear up the Paris Climate Accord. Nothing could be further from the truth. President Trump never asked us to do anything other",April,Q2,8
"In a surprise move the Obama Administration has approved the sale of 6 MM Round Missile Pod to the Philippines. 7MILLION Round Missiles. Great for the Philippines and the World. Great news!
....Who knows what",April,Q2,8
"We have been in contact with the families of the people killed and injured in the Orlando nightclub shooting. Our hearts go out to their loved ones at this very difficult time.
The USA is with you 100%!
The",April,Q2,8
"Has anyone else noticed that the Trump campaign has all of the logos and branding of the Russian mob and totally and completely ripped it all off. I wonder if they are going to sue. No wonder they lost so badly.
",April,Q2,8
"In a stunning development that could have dire economic consequences for the United States, the International Court of Justice (ICJ) has ruled that the United States is in contempt of court for blocking the reopening of a US court.",April,Q2,8
"The most common way we get our information is through newspapers and magazines. To keep a system that has proven to be so successful open up even more opportunities for abuse and corruption.
I have tremendous respect for Senator Manchin.",April,Q2,8
"The man who helped lead the charge against the Islamic State of Iraq and the Levant has been killed in Syria.
BREAKING: US Navy SEALS kill &p_leak of info on special Forces killer. We already",April,Q2,8
"SHARE THIS ARTICLE Share Tweet Post Email

McDonald's Co. will open 12 U.S. restaurants in 2016, more than doubling the number it opened in 2015.

The fast-food restaurant chain plans to",April,Q2,8
"This is the story of how our wonderful Air Force Academy turned into a war zone. Innocent students and teachers were slaughtered in cold blood by radical left wing students. It all started with a Facebook post.....
...And it will",April,Q2,8
The most important thing the Government can do is to stop the Fraud and Abuse. These are the same people that said Mexico would pay for the badly needed Wall. They are now saying we can afford it. Thanks for the Guide,April,Q2,8
"The Dutch government is spending millions of euros on a controversial new prison to hold the world's most wanted man.
Inmates will scream 'Freedom' when they arrive. Already beaten immigrant will be killed.
Hundreds of homeless",April,Q2,8
The ACLU of Michigan is proud to announce the appointment of Lauren Southern as the first female Deputy Attorney General of Michigan. Lauren was sworn in as Deputy Attorney General on Friday and immediately began working to protect the public from the threat of,April,Q2,8
"Democrats are desperate to destroy my Presidency but I will not give up!
We have just seen yet another example of the total dishonesty and fake news going on with the Kavanaugh Accusation. The Democrats are now using the",April,Q2,8
"The most important thing is that we get those two dogs back home. My heart goes out to them and their amazing families.
Just spoke to President Putin of Russia and assured him that we will quickly return the FASTEST",April,Q2,8
"The leader of a Gulf Cartel that has killed scores of drug dealers has been extradited to the United States to face charges related to the 2014 killing of Joaquin ""El Chapo"" Guzman.
U.S",April,Q2,8
"Venezuela's President Nicolas Maduro gestures as he departs after a meeting at the presidential palace in Caracas December 19, 2015. REUTERS/Marco Bello
Good morning!

Wow!
Thank you!
",April,Q2,8
"READ THE TRANSCRIPTS: The State of Wisconsin v. David Boies. (FRONTLINE)
I am pleased to announce that our law enforcement and first responders made the incredible progress that is necessary to keep",April,Q2,8
"These are extremely good cigars. I like them both hot and cold. Good smoke flavor. Definitely buying more!
Just finished a great Smoke for my husband and I to finish the work day off on. Great Job Guys in",April,Q2,8
"The Canadian Press


OTTAWA -- The federal government is looking at streamlining some of the costly and time-consuming processes it uses to determine which companies will get foreign investment and which will not.
That's because",April,Q2,8
Instead of focusing on what is right for our Nation this election cycle the #GOP is talking about @SenWarren MAJORITY VICTORY! Also they are talking about Crooked Hillary +BEST IN PRESIDENTIAL ELECT,April,Q2,8
The President and the Congress have just approved a record $4.2 Trillion Federal budget. This is the largest one-time budget increase in the history of the Federal Government. It will allow us to continue our economic recovery,April,Q2,8
"The UCI has announced a five-rider provisional WorldTour squad for the Rio 2016 Olympics.
Leonardo Nocentini (ITA)
Italian World Champion Nocentini (33) has retired from MotoGP after",April,Q2,8
"Just because you aren't a Republican doesn't mean you can't be an asshole!
We will be going to Michigan on Tuesday!
The Democrat Party has lost Michigan. They put them in play but it was too little",April,Q2,8
"Opinion writer

(CNSNews.com) - The number of Americans filing for unemployment benefits actually fell in March from the previous month, which suggests that the Labor Force Participation Rate (the percentage of the U",April,Q2,8
"The Employment Equity Project (EQP) is a national, non-partisan network of dozens of leading labor organizations committed to advancing fair work and equal pay for equal work. Led by the Service Employees International Union (SEIU",April,Q2,8
"In an important opinion for all Americans it is announced today that Justice Antonin Scalia has died aged 84. Justice Scalia was a towering intellect and a true American hero. He will be deeply missed by so many.
The United",April,Q2,8
"That's right!
Loyal Democrats LOVE ObamaCare!
Thank you! #KAG2020
THEY CANT EVEN FIND THIS COMING TO THEM!
The Democrat National Committee and the state parties should be ashamed",April,Q2,8
"Notorious Democrat Operative James O'Neill (who was convicted of Looting just last week) is now Director of Legislative Affairs for the National Association for the Advancement of Colored People…
I am so proud of",April,Q2,8
"This is the fifth because of the many people who have spoken to me about the amazing support we have been getting and this is just the beginning!
“Republicans are trying to destroy one of the great political forces of our",April,Q2,8
"A couple of weeks ago I wrote about how the Republican Party was trying to get you to think they are the party of small business. My point was that the Republican Party is all about the wealthy and powerful....
....and",April,Q2,8
"The United States has demanded that Germany pay reparations to the victims of the Holocaust.
Germany has refused to pay. The United States has now demanded that they pay a fair amount of money back.
Our great National Parks",April,Q2,8
