Tweets,Month,Quarter,sampling
"My Santa was awesome!
I got a pretty cool metal mask with the Texas Longhorns and the word ""BEST"" on it!
Santa also got me a really cool signed book called ""The Art of Football""",March,Q1,18
"Based on his brilliant and popular book ""The Art of the Deal: How to Win Over Women and Influence Their Lives"" President Trump offers a totally new and totally powerful approach to women's issues. He is strong on Crime and",March,Q1,18
"For the second year in a row, children from impoverished families across the nation will lose their great education options when Congress does NOT act on funding for the National School Lunch Program. This is unacceptable and I will always fight for smaller",March,Q1,18
"We have been lobbying the Prime Minister to approve the delivery of the Arleigh Burke class destroyer to our great country!
Great news! @PeteHegseth will be joining me in the @WhiteHouse for the",March,Q1,18
The City of Atlanta is having some serious problems. They are putting the lives of our very happy young men and women in uniform at risk for a political rally and a political rally only. This is what happens when you do not,March,Q1,18
"The 2016 presidential race is shaping up to be a record-breaking one, and the early returns are extremely good for the Democratic Party. This includes the fact that over 1.3 billion votes were cast, and that the 2016",March,Q1,18
"This article is from the archive of our partner .
China, Russia and Iran are all behind a United States plan to send over 8,000 troops to Afghanistan. The move will be in support of American forces and the Afghan",March,Q1,18
"The main purpose of my blog is to inform the public about the scientific findings that support my Administration's approach to climate change. However, I also want to let people know that they are not alone. There is overwhelming scientific and",March,Q1,18
"We learned today that President Trump spoke with Prime Minister Abe of Japan. They spoke for over an hour about many subjects including the current situation in the Middle East and many more!
Great call with the Prime Minister of Japan.",March,Q1,18
"Who Was the First Black President?

The United States is the first and only country in the world to have a black president. Who was the first black president?
The United States is the first and only country in",March,Q1,18
"This is a cross stitch pattern of a dog with his leash and collar clipped. This is a wonderful dog to knit up!
“In the Olden Time when Horsepower was a small part of the equation a man",March,Q1,18
"It's official! The United States has officially selected the second female presidential candidate after being chosen by the United Kingdom. Congratulations to our very lucky second choice, Hillary Clinton!
I will be making a HAPPY SECOND",March,Q1,18
The Colorado Avalanche are currently 2-1-0 in their last 3 games. The last time they had such dominance was back in November of 2015 when they won their final 4 games in a row. With that kind of dominance,March,Q1,18
"Fifty-nine per cent of Australians believe that the Government is doing a good job doing the job it was elected to do, a new Essential Poll has revealed.
The Essential/Field Poll also shows that despite the Government",March,Q1,18
"The Russian government wants you to know that this is a very important moment and that you should always be on watch! So be sure and be ready!
....to do nothing and allow the crime to continue. A full and",March,Q1,18
"When I was about 6 years old I would sneak into my grandparents room and peek at all of the drawings and pictures that he had made of me growing up. So very well done! Love my grandfather!
CONGRATS",March,Q1,18
The U.S. is the only country in the world that gives citizens the right to be arrested without trial any more. The murderous and corrupt officers who killed our neighbors and loved ones are now free to murder and steal even,March,Q1,18
In the last few years the number of Americans filing for disability claims has decreased considerably. In fact in the last 3 years the percentage of all Americans that are filing for disability claims has gone up dramatically. In fact over the last,March,Q1,18
"This is a repost from last week's newsletter of our Executive Board.
I am pleased to announce that two of our great young leaders in the Senate have joined our Board of Advisors. These two gentlemen are strong supporters",March,Q1,18
"Last week I published the analysis released by the Campaign for Accountability on the Justice Department's Operation Fast and Furious. This is the analysis I used to conclude at the time that:
The Justice Department has been found in serious violation",March,Q1,18
"Although I was the victim of a fake News story I never said that he choked to death!
He is the most Anti-Trump person ever to seek the Presidency. RUSSIA!
The only way to stop the",March,Q1,18
"NSA: Russia to Pay $500 Million to China for Election Rigging
And now we learn that Russia will be paying China $500 million to cover the damage that they caused to the U.S. economy by rigging the",March,Q1,18
"The 3rd TV Animation of the Disney Channel series ""Brave"" has been greenlit by Disney for a spring 2016 release.The episode will be titled ""Darker Side"" and will premiere on April 25th 2016 at 6",March,Q1,18
"WASHINGTON ― President Trump wants to know why he's not getting the investment returns that other successful businessmen are getting.
""My ratings are far better than any of the other companies that are sitting here,"" Trump said in an interview",March,Q1,18
"The U.S. Supreme Court ruled 4-3 yesterday that the federal government cannot force doctors to violate their religious beliefs and provide illegal drugs to patients.
This ruling does not just affect us here in the United States....",March,Q1,18
"What about this?
For the second time in a week, a patriot was shot and killed by the leftist police. This time it was a 19-yr old white boy named Freddie Gray. Yes he was a walking bag",March,Q1,18
"The nation is still reeling from the devastating earthquake and tsunami in Japan. We ask the American people for patience as we gather more information.
Thank you!
....the United States is still the most populous and economically powerful nation",March,Q1,18
"The NFL Draft is less than two weeks away and the Philadelphia Eagles are now in a position that they did not know they were in.
I am so excited to report the signing of former New York Giants wide receiver Hake",March,Q1,18
This week there's probably nothing worse than having a conversation with someone that you know doesn't have the most positive feelings about you. That person is likely to be you. Please know that I love and admire many of you and,March,Q1,18
"And if they don’t want to go along with the TPP they can just leave. — Donald J. Trump (@realDonaldTrump) November 10, 2013
Will be the biggest ever trade deal done in Commerce and very good",March,Q1,18
"The Democratic Party really should stop treating Bernie Sanders and his supporters like they're the party of the forgotten men and women of America.
.@RepChrisCollinsNY27’s office is being investigated for a very strange",March,Q1,18
"Great news everyone!

Great news everyone!

Can this be true?

This is what the corrupt mainstream media looks like!

News conference planned in 15 minutes!
Interesting!
This is",March,Q1,18
"THEY are the greatest ever!
THEY are the greatest ever!
Tonight at 10 P.M. Eastern we are also holding a White House Press Conference by request of a few. Thank you to everyone for your",March,Q1,18
"The Obama administration has decided to abandon its campaign pledge of providing legal status to millions of illegal immigrants. Instead they are now saying that they will only give them a conditional ""deferred action"" so long as they obey the law",March,Q1,18
The number of US troops in Afghanistan has dropped to 28400 from the peak of 50k. The number of Afghanis we are fighting has also increased. As you will see in the video below the number of Americans killed fighting,March,Q1,18
"And then there's this:
Seth Rich was a source for the DNC. He had no information about the leak or any collusion with the Republicans. He was in the building all the time talking to people about the DNC",March,Q1,18
"Venezuela: Venezuela is now the world's number one country for fake news!
Here is another fact check from @scotuslearned:
.@FoxNews Poll: ""Half (50%) of Republicans",March,Q1,18
The following is a transcript of a speech delivered by former Secretary of State Madeline Albright on the 35th anniversary of the U.S. invasion and occupation of Iraq. Please note that the following audio is not presented in,March,Q1,18
"The UESPWiki – Your source for The Elder Scrolls since 1995

This article is about the province. For the faction of Skyrim , see Frostfall

Frostfall is an organization dedicated to helping people escape",March,Q1,18
"While you're at it, why don't you get a tee and join the people of Kansas City in getting this stupid statue of a man taken down.
Small town police chief in Texas is fired after saying that if Trump",March,Q1,18
"Death toll in Gaza rises to at least 18 as Israel attacks targets of Hamas rocket fire
Israel has now killed more Palestinians since it launched its offensive in Gaza in late August than at any point in the last 13 years according to",March,Q1,18
"The Russian official who was caught in the US trying to help his country's ally Sweden and getaway with Hillary Clinton emails has now admitted to being the source of the misleading material being sent to the US.
This will cause",March,Q1,18
"""I hope they bring him back to court!"" Trump tweeted Monday morning after learning of the indictment. ""I hope Sessions RIGGED the Judiciary in favor of the Prosecution. A total 'No thanks' to a",March,Q1,18
Kristan Hawkins is a reporter for The Hill. Her work has been recognized by the Associated Press as one of the top five most important in the news industry. A native of Florida she has covered politics and government in New York,March,Q1,18
We are building a better tomorrow for millions of Americans who are working hard to get there. Today I am announcing a $40 Billion investment to Make America Work better. Here are the Jobs it will create: 1. Manufacturing,March,Q1,18
"In a 2011 interview with CNN, President Obama said that we needed to do more to help small businesses in the U.S. This includes tax credits and incentives for small business and investment in our infrastructure.
I am asking",March,Q1,18
"The National Organization for Marriage sued a Virginia school district on Tuesday, claiming that the school has a ""duty to protect students from the hateful messages and messages of hate that have followed the Supreme Court's decision to legalize same-sex",March,Q1,18
"We are so pleased to announce the return of the Premier League to Sky Sports. Until now, Sky has only carried the top three leagues in England and the top flight in Scotland. We look forward to providing our fans with one",March,Q1,18
"The Woman Who Kept Her Kids Safe When Trump Was Elected President

The Washington Examiner just reported that the FBI Director has determined that the so-called Russia Hoax was an inside job by the Russians.
The",March,Q1,18
"The United Nations has become a haven for anti-Americanism and corruption. The only people getting rich from this are the very rich people who stole our Election!
The United Nations is a haven for anti-Americanism and",March,Q1,18
"How to debloat a loaf of bread
I am so glad to see that many of you are enjoying your Thanksgiving dinner. That being said I have a few things for you tonight. I hope you enjoy them. ",March,Q1,18
"The New York Post is reporting that President Trump was furious with the paper for publishing classified information and called them a ""failing pile of garbage"" on Sunday morning. Sounds familiar....
....Trump is reportedly furious with The New",March,Q1,18
"The Democratic National Committee (DNC) and Hillary Clinton's campaign have put out misleading statements that are not accurate.
The Democratic National Committee (DNC) and Hillary Clinton's campaign have put out misleading statements that are not",March,Q1,18
"The St. Paul Police are investigating after a young black man was shot and killed by police Friday night in Minnesota.
The St. Paul Police Department is currently investigating the death of 18-year-old Laquan McDonald",March,Q1,18
"Report: Chris Christie 'Lose' More Than $21M In New Jersey Casino Money
House Republicans Are Holding a Hearing on the Fast & Free Clinic Bill. Watch:
With all due respect to Senator @TimScott",March,Q1,18
"Protesters commit voter fraud at the Branch Davidian Ranch in Waco Texas on April 7, 2014. REUTERS/Ron Edmonds

By Ben Protess
WASHINGTON (Reuters) - The Obama administration on Thursday said it",March,Q1,18
"I call it what it is. A BEAST!
“Trump: Media Is Afraid of Me because of Bad Metacritic”
Bannon is a beast!
Zero tolerance!
“They",March,Q1,18
"Paperback (288 pages)
❮️The most anticipated book of the year!❯
I AM PRETTY SURE THAT ON DAY ONE OF MY ELECTION I WILL BE PREPARED TO PUT",March,Q1,18
"It was in the midst of the deadliest Ebola epidemic in history that the United States had a very good reason to send a very small number of our very best people into the field.
The United States has sent over 500 doctors",March,Q1,18
"The word ""moron"" is a loaded word to be tossing around around with someone who voted for you.
The Democrats have thrown in with the Republicans in the most unbelievable way. They are the Radical Left!
I",March,Q1,18
"The City of Los Angeles will pay $6.5 million to an undercover cop who was kicked out of the Creamy State for filming himself and his partner in a police van punching down. The cop, who was later fired",March,Q1,18
Who We Are We are the Union of Californians for a Stronger California. Our mission is to strengthen the fabric of our communities by: Providing affordable health care Coverage of important social programs Education and workforce Training and development Stre,March,Q1,18
"Not all of them are bad, just not as bad as they think. They cannot convict me of a crime or anything else. I signed a Waiver of Immunity and am not a witness against them. Also I don�",March,Q1,18
"In September 2012, my brother and I published our first book, ""6-2: The Price Of Loyalty and American Greatness.""
In January 2017, the Fake News Media once again tried to defame our work",March,Q1,18
"Our team has been working around the clock to relaunch our website and improve your shopping experience. We will keep you posted as soon as any details become available.
CONGRATULATIONS TO THE UNITED STATES!
Never",March,Q1,18
"AP

The Bengals are interested in signing former Jets and Vikings safety Eric Berry, according to ESPN's Adam Schefter.
Bucs all-time leader in wins.
@RavensNews Eric Berry is a",March,Q1,18
"The University of Michigan has found itself in hot water after a video surfaced of University of Michigan President Dr. Mark Schlissel suggesting that it would be politically expedient for the United States to attack Syria because of the ""evil",March,Q1,18
"Dozens of protesters were arrested after smashing windows and setting stores on fire during President Trump's Inauguration Day parade in Washington, D.C. Wednesday.
This is not the first time police have been blamed for the",March,Q1,18
"PRINCETON, NJ -- The percentage of Republicans who say they are very or somewhat concerned about the safety and security of the people in their area is up 11 points from last year. The percentage saying this of whites has",March,Q1,18
"THE GREATEST MANHATTAN HOAX IN HISTORY!
LAW &amp; ORDER!
Thank you Mark!
Betsy DeVos is a Wall Street Democrat that got caught stealing money from students. She",March,Q1,18
"The Mystery of the Whistleblower Who Got Caught Stealing Intel:
But this is all part of the larger and more sinister plot to destroy the U.S. and to steal our jobs and prosperity. The",March,Q1,18
"The epicenter of the Ebola virus outbreak in West Africa is in Liberia, not Guinea as previously reported. If this was the case the outbreak would have been contained much earlier and the deadly virus would not be circulating. As it",March,Q1,18
A: As was noted by the President a very large number of our Country's farmers are SAVING &amp; REWARDING OUR COUNTRY! As others have pointed out many of these farmers are making a LOT of,March,Q1,18
The folks at Draftkings are probably the most accurate and reliable rankings and odds sites around. They are absolutely absolutely correct on any given week and I guarantee you that on most weeks. This week they have it at 87-,April,Q2,18
"We are all in this together.
I will always be grateful to President Obama and the entire Democratic Party for our assistance in bringing this historic &amp; historic criminal enterprise to justice.” @Jim_Jordan
The",April,Q2,18
"Our mission is to inspire and empower people around the world to live and work with greater purpose and purpose they will live forever!
The people that want to beat us lose every time. We are stronger and smarter than them!",April,Q2,18
"The following article appeared in the Daily Caller on August 23, 2016.
Democrats are trying to steer the 2018 midterm election back toward President Trump and his agenda by using the Witch Hunt against him.
Stay strong America I",April,Q2,18
Mainstream media is not doing its job. They are not objective they are partisan. The Democrat Party did not win the popular vote. They lost the election. The media did its job and now the real victims are Republicans.,April,Q2,18
The University of North Carolina at Chapel Hill is taking steps to resolve a gender bias problem that has been revealed by this newspaper's investigation. We are fully cooperating with the investigation and hope to offer further details when available.<|endoftext|>Having,April,Q2,18
"You know who's getting a break right now? The elite few who are taking your healthcare away. The very rich people who want to hide behind ObamaCare. And the medical establishment that sold you on ObamaCare.
MAKE AMERICA",April,Q2,18
"The original and perhaps the most important game in the history of the World of Warcraft®. Now with even more content including:
Real-Time World Events
The Finest!
You can play this game for free for",April,Q2,18
"It was a long night for Reddit.
Hours after a major backlash over the site's decision to remove a conservative commentator from the service for criticizing President Trump, the company has since apologized and pulled the plug on which users to",April,Q2,18
"A three-year old boy was injured Saturday morning after falling from a second floor window while playing in downtown Minneapolis.
The child was taken to Hennepin County Medical Center where he is listed in fair condition with minor",April,Q2,18
"The United States has agreed to supply Afghan security forces with a Russian-made anti-tank missile system in what could be the first step in the development of a more powerful anti-tank weapon in the Afghan arsenal.
The",April,Q2,18
Retailers are reporting that the Trump Hotel in Washington D.C. is the biggest ever hotel opening in the United States. The hotel is set to break the previous record of two hotels opening in a day set by the,April,Q2,18
If you've been faithful to the Danville School District you know that we have our work cut out for us. A few weeks ago we were put through the paces by our local and national competitors in the new PARCC,April,Q2,18
The Department of Education (DOE) has been caught lying to the American people and the American people are getting what they paid for. They got the phony and fraudulent information that was issued by the Do Nothing Democrats when the REAL,April,Q2,18
If you love the Dallas Stars organization and your team is playing in the @NHL Draft Lottery you have two options. You can stay home &amp; watch your team lose which is what they have done 100% of,April,Q2,18
"Halloween is almost here and you know what that means! A lot of things to do and see. From the biggest Haunted Houses in the World including Transformers: Age of Extinction (Halloween Shock!), Mad Max: Fury",April,Q2,18
"While it's true that the Affordable Care Act is working incredibly well for our country, the Dems want to strip it of its very existence.
Thank you to @NASA for your leadership on the Syria Humanitarian Scam.",April,Q2,18
This morning I received an email from a very knowledgeable person who knows a thing or two about the Russian Scam. I urge everyone to immediately stop all business with Russia and its corrupt politicians. The United States has already paid them,April,Q2,18
NEW DELHI: A gathering of business leaders from across the globe — including Prime Minister Narendra Modi and Chinese President Xi Jinping — held today in New York City to celebrate the 40th anniversary of the US-India Strategic Partnership signed,April,Q2,18
Yesterday I got a very nice email from my good friend Joe Six Pack that basically says thank you for all of the support I've been getting and that I'm doing GREAT! Yesterday I got a very nice email from my good,April,Q2,18
Wow! @Bannon just said that China is using the U.S. healthcare system to KILL people! They're stealing our jobs &amp; vie with other countries for the jobs because they are so much cheaper.,April,Q2,18
"The dueling narratives that have dominated American politics since the 2016 Election - the Russia Hoax &amp; the Radical Left Coronavirus Hoax - should be viewed as a very bad omen for the future!
",April,Q2,18
"The federal government is considering a plan to gradually phase out coal-fired power plants in the Twin Cities region as it faces mounting costs and criticism of its decision to shutter two plants.
Minnesota Public Service and Metro are considering changing",April,Q2,18
"The nation's largest and most expensive national parks are at risk from commercial development that could threaten their ecosystems and people's health.
The Trump Administration is committed to protecting our Nation's forests and wildlands. The Forest Products Administration",April,Q2,18
"The second part of the story begins to make sense.
Governor Cuomo: ""The Liberal Media Is Now Consistently Misinforming the American People. They Know What They Are Doing.""
They know what they are",April,Q2,18
"The UESPWiki – Your source for The Elder Scrolls since 1995

For other uses, see Magnus (disambiguation)

I was in the same boat as you were! [ edit ]

",April,Q2,18
"The Bakken oil boom has been 'a joke' for the Government and the oil industry, according to one of the people with knowledge of the situation.
The Government has been ridiculed by many for not doing more to stop",April,Q2,18
"It's a nice day in America!
Thanks to @SenJohnMcCain of Arizona for allowing me to HINT Congress is working on a great Cancer &amp; Healthcare Bill!
The real story here is how E",April,Q2,18
"The latest episode of The O'Reilly Factor is the worst in the history of the cable news show.
They even allowed me to talk about it!
It takes nothing away from the great people of South Bend, Ind",April,Q2,18
Polarization is a condition created by the United States to entrench their crimes against humanity against humanity people of color. They are now the most corrupt and lawless administration in the history of the world. The American people must,April,Q2,18
"General Motors Co. is considering a $100 million payment to Puerto Rico to help repair the electric grid that has been crippled by Hurricane Maria.
It is the latest example of General Motors Co. helping Puerto Rico after Hurricane Maria",April,Q2,18
"The family of a young man shot and killed this week in Tulsa, Oklahoma say he was just trying to help them. According to the Tulsa World, 28-year-old 25 year old Andre Miller was holding a baby st",April,Q2,18
"The United States and the European Union are working together to address the massive refugee and migrant crisis. We are working with our European and Middle Eastern partners to share information to help them protect their citizens.
A new book by the",April,Q2,18
"Nasty to the Mouth

I love this post by @DaveWeigel of how @nytimes reporters got caught trying to set Americans on fire over a Pulitzer Prize winning story about the Obama Justice Department's gross miscarriage of",April,Q2,18
"I'm not one to sit around and tell you how to dress. However, I will say that my daughters are 16 and 12 and are already showing me what not to wear. They are smart and independent and always have been",April,Q2,18
"The US has forced six Middle Eastern countries to cut or scale back activities or face serious sanctions. Four of the countries are Saudi Arabia, the United Arab Emirates, Bahrain and Qatar.
The US is now the world's second",April,Q2,18
"TEL AVIV — From his perch as Secretary of State, Hillary Clinton is now pushing the U.S. to go to war with Syria once again.
UN Human Rights office in Geneva condemned the shooting down of",April,Q2,18
"The United States is considering a major escalation of its military intervention in Yemen in response to the Saudi-led coalition's alleged recent bombing of an aid convoy.
The United States is considering a major escalation of its military intervention in",April,Q2,18
"›› Roe v. Wade: What Happened?
›› Obama Mocks GOP for Defying Dem Convention on Trade› @PeteHegseth
›› Obama:",April,Q2,18
"I'm not sure what you're talking about, but this is pretty awesome:
WE HAVE EARNED A TOTAL OF $18.6 BILLION IN FOREIGN TAXES THROUGHTHEY DO WHAT",April,Q2,18
The Department of Justice Investigations into the 2016 Presidential Election should not be used to target individuals or parties on the basis of their political beliefs or beliefs about the President. The Department of Justice is an independent law enforcement agency that is above,April,Q2,18
