Tweets,Month,Quarter,sampling
"The U.S. is now the second largest producer of coal in the world behind China.
47% - The share of U.S. imports from China is down from the previous peak of 80% in 1999.",April,Q2,8
"Quick Facts Screenshots Videos
Elegant Gladiator's Plate Belt


Item Level 91

Binds when equipped Shoulder Plate 23 Armor

+14 [Strength or Intellect]

+21 Stamina
",April,Q2,8
"July 22nd, 2013

By: Rajiv Shah

New York

I have been in touch with my friends in India and will continue to do so. We are working together to further strengthen our two great",April,Q2,8
The first time I met a colleague who was gay was at a dinner party 20 years ago. I didn't know them that well but I recognized that they were very smart and very funny. For a long time I thought they,April,Q2,8
"Yes folks. This is true. I did not know she was so whiny. She is a puppet for the Radical Left Democrats and Fake News!
....I will be making a statement shortly on this very important subject.",April,Q2,8
"The Senate Intelligence Committee is investigating Russia and Russia's interference in the 2016 election. If the investigation leads to any investigation, I will be as forthcoming as I can.
The House Intelligence Committee is an abomination. Their Chairman",April,Q2,8
"Federal Reserve Chairman Ben Bernanke: Trump Is 'Blindsided' By Fed Rate Increase

Senator Mitch McConnell Addison (Mitch) Mitchell McConnellAvenatti: Third Kavanaugh accuser will prove credible against Kavanaugh, other",April,Q2,8
"This is a guest post by Scott Scott. He is a Research Associate at the Center for American Progress.
Congressional Republicans are working overtime to repeal and replace ObamaCare. They are doing so on the back of the largest single",April,Q2,8
"Some of the most intelligent people I've ever met. They are stronger and smarter than us. Love you!
I love New Hampshire! I was so impressed with your Campaign! Thank you!
People who don’",April,Q2,8
"This information was provided to us by a source knowledgeable in the matter. The majority of the money has already been disbursed and our employees are doing just fine. Thank you.
This information was provided to us by a",April,Q2,8
"The Project Gutenberg EBook of ""The Young Turks"" This eBook is for the use of anyone anywhere at no cost and with almost no restrictions whatsoever. You may copy it, give it away or re-use it under the",April,Q2,8
"The Battle of the Beanfieldes: An Historic Triumph for the United States?
Posted by wagthepeople at 1:41 PM
The Battle of the Beanfieldes: An Historic Triumph for the United States?",April,Q2,8
"The US Justice Department has charged three Iranian-American men with making terrorist threats against the US on behalf of the Iranian government.
Law enforcement and intelligence professionals are rightly concerned and this is in clear violation of all relevant laws and",April,Q2,8
"Senate Judiciary Chairman Chuck Grassley released the following statement after the House passed the American Worker First Trade Promotion Authority bill:
""Today is a historic day for American manufacturing. After more than two decades of steady job creation the United States",April,Q2,8
"They said we couldn't do it, but now we can! #MAGA

The Democrats have wasted almost two years trying to repeal and replace ObamaCare. They are now trying to run away from the massive Tax Cuts",April,Q2,8
"This is a rush transcript. Copy may not be in its final form.

AMY GOODMAN: When President Trump visited the National Institutes of Health yesterday he praised the late Fred and Donna Greyson for their service to our nation",April,Q2,8
"The Government is cutting taxes for millions of people across the UK in time for Christmas all thanks to the hard work of hardworking enthusiasts like you!
USA! USA! USA!
Fear not America!
The world is",April,Q2,8
"Purdue football coach Darrell Hazell announces the team's first-ever 2-0 start at Rush University Stadium in Lafayette, Indiana on Saturday, October 28, 2015. (Photo: Kevin Fujii, USA TODAY Sports)",April,Q2,8
"For those of you who don't know this, I am currently in the process of writing a book about my many years of service to our Country. It is the most important book that I have written and it will be a",April,Q2,8
"In the wake of the tragic mass shooting at an Oregon community college by a disturbed Muslim radical, President Trump issued a statement strongly condemning hatred and bigotry. FAST!
“In light of this tragedy, I want to",April,Q2,8
"They're coming for you!
This weekend the National Guard will be on the streets of your communities from coast to coast. This is to ensure our communities are protected from the devastating storms that are set to hit our country in",April,Q2,8
"Mayor Rahm Emanuel on Sunday said that he is confident that the White House will quickly come to a conclusion regarding the situation with the release of the long-form birth certificate.
“I know that the White House will",April,Q2,8
"The FBI is continuing to investigate a tweet from President Trump on the investigation into the deadly Boston Marathon bombing.
What a nut job James Comey is. He never supposed to be in charge of our Country!
Tremend",April,Q2,8
"The Federal Reserve's latest rate hike is yet another of Trump's policies that is causing massive inflation and unemployment in the U.S. even higher!
17000 Federal Reserve Rate Sticks to the Numbers That Have been in",April,Q2,8
"While Bernie Sanders is losing the enthusiasm gap with African Americans he is surging in the polls overall. A new Washington Post poll shows that Bernie Sanders leads all Republican candidates in a national poll of likely Democratic primary voters at 43%.
",April,Q2,8
"A federal appeals court on Tuesday upheld a lower court ruling that found the government had not established a policy of systematically targeting the press for prosecution.
The decision from the three-judge panel of the 9th U.S",April,Q2,8
I've asked the White House to explain their decision to not release the transcript of my meeting with the China Mobile employees yesterday. We had a very good conversation. We were able to reach a peaceful resolution to the Trade Deficit,April,Q2,8
"The absence of any discernible 'chaos' in Washington these days is quite remarkable. Chuck Todd of Meet the Press is a truly great man. Weak and ineffective Nancy is an embarrassment to all!
I told the Democrats",April,Q2,8
"In what could be the biggest media event of the year, Fox News anchor Megyn Kelly was booed during her Wednesday evening news conference by Republicans skeptical of President Donald Trump.
The crowd jeered and shouted her name all",April,Q2,8
"The Ohio Supreme Court on Wednesday upheld a lower court's dismissal of a lawsuit brought by President Donald Trump's former campaign manager, who argued that the campaign was in contempt of court by not complying with a subpoena.


Mar",April,Q2,8
"The Federal Reserve is finally raising interest rates.

This is good news for the US economy as it should reduce unemployment and boost demand.
The Fed is raising interest rates again. This time for good.
These numbers",April,Q2,8
The dirty little secret about American politics is that it is totally rigged. This week the Senate voted 123-0 to confirm Stanley Johnson as the new U.S. Ambassador to Denmark. Johnson is a big supporter of the racist,April,Q2,8
The argument in favor of the TPP is that it will make it easier for manufacturing to move to America and our great country of Canada. What it will NOT do is help us manufacture good paying manufacturing jobs. The TPP will do,April,Q2,8
"Veteran journalists at CNN and other outlets are NOT cronyism. They are doing their job and reporting the truth. They are doing it the right way! — Donald J. Trump (@realDonaldTrump) February 25, 2017
",April,Q2,8
"But they also showed an image of the offspring of a matchmade killer and a matchmade victim.
The image on the left is of a 7 year old girl who was killed in a house fire in Ohio. The image",April,Q2,8
"Regulatory Action to Prevent the Next BP Oil Spill
WASHINGTON (Reuters) - The U.S. Food and Drug Administration on Wednesday said it was studying a potential recall of one of 18.7 million cans of T",April,Q2,8
"More than 100 countries have already agreed to take part in the Paris Climate Agreement and the United States stands ready to play our part.
A federal judge in Seattle has blocked President Trump from ending DACA. If he does that will",April,Q2,8
"From Halopedia, the Halo wiki

""We save lives! We save businesses! And we save the planet!""

The United States Marine Corps is the third largest armed force in the world and has been for",April,Q2,8
"The Trump administration is moving forward with plans to dismantle and ultimately abolish the Federal Communications Commission.
....the Trump team and the Democrat dominated House desperately tried to pass a bill that would have ended the Democrats long rigged &amp;",April,Q2,8
"The Federal Reserve's strong but not overwhelming rate hike on Wednesday did not matter much to the American people. More importantly it didn't matter to the powerful oil and gas companies.
The [GOP] members of Congress who voted",April,Q2,8
"The FBI has discovered thousands of emails that may be pertinent to the Clinton email investigation. We will share these documents as they become available. This is a major development!
The Democrat Party has given in to the Radical Left and",April,Q2,8
"The Central Intelligence Agency has revealed how it hacked into the computers of leaders of countries like China and Russia.
Democrat Hillary Clinton and Republican Donald Trump are the only two candidates in the Republican Party who don’t want",April,Q2,8
"This is a great book. I've never even heard of it before. Thanks!
Thank you for sharing your wonderful testimony with Congress. I strongly encourage everyone to read it!
Thank you John, such a great guy",April,Q2,8
"GitHub is home to over 28 million developers working together to host and review code, manage projects, and build software together.
[image]http://law.cornell.edu/uscode/656/201",April,Q2,8
"This is a rush transcript. Copy may not be in its final form.

AMY GOODMAN: We turn now to a new report that the Obama Justice Department and FBI were deeply involved in the surveillance of the Trump campaign.",April,Q2,8
The latest from the FBI and the US Marshals is that they are looking at the possibility that there may be a link between the destruction of the life of Journalist James Foley and the destruction of evidence in the case. The,April,Q2,8
"I can only assume that your husband is a wonderful husband to his beautiful wife. God Bless you and God Bless the United States of America!
JEB BUSH HAS BEAUTIFULLY LOST THE WHITE HOUSE.",April,Q2,8
"Has anyone really thought that a Black man with a past like his father's would be the President of the United States?
Judge Nap: 'There Is No Such Thing As A Free Lunch'  By Randee Dawn",April,Q2,8
"Associated Press

The Republican Party is far more concerned about Donald Trump than they are about the upcoming Super Tuesday Ballots that will be cast by many states.
The only thing the Radical Left does well is when people rally",April,Q2,8
"With more than 2.5 million tourists visiting the United States each year, this is a big number.
TRANSITION TO GREATNESS! #MAGA
Thank you to @SenJimInhofe of Oklahoma for",April,Q2,8
It's a big day for the people of the Dominican Republic. The President has just signed the SALVADOR MORAL FREEDMAN National Free Trade Agreement into law. This is a BIG win for the USA and the,April,Q2,8
"by

A former U.S. Navy pilot who shot down a North Korean jet has been sentenced to 15 years imprisonment…because he fired his weapon in self-defense? What does that even mean?
Also,",April,Q2,8
"The White House on Monday said it is 'appalled' by the kidnapping of American student Otto Warmbier and is urging China to provide Warmbier with medical attention.
Warmbier was reportedly held against his",April,Q2,8
Today we are launching a brand new initiative to serve our community in the City of Chicago. Our #BlackLivesMatter initiative is a major step in that it will send a powerful message to politicians across the country that the,April,Q2,8
David Icke has rallied millions of people with claims that many scientists and others have long known to be true: Global Warming is a hoax perpetrated by the Chinese to destroy the United States. Icke has been likened to a,April,Q2,8
"An Ontario man has been charged after he allegedly stole $500 from a local restaurant patron.
The 33-year-old suspect is described as:
Black male, 5'10"" to 5'11"" 180 lbs",April,Q2,8
"We welcome you to the National Organization for Marriage website!
Thank you @GovBillLee for a great &amp; life-affirming Debate on @UFCFIGHT that we absolutely loved!
I gave @ChrisChrist",April,Q2,8
"In a rare interview , Republican presidential hopeful Donald J. Trump defended white supremacists and neo-Nazis who have gathered in his rallies and attacked protesters. In response, counterprotesters have charged aggressively with clubs and clubs and other weapons",April,Q2,8
"Do You Think You Deserve to Be President?
We are so close to having the greatest economy and the greatest people the World has ever known. I will always stand by the United States of America my friends. #MAG",May,Q2,8
There has never been a worse time to be female than right now. The number of young women who have chosen to leave the workforce because of lack of opportunities is staggering. We no longer have a men's space in our country,May,Q2,8
"SHARE THIS ARTICLE Share Tweet Post Email

The Trump Administration is considering bringing back the death penalty in Georgia.

The move comes as a result of the untimely death of Justice Antonin Scalia. Scalia was 84",May,Q2,8
"Who are we?
Innovative Social Media Firm Formed to Deliver the Latest in Social Media Innovation and Promote Social Responsibility.
“The President of North Dakota.” Mr. Trump (@RealDJT",May,Q2,8
"USS Washington (DDG 51) is damaged beyond recognition!
Either way the media never talks about how amazing our Veteran @USCGCaptainDavidLanceAlvarez is!
And this is what happens when you allow",May,Q2,8
The official website for Sentai Filmworks ' Key Animation Film Shisouji-kun ( みばしみみに山べん ) is now available! The film will premiere at,May,Q2,8
"LONDON (Reuters) - Britain could be forced to leave the European Union if it wins back voters fleeing its ultra-right National Front, Prime Minister Theresa May's spokesman said on Wednesday.
Britain's Prime Minister Theresa May",May,Q2,8
Rod Wheeler was a good man. A great father and a true American hero. He was a loving husband and father who played a large role in my campaign for President. His beautiful four-year old daughter Sasha died early last,May,Q2,8
"This is a bill that will not only keep our airports open and safe, but it will also serve as a powerful deterrent to others from trying to do the same.
Watched Commander-In-Chief Donald J. Trump",May,Q2,8
"The White House on Tuesday rejected a report that urged the United States to take more action against Iran ahead of a pivotal Saturday summit between President Hassan Rouhani and world leaders.
""The United States of America has not made any decision",May,Q2,8
"Quick Facts Screenshots Videos
Pauldrons of the Resolute


Item Level 58

Binds when picked up Shoulder Cloth 10 Armor

+12 Intellect

+20 Stamina

+",May,Q2,8
"On September 19th the man responsible for the largest internet hack in history was finally brought to justice. This evening the US Court of Appeals for the Second Circuit in New York issued a unanimous decision in favor of the government.
",May,Q2,8
"Nice raffle! 40% off all raffles. Can we get a maximum of 40% off?
I am very pleased to announce that I am going to be having a White House Press Conference today at 5:00",May,Q2,8
"American Atheists is asking the Department of Justice and Congress to investigate and prosecute Scott Lively the leader of a neo-Nazi skinhead gang in Victoria, British Columbia.
Scott Lively is a convicted felon who you know",May,Q2,8
"Play Facebook

Twitter

Embed Clinton Campaign: Thousands of People Stopped to Protest at Her Event in Raleigh 2:35 autoplay autoplay Copy this code to your website or blog

CHARLESTON",May,Q2,8
"There's an extra $375 million to be had from the BEST REWARD EVER for Victims of Domestic Violence and they are NOW PAYING!
Thank you @WhiteHouse for all of the great reviews of my (very nice",May,Q2,8
"The FBI is investigating an apparent cyberattack by the Chinese government on an American political party.
“We are aware of the matter and are in contact with the White House. There is no active threat to the United States",May,Q2,8
"Advisor for the United States Treasure Coast Field Office, Ray Kelly. Ray is a very experienced and hardworking leader. Ray has been with the USTR for almost 5 years and has a proven track record working closely with the",May,Q2,8
"It was just yesterday that President Trump said he was going to ""bomb the shit"" out of ISIS.
Didn’t that cost him the Election?
Thank you!
Wow. This is one I will",May,Q2,8
"A new poll from the Marshall Project finds that a majority of Americans feel that the Obama Administration has been doing a very poor job handling the situation in Puerto Rico.
A new NBC News/Wall Street Journal poll finds that more",May,Q2,8
This study was paid for by the ACLJ. Their article was the subject of a recent Drudge Report Article. The study was flawed from the beginning. The authors made a study up to make their own case about the impact,May,Q2,8
"LAS VEGAS -- Donald Trump is the man for the job.
Trump is the only one who can beat Hillary Clinton and beat Bernie Sanders in November. If he gets the nomination he will totally sweep the field and",May,Q2,8
"Shocking photo shows a naked man being dragged by two dogs in Brooklyn

It shows the naked man being dragged by two dogs in Brooklyn

This picture has been posted to Here &amp; Everywhere and it shows what",May,Q2,8
"The EU wants Turkey to stop paying ransom for the safe return of a British man who disappeared while on holiday with his family.
The EU has demanded that Turkey halt its payments to the family of Aslan Halaby. As",May,Q2,8
"The New York Times is a propaganda and sedition publication. They are an enemy of the People. The people will not take their Country Back!
...Just think of all of the new jobs that will be created!
",May,Q2,8
"WWE Weekly Smackdown with Dean Ambrose &amp; Sheamus &amp; The Usos for the WWE Tag Team Championships!
THANK YOU @WWE! This is a HUGE deal for WWE and @Sm",May,Q2,8
If you are a Republican voter or a person who believes in limited government and individual liberty then you should absolutely support the Impeachment Hoax. If you want a MORE USA then get the Impeachment Hoax to a,May,Q2,8
The New York Times today reported that President Trump did not know that former FBI Director James Comey - the man who gave him the absolute truth about my not intent to go to war with Russia - leaked that information to the media before,May,Q2,8
"Introducing the Best of Vintage Clothing Friday – Vintage Clothing for all.
Brace yourselves! There is a new super hero on the block! The all new #SuperHerOmegaMen have come a long way!
",May,Q2,8
The Democratic National Committee (DNC) is now in hot water after it was revealed that the DNC was not only coordinating with Bernie Sanders' campaign but was also in active negotiations with him to have the DNC list every state Democrat,May,Q2,8
"He sported a mustache but otherwise never looked at like him
He was a lightweight then became strong!! He never lost his temper
At a Glance:
--The House approved $1.2 Trillion in defense",May,Q2,8
"The debate over the Keystone XL Pipeline is one that I have been involved in for well over a year. I took office in January 2009 and I have done more than any President in American history to Make America Great Again.
",May,Q2,8
"The UESPWiki – Your source for The Elder Scrolls since 1995

This article is about the Factions branch of the Empire. For the faction that existed prior to the First Era, see Ald-ruhn
",May,Q2,8
"This is a great article from a respected journalist who really knows his stuff.
... But they don’t know it because they are not paying attention!
You know what is even more amazing than the fact that our",May,Q2,8
"It wasn't just the successful launch of the SpaceX Falcon 9 v1.1 that sent Musk's rocketing company to the top of the list of rocketing companies worldwide.
Musk was just named the 4th most",May,Q2,8
"The most common questions about the impending repeal and replacement of Obamacare come from those who know the law better than anyone else. It is called MAGA!
...the Republican House majority in the House on the first day of recess",May,Q2,8
"Joe Biden is a liar!
“I don’t know if you know this but the Democrats are in big trouble.” @LisaMarieBoothe @FoxNews  I didn’t know they",May,Q2,8
I created this app to help my old high school students who are struggling with academic and related problems. I believe that it will be of great help to others as well. This app is FREE to use and will help many struggling,May,Q2,8
But the most damaging aspect of this whole thing is not the leaks of classified information or bad intel. It is the fact that a sitting President would even contemplate leaking such highly classified information. That is so totally unacceptable that even a,May,Q2,8
"The media has been saying for weeks that there was NO chance that Bernie Sanders would EVER make it past the first Caucus or Nomination Address.
What the media HASN'T told you is that there was NO WAY that",May,Q2,8
"A government insider says they have the evidence. Now they need the courage to share it!
The Fake News Media is working hard to sell a conclusion that President Trump would have been unable to complete his term due to his Phys",May,Q2,8
"I can't thank everyone enough for the kind words about my book. I was supposed to have it out by Christmas and I was waiting in a long line. It was so cool to see all the wonderful reviews. :)
",May,Q2,8
After reading the above article by Dr. Michael Green I knew that I had to write a letter of protest. His article is full of lies and distortions and should NEVER have been published. It is a very bad article by the,May,Q2,8
"Jeff Sessions Sends Shockwaves Through National Security World With His New Recusal From Russian Election Hoax
""I was asked to recuse myself because I am familiar with the matter.""
""I was asked to recuse",May,Q2,8
"The National Guard has been sent to assist in the response to the Las Vegas shooting.
Totally false and unverified. The National Guard has been activated in Las Vegas to assist in the response.
The Wall is slowly",May,Q2,8
"Are you looking for a great, affordable apartment near the University of Washington? Look no further! The Westin Seattle is a beautiful, two story modern style hotel with great location just steps from the world famous Lake Washington. The",May,Q2,8
A guy named Pat Byrnes is a very smart guy. I like him very much and wish him all the best. He is a real talent and is my opponent in the Republican Primary in Maryland on 12/4. I,May,Q2,8
"Our first-ever live outcome of the Maryland Open Water Marathon runs from 11:00 a.m. to 1:00 p.m. MDT on Sunday, October 29, 2018. Join us for the Official Start",May,Q2,8
"The UESPWiki – Your source for The Elder Scrolls since 1995

The Nightingale is an elderly Nord noblewoman and lover of power, honor, and wealth. She has long had a feud with the Ch",May,Q2,8
"The Sacred Heart Hospital in Washington D.C. is now the only institution of its kind in the nation. The nation is proud to be home to the only institution of its kind in the United States.
The Democrat controlled",May,Q2,8
"Raiders defensive end Michael Buchanan was arrested early Saturday morning in California. He is charged with assault with a deadly weapon and battery. He is currently in the Orange County Jail.
I was on @ABC News in an interview",May,Q2,8
"The White House on Wednesday defended President Trump's decision to criticize NFL players who were taking a knee during the national anthem in protest of police brutality.

''The President will always stand with our National Football League and our incredible",May,Q2,8
"The world is suffering from an acute food crisis, with many countries in the western hemisphere suffering from acute food shortages.
We have taken the extraordinary step of not only notifying Russia of this coup but also notifying China who",May,Q2,8
"For other uses of the word ""parasite,"" see Parasite.

It's the same old PR speak. Cheating the Press!
Great news everyone!
I only agreed to do one debate because I",May,Q2,8
"The American people deserve a president who will secure our borders and secure our 2nd Amendment. We will end Sanctuary Cities and protect your most precious freedoms. I am your Donald J. Trump! #MAGA

I love",May,Q2,8
This week on the show we welcome back our good friend and co-host of the @CNNBooker political talk show who this week is joined by her good friend @RepAlexisKaine. We also welcome back our,May,Q2,8
"The New York Times reported in March 2017 that the U.S. Intelligence Community (IC) concluded that Russia meddled in the 2016 U.S. Presidential Election in an effort to help President Trump.
The CIA has",May,Q2,8
"ABC News reports:

[The] State Department released a list on Tuesday of 35 countries and territories where Julian Assange could be sought for rape or sexual molestation.
...
....We cannot allow Iran to obtain a",May,Q2,8
"The Project Gutenberg EBook of The Kinsale Diaries by John Henry Newman This eBook is for the use of anyone anywhere at no cost and with almost no restrictions whatsoever. You may copy it, give it away or re",May,Q2,8
