Tweets,Month,Quarter,sampling
"President Trump is doing everything in his power to aid Indiana and the U.S. in whatever way he can. He is working with Governor Pence and many others to help them.
While the Dems are busy petitioning the",January,Q1,18
"If this is your first time traveling to the hills of PA, you need to get to know this area. You wont be disappointed. If you have any questions i am here to help you and you will be glad you did",January,Q1,18
He is the voice of reason. He is the one who said that the New York Times is the enemy of the people of the United States. He is the voice of peace. He is the voice of conservatism. He is,January,Q1,18
"The Justices of the Supreme Court are the most corrupt, least ethical and most radical Left-leaning judges in American history. They are the real reason our Country needs an Supreme Court Justice who WILL STAND UP FOR LIBERTY",January,Q1,18
"The British navy has arrested a Syrian national who was believed to have tried to board a Malaysia Airlines flight bound for Beijing with explosives.
The 35-year-old was arrested at his home in Kent. He has been detained",January,Q1,18
"We have a problem with fake news.
The Democrat Party has a problem...and it is bigger and much more sinister than you might think.
Fake News!
...The Fake News Media (FNN) of FOX",January,Q1,18
"The FBI is looking into new allegations of Russian interference in the 2016 U.S. Presidential Election.
There has never been in U.S. History been as much Information about a single Political figure or Event passed along in",January,Q1,18
"X-Men: Apocalypse Director: There's No Such Thing as a Good X-Men Film
I used to be a HUGE X-Men lover and even wrote about them for Bleeding Cool. Unfortunately they are far too",January,Q1,18
"HONOLULU — A day after the State Senate voted 43-3 in favor of a bill that would officially legalize medical marijuana in the state, Gov. Chris Gregoire delivered a statement to his fellow Florid",January,Q1,18
"BJP national spokesperson Nirmala Sitharaman had tweeted today that the 'terrorists' in UP are AAP workers and the government has to act.
BJP today issued a press release saying that the terrorists that shot",January,Q1,18
"Thank you so much to all of my students! You rock!
The Greatest Political Crime in American History by a sitting President!
This is an absolute disaster for the United States!
Great!
Great!
This",January,Q1,18
"Peyton Manning has been fined $25,000 by the National Football League for his role in the Ray Rice domestic violence incident.
Sign up for our morning news blast
I think it is a very sad situation for",January,Q1,18
"The U.S. Department of Justice announced today that it has opened a criminal investigation into Russia-linked hackers who stole information from the Democratic National Committee and Hillary Clinton's campaign chairman during the 2016 presidential election.
The Department",January,Q1,18
"The US Anti-Doping Agency has launched an investigation into the urine samples of Chris Horner and others who were caught in a WADA banned substance test.
The US Anti-Doping Agency has launched an investigation into",January,Q1,18
"I am a strong supporter of Women and Girls. I am proud to be an American!
HAPPY MOTHER's DAY!
Thank you @GigiSchri Twitter is awesome!
“We are always",January,Q1,18
Today I'm happy to announce that the Trump Foundation will receive $1M from the City of Philadelphia! This $1M will go immediately to the @PHL_Philly poverty reduction fund. Will be a big boost,January,Q1,18
"Fabled industrialist George Soros spent millions of dollars on negative ads against Republicans in key states this year. Now he is losing millions more. He is a loser!
It is becoming increasingly clear that the Obama campaign was told",January,Q1,18
"The Senate is expected to pass a bill on Tuesday that overhauls Medicare. The House will vote on it next week and send it to the President for his signature.
THE MODERATES IN THE HOUSE NEED TO KEEP",January,Q1,18
"The White House released a statement from the Honorable Julie Roginsky, Acting Assistant to the President for Public Engagement &amp; Public Engagement.
The White House is working closely with the Department of State to deliver on",January,Q1,18
"The Power of a Fan

When the New England Revolution play in front of our passionate supporters we are making our Nation stronger than ever before. Over the past few months we have seen over a hundred newborn babies born in",January,Q1,18
Paying for the EMTs who were there yesterday was like paying for an orphan who has no one to look to for guidance. He got himself into a lot of trouble and that is why I am demanding he get back,January,Q1,18
"We recently spoke with Michael J. Kelly , a partner at the WilmerHale law firm who specializes in intellectual property law. In this exclusive interview he discusses his firm's experience defending Starbucks Coffee Company and why it is so",January,Q1,18
"The only way to stop the drug trade is by stopping people from getting high.
The only people who benefit from the drug trade are the very criminals it is meant to bring into the community.
I think we have the",January,Q1,18
"This is a guest post from David Collins of the The Heritage Foundation.
I've already written about the many ways in which Obamatrade will destroy the middle class and drive up prices for everyone else. But I just",January,Q1,18
"When I first started working in civil defense in the 1980s the average age of the team was already over 60. The average age of the team right now is under 40. Lame.
When I was growing up our",January,Q1,18
"Representatives from the African Union Mission in Washington (AMISOM) will visit the U.S. on March 13 to assess the nation's response to the Ebola virus outbreak. Consistent with its normal procedures, the United",January,Q1,18
"The Federal Communications Commission is preparing a rule to regulate Internet Service Providers like the likes of Comcast.
The Federal Communications Commission is preparing a rule to regulate Internet Service Providers like the likes of Comcast.
The Federal Communications",January,Q1,18
"Standard & Poor's downgrades the U.S. government's credit outlook, saying that ""the balance of payments situation remains sensitive to developments in the Middle East and Ukraine.""
The best is yet to come. The best",January,Q1,18
"The federal government is investigating whether two Detroit police officers have committed a crime in the death of a black teenager who was tasered and beaten on video.
The government has been notified and will determine if these two Detroit Police",January,Q1,18
"This is a rush transcript. Copy may not be in its final form.

AMY GOODMAN: Well, we turn now to the story of former secretary of state and 2016 Democratic presidential nominee Hillary Clinton. Clinton spoke to thousands",January,Q1,18
Senate Republicans are now saying that they are open to raising the debt ceiling again if we get our act together. But they are not willing to offer more money or give us the authority we need. They want to blow it up,January,Q1,18
The U.S. Supreme Court gave Congress the authority to regulate the Internet this morning by reversing a lower court ruling. This does not mean that the Federal Government should be able to decide what content is appropriate for children and what,January,Q1,18
"The U.S. Navy will spend an additional $1.5 billion to support Ukraine in its efforts to defeat the so-called Islamic State. The funds will be used for naval vessels, equipment, personnel and support for",January,Q1,18
The FBI is investigating a report that President Trump Donald John TrumpFlake: I sometimes feel like I'm 'without a party' Graham attacks NBC as 'co-conspirator in the destruction of Kavanaugh' Alex Trebek,January,Q1,18
I'm not going to pretend to know where you're coming from. I am. But as a lawyer with nearly 10 years experience in the United States Senate I know that it is the Congress that must now act. If they,January,Q1,18
"After more than a decade of research and development, the Tesla Energy System is now fully operational.
The great people of California are once again celebrating the fact that they have found a new and improved and much loved Governor. The",January,Q1,18
One of the things we learned about Andrew McCabe in his investigation of the Trump campaign Russia ties is that he was a KGB agent. He lied about it. He also never took the Fifth. He is a leaker and a,January,Q1,18
"There is nothing more annoying than hearing a politician talking about the danger of the ****ing sun. Its a ****ing ****ing blast furnace. Its a ****ing ****ing ****** job. Don *****t panic!!
",January,Q1,18
"The eBook is available again! Get your copy today!
The Democrats are destroying the Trump Administration. They are dragging their feet on many important things and doing their best to make things even worse. They are not letting the GREAT",January,Q1,18
"Two adult males were arrested early Sunday morning after a shooting that took the life of one person and injured another.
BREAKING: Police in Charlotte North Carolina have ONE suspect in custody. Suspect in custody.
BREAKING",January,Q1,18
"Cancer and Reproductive Harm- our Lady loves you!
So many of you are with her and I am so blessed to receive your love and prayers. #LoveTrinity
I just signed the Health Care Bill into",January,Q1,18
Government and the pharmaceutical industry are closely working together to eliminate access to affordable and effective pain medication for America's seniors. The Trump Administration will continue to stand with patients and ensure affordable access to compassionate and effective medicine for our most vulnerable,January,Q1,18
"All things considered, it's nice to see that the conversation about equal pay for equal work has finally taken off.
The Washington Post just out with the results of their great new poll. From them:
PHILAD",January,Q1,18
"It wouldn't be a post about the dangers of Obamacare if we didn't mention that one of the worst pieces of legislation in the history of the Federal Government was passed by both houses of Congress.
I always said it is",January,Q1,18
The St. Louis Rams are one of the hottest teams in the NFL right now. They are already in the mix for the #1 seed in a very competitive AFC West. They are playing great football and look to win more,January,Q1,18
"Shamanism is a spiritual discipline dedicated to the protection and restoration of the physical body by the use of herbs, roots, and other organic matter. It is a direct path to inner peace and inner strength.
Thank you",January,Q1,18
"It's true!
The only way to stop this madness is for the American People to demand that their representatives in Washington do their jobs and approve a Budget that provides critical funding for our National Parks and our critical infrastructure. We",January,Q1,18
"The popular animated feature that has the world laughing and smiling is coming to Netflix. Netflix will release the short film, Cheers, on Friday, December 15th at 10:00pm.
“The U.S",January,Q1,18
This is not an article by the Washington Post. This is an article from the New York Times. They report that Donald J. Trump has chosen Judge Neil Gorsuch to fill the seat of the late great Justice Antonin Scalia who,January,Q1,18
"Minimalist Universal Basic Income: What is it for?
The United States is a major economy. We are well on our way to being the world leader in jobs, wages and economic growth. Did you know that America",January,Q1,18
"We are working hard to get the United States out of the Paris Climate Agreement. We are getting close. It is a disaster for our Country and the World!
PC Police are actively looking for one of their many victims in",January,Q1,18
The Cubs are having a really good season. Since the All-Star Break they have won 25 games only two games behind the Los Angeles Dodgers. The Cubs are playing very well and look to continue their hot start in the NL,January,Q1,18
"It is with great sadness that we report the passing of our friend and fellow founding father, John W. McPherson. A champion of the U.S. Constitution and a true friend to many in our nation's",January,Q1,18
"Apex is a lightweight framework for creating custom web sites for small businesses. It has been used by large organizations such as Netflix and Pinterest.
Apex is an easy to learn framework that will put you on your way to",January,Q1,18
"Other Ways to Help:
Thank you to our initial Donors! Over $120 Million has been raised for our victims and their families. Today we are reaching out to others in your communities with another #GivingTuesday...
",January,Q1,18
"I was not disappointed at all by my review of his book ""Hacksaw Ridge."" It is a tremendous book written by a very accomplished and highly respected military historian. His book covers both the Vietnam War and the Afghan War",January,Q1,18
"Posted by: John

5:15 AM
Well he was the one that got caught!
A great guy!
Congrats to John Jameson on his getting caught!
Top Judges in the Land are disgusted",January,Q1,18
"At the end of the day, what we are seeing is a president who has been totally focused and focused on building the capacity of our Federal Government. This includes our most critical infrastructure projects such as our Power Grid. This focus",January,Q1,18
"The UESPWiki – Your source for The Elder Scrolls since 1995

This article is about the race. For other uses of the name, see Orcish (disambiguation).

Oblivion",January,Q1,18
But in reality there is nothing wrong with my style of play. I love to play defense and am very confident in my ability to do so. My teammates and I love playing defense for me and I love playing against other great,January,Q1,18
PRINCETON NATIONAL – A new Monmouth University Poll finds that a majority of Americans (57%) favor a Constitutional Amendment to ban assault weapons and other high-capacity magazines. Two-thirds (67%) also favor,January,Q1,18
"NOTE: These 6.5""x7"" posters are OFFERED ONLY AT the following locations:
Tom Green Park & Garden
6640 N. Clark St. Ste. 122
Elk Grove Village ~ CA",January,Q1,18
"The opinions expressed by columnists are their own and do not represent the views of Townhall.com.
WHY DID HE LET JONAH BOND GO? … Because he is a Pro-Israel Puppeteer",January,Q1,18
"The Senate has overwhelmingly approved a massive $1.1 Trillion spending bill that will keep the government open and save the U.S. economy millions of good-paying jobs.
Democrats are raving about this stunning vote",January,Q1,18
"Days after a student who was racially profiled was stabbed to death in Madison, Wisconsin, the campus watchdog group FIRE has been called out for its irresponsible use of a video that appears to show the Madison Police Department retaliating against",January,Q1,18
In my last post I mentioned that I am not a fan of the Common Core State Standards. I came across your post of course and thought you are absolutely correct. I am in favor of Public Education and strongly support school choice,January,Q1,18
"Jerry Sandusky's accuser Betsy DeVos calls Jerry Sandusky's accuser Betsy DeVos a 'paedophile' and said she should be reported to law enforcement. She also said that Jerry Sandusky should be prosecuted.
The Hill",January,Q1,18
It all started with the Arizona Attorney General and her desperate attempt to get taxpayer dollars to pay for a PROMISES LAWS. I told her she would be fined $15K a day if she tried this. She,January,Q1,18
The American Enterprise Institute (AEI) has released the results of a new survey that shows that a huge majority of Americans (68%) are dissatisfied with the way things are going in the U.S. The highest levels of,January,Q1,18
"The Michigan Senate on Thursday approved a $80 million aid package for Flint after Republicans blocked Democrats from adding any money.
More than $120 million is coming your way to keep Michigan Moving Forward!
The Republican Party of Michigan",January,Q1,18
"I am a very strong believer in the Power of Positive Thinking!
DRAIN THE SWAMP!
No Ballots!
Thank you @PeteRose and everyone else!
Great book!
Who are the",January,Q1,18
"With the exception of a couple of exceptions, the United States will continue to aid Israel in its fight against the Iranian threat. There is no doubt that Israel has done an outstanding job with respect to the Iranian threat. We are",January,Q1,18
"The BBC has pulled out all the stops to try and make it look like they are reporting the truth on this subject. From using the wording ""allegations"" and ""potential investigations"" they have created a false narrative",January,Q1,18
"Hello Everyone!


My name is Michael Chalfant and I am the President of the Tucson AZ Chapter of the National Organization for the Reform of Marijuana Laws.
The United States is not in war with Mexico!
",January,Q1,18
"The President of the United States of America is listening to the desperate pleas pouring in from his hard working people. This is the VOICE of America!
Thank you @SenBillCassidy!
Our Country was built on",January,Q1,18
The Democrats have just created yet another scandal. They corruptly rigged my election. The Russians stole it and now they try to Rig it for Trump. Must find out who did it &amp; when will be interviewed/pun,January,Q1,18
"The best way to beat the GOP is to beat them first.
— Donald J. Trump (@realDonaldTrump ) January 29, 2017
We will win Indiana &amp; others big. Stay tuned!
Thank you David!",January,Q1,18
"Permanent Enlargement of the Heart!
Congratulations to @DrHaleyBrown who will bring great new energy to the Great State of Iowa. We need you in Washington!
Thank you to all of my many friends",January,Q1,18
"At a time when the Federal Reserve is tightening monetary policy and the ""fraud"" of the Federal Reserve is being exposed for what it is, how about we take a look at the Federal Reserve's actions and the actions of",January,Q1,18
"What is a 'Contribution Tax Credit'

A contribution tax credit is a tax break for businesses by the U.S. Congress. The credit is a refundable credit which businesses use to reduce their tax bills.",January,Q1,18
"Madame President,

I congratulate you on your historic win in California! I know that you will keep fighting for our great people!

It is with great pride and great pride that I inform the United States Congress",January,Q1,18
"They are at war with the American people!
Thank you Tom!
I am so proud of our Military. I have the greatest team ever assembled. They are getting great pay and benefits. They are doing very well.",January,Q1,18
"The Washington Post has just released a piece by Robert Parry entitled ""Is the Global Warming Conspiracy the Most Fraudulently Reported and Contradicted Paper in History?"" The answer is a resounding ""No."" Here is",January,Q1,18
"Pete Buttigieg has been linked to the Dallas Cowboys. (USATSI)
-- Two Democratic National Committee members are threatening to go on the record with their displeasure with the way the House is working and warn that",January,Q1,18
"So you've got a nice little dog, don't you? Then people come to your house and walk in front of you, barking, jumping on you, biting your head off and generally doing everything they can to break your",January,Q1,18
"The Republican National Committee (RNC) is in turmoil after a hard-fought election.
As of now the Trump campaign has spent only $331 million dollars on advertising. That is less than 1/10th of",January,Q1,18
"Matthew Hahn spent decades working with the FBI and the Department of Justice to save lives. Matthew is a tremendous American. He is survived by his wife and two beautiful daughters.
The Trump Campaign has been warned that their continued",January,Q1,18
"The Ultimate Guide to the Best Low-Carb Chews and Nuts for Dogs and Cats

Save money and time by buying from the following brands of Chews and Nuts:

Cathy's Pet Nutrition",January,Q1,18
"We're here to help! Check our website for the latest news on our programs and events!<|endoftext|>Why would anyone vote for a person who bragged about sexually assaulting and murdering women?


President Trump is a professional bully",January,Q1,18
"The National Security Agency collects trillions of records on its American citizens every day every hour of the day and night.
The President has just made it easier for China. He gave them more time to deal with the crisis than we",January,Q1,18
"The Washington Post is reporting that the Trump campaign colluded with Russia to defeat Hillary Clinton. This is a big deal.
The Fake News @washingtonpost is reporting that the Trump campaign colluded with Russia to defeat Hillary",January,Q1,18
The statement from the Chancellor stating that he was not personally involved in the decision to fire Dr. James Pindell is a complete and total lie. He apologized to me directly for my very poor performance on the T.H,January,Q1,18
"Don't You Know I'm The Best?
It's been over 3 years since the death of my good friend and neighbor Michael Brown. Last night I was moved by the love and sincerity of the people of Missouri and beyond",January,Q1,18
"The Prophet ﷺ said: ""Whoever kills a human being in the name of God will not be forgiven.""
This is made up of 2 lies. 1. They made up the original 9/11 Truth Hij",January,Q1,18
"This is a rush transcript. Copy may not be in its final form.

AMY GOODMAN: We turn now to another important victory for immigration reform. The Senate voted 98 to 1 to send the American Immigration Bill to President",January,Q1,18
"The NYPD is investigating a shooting in Brooklyn early Sunday morning, police sources tell Eyewitness News.
At approximately 5:40 a.m. a female was shot in the right leg and taken to Harlem Hospital. She is",January,Q1,18
"When we talk about Doctor Who, what comes to mind are stories of Timeliness and Superiority!
The best thing that can happen to Whitey is that he is caught and brought to justice!
The Federal Reserve",January,Q1,18
"When I was younger, I also loved hockey. My favorite player was probably Lester Patrick (DET.) or Gordie Howe (TOR). I've always been a big Hockey Guy. But I've always been a terrible and",January,Q1,18
"The national anthem is a great way for people of all political persuasions to express their patriotism and love for our great country. It should never be used to denigrate anyone or anything.
The National Anthem is a GREAT AMER",January,Q1,18
Gov. Rick Scott signed into law the Omnibus Crime Control and Safe Streets Act of 1968 on Friday night. The law finally closes a large gap in our criminal justice system that we had existed for decades. This law is a,January,Q1,18
The TechCrunch is reporting that Facebook is quietly introducing a new feature to its Trending Topics section. This section will be live on Facebook Live and in other places across the site. This feature will allow you to post photos and,February,Q1,18
"The United States is planning to supply warplanes to a Saudi-led coalition to fight the Islamic State of Iraq and the Levant (ISIL).
The United States is planning to supply warplanes to a Saudi-led coalition",February,Q1,18
"Interior Secretary Ryan Zinke (R) is considering whether to cancel the first week of President Trump's trip to the Great White North.
The White House said Zinke is working with his team to carefully consider this possibility",February,Q1,18
"The Government is to amend its plans to tackle the crippling effects of the Northern Powerhouse Scheme to ensure that it does not place too many workers at risk.
CCTV Shows Tragic Deaths at Royal Mail HQ &amp;",February,Q1,18
The California Legislature is expected to pass a bill this week that will vastly expand the use of a program that allows citizens of certain Muslim-majority nations to apply for citizenship — a move that could seriously undermine the president's effort to,February,Q1,18
"The only thing our government is good at is lying. In the meantime they are closing down many places for looting. This includes Bowling Green.
“Disaster in Bowling Green.”  @CameronNY Times",February,Q1,18
"Democrats have no idea how to win Missouri. They are doing what they have done for years: bicker &amp; moan all day but completely lose the Primary. A total mess!
Brady defends DACA comments after a",February,Q1,18
"A group of scientists and former CIA employees are launching a campaign to expose how the Obama Administration and the Democrat Party are colluding to build a massive and illegal database to track Americans' every move.
The Daily Caller reported:",February,Q1,18
"We are happy to announce that the Seattle Mariners will be playing their home games at Safeco Field!
They are a great baseball team and they will always be a GREAT baseball team. They will always come back BIG. Seattle",February,Q1,18
"The Story Behind The Story
Somebody sent me this story recently. It is true!
Great news! @SteveHiltonNBC is doing great interviews with my top Cabinet Members and most importantly the American people!
Big",February,Q1,18
"Terms & Conditions
Power Rankings: Week 8!
The NFL Season has just started and so far the Cleveland Browns have outplayed the Buffalo Bills 18-3. The Oakland Raiders are struggling to get out of their own",February,Q1,18
"The Department of Homeland Security has approved $126 million in funding to West Virginia to fight the spread of the deadly yellow fever pathogen.
The money will be used to purchase laboratory equipment, increase surveillance efforts and support local health",February,Q1,18
"Update:

President Trump just tweeted that it was @NASA that told me that the path I am on is the fastest in the history of any Presidential Inauguration. The path I am on was never attempted before.",February,Q1,18
Catelynn Fenton (@CatelynnforGA) is a rising star in the Republican Party. A former Virginia State Senator and Secretary of the Commonwealth she became Speaker of the House in the Republican Party takeover of the House,February,Q1,18
