Tweets,Month,Quarter,sampling
"← Is Amazon Going To Be Forced To Pay $(X) For Free Shipping To People Who Order Through Their Website?
A Happy Hour For All!
Thank you for all of the kind messages and comments on our",April,Q2,18
House Republicans are taking a page from the Democrats playbook by using the Zika virus as a partisan football. A mere 5 days after the Democrat President fired him for not getting the government to do more to stop the spread of the disease,April,Q2,18
Venezuela is being run by the most extreme elements of the Venezuelan regime. The U.S. supports them in every way possible. Trump should immediately impose a currency coup to restore faith in the Venezuelan people. The U,April,Q2,18
"The Clintons start the New Year by tweeting that they would be happy to visit the sick and dying in their homes.
The Clintons start the New Year by tweeting that they would be happy to visit the sick and dying in their",April,Q2,18
"The Best of the Best

The Southeast Sports Center has been providing the best in facility and sports experience for fans and businesses in the Charlotte area since its opening in 2009. The Southeast Sports Center offers clean drinking water, a",April,Q2,18
"And the top 10 percent of U.S. incomes are at a record high just as they have for decades.
...And you listened as they lied about your V.P. Nomination. I won it and won",April,Q2,18
"It's official: Iran is going to hell.
The White House has just stated that Iran is going to hell. They wacko @VP were fake Pukes all along!
The Fake News Media is trying so",April,Q2,18
And now I'm excited to see what Greg Gianforte has in store for me in the race for Montana's 6th Congressional District. I am an Extremely Active Veteran and a Strong Leader who will always stand for what,April,Q2,18
"And the National Rifle Association did not even have to offer up this gem from its president to prove to the American people just how much it dislikes Obamacare.
...much less to negotiate on a day-to-day basis",April,Q2,18
"It's official! You can now get your very own FREE copy of @USATODAY now!
...I am thrilled that @PeteRose will be a part of the #NYTimes on the #2Contin",April,Q2,18
"NEW YORK (Reuters) - U.S. stock markets rose on Tuesday after President Donald Trump's surprise decision to recognize Jerusalem as Israel's capital.

FILE PHOTO: A woman uses her mobile phone in front of the",April,Q2,18
"From the archive: Another reason to vote Democratic: A bunch of racists are getting their comeuppance!
The murder rate in the United States has plummeted to the lowest level in our history!! This is because Presidents Obama and",April,Q2,18
"SALT LAKE CITY — A former police chief in Utah was sentenced to 3 1/2 years in prison on Wednesday for killing at least 11 people and leaving dozens more injured during a riot that broke out in 2014.
",April,Q2,18
"Complaints about the Judicial Branch are unfounded and should be ignored.
The people running the GOVERNMENT don’t want to close Guantanamo Bay because they are so busy they don’t even know if they",April,Q2,18
"The Senate has done more for the poor than any other branch of our government. We have cut taxes for hard working Americans and small businesses. And we are working to make college and retirement affordable for all.
These are important",April,Q2,18
"On Tuesday, November 3rd, we commemorate the life of American philosopher Immanuel Kant. This is a man who spoke out for the American people 100% on the evils of Capitalism and the greed of a few. He was",April,Q2,18
"It was reported that James Comey would be fired by the Trump administration. Many people are frustrated that he was fired. That is his prerogative how he wants to utilize it. However, the real problem with Comey is not",April,Q2,18
"Our mission is to serve you. Our philosophy is to prepare you for your calling and to give you the tools you need to succeed. We are committed to protecting your privacy and fighting for the First Amendment.
We are the",April,Q2,18
Speculation over the future of the Florida Keys has not abated. While there are many possible paths for a THOUSAND DOLLARS to be found somewhere in Florida the real questions are: WHAT PATH? and WHY?,April,Q2,18
"The official website for the television anime of Seijo Asano's light novel series Dimension W has announced that the anime will premiere in April 2017 at 11:00 p.m. on TV Asahi.
Thanks,",April,Q2,18
"Homeowners in the San Fernando Valley are being asked to pay more and more to keep their homes from being bulldozed to make way for more and more housing. What is the end game here?
Continuing the Decline",April,Q2,18
"The True Cost of the War on Drugs

by Stephen J. Hayes

Washington Post Staff Writer

Saturday, August 3, 2014

The Drug War is back in full force. The Obama Administration is planning",April,Q2,18
"With the 2016 U.S. presidential election less than three months away and ballot access in the United States at an all-time low, many Americans are wondering why the corrupt and incompetent Obama administration is still allowing states to implement",April,Q2,18
"The United States is pursuing a new approach to China following the country's invasion of the South China Sea. We are working closely with China to contain the spread of these rogue regimes terrorist organizations and proliferation that threatens regional stability.
",April,Q2,18
"The funding for the California Highway Patrol will continue to be provided through Treasury by the same amount that was appropriated previously.
“California Highway Patrol Funding Continues to Grow.” @foxandfriends
“The",April,Q2,18
"The Democratic National Committee (DNC) just said it is going to sue over the fact that the Sanders campaign did not properly inform the DNC that it would be airing ads during the ""Super Tuesday"" contests. After all of",April,Q2,18
"A lawsuit has been filed against U.S. Rep. John Lewis over his comments about President Trump.
The Democratic Congressional Campaign Committee released the following statement:
""Congressman Lewis' comments today are deeply troubling. He",April,Q2,18
"The Democratic National Committee (DNC) released the following statement today on the latest Wikileaks dump on the DNC:
The Trump/Russia Witch Hunt is a complete and total hoax. The Democrats are trying to rig the Election AGA",April,Q2,18
"The top 10 per cent of U.S. families who receive federal cash payments are getting less than half of the federal minimum wage.
Fully half of baby boomers are living in poverty. They cannot afford to lose",April,Q2,18
U.S. Senator Cory Gardner of Colorado on Monday warned the U.S. Senate that the United States will expand its involvement in the fight against the Islamic State of Iraq and Syria (ISIS) if they execute President Trump,April,Q2,18
"More than 2,000 people signed a petition to the White House on Tuesday urging President Trump to end the ""unjust and continued"" imprisonment of Michelle and John Kennedy.
The Justice for the Kennedy Vets Foundation has just",April,Q2,18
"That is NOT my twitter handle. I never said it was. I never called it that. However I have never been more wrong than I was in that interview. Sorry!
...A total and complete shutdown of Muslims coming",April,Q2,18
"The state of Mississippi is suing the federal government over President Donald Trump's executive order temporarily banning citizens from seven Muslim-majority countries.
The Mississippi Department of Corrections and Rehabilitation (MDC) is now charging $57.",April,Q2,18
So I'm seeing some really bad and inaccurate reporting on the Trump/Pence Crime Bill. The Times is a disgrace to journalism. The only thing the Times and their partner ABC are good at is making Fake News look good,April,Q2,18
"Elections Canada is investigating a complaint that a Conservative campaign literature vendor was impersonating a registered voter.
The complaint was received by Elections Canada on Thursday.
The federal Election Act doesn’t allow for code words to",April,Q2,18
"Take a moment to appreciate the beauty of this picture!
Congratulations to @SenLacyGC on a hard fought and successful re-election. She is strong on Crime and the Border and will always put America First!
",April,Q2,18
"What is this?
You can tell I really love this question. It was something we all wanted to know. This is what I came up with. It is a head to head matchup between the two best quarterbacks in the",April,Q2,18
"Another day, another Republican disaster. An American city is in a total meltdown. Not even a hint of people working. All I hear is chaos!
Republicans are now the party of torture. They are against due process for",April,Q2,18
"This is a rush transcript. Copy may not be in its final form.

AMY GOODMAN: Well, here we are. We just saw the worst mass shooting in American history in Las Vegas as more than 50 people were",April,Q2,18
"The government of Canada is committed to supporting thousands of Syrian refugees who are fleeing the ongoing conflict. We are supporting the United Nations plan to resettle 100,000 Syrian refugees in Canada in the coming years. We are also working",April,Q2,18
"USA TODAY Sports

The Denver Broncos have passed up the chance to sign former Green Bay Packers defensive end Brandon Meriweather.
The Chiefs are still in the mix.
Great news for those impacted by this weekend's",April,Q2,18
"I am going to be having a White House Press Conference today at 5:30 P.M. Thank you!
The #1 Misinformation Weapon in the World is the Do Nothing Democrats!
Interesting how they will",April,Q2,18
"#1 in the World for Student Engagement and Performance

The University of Michigan is ranked number one in the world for student engagement and performance. Today we celebrate the fact that more than 61 million people around the world can",April,Q2,18
"The House approved legislation Friday that repeals the Obama-era rule aimed at staving off a major oil spill in the Gulf of Mexico.
The Senate voted 52-45 to reject the rule. The House will now have",April,Q2,18
"A couple of nights ago the President of the United States of America said something that I will never forget.
""I don’t think a word should be said about the fact that hundreds of people were treated amazingly well",April,Q2,18
"What you need

An Internet connection

Additional devices to make up the audience

To get you started:

If you want to see what the audience looks like we have some graphics.
Doing well",April,Q2,18
"The United States is losing more than 50,000 soldiers a year to suicide. The suicide rate is, in fact, falling.
Great news!
@larrygove @USOIndia Our roads, railways &",April,Q2,18
"It's been just over a week since the election of Donald J. Trump and the Democratic National Committee has not taken the following actions:
1. Funded or committed to the fight against the deadly Ebola Virus Disease.
",April,Q2,18
"The United States must adopt a policy of full implementation of the UN Security Council Resolution 2231 and the President's, Secretary of State's and Congress' calls for comprehensive and expeditious investigations into the Russian cyber-attacks and the",April,Q2,18
"The Crime and Corruption Reporting Program at The New York Times has been named one of ""The Best Small Towns in America"" by The Washington Post! Get ready New Yorkers because the Crime and Corruption Reporting Program at The New York Times",April,Q2,18
"This news release is available in German.

Luxembourg, September 25. /RUSSIA.tv The Supreme Court of Luxembourg has ruled that the United States has the legal right to bomb and drone which cities",April,Q2,18
"A Russian hacker who has been denied a U.S. visa believes he has found a way to infiltrate the United States and steal the Democratic presidential nomination.
The U.S. government has granted Russian hackers the perfect opportunity",April,Q2,18
"The Green Party of Wisconsin has endorsed Libertarian presidential candidate Gary Johnson for president.
Johnson is a strong supporter of the Second Amendment and the Great American American Veterans. He is Strong on Crime and the Border he Loves our great",April,Q2,18
"The PGA Tour has announced it will donate $1 million to support the University of Kansas.
This is amazing news for the University of Kansas!
Thank you!
So the Dems are working overtime to make it more",April,Q2,18
Senator Bernie Sanders Bernard (Bernie) SandersPoll: Gillum leads Kavanaugh conducting NYU Hearing Kavanaugh furor intensifies as calls for new testimony grow Sanders: Kavanaugh accusers 'have risked their lives to come forward' Helping citizens,April,Q2,18
"Builders and workers are getting ready for winter construction on the $1.2 Billion Central Florida Waterfront development.
The @FEMA have approved $826M to NYC to help get Wall St. back on track",April,Q2,18
I have been working in the health care industry for over 15 years and have seen first-hand the impact of the Affordable Care Act. The law has saved lives and I have worked with some of the most amazing people in the,April,Q2,18
"In this rare interview, President Obama makes repeated reference to our #1Trade and one of the few with China. A fantastic deal. — Donald J. Trump (@realDonaldTrump) January 29, 2017
TOP SECRET/CON",April,Q2,18
"Last week, the leader of the Free World denounced the U.S. for supposedly being the largest human-rights abuser in the world. He made no mention of the substantial human-rights abuses by our close ally Russia.",April,Q2,18
The US and Russia should continue to cooperate with the UN Special Envoy for Syria Staffan de Mistura and the Syrian National Coalition. The Syrian people are fully behind Staffan and the Syrian people fully support his efforts to end,May,Q2,18
We are currently providing our Premium Members with a very early peek at the future of Zone of the Enders™. This is the exciting new future where you can play the Zone of the Enders on the big screen at home,May,Q2,18
"The United States Secretary of State, Rex Tillerson, has just asked Canada to withdraw its request to reopen our Canadian embassy in Dublin. We will continue to press for the full and swift return of those detained by the Irish authorities.",May,Q2,18
"Nathanial Anthony

Nathanial Anthony

Nathanial Anthony
The Washington Post
The Washington Post
Nathanial Anthony
Nathanial Anthony
Nathanial Anthony
Radio New York
All",May,Q2,18
"A leading prosecutor for Michigan said he is resigning over President Trump's criticism of the independent federal prosecutors who are investigating the Hillary Clinton and her campaign team.
“I was not going to be complicit in the undermining of",May,Q2,18
"Tim is such a great guy and a true pioneer for our great Gold Country!
- I will be giving my total Presidential Approval rating to all of our Country's great Farmers and ranchers- check it now.
",May,Q2,18
"UPDATED: This story has been updated to include comment from the State Department.
A former senior Obama Administration official has told Sky News that the Obama Administration was complicit in the illegal rendition of prisoners to countries such as Iraq and",May,Q2,18
The FBI and Department of Justice have concluded that the Russian government was in fact behind the 2016 U.S. Presidential Election-a conclusion that has been in the making for some time and that was only recently officially made public by,May,Q2,18
"The PC Industry Has Been Rigged Against Women For Years. The Media Is Afraid To Speak Out. How Will This Play Out?
The Radical Left Democrats Hypocrisy Must Stop. We Can't let them Rig the",May,Q2,18
"In 2012, President Obama appointed Chuck Rosenberg, a Harvard Law School graduate, to head the Consumer Financial Protection Bureau. In his first two months, he quietly rolled back consumer protections and weakened enforcement. He also ignored Congress and ignored",May,Q2,18
"Technically there was a fire at this same location over 200 years ago.
Bernie won Montana by a massive margin but Hillary is still losing big. She had nothing to do with her great approval rating. She is just trying",May,Q2,18
"Please help us save the Baltimore Zoo!
""I certainly hope that we will win the election for a second time. I think that is absolutely inevitable. It is a historic time for the United States and I definitely hope that",May,Q2,18
"The National Security Agency has had a vast database of U.S. phone numbers and amounts for several years, even before the Sept. 11 terrorist attacks. The very existence of this database is an absolute no-go zone for",May,Q2,18
"The Cleveland Browns have released wide receiver Travis Benjamin.
BENJAMIN BENJAMIN BENJAMIN BENJAMIN BENJAMIN BENJAMIN BENJAMIN BENJAMIN BEN",May,Q2,18
"Behind closed doors, the National Security Agency has been collecting and storing the phone records of virtually every American. This is not some incidental collection of data by a private company. This is a direct effort to identify persons of interest and",May,Q2,18
"The Cosplay of Steve Austin
Austin was a man who loved his country and his people. He loved our military and our Vets. He loved our #MAGA and #KAG policies and he was totally behind them",May,Q2,18
The United States must quickly approve the shipment of 757 airliners required to meet the U.S. Air Force's global strike requirements. The United States also must quickly approve the delivery of the 757-300ER aircraft,May,Q2,18
"That's right. That's how much you can expect in return for voting for the Republican Party in 2018.
As the Fourth of July nears I want to be very clear: Radical Islamic Terrorism and all that it represents",May,Q2,18
"The Miramonte Golf Club in West Palm Beach, Florida, just across from the White House, was the scene of a massive riot and looting on Saturday night.
The rioters smashed windows and stole from businesses. The",May,Q2,18
"Re: CLOSING: Shelly Sterling | @realDonaldTrump
They are doing a great job on the CoronaVirus front. Keeping up!
I am pleased to report that CoronaVirus testing has been greatly extended by",May,Q2,18
"USS Fitzgerald:

USS Fitzgerald (DDG 71) is currently conducting exercise 'Bomb Scare'. It is not clear if this is related to the recent revelation of the existence of the so-called ""deep state"" and",May,Q2,18
"But it was a stunning display by the U.S. Navy, which took the first action of the day against a Chinese warship in 20 years.
The USS Lassen (DDG 78) was operating in",May,Q2,18
"FIFA President Seeks to ""Flatten"" the World Cup in 2018 by Permitting More Illegal Immigrants into the United States.
I love the great people of South Carolina. I am proud of them. I want",May,Q2,18
"You've probably heard of it.
The Golden State Warriors are proud to announce the signing of guard/forward/wonder sleeper CJ McCollum! A 6-9 power forward from Lodi, California CJ brings a",May,Q2,18
"The Bounty Hunter

This period drama was created by Joel and Ethan Coen and stars Joel Edgerton as a ruthless New York City prosecutor who in the face of mobster Jack the Ripper solves the case with forensic",May,Q2,18
"Here are two videos from the 2016 Republican National Convention that should be mandatory viewing for every Republican:
This is what a President Trump rally should be like. You will be moved by the passion and energy from our great Republican Movement",May,Q2,18
"The Supreme Court has ruled that a Michigan man cannot be prosecuted for having a red skinned baby.
This is a huge victory for all of the American people. Thank you!
I believe that the United States of America",May,Q2,18
"All Americans should join me in applauding the Department of Justice and the FBI for their hard work in securing the arrest of Joe Arpaio!
We are in close communication with the Republic of China. We are monitoring developments closely!",May,Q2,18
"The Royal Canadian Navy is performing tests on Canadian CF-18 Hornets at Naval Air Station Petawawa in British Columbia.
The Royal Canadian Navy is performing tests on Canadian CF-18 Hornets at Naval Air Station Petawawa",May,Q2,18
"In an effort to promote a safer and more prosperous America we have created and are constantly expanding jobs opportunities all over the world including in the beautiful beautiful United Kingdom.
Great news! @UPS is moving an American Family from",May,Q2,18
"St. Petersburg, FL – Today the Florida House of Representatives approved Senate Bill 5386 by a vote of 26-21. This bill would immediately provide a temporary reprieve to those suffering from the devastating effects of Hurricane Harvey.",May,Q2,18
"For the past few years, the Obama Administration has been attempting to replace the failed policies of the Bush Administration. The most recent attempt consisted of a short press release but that was only the beginning. The President has called up every",May,Q2,18
"REDMOND, Wash. (AP) — The Latest on the Senate Intelligence Committee hearing into Russian election meddling (all times local):
Manafort &amp; Gates are facing a criminal investigation by U.S. federal",May,Q2,18
"Not to be confused with Wizard of Oz.
UNH!
A combination of ""not my President"" and ""too soon to tell.""
(Reuters) The United States has withdrawn from the Paris Climate Accord. This",May,Q2,18
"Obama's 'Very Smart' Plan to Reverse Climate Change Will Cost the USA $400 Billion a Year
President Trump has spent the weekend calling for unity and praying for the well-being of our wonderful Country. I have spent",May,Q2,18
Barack Obama didn’t invent the concept of the “emperor has no clothes” line. All presidents who have used it have been either incompetent or downright dishonest. It’s a dishonorable and,May,Q2,18
"The White House says it is 'deeply troubled' by news that Colombia has executed two American citizens under the country's 'death row' despite the US President's calls for clemency.
Colombia's President",May,Q2,18
"This week marked the 50th anniversary of the first word that President John F. Kennedy used to describe a genius: ""Mad Dog.""
The New York Times said this:
On the 50th Anniversary of his Eman",May,Q2,18
"The Washington Post is telling the truth!
Fake News @washingtonpost is reporting that I am ""ruthless."" This is not true. They have never mentioned that to my face or on the telecast. I",May,Q2,18
"AFP/Getty Images

""We've got to get back to business as usual.""<|endoftext|>The Hottest Video Game Trend of the 21st Century!
Welcome to my YouTube Channel! I will always be a big fan",May,Q2,18
"The government is targeting the drug cartels, not violent criminals. That is why I am creating a new agency to combat both violent and corrupt criminals nationwide.
The Radical Left Democrats want to keep you on the government and not allow",May,Q2,18
The reason for this drastic change in policy is not because I appointed a Special Prosecutor but rather because of my inability to do so. Because of this I have been able to expand and protect our Borders far more than any President in,May,Q2,18
"One of the most important things you can do in your personal and professional life is to understand that you are not special. You are just as flawed as everyone else. You are just as flawed in your own way.
I",May,Q2,18
"The Utah Republican Senate nominee is up by 5 points in a new Marquette Law School Poll. | AP Photo Poll: GOP nominee up in Utah

Donald Trump is getting ""better"" marks in a new Marquette Law",May,Q2,18
Will Gomber (@WillGomber) is a Senior Fellow at the Stimson Center @StimsonCenter and a member of the Council on Foreign Relations. He has been a columnist for The New York Times for,May,Q2,18
"Yes! The NCAA is so corrupt and inept! They don’t prosecute fraud at all!
They are going to do what they always do and blame you. It’s the only way they can go around",May,Q2,18
"In a bid to boost trade between the two countries, the Indian government is set to introduce a tariff of 27 paise on all electronic goods.
The move, which will also apply to hardware and software from both these countries",May,Q2,18
"The FBI has begun an investigation into whether President Trump or anyone in his inner circle may have committed a crime. Sources tell CNN that the investigation is ongoing.
Did Crooked Hillary Clinton get away with murder? Very possible.",May,Q2,18
"HARRISBURG — The RNC has withdrawn its complaint that the Trump campaign mislead the public by not fully disclosing that it had already spent $66 million on ads in the attack on the satirical news website ""Duck Dynasty",May,Q2,18
"The American people are sick and tired of hearing the same old Sad &amp; Misleading talking points. The short version is that they are not true &amp; do not reflect the situation. We must get tough!
",May,Q2,18
"Another President Has Been Dropped for Doing Nothing. Who will Be Next?
“President Trump”s decision to withdraw from the Paris Climate Accord was not based on the science of the science was not based on the",May,Q2,18
"In an unprecedented move, Sir Gerald Kaufman, the former Labour home secretary who was instrumental in the Government's action to tackle the Government's own crime and disorder, has been appointed as the new President and CEO of the National Crime",May,Q2,18
"The best way to make someone feel terrible is to do nothing. That is why so many Americans are angry. A RIDICULOUS ATTACK ON A U.S. POLICE OFFICER!
We are getting",May,Q2,18
And no I don't think so either. I think he just doesn’t want to talk about it. He did a great job with the House last week. I would think he is going to do a great job,May,Q2,18
"The Department of Justice is seeking to suppress the vote of Texas voters in order to steal the election for Hillary Clinton.
I will be asking for an investigation as sick as it is politically motivated. People are dying in these under",May,Q2,18
