Tweets,Month,Quarter,sampling
"Since then, the White House has been putting out fires through talking points sent to reporters and a tweet from the President. All of this attention to a little thing called the Russia Hoax. The Fake News Media is working hard",May,Q2,8
"I have reviewed and approved the new E1S Vinson Intruders - They are now in use in the Middle East - You can see the following from the website: ""Built to be as lethal and effective against our",May,Q2,8
"You heard right!
The House just passed the STOP Funding Act with a BIG Republican majority. It was a long and hard fought victory - and it sends a very strong signal that we are going to continue to stand with our",May,Q2,8
"The Florida Legislature has passed House Bill 4254. It will be signed by the Governor. The bill will protect the rights of every Floridian and better protect the most vulnerable.
SIGN LIKELY!
This is a",May,Q2,8
"You are going to love this Chicken Pot Pie. It is sure to be one of your favorite Thanksgiving dinners. It's super easy to make.
...the Great and Powerful United States of America. Thank you!
I",May,Q2,8
Bradley Manning is set to be sentenced on Wednesday for leaking classified documents to the press. The sentencing is a historic and historic event because it will mark the first time that a soldier of color – a true American hero – will,May,Q2,8
"The new time zone system

This is a good example of how the U.S. and many others can get things done when we work together. The USA has decided to move to a new time zone system in an",May,Q2,8
The key to ending the opioid epidemic is to treat opioid addiction as a health crisis. This is not about getting high. This is a real health crisis that will ultimately take many lives. We have done more to treat and save,May,Q2,8
"A few months ago, I was at a dinner where an old friend of mine was having a great time. As he was talking about all the wonderful things that had happened in his life he noticed something strange. There was a",May,Q2,8
"The U.S. Embassy in Baghdad has reopened following the failed coup attempt. American citizens have been allowed to return to their homes.
The real reason why the MSM won't talk about the coup is that it would expose",May,Q2,8
"It's been called the loneliest name in politics.
At long last a title that I'm very proud of!
I will always love Wisconsin. I love our great people LOVE our wonderful state of Wisconsin. I",May,Q2,8
"The Fed should never have created the unproven (and very real) fear factor in the first place.
The answer to the Federal Reserve is not more QE. It is to have more discipline!
The failing @",May,Q2,8
The New York Times Editorial Board has a very good piece up about how the Iowa Polls are a huge Flop as they are being run by Fake News CNN. They are Fake News just like the Monmouth Polls which,May,Q2,8
"The country is at risk of becoming a police state like North Korea.
The United States is at a critical crossroads and I cannot in good conscience continue to allow this illegitimate Coup to take place in our Country. It has",May,Q2,8
"I'm sorry, but this is too much. There is no way this is legit!

Not true. They are being paid $$$$ for their silence!
Total and complete Endorsement of Chris Van Holl",May,Q2,8
"He wasn't even supposed to be a congressman.
Hey @RepWhitfield thank you for your kind words but I was forced to fire you for your completely made up story about me at the time. I never said that",May,Q2,8
"So I missed the last few changes to the Psychic ability Spontaneous Combustion? Well I guess the real test is not if but WHEN?
The real test is not if but WHEN?
The real test is",May,Q2,8
I am a feminist! I believe that all men and women are created equal and deserve the opportunity to lead fulfilling and fulfilling lives. I am proud to have been a Senator for New York from 1986 to 1992 and I served as,May,Q2,8
"Government Accountability Office Report Slams Depleted Uranium
The U.S. Government Accountability Office (GAO) has just released a scathing report on the Depleted Uranium program.
The Depleted Uranium (D",May,Q2,8
"After years of work and with the help of our amazing partners from the CDC and many others, we are finally tackling this massive epidemic. Our efforts continue today!
I have asked the Department of Health and Human Services to quickly",May,Q2,8
"The Illustrated History of the United States by Carl Bernstein

The Intelligence Community is the most powerful and important organization ever created by the United States Government. It is the backbone of our extraordinary democracy. The President cannot do his jobs",May,Q2,8
"The United States is following up on concerns raised by the United Nations that China has been slow in addressing widespread human rights abuses across the country.
The United States is following up on concerns raised by the United Nations that China has",May,Q2,8
"It is thought a Boeing 777-200ER jet was shot down over eastern Ukraine on Saturday killing all 298 people on board.
Bloomberg
The infamous 'Obama Witch Hunt' is finally over. Two years after the 'f",May,Q2,8
"Special Counsel Robert Mueller's team is probing the possible collusion between President Trump's 2016 presidential campaign team and the Russians, sources tell ABC News.
The probe is not related to the Russia investigation but is in its early stages.",May,Q2,8
"It is my great honor to introduce our distinguished guest speaker tonight, Donald J. Trump. Thank you very much!
I will be holding a news conference at 5:00 P.M. Eastern. Here is the text",May,Q2,8
"The Russian government has warned that if the Trump administration does not end its ""unfair and illegitimate"" sanctions against Russia it will ""pay a huge price"" and that it will ""get tough"".
The warning comes after the",May,Q2,8
Today at 3:30 P.M. Eastern we'll be making a small adjustment to the Travel Ban. We'll be making this adjustment while the courts review the second stay. We estimate this adjustment will take 60 minutes based,May,Q2,8
"Yesterday at George Mason University, I discussed how President Obama and the Democrats are trying to rig the 2016 Presidential Election. They are bribing the Electors in an attempt to rig the Election; they are not even trying!
",May,Q2,8
"He has been called out on lies such as these before. Now he is making them up again.
Just got off the phone with the Great State of South Carolina. They love South Carolina. Love the South! Love John",May,Q2,8
"If you're looking for a fresh start looking to retire with dignity then look no further!
There is a lot of talk about China stealing our jobs but that does not make it true. We have the best people anywhere in",May,Q2,8
"Jacksonville, FL - JANUARY 13: Head Coach Jack Del Rio of the Jacksonville Jaguars looks on during the first half against the Atlanta Falcons at Mercedes-Benz Stadium on January 13, 2016 in Jacksonville, Florida.",May,Q2,8
"Just in: The Trump Administration is poised to approve the Keystone XL Pipeline. This is big. Big news. The U.S. will now be a global leader in transportation!
The Radical Left Lamestream Media is",May,Q2,8
The Covered Oregon Health Plan is a great example of how a pre-existing condition can be treated successfully. We have over 17000 eligibles enrolled under the plan and with the federal funding for the plan coming our members will,May,Q2,8
"More than 90 per cent of voters said she should apologize!
WOW!
.@RepStephenFinn is an American hero. He has been fighting for our Military Vets &amp; our Vets Vets",May,Q2,8
"Is this the most important election in our nation's history?
There has never been a presidential election in which the people of this great country have had more say than they will have this November. I want to thank Governor Mike",May,Q2,8
"The Daily Caller reports:

Hillary Clinton and Bernie Sanders are locked in a tight battle for the Northeast Iowa caucus vote. @GOPLeader tells me that @HillaryClinton will win the State of Iowa. She has big leads",May,Q2,8
"A love story that began on a T-shirt and ended in a movie so good you've gotta see it to believe it.
....And they are going to be very angry. They have been doing this for years.",May,Q2,8
The National Reconnaissance Office (NRO) is the premier spy agency in the world. I know this because I was inside the agency when I was the head of the CIA and they (the Obama Administration) were called out,May,Q2,8
"Allegations that Mr. Trump conspired with Russia to sway the 2016 U.S. Election have been swirling around Washington for months, but they only grew in the wake of Mr. Trump's stunning election victory. Now",May,Q2,8
"A black man who called 911 to report an armed black male was shot and killed by a police officer in Milwaukee Wisconsin.
The police officer has now been fired for dereliction of duty and is now on administrative leave.
",May,Q2,8
"So what happened to all those fraudulent Berniebots who tried to get into the Democratic National Convention? They never even registered as Democrats, just like they failed to show up for the Republican National Convention.
Are all of the fraudulent",May,Q2,8
"The Labour leader spoke to the Leader of the Opposition of the United States. They had a very good conversation.

I hope everyone watching tonight is a very good doctor. There is nothing I do or say that is going",June,Q2,8
"If you're going to be @WhiteHouse press corps, why not invite us in for a photo op? We can tell the press the real story!!
Amazing how the mighty have become the paupers of the world",June,Q2,8
You'll never guess what a terrible person this is. It turns out that he/she is the real Nancy Pelosi. Just like the one that didn’t tell us that the House If anything would be worse than last,June,Q2,8
"PITTSBURGH - The Pittsburgh Penguins have recalled goaltender Connor Hellebuyck from Wilkes-Barre/Scranton of the American Hockey League.
Hellebuyck, 24, appeared in two games",June,Q2,8
"Failed Presidential Candidate (and Reality TV Star) Donald Trump has been named by the New York Times as being in the process of forming an 'exclusively American' company.
The New York Times has named me as the",June,Q2,8
"Rise of the Tomb Raider Review – A Not So Pretty Sequel!
Rise of the Tomb Raider Review – A Not So Pretty Sequel! by BruceAckerman
Another review in which RUM is the",June,Q2,8
The City of Portland is proud to announce that it will receive over $40 million dollars in funding to help build the city's future transportation system. This multi-year construction partnership between the City of Portland and the state will ensure,June,Q2,8
"Update:

MIT has released a statement saying, ""We are deeply concerned by the news that senior officials from several countries have been notified of the possibility of a terrorist attack within the United States. We've sent letters to",June,Q2,8
"In honor of National Transgender Discrimination Remembrance Day, I'm launching an initiative to empower transgender people and their allies across the country to overcome the odds and make America Great Again. Together we are Americans First!

Today was",June,Q2,8
"I have long advocated a one-state, negotiated-for-two-states, one-state-for-two-states solution.
I have always advocated a one-state, negotiated-for-two-states",June,Q2,8
"Crime Stoppers of San Francisco is offering up to a $2,500 reward for information leading to an arrest and conviction in the murder of Manuel Javier Noriega. If you have any information regarding this case, you are",June,Q2,8
My Santa came through! I got a beautiful book about a person named Thomas Jefferson. You know how Jefferson was such a crazy man. He was such a genius? Well he was so insane he was labeled as such in the,June,Q2,8
"Vancouver Gasand – The Green Energy Investment that Will Transform Your Life!
Earthquake damage to my @B.C. office building in Burnaby BC. Work to be done. Will be repaired. Will be",June,Q2,8
Fallout New Vegas add It has been over ten years since the great battle began. We are finally at peace with the Feral ghouls in the Capital Wasteland. Unfortunately it will not be forever. The Sentinels are,June,Q2,8
"However, this did not stop the Democratic Party from throwing their weight behind the TPP.
The Democratic Party has a problem.  Donald Trump needs them now more than ever.
Great job!
I was pleased to receive",June,Q2,8
"It was a great honor to be here with you this morning. My pleasure.
Interesting Times. Thank you!
Great interview with @jeffTheede of @FoxNews. Enjoy!
I have just spoken",June,Q2,8
"A woman who was allegedly raped by two men in her home has died. The victim was her husband. (Twitter)
-- New York City Mayor Bill de Blasio and Governor Andrew Cuomo both issued statements late yesterday condemning the assault",June,Q2,8
"Eventbrite, and certain approved third parties are a protected service of the community. >>> Last night I was asked to speak by a great friend and supporter from the White House. Here we go over what I said to the",June,Q2,8
"This article is from the archive of our partner .
On the heels of a recent mass shooting in Las Vegas, we again ask our country to unite in this time of need. We are with you all the way!
",June,Q2,8
"I was very pleased to see that President @PeteHegseth and the Governor of Minnesota signed the most sweeping tax cuts in state history! #MN16
Thank you to @GovBillLeeFL for your leadership",June,Q2,8
"A POLLSTER and a CANDIDATE FOR PRESIDENT!
Wow!
I am so happy that @MariaBartiromo is doing a GREAT job at @FoxNews. Great interview &amp; has my",June,Q2,8
"In a shock announcement, the United States Treasury Department has recently announced that the United States will be withdrawing from TPP. Now this is a deal that many believed would never even be considered!


TRANS-ALONG!",June,Q2,8
"The Australian Competition and Consumer Commission (ACCC) has fined Apple $US0.0119 billion ($A080.5 million) for a year-long practice of unfair competition in the mobile phone industry.
DO NOT",June,Q2,8
"United States v. Hernandez

United States v. Hernandez determined that the United States government cannot use New York City's high death toll on any pretext. New York is a war zone.
Well if that is the case",June,Q2,8
I have been accused of being racist for saying that the Vietnamese people love their President. They do. This isn't a racial statement. It is based on the fact that the President of the USA is the most popular President in,June,Q2,8
"There are many reasons to be nervous right now. This isn't the first time that the Federal Reserve has caused panic and trouble. They are always wrong about EVERYTHING!
Who are the Radical Left Liberals in Congress who have",June,Q2,8
"We are very happy to announce that Adrien Brody will be joining us for another installment of #MAGA on @FoxNews tonight at 8:00 P.M.
Adrien Brody is a very decorated Vietnam",June,Q2,8
Bernie Sanders says he wants to reduce the cost of prescription drugs by letting the private sector fix and sell them. He also wants to bring back the Iron Curtain. He also wants to close the Guantanamo Bay prison. He may,June,Q2,8
We are proud to present the first ever CB Stampede Parade in the City of Angels! The parade will start at South Hollywood Memorial Park at 6:30 a.m. and will run through Downtown Los Angeles. The,June,Q2,8
"The ravaged city of Kunduz Afghanistan has been named after a colorful &amp; brilliant American Gen. George ""Buzz"" Garfield.


General Buzz Garfield was a GREAT General who LOVED his family &amp; friends",June,Q2,8
"NATIONAL

President Trump and his team are busy working hard to complete and deliver a great HealthCare Bill that will CUT Taxes &amp; kill your Healthcare costs far beyond anything seen under previous Republican &amp; Obama",June,Q2,8
"The Golden State Warriors are back. Golden State is back.
I love New York. I love New York. I love New York.
THE GREATEST JOBS GIVEN IN NEW YORK CITY BY ANY INDUST",June,Q2,8
"Promises made on the campaign trail would be broken by Congress and the Obama Administration. They are now the target of Fake Dossier production. What are their sources?
Narcissists will be the most dangerous group of",June,Q2,8
"The Trump Campaign is considering firing Corey Lewandowski, the man who beat up my campaign volunteer in Iowa. Even though he came back and beat up another volunteer he is not welcome at the White House!
Will be interviewed on",June,Q2,8
"The FDA is now requiring doctors to inform students of the possible side effects of the chemical used in the Agent Orange that was sprayed on Vietnam.
More than 60000 people have died in the United States from Agent Orange since it",June,Q2,8
"The Obama Administration Pushed a Bill that Would Have Sentenced 3-Year-Old Boys to the Middle Ages
The bill was introduced by a great Congressman @Steve Scalise of Louisiana. He is a strong Christian who loves",June,Q2,8
"I am starting a new restaurant in Massachusetts!
It began when I came into politics here in Massachusetts. I founded the Kennedy Center Honors College and launched the MA-based Kennedy Center Honors Scholarships. Since then I",June,Q2,8
The New York Times reported that the Trump campaign paid Dr. Laszlo Bock for a speech last summer in which he called for the murder of Muslims and other groups. Dr. Bock has since retracted his views and,June,Q2,8
"President Trump on Friday blasted the media for reporting ""a total hoax"" that former President Barack Obama had wiretapped him during the campaign.
""The Fake &amp; Corrupt News doesn’t report this. It",June,Q2,8
"Mitt Romney and the 47 Percent isn’t a long-shot. The New York Times’s Paul Krugman is right. This is a slam-dunk for us!
A bunch of thugs broke into",June,Q2,8
"Thanks for the heads-up!
-- @GOPLeader Steve Schmidt (@SteveSchmidt) October 28, 2014
We love you!
Proud to be running against Rep. Mo Brooks R-AL! We need",June,Q2,8
The 2013 NFL season has begun and with it a new schedule full of games that will be broadcast on the NFL Network. I attended the Scouting Combine today in Indianapolis and had the chance to see over 100 prospects including Patrick Mahomes,June,Q2,8
The movie about the cancer that took the life of my dad has opened in over 30 countries and earned Oscar nominations including Best Picture for Mad Max: Fury Road. It is going to be the biggest movie of all time. It,June,Q2,8
"This is the hard truth about the Richmond Police Department: They are one of the least safe large law enforcement agencies in the country.
The police officers lives and the lives of their families are at risk by Riot Police thugs.",June,Q2,8
"The New York Times is reporting that the Federal Reserve will soon begin raising rates again. The Fed raised rates by a record low amount in December, and this will be their first hike in 3 years. The Fed raised rates by",June,Q2,8
"We have just announced that the White House will host a luncheon for business leaders on Tuesday March 16th at the @WhiteHouse.
...
.@PeteHegseth’s new book is called",June,Q2,8
"PRINCETON, NJ -- When President Obama was elected in 2008, he had a favorable rating of 49% - 9 points higher than the average for the next 11 months. Since then he's maintained a 58% favorable",June,Q2,8
"The following article was originally published by the Daily Caller:

Former CIA Director John Brennan and other Homeland Security officials have finally admitted the Obama Administration knowingly allowed the very dangerous H1N1 swine flu virus to spread rapidly",June,Q2,8
"743 days 3633 hours 15496135 minutes 6817272328 seconds

since Friday, June 21, 2014 at 5:00:00 pm (Sperryville time)

Today is a Saturday",June,Q2,8
"Chris Hayes of MSNBC got frustrated with Hillary Clinton on Monday night and decided to call her out for not being as sharp as she should have been.
""Can we at least have a little more decorum with the press following",June,Q2,8
"The man who arrested Congressman John Lewis after he spoke at the Women's March last month just got a new lawyer. That's right.
The man who arrested Congressman John Lewis after he spoke at the Women's March last month",June,Q2,8
"The 2018/2019 season is just around the corner so be sure to sign up today!
CRIMINAL JUSTICE APRIL 15TH 2019!
#BLACKLIVESMATTER
MAKE AMERICA GREAT AGAIN!",June,Q2,8
"A couple of days ago I wrote an article about the fact that Philanthropy is the #1 scam of our time. It is an incredible $100B a year and it is destroying our economy.
The biggest scam",June,Q2,8
"Praise be to Allaah.
They are insane!
They are insane!
Iranian President Hassan Rouhani is a man with a huge heart. He will not let our people down!
“Iranian President:",June,Q2,8
Senator Chris Murphy (D-CT) said Sunday that he is open to working with Speaker Paul Ryan Paul Davis RyanHouse passes resolution blasting cities that allow live ammo #1. Republican badly flawed election win and we need Speaker Ryan,June,Q2,8
"Praise be to Allaah.
Ibn 'Abbas said in al-Maa'idah al-Kabir that there is no evidence against the Prophet ﷺ and that he had nothing to do with",June,Q2,8
"The ability of words to express emotion and understanding is what makes a great story.
A great story is one that moves you and makes you feel something. This story was made even greater by the fact that our very own @",June,Q2,8
"LGBTQ people have been saying for years that this was what we wanted and it has been coming true. Our economy is booming jobs are being created the FBI is GREAT!!
.@FoxNews is a disgrace to journalism.",June,Q2,8
"The UESPWiki – Your source for The Elder Scrolls since 1995

This article is about the dragon. For the active-aggressive creature that attacks using powerful breath weapons, see Frost Giant

The Frost Giant is",June,Q2,8
"The state of Ohio is asking the Supreme Court to let its voters decide the fate of SB 5201, a law which gives the Governor the power to veto any bill that he doesn't like.
Ohio is asking the Supreme",June,Q2,8
It was a really good week for the President. He had a very good week last week. The stock market came back up big AFTER THE PRESIDENT FIRED 22 Tomahawks at 2 Syrian Rebels. Highest number of Tomah,June,Q2,8
"TAMPA — A jury was just told Tuesday that a Florida man lied to federal agents about the nature and extent of his plans to kill as many people as possible in the United States.
Judgment in the Ells",June,Q2,8
"Somewhere out there is a great story. Please share it with everyone you know!
“A strong national security team led by the Department of Homeland Security is in full gear to stop all of these dangerous and illegal",June,Q2,8
"The Cleveland Clinic has the largest Clinic network in the United States and we have dedicated specialists to visit with all of your medical needs!
...and I will be accepting your Requests now thru the end of May.
Thank",June,Q2,8
This study examined the effects of two types of training interventions on aerobic capacity (VO2max) and muscular strength in elite male weightlifters (mean age 37.4 ± 1.1 years) using a variety of resistance,June,Q2,8
Video: Video: Trump supporters heckle reporter who asked about their vote Donald Trump supporter gets into a shouting match with a reporter as he asks a question about his vote Donald Trump supporter gets into a shouting match with a reporter as,June,Q2,8
"Praise be to Allaah.
We are all Al-Ansar!
We are all One!
The European Union is a laughingstock! They are failing on almost every front and keep screwing us. They",June,Q2,8
"The tensions between China and India escalated further on Wednesday after Beijing accused the neighbouring country of trying to encircle the Sichuan capital of Chengdu.
The International Committee of the Red Cross (ICRC) said on",June,Q2,8
"Vol.2 No.1
THE LEADING STRATEGY TO REBUILD THE AMERICAN PEOPLE'S SECURITY IS CORRUPT AND FAIRLY JUDGMENTAL.
The United",June,Q2,8
"For other uses of the term ""coronavirus,"" see Coronavirus.
I only want the truth. No grand jury or anything of the sort. Just the facts. I can also be trusted with the",June,Q2,8
"We are currently in the process of changing the email address of the Governor of the State of Wisconsin to GovernorGutfeld@state.wis.
.@RNC is the party of Lincoln &amp; WE WIN",June,Q2,8
"The Chargers are going to be a Super Bowl LI team!
“The NFL is so biased against the Chargers it is ridiculous!” @IngrahamAngle @FoxNews
“You have to give the",June,Q2,8
"The UESPWiki – Your source for The Elder Scrolls since 1995

This article is about the quest. For the quest, see Same Old Story.

A Stealing of the Fair is a quest available to",June,Q2,8
"Reset
President Trump has declared a national emergency in 44 states and Washington, DC.
A great man by the name of Jeff Sessions was recently confirmed as a federal judge on the 9th Circuit Court of Appeals. He",June,Q2,8
"NEW YORK -- The NBA announced on Monday that it has recalled approximately 9.5 million baseball caps for use in the 2016-17 regular season.
The recall is to address safety concerns and to ensure that the correct sizes are",June,Q2,8
LONDON (Reuters) - British Prime Minister Theresa May called on European Union states to unite to tackle the growing threat of the so-called Islamic State and said Britain wanted to help European police fight the gangs and drugs that are,June,Q2,8
"This is a rush transcript. Copy may not be in its final form.

AMY GOODMAN: We turn right now to a story that is being covered around the world, Iran's long feared nuclear weapon. The Obama Administration",June,Q2,8
"The deadline to file your federal income tax returns has now passed!
Feds need to get this done ASAP so that we can all GO TO WORK on Day ONE. Hope everyone is doing well!
Great news! @",June,Q2,8
"But even that may be too little too late. When the delegates to this year's Democratic National Convention who have not yet been elected are finally elected, we are going to have a very different party.
I will be the",June,Q2,8
