Tweets,Month,Quarter,sampling
"Twitter is an incredible tool for education. We are working hard to ensure that every student in America has the opportunity to learn with the strongest educational resources have ever existed.
President Trump is doing a great job on Manufacturing JOBS",January,Q1,8
"The National Rifle Association said Tuesday that the State of Colorado doesn't have the legal authority to deny people the right to vote based on their sexual orientation.
'The State of Colorado does not have the legal authority to deny voters",January,Q1,8
Ace Attorney 5 Review - 6 IMAGES Full Review Ace Attorney 5 Review - 6 IMAGES Full Review Ace Attorney 5 Review - 6 IMAGES Full Review Ace Attorney 5 Review - 6 IMAGES Full Review Ace Attorney 5 Review - 6 IMAGES Full,January,Q1,8
"The United States has a long and proud history of standing up for freedom and justice around the world. That is reflected in our commitment to the people of South Sudan and throughout the world where we are strong.
Under my Administration",January,Q1,8
"The Brady Campaign to Prevent Gun Violence has released the latest numbers from the National Instant Criminal Background Check System (NICS). The Brady Campaign found that from January 1, 2014 to February 28, 2016 there were 8.3 million",January,Q1,8
"Looking for news you can trust?

Subscribe to our free newsletters.


Remember when Republicans were all mad at the Obama White House for putting out a statement on the potential race to the Supreme Court Justice Scalia? Well",January,Q1,8
"The Department of Justice has decided to drop its investigation into former National Security Adviser Michael Flynn, overturning nearly two years of work by special counsel Robert Mueller.
The decision to drop the case against Flynn and to bring this case",January,Q1,8
"The Equal Employment Opportunity Commission (EEOC) has opened an investigation into the termination of a California woman for being pregnant.
An employee of a construction company in California is under investigation by the Equal Employment Opportunity Commission (EEOC",January,Q1,8
It's not just the president who has been caught up in the Mueller investigation. The FBI itself has been caught up in some very serious and very illegal things. I hope people around the world are very careful who they talk to,January,Q1,8
"The expansion of the Trump International Hotel & Tower in Washington D.C. will be a disaster for the people of Washington D.C. — Tom Tancredo (@TomTancredo) August 14, 2017
Some",January,Q1,8
"The zen of it all!
President Trump has been doing a great job on the CoronaVirus front. In fact he has the reputation of a ""Birth Certificate"" guy since he said on the campaign trail that he",January,Q1,8
"BALTIMORE (WJZ) — One person was killed and at least 20 others were injured in a double shooting in the Roseland neighborhood of Baltimore.
Authorities tell me that at least one person was killed and",January,Q1,8
"Hillary Clinton has completely and totally destroyed the Trump/Pocan relationship. Bad for our Country great for the Great State of New York! Also good for the great people of New York!

The Democrats are using the",January,Q1,8
"The Giants have agreed to terms with minor leaguer Willson Contreras on a minor league deal from Triple-A Sacramento. He will join the team on Saturday.
Greatest Show On Turf®!
",January,Q1,8
"The ACLU of Alabama is pleased to announce that we have won a historic victory in our fight to end unconstitutional unconstitutional searches and seizures by the Birmingham Police Department.
As I have said from the beginning of my Administration we are going",January,Q1,8
"The House Intelligence Committee has approved subpoenas for records related to the FBI's investigation into Russian election interference.
There was a lot of confusion yesterday regarding the subpoena process. The VA Inspector General has informed me that the VA was",January,Q1,8
"Here we go again!
Here we go again with the Tax &amp; spend plan. No Trump nonsense. Nothing but terrific things going for us!
The Federal Reserve is very smart. They are lowering their key interest",January,Q1,8
"The Columbus Blue Jackets have agreed to terms on a five-year contract with forward Boone Jenner, it was announced today by President of Hockey Operations/General Manager Jarmo Kekalainen. Per club policy terms of",January,Q1,8
"American Muslims are endorsing Donald J. Trump for President in record numbers. A recent CNN/ORC poll showed that American Muslims have a favorable opinion of Mr. Trump at 57%.
Can anyone believe that @FoxNews is",January,Q1,8
"""So what exactly happened?
A lot of people were upset about the decision not to include African-American voices in the review. They were right!
The totally discredited conspiracy theory that the @nytimes refused to include",January,Q1,8
"The New York Police Department is investigating a fatal officer-involved shooting in Brooklyn.
NYPD: Officers Shot By Unarmed Man At Lorimer and Washington Streets NW
A 27-year-old man was fatally shot early",January,Q1,8
"Our Price: $15.00


All or Nothing Cards - White Stock!
5.00% Priority Shipping on Orders $75 and above.
If you have any questions please call 800-524-5769",January,Q1,8
"The Canadian Press


MONTREAL -- The Senate narrowly passed Bill C-51 on Thursday, a bill that could see the creation of what's being billed as Canada's ""most expansive anti-terror law in history",January,Q1,8
I was very surprised to hear the recent news that President Trump would be holding a news conference on Tuesday. I never thought I would say this but he and I are at war. We have been at it for many years now,January,Q1,8
"including new camera angles and everything!

Thank you to @FoxNews for sharing the new Donna Brazile docs with Congress. The Dems are going bananas!
The media is going bananas with these Donna Brazile docs.",January,Q1,8
"Vernon Hughes: We need to work with India to defeat Daesh
Joint Statement by the Prime Ministers of the UK and India. Thank you all for a great evening. Hope to see you on Saturday!
...",January,Q1,8
"I've never really read the books by Stephen King, but I've heard so many great things about them. For example - he wrote about a serial killer named The Ripper who stabbed innocent people to death in different places and",January,Q1,8
"This article is from the archive of our partner .
Former Alaska Gov. Sarah Palin is the most overrated politician in the history of politics. She was a poor candidate (went out of her way to take money from oil",January,Q1,8
"The Pentagon says a Russian-built anti-aircraft missile fired on the United States on Tuesday killed one person and injured at least 16 others.
The Pentagon says a Russian-built anti-aircraft missile fired on the",January,Q1,8
"People have been asking for an answer to this question for a long time. Is it possible that the largest terrorist attack in U.S. history was not by ISIS but by a few small groups of very angry people?
",January,Q1,8
A few days ago I posted an article on the subject of the War on Drugs. The article was well received and I received a lot of questions about it. Unfortunately I didn't have the time to respond to every question I,January,Q1,8
"The US Army is looking for a Soldier to join us on a 3 day deployment to Europe.
We are doing very well in the polls and have done a very good job on Healthcare and the Border. A big factor is",January,Q1,8
The New York Post is reporting that the NFL and the White House are working on ways to keep the game relatively peaceful during the Super Bowl LI in spite of the fact that we have seen a LOT of violence in this country in,January,Q1,8
"Many thousands of dollars have been raised for a young man who is fighting for his life after he was shot in the leg.
A young man has passed away in our thoughts and prayers. He was a great kid from Hollywood",January,Q1,8
"In a stunning turn of events, it has been revealed that the CIA Director John Brennan has admitted as much.
It was reported that the CIA Director John Brennan admitted that the Obama Administration knew months in advance that the Russians were",January,Q1,8
"You can use it for filming Mardi Gras and all other fun things. Just remember to pack it in!
A GREAT MAN!
The President has done a BIG &amp; AMAZING JOB!
",January,Q1,8
"VANCOUVER — As the Edmonton Oilers prepare to face the Vancouver Canucks in Game 7 of the Stanley Cup Finals on Sunday at BC Place, the Canadian Broadcasting Corporation (CBC) has gone so far off the deep end that",January,Q1,8
The Vireo Seven are the only surviving members of the famed Vireo Seven Special Response Team. They are legendary and courageous heroes who went above and beyond to save many lives. They were especially dedicated to those in the,January,Q1,8
"Coach Tom Herman said Monday that he doesn't have a problem with Ezekiel Elliott playing football for the Texas Longhorns.
Coach Tom Herman said Monday that he doesn’t have a problem with Ezekiel Elliott playing football for the",January,Q1,8
"It is hard to believe that the greatest nation in the history of the world, the most powerful nation in the world, the most beautiful nation in the world would allow its citizens to be hit by small arms and that the United",January,Q1,8
"The first time I heard of the term ""Trumpster"" was when Jack Posobiec tweeted it out last night in response to my statement that there is absolutely no evidence to support the widely-reported claim that President Trump",January,Q1,8
"Furious about the recent increase in the price of prescription drugs? Then you are in for a big surprise.
You know how when the price of gasoline goes up you go out and spend more money to drive more?
",January,Q1,8
Last year even I wrote that we should stop calling Obamacare the greatest legislative achievement in American history. In fact it wasn't. Politicians always like to call things their own way so long as they can say they are the real,January,Q1,8
The Florida Department of Law Enforcement (FLDLE) is investigating after a woman named Ashley Madison founder Eran Elazar was found dead in his Orlando home with multiple stab wounds. Elazar has been arrested for Domestic Violence Battery,January,Q1,8
"A new poll from Public Policy Polling shows Donald Trump leading Hillary Clinton in a head-to-head matchup.
A new poll from Public Policy Polling shows Donald Trump leading Hillary Clinton in a head-to-head",January,Q1,8
"The U.S. Department of Health and Human Services has been informed by the Dominican Republic that the number of people dying there due to the Zika virus is ""very very low"".
The U.S. Department of Health",January,Q1,8
The National Rifle Association has released a new ad attacking Sen. Chris Murphy Christopher (Chris) Scott MurphyDems push back on using federal funds to arm teachers Want limited to no regulation Supreme Court the hottest ticket item May end well,January,Q1,8
"The mom of a U.S. Navy SEAL killed in Pakistan says her son's killer should be brought to justice.
CNN reported that the killer was a U.S. soldier and that Pakistani officials strongly denied the charges",January,Q1,8
"One can only imagine the attention Tesla is receiving. This is the most amazing thing that has happened to our Country in a really long time. Thank you President Trump!
Thank you Mike!
“Trump Analyizes FCC",January,Q1,8
"Annotation

And so it begins again. After several years of work and with very few signs of slowing down the United States Government is going to create yet another far reaching and overreaching bureaucracy called the Federal Reserve. It",January,Q1,8
"Media playback is unsupported on your device Media caption Theresa May spoke to the President of the Philippines about the situation in Mindanao

The UK is working closely with other Commonwealth nations to keep people in the UK as far as",January,Q1,8
"Trump on Charlottesville: 'There is no place for this kind of violence in America' https://t.co/HXRKZ9kQQ1
The Mayor of Boston just said that it has been reported",January,Q1,8
"The White House said late Monday it was not aware of the report that National Security Adviser Michael Flynn had discussed sanctions with the Russian ambassador. | Getty Obama calls Russia 'one of the world's most oppressive regimes'
President Barack",January,Q1,8
"The U.S. Secret Service has been caught in yet another scandal after showing a picture of President Trump with his hand on his heart-shaped symbol.
It is not the first time the President has done this but it",January,Q1,8
"In a stunning development that could pave the way for a full scale Arab-Israeli peace deal, the Obama Administration has finally decided to give up its phony ""case"" that the settlements are an impediment to peace. In a",January,Q1,8
"How dare the NRA or their leader the Chuck Schumer do what they have been doing since day one: they will do everything within their power to dismantle or weaken and even kill the 2nd Amendment.
I will never let our",January,Q1,8
The Los Angeles Police Department (LAPD) has been caught using taxpayer money to pay private detectives to spy on and harass the family and friends of one of the officers who was killed in the line of duty. The FBI is,January,Q1,8
"We're pleased to be bringing you another great player this week!
SPOILER ALERT: If you haven't seen or listened to the big crossover episode of Arrow this past weekend then you need to find some other way",January,Q1,8
"The Rise of the Right-Wing Media

History will remember this as the Year of the Fake News.
....The many voices of reason and moderation in the Republican Party have been drowned out by a toxic combination of hate",January,Q1,8
"The War on Women is over!
By now we have all seen the number of women having their Lives destroyed by Unions and their Representatives. It is getting worse by the day!
.@FoxNews just said that",January,Q1,8
"These are conflicting reports.

Reporter Who Exposed Fake News Hill to Fire &amp; Bomb went AWOL before he was found guilty. Fake News is worse than Crooked Hillary!
Will be interviewed tonight on",January,Q1,8
"The Green Party of Minnesota has released the following statement on the tragic explosion at the Murray Hill Power Station:
""We extend our deepest sympathies to the victims and loved ones of this terrible tragedy. Let us continue to pray",January,Q1,8
"Trump Calls On Congress To 'Replace and Revamp' Obamacare
“We will replace and revamp the disastrous and unpopular HealthCare Bill once it is passed by Congress.” @SenTomCotton
�",January,Q1,8
"If you haven't watched the second presidential debate, DO IT RIGHT NOW!
The United States must be stronger than ever before. We are stronger than ever before because of the dedication and hard work of our military and our incredible",January,Q1,8
"The Texas Rangers have acquired right-hander Dylan Bundy from the Athletics in exchange for minor league infielder Kaleb Cowart.
Bundy, who turned 25 yesterday, is in his third season with the Rangers after spending the",January,Q1,8
"The Milwaukee Bucks have acquired guard/forward Joel Bolomboy from the Brooklyn Nets in exchange for Brooklyn's 2014 first-round pick.
Bolt signed with Brooklyn in the offseason and was expected to contribute immediately. He was",January,Q1,8
"WWE Hall of Famer CM Punk has been arrested on multiple charges including assault, battery and false imprisonment.
Punk has been arrested on multiple charges including assault, battery and false imprisonment.
“The people that",January,Q1,8
There are some who say that the Great Comet of 1812 was not quite as big as is believed. They say it was only a third of the size. They say that it was of such a small size it was invisible,January,Q1,8
The British Empire is only one of the many in the world that fight against Radical Islamic Terrorism. We are a strong and powerful nation committed to working constructively with the people of other countries. I look forward to meeting with Prime,January,Q1,8
The US government is bringing in tens of thousands of illegal aliens along with their families to keep the peace and keep the bloodletting at bay. This is not about keeping us safe its about keeping us isolated and out of the,January,Q1,8
The Great Depression was not an easy time in history. It was the most important economic depression since the Great Depression of the 1930's. It was caused by a massive bubble that was created by a small group of irresponsible people who,January,Q1,8
"This is not the first time that the name ""Trump"" has caused trouble in the United States of America. Two years ago I was in India for the BRICS Summit. I had the honor of meeting Prime Minister Modi.",January,Q1,8
"GETTY Fears are growing that Isis could use the chaos in Catalonia to launch attacks abroad

Catalan President Artur Mas is urging people to return home and help their loved ones. He has also called for a minute",January,Q1,8
"Help Us Save the Lives of Our Vets

We cannot save our officers and our Vets will be at risk!
​
Great job Joe!
Thank you!
Thank you!
A GREAT DAY AT",January,Q1,8
"The daughter of former NYC Mayor Rudy Giuliani says her father never raped her and that she never even told her mother about the incident.
This story was completely fabricated by the Clintons &amp; Dems and is a way for them",January,Q1,8
"The Federal Reserve raised interest rates just a few hours after a tumultuous full day of Federal Economic Data. The Fed raised rates not because of bad data as many outlets are making it out to be but because of bad policy.
",January,Q1,8
"The idea that an African-American would vote Republican has never been more objectionable.
.....The big lie is the really big lie. The Republican Party wants to make it harder for millions of hardworking Americans to get ahead.",January,Q1,8
"The Trump administration is considering expelling undocumented immigrants brought into the United States as children from certain states and localities.
The New York Times reported yesterday that the Trump administration is considering expelling undocumented immigrants brought into the United States",January,Q1,8
"The Obama administration has approved a permit for the Keystone XL pipeline despite opposition from the Obama Administration. The pipeline would bring Canadian oil to the United States from the tar sands of Alberta in Canada.
Republican presidential candidate Donald Trump speaks",January,Q1,8
"Despite the misadventure of the 2008 financial crisis and the subsequent Great Recession the federal government has done very little to rein in Wall Street and Main Street since then.
Republicans have done far more to help Main Street than to",January,Q1,8
There are several theories as to why the situation in Ukraine is so different from that in Venezuela or Iran. One is that the U.S. has been trying to install someone in that country for a very long time now.,January,Q1,8
"This is a rush transcript. Copy may not be in its final form.

AMY GOODMAN: The White House says President Trump is all right. He just returned to the White House from Bedminster New Jersey.
J",January,Q1,8
The Department of Homeland Security has announced that they have allocated $10.5 million dollars to Puerto Rico. This money will be used to improve the quality of life on the island and to assist in the recovery. This money will,January,Q1,8
"The UESPWiki – Your source for The Elder Scrolls since 1995

This article is about the Dragonborn. For the follower of Mara Sovvalda, see Mara Sovvalda.

A Brief",January,Q1,8
"The Financial Times reports:

How did Stephen Hawking compare to his predecessor?
Well, in a bit of good news, he is now in a very good position for another Nobel Prize.
In a very bad news",January,Q1,8
"The DEFCON 4 rating for the TSA is now the highest in the history of the agency. The TSA is doing a great job and everyone should give them the benefit of the doubt. The worst times are ahead!
",January,Q1,8
"Now that you have your own server!
Thanks for the feedback!
Thanks!
Great job!
Great job!
Great job!
Great job!
Thanks!
Thank you!
TBH I was",January,Q1,8
"The UN has confirmed that the horrific weather in the United Kingdom throughout the week of August 19th has been caused by climate change.
The United Nations confirmed this week that the devastating flooding in the United Kingdom this week is directly",January,Q1,8
There's no doubt about it: The Atlanta Falcons are really good. They are dominant and they are fun to watch. They have a really cool new stadium and are playing in the Super Bowl. You don't see that often,January,Q1,8
"The University of Michigan has decided to suspend the classes of 2.5 million students because of the protests and violence that has been spilling out of our capital city over the past few days.

That is not fair!
",January,Q1,8
More and more doctors are leaving the United States to practise in lower cost countries because of the Affordable Care Act. The exodus of highly qualified doctors is leading to a sharp rise in the number of unsafe and expensive procedures. I am,January,Q1,8
"Merry Christmas everyone!
Today is a BIG day for the Great State of Ohio!
Great job being done by @NancyMeadows who will always be a BIG WIN FOR OUR PEOPLE!
Congratulations to Jim",January,Q1,8
"Our Nation's Best and Brightest are coming home!
I just got off the phone with the great people of Mississippi. They are fighting for their very lives and their very homes from the storm. They are strong and they",January,Q1,8
"This is one of the most important and difficult things I have ever had to do. I said that the President of the United States must be removed for the Impeachment Hoax he started....
....and now he is",January,Q1,8
"THE FACTS:

The Affordable Care Act has been going strong for about a year. Many folks are applauding the miracle of the Affordable Care Act!
It is a complete political rigged system!
The mainstream media",January,Q1,8
"The top seven U.S. newspapers on the issue of Fake News are collectively losing money and are way behind. How are they doing this?
THEY DONT WANT TRUMP. They WANT ICON POWDER!
",January,Q1,8
"The UESPWiki – Your source for The Elder Scrolls since 1995

The Battle of Wolfsmouth is a minor skirmish fought between two of the most powerful factions in the province of Whiterun. It was",January,Q1,8
"How did a bunch of neo-Nazis and white supremacists get tickets to a baseball game?
Former Vice President Joe Biden’s campaign manager says Joe would not have nominated Joe Biden. Joe has let it be known he",January,Q1,8
"My Santa was amazing. They sent me a package with everything I needed to celebrate my birthday!
I got: A FREE SHIRT from Virginia Tech!
I also got: A FREE SHIRT from UTSA!
",January,Q1,8
"The Tampa Bay Lightning have signed forward Jack Johnson to a National Hockey League (NHL) multi-year contract. Per club and agreement.
Jack joins our hockey family after spending the past 3 seasons with the Lightning. A",January,Q1,8
"In the latest chapter of Supreme Court Justice Confusion, Justice Anthony Kennedy has just stated that the government must produce to him and his fellow Supreme Court Justice a copy of the warrant that was executed on Moussaoui. This",February,Q1,8
The Seattle Mariners have acquired the minor league status of Class AAA Tacoma. This is about as minor as it gets. They are going to start the season in a small-leaguer environment. I am continuing to see great,February,Q1,8
"""With the support of our strong military professionals and our allies, the United States will defeat this very real and very dangerous threat! #MAGA""
— @GovMikeRogers on the death of former Army Chief b",February,Q1,8
"In 1993, in a stunning victory over the Democrats, the people of Texas sent a Democrat to the U.S. Senate from a heavily Republican state. Not only did he fight for us against the most powerful military in the",February,Q1,8
"The German government is considering suspending a planned $150 million loan to the United States to help it combat the spread of the disease and increase treatment in the U.S.
German Chancellor Angela Merkel announces that $150 million will",February,Q1,8
"This is a great book! Thank you!
Great book!
Great book!
Wonderful stuff!
Thank you for sharing this amazing information and sharing our great economy with the world. We'll be sharing it with",February,Q1,8
"New at SubtleTV! Close
Video: Video: FULL HOUSE - A Conversation with Mark Levin - (Mark Levin™) @Morning_Show Join me live at the Hard Rock Hotel &amp; State this evening for a",February,Q1,8
"The San Diego Chargers need WR Keenan Allen. They have so many holes on defense.
Ted Cruz called for a boycott of NFL games this season. The NFL should follow his lead. NFL ratings are at an all-",February,Q1,8
The name of the game for any great US military operation is not to attack first and hope for the best. In fact we have been there. We are a long way off from being there and we WILL be there soon.,February,Q1,8
Intel has been busy working on their next generation of processors. Intel is expected to release a new generation of processors in Q2 2018. The processor that Intel is working on is the 14nm FinFET manufacturing process and will,February,Q1,8
"IRVINE, Calif. — The NBA has approved Tim Duncan's return to play in Week 11 of the regular season, a decision that was made ahead of time by league general manager Rob Manfred and the San Antonio Spurs",February,Q1,8
"The UESPWiki – Your source for The Elder Scrolls since 1995

Unleash the Beast is a leveled list unique to Skyrim. It is crafted with 1-Handed and requires level 90 Smithing.
",February,Q1,8
Mike Pence and Mitch McConnell are the absolute worst of the worst in Washington. They are not only corrupt but they are dangerous. Mitch has been playing the Radical Left Side all along knowing full well that it is a ruse to,February,Q1,8
