Tweets,Month,Quarter,sampling
"After an initially underwhelming performance, Microsoft today released Windows 10 Technical Preview Build 14393. This is an early build and is subject to change.
I want to thank everyone for their continued support. I have been doing this",May,Q2,18
"New at SubtleTV! Close
Video: Video: Hanukkah 2017 Special - Hanukkah Music and Lights! Hanukkah is upon us and with it comes lots of incredible new products and features for",May,Q2,18
"Thanks Dr. Wood. My thoughts are with you all.
WE LOVE YOU!
Congratulations to our GREAT Attorney General @AGMikeHunter on his big win on V.A.! He and his team are working very",May,Q2,18
"Flat is a fast becoming one of the hottest apps in the Apple store. I love it.
Can anyone believe that the Left is trying to HIDE the impact of Flat Rate Taxation on the Flat Lands? The",May,Q2,18
"Obama says he wants to make 'great progress' on border wall with Mexico but says it won 'a fair trial' and that he won't 'deliberately' cut corners.
Election Fraudsters!
Thank",May,Q2,18
"I was on my way home from work when I saw this.
Not cool. Thank you!
I will be having a News Conference at the White House at 5:15 P.M. Thank you!
You",May,Q2,18
The future of our Great State of Nevada is at stake. If @GOPLeaderWard supports the CAUSE OR PREVAILANCE of a TINY fraction of a %.00 of my STUDENTS being STILL denied,May,Q2,18
One of the things that makes the United States special is our diversity. It is this fact that led to the creation of the United States of America. As founder of the very first Nation of the Philippines I have the greatest respect,May,Q2,18
"In our view, the Government Accountability Office (GAO) report contains serious errors that should be corrected in order to achieve the best possible outcome. The following are just a few of the errors in the GAO report that we",May,Q2,18
Mayor Rob Ford and his brother Councillor Doug say that they did nothing wrong. They are being forced out of office over an email that was never supposed to be on their private server. Rob Ford does not have the where,May,Q2,18
I am writing to you today to offer my full support and to assure you that the Department of Justice and the Department of Homeland Security are responding quickly and effectively. Together we will hold accountable those who threaten our way of life and,May,Q2,18
"The Los Angeles Times is reporting that while President Trump was in Bedminster N.J. he received treatment for a stomach bug from a doctor who is pro-life.
The Los Angeles Times is reporting that while President Trump",May,Q2,18
"In a stunning attack on America's youth, the Obama administration is demanding that all schools provide a ""safe space"" for the public where they will be able to openly discuss controversial political and social topics without fear of punishment.
",May,Q2,18
"SALT LAKE CITY — A federal judge on Monday reinstated the Trump campaign's ban on foreign workers who are required to have a college degree.
Read more about this decision here: https://t.co/gW",May,Q2,18
"AP

The Raiders are facing a $2.5 million fine for their handling of the Ray Mac rule. The Raiders are facing a $2.5 million fine for their handling of the Ray Mac rule.
The",May,Q2,18
"I'm sorry but the FBI has been leaking information to the media about my administration for far too long. The very existence of the FBI shows the corruption and dishonesty at the highest levels of our government!
Thank you @",May,Q2,18
Saturday Night Live is at it again with a parody of the State of California. Apparently the California legislature doesn’t like the parody they just passed a bill that will totally destroy Saturday Night Live. They are trying their best,May,Q2,18
"The man who arrested a homeless woman for allegedly urinating on the sidewalk had no idea what he was doing and should've, a federal judge ruled Friday.
The decision retools the court's calculus in ways that will make",May,Q2,18
"The leader of the People's Militia of Ukraine is being praised by the U.S. Congress as having brought about the greatest political victory in Ukraine's history.
Moshe Katsavkaz is a very brave man who",May,Q2,18
There is a great deal to like about the way the New York State Senate has been handling its business this year. The New York Times called it a 'landmark' session. I thought that was an understatement. The Senate,May,Q2,18
"Overall 10 Story 9 Acting/Cast Quality 9 Music Quality 8 Rewatch Value 10
I saw this movie the other night and I thought it was amazing amazing amazing. I recommend this to anyone who loves a good story told through",May,Q2,18
The PBE has been updated! As we continue the 4.16 PBE cycle today we have made a few splashy changes to the PBE! Below you will find a link to Josh 'Josh1717' B,May,Q2,18
"The Senate overwhelmingly passed a spending bill late Saturday night that contains $1.1 trillion in spending cuts and tax relief for Congress and the public. It is a big victory for President Trump and the American people!
BIGG",May,Q2,18
"Groups and individuals wishing to create fear and confusion in the minds of the public will be sorely disappointed by this decision. The Court has given us far more than enough evidence to bring these organizations to justice.
The Supreme Court",May,Q2,18
"Do you want an American Dream? I do!
The United States should immediately stop all trade with Iran. Stop selling all of your products you love to Iran!
A great man and a great American. My thoughts and",May,Q2,18
"The Mojave Trails are closed between the Colorado River and the California coast due to heavy rains. There is limited information available as of this writing about when these parts of the trail might reopen. Thank you!
Just landed in",May,Q2,18
"The UESPWiki – Your source for The Elder Scrolls since 1995

Potions are consumable items that you can craft into various potions with ingredients found throughout Skyrim. Potions are made by mixing potions with other ingredients",May,Q2,18
"Democrats are being told to give up on their sub-par poll numbers because they are all fake and now they are being exposed as the party of dirty tricks.


Witch Hunt!
.....and he is a total",May,Q2,18
"The Supreme Court on Wednesday gave Prime Minister Narendra Modi a major lift by dismissing his plea to scrap the death penalty and grant life imprisonment to an accused who killed his wife and step-daughter.
The apex court said that the",May,Q2,18
"AP

The Seahawks are always one of the teams to get the treatment of the public in the NFC. And this week though they got it right.
The NFL gave the 49ers permission to leave Levi's Stadium after",May,Q2,18
"Riot police stand by as a large group of anti-fascist demonstrators march toward the Brandenburg Gate in Berlin, Germany, U.S., September 23, 2017. REUTERS/Hannibal Hanschke

By",May,Q2,18
"Great Book!
by Bernard B. Silver
The true history of the United States has been buried by the fraud and deceit of the Nixon administration. Now it is the turn of the Radical Left Democrats who destroyed the great career",May,Q2,18
One of the many things that led to the demise of the Chrysler and GM brands is that they were too good to be true. The combination of high quality products and consistent industry leading innovation that they brought to the marketplace has brought,May,Q2,18
We are very excited to announce that we have secured an incredible Producer/Executive Producer in Jeremy Podeswa! Jeremy has worked on some of the most popular shows like Law & Order SVU as well as an incredible run on,May,Q2,18
"A few hours before the 2016 Presidential Debate, Fox News Senior Political Analyst Judge Andrew Napolitano was asked by a Fox Business Network audience member what he made of the President's recent tweet claiming that the federal government is paying too",May,Q2,18
Campus safety: University of North Carolina at Chapel Hill students forced to sleep in classrooms; one student killed after someone took a knife to his room; another killed by a stray bullet from a car that had just plowed through,May,Q2,18
"The United States has just signed a major arms deal with Saudi Arabia. This is a huge deal. The USA will be a major arms supplier to Saudi Arabia for many years to come.
The Saudis are beating us on the",May,Q2,18
This is the question I am most curious about. I have no idea what the answer to this question is but it is very important. BTW I would like to thank the great team at Sprint/Sprint Nextel.,May,Q2,18
"They're beating us badly but they're not successful enough!
This will be the first time in history that a sitting President is not being greeted at the airport with a standing ovation. It will be a very difficult trip",May,Q2,18
"The U.S. Supreme Court on Monday handed a major victory to the nation's farmers, who were able to avoid further debt and uncertainty for the better.
The 5-4 ruling means that debt that would have been",May,Q2,18
"The FBI has been investigating Gianforte for months now, and now he's been caught lying to the FBI. He admitted to fabricating numbers on a voter file he used as a campaign surrogate. This was not the kind",May,Q2,18
The Daily Mail has now retracted an article which called for the assassination of US President Donald Trump. It is understandable that the paper would want to distance itself from such an article. However the BBC is now reporting that the Trump family,May,Q2,18
"The Asian American Journalists Association is calling on the White House to exclude members of the press corps from the White House Correspondents' Association Dinner.
The dinner is an opportunity for the nation to celebrate excellence in journalism and to honor",May,Q2,18
"The Ministry of Justice has today (September 20) formally notified the Warrants Board that the following warrants have been issued for the arrest and prosecution of:
Mr. Oliver North, a former Prime Minister of the United States and",May,Q2,18
"The government's decision to let the UK off the hook for shutting down parts of the Internet because of threats of terrorism is completely out of step with the times and misplaced.
The Obama Administration made a major security and economic mistake",May,Q2,18
A friend of mine that I haven't seen in a while sent me a link to this report on the Syrian chemical weapons attack. I was rather surprised that our friends in the EU would attack Syria over a few grains of sugar,June,Q2,18
"We also have a great new podcast coming out this week called The Progressive Kind. Be sure to check it out!
So just what is this all about?
A lot of people are confused and just don’t",June,Q2,18
The debate over electronic cigarettes should be left to professionals like Dr. Robert O'Brien. He is a respected pediatrician who has long been strongly in favor of decreasing the use of these dangerous and addictive devices. Dr. O,June,Q2,18
"BALTIMORE (WJZ) — A former Baltimore police officer is dead after being shot in the neck in the South Baltimore neighborhood he was assigned to.
A police source tells me the victim was shot in the",June,Q2,18
"We are excited to announce that our website has been upgraded to a brand new and improved website!
...and I was just informed that the Department of Justice is now investigating whether or not the Justice Department overstepped its legal",June,Q2,18
"If you're like me and have never tried pot, I highly suggest it. It is truly amazing!
I am working hard to defeat Boozman! He wants to take our Country Back to the Dark Ages! He won",June,Q2,18
"The same people who promote the lie that the US is in deep financial trouble and that the Federal Reserve is not doing its job are the same people who tell the world that the US can never have enough money.
The Federal",June,Q2,18
"Second Amendment advocates were quick to blast the ruling as biased and unconstitutional. ""This is a shameful decision by the Court. It is another example of the Obama Administration trying to rewrite the law to allow for even more of their unconstitutional",June,Q2,18
"So I'll be honest and admit that it at least kinda came out of left field. But I just can't help myself. 😄
....WHY DIDN'T THE LEADERSHIP COUNC",June,Q2,18
We are pleased to announce the first publication of the book The End Times: How Satanism and other New Age Cultures are Predating the Industrial Revolution by Many Generations. The End Times: How Satanism and other New Age,June,Q2,18
The Democrats are still obsessing over Sarah Palin. They are all hooting and aahting over her being the nominee of the Democrat Party. Just look at all of the negative articles they are printing. Look at all of,June,Q2,18
"Bill Maher, who once called us the 'most criminally-corrupt government in the world', said he didn't think it would be 'much of a stretch' to think the Clintons even 'knew' what was going",June,Q2,18
People take selfies with flowers and candles on the steps of the US Supreme Court after hearing oral arguments in the #SCOTUSRidiculousOscars. pic.twitter.com/v2E7oPq,June,Q2,18
"North Korea fired more than 150 missiles into the Sea of Japan from where they flew over Japan and the Pacific Ocean today en route to cause maximum damage to the economy of the United States and Japan.
In just a few short",June,Q2,18
"The greatest gift you can give yourself is to learn to Love the Things that Make You Happy. This is what we do best!
...We haven’t really gotten there. It is just the opposite. Competition is",June,Q2,18
"""We are going to be a nation of immigrants!"" Trump declared at the Republican National Convention in Cleveland. ""We are going to be a nation of warriors! We are going to be a nation of great Americans.""
""",June,Q2,18
"The recent flurry of interest in the University of Washington's controversial (as they say) free speech zones makes me wonder if there is any truth to the rumor that Dwayne ""The Rock"" Johnson will be leaving the University of",June,Q2,18
"That was a close one. As you can see it wasn't even close!
I'm so excited to be back in Ohio! We have a great team ready to go and make a big comeback! #KCD5",June,Q2,18
"He has been a champion and leader for our LGBTQ community. I am so proud of him!
THANK YOU 🇺🇸 for your big wins in Alabama and Utah. The Republican Party now has more Congressional",June,Q2,18
"The M1 Abrams Tank is the newest addition to the United States Army Tank Regiment. This highly maneuverable force supports the battlefield while providing the backbone for our Nation's Army and Navy.
The M1 Abrams Tank is the",June,Q2,18
"The parents of two American students abducted by the Islamic State group are demanding the US government release their children.
Two American citizens who were kidnapped by ISIS are demanding they be released!
The head of the National Center for Missing",June,Q2,18
LAWMAKERS: If you don’t like this person you can leave him or her. If this person does this person can’t you’re going to have a hard time getting people to,June,Q2,18
It's been a busy few weeks for the UFC as they have given us the undercard to FIGHT NIGHT! Can they do it again next month or will they end up with the same number of fights as last time and lose,June,Q2,18
"While everyone else is talking about the California wildfires, we are only getting started on the Siberian wildfires. In just the last few days this fire has grown to more than 600 square miles and is threatening more than 30 villages. There",June,Q2,18
"It was a long shot but it was close. We won big today!

Will be speaking at the White House from 11:30 a.m. to 12:30 p.m. Thank you!
Thank",June,Q2,18
"Deadly Poisoning at UC Berkeley: There is a Monopoly to Play for ...
Two women who were attacked by several masked men on UC Berkeley's West Side are in critical condition after being treated at the hospital. The",June,Q2,18
If you are looking for a great location to spend a beautiful late night or early morning. The Bubba &amp; his two c**ts are in charge. Get there early as it gets HOT &amp; HOTG,June,Q2,18
The 2016 Presidential election has the potential to be the most expensive in U.S. history. President Trump is leading Democrat Hillary Clinton in the polls and has an incredible chance of winning the Presidency. The Federal Reserve should now raise,June,Q2,18
Welcome back to another edition of the Best of the NFL podcast! As always I am joined by my good friend and fellow CFB legend Jerry Rice. I spoke with Jerry earlier in the week. He is doing very well.,June,Q2,18
"The California legislature has just passed AB-3356, which adds language to the California Penal Code which will make illegal the distribution of the following materials or ideas in public places:
* Pornography.
* Any material which",June,Q2,18
"My Santa hit it out of park! My SS got me a great set of American Football Cards! I love them all!!!
I also got my very own personalized card from my SS!
Thank you so much to my",June,Q2,18
"It's time to start voting! Join us on Wednesday, November 2nd from 8:00 AM to 12:00 PM at the United States Capitol Visitor Center (202-225-2200). This free Voter Guide will",June,Q2,18
"The Fed is now almost certainly at least partially to blame for the ongoing and possibly very dangerous drought in the US.
Drought? Really?
DID the Fed start a massive Quantitative Easing (QE)",June,Q2,18
"North Korea has just tested a new type of intercontinental ballistic missile and the U.S. has the capacity to defend ourselves against this threat. The United States stands ready to meet any and all threats with fire.
Great",June,Q2,18
"The best way to fix the Fake News is to replace it with the REAL news!
“From the moment our Country was founded in 1776 the people have had their voices heard. Today the echo is far too loud",June,Q2,18
"This article is about the character. For the Star Trek: Excelsior episode, please see Carla Quimby.
Carla Quimby is a freelance writer and game designer from Niagara Falls, New York.",June,Q2,18
"Opinion writer

Mr. President, your administration is at war with the American people. We are being attacked from every direction.
The outgoing chief of staff of the Cuban Republic sent a telegram to President Trump",June,Q2,18
"Dr. Michael P. Mann, a climate denier and the lead author of the infamous ""hockey stick"" graph that showed a precipitous rise in global temperatures in the past 100 years, is now the lead author of",June,Q2,18
"The Colorado Rockies have agreed to terms with left-hander Tyler Anderson on a minor-league contract, tweets Jon Heyman of CBS Sports.
Anderson is hitting just .205/.238/.279 with two home runs and seven",June,Q2,18
"The Chilling Effect: The Obama Administration's War on the Alt-Right

I am pleased to announce that @NASA Administrator Scott Pace has asked me to continue the Great American Voyage to the Moon!

I",June,Q2,18
"How to spot a LIAR.
Posted by wolverine @DNSNames
Sometimes you just have to let it all hang out. That is exactly what is happening to the United States by the Iranians. They are",June,Q2,18
"OPINION

The Liberals have given us the most expensive High-Speed Internet in the world. They are now going to give it back. They said they would get rid of High-Speed Internet but are now going",June,Q2,18
"The NRA and other gun rights groups have spent millions on ads blaming Obama for the Orlando shootings. They are wrong.
The Washington Post today is reporting that there is very little that President Obama Can Do To Help The American People",June,Q2,18
"This was a great book. The authors are rock stars. I highly recommend it!
Audrey Hepburn &amp; Ibraheem are both incredible women. My two favorite actresses of all time. Elizabeth Taylor is",June,Q2,18
"WASHINGTON — The Obama administration on Thursday closed a deal to save the Keystone XL pipeline.
In just a matter of days the Trump agenda will be done. Massive Tax Cuts &amp; Reform. JOBS JOBS JO",June,Q2,18
"The first time I watched the movie ""The Dark Knight"" I had a ton of questions. I thought the movie was pretty...
I am an Independent Contracted Military Gentleman who has been Serving our Country for 40 Years.",June,Q2,18
"The world will be a different place without Steve Jobs.
Steve Jobs was one of the greatest of all time. A true American hero. He touched so many people's lives and we will miss him so much. The world",June,Q2,18
"The Ottawa Senators have agreed to terms on a two-year contract with forward Mike Hoffman.
Hoffman, 26, has 5-9=9=13 points in 40 games with the Ottawa Senators this season. He",June,Q2,18
"I'm not sure what the point of this is but I thought I'd post it anyway.
Hawaii is a Republican state and their candidate for Governor is a former member of Al Queda who is a sexist pig",June,Q2,18
"Our general interest e-newsletter keeps you up to date on a wide variety of health topics.
From the Cold War to today's cyber threats, a comprehensive approach is required. For example, we need a new national",June,Q2,18
2014-10-25 Patriots Dolphins 4 1:15 3 1 MIA 1 21-27 Tom Brady up the middle for -2 yards (tackle by Earl Mitchell) -2 4 -0.780 2.037 1,June,Q2,18
President Trump has just pardoned a man who had already served time for a horrific crime. A man who beat a woman to death with a baseball bat and then fled to Mexico with his family. A man who stabbed his ex,June,Q2,18
"The federal government is looking into reports that thousands of people may have been swept up in President Donald Trump's controversial travel ban.
The Department of Justice is looking into reports that thousands of people may have been swept up in President",June,Q2,18
Democrats in Congress are clearly doing everything in their power to destroy the United States of America. They are threatening our military men and women with jail time and even death if they try and stop them. This has never happened in our,June,Q2,18
"The Department of Homeland Security has just admitted that it knowingly allowed thousands of highly dangerous people to enter the United States.
This is just the latest example of the incompetence of the Obama Administration. They admitted WAY more people than they",June,Q2,18
"Sierra Nevada Corporation – the world's largest producer of natural gas – is facing a federal lawsuit alleging that it broke the law by not paying royalties.
This is a major development as it would be the first time that a",June,Q2,18
"This is a great story. I will be commenting on it soon.
Chuck we have got to stop this already!
I have a great friend who is a great man and fighter. He is 89 years old and lives",June,Q2,18
"A man who died after he was shot in the head by his estranged wife has been named as Tyrone Harris.
The identity of the victim has not been released pending notification of his family. Our deepest sympathies go out",June,Q2,18
"So many great names came out of the tunnel on November 3rd. There were so many incredible candidates including @Jill_Klain and @GavinNewsom. Thanks to them!
Our great Person of the Year",June,Q2,18
"The 2016 election was the most expensive in U.S. history. According to the Federal Election Commission (FEC).
...And then he totally screwed it up AGAIN. He called me yesterday and said that General Motors",June,Q2,18
"Federal agencies and private citizens working closely with us are working diligently to identify those responsible for this terrible and highly disruptive cyberattack. We are working closely with our international partners and will keep you apprised as necessary.
I",June,Q2,18
"The best part about a cruise ship is the view of the mountains and valleys around you. We also have amazing views of the San Francisco Bay Area to the west and the mountains of Northern Oregon to the north!
United States",June,Q2,18
"The Romney-Ryan budget would further impoverish the United States by gutting Social Security and Medicare. It also would lead to even greater cuts to Medicaid and other vital programs to help those most in need.
This budget is",June,Q2,18
The Seattle Seahawks are coming off a big win against the Green Bay Packers. This was their fourth win in the last five games including a recent win over the Kansas City Chiefs. They finished the game with 269 yards of offense scoring,June,Q2,18
"CINCINNATI -- The Cincinnati Bengals have promoted running back Giovani Bernard from the practice squad to the 53-man roster.
Bernard (6-0, 192) was signed as an undrafted free agent out",June,Q2,18
"The Federal Communications Commission has approved a plan to renew the expired expired controversial net neutrality rules.
The vote was 3 to 2 with one Republican voted against.  The plan  will keep the internet open for businesses and for all",June,Q2,18
"The Farmer in me is proud to have led the way in cutting tax for small businesses!
Does anybody really believe that the Lamestream Media will report that I am cutting Social Security or Medicare?
When I said they",June,Q2,18
"The Goldwater Institute's newest book is called A People's History of the United States.
The most incredible thing about the recent destruction in Paris is that it is being determined as to whether it was the result of terrorism or",June,Q2,18
This is a guest post by Marcus Bannister (@marcusbannister). Marcus is the Director of Social Entrepreneurship at the Roosevelt Institute. He is also the author of Getting America Back: How Social Entrepreneurs,June,Q2,18
The Great American Beer Festival has been in full swing for a few weeks now and with some great new breweries opening up and competitors getting stronger it looks like we can finally say that we are in the midst of a great new lineup,June,Q2,18
"What is an 'Income-Based' Tax Cuts?

An income-based tax is one in which the amount of money paid in taxes is reduced by the amount of money paid back to the government. In",June,Q2,18
"How do I get my child to stop crying?
By placing your child in a cryin-fit-fitter until the problem is fixed.
We are in the midst of one of the most successful recessions in",June,Q2,18
