Tweets,Length,Date,Source,Favourites,RTs,Username,id_str,in_reply_to_user_id,user_id,isRT,tco,Language,Month,Quarter,TweetsTokenized
"If health indicators remain positive, the state will move to stage 4 in mid-June. To learn more about the different stages and the associated dates to get a better understanding about where we’re going as a state, click here to see the full plan:",270,2020-05-21 19:47:29,Twitter Web App,13,4,GovHolcomb,1263557041479614469,4919082864.0,4919082864,False,https://t.co/aj7QiJneRO,en,May,Q2,"['health', 'indicators', 'remain', 'positive', 'state', 'move', 'stage', '4', 'midjune', 'learn', 'different', 'stages', 'associated', 'dates', 'understanding', 'state', 'click', 'full', 'plan']"
"Movie theaters and playgrounds, which had been projected to open in stage 3, will remain closed. Movie theaters are now projected to open along with other entertainment facilities and venues during stage 4. Playgrounds are to be determined.",240,2020-05-21 19:47:28,Twitter Web App,15,7,GovHolcomb,1263557040070365184,4919082864.0,4919082864,False,,en,May,Q2,"['movie', 'theaters', 'playgrounds', 'projected', 'stage', '3', 'remain', 'closed', 'movie', 'theaters', 'projected', 'along', 'entertainment', 'facilities', 'venues', 'stage', '4', 'playgrounds', 'determined']"
"Personal services such as hair salons, barber shops, nail salons, spas and tattoo parlors may continue to be open by appointment only and must follow social distancing guidelines.",179,2020-05-21 19:47:28,Twitter Web App,11,2,GovHolcomb,1263557038589775872,4919082864.0,4919082864,False,,en,May,Q2,"['personal', 'services', 'hair', 'salons', 'barber', 'shops', 'nail', 'salons', 'spas', 'tattoo', 'parlors', 'may', 'continue', 'appointment', 'follow', 'social', 'distancing', 'guidelines']"
"Restaurants and bars with restaurant services may continue to operate at 50% capacity, but bar seating must remain closed.",122,2020-05-21 19:47:28,Twitter Web App,11,1,GovHolcomb,1263557037251837958,4919082864.0,4919082864,False,,en,May,Q2,"['restaurants', 'bars', 'restaurant', 'services', 'may', 'continue', 'operate', '50', 'capacity', 'bar', 'seating', 'remain', 'closed']"
"Youth summer day camps may open on June 1.

Raceways may open with restrictions and no spectators.

Campgrounds may open restrictions, including social distancing and sanitation precautions. State park inns will reopen.",219,2020-05-21 19:47:27,Twitter Web App,15,3,GovHolcomb,1263557035922264065,4919082864.0,4919082864,False,,en,May,Q2,"['youth', 'summer', 'camps', 'may', 'june', '1raceways', 'may', 'restrictions', 'spectatorscampgrounds', 'may', 'restrictions', 'social', 'distancing', 'sanitation', 'precautions', 'state', 'park', 'inns', 'reopen']"
"Community recreational youth and adult sports leagues may resume practices and conditioning while adhering to social gathering and social distancing guidelines. Contact sports, such as lacrosse and football, are prohibited, but conditioning and non-contact drills may take place.",279,2020-05-21 19:47:27,Twitter Web App,13,2,GovHolcomb,1263557034491944961,4919082864.0,4919082864,False,,en,May,Q2,"['community', 'recreational', 'youth', 'adult', 'sports', 'leagues', 'may', 'resume', 'practices', 'conditioning', 'adhering', 'social', 'gathering', 'social', 'distancing', 'guidelines', 'contact', 'sports', 'lacrosse', 'football', 'prohibited', 'conditioning', 'noncontact', 'drills', 'may', 'take', 'place']"
"Community pools may open according to @CDCgov guidance. Community tennis and basketball courts, soccer and baseball fields, YMCA programs, and similar facilities may open with social gathering and social distancing guidelines in place.",235,2020-05-21 19:47:27,Twitter Web App,15,3,GovHolcomb,1263557033149726725,4919082864.0,4919082864,False,,en,May,Q2,"['community', 'pools', 'may', 'according', '@cdcgov', 'guidance', 'community', 'tennis', 'basketball', 'courts', 'soccer', 'baseball', 'fields', 'ymca', 'programs', 'similar', 'facilities', 'may', 'social', 'gathering', 'social', 'distancing', 'guidelines', 'place']"
"Gyms, fitness centers, yoga studios, martial arts studios, and similar facilities may open with restrictions. Class sizes should be limited. Equipment must be spaced to accommodate social distancing and cleaned after each use. No contact activities are permitted.",263,2020-05-21 19:47:26,Twitter Web App,13,1,GovHolcomb,1263557031904116738,4919082864.0,4919082864,False,,en,May,Q2,"['gyms', 'fitness', 'centers', 'yoga', 'studios', 'martial', 'arts', 'studios', 'similar', 'facilities', 'may', 'restrictions', 'class', 'sizes', 'limited', 'equipment', 'spaced', 'accommodate', 'social', 'distancing', 'cleaned', 'use', 'contact', 'activities', 'permitted']"
"Social gatherings of up to 100 people will be permitted following the @CDCgov's social distancing guidelines.

Retail and commercial businesses may open at 75% capacity. Shopping malls can open at 75% capacity with indoor common areas restricted to 50% capacity.",262,2020-05-21 19:47:26,Twitter Web App,14,1,GovHolcomb,1263557030641577986,4919082864.0,4919082864,False,,en,May,Q2,"['social', 'gatherings', '100', 'people', 'permitted', 'following', '@cdcgovs', 'social', 'distancing', 'guidelinesretail', 'commercial', 'businesses', 'may', '75', 'capacity', 'shopping', 'malls', '75', 'capacity', 'indoor', 'common', 'areas', 'restricted', '50', 'capacity']"
"In Stage 3, Hoosiers 65 and over and those with high-risk health conditions – who are the most vulnerable to #COVID19 – should remain at home as much as possible. Face coverings in public places are recommended. Hoosiers who can work from home are encouraged to continue to do so.",280,2020-05-21 19:47:26,Twitter Web App,21,4,GovHolcomb,1263557029219704845,4919082864.0,4919082864,False,,en,May,Q2,"['stage', '3', 'hoosiers', '65', 'highrisk', 'health', 'conditions', 'vulnerable', '#covid19', 'remain', 'home', 'possible', 'face', 'coverings', 'public', 'places', 'recommended', 'hoosiers', 'work', 'home', 'encouraged', 'continue']"
"If these principles cannot be met, all or portions of the state may need to pause on moving forward or may need to return to an earlier phase of my stay-at-home order.",167,2020-05-21 19:47:25,Twitter Web App,16,1,GovHolcomb,1263557027575537665,4919082864.0,4919082864,False,,en,May,Q2,"['principles', 'cannot', 'portions', 'state', 'may', 'pause', 'moving', 'forward', 'may', 'return', 'earlier', 'phase', 'stayathome', 'order']"
"As the state lifts restrictions and more people return to work, visit a store or restaurant, and participate in more activities, the number of #COVID19 cases will increase.",172,2020-05-21 19:47:25,Twitter Web App,15,2,GovHolcomb,1263557026334064641,4919082864.0,4919082864,False,,en,May,Q2,"['state', 'lifts', 'restrictions', 'people', 'return', 'work', 'visit', 'store', 'restaurant', 'participate', 'activities', 'number', '#covid19', 'cases', 'increase']"
"➡️ The state retains its ability to test all Hoosiers who are COVID-19 symptomatic as well as health care workers, first responders, &amp; frontline employees

➡️ Health officials have systems in place to contact all individuals who test positive for #COVID19 &amp; expand contact tracing",288,2020-05-21 19:47:25,Twitter Web App,15,2,GovHolcomb,1263557024815755264,4919082864.0,4919082864,False,,en,May,Q2,"['state', 'retains', 'ability', 'test', 'hoosiers', 'covid19', 'symptomatic', 'health', 'care', 'workers', 'responders', 'frontline', 'employees', 'health', 'officials', 'systems', 'place', 'contact', 'individuals', 'test', 'positive', '#covid19', 'expand', 'contact', 'tracing']"
"➡️ The number of hospitalized #COVID19 patients statewide has decreased for 14 days

➡️ The state retains its surge capacity for critical care beds and ventilators",163,2020-05-21 19:47:24,Twitter Web App,22,2,GovHolcomb,1263557023595139076,4919082864.0,4919082864,False,,en,May,Q2,"['number', 'hospitalized', '#covid19', 'patients', 'statewide', 'decreased', '14', 'days', 'state', 'retains', 'surge', 'capacity', 'critical', 'care', 'beds', 'ventilators']"
I have used data to drive decisions since the state’s first case of the #COVID19 in early March and will continue to do so as the state contemplates a sector-by-sector reset. The state will move to reopen while continuing to monitor and respond to these four guiding principles:,278,2020-05-21 19:47:24,Twitter Web App,15,1,GovHolcomb,1263557022307491841,4919082864.0,4919082864,False,,en,May,Q2,"['used', 'data', 'drive', 'decisions', 'states', 'case', '#covid19', 'early', 'march', 'continue', 'state', 'contemplates', 'sectorbysector', 'reset', 'state', 'move', 'reopen', 'continuing', 'monitor', 'respond', 'four', 'guiding', 'principles']"
We continue to remain vigilant about protecting Hoosiers’ health while taking responsible steps to further open our state’s economy. Moving to stage 3 is possible because Hoosiers across the state have worked together and made sacrifices to slow the spread.,257,2020-05-21 19:47:24,Twitter Web App,15,2,GovHolcomb,1263557020973744133,4919082864.0,4919082864,False,,en,May,Q2,"['continue', 'remain', 'vigilant', 'protecting', 'hoosiers', 'health', 'taking', 'responsible', 'steps', 'states', 'economy', 'moving', 'stage', '3', 'possible', 'hoosiers', 'across', 'state', 'worked', 'together', 'sacrifices', 'slow', 'spread']"
"Indiana Back On Track has five stages. For Cass, Lake and Marion counties – which started Stage 2 after other counties, stage 3 may begin on June 1. Local governments may impose more restrictive guidelines.",206,2020-05-21 19:47:23,Twitter Web App,24,4,GovHolcomb,1263557019438665730,4919082864.0,4919082864,False,,en,May,Q2,"['indiana', 'track', 'five', 'stages', 'cass', 'lake', 'marion', 'counties', 'started', 'stage', '2', 'counties', 'stage', '3', 'may', 'begin', 'june', '1', 'local', 'governments', 'may', 'impose', 'restrictive', 'guidelines']"
"Today I announced that because health indicators remain positive, most of the state will advance to stage 3 of the #BackOnTrack Indiana plan on Friday, May 22.",159,2020-05-21 19:47:23,Twitter Web App,436,81,GovHolcomb,1263557018083876865,,4919082864,False,,en,May,Q2,"['announced', 'health', 'indicators', 'remain', 'positive', 'state', 'advance', 'stage', '3', '#backontrack', 'indiana', 'plan', 'friday', 'may', '22']"
"📽️ In 15 minutes, I'll hold a virtual press conference to provide updates in the fight against #COVID19. 

Tune in live at 2:30 p.m. ET (1:30 p.m. CT).

➡️ Watch livestream: 
⬇️ Twitter live",237,2020-05-20 18:15:11,Twitter for iPhone,8,2,GovHolcomb,1263171428435755008,,4919082864,False,https://t.co/MBjDjM2gTr,en,May,Q2,"['15', 'minutes', 'hold', 'virtual', 'press', 'conference', 'provide', 'updates', 'fight', '#covid19', 'tune', 'live', '230', 'et', '130', 'ct', 'watch', 'livestream', 'twitter', 'live']"
"📽️ In one hour, I'll hold a virtual press conference to provide updates in the fight against #COVID19. 

Tune in live at 2:30 p.m. ET (1:30 p.m. CT).

➡️ Watch livestream: 
⬇️ Twitter live",235,2020-05-20 17:30:05,Twitter for iPhone,9,6,GovHolcomb,1263160077122441222,,4919082864,False,https://t.co/MBjDjM2gTr,en,May,Q2,"['hour', 'hold', 'virtual', 'press', 'conference', 'provide', 'updates', 'fight', '#covid19', 'tune', 'live', '230', 'et', '130', 'ct', 'watch', 'livestream', 'twitter', 'live']"
Teachers across our state have stepped up during a pandemic to continue helping kids learn. Congratulations to our Hoosier teachers for being recognized as 2021 Indiana Teacher of the Year!,213,2020-05-20 12:57:00,Twitter Web App,260,41,GovHolcomb,1263091352562171905,,4919082864,False,https://t.co/6j4tjSleQM,en,May,Q2,"['teachers', 'across', 'state', 'stepped', 'pandemic', 'continue', 'helping', 'kids', 'learn', 'congratulations', 'hoosier', 'teachers', 'recognized', '2021', 'indiana', 'teacher', 'year']"
#INthistogether,39,2020-05-19 17:48:57,Twitter Web App,16,2,GovHolcomb,1262802437909491715,,4919082864,False,https://t.co/MlHyfhcGte,en,May,Q2,['#inthistogether']
Our Hoosier EMS professionals spring into action &amp; answer the call every day ⁠— &amp; we're so grateful. Thank you for all you continue to do during #COVID19. #EMSWeek2020,199,2020-05-18 19:06:02,Twitter Media Studio - LiveCut,31,8,GovHolcomb,1262459447768727553,,4919082864,False,https://t.co/kxJcYCzhls,en,May,Q2,"['hoosier', 'ems', 'professionals', 'spring', 'action', 'answer', 'call', 'grateful', 'thank', 'continue', '#covid19', '#emsweek2020']"
"📽️ In 15 minutes, I'll hold a virtual press conference to provide updates in the fight against #COVID19. 

Tune in live at 2:30 p.m. ET (1:30 p.m. CT).

➡️ Watch livestream: 
⬇️ Twitter live",237,2020-05-18 18:15:10,Twitter for iPhone,6,4,GovHolcomb,1262446647017078790,,4919082864,False,https://t.co/MBjDjM2gTr,en,May,Q2,"['15', 'minutes', 'hold', 'virtual', 'press', 'conference', 'provide', 'updates', 'fight', '#covid19', 'tune', 'live', '230', 'et', '130', 'ct', 'watch', 'livestream', 'twitter', 'live']"
"📽️ In one hour, I'll hold a virtual press conference to provide updates in the fight against #COVID19. 

Tune in live at 2:30 p.m. ET (1:30 p.m. CT).

➡️ Watch livestream: 
⬇️ Twitter live",235,2020-05-18 17:30:08,Twitter for iPhone,19,13,GovHolcomb,1262435314871795712,,4919082864,False,https://t.co/MBjDjM2gTr,en,May,Q2,"['hour', 'hold', 'virtual', 'press', 'conference', 'provide', 'updates', 'fight', '#covid19', 'tune', 'live', '230', 'et', '130', 'ct', 'watch', 'livestream', 'twitter', 'live']"
A list of resources around naloxone may be found at the @StateHealthIN website at .,106,2020-05-18 13:54:33,Twitter Web App,5,5,GovHolcomb,1262381062048677889,4919082864.0,4919082864,False,https://t.co/ULTAJj3otU,en,May,Q2,"['list', 'resources', 'naloxone', 'may', 'found', '@statehealthin', 'website']"
This was initially communicated to IHCP providers through this bulletin (when) and further guidance will be published soon. Indiana Health Coverage Programs and the @IDHS are also planning training sessions to provide guidance and to answer any questions.,255,2020-05-18 13:54:33,Twitter Web App,4,2,GovHolcomb,1262381060878471170,4919082864.0,4919082864,False,,en,May,Q2,"['initially', 'communicated', 'ihcp', 'providers', 'bulletin', 'guidance', 'published', 'soon', 'indiana', 'health', 'coverage', 'programs', '@idhs', 'planning', 'training', 'sessions', 'provide', 'guidance', 'answer', 'questions']"
"Effective July 1, Indiana Health Coverage Programs, which includes the Healthy Indiana Plan, Hoosier Healthwise, Hoosier Care Connect and Traditional Medicaid, will reimburse specialty providers who bill the state after a naloxone administration.",246,2020-05-18 13:54:33,Twitter Web App,1,1,GovHolcomb,1262381059674644482,4919082864.0,4919082864,False,,en,May,Q2,"['effective', 'july', '1', 'indiana', 'health', 'coverage', 'programs', 'includes', 'healthy', 'indiana', 'plan', 'hoosier', 'healthwise', 'hoosier', 'care', 'connect', 'traditional', 'medicaid', 'reimburse', 'specialty', 'providers', 'bill', 'state', 'naloxone', 'administration']"
"Previously, EMS personnel were able to administer naloxone under an expiring federal grant. Including naloxone as a covered Medicaid benefit will help ensure funding is available for EMS first responders to continue to administer naloxone.",239,2020-05-18 13:54:32,Twitter Web App,1,1,GovHolcomb,1262381058387054595,4919082864.0,4919082864,False,,en,May,Q2,"['previously', 'ems', 'personnel', 'able', 'administer', 'naloxone', 'expiring', 'federal', 'grant', 'naloxone', 'covered', 'medicaid', 'benefit', 'help', 'ensure', 'funding', 'available', 'ems', 'responders', 'continue', 'administer', 'naloxone']"
"The change in payment policy will be effective July 1, and was made in consultation the U.S. Centers for Medicare and Medicaid Services. Indiana will become one of the first states to pay EMS providers for both the administration of the drug and the medication itself.",268,2020-05-18 13:54:32,Twitter Web App,1,2,GovHolcomb,1262381057082621954,4919082864.0,4919082864,False,,en,May,Q2,"['change', 'payment', 'policy', 'effective', 'july', '1', 'consultation', 'centers', 'medicare', 'medicaid', 'services', 'indiana', 'become', 'states', 'pay', 'ems', 'providers', 'administration', 'drug', 'medication']"
.@FSSAIndiana and @IDHS also announced today that Indiana’s emergency medical responders will be reimbursed in full through the state’s Medicaid program when they administer naloxone.,183,2020-05-18 13:54:32,Twitter Web App,8,4,GovHolcomb,1262381055912312833,4919082864.0,4919082864,False,,en,May,Q2,"['@fssaindiana', '@idhs', 'announced', 'indianas', 'emergency', 'medical', 'responders', 'reimbursed', 'full', 'states', 'medicaid', 'program', 'administer', 'naloxone']"
"First responders, families, caregivers and other individuals who would like to receive a supply of naloxone can register online at .",155,2020-05-18 13:54:31,Twitter Web App,3,1,GovHolcomb,1262381054272438272,4919082864.0,4919082864,False,https://t.co/ez0VbcQTvz,en,May,Q2,"['responders', 'families', 'caregivers', 'individuals', 'receive', 'supply', 'naloxone', 'register', 'online']"
"The state’s partnership with Overdose Lifeline, Inc. allows local health departments to devote their resources to the #COVID19 public health emergency.",151,2020-05-18 13:54:31,Twitter Web App,1,1,GovHolcomb,1262381053089546241,4919082864.0,4919082864,False,,en,May,Q2,"['states', 'partnership', 'overdose', 'lifeline', 'inc', 'allows', 'local', 'health', 'departments', 'devote', 'resources', '#covid19', 'public', 'health', 'emergency']"
Local health departments registered with the @StateHealthIN as entities to dispense naloxone may be experiencing limited access to resources due to the #COVID19 pandemic.,170,2020-05-18 13:54:31,Twitter Web App,1,1,GovHolcomb,1262381051911057411,4919082864.0,4919082864,False,,en,May,Q2,"['local', 'health', 'departments', 'registered', '@statehealthin', 'entities', 'dispense', 'naloxone', 'may', 'experiencing', 'limited', 'access', 'resources', 'due', '#covid19', 'pandemic']"
"Naloxone is a critical tool for individuals, families, first responders and communities to help reduce opioid overdose deaths. Access to naloxone, however, continues to be limited in some communities.",200,2020-05-18 13:54:31,Twitter Web App,1,1,GovHolcomb,1262381050656968706,4919082864.0,4919082864,False,,en,May,Q2,"['naloxone', 'critical', 'tool', 'individuals', 'families', 'responders', 'communities', 'help', 'reduce', 'opioid', 'overdose', 'deaths', 'access', 'naloxone', 'however', 'continues', 'limited', 'communities']"
"responders, families, friends and others who are likely to be the first on the scene if someone overdoses. The organization has been on the front lines of the opioid epidemic since 2014.",186,2020-05-18 13:54:30,Twitter Web App,1,1,GovHolcomb,1262381049402871816,4919082864.0,4919082864,False,,en,May,Q2,"['responders', 'families', 'friends', 'likely', 'scene', 'someone', 'overdoses', 'organization', 'front', 'lines', 'opioid', 'epidemic', '2014']"
"Overdose Lifeline, Inc., an Indiana nonprofit dedicated to helping individuals, families and communities affected by substance use disorder through advocacy, education, harm reduction, prevention, resources and support, will distribute 25,000 doses of naloxone to first",269,2020-05-18 13:54:30,Twitter Web App,1,1,GovHolcomb,1262381047968411650,4919082864.0,4919082864,False,,en,May,Q2,"['overdose', 'lifeline', 'inc', 'indiana', 'nonprofit', 'dedicated', 'helping', 'individuals', 'families', 'communities', 'affected', 'substance', 'use', 'disorder', 'advocacy', 'education', 'harm', 'reduction', 'prevention', 'resources', 'support', 'distribute', '25000', 'doses', 'naloxone']"
"Naloxone, or Narcan, is a medication approved to prevent overdose by opioids. Naloxone is given when a person is showing signs of opioid overdose.

It blocks the toxic effects of the overdose and is often the difference between a patient living and dying.",255,2020-05-18 13:54:30,Twitter Web App,2,1,GovHolcomb,1262381046630436870,4919082864.0,4919082864,False,,en,May,Q2,"['naloxone', 'narcan', 'medication', 'approved', 'prevent', 'overdose', 'opioids', 'naloxone', 'given', 'person', 'showing', 'signs', 'opioid', 'overdoseit', 'blocks', 'toxic', 'effects', 'overdose', 'often', 'difference', 'patient', 'living', 'dying']"
Funds were made available by the federal Substance Abuse and Mental Health Services Administration’s state opioid response grant.,129,2020-05-18 13:54:29,Twitter Web App,2,1,GovHolcomb,1262381044998852609,4919082864.0,4919082864,False,,en,May,Q2,"['funds', 'available', 'federal', 'substance', 'abuse', 'mental', 'health', 'services', 'administrations', 'state', 'opioid', 'response', 'grant']"
"In the face of #COVID19, it’s even more imperative that we provide resources and support for people with substance use disorders. Making potentially lifesaving treatments more readily available is one of the top ways we can address this crisis.",244,2020-05-18 13:54:29,Twitter Web App,10,2,GovHolcomb,1262381043706978304,4919082864.0,4919082864,False,,en,May,Q2,"['face', '#covid19', 'imperative', 'provide', 'resources', 'support', 'people', 'substance', 'use', 'disorders', 'making', 'potentially', 'lifesaving', 'treatments', 'readily', 'available', 'top', 'ways', 'address', 'crisis']"
Today @FSSAIndiana and I announced the state will fund a nearly $1 million distribution of the opioid reversal agent naloxone to ensure the medication reaches Hoosiers who are at-risk of overdose.,196,2020-05-18 13:54:29,Twitter Web App,98,25,GovHolcomb,1262381042268282886,,4919082864,False,,en,May,Q2,"['@fssaindiana', 'announced', 'state', 'fund', 'nearly', '1', 'million', 'distribution', 'opioid', 'reversal', 'agent', 'naloxone', 'ensure', 'medication', 'reaches', 'hoosiers', 'atrisk', 'overdose']"
Here are some great resources for Hoosiers as we fight #COVID19.,88,2020-05-18 12:50:52,Twitter Web App,38,12,GovHolcomb,1262365034669387777,,4919082864,False,https://t.co/hmPqVeCiwa,en,May,Q2,"['great', 'resources', 'hoosiers', 'fight', '#covid19']"
"📽️ In 15 minutes, I'll hold a virtual press conference to provide updates in the fight against #COVID19. 

Tune in live at 2:30 p.m. ET (1:30 p.m. CT).

➡️ Watch livestream: 
⬇️ Twitter live",237,2020-05-15 18:15:08,Twitter for iPhone,5,2,GovHolcomb,1261359475509858304,,4919082864,False,https://t.co/MBjDjM2gTr,en,May,Q2,"['15', 'minutes', 'hold', 'virtual', 'press', 'conference', 'provide', 'updates', 'fight', '#covid19', 'tune', 'live', '230', 'et', '130', 'ct', 'watch', 'livestream', 'twitter', 'live']"
"📽️ In one hour, I'll hold a virtual press conference to provide updates in the fight against #COVID19. 

Tune in live at 2:30 p.m. ET (1:30 p.m. CT).

➡️ Watch livestream: 
⬇️ Twitter live",235,2020-05-15 17:30:09,Twitter for iPhone,21,12,GovHolcomb,1261348152893980673,,4919082864,False,https://t.co/MBjDjM2gTr,en,May,Q2,"['hour', 'hold', 'virtual', 'press', 'conference', 'provide', 'updates', 'fight', '#covid19', 'tune', 'live', '230', 'et', '130', 'ct', 'watch', 'livestream', 'twitter', 'live']"
It takes a special person to run towards danger when everyone else is running away. Thank you to all of our heroes who have made the ultimate sacrifice to keep us safe. #PeaceOfficersMemorialDay,218,2020-05-15 16:20:54,Twitter Web App,273,44,GovHolcomb,1261330727796424707,,4919082864,False,https://t.co/NdNBlD0I34,en,May,Q2,"['takes', 'special', 'person', 'run', 'towards', 'danger', 'everyone', 'else', 'running', 'away', 'thank', 'heroes', 'ultimate', 'sacrifice', 'safe', '#peaceofficersmemorialday']"
#ShareTheGoodIN,39,2020-05-14 17:52:07,Twitter Web App,44,9,GovHolcomb,1260991294345826305,,4919082864,False,https://t.co/KtlYdkUkht,en,May,Q2,['#sharethegoodin']
Thank you to the Shelby County Tourism and Visitors Bureau for the work you are doing in your community and for sending me this shirt to help spread the word during today's #COVID19 press conference. #INthistogether,239,2020-05-13 20:57:36,Twitter Web App,120,19,GovHolcomb,1260675587091423233,,4919082864,False,https://t.co/KjdKcy2bpl,en,May,Q2,"['thank', 'shelby', 'county', 'tourism', 'visitors', 'bureau', 'work', 'community', 'sending', 'shirt', 'help', 'spread', 'word', 'todays', '#covid19', 'press', 'conference', '#inthistogether']"
"📽️ In 15 minutes, I'll hold a virtual press conference to provide updates in the fight against #COVID19. 

Tune in live at 2:30 p.m. ET (1:30 p.m. CT).

➡️ Watch livestream: 
⬇️ Twitter live",237,2020-05-13 18:15:11,Twitter for iPhone,13,1,GovHolcomb,1260634711640203267,,4919082864,False,https://t.co/MBjDjM2gTr,en,May,Q2,"['15', 'minutes', 'hold', 'virtual', 'press', 'conference', 'provide', 'updates', 'fight', '#covid19', 'tune', 'live', '230', 'et', '130', 'ct', 'watch', 'livestream', 'twitter', 'live']"
"📽️ In one hour, I'll hold a virtual press conference to provide updates in the fight against #COVID19. 

Tune in live at 2:30 p.m. ET (1:30 p.m. CT).

➡️ Watch livestream: 
⬇️ Twitter live",235,2020-05-13 17:31:02,Twitter for iPhone,19,14,GovHolcomb,1260623600807264256,,4919082864,False,https://t.co/MBjDjM2gTr,en,May,Q2,"['hour', 'hold', 'virtual', 'press', 'conference', 'provide', 'updates', 'fight', '#covid19', 'tune', 'live', '230', 'et', '130', 'ct', 'watch', 'livestream', 'twitter', 'live']"
Our state's food banks and pantries are stepping up to feed Hoosiers in need. They need your help and support. #INthistogether,150,2020-05-13 12:17:32,Twitter Web App,61,22,GovHolcomb,1260544708524355585,,4919082864,False,https://t.co/ghO5fwm6gS,en,May,Q2,"['states', 'food', 'banks', 'pantries', 'stepping', 'feed', 'hoosiers', 'help', 'support', '#inthistogether']"
