Tweets,Length,Date,Source,Favourites,RTs,Username,id_str,in_reply_to_user_id,user_id,isRT,tco,Language,Month,Quarter,TweetsTokenized
"Today, we are announcing that Michigan, Ohio, Wisconsin, Minnesota, Illinois, Indiana, and Kentucky will work in close coordination to reopen our economies in a way that prioritizes our workers’ health.",202,2020-04-16 21:16:32,Twitter Web App,114,10,GovHolcomb,1250895878031802369,4919082864.0,4919082864,False,,en,April,Q2,"['announcing', 'michigan', 'ohio', 'wisconsin', 'minnesota', 'illinois', 'indiana', 'kentucky', 'work', 'close', 'coordination', 'reopen', 'economies', 'prioritizes', 'workers', 'health']"
"Here in the Midwest, we are bound by our commitment to our people &amp; the community. We recognize that our economies are all reliant on each other, &amp; we must work together to safely reopen them so hardworking people can get back to work &amp; businesses can get back on their feet.",287,2020-04-16 21:16:32,Twitter Web App,59,3,GovHolcomb,1250895876807102468,4919082864.0,4919082864,False,,en,April,Q2,"['midwest', 'bound', 'commitment', 'people', 'community', 'recognize', 'economies', 'reliant', 'work', 'together', 'safely', 'reopen', 'hardworking', 'people', 'work', 'businesses', 'feet']"
"We are doing everything we can to protect the people of our states and slow the spread of #COVID19, and we are eager to work together to mitigate the economic crisis this virus has caused in our region.",202,2020-04-16 21:16:31,Twitter Web App,65,6,GovHolcomb,1250895875490099200,4919082864.0,4919082864,False,,en,April,Q2,"['protect', 'people', 'states', 'slow', 'spread', '#covid19', 'eager', 'work', 'together', 'mitigate', 'economic', 'crisis', 'virus', 'caused', 'region']"
"Today, @GovWhitmer, @GovMikeDeWine, @GovEvers, @GovTimWalz, @GovPritzker, @GovAndyBeshear, and I announced that we will work in close coordination to reopen the economy in the Midwest region.",191,2020-04-16 21:16:31,Twitter Web App,761,105,GovHolcomb,1250895874349203458,,4919082864,False,,en,April,Q2,"['@govwhitmer', '@govmikedewine', '@govevers', '@govtimwalz', '@govpritzker', '@govandybeshear', 'announced', 'work', 'close', 'coordination', 'reopen', 'economy', 'midwest', 'region']"
Together we can stop the spread of #COVID19. Thanks to @davidboudia for this message. #INthistogether,125,2020-04-16 19:54:59,Twitter Web App,67,16,GovHolcomb,1250875355570876417,,4919082864,False,https://t.co/AOjFqBmzk7,en,April,Q2,"['together', 'stop', 'spread', '#covid19', 'thanks', '@davidboudia', 'message', '#inthistogether']"
"📽️ In 15 minutes, I'll hold a virtual press conference to provide updates in the fight against #COVID19. 

Tune in live at 2:30 p.m. ET (1:30 p.m. CT).

➡️ Watch livestream: 
➡️ Facebook Live:",239,2020-04-16 18:15:05,Twitter Web App,43,9,GovHolcomb,1250850213276852233,,4919082864,False,https://t.co/MBjDjM2gTr,en,April,Q2,"['15', 'minutes', 'hold', 'virtual', 'press', 'conference', 'provide', 'updates', 'fight', '#covid19', 'tune', 'live', '230', 'et', '130', 'ct', 'watch', 'livestream', 'facebook', 'live']"
"📽️ In one hour, I'll hold a virtual press conference to provide updates in the fight against #COVID19. 

Tune in live at 2:30 p.m. ET (1:30 p.m. CT).

➡️ Watch livestream: 
➡️ Facebook Live:",237,2020-04-16 17:30:04,Twitter Web App,21,11,GovHolcomb,1250838887645274117,,4919082864,False,https://t.co/MBjDjM2gTr,en,April,Q2,"['hour', 'hold', 'virtual', 'press', 'conference', 'provide', 'updates', 'fight', '#covid19', 'tune', 'live', '230', 'et', '130', 'ct', 'watch', 'livestream', 'facebook', 'live']"
More information may be found at the @StateHealthIN  website at  and the @CDCgov website at .,139,2020-04-15 21:28:54,Twitter Web App,4,1,GovHolcomb,1250536600762757122,4919082864.0,4919082864,False,https://t.co/aEEjhDzBBD,en,April,Q2,"['information', 'may', 'found', '@statehealthin', 'website', '@cdcgov', 'website']"
I previously extended the deadline for property tax payments under executive order 20-05. Executive order 20-21 extends the deadline for all other fees included on the property tax bill.,186,2020-04-15 21:28:53,Twitter Web App,29,3,GovHolcomb,1250536599626055683,4919082864.0,4919082864,False,,en,April,Q2,"['previously', 'extended', 'deadline', 'property', 'tax', 'payments', 'executive', 'order', '2005', 'executive', 'order', '2021', 'extends', 'deadline', 'fees', 'included', 'property', 'tax', 'bill']"
"As allowed by the federal CARES Act, the executive order permits state employees, county employees, teachers, and other public employees who have a defined contribution account to access funds without penalty if they have been affected by #COVID19.",248,2020-04-15 21:28:53,Twitter Web App,15,4,GovHolcomb,1250536598535577609,4919082864.0,4919082864,False,,en,April,Q2,"['allowed', 'federal', 'cares', 'act', 'executive', 'order', 'permits', 'state', 'employees', 'county', 'employees', 'teachers', 'public', 'employees', 'defined', 'contribution', 'account', 'access', 'funds', 'without', 'penalty', 'affected', '#covid19']"
"Executive order 20-21 allows those pharmacy students to apply for a temporary license with the Professional Licensing Agency. Also under the EO, health care providers who cannot meet in-person continuing education requirements this year can do so via distance learning.",269,2020-04-15 21:28:53,Twitter Web App,11,1,GovHolcomb,1250536597394722816,4919082864.0,4919082864,False,,en,April,Q2,"['executive', 'order', '2021', 'allows', 'pharmacy', 'students', 'apply', 'temporary', 'license', 'professional', 'licensing', 'agency', 'eo', 'health', 'care', 'providers', 'cannot', 'meet', 'inperson', 'continuing', 'education', 'requirements', 'year', 'via', 'distance', 'learning']"
"Today I signed an executive order to allow pharmacy students who have successfully completed all required course work to join the fight against #COVID19.

Click here to see the executive order:",217,2020-04-15 21:28:53,Twitter Web App,188,30,GovHolcomb,1250536596262322181,,4919082864,False,https://t.co/PQqVIpSmXO,en,April,Q2,"['signed', 'executive', 'order', 'allow', 'pharmacy', 'students', 'successfully', 'completed', 'required', 'course', 'work', 'join', 'fight', '#covid19click', 'executive', 'order']"
"Across Indiana, nearly 40,000 firefighters and EMS personnel are fighting on the front lines against #COVID19. Thank you for everything you do to keep Hoosiers safe.",189,2020-04-15 20:01:58,Twitter Web App,141,24,GovHolcomb,1250514726850871296,,4919082864,False,https://t.co/wQiwXN3zX0,en,April,Q2,"['across', 'indiana', 'nearly', '40000', 'firefighters', 'ems', 'personnel', 'fighting', 'front', 'lines', '#covid19', 'thank', 'hoosiers', 'safe']"
"📽️ In 10 minutes, I'll hold a virtual press conference to provide updates in the fight against #COVID19. 

Tune in live at 2:30 p.m. ET (1:30 p.m. CT).

➡️ Watch livestream: 
➡️ Facebook Live:",239,2020-04-15 18:20:10,Twitter Web App,36,11,GovHolcomb,1250489105089286144,,4919082864,False,https://t.co/MBjDjM2gTr,en,April,Q2,"['10', 'minutes', 'hold', 'virtual', 'press', 'conference', 'provide', 'updates', 'fight', '#covid19', 'tune', 'live', '230', 'et', '130', 'ct', 'watch', 'livestream', 'facebook', 'live']"
"📽️ In one hour, I'll hold a virtual press conference to provide updates in the fight against #COVID19. 

Tune in live at 2:30 p.m. ET (1:30 p.m. CT).

➡️ Watch livestream: 
➡️ Facebook Live:",237,2020-04-15 17:30:21,Twitter Web App,37,15,GovHolcomb,1250476567664504841,,4919082864,False,https://t.co/MBjDjM2gTr,en,April,Q2,"['hour', 'hold', 'virtual', 'press', 'conference', 'provide', 'updates', 'fight', '#covid19', 'tune', 'live', '230', 'et', '130', 'ct', 'watch', 'livestream', 'facebook', 'live']"
Chris Lingner from the @indyballet has a message for Hoosiers. #INthistogether,102,2020-04-15 16:04:12,Twitter Web App,48,6,GovHolcomb,1250454887101616129,,4919082864,False,https://t.co/kIJ8nXAVSp,en,April,Q2,"['chris', 'lingner', '@indyballet', 'message', 'hoosiers', '#inthistogether']"
"During this #COVID19 emergency, blood donations are critical as we fight to maintain a sufficient supply for those in need. #Indiana EMS Medical Director Michael Kauffman asks that you consider donating blood and thanks everyone for their generosity while we are #INthistogether.",303,2020-04-15 13:16:46,Twitter Web App,66,23,GovHolcomb,1250412754512613381,,4919082864,False,https://t.co/06WuVcLhRp,en,April,Q2,"['#covid19', 'emergency', 'blood', 'donations', 'critical', 'fight', 'maintain', 'sufficient', 'supply', '#indiana', 'ems', 'medical', 'director', 'michael', 'kauffman', 'asks', 'consider', 'donating', 'blood', 'thanks', 'everyone', 'generosity', '#inthistogether']"
We'll get through this. Be strong and be smart. Thanks to Ryan Kelly of the @Colts for the great message. #INthistogether,145,2020-04-14 20:01:18,Twitter Web App,315,41,GovHolcomb,1250152168931364873,,4919082864,False,https://t.co/sUFpyTatQu,en,April,Q2,"['strong', 'smart', 'thanks', 'ryan', 'kelly', '@colts', 'great', 'message', '#inthistogether']"
"📽️ In 15 minutes, I'll hold a virtual press conference to provide updates in the fight against #COVID19. 

Tune in live at 2:30 p.m. ET (1:30 p.m. CT).

➡️ Watch livestream: 
➡️ Facebook Live:",239,2020-04-14 18:16:40,Twitter Web App,37,8,GovHolcomb,1250125837036371969,,4919082864,False,https://t.co/MBjDjM2gTr,en,April,Q2,"['15', 'minutes', 'hold', 'virtual', 'press', 'conference', 'provide', 'updates', 'fight', '#covid19', 'tune', 'live', '230', 'et', '130', 'ct', 'watch', 'livestream', 'facebook', 'live']"
"📽️ In one hour, I'll hold a virtual press conference to provide updates in the fight against #COVID19. 

Tune in live at 2:30 p.m. ET (1:30 p.m. CT).

➡️ Watch livestream: 
➡️ Facebook Live:",237,2020-04-14 17:30:12,Twitter Web App,30,20,GovHolcomb,1250114141924274176,,4919082864,False,https://t.co/MBjDjM2gTr,en,April,Q2,"['hour', 'hold', 'virtual', 'press', 'conference', 'provide', 'updates', 'fight', '#covid19', 'tune', 'live', '230', 'et', '130', 'ct', 'watch', 'livestream', 'facebook', 'live']"
A wonderful message about fighting #COVID19 from the Principal Pops Director of the @Indy_Symphony Jack Everly. #INthistogether,151,2020-04-14 15:59:40,Twitter Web App,52,17,GovHolcomb,1250091360864161792,,4919082864,False,https://t.co/ThcXVDqWqR,en,April,Q2,"['wonderful', 'message', 'fighting', '#covid19', 'principal', 'pops', 'director', '@indy_symphony', 'jack', 'everly', '#inthistogether']"
#COVID19 has impacted every corner of Hoosier communities. We all feel the stress of not knowing what's next. The best response is to have a plan in place before someone in your home gets sick.,217,2020-04-14 13:20:10,Twitter Web App,74,38,GovHolcomb,1250051220733153281,,4919082864,False,https://t.co/ksBLMbBF5f,en,April,Q2,"['#covid19', 'impacted', 'corner', 'hoosier', 'communities', 'feel', 'stress', 'knowing', 'whats', 'next', 'best', 'response', 'plan', 'place', 'someone', 'home', 'gets', 'sick']"
More information may be found at the @StateHealthIN website at  and the @CDCgov website at .,138,2020-04-13 20:50:11,Twitter Web App,8,0,GovHolcomb,1249802081944428545,4919082864.0,4919082864,False,https://t.co/aEEjhDzBBD,en,April,Q2,"['information', 'may', 'found', '@statehealthin', 'website', '@cdcgov', 'website']"
".@Indiana_EDC noted that the total number of PPE donations is likely much higher than 440K as Indiana businesses, charitable organizations &amp; residents across the state have been donating items directly to hospitals &amp; to shelters in their local communities.",288,2020-04-13 20:49:11,Twitter Web App,23,5,GovHolcomb,1249801832983080963,4919082864.0,4919082864,False,https://t.co/6bllm5FUnT,en,April,Q2,"['@indiana_edc', 'noted', 'number', 'ppe', 'donations', 'likely', 'higher', '440k', 'indiana', 'businesses', 'charitable', 'organizations', 'residents', 'across', 'state', 'donating', 'items', 'directly', 'hospitals', 'shelters', 'local', 'communities']"
".@Indiana_EDC, which expects these figures to grow, has been in conversation with more than 450 additional Hoosier companies that have pledged their assistance and are exploring ways to support PPE production and procurement as well as related services.",253,2020-04-13 20:49:11,Twitter Web App,13,3,GovHolcomb,1249801831548583940,4919082864.0,4919082864,False,,en,April,Q2,"['@indiana_edc', 'expects', 'figures', 'grow', 'conversation', '450', 'additional', 'hoosier', 'companies', 'pledged', 'assistance', 'exploring', 'ways', 'support', 'ppe', 'production', 'procurement', 'related', 'services']"
"➡️ Worldcell Extrusions (Elkhart County) has adjusted production to produce lightweight face shields for medical workers.

In total, the state has ordered more than: 1 million face masks, 763K face shields, 141K gloves, 68K gowns, 10K goggles, and 6.7K bottles of hand sanitizer.",279,2020-04-13 20:49:11,Twitter Web App,18,4,GovHolcomb,1249801830202212352,4919082864.0,4919082864,False,,en,April,Q2,"['worldcell', 'extrusions', 'elkhart', 'county', 'adjusted', 'production', 'produce', 'lightweight', 'face', 'shields', 'medical', 'workersin', 'state', 'ordered', '1', 'million', 'face', 'masks', '763k', 'face', 'shields', '141k', 'gloves', '68k', 'gowns', '10k', 'goggles', '67k', 'bottles', 'hand', 'sanitizer']"
"➡️ Williams Distribution (Marion County), a minority-owned chemical distribution company in Indianapolis, is leveraging its expertise to support the increased need for PPE and is shipping nearly 48,000 items, including hand sanitizer, medical gowns and gloves, to the state.",274,2020-04-13 20:49:10,Twitter Web App,13,4,GovHolcomb,1249801828579016705,4919082864.0,4919082864,False,,en,April,Q2,"['williams', 'distribution', 'marion', 'county', 'minorityowned', 'chemical', 'distribution', 'company', 'indianapolis', 'leveraging', 'expertise', 'support', 'increased', 'ppe', 'shipping', 'nearly', '48000', 'items', 'hand', 'sanitizer', 'medical', 'gowns', 'gloves', 'state']"
"➡️ Top Stitch (Elkhart County), one of Indiana’s more than 508,000 small businesses, has applied its textile experience to the healthcare industry and is now making medical gowns and surgical face masks, filling orders to the state as well as to customers in the Northeast U.S.",277,2020-04-13 20:49:10,Twitter Web App,14,4,GovHolcomb,1249801827094274049,4919082864.0,4919082864,False,,en,April,Q2,"['top', 'stitch', 'elkhart', 'county', 'indianas', '508000', 'businesses', 'applied', 'textile', 'experience', 'healthcare', 'industry', 'making', 'medical', 'gowns', 'surgical', 'face', 'masks', 'filling', 'orders', 'state', 'customers', 'northeast']"
"➡️ Tiedemann-Bevs Industries (Wayne County), has been operating in Richmond since 1974. TBI, which manufactures interior casket components and distributes essential textiles to hundreds of casket manufacturers in the industry, is now producing 1,000 isolation gowns per week.",275,2020-04-13 20:49:10,Twitter Web App,17,4,GovHolcomb,1249801825747898369,4919082864.0,4919082864,False,,en,April,Q2,"['tiedemannbevs', 'industries', 'wayne', 'county', 'operating', 'richmond', '1974', 'tbi', 'manufactures', 'interior', 'casket', 'components', 'distributes', 'essential', 'textiles', 'hundreds', 'casket', 'manufacturers', 'industry', 'producing', '1000', 'isolation', 'gowns', 'per', 'week']"
"➡️ @superatvtweet (Jefferson County) has shifted production to make lightweight full face shields, intubation shields and retail employee protective barriers, with plans to produce face shields for the state’s front-line workers.",229,2020-04-13 20:49:09,Twitter Web App,13,3,GovHolcomb,1249801824330285056,4919082864.0,4919082864,False,,en,April,Q2,"['@superatvtweet', 'jefferson', 'county', 'shifted', 'production', 'lightweight', 'full', 'face', 'shields', 'intubation', 'shields', 'retail', 'employee', 'protective', 'barriers', 'plans', 'produce', 'face', 'shields', 'states', 'frontline', 'workers']"
"Royer has partnered with Clifty Engineering, also based in Madison, to fabricate and build an additional die cutting machine, which will double its output of face shields.",171,2020-04-13 20:49:09,Twitter Web App,13,2,GovHolcomb,1249801822832939013,4919082864.0,4919082864,False,,en,April,Q2,"['royer', 'partnered', 'clifty', 'engineering', 'based', 'madison', 'fabricate', 'build', 'additional', 'die', 'cutting', 'machine', 'double', 'output', 'face', 'shields']"
"➡️ @RoyerCorp  (Jefferson County) is utilizing its resources to create face shields for medical workers. The Madison-based, family-owned company plans to produce 75,000 weekly pieces, sending 20,000 to support the state’s efforts so far.",237,2020-04-13 20:49:09,Twitter Web App,17,3,GovHolcomb,1249801821394264067,4919082864.0,4919082864,False,,en,April,Q2,"['@royercorp', 'jefferson', 'county', 'utilizing', 'resources', 'create', 'face', 'shields', 'medical', 'workers', 'madisonbased', 'familyowned', 'company', 'plans', 'produce', '75000', 'weekly', 'pieces', 'sending', '20000', 'support', 'states', 'efforts']"
"➡️ @MursixCorp (Delaware County) serves a wide range of customers whose applications range from hospital beds to automotive safety to hybrid electric vehicles. The Yorktown company is now manufacturing up to 500,000 face shields each week.",239,2020-04-13 20:49:08,Twitter Web App,13,2,GovHolcomb,1249801819783606274,4919082864.0,4919082864,False,,en,April,Q2,"['@mursixcorp', 'delaware', 'county', 'serves', 'wide', 'range', 'customers', 'whose', 'applications', 'range', 'hospital', 'beds', 'automotive', 'safety', 'hybrid', 'electric', 'vehicles', 'yorktown', 'company', 'manufacturing', '500000', 'face', 'shields', 'week']"
"➡️ Mastercraft (LaGrange County), the world’s largest maker of RV furniture, has been serving manufacturers and direct consumers since 1971. The LaGrange-based company is now using its expertise to manufacture non-medical isolation gowns, producing thousands each week.",269,2020-04-13 20:49:08,Twitter Web App,15,4,GovHolcomb,1249801818399440899,4919082864.0,4919082864,False,,en,April,Q2,"['mastercraft', 'lagrange', 'county', 'worlds', 'largest', 'maker', 'rv', 'furniture', 'serving', 'manufacturers', 'direct', 'consumers', '1971', 'lagrangebased', 'company', 'using', 'expertise', 'manufacture', 'nonmedical', 'isolation', 'gowns', 'producing', 'thousands', 'week']"
"➡️ @jordanmfg (Newton &amp; White Counties), has shifted production at its Indiana facilities in Monticello and Kentland to make isolation gowns to support healthcare providers, producing 11,500 for the state.",209,2020-04-13 20:49:08,Twitter Web App,14,3,GovHolcomb,1249801816948211716,4919082864.0,4919082864,False,,en,April,Q2,"['@jordanmfg', 'newton', 'white', 'counties', 'shifted', 'production', 'indiana', 'facilities', 'monticello', 'kentland', 'isolation', 'gowns', 'support', 'healthcare', 'providers', 'producing', '11500', 'state']"
"➡️ Hentz Manufacturing's (Allen County) Fort Wayne facility has started production of isolation gowns, face masks and face shields and has already filled initial orders for the state. They have already produced 46,600 PPE items and is ramping up its team to meet demand.",270,2020-04-13 20:49:07,Twitter Web App,11,4,GovHolcomb,1249801815509610496,4919082864.0,4919082864,False,,en,April,Q2,"['hentz', 'manufacturings', 'allen', 'county', 'fort', 'wayne', 'facility', 'started', 'production', 'isolation', 'gowns', 'face', 'masks', 'face', 'shields', 'filled', 'initial', 'orders', 'state', 'produced', '46600', 'ppe', 'items', 'ramping', 'team', 'meet', 'demand']"
"➡️ GDC Inc. (Elkhart County) plans to start manufacturing disposable full face shields in April and expects to provide 500,000 pieces to the state.",147,2020-04-13 20:49:07,Twitter Web App,11,3,GovHolcomb,1249801814041595904,4919082864.0,4919082864,False,,en,April,Q2,"['gdc', 'inc', 'elkhart', 'county', 'plans', 'start', 'manufacturing', 'disposable', 'full', 'face', 'shields', 'april', 'expects', 'provide', '500000', 'pieces', 'state']"
"➡️ @FleecePE (Hendricks County), has redeployed its engineers and a portion of its flexible manufacturing space to develop, test, document and begin producing lightweight disposable full face shields. The company now has the capacity to produce up to 250,000 per week.",268,2020-04-13 20:49:06,Twitter Web App,11,2,GovHolcomb,1249801812493942784,4919082864.0,4919082864,False,,en,April,Q2,"['@fleecepe', 'hendricks', 'county', 'redeployed', 'engineers', 'portion', 'flexible', 'manufacturing', 'space', 'develop', 'test', 'document', 'begin', 'producing', 'lightweight', 'disposable', 'full', 'face', 'shields', 'company', 'capacity', 'produce', '250000', 'per', 'week']"
"➡️ @Fatheadz (Marion County) has now shifted its operations to produce fluid protective goggles, safety glasses and shields and plans to fulfill an order of several thousand items to the state yet this week.",207,2020-04-13 20:49:06,Twitter Web App,12,2,GovHolcomb,1249801811072081920,4919082864.0,4919082864,False,,en,April,Q2,"['@fatheadz', 'marion', 'county', 'shifted', 'operations', 'produce', 'fluid', 'protective', 'goggles', 'safety', 'glasses', 'shields', 'plans', 'fulfill', 'order', 'several', 'thousand', 'items', 'state', 'week']"
"➡️ @BerryGlobalInc (Vanderburgh County) is accelerating production of plastic face shields &amp; aims to soon reach production of 150,000 per week. The company will provide 30,000 face shields to the state, helping provide an added protection for first responders &amp; medical personnel.",288,2020-04-13 20:49:06,Twitter Web App,13,2,GovHolcomb,1249801809608290305,4919082864.0,4919082864,False,,en,April,Q2,"['@berryglobalinc', 'vanderburgh', 'county', 'accelerating', 'production', 'plastic', 'face', 'shields', 'aims', 'soon', 'reach', 'production', '150000', 'per', 'week', 'company', 'provide', '30000', 'face', 'shields', 'state', 'helping', 'provide', 'added', 'protection', 'responders', 'medical', 'personnel']"
➡️ The Acid Products-Prairie Packaging Company (LaPorte County) is now helping meet demand for hand sanitizer and hard surface cleaners. The company’s Kingsbury facility is providing hand sanitizer to the state and also donated supplies to first responders in LaPorte County.,275,2020-04-13 20:49:05,Twitter Web App,14,3,GovHolcomb,1249801808060600320,4919082864.0,4919082864,False,,en,April,Q2,"['acid', 'productsprairie', 'packaging', 'company', 'laporte', 'county', 'helping', 'meet', 'demand', 'hand', 'sanitizer', 'hard', 'surface', 'cleaners', 'companys', 'kingsbury', 'facility', 'providing', 'hand', 'sanitizer', 'state', 'donated', 'supplies', 'responders', 'laporte', 'county']"
"To date, the state has received and distributed more than 375,000 items of PPE and expects to receive more than 150,000 items this week with deliveries daily. 

Indiana businesses that have shifted production to help deliver these critical supplies include:",257,2020-04-13 20:49:05,Twitter Web App,9,2,GovHolcomb,1249801806357696514,4919082864.0,4919082864,False,,en,April,Q2,"['date', 'state', 'received', 'distributed', '375000', 'items', 'ppe', 'expects', 'receive', '150000', 'items', 'week', 'deliveries', 'daily', 'indiana', 'businesses', 'shifted', 'production', 'help', 'deliver', 'critical', 'supplies', 'include']"
"The purchased and donated products are being delivered to @StateHealthIN for distribution to Indiana’s hospitals, first responders, long-term care facilities and health care providers treating #COVID19 patients.",211,2020-04-13 20:49:05,Twitter Web App,13,2,GovHolcomb,1249801804730249218,4919082864.0,4919082864,False,,en,April,Q2,"['purchased', 'donated', 'products', 'delivered', '@statehealthin', 'distribution', 'indianas', 'hospitals', 'responders', 'longterm', 'care', 'facilities', 'health', 'care', 'providers', 'treating', '#covid19', 'patients']"
"It’s incredible to see companies shifting gears to help those who need it most, our healthcare providers on the frontline. We couldn’t be more grateful for these companies stepping up &amp; contributing in every way they can. They are true examples of how great the Hoosier spirit is.",284,2020-04-13 20:49:04,Twitter Web App,10,2,GovHolcomb,1249801803203588096,4919082864.0,4919082864,False,,en,April,Q2,"['incredible', 'companies', 'shifting', 'gears', 'help', 'healthcare', 'providers', 'frontline', 'couldnt', 'grateful', 'companies', 'stepping', 'contributing', 'examples', 'great', 'hoosier', 'spirit']"
"Of these, more than 1.9 million items are being made by 15 Indiana manufacturers across a diverse range of specialties, from automotive to RVs to caskets and consumer products, while more than 440,000 are being donated by Hoosier businesses and organizations.",259,2020-04-13 20:49:04,Twitter Web App,13,2,GovHolcomb,1249801801639120899,4919082864.0,4919082864,False,,en,April,Q2,"['19', 'million', 'items', '15', 'indiana', 'manufacturers', 'across', 'diverse', 'range', 'specialties', 'automotive', 'rvs', 'caskets', 'consumer', 'products', '440000', 'donated', 'hoosier', 'businesses', 'organizations']"
".@Indiana_EDC, which has been working with business leaders across the state to help meet increased demand for PPE, has secured commitments for more than 2.6 million pieces of PPE.",180,2020-04-13 20:49:03,Twitter Web App,10,2,GovHolcomb,1249801800020037632,4919082864.0,4919082864,False,,en,April,Q2,"['@indiana_edc', 'working', 'business', 'leaders', 'across', 'state', 'help', 'meet', 'increased', 'demand', 'ppe', 'secured', 'commitments', '26', 'million', 'pieces', 'ppe']"
