Unnamed: 0,Tweets,Length,Date,Source,Favourites,RTs,Username,id_str,in_reply_to_user_id,user_id,isRT,tco,Language,Month,Quarter,TweetsTokenized
2388,The Legislative Black Caucus is hosting events throughout the month of February for #BlackHistoryMonth . Learn more here:,145,2020-02-13 15:31:25,Twitter Web App,27,16,GovEvers,1.2279785918724628e+18,,234896532.0,False,https://t.co/peXPoFafHh,en,February,Q1,"['legislative', 'black', 'caucus', 'hosting', 'events', 'throughout', 'month', 'february', '#blackhistorymonth', 'learn']"
21530,"It’s been a week since we had our last update on our state’s efforts to acquire Personal Protective Equipment, so I want to provide a quick update on PPE since March 30.",169,2020-04-06 21:45:27,Twitter Web App,1299,228,GovPritzker,1.2472792756460954e+18,,1.0848175233784544e+18,False,,en,April,Q2,"['week', 'update', 'states', 'efforts', 'acquire', 'personal', 'protective', 'equipment', 'provide', 'quick', 'update', 'ppe', 'march', '30']"
16566,"My administration has and will continue to do the HARD WORK, and the benefit will be for Missouri taxpayers and our state’s financial stability. The progress we are making is real and exciting, but there is more we can do to improve government and promote our state.#MissouriSOTS",279,2020-01-15 21:57:12,Twitter Web App,10,3,GovParsonMO,1.2175664269044e+18,,1.0036723207818076e+18,False,,en,January,Q1,"['administration', 'continue', 'hard', 'work', 'benefit', 'missouri', 'taxpayers', 'states', 'financial', 'stability', 'progress', 'making', 'real', 'exciting', 'improve', 'government', 'promote', 'state#missourisots']"
4971,@Sfielding21 It's the name of a certain type of legal document.,63,2020-03-07 02:44:51,Twitter Web App,12,0,GovHerbert,1.236120597966422e+18,7.888779452720456e+17,60688326.0,False,,en,March,Q1,"['@sfielding21', 'name', 'certain', 'type', 'legal', 'document']"
26038,"""Rescuers: Portraits of Moral Courage in the Holocaust” is a compelling exhibit by photographer Gay Block that tells stories of those who saved lives during one of history’s darkest moments. I was honored to attend the opening of this collection, on display now at @ArkansasTech.",303,2020-02-05 23:00:47,Twitter Web App,34,2,AsaHutchinson,1.225192576699052e+18,,269992801.0,False,https://t.co/9eKYVWZL5E,en,February,Q1,"['rescuers', 'portraits', 'moral', 'courage', 'holocaust', 'compelling', 'exhibit', 'photographer', 'gay', 'block', 'tells', 'stories', 'saved', 'lives', 'historys', 'darkest', 'moments', 'honored', 'attend', 'opening', 'collection', 'display', '@arkansastech']"
11337,This past year we stood up to protect New Mexicans from pernicious federal efforts to dismantle health care services and enacted safeguards against attempts to roll back the Affordable Care Act and strip New Mexicans of the health care lifelines they depend on. #StateOfTheStateNM,280,2020-01-21 21:16:27,Twitter for iPhone,6,3,GovMLG,1.2197305007947162e+18,1.0700837068224388e+18,1.0700837068224388e+18,False,,en,January,Q1,"['past', 'year', 'stood', 'protect', 'new', 'mexicans', 'pernicious', 'federal', 'efforts', 'dismantle', 'health', 'care', 'services', 'enacted', 'safeguards', 'attempts', 'roll', 'affordable', 'care', 'act', 'strip', 'new', 'mexicans', 'health', 'care', 'lifelines', 'depend', '#stateofthestatenm']"
1614,@LindsayAWatts @joethetvguy Congratulations on such a wonderful blessing!,73,2020-01-04 04:36:00,Twitter for iPhone,7,0,MayorBowser,1.2133181369357312e+18,139841847.0,976542720.0,False,,en,January,Q1,"['@lindsayawatts', '@joethetvguy', 'congratulations', 'wonderful', 'blessing']"
2583,"West Virginia’s job numbers are the best the state has seen in over a decade! We are creating thousands of jobs each year, and in August we set yet another milestone for the lowest unemployment rate (4.6%) seen in the state in over a decade. | Read more:",302,2020-01-23 14:54:00,Twitter Web App,10,2,JimJusticeWV,1.22035902825941e+18,,3167789983.0,False,https://t.co/e0CLsNeMuv,en,January,Q1,"['west', 'virginias', 'job', 'numbers', 'best', 'state', 'seen', 'decade', 'creating', 'thousands', 'jobs', 'year', 'august', 'set', 'another', 'milestone', 'lowest', 'unemployment', 'rate', '46', 'seen', 'state', 'decade']"
35910,"9.  OW and ODSP - reverse any cuts and immediately expand, accelerate payment and increase amount to reflect true costs of living in Toronto.",141,2020-03-16 00:00:59,Twitter for iPad,75,7,kristynwongtam,1.2393408533505802e+18,20452161.0,20452161.0,False,,en,March,Q1,"['9', 'ow', 'odsp', 'reverse', 'cuts', 'immediately', 'expand', 'accelerate', 'payment', 'increase', 'amount', 'reflect', 'costs', 'living', 'toronto']"
9891,Gov. Cooper and members of the Coronavirus Task Force will give an update at 2:00pm. Watch it live here:,128,2020-05-12 17:55:31,Twitter Media Studio,89,41,NC_Governor,1.260267374034342e+18,,8.137922504970281e+17,False,https://t.co/JUEsfsrA0v,en,May,Q2,"['gov', 'cooper', 'members', 'coronavirus', 'task', 'force', 'give', 'update', '200pm', 'watch', 'live']"
15886,"Today at 3pm, Governor Mike Parson will be LIVE on Facebook to provide a COVID-19 update.

Today's briefing will include @MOLabor Director Anna Hui, to discuss unemployment.",197,2020-04-07 14:54:37,Twitter for iPhone,25,22,GovParsonMO,1.2475382728399872e+18,,1.0036723207818076e+18,False,https://t.co/R8hDbtRdPy,en,April,Q2,"['3pm', 'governor', 'mike', 'parson', 'live', 'facebook', 'provide', 'covid19', 'updatetodays', 'briefing', 'include', '@molabor', 'director', 'anna', 'hui', 'discuss', 'unemployment']"
14858,Grateful to our healthcare heroes on the front lines. #ShowMeStrong,91,2020-06-23 00:10:29,Twitter for iPhone,41,9,GovParsonMO,1.275219641045078e+18,,1.0036723207818076e+18,False,https://t.co/HO6tTt4LAv,en,June,Q2,"['grateful', 'healthcare', 'heroes', 'front', 'lines', '#showmestrong']"
2543,Senior home-delivered meals will continue and arrangements are being made for our congregate meal recipients to also continue to receive meals. Shelf stable and emergency meals are being provided to all our current meal recipients. #COVID2019,242,2020-03-17 17:01:34,Twitter Web App,1,0,JimJusticeWV,1.2399600791741768e+18,3167789983.0,3167789983.0,False,,en,March,Q1,"['senior', 'homedelivered', 'meals', 'continue', 'arrangements', 'congregate', 'meal', 'recipients', 'continue', 'receive', 'meals', 'shelf', 'stable', 'emergency', 'meals', 'provided', 'current', 'meal', 'recipients', '#covid2019']"
21341,"We’ve now delivered PPE to each of our 102 counties in Illinois from the state stockpile.

In sum, we’ve sent out more than 10 million items including 5 million surgical masks, over 1.5 million N95 masks, nearly 20,000 gowns, over 4 million gloves and nearly 200,000 face shields.",280,2020-04-16 22:00:37,Twitter Web App,200,21,GovPritzker,1.250906971609477e+18,1.0848175233784544e+18,1.0848175233784544e+18,False,,en,April,Q2,"['delivered', 'ppe', '102', 'counties', 'illinois', 'state', 'stockpilein', 'sum', 'sent', '10', 'million', 'items', '5', 'million', 'surgical', 'masks', '15', 'million', 'n95', 'masks', 'nearly', '20000', 'gowns', '4', 'million', 'gloves', 'nearly', '200000', 'face', 'shields']"
11487,"THREAD: On April 14th, we announced the Long Term Care Stabilization program. Originally, the program was set to end on June 31. 

Today, we're extending the program through July 31 to ensure we have the workforce needed to care for our loved ones.",248,2020-06-23 19:06:25,Twitter Web App,32,8,GovChrisSununu,1.275505507198009e+18,,8.162821207672914e+17,False,,en,June,Q2,"['thread', 'april', '14th', 'announced', 'term', 'care', 'stabilization', 'program', 'originally', 'program', 'set', 'end', 'june', '31', 'extending', 'program', 'july', '31', 'ensure', 'workforce', 'needed', 'care', 'loved', 'ones']"
32278,"The indicators reflect action. When social distancing is honored, it has a huge impact. Most New Yorkers are doing that. But we’ve seen unfortunate examples where it hasn’t been followed. We can’t tolerate that. Call 311 immediately if you see groups gathering.",261,2020-05-01 17:09:00,Twitter Web App,35,7,NYCMayor,1.2562694027580908e+18,19834403.0,19834403.0,False,,en,May,Q2,"['indicators', 'reflect', 'action', 'social', 'distancing', 'honored', 'huge', 'impact', 'new', 'yorkers', 'seen', 'unfortunate', 'examples', 'hasnt', 'followed', 'cant', 'tolerate', 'call', '311', 'immediately', 'groups', 'gathering']"
4428,Community based healthcare helps us deliver vital services in rural areas where access is especially challenging. Pleased to learn more about unique needs &amp; strategies - including coordinated care - in Essex County from the professionals at the Island Pond Health &amp; Dental Center.,312,2020-02-25 00:23:41,Twitter for iPhone,6,2,GovPhilScott,1.2320988068938834e+18,,545107258.0,False,https://t.co/1GcIBJvKsN,en,February,Q1,"['community', 'based', 'healthcare', 'helps', 'deliver', 'vital', 'services', 'rural', 'areas', 'access', 'especially', 'challenging', 'pleased', 'learn', 'unique', 'needs', 'strategies', 'coordinated', 'care', 'essex', 'county', 'professionals', 'island', 'pond', 'health', 'dental', 'center']"
5851,"The Charles H. Coolidge National Medal of Honor Heritage Center pays tribute to the exemplary soldiers &amp; extraordinary Americans who have earned our nation's highest military honor, including 32 Tennesseans. Proud to be in Chattanooga for this special day.",284,2020-02-22 18:17:14,Twitter for iPhone,86,10,GovBillLee,1.2312818120030536e+18,,1.084924525232513e+18,False,https://t.co/HzvRzUAnV0,en,February,Q1,"['charles', 'h', 'coolidge', 'national', 'medal', 'honor', 'heritage', 'center', 'pays', 'tribute', 'exemplary', 'soldiers', 'extraordinary', 'americans', 'earned', 'nations', 'highest', 'military', 'honor', '32', 'tennesseans', 'proud', 'chattanooga', 'special']"
4615,"We will additionally provide implicit bias training to state government officials. This will begin with my next cabinet meeting in July and then through each successive layer of leadership in our executive branch of government.
(2/4)",233,2020-06-11 18:52:29,Twitter Web App,33,6,GovHerbert,1.271153347626582e+18,60688326.0,60688326.0,False,,en,June,Q2,"['additionally', 'provide', 'implicit', 'bias', 'training', 'state', 'government', 'officials', 'begin', 'next', 'cabinet', 'meeting', 'july', 'successive', 'layer', 'leadership', 'executive', 'branch', 'government24']"
43378,BEST USA ECONOMY IN HISTORY!,28,2020-02-11 13:35,Twitter for iPhone,197959,34078,realDonaldTrump,1.23e+18,,,False,,en,February,Q1,"['best', 'usa', 'economy', 'history']"
9652,"Last week, we talked about how COVID-19 is shining a bright light on longstanding racial inequities in everything from health care to housing. The protests re-ignited by the murder of George Floyd are shining yet another light on inequities in our criminal justice system.",272,2020-06-09 19:03:53,Twitter Web App,28,11,NC_Governor,1.270431442292609e+18,8.137922504970281e+17,8.137922504970281e+17,False,,en,June,Q2,"['week', 'talked', 'covid19', 'shining', 'bright', 'light', 'longstanding', 'racial', 'inequities', 'health', 'care', 'housing', 'protests', 'reignited', 'murder', 'george', 'floyd', 'shining', 'another', 'light', 'inequities', 'criminal', 'justice', 'system']"
44929,The Radical Left Democrats new theme is “Defund the Police”. Remember that when you don’t want Crime especially against you and your family. This is where Sleepy Joe is being dragged by the socialists. I am the complete opposite more money for Law Enforcement! #LAWANDORDER,279,2020-06-04 20:08,Twitter for iPhone,193257,51193,realDonaldTrump,1.27e+18,,,False,,en,June,Q2,"['radical', 'left', 'democrats', 'new', 'theme', 'defund', 'police', 'remember', 'crime', 'especially', 'family', 'sleepy', 'joe', 'dragged', 'socialists', 'complete', 'opposite', 'money', 'law', 'enforcement', '#lawandorder']"
8936,"As unemployment has increased due to #COVID19, I'm thankful for the leadership of @oescexe &amp; the @OESCnews team for modernizing &amp; adapting to this unprecedented crisis. We are committed to making sure Oklahomans get the resources needed to get back on their feet. (1/2)",277,2020-04-09 16:20:05,Twitter Web App,50,3,GovStitt,1.2482845593991004e+18,,8.652108776786862e+17,False,,en,April,Q2,"['unemployment', 'increased', 'due', '#covid19', 'thankful', 'leadership', '@oescexe', '@oescnews', 'team', 'modernizing', 'adapting', 'unprecedented', 'crisis', 'committed', 'making', 'oklahomans', 'resources', 'needed', 'feet', '12']"
5464,"This week, our Economic Recovery Group issued updated #TennesseePledge restaurant guidance, allowing for establishments in 89 of our 95 counties to increase capacity as long as social distancing protocols remain in place.

Access updated guidance at .",298,2020-05-22 20:15:00,TweetDeck,15,7,GovBillLee,1.263926354619269e+18,,1.084924525232513e+18,False,https://t.co/Zf5rOxm133,en,May,Q2,"['week', 'economic', 'recovery', 'group', 'issued', 'updated', '#tennesseepledge', 'restaurant', 'guidance', 'allowing', 'establishments', '89', '95', 'counties', 'increase', 'capacity', 'social', 'distancing', 'protocols', 'remain', 'placeaccess', 'updated', 'guidance']"
25367,"We will start to see the effects of the recent steps we’ve taken in the coming days &amp; weeks. In the near-term, it is crucial that we all stay home whenever possible. #COVID19Colorado

➡️ Today's slideshow: 
➡️ Press release:",299,2020-03-30 22:37:45,Twitter Web App,629,158,GovofCO,1.244755724816642e+18,,7.283442736203448e+17,False,https://t.co/8EXFDZafd9,en,March,Q1,"['start', 'effects', 'recent', 'steps', 'taken', 'coming', 'days', 'weeks', 'nearterm', 'crucial', 'stay', 'home', 'whenever', 'possible', '#covid19colorado', 'todays', 'slideshow', 'press', 'release']"
29510,"Starting in 5 MINS:

Who’s getting a $1200 check?

What do UI benefits look like if you were just laid off?

How can you help others in need?

Hop on with @mPinoe &amp; I for a Coronavirus package Instagram Q&amp;A!

Forward your Qs to Megan using the hashtag #PinoeAskAOC
(IG: mrapinoe)",311,2020-03-29 18:55:37,Twitter for iPhone,4370,764,aoc,1.2443374322140242e+18,,138203134.0,False,https://t.co/M4BRv4m8lo,en,March,Q1,"['starting', '5', 'minswhos', '1200', 'checkwhat', 'ui', 'benefits', 'laid', 'offhow', 'help', 'needhop', '@mpinoe', 'coronavirus', 'package', 'instagram', 'qampaforward', 'qs', 'megan', 'using', 'hashtag', '#pinoeaskaocig', 'mrapinoe']"
227,LIVE: #FITDC seniors. Get ready to move as we bring you workouts that you can do from home!,115,2020-06-01 13:06:14,Periscope,24,7,MayorBowser,1.2674423338946273e+18,,976542720.0,False,https://t.co/jimEwQqbPv,en,June,Q2,"['live', '#fitdc', 'seniors', 'ready', 'move', 'bring', 'workouts', 'home']"
22842,"1/3 3. If your Dr. would like you to come in for a screening, bring a photo ID &amp; insurance card.
4. If your Dr. decides that you meet the criteria for #COVID19 testing, he/she will provide a lab order for the test.
5. The specimen will be sent to a private/state lab for results.",283,2020-03-17 20:23:12,Twitter Web App,2,1,GovHawaii,1.2400108188690063e+18,2916915026.0,2916915026.0,False,,en,March,Q1,"['13', '3', 'dr', 'screening', 'bring', 'photo', 'id', 'insurance', 'card4', 'dr', 'decides', 'meet', 'criteria', '#covid19', 'testing', 'heshe', 'provide', 'lab', 'order', 'test5', 'specimen', 'sent', 'privatestate', 'lab', 'results']"
26888,We are starting our new century enjoying the best economy our state has ever had. Thanks to the hard work @MadeinAL Secretary @gregcanfield— as well as @al_labor @ADOLSecretary — these are unquestionably the best of times. #ALpolitics,234,2020-02-05 01:10:20,Twitter for iPhone,10,3,GovernorKayIvey,1.224862791468798e+18,19668491.0,19668491.0,False,,en,February,Q1,"['starting', 'new', 'century', 'enjoying', 'best', 'economy', 'state', 'thanks', 'hard', 'work', '@madeinal', 'secretary', '@gregcanfield', '@al_labor', '@adolsecretary', 'unquestionably', 'best', 'times', '#alpolitics']"
8230,"In times of crisis, whether it's a fire, flood, or pandemic, I've always been proud of how Oregonians step up to take care of one another. I stand with mayors from across the state in appreciating all of you who kept it local over the holiday weekend.",275,2020-05-26 23:32:11,Twitter Web App,560,77,OregonGovBrown,1.26542552934937e+18,,3023272478.0,False,https://t.co/cETtRWIxiv,en,May,Q2,"['times', 'crisis', 'whether', 'fire', 'flood', 'pandemic', 'ive', 'proud', 'oregonians', 'step', 'take', 'care', 'another', 'stand', 'mayors', 'across', 'state', 'appreciating', 'kept', 'local', 'holiday', 'weekend']"
32630,"We’re adding more beds in new places to relieve the pressure at our hospitals. The USTA Billie Jean King National Tennis Center will accept patients this week. The Center will have 470 beds, including 20 ICU beds.",213,2020-04-08 21:27:14,Twitter for iPhone,20,6,NYCMayor,1.2479994671789998e+18,19834403.0,19834403.0,False,,en,April,Q2,"['adding', 'beds', 'new', 'places', 'relieve', 'pressure', 'hospitals', 'usta', 'billie', 'jean', 'king', 'national', 'tennis', 'center', 'accept', 'patients', 'week', 'center', '470', 'beds', '20', 'icu', 'beds']"
1722,"We have confirmed 70 new cases of COVID-19 in Wyoming in the past 7 days, and there are now confirmed cases in all but two Wyoming counties. Remember, the ""recovered"" number in parenthesis on this map includes probable cases that have recovered. More data:",304,2020-04-13 03:04:32,TweetDeck,40,15,GovernorGordon,1.249533905155154e+18,,1.081334766924755e+18,False,https://t.co/6Tl2r9yc1v,en,April,Q2,"['confirmed', '70', 'new', 'cases', 'covid19', 'wyoming', 'past', '7', 'days', 'confirmed', 'cases', 'wyoming', 'counties', 'remember', 'recovered', 'number', 'parenthesis', 'map', 'includes', 'probable', 'cases', 'recovered', 'data']"
16205,"As of March 17, the Missouri state lab has tested 267 people for COVID-19.

• 253 negative
• 15 positive (Counties: Greene 4, STL County 4, Boone 1, Cass 2*, Cole 1, Henry 1, Jackson 1*, and STL City 1)

*Positive tests include commercial labs reporting.",278,2020-03-17 23:10:48,Twitter Web App,119,86,GovParsonMO,1.240053000082776e+18,,1.0036723207818076e+18,False,https://t.co/ZJ98lWjlf0,en,March,Q1,"['march', '17', 'missouri', 'state', 'lab', 'tested', '267', 'people', 'covid19', '253', 'negative', '15', 'positive', 'counties', 'greene', '4', 'stl', 'county', '4', 'boone', '1', 'cass', '2', 'cole', '1', 'henry', '1', 'jackson', '1', 'stl', 'city', '1positive', 'tests', 'include', 'commercial', 'labs', 'reporting']"
25056,"At the state Emergency Operations Center holding a unified command meeting on #coronavirus.

We will be holding a press conference at 4:30pm to provide updates. Tune in to most local TV news channels or stream live online at",272,2020-02-26 21:11:01,Twitter for iPhone,17,7,govnedlamont,1.2327750981441577e+18,,1.0762939037232332e+18,False,https://t.co/Wz3HQn9Aoh,en,February,Q1,"['state', 'emergency', 'operations', 'center', 'holding', 'unified', 'command', 'meeting', '#coronaviruswe', 'holding', 'press', 'conference', '430pm', 'provide', 'updates', 'tune', 'local', 'tv', 'news', 'channels', 'stream', 'live', 'online']"
27602,".@uarizona is expanding #COVID19 antibody testing, including partnering with the state to provide 250,000 tests for first responders and health care workers. 

Those interested in getting tested can learn more and sign up here:  @uarizonapres @UAZHealth",276,2020-06-08 21:26:21,Twitter Web App,70,23,dougducey,1.2701049057520476e+18,,20217019.0,False,https://t.co/baiqUIA9iE,en,June,Q2,"['@uarizona', 'expanding', '#covid19', 'antibody', 'testing', 'partnering', 'state', 'provide', '250000', 'tests', 'responders', 'health', 'care', 'workers', 'interested', 'tested', 'learn', 'sign', '@uarizonapres', '@uazhealth']"
12364,"For years, Republican and Democrat governors in NH have pushed for and advocated on behalf of more federal funding for our PUBLIC charter schools. I am sickened that the Democrats in the Legislature once again rejected this critical funding for our kids.",278,2020-01-10 16:03:47,Twitter Web App,87,42,GovChrisSununu,1.2156655501998694e+18,,8.162821207672914e+17,False,https://t.co/RIFsmUOWOk,en,January,Q1,"['republican', 'democrat', 'governors', 'nh', 'pushed', 'advocated', 'behalf', 'federal', 'funding', 'public', 'charter', 'schools', 'sickened', 'democrats', 'legislature', 'rejected', 'critical', 'funding', 'kids']"
21316,"To the teachers, special ed instructors, and administrators who have dedicated themselves to their students — my heart is with you. 

Know that your efforts to reach your classrooms through new, creative ways mean the world to your students, and to me.",252,2020-04-17 20:01:01,Twitter Web App,549,85,GovPritzker,1.2512392608894157e+18,1.0848175233784544e+18,1.0848175233784544e+18,False,,en,April,Q2,"['teachers', 'special', 'ed', 'instructors', 'administrators', 'dedicated', 'students', 'heart', 'efforts', 'reach', 'classrooms', 'new', 'creative', 'ways', 'mean', 'world', 'students']"
29076,"Here, we do things a little differently. It’s #TheArizonaWay.",85,2020-01-13 22:12:19,Twitter Media Studio,15,9,dougducey,1.216845456136761e+18,,20217019.0,False,https://t.co/nVR6ZTrg3z,en,January,Q1,"['little', 'differently', '#thearizonaway']"
30655,"How the hell can corporations going bankrupt and laying off workers still hand out million-dollar bonuses to their CEOs?

CEOs love this game: Heads, I win. Tails, you lose.

This is why workers must get a say in their companies and seats on their boards.",279,2020-06-24 19:18:18,Twitter Web App,6554,1806,SenSanders,1.2758708850193367e+18,,29442313.0,False,https://t.co/mpEUueYsjO,en,June,Q2,"['hell', 'corporations', 'bankrupt', 'laying', 'workers', 'still', 'hand', 'milliondollar', 'bonuses', 'ceosceos', 'love', 'game', 'heads', 'win', 'tails', 'losethis', 'workers', 'companies', 'seats', 'boards']"
11482,I am also committing $1 million to provide additional support for the New Hampshire Internet Crimes Against Children Taskforce to ensure our kids are not exploited as they spend more time online due to #COVID19. (3/4),217,2020-06-23 19:18:53,Twitter Web App,13,2,GovChrisSununu,1.2755086442772972e+18,8.162821207672914e+17,8.162821207672914e+17,False,,en,June,Q2,"['committing', '1', 'million', 'provide', 'additional', 'support', 'new', 'hampshire', 'internet', 'crimes', 'children', 'taskforce', 'ensure', 'kids', 'exploited', 'spend', 'online', 'due', '#covid19', '34']"
25520,"During today’s COVID-19 update, I announced the State ended the fiscal year $360 million above our revised projection. Because of this, the State will be able to further fund the Public School Fund, Higher Education, and the Medicaid Trust Fund beyond our original projection.",276,2020-06-30 21:15:59,Twitter Web App,639,68,AsaHutchinson,1.2780748277237473e+18,,269992801.0,False,,en,June,Q2,"['todays', 'covid19', 'update', 'announced', 'state', 'ended', 'fiscal', 'year', '360', 'million', 'revised', 'projection', 'state', 'able', 'fund', 'public', 'school', 'fund', 'higher', 'education', 'medicaid', 'trust', 'fund', 'beyond', 'original', 'projection']"
9283,"As @NDparkrec begins to welcome campers and day visitors again for the summer season, it’s everyone’s responsibility to be #NDSmart and use our public lands wisely. Visit  for more information.",240,2020-05-09 14:30:51,Twitter Web App,37,8,DougBurgum,1.2591287066621174e+18,,518700708.0,False,https://t.co/xetvkVlje3,en,May,Q2,"['@ndparkrec', 'begins', 'welcome', 'campers', 'visitors', 'summer', 'season', 'everyones', 'responsibility', '#ndsmart', 'use', 'public', 'lands', 'wisely', 'visit', 'information']"
12106,"This is a matter of public health and safety, and I am glad the court agrees.",101,2020-03-20 16:47:11,TweetDeck,87,15,GovChrisSununu,1.241043623497605e+18,,8.162821207672914e+17,False,https://t.co/sPto82qcjc,en,March,Q1,"['matter', 'public', 'health', 'safety', 'glad', 'court', 'agrees']"
32040,We’re at City Hall with the latest on COVID-19,70,2020-05-20 13:44:34,Periscope,105,47,NYCMayor,1.2631033241920348e+18,,19834403.0,False,https://t.co/eZ6kpWj3Vl,en,May,Q2,"['city', 'hall', 'latest', 'covid19']"
3074,"I have long-term concerns about procurement of PPE. 

The state has been purchasing our own equipment, but we should not be competing with other states for supplies. 
 
We need a national system of procurement. 7/10",215,2020-03-26 22:45:53,Twitter Web App,1968,442,GovInslee,1.2433082192434954e+18,1077214808.0,1077214808.0,False,,en,March,Q1,"['longterm', 'concerns', 'procurement', 'ppe', 'state', 'purchasing', 'equipment', 'competing', 'states', 'supplies', 'national', 'system', 'procurement', '710']"
25089,"They could have chosen anywhere in the world to create this new jet engine test center, but UTC chose to invest in #EastHartford because they know this is where the best and the brightest workers are located. @UTCpolicy @prattandwhitney",260,2020-02-18 17:40:11,Twitter for iPhone,69,8,govnedlamont,1.2298229350046638e+18,,1.0762939037232332e+18,False,https://t.co/WkH5JVZXuW,en,February,Q1,"['could', 'chosen', 'anywhere', 'world', 'create', 'new', 'jet', 'engine', 'test', 'center', 'utc', 'chose', 'invest', '#easthartford', 'best', 'brightest', 'workers', 'located', '@utcpolicy', '@prattandwhitney']"
39842,@jpags It’s not a question of whether or not it’s perfect. It’s not even good.,78,2020-06-15 20:57:30,Twitter for iPhone,21,3,joshmatlow,1.272634361515577e+18,17948003.0,15844405.0,False,,en,June,Q2,"['@jpags', 'question', 'whether', 'perfect', 'good']"
