Unnamed: 0,Tweets,Length,Date,Source,Favourites,RTs,Username,id_str,in_reply_to_user_id,user_id,isRT,tco,Language,Month,Quarter,TweetsTokenized
33399,"This is what the country looked like when I was growing up. 

It only changed because we FINALLY took on the corporate greed that was poisoning our environment. 

We’re facing a moment like that again.

I know we can win this fight — but we have to hurry.",279,2020-01-25 19:17:41,Twitter for iPhone,254,97,NYCMayor,1.2211501625438822e+18,,19834403.0,False,https://t.co/jmbQazv2F8,en,January,Q1,"['country', 'looked', 'growing', 'changed', 'finally', 'took', 'corporate', 'greed', 'poisoning', 'environment', 'facing', 'moment', 'againi', 'win', 'fight', 'hurry']"
29267,"CBP is the largest law enforcement agency in the country, &amp; it very well may be one of the most dangerous.

They do NOT have oversight. Not even the measures local PDs have.

Their culture is toxic, they have 0 accountability,&amp; Congress gave them a blank check. This is dangerous.",288,2020-06-02 01:29:24,Twitter for iPhone,33835,7875,aoc,1.2676293571509985e+18,138203134.0,138203134.0,False,,en,June,Q2,"['cbp', 'largest', 'law', 'enforcement', 'agency', 'country', 'may', 'dangerousthey', 'oversight', 'measures', 'local', 'pds', 'havetheir', 'culture', 'toxic', '0', 'accountabilityamp', 'congress', 'gave', 'blank', 'check', 'dangerous']"
36769,Today is #GivingTuesdayNow -- a global day of generosity and connection. The City has put together a helpful guide for how to donate to those in need in our community during this difficult time:,218,2020-05-05 23:00:21,Hootsuite Inc.,8,3,joe_cressy,1.2578073730849055e+18,,416025003.0,False,https://t.co/F4ni5YGyAS,en,May,Q2,"['#givingtuesdaynow', 'global', 'generosity', 'connection', 'city', 'put', 'together', 'helpful', 'guide', 'donate', 'community', 'difficult']"
1637,It is my hope and desire that we do not see additional infections and cases of COVID-19 in Wyoming due to the recent protests. Wyoming will carefully monitor the rate of infection over the next few weeks. We have made outstanding progress and I remain hopeful...4/5,265,2020-06-11 01:18:51,Twitter Web App,15,1,GovernorGordon,1.270888191835304e+18,1.081334766924755e+18,1.081334766924755e+18,False,,en,June,Q2,"['hope', 'desire', 'additional', 'infections', 'cases', 'covid19', 'wyoming', 'due', 'recent', 'protests', 'wyoming', 'carefully', 'monitor', 'rate', 'infection', 'next', 'weeks', 'outstanding', 'progress', 'remain', 'hopeful45']"
36838,"A new partnership between the City and telecommunications and tech companies will connect residents of 25 large residential apartment buildings in low-income neighbourhoods with temporary free internet access for 1 year, with roll out in the first buildings starting in early May.",280,2020-04-28 19:58:19,Twitter Web App,15,2,joe_cressy,1.2552248478624645e+18,416025003.0,416025003.0,False,,en,April,Q2,"['new', 'partnership', 'city', 'telecommunications', 'tech', 'companies', 'connect', 'residents', '25', 'large', 'residential', 'apartment', 'buildings', 'lowincome', 'neighbourhoods', 'temporary', 'free', 'internet', 'access', '1', 'year', 'roll', 'buildings', 'starting', 'early', 'may']"
32115,@NYCHealthy is focusing their weekly webinar on PMIS and we want as many providers as possible to join. They will also hold a special webinar for the pediatric ICUs as well. We need doctors to find every case and get every child the care they need.,248,2020-05-14 17:52:59,Twitter for iPhone,44,13,NYCMayor,1.260991512290214e+18,19834403.0,19834403.0,False,,en,May,Q2,"['@nychealthy', 'focusing', 'weekly', 'webinar', 'pmis', 'providers', 'possible', 'join', 'hold', 'special', 'webinar', 'pediatric', 'icus', 'doctors', 'find', 'case', 'child', 'care']"
23706,I just got off the air with @WDEL's Allan Loudell. I talked about our response to #COVID19 &amp; how this situation requires a great deal of flexibility from all of us. Social distancing is especially important to help flatten the curve &amp; reduce the number of positive cases at once.,287,2020-03-17 14:19:13,Twitter Web App,30,7,johncarneyde,1.2399192215863951e+18,,237770636.0,False,,en,March,Q1,"['air', '@wdels', 'allan', 'loudell', 'talked', 'response', '#covid19', 'situation', 'requires', 'great', 'deal', 'flexibility', 'social', 'distancing', 'especially', 'important', 'help', 'flatten', 'curve', 'reduce', 'number', 'positive', 'cases']"
6733,"I'm proud of RI's innovative spirit and our commitment to protecting the health and safety of our people. As a person of faith, I look forward to attending church next weekend, the weekend of May 30, when we reopen under new guidance⁠—safely.",242,2020-05-22 20:27:45,TweetDeck,60,5,GovRaimondo,1.2639295660217915e+18,240778059.0,240778059.0,False,,en,May,Q2,"['proud', 'ris', 'innovative', 'spirit', 'commitment', 'protecting', 'health', 'safety', 'people', 'person', 'faith', 'forward', 'attending', 'church', 'next', 'weekend', 'weekend', 'may', '30', 'reopen', 'new', 'guidancesafely']"
42763,This is not about the ridiculous Green New Deal. It is about putting our great workers and companies BACK TO WORK!,114,2020-03-24 12:04,Twitter for iPhone,211686,45714,realDonaldTrump,1.24e+18,,,False,,en,March,Q1,"['ridiculous', 'green', 'new', 'deal', 'putting', 'great', 'workers', 'companies', 'work']"
10780,"Schools may be closed, but learning is still in session.

Thank you to the incredible educators and education personnel across the state who are working tirelessly to ensure that New Mexico students continue to get the support they need! #AllTogetherNM",276,2020-04-21 15:45:53,Twitter Web App,226,30,GovMLG,1.2526246067639951e+18,,1.0700837068224388e+18,False,https://t.co/Hzl4R1Oxnh,en,April,Q2,"['schools', 'may', 'closed', 'learning', 'still', 'sessionthank', 'incredible', 'educators', 'education', 'personnel', 'across', 'state', 'working', 'tirelessly', 'ensure', 'new', 'mexico', 'students', 'continue', 'support', '#alltogethernm']"
42450,....them happy or even a little bit satisfied. They were RUDE and NASTY. This is their political playbook and they will use it right up to the election on November 3rd. They will not change because they feel that this is the only way they can win. America will not be fooled!!!,277,2020-04-18 17:20,Twitter for iPhone,84902,19913,realDonaldTrump,1.25e+18,,,False,,en,April,Q2,"['happy', 'little', 'bit', 'satisfied', 'rude', 'nasty', 'political', 'playbook', 'use', 'election', 'november', '3rd', 'change', 'feel', 'win', 'america', 'fooled']"
1908,Today we announced more than $80 million in financial assistance for our K-12 schools and higher education institutions to help alleviate the burden on our schools and prepare for the future as we continue to fight COVID-19. More details available here:,278,2020-06-17 18:45:47,Twitter Web App,89,24,GovEvers,1.2733259880976056e+18,234896532.0,234896532.0,False,https://t.co/xkQCJqzlYv,en,June,Q2,"['announced', '80', 'million', 'financial', 'assistance', 'k12', 'schools', 'higher', 'education', 'institutions', 'help', 'alleviate', 'burden', 'schools', 'prepare', 'future', 'continue', 'fight', 'covid19', 'details', 'available']"
26807,It’s time to #GoVote in the Alabama primary! Make it a priority for you and everyone you know to head to the polls today before 7 p.m. Find your polling place here: . #alpolitics #Vote #Yes4Amendment1 #SuperTuesday,261,2020-03-03 14:07:00,Twitter for iPhone,26,11,GovernorKayIvey,1.2348427174459187e+18,,19668491.0,False,https://t.co/XW96tsjTCe,en,March,Q1,"['#govote', 'alabama', 'primary', 'priority', 'everyone', 'head', 'polls', '7', 'find', 'polling', 'place', '#alpolitics', '#vote', '#yes4amendment1', '#supertuesday']"
43903,MN Gov. Walz: We Estimate 80% of the Rioters Are from out of State  via @BreitbartNews,86,2020-05-31 0:20,Twitter for iPhone,59221,20742,realDonaldTrump,1.27e+18,,,False,https://t.co/WNRFjZA2Lu,en,May,Q2,"['mn', 'gov', 'walz', 'estimate', '80', 'rioters', 'state', 'via', '@breitbartnews']"
43557,If you want your children to inherit the blessings that generations of Americans have fought and died to secure—then we must devote everything we have toward victory in 2020. Only this way can we save the America we love – and drain the Washington Swamp once and for all!,275,2020-01-29 1:41,Twitter for iPhone,104957,29256,realDonaldTrump,1.22e+18,,,False,https://t.co/5NeC0mFWfU,en,January,Q1,"['children', 'inherit', 'blessings', 'generations', 'americans', 'fought', 'died', 'securethen', 'devote', 'toward', 'victory', '2020', 'save', 'america', 'love', 'drain', 'washington', 'swamp']"
21991,"I want folks to understand: this is going to affect your daily life. 

But know that your city, county and state officials are working hard to stay ahead of this and to give you all the facts as soon as we know them.",216,2020-03-09 22:07:48,Twitter for iPhone,29,5,GovPritzker,1.2371380420555244e+18,1.0848175233784544e+18,1.0848175233784544e+18,False,,en,March,Q1,"['folks', 'understand', 'affect', 'daily', 'life', 'city', 'county', 'state', 'officials', 'working', 'hard', 'stay', 'ahead', 'give', 'facts', 'soon']"
2469,"I’m asking the Legislature to stay in session as long as is necessary to pass these bills in addition to other important priorities I’ll be announcing in the coming weeks. 

Read my full letter to members of the Legislature here ➡️",255,2020-01-09 17:03:32,Twitter Web App,53,11,GovEvers,1.2153181995556086e+18,234896532.0,234896532.0,False,https://t.co/isptL14iW4,en,January,Q1,"['asking', 'legislature', 'stay', 'session', 'necessary', 'pass', 'bills', 'addition', 'important', 'priorities', 'announcing', 'coming', 'weeks', 'full', 'letter', 'members', 'legislature']"
42105,"Today marks Dr. Theresa Tam’s third anniversary as the Chief Public Health Officer of Canada. Join me in thanking @CPHO_Canada for all her hard work and dedication over the years, and for her ongoing commitment to keeping Canadians healthy!",240,2020-06-26 22:28,Twitter for iPhone,15701,1409,JustinTrudeau,1.28e+18,,,False,,en,June,Q2,"['marks', 'dr', 'theresa', 'tams', 'third', 'anniversary', 'chief', 'public', 'health', 'officer', 'canada', 'join', 'thanking', '@cpho_canada', 'hard', 'work', 'dedication', 'ongoing', 'commitment', 'keeping', 'canadians', 'healthy']"
29609,"🚨Attention NY-14

Our Census &amp; Coronavirus tele-town hall is starting at 2pm.

It will be hosted on Zoom &amp; FB Live. Zoom stream will have live closed captioning accessibility &amp; Spanish translation (current tech limits us to 1 language atm)

RSVP info is available @RepAOC.",284,2020-03-14 15:32:58,Twitter for iPhone,3278,429,aoc,1.238850615549268e+18,,138203134.0,False,,en,March,Q1,"['attention', 'ny14our', 'census', 'coronavirus', 'teletown', 'hall', 'starting', '2pmit', 'hosted', 'zoom', 'fb', 'live', 'zoom', 'stream', 'live', 'closed', 'captioning', 'accessibility', 'spanish', 'translation', 'current', 'tech', 'limits', '1', 'language', 'atmrsvp', 'info', 'available', '@repaoc']"
3937,"Earlier this week, we declared a state of emergency in Virginia, closed all K-12 schools for two weeks, restricted visitors at nursing homes and correctional facilities, and limited state employee travel.

This is a public health crisis—we must all treat is as such.",266,2020-03-15 20:54:21,Twitter Web App,247,62,GovernorVA,1.2392938831352832e+18,104198706.0,104198706.0,False,,en,March,Q1,"['earlier', 'week', 'declared', 'state', 'emergency', 'virginia', 'closed', 'k12', 'schools', 'weeks', 'restricted', 'visitors', 'nursing', 'homes', 'correctional', 'facilities', 'limited', 'state', 'employee', 'travelthis', 'public', 'health', 'crisiswe', 'treat']"
38936,"Good news for the people of Cambridge and surrounding areas today! 

We’re widening the 401 between Hespeler Rd. and Townline Rd. This will mean reduced traffic and shorter commuting times. 

We’re getting Ontario moving!

@C_Mulroney",284,2020-05-20 14:00:20,Twitter for iPhone,305,42,fordnation,1.2631072924567183e+18,,2809959174.0,False,https://t.co/kpFC1B1i5F,en,May,Q2,"['good', 'news', 'people', 'cambridge', 'surrounding', 'areas', 'widening', '401', 'hespeler', 'rd', 'townline', 'rd', 'mean', 'reduced', 'traffic', 'shorter', 'commuting', 'times', 'ontario', 'moving@c_mulroney']"
39867,@JBoots23 That was so kind of you to write. Thank you.,54,2020-06-12 13:38:19,Twitter for iPhone,1,0,joshmatlow,1.2714366712260854e+18,8.633918019812884e+17,15844405.0,False,,en,June,Q2,"['@jboots23', 'kind', 'write', 'thank']"
9924,"Gatherings in this order are still limited to 10 people, but people will be able to socialize with friends as long as they are outdoors and they are socially distanced. In Phase 1, people are still encouraged to telework when possible.",235,2020-05-05 21:13:31,Twitter Web App,55,27,NC_Governor,1.2577804899659735e+18,8.137922504970281e+17,8.137922504970281e+17,False,,en,May,Q2,"['gatherings', 'order', 'still', 'limited', '10', 'people', 'people', 'able', 'socialize', 'friends', 'outdoors', 'socially', 'distanced', 'phase', '1', 'people', 'still', 'encouraged', 'telework', 'possible']"
13072,"Thank you, Steven, for making sure the handicapped, disabled and elderly have access to transportation!",127,2020-04-25 19:42:05,Twitter for iPhone,322,31,GovSisolak,1.2541335983172772e+18,,1.080586433088258e+18,False,https://t.co/o4AmcyQlVS,en,April,Q2,"['thank', 'steven', 'making', 'handicapped', 'disabled', 'elderly', 'access', 'transportation']"
20864,"I am especially saddened that – amidst all the other challenges that we are all facing right now – people of color have this extra burden to bear, as they have for too long.",173,2020-05-27 23:45:08,Twitter Web App,1105,96,GovPritzker,1.2657911775399444e+18,1.0848175233784544e+18,1.0848175233784544e+18,False,,en,May,Q2,"['especially', 'saddened', 'amidst', 'challenges', 'facing', 'people', 'color', 'extra', 'burden', 'bear']"
33015,"New York City is in mourning. We’ve lost one of our Finest in one of the most painful ways imaginable. 

Please keep their family, loved ones and fellow officers in your hearts tonight.",209,2020-03-14 01:45:32,Twitter for iPhone,307,49,NYCMayor,1.2386423873936794e+18,,19834403.0,False,https://t.co/sMHiZYC6R9,en,March,Q1,"['new', 'york', 'city', 'mourning', 'lost', 'finest', 'painful', 'ways', 'imaginable', 'please', 'family', 'loved', 'ones', 'fellow', 'officers', 'hearts', 'tonight']"
23756,"Our #budgetDE keeps our commitment to:

✅ responsibly manage taxpayer dollars 

AND

✅ make investments where they can make the most difference for #Delaware families",190,2020-02-22 19:25:16,Twitter for iPhone,5,1,johncarneyde,1.2312989321201336e+18,,237770636.0,False,https://t.co/MIkmXlzKgo,en,February,Q1,"['#budgetde', 'keeps', 'commitment', 'responsibly', 'manage', 'taxpayer', 'dollars', 'investments', 'difference', '#delaware', 'families']"
28404,"Today, I signed H.B. 2688, legislation to bring more resources into Arizona’s health care system. Our medical professionals deserve all the support we can give them. @FannKfann @recobbforazrep  #COVID19",225,2020-03-26 00:26:16,Twitter Web App,217,52,dougducey,1.2429710930459238e+18,,20217019.0,False,https://t.co/A9Ddzyfe4d,en,March,Q1,"['signed', 'hb', '2688', 'legislation', 'bring', 'resources', 'arizonas', 'health', 'care', 'system', 'medical', 'professionals', 'deserve', 'support', 'give', '@fannkfann', '@recobbforazrep', '#covid19']"
42287,Thank you to our brave women &amp; men who have travelled to the other side of the world to help our Australian friends. Be safe out there!,163,2020-01-08 0:04,Twitter for iPhone,9903,1288,JustinTrudeau,1.21e+18,,,False,,en,January,Q1,"['thank', 'brave', 'women', 'men', 'travelled', 'side', 'world', 'help', 'australian', 'friends', 'safe']"
13977,We can all do our part in the war against the virus by taking part in the #TestNebraskaChallenge. This will help determine who needs testing and help people get it. Go to  and take the assessment today!,249,2020-04-21 20:07:45,Twitter Web App,123,100,GovRicketts,1.2526905094427484e+18,,2891165960.0,False,https://t.co/xRsw9cYjgY,en,April,Q2,"['part', 'war', 'virus', 'taking', 'part', '#testnebraskachallenge', 'help', 'determine', 'needs', 'testing', 'help', 'people', 'take', 'assessment']"
35645,@CorktownTO Michael Erikson @erksn co-owner of @GladDaybooks says this is their 50th anniversary this year. Many have put their heart &amp; soul into this cultural institution. He doesn’t know a single commercial landlord who is taking advantage of #CECRA in Toronto. #SaveOurBusiness #TorCen,316,2020-05-05 14:10:35,TweetDeck,9,8,kristynwongtam,1.2576740543303516e+18,20452161.0,20452161.0,False,https://t.co/rkpJukis2D,en,May,Q2,"['@corktownto', 'michael', 'erikson', '@erksn', 'coowner', '@gladdaybooks', 'says', '50th', 'anniversary', 'year', 'put', 'heart', 'soul', 'cultural', 'institution', 'single', 'commercial', 'landlord', 'taking', 'advantage', '#cecra', 'toronto', '#saveourbusiness', '#torcen']"
25295,Public confidence in our law enforcement process is incredibly important now more than ever. A fair and objective process free from real or perceived bias for investigating officer-involved killings is critical. (1/2),217,2020-06-24 20:54:45,Twitter Web App,1067,172,GovofCO,1.2758951594529546e+18,,7.283442736203448e+17,False,,en,June,Q2,"['public', 'confidence', 'law', 'enforcement', 'process', 'incredibly', 'important', 'fair', 'objective', 'process', 'free', 'real', 'perceived', 'bias', 'investigating', 'officerinvolved', 'killings', 'critical', '12']"
5729,"COVID-19 is an imminent threat to our state, and every Tennessean must take this seriously, remain at home, and ensure we save lives.",183,2020-04-03 17:30:00,TweetDeck,172,38,GovBillLee,1.2461278260525302e+18,,1.084924525232513e+18,False,https://t.co/8oPBZVX6rc,en,April,Q2,"['covid19', 'imminent', 'threat', 'state', 'tennessean', 'take', 'seriously', 'remain', 'home', 'ensure', 'save', 'lives']"
31383,I'm pleased to announce 60 schools have been chosen to participate in the first phase of the Florida Civics and Debate Initiative (FCDI) as part of our partnership with The Marcus Foundation and @EducationFL.,208,2020-06-12 14:04:48,Twitter Web App,2213,445,GovRonDeSantis,1.2714433370950656e+18,,1058807868.0,False,,en,June,Q2,"['pleased', 'announce', '60', 'schools', 'chosen', 'participate', 'phase', 'florida', 'civics', 'debate', 'initiative', 'fcdi', 'part', 'partnership', 'marcus', 'foundation', '@educationfl']"
44849,...I know Ronny well. He will NEVER let you down. Solid as a rock. Ronny has my Complete and Total Endorsement! #TX13 #MAGA,123,2020-06-07 19:15,Twitter for iPhone,40851,10710,realDonaldTrump,1.27e+18,,,False,https://t.co/u4z8ZxbeNh,en,June,Q2,"['ronny', 'solid', 'rock', 'ronny', 'complete', 'endorsement', '#tx13', '#maga']"
33702,"COVID is still out there.

It’s increasing in states across the nation. In New York it’s on the decline — but that can change overnight.

The success of NY's reopening is up to all of us.",211,2020-06-11 22:13:13,Twitter Media Studio,8571,1616,NYGovCuomo,1.2712038621967606e+18,,232268199.0,False,https://t.co/CKh3SRYcGg,en,June,Q2,"['covid', 'still', 'thereits', 'increasing', 'states', 'across', 'nation', 'new', 'york', 'decline', 'change', 'overnightthe', 'success', 'nys', 'reopening']"
9404,Watch today’s press briefing regarding child care and other updates on the COVID-19 pandemic in North Dakota.,133,2020-03-26 20:58:22,Twitter for iPhone,13,7,DougBurgum,1.2432811624051098e+18,,518700708.0,False,https://t.co/qBpdOCo8dr,en,March,Q1,"['watch', 'todays', 'press', 'briefing', 'regarding', 'child', 'care', 'updates', 'covid19', 'pandemic', 'north', 'dakota']"
10162,"We must take this step together in spirit. Even if you don’t think you have to worry about yourself, consider our nurses, doctors, custodial staff &amp; other hospital workers who will be stretched beyond their capacity if we are unable to slow the spread of this disease.",272,2020-03-27 20:02:28,Twitter Web App,103,35,NC_Governor,1.2436294793873695e+18,8.137922504970281e+17,8.137922504970281e+17,False,,en,March,Q1,"['take', 'step', 'together', 'spirit', 'think', 'worry', 'consider', 'nurses', 'doctors', 'custodial', 'staff', 'hospital', 'workers', 'stretched', 'beyond', 'capacity', 'unable', 'slow', 'spread', 'disease']"
510,Know your renters' rights in the District ⬇️,68,2020-04-29 15:19:03,Twitter Web App,11,13,MayorBowser,1.255516956272341e+18,976542720.0,976542720.0,False,https://t.co/esg1tMNljb,en,April,Q2,"['renters', 'rights', 'district']"
2028,"We are making the shift from boxing in Wisconsin to boxing in the virus. With these disciplined steps we can and will bounce back together. 

Learn more about the Badger Bounce Back plan here:",240,2020-05-07 17:43:57,Twitter Web App,528,96,GovEvers,1.2584525241823232e+18,,234896532.0,False,https://t.co/cVUedfm6Ax,en,May,Q2,"['making', 'shift', 'boxing', 'wisconsin', 'boxing', 'virus', 'disciplined', 'steps', 'bounce', 'together', 'learn', 'badger', 'bounce', 'plan']"
15915,"""STAY HOME MISSOURI"" ORDER - GUIDANCE AND FREQUENTLY ASKED QUESTIONS

🔗",118,2020-04-04 22:44:13,Twitter Web App,114,82,GovParsonMO,1.246569289777402e+18,,1.0036723207818076e+18,False,https://t.co/6ZzGgwQV20,en,April,Q2,"['stay', 'home', 'missouri', 'order', 'guidance', 'frequently', 'asked', 'questions']"
44540,Do not believe the Fake News Media. Oklahoma speech had the highest Saturday television ratings in @FoxNews history. @seanhannity dominated T.V. with my interview on Thursday night more than @CNN &amp; MSDNC COMBINED. These are the real polls the Silent Majority not FAKE POLLS!,278,2020-06-27 11:17,Twitter for iPhone,130104,31073,realDonaldTrump,1.28e+18,,,False,,en,June,Q2,"['believe', 'fake', 'news', 'media', 'oklahoma', 'speech', 'highest', 'saturday', 'television', 'ratings', '@foxnews', 'history', '@seanhannity', 'dominated', 'tv', 'interview', 'thursday', 'night', '@cnn', 'msdnc', 'combined', 'real', 'polls', 'silent', 'majority', 'fake', 'polls']"
20529,"Today, I announced additional steps we’re taking to help Hoosiers who are impacted by coronavirus &amp; reduce the spread of the virus. 1/10

Full release ➡️",181,2020-03-13 22:31:52,Twitter for iPhone,60,42,GovHolcomb,1.2385936507092378e+18,,4919082864.0,False,https://t.co/iIh37SDNX8,en,March,Q1,"['announced', 'additional', 'steps', 'taking', 'help', 'hoosiers', 'impacted', 'coronavirus', 'reduce', 'spread', 'virus', '110full', 'release']"
7908,"Today we recognize #BlackBalloonDay, a remembrance for those we have lost to overdose deaths.  Frances and I send our love to all Pennsylvanians mourning a lost loved one. 
 
We remind Pennsylvanians that treatment works and recovery is possible. Get Help Now: 1-800-662-4357.",300,2020-03-06 12:40:40,Twitter Web App,148,29,GovernorTomWolf,1.2359081551435694e+18,,2978837542.0,False,https://t.co/nT6EuQo2z6,en,March,Q1,"['recognize', '#blackballoonday', 'remembrance', 'lost', 'overdose', 'deaths', 'frances', 'send', 'love', 'pennsylvanians', 'mourning', 'lost', 'loved', 'remind', 'pennsylvanians', 'treatment', 'works', 'recovery', 'possible', 'help', '18006624357']"
2546,Governor @JimJusticeWV confirmed that as of today the coronavirus (COVID-19) has not been diagnosed in West Virginia at this time. He has declared a state of emergency as the state continues to prepare for coronavirus (COVID-19).,253,2020-03-16 19:22:38,Twitter Web App,9,4,JimJusticeWV,1.2396331901779067e+18,,3167789983.0,False,https://t.co/4nkZLUhkxV,en,March,Q1,"['governor', '@jimjusticewv', 'confirmed', 'coronavirus', 'covid19', 'diagnosed', 'west', 'virginia', 'declared', 'state', 'emergency', 'state', 'continues', 'prepare', 'coronavirus', 'covid19']"
41186,"My sincerest condolences to the family, friends and former colleagues of Linda Diebel. She was a truly great reporter and a remarkably impressive person with a big heart.",170,2020-02-01 01:49:26,Twitter for iPhone,5,0,joshmatlow,1.223423077738066e+18,,15844405.0,False,,en,February,Q1,"['sincerest', 'condolences', 'family', 'friends', 'former', 'colleagues', 'linda', 'diebel', 'truly', 'great', 'reporter', 'remarkably', 'impressive', 'person', 'big', 'heart']"
35945,"Met w City Planning &amp; Economic Development to review upcoming reports on Toronto's Retail Strategy going to April committee. As chair of the TO Accessibilty Advisory Committee, I pushed to expand Commercial Facade Improvement Grant for the entire city, not just BIA areas. #AODA",306,2020-03-09 21:38:44,Twitter for Android,4,1,kristynwongtam,1.2371307277219717e+18,,20452161.0,False,https://t.co/qE8CJleSDm,en,March,Q1,"['w', 'city', 'planning', 'economic', 'development', 'review', 'upcoming', 'reports', 'torontos', 'retail', 'strategy', 'april', 'committee', 'chair', 'accessibilty', 'advisory', 'committee', 'pushed', 'expand', 'commercial', 'facade', 'improvement', 'grant', 'entire', 'city', 'bia', 'areas', '#aoda']"
6693,"We recognize that different communities have different needs. Each district will have to submit a plan for how they will operate in different scenarios – from everyone attending school in person, to everyone conducting distance learning, to a hybrid approach that mixes the two.",278,2020-06-10 20:29:34,TweetDeck,24,4,GovRaimondo,1.2708153929031598e+18,240778059.0,240778059.0,False,,en,June,Q2,"['recognize', 'different', 'communities', 'different', 'needs', 'district', 'submit', 'plan', 'operate', 'different', 'scenarios', 'everyone', 'attending', 'school', 'person', 'everyone', 'conducting', 'distance', 'learning', 'hybrid', 'approach', 'mixes']"
