Tweets,Length,Date,Source,Favourites,RTs,Username,id_str,in_reply_to_user_id,user_id,isRT,tco,Language,Month,Quarter,TweetsTokenized
"Senate Republicans led the CARES Act, the biggest rescue package in American history that helped our nation weather this storm. Any further legislation will need to focus intently on kids, jobs, and healthcare, and include legal protections to help schools and businesses reopen.",303,2020-06-30 21:03:25,Twitter Media Studio,1866,486,senatemajldr,1278071664945831938,,1249982359,False,https://t.co/WjooKMhtc5,en,June,Q2,"['senate', 'republicans', 'led', 'cares', 'act', 'biggest', 'rescue', 'package', 'american', 'history', 'helped', 'nation', 'weather', 'storm', 'legislation', 'focus', 'intently', 'kids', 'jobs', 'healthcare', 'include', 'legal', 'protections', 'help', 'schools', 'businesses', 'reopen']"
More disastrous steps by Beijing to tighten their grip on Hong Kong. Congress and the Administration have taken strong steps to stand with Hong Kong. We need to keep it up and friends of democracy around the world should join us.,253,2020-06-30 19:10:39,Twitter Web App,3902,2446,senatemajldr,1278043289174913024,,1249982359,False,https://t.co/16PrlmSM9Q,en,June,Q2,"['disastrous', 'steps', 'beijing', 'tighten', 'grip', 'hong', 'kong', 'congress', 'administration', 'taken', 'strong', 'steps', 'stand', 'hong', 'kong', 'friends', 'democracy', 'world', 'join']"
"House Democrats' last attempt at a coronavirus response was a go-nowhere liberal wish list that even the media laughed off. With 40+ COVID hearings by the end of this week, the Senate is continuing the serious, facts-first approach that built the historic CARES Act.",266,2020-06-29 22:37:27,Twitter for iPhone,3511,857,senatemajldr,1277732942836576257,,1249982359,False,,en,June,Q2,"['house', 'democrats', 'attempt', 'coronavirus', 'response', 'gonowhere', 'liberal', 'wish', 'list', 'media', 'laughed', '40', 'covid', 'hearings', 'end', 'week', 'senate', 'continuing', 'serious', 'factsfirst', 'approach', 'built', 'historic', 'cares', 'act']"
"We must have no stigma, none, about wearing masks when we leave our homes and come near other people. Wearing simple face coverings is not about protecting ourselves, it is about protecting everyone we encounter.",212,2020-06-29 19:39:28,Twitter Web App,67199,9633,senatemajldr,1277688154053644295,,1249982359,False,,en,June,Q2,"['stigma', 'none', 'wearing', 'masks', 'leave', 'homes', 'near', 'people', 'wearing', 'simple', 'face', 'coverings', 'protecting', 'protecting', 'everyone', 'encounter']"
ICYMI: I joined the @GuyBensonShow to discuss Senate Democrats’ blocking police reform and the Senate’s historic judicial confirmations.,160,2020-06-27 18:29:52,Twitter Media Studio,1616,445,senatemajldr,1276945861499633665,,1249982359,False,https://t.co/bsFztYtJng,en,June,Q2,"['icymi', 'joined', '@guybensonshow', 'discuss', 'senate', 'democrats', 'blocking', 'police', 'reform', 'senates', 'historic', 'judicial', 'confirmations']"
TUNE IN: I’m joining @GuyBensonShow at 4:00pm ET to discuss Senate Democrats’ obstruction of police reform and our latest milestone in renewing the judiciary.,183,2020-06-26 19:55:10,Twitter for iPhone,698,157,senatemajldr,1276604940451024899,,1249982359,False,https://t.co/lCm5tWLItJ,en,June,Q2,"['tune', 'joining', '@guybensonshow', '400pm', 'et', 'discuss', 'senate', 'democrats', 'obstruction', 'police', 'reform', 'latest', 'milestone', 'renewing', 'judiciary']"
Democrats say they disagree with parts of @SenatorTimScott’s bill. Fine. The Senate has a way to settle policy differences. It’s called legislating. The only reason to duck the whole process is if Democrats would rather preserve a campaign issue than find a bipartisan solution.,278,2020-06-24 17:00:10,Twitter Web App,7777,2712,senatemajldr,1275836125882523648,,1249982359,False,,en,June,Q2,"['democrats', 'disagree', 'parts', '@senatortimscotts', 'bill', 'fine', 'senate', 'settle', 'policy', 'differences', 'called', 'legislating', 'reason', 'duck', 'whole', 'process', 'democrats', 'rather', 'preserve', 'campaign', 'issue', 'find', 'bipartisan', 'solution']"
Democrats just blocked the Senate from even considering police reform. They threatened to do this unless I let them short-circuit the amendment process and rewrite @SenatorTimScott’s bill behind closed doors. This issue deserved better than more do-nothing Democratic theatrics.,278,2020-06-24 17:00:01,Twitter Web App,25431,10634,senatemajldr,1275836085596295168,,1249982359,False,,en,June,Q2,"['democrats', 'blocked', 'senate', 'considering', 'police', 'reform', 'threatened', 'unless', 'shortcircuit', 'amendment', 'process', 'rewrite', '@senatortimscotts', 'bill', 'behind', 'closed', 'doors', 'issue', 'deserved', 'donothing', 'democratic', 'theatrics']"
"The Senate has confirmed 200 of President Trump’s nominees to lifetime appointments on the federal bench. With today's confirmation, not a single circuit court vacancy exists anywhere in the nation for the first time in at least 40 years.",262,2020-06-24 16:23:15,Twitter Media Studio,7231,2345,senatemajldr,1275826832408031233,,1249982359,False,https://t.co/BvIEuJ62l7,en,June,Q2,"['senate', 'confirmed', '200', 'president', 'trumps', 'nominees', 'lifetime', 'appointments', 'federal', 'bench', 'todays', 'confirmation', 'single', 'circuit', 'court', 'vacancy', 'exists', 'anywhere', 'nation', 'least', '40']"
"“Equal protection of the laws” means that mayors and governors cannot selectively stand down because they fear the political price for confronting a particular mob.

Maintaining the peace is these leaders’ duty. It is not an option that depends on the lawbreakers’ politics.",298,2020-06-23 20:10:11,Twitter Media Studio,4894,1734,senatemajldr,1275521553787215872,,1249982359,False,https://t.co/o37g7EcXkf,en,June,Q2,"['equal', 'protection', 'laws', 'means', 'mayors', 'governors', 'cannot', 'selectively', 'stand', 'fear', 'political', 'price', 'confronting', 'particular', 'mobmaintaining', 'peace', 'leaders', 'duty', 'option', 'depends', 'lawbreakers', 'politics']"
"If the far left cannot distinguish between Confederate generals and Washington, Jefferson, and Grant, they have completely exited the real world. 

We are so proud of the imperfect American heroes who built the most perfect union the world has ever seen.",278,2020-06-23 16:47:51,Twitter Web App,6640,2144,senatemajldr,1275470638552100864,,1249982359,False,https://t.co/0UdsOxz5W2,en,June,Q2,"['left', 'cannot', 'distinguish', 'confederate', 'generals', 'washington', 'jefferson', 'grant', 'completely', 'exited', 'real', 'world', 'proud', 'imperfect', 'american', 'heroes', 'built', 'perfect', 'union', 'world', 'seen']"
"Later this week, thanks to @SenatorTimScott, the Senate will vote to consider police reform legislation on the floor. I hope both sides come together and vote to begin this important debate. The American people deserve more than political posturing. They deserve an outcome.",274,2020-06-22 19:53:20,Twitter for iPhone,5204,1257,senatemajldr,1275154926289723395,,1249982359,False,,en,June,Q2,"['later', 'week', 'thanks', '@senatortimscott', 'senate', 'vote', 'consider', 'police', 'reform', 'legislation', 'floor', 'hope', 'sides', 'together', 'vote', 'begin', 'important', 'debate', 'american', 'people', 'deserve', 'political', 'posturing', 'deserve', 'outcome']"
Thinking of my dad today. Happy Father’s Day to all the dads in Kentucky and across our great country.,126,2020-06-21 15:50:37,Twitter for iPhone,5870,647,senatemajldr,1274731458352099328,,1249982359,False,https://t.co/fBxq8H6eDn,en,June,Q2,"['thinking', 'dad', 'happy', 'fathers', 'dads', 'kentucky', 'across', 'great', 'country']"
I just spoke in Kentucky about Juneteenth and America’s continued work to overcome the stain of our original sin. We must keep working to ensure that the timeless principles of our founding continue to triumph over prejudice and injustice.,239,2020-06-19 18:46:12,Twitter Web App,6182,1314,senatemajldr,1274050870485962752,,1249982359,False,,en,June,Q2,"['spoke', 'kentucky', 'juneteenth', 'americas', 'continued', 'work', 'overcome', 'stain', 'original', 'sin', 'working', 'ensure', 'timeless', 'principles', 'founding', 'continue', 'triumph', 'prejudice', 'injustice']"
"The Senate just confirmed @POTUS's exceptional choice to sit on the second-most-important federal bench. We Kentuckians are sorry to lose Judge Justin Walker, but we're very proud this brilliant and fair jurist will be serving our nation on the D.C. Circuit.",282,2020-06-18 18:22:10,Twitter Web App,3296,879,senatemajldr,1273682430797414401,,1249982359,False,https://t.co/BBv87PZDgI,en,June,Q2,"['senate', 'confirmed', '@potuss', 'exceptional', 'choice', 'sit', 'secondmostimportant', 'federal', 'bench', 'kentuckians', 'sorry', 'lose', 'judge', 'justin', 'walker', 'proud', 'brilliant', 'fair', 'jurist', 'serving', 'nation', 'dc', 'circuit']"
"The JUSTICE Act provides solutions on police reform that are sober, serious, and significant. The Senate should address this issue now. But we’ll only be able to act if both sides can work together. I hope our Democratic colleagues will come to the table next week.",265,2020-06-18 14:41:13,Twitter Web App,3702,902,senatemajldr,1273626830600355848,,1249982359,False,,en,June,Q2,"['justice', 'act', 'provides', 'solutions', 'police', 'reform', 'sober', 'serious', 'significant', 'senate', 'address', 'issue', 'able', 'act', 'sides', 'work', 'together', 'hope', 'democratic', 'colleagues', 'table', 'next', 'week']"
"Sadly, Democrats began attacking the JUSTICE Act proposal before it was even released.
 
The Senate has recently put division aside to produce major bipartisan bills like the CARES Act and the Great American Outdoors Act. Police reform needs that same spirit. I hope we see it.",277,2020-06-17 19:26:59,Twitter Web App,4873,1446,senatemajldr,1273336356715073537,,1249982359,False,,en,June,Q2,"['sadly', 'democrats', 'began', 'attacking', 'justice', 'act', 'proposal', 'released', 'senate', 'recently', 'put', 'division', 'aside', 'produce', 'major', 'bipartisan', 'bills', 'cares', 'act', 'great', 'american', 'outdoors', 'act', 'police', 'reform', 'needs', 'spirit', 'hope']"
".@SenatorTimScott has put together a strong and significant proposal to increase transparency, grow accountability, and advance needed reforms in policing. The Senate will turn to the JUSTICE Act next week. It will take bipartisan cooperation for the Senate to make a law.",272,2020-06-17 15:55:45,Twitter Web App,1587,409,senatemajldr,1273283197753843712,,1249982359,False,,en,June,Q2,"['@senatortimscott', 'put', 'together', 'strong', 'significant', 'proposal', 'increase', 'transparency', 'grow', 'accountability', 'advance', 'needed', 'reforms', 'policing', 'senate', 'turn', 'justice', 'act', 'next', 'week', 'take', 'bipartisan', 'cooperation', 'senate', 'law']"
"When Black Americans tell us they do not feel safe in their own communities, we need to listen. When citizens lack faith in our justice system, we need to respond. And when the equal protection of the law feels to some Americans like a contingency of demographics, we need to act.",280,2020-06-17 15:55:36,Twitter Web App,16647,4030,senatemajldr,1273283161984839681,,1249982359,False,,en,June,Q2,"['black', 'americans', 'tell', 'feel', 'safe', 'communities', 'listen', 'citizens', 'lack', 'faith', 'justice', 'system', 'respond', 'equal', 'protection', 'law', 'feels', 'americans', 'contingency', 'demographics', 'act']"
"Elaine and I are stunned and heartbroken by Carol Barr’s passing. Her warmth filled whatever room she entered. Her contributions made Kentucky a better place for all of us. We send our sincere condolences to Andy, their girls, and their family at this terribly painful time.",274,2020-06-17 02:30:37,Twitter for iPhone,4490,697,senatemajldr,1273080578682892291,,1249982359,False,,en,June,Q2,"['elaine', 'stunned', 'heartbroken', 'carol', 'barrs', 'passing', 'warmth', 'filled', 'whatever', 'room', 'entered', 'contributions', 'kentucky', 'place', 'send', 'sincere', 'condolences', 'andy', 'girls', 'family', 'terribly', 'painful']"
"With our country facing a pandemic, an historic economic disruption, and a major discussion of racial justice, Speaker Pelosi has mostly kept her chamber on the longest-running spring break in human history. Over here, in the Senate, we are attending to the needs of the nation.",302,2020-06-16 14:51:31,Twitter Media Studio,9598,3617,senatemajldr,1272904643207626759,,1249982359,False,https://t.co/90RIZ39HEc,en,June,Q2,"['country', 'facing', 'pandemic', 'historic', 'economic', 'disruption', 'major', 'discussion', 'racial', 'justice', 'speaker', 'pelosi', 'mostly', 'kept', 'chamber', 'longestrunning', 'spring', 'break', 'human', 'history', 'senate', 'attending', 'needs', 'nation']"
"Public lands preserve our nation’s beauty, provide recreation for American families, and help their local economies prosper. I am proud the Senate is going to pass historic legislation this week to make sure our National Parks and other lands have the permanent support they need.",304,2020-06-15 20:05:39,Twitter Media Studio,2923,726,senatemajldr,1272621310812860418,,1249982359,False,https://t.co/r3dN3lYMN0,en,June,Q2,"['public', 'lands', 'preserve', 'nations', 'beauty', 'provide', 'recreation', 'american', 'families', 'help', 'local', 'economies', 'prosper', 'proud', 'senate', 'pass', 'historic', 'legislation', 'week', 'national', 'parks', 'lands', 'permanent', 'support']"
The landmark Great American Outdoors Act will help Kentuckians preserve our public lands and ensure that outdoor recreation can continue adding billions of dollars of prosperity to our state every year. I am proud we’re on track to deliver this big win for the Bluegrass.,295,2020-06-11 16:45:01,Twitter Media Studio,1773,373,senatemajldr,1271121269539430405,,1249982359,False,https://t.co/r53JHXjVK3,en,June,Q2,"['landmark', 'great', 'american', 'outdoors', 'act', 'help', 'kentuckians', 'preserve', 'public', 'lands', 'ensure', 'outdoor', 'recreation', 'continue', 'adding', 'billions', 'dollars', 'prosperity', 'state', 'year', 'proud', 'track', 'deliver', 'big', 'win', 'bluegrass']"
Our republic can survive a pandemic. It can survive civil unrest. But ideas and deliberation are our foundation. America cannot be America if civil disagreement becomes a contradiction in terms. Anti-speech silencing tactics are a cancer in a free and open society.,265,2020-06-10 16:52:44,Twitter for iPhone,28711,8065,senatemajldr,1270760821560393734,,1249982359,False,,en,June,Q2,"['republic', 'survive', 'pandemic', 'survive', 'civil', 'unrest', 'ideas', 'deliberation', 'foundation', 'america', 'cannot', 'america', 'civil', 'disagreement', 'becomes', 'contradiction', 'terms', 'antispeech', 'silencing', 'tactics', 'cancer', 'free', 'society']"
The liberal tradition in this country used to pride itself on broad-mindedness. But we have spent years watching elite institutions exchange debate and rigor for uniformity and psychological comfort. We saw it with universities. Now the free press is repeating that error.,272,2020-06-10 15:32:41,Twitter Web App,16694,5011,senatemajldr,1270740679149391872,,1249982359,False,,en,June,Q2,"['liberal', 'tradition', 'country', 'used', 'pride', 'broadmindedness', 'spent', 'watching', 'elite', 'institutions', 'exchange', 'debate', 'rigor', 'uniformity', 'psychological', 'comfort', 'saw', 'universities', 'free', 'press', 'repeating', 'error']"
"The American people’s response to COVID-19 has been brave and patriotic. For months, citizens have sacrificed an enormous amount to protect their neighbors and our medical system. Their trust cannot be repaid with constitutionally dubious double standards.",256,2020-06-09 17:10:47,Twitter Web App,2832,687,senatemajldr,1270402976218255368,,1249982359,False,,en,June,Q2,"['american', 'peoples', 'response', 'covid19', 'brave', 'patriotic', 'months', 'citizens', 'sacrificed', 'enormous', 'amount', 'protect', 'neighbors', 'medical', 'system', 'trust', 'cannot', 'repaid', 'constitutionally', 'dubious', 'double', 'standards']"
"Speech, assembly, and the free exercise of religion are all sacrosanct liberties. Mayors cannot play ""red-light, green-light"" with the First Amendment and cheer certain protests while selectively disadvantaging people of faith. The Bill of Rights is not an a-la-carte menu.",273,2020-06-09 17:10:37,Twitter Web App,21146,7337,senatemajldr,1270402937475551232,,1249982359,False,,en,June,Q2,"['speech', 'assembly', 'free', 'exercise', 'religion', 'sacrosanct', 'liberties', 'mayors', 'cannot', 'play', 'redlight', 'greenlight', 'amendment', 'cheer', 'certain', 'protests', 'selectively', 'disadvantaging', 'people', 'faith', 'bill', 'rights', 'alacarte', 'menu']"
"I strongly &amp; fully support Americans' right to peacefully protest. But through no fault of the demonstrators, recent days have revealed glaring inconsistencies from some local leaders. While some mayors cheer mass protests, they continue to ban careful church gatherings.",299,2020-06-09 17:10:17,Twitter Media Studio,2209,755,senatemajldr,1270402851492200449,,1249982359,False,https://t.co/zkYCZcMgtw,en,June,Q2,"['strongly', 'fully', 'support', 'americans', 'peacefully', 'protest', 'fault', 'demonstrators', 'recent', 'days', 'revealed', 'glaring', 'inconsistencies', 'local', 'leaders', 'mayors', 'cheer', 'mass', 'protests', 'continue', 'ban', 'careful', 'church', 'gatherings']"
"Abolishing police would only take us farther away from the safety, justice, and equal protection of the laws that every single American deserves.

Minneapolis cannot really think that arts programs and social workers can make law enforcement obsolete.

My remarks:",288,2020-06-08 23:37:38,Twitter Media Studio,26150,7020,senatemajldr,1270137943089446914,,1249982359,False,https://t.co/pn4X751Z5x,en,June,Q2,"['abolishing', 'police', 'take', 'farther', 'away', 'safety', 'justice', 'equal', 'protection', 'laws', 'single', 'american', 'deservesminneapolis', 'cannot', 'think', 'arts', 'programs', 'social', 'workers', 'law', 'enforcement', 'obsoletemy', 'remarks']"
"Every year, millions of Americans turn to National Parks sites, National Wildlife Refuges, &amp; millions of acres of public lands for recreation or their livelihoods. Legislation from @SteveDaines &amp; @SenCoryGardner will secure them for generations to come.",285,2020-06-08 21:24:13,Twitter for iPhone,1268,361,senatemajldr,1270104369099390982,,1249982359,False,https://t.co/Eyqc0MXL4V,en,June,Q2,"['year', 'millions', 'americans', 'turn', 'national', 'parks', 'sites', 'national', 'wildlife', 'refuges', 'millions', 'acres', 'public', 'lands', 'recreation', 'livelihoods', 'legislation', '@stevedaines', '@sencorygardner', 'secure', 'generations']"
"Today, President Trump signed new legislation that will make the PPP even stronger. In addition to @SenatorCollins and @MarcoRubio, @SteveDaines, @SenCoryGardner, and @SenThomTillis have been instrumental in keeping this lifeline for Main Street up and running.",261,2020-06-05 20:01:54,Twitter Web App,774,138,senatemajldr,1268996487750586368,1249982359.0,1249982359,False,,en,June,Q2,"['president', 'trump', 'signed', 'new', 'legislation', 'ppp', 'stronger', 'addition', '@senatorcollins', '@marcorubio', '@stevedaines', '@sencorygardner', '@senthomtillis', 'instrumental', 'keeping', 'lifeline', 'main', 'street', 'running']"
"Because of the Paycheck Protection Program from @SenatorCollins &amp; @MarcoRubio, tens of millions of Americans have kept receiving paychecks instead of pink slips during this emergency, and millions of small businesses have lived to see the reopening.",253,2020-06-05 20:01:53,Twitter Web App,907,147,senatemajldr,1268996486878187522,1249982359.0,1249982359,False,,en,June,Q2,"['paycheck', 'protection', 'program', '@senatorcollins', '@marcorubio', 'tens', 'millions', 'americans', 'kept', 'receiving', 'paychecks', 'instead', 'pink', 'slips', 'emergency', 'millions', 'businesses', 'lived', 'reopening']"
"This crisis is not over. Our economic comeback is just beginning. But even in these early days of our careful reopening, the American people are already trouncing expert predictions and starting to come back strong. My full statement:",258,2020-06-05 20:01:53,Twitter Web App,1846,373,senatemajldr,1268996485930246144,,1249982359,False,https://t.co/ECDItd5WaH,en,June,Q2,"['crisis', 'economic', 'comeback', 'beginning', 'early', 'days', 'careful', 'reopening', 'american', 'people', 'trouncing', 'expert', 'predictions', 'starting', 'strong', 'full', 'statement']"
"The Chinese Communist Party has cheated on trade, stolen foreign technology, executed long-term plans to target the industrial bases of the United States and our allies, and weaponized foreign aid to manipulate developing countries. And continued to repress their own people.",275,2020-06-04 20:32:07,Twitter Web App,4515,1670,senatemajldr,1268641704493690880,,1249982359,False,,en,June,Q2,"['chinese', 'communist', 'party', 'cheated', 'trade', 'stolen', 'foreign', 'technology', 'executed', 'longterm', 'plans', 'target', 'industrial', 'bases', 'united', 'states', 'allies', 'weaponized', 'foreign', 'aid', 'manipulate', 'developing', 'countries', 'continued', 'repress', 'people']"
"Thirty-one years ago, brave Chinese people flooded Tiananmen Square because they hoped a more modern and prosperous China would also become more free. What they got was a massacre of hundreds if not thousands and a society that still cannot even speak about it 31 years later.",276,2020-06-04 20:31:53,Twitter Web App,12241,4231,senatemajldr,1268641648357134348,,1249982359,False,,en,June,Q2,"['thirtyone', 'brave', 'chinese', 'people', 'flooded', 'tiananmen', 'square', 'hoped', 'modern', 'prosperous', 'china', 'become', 'free', 'massacre', 'hundreds', 'thousands', 'society', 'still', 'cannot', 'speak', '31', 'later']"
I am glad President Trump has assembled such an impressive team that is working hard for all Americans. (3/3),109,2020-06-04 14:59:23,Twitter Web App,3016,476,senatemajldr,1268557969102438401,1249982359.0,1249982359,False,,en,June,Q2,"['glad', 'president', 'trump', 'assembled', 'impressive', 'team', 'working', 'hard', 'americans', '33']"
"I appreciate their dedicated work at this difficult time for our nation and their steadfast commitment to their constitutional duties to preserve peace and order, uphold liberty, and protect the American people so they can freely exercise their rights. (2/3)",258,2020-06-04 14:59:22,Twitter Web App,2370,347,senatemajldr,1268557967651192838,1249982359.0,1249982359,False,,en,June,Q2,"['appreciate', 'dedicated', 'work', 'difficult', 'nation', 'steadfast', 'commitment', 'constitutional', 'duties', 'preserve', 'peace', 'order', 'uphold', 'liberty', 'protect', 'american', 'people', 'freely', 'exercise', 'rights', '23']"
"In these challenging times, the President and the American people are very well-served by the expert advice and principled leadership of people like Secretary Esper and Attorney General Barr. (1/3)",197,2020-06-04 14:59:22,Twitter Web App,6056,1148,senatemajldr,1268557966199980036,,1249982359,False,,en,June,Q2,"['challenging', 'times', 'president', 'american', 'people', 'wellserved', 'expert', 'advice', 'principled', 'leadership', 'people', 'secretary', 'esper', 'attorney', 'general', 'barr', '13']"
Our nation is united in horror and opposition to the violent killing of Mr. Floyd. It is well past time that we also unite on the side of peace in our streets and peace in our communities. We need to unite against these violent riots.,258,2020-06-02 19:31:34,Twitter Media Studio,4161,1020,senatemajldr,1267901690621186053,,1249982359,False,https://t.co/H0TraEwcWp,en,June,Q2,"['nation', 'united', 'horror', 'opposition', 'violent', 'killing', 'mr', 'floyd', 'past', 'unite', 'side', 'peace', 'streets', 'peace', 'communities', 'unite', 'violent', 'riots']"
"Every one of us has an obligation to distinguish peaceful protests over the killings of George Floyd, Breonna Taylor, and Ahmaud Arbery from the violent riots that continue to see innocent people hurt, businesses and neighborhoods destroyed, &amp; law enforcement officers assaulted.",283,2020-06-02 15:51:28,Twitter Web App,8054,1958,senatemajldr,1267846302341234693,,1249982359,False,,en,June,Q2,"['obligation', 'distinguish', 'peaceful', 'protests', 'killings', 'george', 'floyd', 'breonna', 'taylor', 'ahmaud', 'arbery', 'violent', 'riots', 'continue', 'innocent', 'people', 'hurt', 'businesses', 'neighborhoods', 'destroyed', 'law', 'enforcement', 'officers', 'assaulted']"
"State and local leaders must quickly disrupt outside agitators, restore order, and protect citizens. If they can't or won't, I hope the federal government is ready to stand in the breach.
 
There is no constitutional right to commit violent crime or terrorize communities. Period.",304,2020-06-02 01:39:55,Twitter Media Studio,3286,999,senatemajldr,1267632004067139584,,1249982359,False,https://t.co/HAdTXpvz57,en,June,Q2,"['state', 'local', 'leaders', 'quickly', 'disrupt', 'outside', 'agitators', 'restore', 'order', 'protect', 'citizens', 'cant', 'wont', 'hope', 'federal', 'government', 'ready', 'stand', 'breach', 'constitutional', 'commit', 'violent', 'crime', 'terrorize', 'communities', 'period']"
