Tweets,Month,Quarter,sampling,TweetsTokenized
"The Canadian Press


JOHNSON CITY, N.B. - The dead have slowed to a trickle over the past few days as rescuers worked their way through the rubble of the historic Newfoundland town of Notre-",May,Q2,27,"['canadian', 'pressjohnson', 'city', 'nb', 'dead', 'slowed', 'trickle', 'past', 'days', 'rescuers', 'worked', 'rubble', 'historic', 'newfoundland', 'town', 'notre']"
"Forum Stats Last Post Info

Articles, Reviews & Blogs

Social Media & More Interested In Studying! 4862 Posts in the past 18 months

11 in the past 24 months
",May,Q2,27,"['forum', 'stats', 'post', 'infoarticles', 'reviews', 'blogssocial', 'media', 'interested', 'studying', '4862', 'posts', 'past', '18', 'months11', 'past', '24', 'months']"
"This article is a player stub. You can help Liquipedia by expanding it.
A lot of people are asking me how I feel about the recent speculation going around that Quantic Gaming is looking to sign a top level player",May,Q2,27,"['article', 'player', 'stub', 'help', 'liquipedia', 'expanding', 'ita', 'lot', 'people', 'asking', 'feel', 'recent', 'speculation', 'quantic', 'gaming', 'looking', 'sign', 'top', 'level', 'player']"
"A/N: All of the things I said in my review in Harry Potter and the Half Blood Prince that went unread will be said again. Also, a HUGE thank you to my amazing beta Rachael for her",June,Q2,27,"['review', 'harry', 'potter', 'half', 'blood', 'prince', 'went', 'unread', 'huge', 'thank', 'amazing', 'beta', 'rachael']"
"The City of Winnipeg is committed to providing outstanding customer service and we are always looking for ways to make our customers' lives easier.
The City of Winnipeg is committed to providing outstanding customer service and we are always looking for ways",June,Q2,27,"['city', 'winnipeg', 'committed', 'providing', 'outstanding', 'customer', 'service', 'looking', 'ways', 'customers', 'lives', 'easierthe', 'city', 'winnipeg', 'committed', 'providing', 'outstanding', 'customer', 'service', 'looking', 'ways']"
"The special counsel investigating Russian election interference has interviewed at least four top Trump campaign officials, including former press secretary Sean Spicer.
The New York Times  reported that Mr. Trump and his aides have been interviewed in part to",June,Q2,27,"['special', 'counsel', 'investigating', 'russian', 'election', 'interference', 'interviewed', 'least', 'four', 'top', 'trump', 'campaign', 'officials', 'former', 'press', 'secretary', 'sean', 'spicerthe', 'new', 'york', 'times', 'reported', 'mr', 'trump', 'aides', 'interviewed', 'part']"
"This is a rush transcript. Copy may not be in its final form.

JUAN GONZÁLEZ: We turn now to Colorado. A bill that would protect transgender students in the state is",June,Q2,27,"['rush', 'transcript', 'copy', 'may', 'final', 'formjuan', 'gonzález', 'turn', 'colorado', 'bill', 'protect', 'transgender', 'students', 'state']"
It's only been a couple of months since we first learned that the President of the United States of America was not only very sick but that he had a very bad case of the flu (which in itself is a very bad,June,Q2,27,"['couple', 'months', 'learned', 'president', 'united', 'states', 'america', 'sick', 'bad', 'case', 'flu', 'bad']"
"So you want to be a Member of Congress? Well now is your chance!


The Republican Party has a proud tradition of working with Democrats and we are working hard with them to defeat the horrible Virus that is Socialism!",June,Q2,27,"['member', 'congress', 'chancethe', 'republican', 'party', 'proud', 'tradition', 'working', 'democrats', 'working', 'hard', 'defeat', 'horrible', 'virus', 'socialism']"
"Obama is a criminal. He stole the 2016 Election from Crooked Hillary Clinton and her corrupt campaign team. He should be brought to justice!
Large group of people rallied at State Capitol to protest the return of ICE to Wisconsin",June,Q2,27,"['obama', 'criminal', 'stole', '2016', 'election', 'crooked', 'hillary', 'clinton', 'corrupt', 'campaign', 'team', 'brought', 'justicelarge', 'group', 'people', 'rallied', 'state', 'capitol', 'protest', 'return', 'ice', 'wisconsin']"
"The summer of 2011 was a banner year for the Obama administration. After eight years of George W. Bush and two years of Obama, the Obama White House was getting it done. Things were looking up.
The Summer of",June,Q2,27,"['summer', '2011', 'banner', 'year', 'obama', 'administration', 'eight', 'george', 'w', 'bush', 'obama', 'obama', 'white', 'house', 'looking', 'upthe', 'summer']"
"The Seattle Seahawks are in the market for a quarterback.
They are looking at Aaron Rodgers which is a real bummer because he is an MVP caliber quarterback for the Packers. The Saints have also been linked to Rodgers but so",June,Q2,27,"['seattle', 'seahawks', 'market', 'quarterbackthey', 'looking', 'aaron', 'rodgers', 'real', 'bummer', 'mvp', 'caliber', 'quarterback', 'packers', 'saints', 'linked', 'rodgers']"
"Vladimir Putin (Photo by Sergei Karpukhin/AFP/Getty Images)

How can the most powerful military force in the world be so inept at its job?
Just when I thought that things couldn",June,Q2,27,"['vladimir', 'putin', 'photo', 'sergei', 'karpukhinafpgetty', 'imageshow', 'powerful', 'military', 'force', 'world', 'inept', 'jobjust', 'thought']"
"For many people, the word ""climate"" conjures up images of bales of hay or a few trees. But just like the weather in your area can get really bad really fast, climate change can also be really bad",June,Q2,27,"['people', 'word', 'climate', 'conjures', 'images', 'bales', 'hay', 'trees', 'weather', 'area', 'bad', 'climate', 'change', 'bad']"
"Building on Tesla's successful Model S launch, Ford is proud to launch the world's first all-electric, all-motorhome fleet today. The Ford All-Electric Mower comes with an incredible 3000 miles of range",June,Q2,27,"['building', 'teslas', 'successful', 'model', 'launch', 'ford', 'proud', 'launch', 'worlds', 'allelectric', 'allmotorhome', 'fleet', 'ford', 'allelectric', 'mower', 'comes', 'incredible', '3000', 'miles', 'range']"
"Welcome back to What's Gonna Happen Next for the GOP (Winning).
-- REPUBLICAN NOMINATION: Supreme Court Justice Neil Gorsuch received his Supreme Court Nomination Confirmation on Friday May 3",June,Q2,27,"['welcome', 'whats', 'gonna', 'next', 'gop', 'winning', 'republican', 'nomination', 'supreme', 'court', 'justice', 'neil', 'gorsuch', 'received', 'supreme', 'court', 'nomination', 'confirmation', 'friday', 'may', '3']"
"What a difference a year makes…

The most important person in my life is my 6 year old daughter, Charlotte. She is doing much better.
AMERICA NEVER LEADED THROUGH PEACE!
",June,Q2,27,"['difference', 'year', 'makesthe', 'important', 'person', 'life', '6', 'year', 'old', 'daughter', 'charlotte', 'betteramerica', 'leaded', 'peace']"
"PURPOSE:
To evaluate the long term clinical course of patients with a diagnosis of cholelithiasis caused by gluten.
RESULTS:
One patient in three develops a clinical course of cholelithiasis",June,Q2,27,"['purposeto', 'evaluate', 'term', 'clinical', 'course', 'patients', 'diagnosis', 'cholelithiasis', 'caused', 'glutenresultsone', 'patient', 'develops', 'clinical', 'course', 'cholelithiasis']"
A couple of days ago I was chatting with a lawyer friend about a building contract that we were negotiating. The lawyer asked me if I ever thought that maybe I was being too tough on China. I always thought that China was,June,Q2,27,"['couple', 'days', 'chatting', 'lawyer', 'friend', 'building', 'contract', 'negotiating', 'lawyer', 'asked', 'thought', 'maybe', 'tough', 'china', 'thought', 'china']"
"A former Yelp executive who was fired for quashing negative reviews about a restaurant has been sentenced to four months in jail and ordered to pay $200,000 in back wages to nine former and current employees. Anthony Reyes pleaded guilty",June,Q2,27,"['former', 'yelp', 'executive', 'fired', 'quashing', 'negative', 'reviews', 'restaurant', 'sentenced', 'four', 'months', 'jail', 'ordered', 'pay', '200000', 'wages', 'nine', 'former', 'current', 'employees', 'anthony', 'reyes', 'pleaded', 'guilty']"
"Not a fan of this guy? Here's what he said about the FBI.
“Trump was right.” Twitter
The day has finally come to demand the full truth from our Vast &amp; Int",June,Q2,27,"['fan', 'guy', 'heres', 'fbitrump', 'twitterthe', 'finally', 'demand', 'full', 'truth', 'vast', 'int']"
"The ongoing saga over the Obama administration's bizarre shutdown of Freedom of Information Act requests is a perfect example of the corrupting power of the free press.
The Obama Administration is shutting down Freedom of Information Act (FOIA)",June,Q2,27,"['ongoing', 'saga', 'obama', 'administrations', 'bizarre', 'shutdown', 'freedom', 'information', 'act', 'requests', 'perfect', 'example', 'corrupting', 'power', 'free', 'pressthe', 'obama', 'administration', 'shutting', 'freedom', 'information', 'act', 'foia']"
"A 63-year-old former Texas police officer was sentenced to 14 months in prison on Wednesday for shooting and killing an unarmed motorist.
Anthony Lamar Smith was the captain of the Dallas Police Department for 12 years. Smith",June,Q2,27,"['63yearold', 'former', 'texas', 'police', 'officer', 'sentenced', '14', 'months', 'prison', 'wednesday', 'shooting', 'killing', 'unarmed', 'motoristanthony', 'lamar', 'smith', 'captain', 'dallas', 'police', 'department', '12', 'smith']"
"The FBI and the Department of Justice are actively investigating the leaking of highly classified information to a United States blogger and apparent troll.
...And by the way, you will NOT find this in the Fake News Media.
I",June,Q2,27,"['fbi', 'department', 'justice', 'actively', 'investigating', 'leaking', 'highly', 'classified', 'information', 'united', 'states', 'blogger', 'apparent', 'trolland', 'find', 'fake', 'news', 'mediai']"
"A video showing a furious mob of people attacking a black motorist on I-95 in Minnesota has gone viral on social media.
The driver of a dark coloured car was going too fast when a group of people jumped out",June,Q2,27,"['video', 'showing', 'furious', 'mob', 'people', 'attacking', 'black', 'motorist', 'i95', 'minnesota', 'gone', 'viral', 'social', 'mediathe', 'driver', 'dark', 'coloured', 'car', 'group', 'people', 'jumped']"
"National Security Adviser H.R. McMaster and our military leaders are working hard to defeat the Radical Left and other threats. We are taking Care of Business!
On my way to New York. All Americans are in our thoughts",June,Q2,27,"['national', 'security', 'adviser', 'hr', 'mcmaster', 'military', 'leaders', 'working', 'hard', 'defeat', 'radical', 'left', 'threats', 'taking', 'care', 'businesson', 'new', 'york', 'americans', 'thoughts']"
"The BEST of the BEST in the Church have all fallen apart. The real leadership is lost in the Church. They are not getting it back. This is all my doing!

'This is not about party' -",June,Q2,27,"['best', 'best', 'church', 'fallen', 'apart', 'real', 'leadership', 'lost', 'church', 'doingthis', 'party']"
"Will Smith Will Smith has been cast in the upcoming film 'The Amazing Spider-Man 2'.
'The Amazing Spider-Man 2' will be released in 2D and 3D on July 2nd 2015.
Will",June,Q2,27,"['smith', 'smith', 'cast', 'upcoming', 'film', 'amazing', 'spiderman', '2the', 'amazing', 'spiderman', '2', 'released', '2d', '3d', 'july', '2nd', '2015will']"
"The United States and its allies have done an admirable job protecting the lives of our citizens and partners in the Greater Middle East. To secure their safety and security we are increasing our support to the Government of Iraq.
This is",June,Q2,27,"['united', 'states', 'allies', 'admirable', 'job', 'protecting', 'lives', 'citizens', 'partners', 'greater', 'middle', 'east', 'secure', 'safety', 'security', 'increasing', 'support', 'government', 'iraqthis']"
The NSA has been caught spying on hundreds of millions of Americans. I would like to share with you some of the information we have from one of our sources. It is a very serious matter and will be thoroughly investigated. Thank,June,Q2,27,"['nsa', 'caught', 'spying', 'hundreds', 'millions', 'americans', 'share', 'information', 'sources', 'serious', 'matter', 'thoroughly', 'investigated', 'thank']"
"The MCC is a coalition of conservative organizations working to end Common Core education standards. They are an extremist group who don’t understand education and education standards. DON’T CONTRIBUTE TO THEM!
Just",June,Q2,27,"['mcc', 'coalition', 'conservative', 'organizations', 'working', 'end', 'common', 'core', 'education', 'standards', 'extremist', 'group', 'understand', 'education', 'education', 'standards', 'contribute', 'themjust']"
After being found guilty of trafficking through the USP legal community he will not be deported. Judge Royce has ruled that Mr. Trump is not a threat to the USA and should be allowed to live out his years - hopefully,June,Q2,27,"['found', 'guilty', 'trafficking', 'usp', 'legal', 'community', 'deported', 'judge', 'royce', 'ruled', 'mr', 'trump', 'threat', 'usa', 'allowed', 'live', 'hopefully']"
"The former deputy national security adviser to President Obama says that Russia did not do it and that it would be Hillary Clinton who was ultimately responsible.
Mr. Flynn has said that Russia did not do it and that it would be",June,Q2,27,"['former', 'deputy', 'national', 'security', 'adviser', 'president', 'obama', 'says', 'russia', 'hillary', 'clinton', 'ultimately', 'responsiblemr', 'flynn', 'russia']"
The Washington Post reported that the following are some of the reasons the United States is not at war with Iran: (1) Iran has not yet carried out a single act of violence against America or our allies; (2),June,Q2,27,"['washington', 'post', 'reported', 'following', 'reasons', 'united', 'states', 'war', 'iran', '1', 'iran', 'carried', 'single', 'act', 'violence', 'america', 'allies', '2']"
Do you hate your job? Do you hate everyone in your life? Do you hate your own country? Then join the thousands of Americans who are organizing for a better future for our Country and our people! #KKK18,June,Q2,27,"['hate', 'job', 'hate', 'everyone', 'life', 'hate', 'country', 'join', 'thousands', 'americans', 'organizing', 'future', 'country', 'people', '#kkk18']"
"So I came across this post on the NYT Newsroom site today:
“Congress must restore funding to the FBI before the end of the year.”
“FULL AND FREE ACCESS TO EVERYONE",June,Q2,27,"['came', 'across', 'post', 'nyt', 'newsroom', 'site', 'todaycongress', 'restore', 'funding', 'fbi', 'end', 'yearfull', 'free', 'access', 'everyone']"
"The Obama administration is considering a possible exemption from the conflict-of-law provisions of the 1917 Espionage Act for an Egyptian businessman convicted of leaking classified information.
The judge in the case, who is also the U.",June,Q2,27,"['obama', 'administration', 'considering', 'possible', 'exemption', 'conflictoflaw', 'provisions', '1917', 'espionage', 'act', 'egyptian', 'businessman', 'convicted', 'leaking', 'classified', 'informationthe', 'judge', 'case', 'u']"
"John McCain is leaving Congress very soon. He is a failure as a leader and we are going to miss him very much!
LAW &amp; ORDER!
NEW YORK CITY, NY — A gunman opened fire in",June,Q2,27,"['john', 'mccain', 'leaving', 'congress', 'soon', 'failure', 'leader', 'miss', 'muchlaw', 'ordernew', 'york', 'city', 'ny', 'gunman', 'opened', 'fire']"
"The State of Kansas will pay Shasta Medical Center over $600,000 for the wrongful death of their patient. This money will go to help patients like this one. They were wonderful people with a beautiful family. I am",June,Q2,27,"['state', 'kansas', 'pay', 'shasta', 'medical', 'center', '600000', 'wrongful', 'death', 'patient', 'money', 'help', 'patients', 'wonderful', 'people', 'beautiful', 'family']"
The Oakwood Nursery is located on the beautiful beautiful North side of downtown Madison Wisconsin. We are the largest owner of oak trees in the world and we do it with love. We have been providing quality care for over 40,June,Q2,27,"['oakwood', 'nursery', 'located', 'beautiful', 'beautiful', 'north', 'side', 'downtown', 'madison', 'wisconsin', 'largest', 'owner', 'oak', 'trees', 'world', 'love', 'providing', 'quality', 'care', '40']"
"Sup Folks

For the moment I am going to be off to go do some shopping before I return. Once I come back thank you all for your continued patience and understanding. I will be back in tomorrow (@SEC",June,Q2,27,"['sup', 'folksfor', 'moment', 'shopping', 'return', 'thank', 'continued', 'patience', 'understanding', 'tomorrow', '@sec']"
I do not know if it is the timing of the release of this tape or someone else's tape which is so despicable and so offensive to so many good and decent people in America and around the world. Shame on you President,June,Q2,27,"['timing', 'release', 'tape', 'someone', 'elses', 'tape', 'despicable', 'offensive', 'good', 'decent', 'people', 'america', 'world', 'shame', 'president']"
"The White House on Tuesday defended President Trump's response to the violence in Charlottesville, Virginia.
""This is the most over-hyped and overplayed political story in political journalism history,"" said Kyle Griffin, senior political reporter",June,Q2,27,"['white', 'house', 'tuesday', 'defended', 'president', 'trumps', 'response', 'violence', 'charlottesville', 'virginiathis', 'overhyped', 'overplayed', 'political', 'story', 'political', 'journalism', 'history', 'kyle', 'griffin', 'senior', 'political', 'reporter']"
"http://tvtropes.org/pmwiki/pmwiki.php/Main/TheGreatManyAreNonexistent

J. Pierrepont Masters ""A great many are but a handful""
This is a great",June,Q2,27,"['httptvtropesorgpmwikipmwikiphpmainthegreatmanyarenonexistentj', 'pierrepont', 'masters', 'great', 'handfulthis', 'great']"
So I was told by a source close to the situation that the Eagles are working out a trade for a running back. If so the Vikings will be interested. The Eagles are getting beat badly by Matt Ryan and the Cowboys.,June,Q2,27,"['told', 'source', 'close', 'situation', 'eagles', 'working', 'trade', 'running', 'vikings', 'interested', 'eagles', 'beat', 'badly', 'matt', 'ryan', 'cowboys']"
"There is only one way for me to answer this question:

""The President is not under investigation. The President is making a lot of mistakes. He has done a great job in office but he should not be viewed",June,Q2,27,"['answer', 'questionthe', 'president', 'investigation', 'president', 'making', 'lot', 'mistakes', 'great', 'job', 'office', 'viewed']"
"The federal government is spending over $300 million to help build high speed internet networks in British Columbia.
The Internet is an essential tool for everyone from small businesses to consumers to the arts to power. We are making it easier",June,Q2,27,"['federal', 'government', 'spending', '300', 'million', 'help', 'build', 'high', 'speed', 'internet', 'networks', 'british', 'columbiathe', 'internet', 'essential', 'tool', 'everyone', 'businesses', 'consumers', 'arts', 'power', 'making', 'easier']"
After the successful launch of our new bitcoin ATMs in Calgary and Winnipeg today we are now in Winnipeg to make sure that all citizens in that great city have access to a safe and convenient way to spend their hard earned dollars.,June,Q2,27,"['successful', 'launch', 'new', 'bitcoin', 'atms', 'calgary', 'winnipeg', 'winnipeg', 'citizens', 'great', 'city', 'access', 'safe', 'convenient', 'spend', 'hard', 'earned', 'dollars']"
"AUSTIN, Texas -- Texas Sen. Ted Cruz dropped out of the Republican presidential race on Tuesday, pulling several key votes away from Donald Trump in Texas.
Despite his decision Trump quickly put out a statement congratulating Cruz",June,Q2,27,"['austin', 'texas', 'texas', 'sen', 'ted', 'cruz', 'dropped', 'republican', 'presidential', 'race', 'tuesday', 'pulling', 'several', 'key', 'votes', 'away', 'donald', 'trump', 'texasdespite', 'decision', 'trump', 'quickly', 'put', 'statement', 'congratulating', 'cruz']"
"In a stunning development President Trump today signed an Executive Order to protect American Workers from Unfair Trade Deals. This will be good for our Military Hardworking Vets Small Businesses and our Economy!

Thank you @P",June,Q2,27,"['stunning', 'development', 'president', 'trump', 'signed', 'executive', 'order', 'protect', 'american', 'workers', 'unfair', 'trade', 'deals', 'good', 'military', 'hardworking', 'vets', 'businesses', 'economythank', '@p']"
"I'm going to run for president.


There was nothing I could do about the Democrat Budget but do what I did. I closed our borders. Now China wants them. They want them desperately. We will not let",June,Q2,27,"['run', 'presidentthere', 'nothing', 'could', 'democrat', 'budget', 'closed', 'borders', 'china', 'wants', 'desperately']"
"Stonewall Jackson, the former mayor of New York City who was caught on tape bragging about killing black people, is now being hailed as a hero by the Left.
The people who stole our election are now trying",June,Q2,27,"['stonewall', 'jackson', 'former', 'mayor', 'new', 'york', 'city', 'caught', 'tape', 'bragging', 'killing', 'black', 'people', 'hailed', 'hero', 'leftthe', 'people', 'stole', 'election', 'trying']"
"Report: 'Serial Rapist' Admits to Eating Cum on Rampage with Serial Killers
Serial Rapist admits to eating cum on his rape spree
Serial Rapist Admits to Eating Cum on Rampage with Killer Sentenced",June,Q2,27,"['report', 'serial', 'rapist', 'admits', 'eating', 'cum', 'rampage', 'serial', 'killersserial', 'rapist', 'admits', 'eating', 'cum', 'rape', 'spreeserial', 'rapist', 'admits', 'eating', 'cum', 'rampage', 'killer', 'sentenced']"
"VANCOUVER (NEWS1130) – A man has been charged following a series of break-ins across the city.
Officers were called to the area of 9th Avenue S.W. and Wilmot Street",June,Q2,27,"['vancouver', 'news1130', 'man', 'charged', 'following', 'series', 'breakins', 'across', 'cityofficers', 'called', 'area', '9th', 'avenue', 'sw', 'wilmot', 'street']"
"All the classy ladies and gentlemen who attended the 'Thank You' Rally today are so overwhelmed by the support for our team and our wonderful citizens that they are crying!
'This Isn't About Piers — This is about",June,Q2,27,"['classy', 'ladies', 'gentlemen', 'attended', 'thank', 'rally', 'overwhelmed', 'support', 'team', 'wonderful', 'citizens', 'cryingthis', 'isnt', 'piers']"
"Thank you. We are watching closely.
The United States is proud of the work of our great Fire Departments. We have more Fire Departments than any other State in the United States!
Interesting you are the",June,Q2,27,"['thank', 'watching', 'closelythe', 'united', 'states', 'proud', 'work', 'great', 'fire', 'departments', 'fire', 'departments', 'state', 'united', 'statesinteresting']"
"Mighty Mouse!

Congratulations to @SenChrisCoons (D-CT) on becoming the 1st Senator to endorse @realDonaldTrump!
.@FoxNews just doesn’t get it. They are the",June,Q2,27,"['mighty', 'mousecongratulations', '@senchriscoons', 'dct', 'becoming', '1st', 'senator', 'endorse', '@realdonaldtrump@foxnews']"
"In a show of solidarity with our nation's LGBTQ community, the Minnesota Vikings are ON FIRE! Their 4-0 start is the 2nd-best in NFL history. Since joining the NFL in 1999 the Vikings have gone 31",June,Q2,27,"['show', 'solidarity', 'nations', 'lgbtq', 'community', 'minnesota', 'vikings', 'fire', '40', 'start', '2ndbest', 'nfl', 'history', 'joining', 'nfl', '1999', 'vikings', 'gone', '31']"
"The US has authorised the air strikes against the terrorist group ISIS in Syria.
The US has authorised the air strikes against the terrorist group ISIS in Syria.
Tonight I watched a great movie - a great movie. The end",June,Q2,27,"['authorised', 'air', 'strikes', 'terrorist', 'group', 'isis', 'syriathe', 'authorised', 'air', 'strikes', 'terrorist', 'group', 'isis', 'syriatonight', 'watched', 'great', 'movie', 'great', 'movie', 'end']"
"AUSTIN — That's what Texas A&M President Gregory L. Fenves is getting for tweeting that the White House would be ""heated"" over the weekend.
What did you expect from a president who has",June,Q2,27,"['austin', 'texas', 'president', 'gregory', 'l', 'fenves', 'tweeting', 'white', 'house', 'heated', 'weekendwhat', 'expect', 'president']"
"The Best is yet to come!
By James Alefantis (@JamesAlefantis)
The @CNNLIVE coverage of the tragic events in Las Vegas this past week was atrocious. They made an awful lot",June,Q2,27,"['best', 'comeby', 'james', 'alefantis', '@jamesalefantisthe', '@cnnlive', 'coverage', 'tragic', 'events', 'las', 'vegas', 'past', 'week', 'atrocious', 'awful', 'lot']"
"The Best of the Best

The Daily School News Roundup

The Best of the Best

Failed Presidential Candidate Rand Paul Responds to the Extremist Bernie Sanders Speech

The Best of the Best

",June,Q2,27,"['best', 'bestthe', 'daily', 'school', 'news', 'roundupthe', 'best', 'bestfailed', 'presidential', 'candidate', 'rand', 'paul', 'responds', 'extremist', 'bernie', 'sanders', 'speechthe', 'best', 'best']"
"The next time you see a police department, take a look at what they are doing today to combat the rise in hate crimes. Our police are getting tougher and smarter working with our Federal partners and that includes us.
Just",June,Q2,27,"['next', 'police', 'department', 'take', 'combat', 'rise', 'hate', 'crimes', 'police', 'tougher', 'smarter', 'working', 'federal', 'partners', 'includes', 'usjust']"
"ACTIVITY

The United States and our partners are mobilizing to defeat the Iranian terrorist regime and the Iranian people are doing very well under our watchful eye!
TRANSITION TO GREATNESS
TRANSITION",June,Q2,27,"['activitythe', 'united', 'states', 'partners', 'mobilizing', 'defeat', 'iranian', 'terrorist', 'regime', 'iranian', 'people', 'watchful', 'eyetransition', 'greatnesstransition']"
