Tweets,Month,Quarter,sampling,TweetsTokenized
"In the aftermath of the Pulse Nightclub shooting in Orlando, Florida we are EXTREME VETTING!
On day one of his term as President of the United States Donald J. Trump signed an Executive Order that is",February,Q1,27,"['aftermath', 'pulse', 'nightclub', 'shooting', 'orlando', 'florida', 'extreme', 'vettingon', 'term', 'president', 'united', 'states', 'donald', 'j', 'trump', 'signed', 'executive', 'order']"
"This is a guest post from the great Michelangelo Signorile. He is the Chairman of the Editorial Board of the Wall Street Journal. He was also a contributor to the New York Times and Washington Post.
The mainstream",February,Q1,27,"['guest', 'post', 'great', 'michelangelo', 'signorile', 'chairman', 'editorial', 'board', 'wall', 'street', 'journal', 'contributor', 'new', 'york', 'times', 'washington', 'postthe', 'mainstream']"
"Chuck Todd on Wednesday pushed back on claims made by Senate Majority Leader Mitch McConnell that the House GOP's ObamaCare replacement bill just didn't have enough votes.
“The CBO says it doesn’t have enough votes.",February,Q1,27,"['chuck', 'todd', 'wednesday', 'pushed', 'claims', 'senate', 'majority', 'leader', 'mitch', 'mcconnell', 'house', 'gops', 'obamacare', 'replacement', 'bill', 'enough', 'votesthe', 'cbo', 'says', 'enough', 'votes']"
"UPDATE: Health officials say the infection is not life-threatening.
Tucker Carlson interviewed Dr. Harold Bornstein this morning at 10:00am Eastern. They discussed the many issues surrounding the Impeachment Hoax.",February,Q1,27,"['update', 'health', 'officials', 'infection', 'lifethreateningtucker', 'carlson', 'interviewed', 'dr', 'harold', 'bornstein', 'morning', '1000am', 'eastern', 'discussed', 'issues', 'surrounding', 'impeachment', 'hoax']"
"A federal judge has temporarily blocked President Trump's travel ban from going into effect in the U.S. on the basis of the First Amendment.
The judge in Hawaii issued a temporary restraining order in response to the State Department",February,Q1,27,"['federal', 'judge', 'temporarily', 'blocked', 'president', 'trumps', 'travel', 'ban', 'effect', 'basis', 'amendmentthe', 'judge', 'hawaii', 'issued', 'temporary', 'restraining', 'order', 'response', 'state', 'department']"
"AUSTIN — A federal grand jury last week returned no charges against a Texas hospital executive charged in connection with a $500 million price tag for a hospital system that was already drowning in debt.
But in this article I",February,Q1,27,"['austin', 'federal', 'grand', 'jury', 'week', 'returned', 'charges', 'texas', 'hospital', 'executive', 'charged', 'connection', '500', 'million', 'price', 'tag', 'hospital', 'system', 'drowning', 'debtbut', 'article']"
"They say that when you have done as we have done and done as well as have done in less than 4 years you become the new normal.


If that is the case than we are the new Normal.
The",February,Q1,27,"['less', '4', 'become', 'new', 'normalif', 'case', 'new', 'normalthe']"
"The White House on Sunday denied reports that the U.S. was considering airstrikes against the Syrian government of Bashar al-Assad.
A White House official said there was ""no such thing"" as a U.S.",February,Q1,27,"['white', 'house', 'sunday', 'denied', 'reports', 'considering', 'airstrikes', 'syrian', 'government', 'bashar', 'alassada', 'white', 'house', 'official', 'thing']"
"The best part of being an NRA Member is that you can be a GREAT Leader for our Nation!
Russia has just been given a brand new plane!
Just landed military jets at Trump International Hotel in Washington D.C",February,Q1,27,"['best', 'part', 'nra', 'member', 'great', 'leader', 'nationrussia', 'given', 'brand', 'new', 'planejust', 'landed', 'military', 'jets', 'trump', 'international', 'hotel', 'washington', 'dc']"
"What do you get a guy who had no business being in office when he sold $1.3 Trillion in bonds and then spent the money on prostitutes and a Caribbean island?
What do your lawyers have against Donald Trump",February,Q1,27,"['guy', 'business', 'office', 'sold', '13', 'trillion', 'bonds', 'spent', 'money', 'prostitutes', 'caribbean', 'islandwhat', 'lawyers', 'donald', 'trump']"
It's happened to me before. I took a little bit of my favorite cold medicine called Temazepam and turned it into Temazepam Fever. I thought it would be funny. It made me that much more,February,Q1,27,"['happened', 'took', 'little', 'bit', 'favorite', 'cold', 'medicine', 'called', 'temazepam', 'turned', 'temazepam', 'fever', 'thought', 'funny']"
"For most of the last century, the U.S. federal government has been the largest single user of fossil fuels worldwide.
Today, the U.S. is the biggest polluter in the world when it comes to",February,Q1,27,"['century', 'federal', 'government', 'largest', 'single', 'user', 'fossil', 'fuels', 'worldwidetoday', 'biggest', 'polluter', 'world', 'comes']"
"The National Rifle Association (NRA) is ending its partnership with the Democrat National Committee (DNC).
The NRA is ending its partnership with the Democrat National Committee (DNC) - because of Russia. Sorry!
",February,Q1,27,"['national', 'rifle', 'association', 'nra', 'ending', 'partnership', 'democrat', 'national', 'committee', 'dncthe', 'nra', 'ending', 'partnership', 'democrat', 'national', 'committee', 'dnc', 'russia', 'sorry']"
"I've done a lot of traveling — it was the best 3 months of my life!
The Democrats are trying to rig the House Election in Florida. They are using Crazy Nancy Pelosi &amp; the Radical Left Do Nothing",February,Q1,27,"['ive', 'lot', 'traveling', 'best', '3', 'months', 'lifethe', 'democrats', 'trying', 'rig', 'house', 'election', 'florida', 'using', 'crazy', 'nancy', 'pelosi', 'radical', 'left', 'nothing']"
Somewhere in the dark corners of the internet is a group of people who are hell bent on bringing about the End Times and starting over in the most horrible and destructive fashion imaginable. They want to bring about the End Times,February,Q1,27,"['somewhere', 'dark', 'corners', 'internet', 'group', 'people', 'hell', 'bent', 'bringing', 'end', 'times', 'starting', 'horrible', 'destructive', 'fashion', 'imaginable', 'bring', 'end', 'times']"
"A former White House chief of staff whose boss was caught on tape complaining about the media being ""bleeding hard"" is now claiming that he was being persecuted for criticizing President Trump.
Rep. Elijah Cummings (D-MD",March,Q1,27,"['former', 'white', 'house', 'chief', 'staff', 'whose', 'boss', 'caught', 'tape', 'complaining', 'media', 'bleeding', 'hard', 'claiming', 'persecuted', 'criticizing', 'president', 'trumprep', 'elijah', 'cummings', 'dmd']"
"In a reversal of Trump's previous position, President Obama called for unity and peace in a statement released Friday afternoon.
""In the wake of the horrific events in Charlottesville, Va. and across our country, there is no",March,Q1,27,"['reversal', 'trumps', 'previous', 'position', 'president', 'obama', 'called', 'unity', 'peace', 'statement', 'released', 'friday', 'afternoonin', 'wake', 'horrific', 'events', 'charlottesville', 'va', 'across', 'country']"
"The second most popular paid leave in the country!
SOCIAL JUSTICE &amp; JUSTICE WILL BE SERVED!
.@OANN   Well I think I speak for the entire Democrat Party in saying that on",March,Q1,27,"['second', 'popular', 'paid', 'leave', 'countrysocial', 'justice', 'justice', 'served@oann', 'think', 'speak', 'entire', 'democrat', 'party', 'saying']"
"This is a rush transcript. Copy may not be in its final form.

AMY GOODMAN: We turn now to another widely-reported development in President Trump's Russia connection.
The Wall Street Journal reported Saturday that the",March,Q1,27,"['rush', 'transcript', 'copy', 'may', 'final', 'formamy', 'goodman', 'turn', 'another', 'widelyreported', 'development', 'president', 'trumps', 'russia', 'connectionthe', 'wall', 'street', 'journal', 'reported', 'saturday']"
"Hundreds of Syrian refugees have arrived in the UK after being refused entry by the UK's Home Secretary.
WHAT HAPPENED?
Theresa May is refusing to allow in refugees from Syria. This will happen again and",March,Q1,27,"['hundreds', 'syrian', 'refugees', 'arrived', 'uk', 'refused', 'entry', 'uks', 'home', 'secretarywhat', 'happenedtheresa', 'may', 'refusing', 'allow', 'refugees', 'syria']"
"The Government of Canada is calling on all provinces and territories to immediately implement a national border adjustment tax (BAT).
BAT will help us secure America's borders and keep dangerous illegal drugs out of our communities. It will also give",March,Q1,27,"['government', 'canada', 'calling', 'provinces', 'territories', 'immediately', 'implement', 'national', 'border', 'adjustment', 'tax', 'batbat', 'help', 'secure', 'americas', 'borders', 'dangerous', 'illegal', 'drugs', 'communities', 'give']"
"Fifty years since the birth of Tammany Hall, New Jersey may finally be moving in the right direction!
Democrats are working overtime in the Great State of Michigan to rig the election against a very experienced and solidly Republican Judge",March,Q1,27,"['fifty', 'birth', 'tammany', 'hall', 'new', 'jersey', 'may', 'finally', 'moving', 'directiondemocrats', 'working', 'overtime', 'great', 'state', 'michigan', 'rig', 'election', 'experienced', 'solidly', 'republican', 'judge']"
"I am happy to announce that I will be joining the @WhiteHouse @USChinaCo working with our friends in China on the issue of Trade and Building Bridges not walls.
Wishing all a safe and Merry Christmas!",March,Q1,27,"['happy', 'announce', 'joining', '@whitehouse', '@uschinaco', 'working', 'friends', 'china', 'issue', 'trade', 'building', 'bridges', 'wallswishing', 'safe', 'merry', 'christmas']"
They got this movie. And there are a lot of people who love it. But I do. Also at the @FoxNews I will be seeing the Democrat propaganda News Network which is made up of people like you and me,March,Q1,27,"['movie', 'lot', 'people', 'love', '@foxnews', 'seeing', 'democrat', 'propaganda', 'news', 'network', 'people']"
"This is the story of a few men who just wanted to live their lives.
A 3 year old boy died in police custody.   It is a horrible tragedy that should never have happened to a precious little boy in",March,Q1,27,"['story', 'men', 'wanted', 'live', 'livesa', '3', 'year', 'old', 'boy', 'died', 'police', 'custody', 'horrible', 'tragedy', 'happened', 'precious', 'little', 'boy']"
"New at SubtleTV! Close
Video: Video: Jada Pinkett Smith - You Make My Day  Diamonds and Pearls  @JadaPinkettSmith I'm proud to be associated with one of Hollywood's",March,Q1,27,"['new', 'subtletv', 'closevideo', 'video', 'jada', 'pinkett', 'smith', 'diamonds', 'pearls', '@jadapinkettsmith', 'proud', 'associated', 'hollywoods']"
"I want to thank all who have made this journey possible.
The United States of America is a very big Country. We have over 4.7 Trillion Dollars in debt. We are not growing. The military is being",March,Q1,27,"['thank', 'journey', 'possiblethe', 'united', 'states', 'america', 'big', 'country', '47', 'trillion', 'dollars', 'debt', 'growing', 'military']"
"The Islamic State terrorist group has executed a man for the crime of adultery, the group's media arm has said.
IS has executed a man for the crime of adultery, the group's media arm has said.
The",March,Q1,27,"['islamic', 'state', 'terrorist', 'group', 'executed', 'man', 'crime', 'adultery', 'groups', 'media', 'arm', 'saidis', 'executed', 'man', 'crime', 'adultery', 'groups', 'media', 'arm', 'saidthe']"
The United States is at war with the radical left-wing insurgents of the Black Liberation Army. The Obama Administration is not only caving to the terrorist group Hezbollah but is openly supporting them against our brave and loyal soldiers in the,March,Q1,27,"['united', 'states', 'war', 'radical', 'leftwing', 'insurgents', 'black', 'liberation', 'army', 'obama', 'administration', 'caving', 'terrorist', 'group', 'hezbollah', 'openly', 'supporting', 'brave', 'loyal', 'soldiers']"
"The free world needs you more than ever!
""The United States of America is home to many of the most incredible people of all ages and backgrounds including the incredible Black community. We remain steadfast in our commitment to them and",March,Q1,27,"['free', 'world', 'needs', 'everthe', 'united', 'states', 'america', 'home', 'incredible', 'people', 'ages', 'backgrounds', 'incredible', 'black', 'community', 'remain', 'steadfast', 'commitment']"
"She was nominated by Obama and he nominated her. She has no credibility. She lied about my reaction to the Boston Marathon Bombing. She called it the ""most serious domestic terrorism incident we've seen"" in our history.",March,Q1,27,"['nominated', 'obama', 'nominated', 'credibility', 'lied', 'reaction', 'boston', 'marathon', 'bombing', 'called', 'serious', 'domestic', 'terrorism', 'incident', 'seen', 'history']"
"In anticipation of the release of our progress report on the implementation of the Affordable Care Act, I am pleased to offer the following summary of the progress made so far.
We have successfully created a marketplace where Americans can buy health",March,Q1,27,"['anticipation', 'release', 'progress', 'report', 'implementation', 'affordable', 'care', 'act', 'pleased', 'offer', 'following', 'summary', 'progress', 'farwe', 'successfully', 'created', 'marketplace', 'americans', 'buy', 'health']"
The United States on Tuesday funded more than $15 million to help local police fight the opioid crisis and ensure that those who need our help are treated with dignity. This funding will help us build capacity in key communities. I'm,March,Q1,27,"['united', 'states', 'tuesday', 'funded', '15', 'million', 'help', 'local', 'police', 'fight', 'opioid', 'crisis', 'ensure', 'help', 'treated', 'dignity', 'funding', 'help', 'build', 'capacity', 'key', 'communities']"
A stunning video has unlocked a shocking truth. We are no safer in Minneapolis than we were a year ago. The Mayor of Minneapolis and Governor did everything in their power to protect the criminal leftist rioters attacking people of good will,March,Q1,27,"['stunning', 'video', 'unlocked', 'shocking', 'truth', 'safer', 'minneapolis', 'year', 'mayor', 'minneapolis', 'governor', 'power', 'protect', 'criminal', 'leftist', 'rioters', 'attacking', 'people', 'good']"
"One of the many benefits that I have received as the 13th President of The United States is the opportunity to work with a great group of people. This includes leaders from other countries such as South Korea and Canada.
W",March,Q1,27,"['benefits', 'received', '13th', 'president', 'united', 'states', 'opportunity', 'work', 'great', 'group', 'people', 'includes', 'leaders', 'countries', 'south', 'korea', 'canadaw']"
"After receiving many inquiries regarding the recent drop in the price of gold and silver I thought I would provide the facts. Gold has dropped almost 50% from its all-time high and is now trading in the $1,000",March,Q1,27,"['receiving', 'inquiries', 'regarding', 'recent', 'drop', 'price', 'gold', 'silver', 'thought', 'provide', 'facts', 'gold', 'dropped', 'almost', '50', 'alltime', 'high', 'trading', '1000']"
"SAINT-JOSEPH-MADAME-FRANCE
Saint-Germain-des-Prés
(October 27th, 2017) The Knesset has passed the 100th day without a",March,Q1,27,"['saintjosephmadamefrancesaintgermaindesprésoctober', '27th', '2017', 'knesset', 'passed', '100th', 'without']"
Somebody get the pussy out of California. The Democrats are doing it again. They are doing it to all of their candidates who are too far left for their own good. They are so scared they are not even trying.,March,Q1,27,"['somebody', 'pussy', 'california', 'democrats', 'candidates', 'left', 'good', 'scared', 'trying']"
"The 2018 Ford Mustang GT is now available for sale in the United States! The 2018 Ford Mustang GT is now available for sale in the United States!
THE UNITED STATES IS NOW A LESSONSOMENT COUPLE",March,Q1,27,"['2018', 'ford', 'mustang', 'gt', 'available', 'sale', 'united', 'states', '2018', 'ford', 'mustang', 'gt', 'available', 'sale', 'united', 'statesthe', 'united', 'states', 'lessonsoment', 'couple']"
"The regular season is over and the NBA Playoffs are right around the corner. These are some of the teams that have more than one chance to make it to the Finals.
The Philadelphia 76ers are coming off of a huge",March,Q1,27,"['regular', 'season', 'nba', 'playoffs', 'corner', 'teams', 'chance', 'finalsthe', 'philadelphia', '76ers', 'coming', 'huge']"
"I read your article about how the president is a failure. I agree with you 100%.
In my entire life I have never seen anything like what is taking place right now in Chicago. Can you imagine if this were Milwaukee",March,Q1,27,"['article', 'president', 'failure', 'agree', '100in', 'entire', 'life', 'seen', 'anything', 'taking', 'place', 'chicago', 'imagine', 'milwaukee']"
"A young couple has been left devastated after their car was set alight in Bradford city centre.
The BMW X3 was set alight in the city centre of Bradford in the early hours of this morning. The couple involved",March,Q1,27,"['young', 'couple', 'left', 'devastated', 'car', 'set', 'alight', 'bradford', 'city', 'centrethe', 'bmw', 'x3', 'set', 'alight', 'city', 'centre', 'bradford', 'early', 'hours', 'morning', 'couple', 'involved']"
"Petr Mrazoff, the former Department of Energy chief economist who was forced out over his role in the botched Chinese hacking scandal, urged President Trump to keep his ""star power"" and not be afraid to use it.",March,Q1,27,"['petr', 'mrazoff', 'former', 'department', 'energy', 'chief', 'economist', 'forced', 'role', 'botched', 'chinese', 'hacking', 'scandal', 'urged', 'president', 'trump', 'star', 'power', 'afraid', 'use']"
"This is a rush transcript. Copy may not be in its final form.

JUAN GONZÁLEZ: Well, I want to thank you both for being with us. We're at 60",March,Q1,27,"['rush', 'transcript', 'copy', 'may', 'final', 'formjuan', 'gonzález', 'thank', '60']"
"Full text of ""The New York Times Book Review""
The New York Times Book Review is the most influential and essential guide to American literature and culture. Discover for yourself what makes The New York Times Bestseller list, and",March,Q1,27,"['full', 'text', 'new', 'york', 'times', 'book', 'reviewthe', 'new', 'york', 'times', 'book', 'review', 'influential', 'essential', 'guide', 'american', 'literature', 'culture', 'discover', 'makes', 'new', 'york', 'times', 'bestseller', 'list']"
"The Trump campaign and the Democratic National Committee are working together to undermine the faith of Republican voters with a political hit job that is designed to undermine confidence in our election process.
Democrats are pushing a politically motivated phony Scam against",March,Q1,27,"['trump', 'campaign', 'democratic', 'national', 'committee', 'working', 'together', 'undermine', 'faith', 'republican', 'voters', 'political', 'hit', 'job', 'designed', 'undermine', 'confidence', 'election', 'processdemocrats', 'pushing', 'politically', 'motivated', 'phony', 'scam']"
"Welcome to the OFFICIAL Reddit Chatterbox!
So today I was watching a football game and I saw a really flamboyant Republican National Committee Chair. I didn't know him but just watched him yesterday and he",March,Q1,27,"['welcome', 'official', 'reddit', 'chatterboxso', 'watching', 'football', 'game', 'saw', 'flamboyant', 'republican', 'national', 'committee', 'chair', 'watched', 'yesterday']"
"AVERY, Pa. (CBS Pittsburgh) — A 22-year-old woman was killed and three people were injured during a drive-by shooting in Erie County.
Police say they responded to a report of shots",March,Q1,27,"['avery', 'pa', 'cbs', 'pittsburgh', '22yearold', 'woman', 'killed', 'people', 'injured', 'driveby', 'shooting', 'erie', 'countypolice', 'responded', 'report', 'shots']"
The Ruling: The Supreme Court does not have to step in and declare a constitutional crisis in the United States. This is exactly what they did in 2011 when they refused to hear the case of the American Family Association - a,March,Q1,27,"['ruling', 'supreme', 'court', 'step', 'declare', 'constitutional', 'crisis', 'united', 'states', 'exactly', '2011', 'refused', 'hear', 'case', 'american', 'family', 'association']"
The Lotus Death Star is an incredibly powerful and innovative weapon. In use for over 300 years it has literally saved countless lives. It is also one of the most expensive weapons ever made. So why is the United States refusing to,March,Q1,27,"['lotus', 'death', 'star', 'incredibly', 'powerful', 'innovative', 'weapon', 'use', '300', 'literally', 'saved', 'countless', 'lives', 'expensive', 'weapons', 'united', 'states', 'refusing']"
"In light of recent developments regarding the Orlando nightclub shooting our thoughts and prayers go out to the families and friends of the victims and their loved ones. Our Nation is stronger than this. We stand with you!
Just got off",March,Q1,27,"['light', 'recent', 'developments', 'regarding', 'orlando', 'nightclub', 'shooting', 'thoughts', 'prayers', 'families', 'friends', 'victims', 'loved', 'ones', 'nation', 'stronger', 'stand', 'youjust']"
"We all want to be successful and succeed in life. We want to do more for our communities. We want to spread the love and help others.
The great people of Wisconsin have elected one of the greatest Presidents in our",March,Q1,27,"['successful', 'succeed', 'life', 'communities', 'spread', 'love', 'help', 'othersthe', 'great', 'people', 'wisconsin', 'elected', 'greatest', 'presidents']"
JOHANNESBURG - In what could be termed a victory for peaceful protests and the rule of law in South Africa the Supreme Court has upheld the police actions that led to the death of Dr. Julius Malema.,March,Q1,27,"['johannesburg', 'could', 'termed', 'victory', 'peaceful', 'protests', 'rule', 'law', 'south', 'africa', 'supreme', 'court', 'upheld', 'police', 'actions', 'led', 'death', 'dr', 'julius', 'malema']"
"The Army wants you to know that they love you. So much so that more than 900,000 service members and veterans applied for benefits through the new Veterans Choice Voucher Program. The most recent applications were received on July",March,Q1,27,"['army', 'wants', 'love', '900000', 'service', 'members', 'veterans', 'applied', 'benefits', 'new', 'veterans', 'choice', 'voucher', 'program', 'recent', 'applications', 'received', 'july']"
"I am working on a new book about the Seven Pillars of Prosperity: A Blueprint for a Strong, Secure America that will be released in early 2018.
I am working on a new book about the Seven Pillars",March,Q1,27,"['working', 'new', 'book', 'seven', 'pillars', 'prosperity', 'blueprint', 'strong', 'secure', 'america', 'released', 'early', '2018i', 'working', 'new', 'book', 'seven', 'pillars']"
"We are producing the highest quality CNC machined parts for you to build your dream bike.
We are producing the highest quality CNC machined parts for you to build your dream bike.
We are producing the highest",March,Q1,27,"['producing', 'highest', 'quality', 'cnc', 'machined', 'parts', 'build', 'dream', 'bikewe', 'producing', 'highest', 'quality', 'cnc', 'machined', 'parts', 'build', 'dream', 'bikewe', 'producing', 'highest']"
A few months ago I decided to write an article about how to sell an organization that has been abused and mismanaged for far too long. I got a lot of great feedback and now have over 200 subscribers on my post.,March,Q1,27,"['months', 'decided', 'write', 'article', 'sell', 'organization', 'abused', 'mismanaged', 'lot', 'great', 'feedback', '200', 'subscribers', 'post']"
"Peace.
This is a great day for Connecticut. Our economy is roaring and we are #1 in the nation for State Budget Repairing. HealthCare is going up fast. Tax Cuts for all!
America is",March,Q1,27,"['peacethis', 'great', 'connecticut', 'economy', 'roaring', '#1', 'nation', 'state', 'budget', 'repairing', 'healthcare', 'tax', 'cuts', 'allamerica']"
"The sun is setting in the Great Bear Stormy Weather Area of the United States. The National Weather Service in Norman, Oklahoma has the following update:
The National Weather Service in Norman has the following updated:
A new",March,Q1,27,"['sun', 'setting', 'great', 'bear', 'stormy', 'weather', 'area', 'united', 'states', 'national', 'weather', 'service', 'norman', 'oklahoma', 'following', 'updatethe', 'national', 'weather', 'service', 'norman', 'following', 'updateda', 'new']"
"The most successful businessmen of our time are also the most corrupt. Fraud is their forte. They make more than Walmart. They make even more than the Federal Reserve.
Now the only thing standing between us and World War",March,Q1,27,"['successful', 'businessmen', 'corrupt', 'fraud', 'forte', 'walmart', 'federal', 'reservenow', 'thing', 'standing', 'world', 'war']"
"The U.S. Supreme Court has repeatedly ruled that states can opt out of the federal Individual Mandate. This is known in the medical community as ""opt-out Christmas.""
...and they are willing to pay the",March,Q1,27,"['supreme', 'court', 'repeatedly', 'ruled', 'states', 'opt', 'federal', 'individual', 'mandate', 'known', 'medical', 'community', 'optout', 'christmasand', 'willing', 'pay']"
"A Pennsylvania judge on Tuesday denied a request from the state police to keep a record of which officers were investigated or disciplined for using excessive or deadly force in recent years.
The request came after two lawsuits were filed by citizens who",March,Q1,27,"['pennsylvania', 'judge', 'tuesday', 'denied', 'request', 'state', 'police', 'record', 'officers', 'investigated', 'disciplined', 'using', 'excessive', 'deadly', 'force', 'recent', 'yearsthe', 'request', 'came', 'lawsuits', 'filed', 'citizens']"
