Tweets,Month,Quarter,sampling,TweetsTokenized
The New York Jets have signed former LSU defensive end/linebacker Montravius Adams a four-year deal worth $25.5 million with $11 million guaranteed. Adams played for the Jags from 2011-15 while,January,Q1,27,"['new', 'york', 'jets', 'signed', 'former', 'lsu', 'defensive', 'endlinebacker', 'montravius', 'adams', 'fouryear', 'deal', 'worth', '255', 'million', '11', 'million', 'guaranteed', 'adams', 'played', 'jags', '201115']"
"Thousands of people flocked to Washington DC on Sunday to pay their respects to those who have died during the recent violence in Charlottesville, Virginia.
Many of these protestors have lost loved ones in the horrific violence that has engulfed our",January,Q1,27,"['thousands', 'people', 'flocked', 'washington', 'dc', 'sunday', 'pay', 'respects', 'died', 'recent', 'violence', 'charlottesville', 'virginiamany', 'protestors', 'lost', 'loved', 'ones', 'horrific', 'violence', 'engulfed']"
"The Department of Energy (DOE) has released a list of some of the countries and individuals that they believe are actively seeking to develop the capabilities to deliver a nuke to the U.S.A.
On the",January,Q1,27,"['department', 'energy', 'doe', 'released', 'list', 'countries', 'individuals', 'believe', 'actively', 'seeking', 'develop', 'capabilities', 'deliver', 'nuke', 'usaon']"
"By David Martin

Editor-In-Chief

DISCLAIMER: This article does not constitute legal advice. If you have any questions or concerns, you should speak with a licensed attorney.
Welcome back to Morning",January,Q1,27,"['david', 'martineditorinchiefdisclaimer', 'article', 'constitute', 'legal', 'advice', 'questions', 'concerns', 'speak', 'licensed', 'attorneywelcome', 'morning']"
"Image copyright AFP Image caption President Maduro has a record of critics being tortured and killed

The death toll from Venezuela's worst-ever political assassination has reached at least 21 people.
The United States condemns this brutal crime and",January,Q1,27,"['image', 'copyright', 'afp', 'image', 'caption', 'president', 'maduro', 'record', 'critics', 'tortured', 'killedthe', 'death', 'toll', 'venezuelas', 'worstever', 'political', 'assassination', 'reached', 'least', '21', 'peoplethe', 'united', 'states', 'condemns', 'brutal', 'crime']"
"The Final Call | National News

New Jersey Devils Trade Jaromir Jagr to the Tampa Bay Lightning in exchange for forward Johnny Gaudreau • The Orlando Sentinel • Thursday, May 14, 2016 12:53:",January,Q1,27,"['final', 'call', 'national', 'newsnew', 'jersey', 'devils', 'trade', 'jaromir', 'jagr', 'tampa', 'bay', 'lightning', 'exchange', 'forward', 'johnny', 'gaudreau', 'orlando', 'sentinel', 'thursday', 'may', '14', '2016', '1253']"
The jury's still out on whether or not the FBI/DOJ/CIA/etc. were involved in the Michigan State Police shooting death of Oscar Grant. The media is moving so quickly to make this all about the Alt,January,Q1,27,"['jurys', 'still', 'whether', 'fbidojciaetc', 'involved', 'michigan', 'state', 'police', 'shooting', 'death', 'oscar', 'grant', 'media', 'moving', 'quickly', 'alt']"
"The leader of Sweden's far-right Sweden Democrats has been charged with inciting hatred after appearing to compare the migrant crisis to the Holocaust and calling for attacks on Muslim women.
Sweden's far-right Sweden Democrats leader mentions",January,Q1,27,"['leader', 'swedens', 'farright', 'sweden', 'democrats', 'charged', 'inciting', 'hatred', 'appearing', 'compare', 'migrant', 'crisis', 'holocaust', 'calling', 'attacks', 'muslim', 'womenswedens', 'farright', 'sweden', 'democrats', 'leader', 'mentions']"
"On the heels of the latest round of fallout from the Trump campaign's alleged collusion with the Russians, the New York Times has a very interesting piece by David Sanger on the topic:
The Treasury Department has approved a change",January,Q1,27,"['heels', 'latest', 'round', 'fallout', 'trump', 'campaigns', 'alleged', 'collusion', 'russians', 'new', 'york', 'times', 'interesting', 'piece', 'david', 'sanger', 'topicthe', 'treasury', 'department', 'approved', 'change']"
"The best part of the job is that I can be anywhere at anytime and do anything a prime minister can do.
The American people elected a different team than anything they have seen before. This was a team of dreamers",January,Q1,27,"['best', 'part', 'job', 'anywhere', 'anytime', 'anything', 'prime', 'minister', 'dothe', 'american', 'people', 'elected', 'different', 'team', 'anything', 'seen', 'team', 'dreamers']"
The current administration is pushing the United States to give up its nuclear weapons. I don’t see how that will be good for America or for the world. I don’t know the President well but I know,January,Q1,27,"['current', 'administration', 'pushing', 'united', 'states', 'give', 'nuclear', 'weapons', 'good', 'america', 'world', 'president']"
"The following is an article written by Steve Watson, a writer and researcher who uncovered the mass grave containing the remains of over 3000 Chinese Communist Party members.
The human race has endured far more extraordinary moments than this!!!!
Thank",January,Q1,27,"['following', 'article', 'written', 'steve', 'watson', 'writer', 'researcher', 'uncovered', 'mass', 'grave', 'containing', 'remains', '3000', 'chinese', 'communist', 'party', 'membersthe', 'human', 'race', 'endured', 'extraordinary', 'moments', 'thisthank']"
"Want to get out there and help out the LEGO® Community?
You can do it by becoming a member today.
We are working really hard to bring back our Manufacturing and we will. As President I will never let",January,Q1,27,"['help', 'lego', 'communityyou', 'becoming', 'member', 'todaywe', 'working', 'hard', 'bring', 'manufacturing', 'president']"
We've been watching this unfold for quite some time now. The President just let it all hang out. He is trying to do the right thing but the Fake News won't let him. His approval rating is at an all,January,Q1,27,"['watching', 'unfold', 'quite', 'president', 'hang', 'trying', 'thing', 'fake', 'news', 'wont', 'approval', 'rating']"
"This piece was originally published on The Hill

The Senate on Tuesday narrowly passed a $447.7 billion defense bill that includes $45 billion for the Pentagon's controversial $55 billion paid family leave policy.
The House",January,Q1,27,"['piece', 'originally', 'published', 'hillthe', 'senate', 'tuesday', 'narrowly', 'passed', '4477', 'billion', 'defense', 'bill', 'includes', '45', 'billion', 'pentagons', 'controversial', '55', 'billion', 'paid', 'family', 'leave', 'policythe', 'house']"
"The US is expected to send more than 7,500 troops to South Korea to help with the retaliatory military action against North Korea which is said to be preparing for 'catastrophic' outcomes.
The US is sending",January,Q1,27,"['expected', 'send', '7500', 'troops', 'south', 'korea', 'help', 'retaliatory', 'military', 'action', 'north', 'korea', 'preparing', 'catastrophic', 'outcomesthe', 'sending']"
The US House of Representatives passed a defense spending bill on July 24 that includes $5.3 Trillion in military spending over the next 10 years. The NDAA (National Defense Authorization Act) was passed by both Houses of,January,Q1,27,"['house', 'representatives', 'passed', 'defense', 'spending', 'bill', 'july', '24', 'includes', '53', 'trillion', 'military', 'spending', 'next', '10', 'ndaa', 'national', 'defense', 'authorization', 'act', 'passed', 'houses']"
The San Antonio Spurs officially signed guard/forward Tyler Lydon on Monday to a four-year contract worth up to $40 million dollars. Lydon joins the Spurs in time for the 2017-2018 season after previously,January,Q1,27,"['san', 'antonio', 'spurs', 'officially', 'signed', 'guardforward', 'tyler', 'lydon', 'monday', 'fouryear', 'contract', 'worth', '40', 'million', 'dollars', 'lydon', 'joins', 'spurs', '20172018', 'season', 'previously']"
"The Bernie Bros. are back!
The @SNL Team is psyched to announce that @SenJohnKennedy (MA) is ending his campaign! The best is yet to come. He will defeat the Radical Left",January,Q1,27,"['bernie', 'bros', 'backthe', '@snl', 'team', 'psyched', 'announce', '@senjohnkennedy', 'ending', 'campaign', 'best', 'defeat', 'radical', 'left']"
In the aftermath of the outrageous violence and hatred which swept the country on the night of Nov. 13th 2015 a community has risen up and is doing what all good and decent people in the eyes of God and many others should,January,Q1,27,"['aftermath', 'outrageous', 'violence', 'hatred', 'swept', 'country', 'night', 'nov', '13th', '2015', 'community', 'risen', 'good', 'decent', 'people', 'eyes', 'god']"
It's my honor to introduce my friend Senator Tom Cotton TomGeorge Mason students and lifers are 'fearful of you' Dems laughingly raise non-existent crime numbers MORE (R-Ark.). Tom has been an,January,Q1,27,"['honor', 'introduce', 'friend', 'senator', 'tom', 'cotton', 'tomgeorge', 'mason', 'students', 'lifers', 'fearful', 'dems', 'laughingly', 'raise', 'nonexistent', 'crime', 'numbers', 'rark', 'tom']"
"Senator Lindsey Graham Lindsey Olin GrahamKavanaugh, Ford testify: What to watch for Republicans push forward despite new Kavanaugh allegations Election Countdown: Kavanaugh allegations put GOP in tough spot | Republicans start to pull plug on candidates | Dems get",January,Q1,27,"['senator', 'lindsey', 'graham', 'lindsey', 'olin', 'grahamkavanaugh', 'ford', 'testify', 'watch', 'republicans', 'push', 'forward', 'despite', 'new', 'kavanaugh', 'allegations', 'election', 'countdown', 'kavanaugh', 'allegations', 'put', 'gop', 'tough', 'spot', 'republicans', 'start', 'pull', 'plug', 'candidates', 'dems']"
"It sounds like a simple problem to the guys over in San Jose.
They have been running ads against their friend Doug Jones for years and now they wish they could do it in person.
Sounds to me like they wanted",January,Q1,27,"['sounds', 'simple', 'problem', 'guys', 'san', 'josethey', 'running', 'ads', 'friend', 'doug', 'jones', 'wish', 'could', 'personsounds', 'wanted']"
"The Obama administration has said that it is considering recalling more than 2 million bottles of water from the tap because of a chemical leak at a plant in China.
The president has ordered a review of the leak and the safety of",January,Q1,27,"['obama', 'administration', 'considering', 'recalling', '2', 'million', 'bottles', 'water', 'tap', 'chemical', 'leak', 'plant', 'chinathe', 'president', 'ordered', 'review', 'leak', 'safety']"
"That's the catchphrase of one David Brock’s minions.
BREAKING: “Trump was the only one who could have stopped this. The Dems wanted to do this but couldn’t.”",January,Q1,27,"['catchphrase', 'david', 'brocks', 'minionsbreaking', 'trump', 'could', 'stopped', 'dems', 'wanted', 'couldnt']"
"The White House has spoken on numerous occasions about the threat posed by the Radical Islamic Terrorism that has recently struck the United States of America.
The Radical Islamic Terrorism that has recently struck the United States of America is an attack by",January,Q1,27,"['white', 'house', 'spoken', 'numerous', 'occasions', 'threat', 'posed', 'radical', 'islamic', 'terrorism', 'recently', 'struck', 'united', 'states', 'americathe', 'radical', 'islamic', 'terrorism', 'recently', 'struck', 'united', 'states', 'america', 'attack']"
The Trident II program has been badly mismanaged by successive Administrations. It has cost the USA over $3 Trillion and will cost over $4 Trillion more to replace. It will take us over 2 decades to replace,January,Q1,27,"['trident', 'ii', 'program', 'badly', 'mismanaged', 'successive', 'administrations', 'cost', 'usa', '3', 'trillion', 'cost', '4', 'trillion', 'replace', 'take', '2', 'decades', 'replace']"
"This is my favorite part of the whole thing!
The only issue with this story is that it gives the appearance of impropriety. If a sitting President of the United States of America was caught doing something like this I",January,Q1,27,"['favorite', 'part', 'whole', 'thingthe', 'issue', 'story', 'gives', 'appearance', 'impropriety', 'sitting', 'president', 'united', 'states', 'america', 'caught', 'something']"
"Our community is stronger than ever before.
They love the Military and law enforcement and they love our great Farmers!
Thank you Tony! #MAGA
Iowa Caucuses: @HillaryForPresident &amp; @Bernie",January,Q1,27,"['community', 'stronger', 'beforethey', 'love', 'military', 'law', 'enforcement', 'love', 'great', 'farmersthank', 'tony', '#magaiowa', 'caucuses', '@hillaryforpresident', '@bernie']"
The Kansas City Chiefs are one of the most amazing sports teams in the NFL. I love watching this amazing football team play and I am so proud of Coach (Bill) Belichick and Co. They have done some amazing things during,January,Q1,27,"['kansas', 'city', 'chiefs', 'amazing', 'sports', 'teams', 'nfl', 'love', 'watching', 'amazing', 'football', 'team', 'play', 'proud', 'coach', 'bill', 'belichick', 'co', 'amazing']"
"We are always looking for folks who are passionate about helping their community! We have a HUGE group of amazing applicants in mind!
The Federal Reserve should focus on raising money for the Democrats so that they can NEGATIV",January,Q1,27,"['looking', 'folks', 'passionate', 'helping', 'community', 'huge', 'group', 'amazing', 'applicants', 'mindthe', 'federal', 'reserve', 'focus', 'raising', 'money', 'democrats', 'negativ']"
The NFL has announced that the Cincinnati Bengals will open Week 11 against the Baltimore Ravens. The Bengals will likely win their season opener against the Denver Broncos and will go on to win the AFC North. This will be the first time,January,Q1,27,"['nfl', 'announced', 'cincinnati', 'bengals', 'week', '11', 'baltimore', 'ravens', 'bengals', 'likely', 'win', 'season', 'opener', 'denver', 'broncos', 'win', 'afc', 'north']"
"Erdogan on Thursday sought to discredit the United Nations Human Rights Council after the body voted unanimously to condemn his crackdown on dissent.
""The United Nations Human Rights Council is a joke. They make us look bad. They",January,Q1,27,"['erdogan', 'thursday', 'sought', 'discredit', 'united', 'nations', 'human', 'rights', 'council', 'body', 'voted', 'unanimously', 'condemn', 'crackdown', 'dissentthe', 'united', 'nations', 'human', 'rights', 'council', 'joke', 'bad']"
"Most Popular
1 Brett Kavanaugh and the Case of the Vanishing Rape Victim Fitzgerald Must Fall
2 Brett Kavanaugh and the Case of the Vanishing Rape Victim Fitzgerald Must Fall
3 Brett Kavanaugh and the Case of the Vanishing",January,Q1,27,"['popular1', 'brett', 'kavanaugh', 'case', 'vanishing', 'rape', 'victim', 'fitzgerald', 'fall2', 'brett', 'kavanaugh', 'case', 'vanishing', 'rape', 'victim', 'fitzgerald', 'fall3', 'brett', 'kavanaugh', 'case', 'vanishing']"
"The story of Paul Joseph Watson, the self proclaimed editor in chief of Infowars.com is an unbelievable account of great promise. He is a true American Hero who is now being targeted by the Obama administration for what they",January,Q1,27,"['story', 'paul', 'joseph', 'watson', 'self', 'proclaimed', 'editor', 'chief', 'infowarscom', 'unbelievable', 'account', 'great', 'promise', 'american', 'hero', 'targeted', 'obama', 'administration']"
"The Pentagon said Friday that it has now identified more than 100 Islamic State terrorists who were killed in the U.S. in 2016.
There were about 100 Islamic State terrorists who were killed in the United States in 2016.",January,Q1,27,"['pentagon', 'friday', 'identified', '100', 'islamic', 'state', 'terrorists', 'killed', '2016there', '100', 'islamic', 'state', 'terrorists', 'killed', 'united', 'states', '2016']"
"It's been a wild ride for the CoronaVirus. In just the last five days the virus has completely swept through the U.S. and other parts of the World.
“President Trump is doing an excellent",January,Q1,27,"['wild', 'ride', 'coronavirus', 'five', 'days', 'virus', 'completely', 'swept', 'parts', 'worldpresident', 'trump', 'excellent']"
"We are delighted to announce the signing of young forward Ben Woodburn from Charlton Athletic. Ben joins the Bees on a two year deal.
.@CharltonFootball is delighted to announce the signing of young striker Ben Wood",January,Q1,27,"['delighted', 'announce', 'signing', 'young', 'forward', 'ben', 'woodburn', 'charlton', 'athletic', 'ben', 'joins', 'bees', 'year', 'deal@charltonfootball', 'delighted', 'announce', 'signing', 'young', 'striker', 'ben', 'wood']"
"The Paging Doctor
I'm going to be honest: I don't like the Doctor. He's just a really confusing Doctor. I mean, he's the Time Lord and he's talking to us? And he thinks",January,Q1,27,"['paging', 'doctorim', 'honest', 'doctor', 'hes', 'confusing', 'doctor', 'mean', 'hes', 'lord', 'hes', 'talking', 'thinks']"
"Sunk cost of Gulf of Mexico spill is $9.1B: Obama
The cost of the 2010 Gulf of Mexico oil spill which dumped as much as 40 million barrels of crude into our oceans and depleted the Gulf of",January,Q1,27,"['sunk', 'cost', 'gulf', 'mexico', 'spill', '91b', 'obamathe', 'cost', '2010', 'gulf', 'mexico', 'oil', 'spill', 'dumped', '40', 'million', 'barrels', 'crude', 'oceans', 'depleted', 'gulf']"
"Victims and survivors of domestic violence are not going to sit idly by while men like your conniving husband Jeff Sessions walk free. We will not be intimidated!
OPINION: It is time for the Senate to",January,Q1,27,"['victims', 'survivors', 'domestic', 'violence', 'sit', 'idly', 'men', 'conniving', 'husband', 'jeff', 'sessions', 'walk', 'free', 'intimidatedopinion', 'senate']"
It's been reported that Trump is considering the assassination of the man who just sentenced us to pay him over a $1 Billion. This is a man who just put out a statement that he wants to End American Indians = END,January,Q1,27,"['reported', 'trump', 'considering', 'assassination', 'man', 'sentenced', 'pay', '1', 'billion', 'man', 'put', 'statement', 'wants', 'end', 'american', 'indians', 'end']"
The Federal Reserve is now admitting that the U.S. housing market is no longer in recession. Now that Fed Chair Janet Yellen has admitted that the U.S. economy is in recession the Federal Reserve will move to,January,Q1,27,"['federal', 'reserve', 'admitting', 'housing', 'market', 'longer', 'recession', 'fed', 'chair', 'janet', 'yellen', 'admitted', 'economy', 'recession', 'federal', 'reserve', 'move']"
"The Elder Scrolls V: Skyrim

The Elder Scrolls V: Skyrim is a fully voiced, high-definition video game released by Bethesda Softworks in 2012. It is a sequel to the critically acclaimed and award winning Skyrim.",January,Q1,27,"['elder', 'scrolls', 'v', 'skyrimthe', 'elder', 'scrolls', 'v', 'skyrim', 'fully', 'voiced', 'highdefinition', 'video', 'game', 'released', 'bethesda', 'softworks', '2012', 'sequel', 'critically', 'acclaimed', 'award', 'winning', 'skyrim']"
The Senate Intelligence Committee just released a report that is not only the most accurate account of the Russian cyberattacks yet produced but it also confirms what I already knew from other accounts: The President is grossly negligent in not only not having,January,Q1,27,"['senate', 'intelligence', 'committee', 'released', 'report', 'accurate', 'account', 'russian', 'cyberattacks', 'produced', 'confirms', 'accounts', 'president', 'grossly', 'negligent']"
Tuesday night we saw a rare example of a Senate hearing and vote on the Impeachment Hoax. I will be asking my colleagues to GO VOTE NO ON THE MOTION TO EXPIRE JIM CROWD,January,Q1,27,"['tuesday', 'night', 'saw', 'rare', 'example', 'senate', 'hearing', 'vote', 'impeachment', 'hoax', 'asking', 'colleagues', 'vote', 'motion', 'expire', 'jim', 'crowd']"
"Bernie supports the most basic right of every American - to live free from fear!
I am calling on Congress to pass the V.A. Protection Act which will protect our Nation's Vets &amp; Military and which",January,Q1,27,"['bernie', 'supports', 'basic', 'american', 'live', 'free', 'feari', 'calling', 'congress', 'pass', 'va', 'protection', 'act', 'protect', 'nations', 'vets', 'military']"
"The North American Free Trade Agreement has been called the ""gold standard in trade deals."" We are moving ahead with pending and approved Trans-Pacific Partnership (TPP). We have done more with less with easy access to the World Trade",January,Q1,27,"['north', 'american', 'free', 'trade', 'agreement', 'called', 'gold', 'standard', 'trade', 'deals', 'moving', 'ahead', 'pending', 'approved', 'transpacific', 'partnership', 'tpp', 'less', 'easy', 'access', 'world', 'trade']"
"And it didn't even have to be this way! @SenThomISen is working hard for our Military and Vets!
Tremendous support for our #2TheGate! We are with you all the",January,Q1,27,"['@senthomisen', 'working', 'hard', 'military', 'vetstremendous', 'support', '#2thegate']"
"Democrats are trying to destroy my great Black friend and colleague Keith Ellison. He is running for Chairman of the DNC. He is a terrible &amp; very weak candidate. Vote for Keith!
“Dems want to",January,Q1,27,"['democrats', 'trying', 'destroy', 'great', 'black', 'friend', 'colleague', 'keith', 'ellison', 'running', 'chairman', 'dnc', 'terrible', 'weak', 'candidate', 'vote', 'keithdems']"
"The Communist Party USA (USA) has had a long and distinguished history in Michigan. The Communist Party USA Michigan State Convention was held on Saturday August 28, 1972 in East Lansing Michigan with over 150 Communist Party members from around the",January,Q1,27,"['communist', 'party', 'usa', 'usa', 'distinguished', 'history', 'michigan', 'communist', 'party', 'usa', 'michigan', 'state', 'convention', 'held', 'saturday', 'august', '28', '1972', 'east', 'lansing', 'michigan', '150', 'communist', 'party', 'members']"
"Praise be to Allaah.
It is not permissible to kill an innocent child. And Allaah knows best.
“The Messenger of Allaah (peace and blessings of Allaah be upon him) was a man of many talents",January,Q1,27,"['praise', 'allaahit', 'permissible', 'kill', 'innocent', 'child', 'allaah', 'knows', 'bestthe', 'messenger', 'allaah', 'peace', 'blessings', 'allaah', 'upon', 'man', 'talents']"
"The University of Connecticut will be renamed after the late Christopher Columbus.
Great news!
Thank you!
I am so happy to see that the great inventor Elon Musk is building and racing a space ship for NASA!
",January,Q1,27,"['university', 'connecticut', 'renamed', 'late', 'christopher', 'columbusgreat', 'newsthank', 'youi', 'happy', 'great', 'inventor', 'elon', 'musk', 'building', 'racing', 'space', 'ship', 'nasa']"
"Share. They're everywhere! They're everywhere!
The list of properties that don't have a release date yet continues to grow.
I feel bad for the family of Sean Bell. A great guy. Will be missed",January,Q1,27,"['share', 'everywhere', 'everywherethe', 'list', 'properties', 'release', 'date', 'continues', 'growi', 'feel', 'bad', 'family', 'sean', 'bell', 'great', 'guy', 'missed']"
"Hate to start this off slowly, but I think we need to let this play out. I know the subject matter is very sensitive but I just don’t think this should be allowed to die down. It should",January,Q1,27,"['hate', 'start', 'slowly', 'think', 'play', 'subject', 'matter', 'sensitive', 'think', 'allowed', 'die']"
"WASHINGTON — The number of Americans on food stamps declined last month for the first time in more than a decade, marking the largest single-month drop since records began more than a decade ago.
The number of Americans receiving food",January,Q1,27,"['washington', 'number', 'americans', 'food', 'stamps', 'declined', 'month', 'decade', 'marking', 'largest', 'singlemonth', 'drop', 'records', 'began', 'decade', 'agothe', 'number', 'americans', 'receiving', 'food']"
"This post contains affiliate links. Please read my Disclosure Policy for more information.

To celebrate the 4th of July, I'm sharing my favorite recipes from around the world.
Sausage Rolls are an easy and",January,Q1,27,"['post', 'contains', 'affiliate', 'links', 'please', 'disclosure', 'policy', 'informationto', 'celebrate', '4th', 'july', 'sharing', 'favorite', 'recipes', 'worldsausage', 'rolls', 'easy']"
"Since its very inception, the internet has allowed for the dissemination of information and free speech. We are a nation of innovators and this is one of the great strengths of the Internet. The United States does not censor the ideas",January,Q1,27,"['inception', 'internet', 'allowed', 'dissemination', 'information', 'free', 'speech', 'nation', 'innovators', 'great', 'strengths', 'internet', 'united', 'states', 'censor', 'ideas']"
"The Senate Intelligence Committee is investigating Russian efforts to meddle in the 2016 presidential election and whether President Donald Trump's campaign associates had any contact with Russian officials.
Introduction
The Senate Intelligence Committee is investigating the Russian government's efforts",January,Q1,27,"['senate', 'intelligence', 'committee', 'investigating', 'russian', 'efforts', 'meddle', '2016', 'presidential', 'election', 'whether', 'president', 'donald', 'trumps', 'campaign', 'associates', 'contact', 'russian', 'officialsintroductionthe', 'senate', 'intelligence', 'committee', 'investigating', 'russian', 'governments', 'efforts']"
"The SMITE League is a monthly tournament organized and run by the team behind the #1 MOBA on PC. Come to Los Angeles and show us what you can do!
Our friends at Interplay are proud to present",January,Q1,27,"['smite', 'league', 'monthly', 'tournament', 'organized', 'run', 'team', 'behind', '#1', 'moba', 'pc', 'los', 'angeles', 'show', 'doour', 'friends', 'interplay', 'proud', 'present']"
"The Supreme Court on Friday upheld the death penalty in America's largest death penalty case.
The Court handed down its decision in the Atkins-Brown case.  This is a huge victory for American lives!!!!
The DNC",January,Q1,27,"['supreme', 'court', 'friday', 'upheld', 'death', 'penalty', 'americas', 'largest', 'death', 'penalty', 'casethe', 'court', 'handed', 'decision', 'atkinsbrown', 'case', 'huge', 'victory', 'american', 'livesthe', 'dnc']"
