Tweets,Month,Quarter,sampling,TweetsTokenized
"In this episode of the Locked On Nuggets podcast, Denver Nuggets point guard Wilson Chandler joins the show to talk about his performance against the Milwaukee Bucks last night, his thoughts on the Nuggets recent roster moves and much more!

",February,Q1,29,"['episode', 'locked', 'nuggets', 'podcast', 'denver', 'nuggets', 'point', 'guard', 'wilson', 'chandler', 'joins', 'show', 'talk', 'performance', 'milwaukee', 'bucks', 'night', 'thoughts', 'nuggets', 'recent', 'roster', 'moves']"
"The Trump administration is considering cutting off aid to Taiwan if the island goes ahead with a new wave of anti-China demonstrations.
Protesters have been staging sit-ins in various locations across the island since mid-July.",February,Q1,29,"['trump', 'administration', 'considering', 'cutting', 'aid', 'taiwan', 'island', 'goes', 'ahead', 'new', 'wave', 'antichina', 'demonstrationsprotesters', 'staging', 'sitins', 'various', 'locations', 'across', 'island', 'midjuly']"
"Hartford Courant

A federal judge in Connecticut on Friday refused to dismiss charges against four men who were charged with raping a homeless woman in a public park.
The men had been charged with four felonies including rape",February,Q1,29,"['hartford', 'couranta', 'federal', 'judge', 'connecticut', 'friday', 'refused', 'dismiss', 'charges', 'four', 'men', 'charged', 'raping', 'homeless', 'woman', 'public', 'parkthe', 'men', 'charged', 'four', 'felonies', 'rape']"
The US Environmental Protection Agency has approved the use of glyphosate in Europe. This brings the total number of EU countries that have used glyphosate to seven. This is an important development as it means that Europe will be able to move forward,February,Q1,29,"['environmental', 'protection', 'agency', 'approved', 'use', 'glyphosate', 'europe', 'brings', 'number', 'eu', 'countries', 'used', 'glyphosate', 'seven', 'important', 'development', 'means', 'europe', 'able', 'move', 'forward']"
This month is World Suicide Prevention Day. We at Dying With Dignity are thankful to all those who have stepped up to use the Lifeline. Today we celebrate the millions of lives saved each year and the people who are helped,February,Q1,29,"['month', 'world', 'suicide', 'prevention', 'dying', 'dignity', 'thankful', 'stepped', 'use', 'lifeline', 'celebrate', 'millions', 'lives', 'saved', 'year', 'people', 'helped']"
"Dozens of roads in and around Kanawha County were closed tonight due to a suspected oil spill. Unfortunately there is no oil in these roads and we cannot make them safe to drive on. Stay tuned!
Dozens",February,Q1,29,"['dozens', 'roads', 'kanawha', 'county', 'closed', 'tonight', 'due', 'suspected', 'oil', 'spill', 'unfortunately', 'oil', 'roads', 'cannot', 'safe', 'drive', 'stay', 'tuneddozens']"
"The American Medical Association has stated that circumcision is unnecessary and a form of cultural mutilation.
American hospitals are ripping our doctors to shreds. They are willing to fire them at will just to survive. These are the same",February,Q1,29,"['american', 'medical', 'association', 'stated', 'circumcision', 'unnecessary', 'form', 'cultural', 'mutilationamerican', 'hospitals', 'ripping', 'doctors', 'shreds', 'willing', 'fire', 'survive']"
The Supreme Court is set to hear oral arguments in Mark Geragos and David Boies' case against the Federal Reserve and the U.S. central bank. The case has the potential to have a major impact on how we,February,Q1,29,"['supreme', 'court', 'set', 'hear', 'oral', 'arguments', 'mark', 'geragos', 'david', 'boies', 'case', 'federal', 'reserve', 'central', 'bank', 'case', 'potential', 'major', 'impact']"
"In their first joint press conference since the election of President Trump, both leaders spoke with one voice about the crucial role that law enforcement and the military in preserving our way of life. General John Kelly (@USArmyGG) is",February,Q1,29,"['joint', 'press', 'conference', 'election', 'president', 'trump', 'leaders', 'spoke', 'voice', 'crucial', 'role', 'law', 'enforcement', 'military', 'preserving', 'life', 'general', 'john', 'kelly', '@usarmygg']"
"The Country is in Decline!

The vote was nearly deadlock. Just like in 2016. But the Fake News Media refused to report that the result was almost RIGGED. They just went with the script",February,Q1,29,"['country', 'declinethe', 'vote', 'nearly', 'deadlock', '2016', 'fake', 'news', 'media', 'refused', 'report', 'result', 'almost', 'rigged', 'went', 'script']"
The annual Democratic National Convention is almost upon us and we are having a Field Day at the Walt Disney World Resort in Florida. Tens of thousands of DNC members are in town to support our #MAGA Agenda. Our beautiful Country,February,Q1,29,"['annual', 'democratic', 'national', 'convention', 'almost', 'upon', 'field', 'walt', 'disney', 'world', 'resort', 'florida', 'tens', 'thousands', 'dnc', 'members', 'town', 'support', '#maga', 'agenda', 'beautiful', 'country']"
"The Republican National Committee is ready to step in and help the President in any way they can.
Thank you to the thousands of Americans across the country that have stood against hate and oppression &amp; are rising up for our",February,Q1,29,"['republican', 'national', 'committee', 'ready', 'step', 'help', 'president', 'canthank', 'thousands', 'americans', 'across', 'country', 'stood', 'hate', 'oppression', 'rising']"
"The Kansas City Chiefs have released running back Chris Ivory.
I'm glad to report that the Kansas City Chiefs have released their Running Back Chris Ivory. He had just 43 yards on 14 carries in the Chiefs 34–7 loss",February,Q1,29,"['kansas', 'city', 'chiefs', 'released', 'running', 'chris', 'ivoryim', 'glad', 'report', 'kansas', 'city', 'chiefs', 'released', 'running', 'chris', 'ivory', '43', 'yards', '14', 'carries', 'chiefs', '347', 'loss']"
"The musician and activist is a huge fan of our great President. @SenMadigan has done a great job representing the people of Wisconsin!
“The United States has never had a greater Army or Navy or Air Force",February,Q1,29,"['musician', 'activist', 'huge', 'fan', 'great', 'president', '@senmadigan', 'great', 'job', 'representing', 'people', 'wisconsinthe', 'united', 'states', 'greater', 'army', 'navy', 'air', 'force']"
The United States is launching a military strike against the Syrian government of Bashar al-Assad for using chemical weapons against its own people. I am calling on our allies and friends around the world to join us in this decisive and swift,February,Q1,29,"['united', 'states', 'launching', 'military', 'strike', 'syrian', 'government', 'bashar', 'alassad', 'using', 'chemical', 'weapons', 'people', 'calling', 'allies', 'friends', 'world', 'join', 'decisive', 'swift']"
"The National Guard is taking over security in the Gayborhood of San Francisco after several months of terrifying gay men and women with machine guns. No wonder so many are fleeing the area.
SAN FRANCISCO — The",February,Q1,29,"['national', 'guard', 'taking', 'security', 'gayborhood', 'san', 'francisco', 'several', 'months', 'terrifying', 'gay', 'men', 'women', 'machine', 'guns', 'wonder', 'fleeing', 'areasan', 'francisco']"
"Nobody knows for certain what would happen if the United States entered a war with North Korea. But it's certainly possible, and it would be a disaster for everyone.
Congratulations to @AndInformedDotCom and @",February,Q1,29,"['nobody', 'knows', 'certain', 'united', 'states', 'entered', 'war', 'north', 'korea', 'certainly', 'possible', 'disaster', 'everyonecongratulations', '@andinformeddotcom', '@']"
"This is a conversation between a robot and .

.@realDonaldTrump is a robot who doesn’t have thoughts. He is a puppet for the failed failed Puppet @PressSec. He is a pathetic excuse of a",February,Q1,29,"['conversation', 'robot', '@realdonaldtrump', 'robot', 'thoughts', 'puppet', 'failed', 'failed', 'puppet', '@presssec', 'pathetic', 'excuse']"
"And with that, the door is OPEN!
They are going to be looking at all of those people that got away that shouldn’t have got away.
THE SILENT MAJORITY IS STRONGER",February,Q1,29,"['door', 'openthey', 'looking', 'people', 'away', 'shouldnt', 'awaythe', 'silent', 'majority', 'stronger']"
"The federal government will spend $3.1 million to help with the restoration of the Navy Ship Comfort.
What an incredible story!
THANK YOU @DelawareEmbassy for helping with the Visiting Forces and all",February,Q1,29,"['federal', 'government', 'spend', '31', 'million', 'help', 'restoration', 'navy', 'ship', 'comfortwhat', 'incredible', 'storythank', '@delawareembassy', 'helping', 'visiting', 'forces']"
"Political opponents of President Trump are claiming that he will be judged by ""the greatest numbers ever for a tweet."" However, according to a review of the Tweets of every President from Abraham Lincoln to Obama we have never had the",February,Q1,29,"['political', 'opponents', 'president', 'trump', 'claiming', 'judged', 'greatest', 'numbers', 'tweet', 'however', 'according', 'review', 'tweets', 'president', 'abraham', 'lincoln', 'obama']"
"The New York Times editorial board recently declared that Democrats are the party of ""Fire and Fury."" Why? Because they want to bring back the warm and fuzzy days of the past when President Trump was not under investigation for obstruction of",February,Q1,29,"['new', 'york', 'times', 'editorial', 'board', 'recently', 'declared', 'democrats', 'party', 'fire', 'fury', 'bring', 'warm', 'fuzzy', 'days', 'past', 'president', 'trump', 'investigation', 'obstruction']"
"A simple tool that lets you sort names by their letters. Matthew is a must-use app!
A simple tool that lets you sort names by their letters. Matthew is a must-use app!
Just landed in",February,Q1,29,"['simple', 'tool', 'lets', 'sort', 'names', 'letters', 'matthew', 'mustuse', 'appa', 'simple', 'tool', 'lets', 'sort', 'names', 'letters', 'matthew', 'mustuse', 'appjust', 'landed']"
"Kevin Smith's new movie is whoring itself out to the lowest common denominator. It is huge. It is a disgrace.
I have great respect for JB. He is doing a really good job.
Great",February,Q1,29,"['kevin', 'smiths', 'new', 'movie', 'whoring', 'lowest', 'common', 'denominator', 'huge', 'disgracei', 'great', 'respect', 'jb', 'good', 'jobgreat']"
"In an era of constant and often unfounded paranoia and surveillance, when our First Amendment rights are under assault and the very existence of our way of life is under threat, it is unsurprising that so many people would feel persecuted.",February,Q1,29,"['era', 'constant', 'often', 'unfounded', 'paranoia', 'surveillance', 'amendment', 'rights', 'assault', 'existence', 'life', 'threat', 'unsurprising', 'people', 'feel', 'persecuted']"
"The UESPWiki – Your source for The Elder Scrolls since 1995

This article is about the Clan. For the quest, see The Temple Enforcer.

The Temple Enforcer is a set of five quests",February,Q1,29,"['uespwiki', 'source', 'elder', 'scrolls', '1995this', 'article', 'clan', 'quest', 'temple', 'enforcerthe', 'temple', 'enforcer', 'set', 'five', 'quests']"
"The National Governors Association is demanding more money for Governors Island as Hurricane Irene continues to devastate the northeast Bahamas.
The U.S. Army Corps of Engineers has just granted New York State a one-year extension of",February,Q1,29,"['national', 'governors', 'association', 'demanding', 'money', 'governors', 'island', 'hurricane', 'irene', 'continues', 'devastate', 'northeast', 'bahamasthe', 'army', 'corps', 'engineers', 'granted', 'new', 'york', 'state', 'oneyear', 'extension']"
The Ontario government is moving ahead with the first phase of its $5.6-billion Trans-Canada Pipeline Expansion Project with the approval of the Federal Government. The Federal Government waived the price cap on the project to protect Canadian,February,Q1,29,"['ontario', 'government', 'moving', 'ahead', 'phase', '56billion', 'transcanada', 'pipeline', 'expansion', 'project', 'approval', 'federal', 'government', 'federal', 'government', 'waived', 'price', 'cap', 'project', 'protect', 'canadian']"
"In the wake of the horrific Las Vegas mass shooting, it's hard to believe that even a Republican president would do this to our beautiful country. This is why our #MAGA agenda is more than a political football. It",February,Q1,29,"['wake', 'horrific', 'las', 'vegas', 'mass', 'shooting', 'hard', 'believe', 'republican', 'president', 'beautiful', 'country', '#maga', 'agenda', 'political', 'football']"
"I love England!

Very true!

Great!

Loves our great Country!

This is a total disgrace!

Great job!

So true!
Only the crazed will",February,Q1,29,"['love', 'englandvery', 'truegreatloves', 'great', 'countrythis', 'disgracegreat', 'jobso', 'trueonly', 'crazed']"
"Wow! We had the Best Polling in history last night. It was FAR better than any other Presidential Poll. Thank you Nate Silver and the rest of the Fake News Dragons!
“Susan Sarandon”s",February,Q1,29,"['wow', 'best', 'polling', 'history', 'night', 'presidential', 'poll', 'thank', 'nate', 'silver', 'rest', 'fake', 'news', 'dragonssusan', 'sarandons']"
Since the election of President Donald J. Trump there has been a tremendous increase in violence against our Country and its police. There has also been a tremendous increase in the abuse of powerful and corrupt officials. These actions are in clear,February,Q1,29,"['election', 'president', 'donald', 'j', 'trump', 'tremendous', 'increase', 'violence', 'country', 'police', 'tremendous', 'increase', 'abuse', 'powerful', 'corrupt', 'officials', 'actions', 'clear']"
"The use of force is a serious mistake.
The use of force is a serious mistake.
...and we will honor our side of the bargain. Congratulations to our great law enforcement officials on a great victory on the Im",February,Q1,29,"['use', 'force', 'serious', 'mistakethe', 'use', 'force', 'serious', 'mistakeand', 'honor', 'side', 'bargain', 'congratulations', 'great', 'law', 'enforcement', 'officials', 'great', 'victory']"
McMaster University is preparing to release a report on the relationship between Islam and our country. The report will show how deeply rooted is Islam within our society and culture. The report will also discuss the threat Islam poses to Canada and,February,Q1,29,"['mcmaster', 'university', 'preparing', 'release', 'report', 'relationship', 'islam', 'country', 'report', 'show', 'deeply', 'rooted', 'islam', 'within', 'society', 'culture', 'report', 'discuss', 'threat', 'islam', 'poses', 'canada']"
The Eagles are in a position where they can easily make a trade up in the first round. They would like to add some pass rushing talent to the team and potentially draft one of the players mentioned below. The teams that trade,February,Q1,29,"['eagles', 'position', 'easily', 'trade', 'round', 'add', 'pass', 'rushing', 'talent', 'team', 'potentially', 'draft', 'players', 'mentioned', 'teams', 'trade']"
Article: Lee Yo-hwan 's 'Gold' Daily Mail Article on Japan Hits New Low Puts Him In Direct Competition with @CNN &amp; MSDNC @ABC @CBSNews &amp; NBC Ex,February,Q1,29,"['article', 'lee', 'yohwan', 'gold', 'daily', 'mail', 'article', 'japan', 'hits', 'new', 'low', 'puts', 'direct', 'competition', '@cnn', 'msdnc', '@abc', '@cbsnews', 'nbc', 'ex']"
"When we say that our team is made up of some of the best in the business, we mean it. We have some of the best in the business working for us!
The United States is fully prepared to defend itself",February,Q1,29,"['team', 'best', 'business', 'mean', 'best', 'business', 'working', 'usthe', 'united', 'states', 'fully', 'prepared', 'defend']"
The 5% chance that a new Trump tweet will be true - given the volume of misinformation spewed by his Twitter account. “It’s only a matter of time until it’s confirmed.”,February,Q1,29,"['5', 'chance', 'new', 'trump', 'tweet', 'given', 'volume', 'misinformation', 'spewed', 'twitter', 'account', 'matter', 'confirmed']"
"The Chinese Communist Party, and I in particular, are working hard to ensure that all aspects of our nation's economy are operating at peak performance. We will continue to work with the Trump Administration to guarantee a smooth transition and economic",February,Q1,29,"['chinese', 'communist', 'party', 'particular', 'working', 'hard', 'ensure', 'aspects', 'nations', 'economy', 'operating', 'peak', 'performance', 'continue', 'work', 'trump', 'administration', 'guarantee', 'smooth', 'transition', 'economic']"
His administration is to publish the list of those on its so-called Death List – a list that many will never meet – and make them more widely available to let the families know that there is no place for them on this,February,Q1,29,"['administration', 'publish', 'list', 'socalled', 'death', 'list', 'list', 'meet', 'widely', 'available', 'families', 'place']"
"The value of our country will only increase under your leadership!
Congratulations to @RealCandaceMckesson &amp; @Kelly_Giffords on a great campaign they ran against the crazed @McCain who",February,Q1,29,"['value', 'country', 'increase', 'leadershipcongratulations', '@realcandacemckesson', '@kelly_giffords', 'great', 'campaign', 'ran', 'crazed', '@mccain']"
"The Partially Forgotten Party Is Back!
CARSON, Calif. – The United States Senate is finally taking notice of the incredible job the Army and Marine Corps are doing to defeat the Radical Islamic Terrorist threat.
This",February,Q1,29,"['partially', 'forgotten', 'party', 'backcarson', 'calif', 'united', 'states', 'senate', 'finally', 'taking', 'notice', 'incredible', 'job', 'army', 'marine', 'corps', 'defeat', 'radical', 'islamic', 'terrorist', 'threatthis']"
"The Government's position on the JobBridge scheme has changed.
The Government's position on the JobBridge scheme has changed.
Source: Whitehall - Labour Party Conference 2015_Whitehall powerpoint
They are trying to",February,Q1,29,"['governments', 'position', 'jobbridge', 'scheme', 'changedthe', 'governments', 'position', 'jobbridge', 'scheme', 'changedsource', 'whitehall', 'labour', 'party', 'conference', '2015_whitehall', 'powerpointthey', 'trying']"
"Nelson Mandela: I didn't die for the ANC
Posted by Mike Grange at 12:58 PM
Congratulations to our friend Nelson Mandela for being named as one of the 20 Greatest Leaders of All Time! He was",February,Q1,29,"['nelson', 'mandela', 'die', 'ancposted', 'mike', 'grange', '1258', 'pmcongratulations', 'friend', 'nelson', 'mandela', 'named', '20', 'greatest', 'leaders']"
"The National Football League and the San Francisco 49ers are proud to announce a partnership to bring Super Bowl LII to San Francisco. Join us as we celebrate the best in American Football and fight for the American People!
Thank",February,Q1,29,"['national', 'football', 'league', 'san', 'francisco', '49ers', 'proud', 'announce', 'partnership', 'bring', 'super', 'bowl', 'lii', 'san', 'francisco', 'join', 'celebrate', 'best', 'american', 'football', 'fight', 'american', 'peoplethank']"
"What does it mean to be a feminist?

This question was raised by a reader today. She asked:
A feminist is someone who believes women should be treated with respect &amp; that every human being deserves the",February,Q1,29,"['mean', 'feministthis', 'question', 'raised', 'reader', 'askeda', 'feminist', 'someone', 'believes', 'women', 'treated', 'respect', 'human', 'deserves']"
"The world has never been so safe

From the brazen hacking of the Democratic National Committee and Hillary Clinton campaign chairman John Podesta to a single death in the Philippines, we are seeing a stunning end to the dangers of corruption and",February,Q1,29,"['world', 'safefrom', 'brazen', 'hacking', 'democratic', 'national', 'committee', 'hillary', 'clinton', 'campaign', 'chairman', 'john', 'podesta', 'single', 'death', 'philippines', 'seeing', 'stunning', 'end', 'dangers', 'corruption']"
"What is Universal Windows Platform?
Universal Windows Platform (UWP) is an open source, cross-platform Windows 10 IoT platform built on the Universal Windows Platform (UWP).
Trump Is Making Life Worse For Low &",February,Q1,29,"['universal', 'windows', 'platformuniversal', 'windows', 'platform', 'uwp', 'source', 'crossplatform', 'windows', '10', 'iot', 'platform', 'built', 'universal', 'windows', 'platform', 'uwptrump', 'making', 'life', 'worse', 'low']"
"What is the difference between 'contractual' and 'non-compulsory'?
The United States has only been in the World Trade Center Trilateral Deal for 3 months. It will be in World Trade Center 3 years",February,Q1,29,"['difference', 'contractual', 'noncompulsorythe', 'united', 'states', 'world', 'trade', 'center', 'trilateral', 'deal', '3', 'months', 'world', 'trade', 'center', '3']"
"On the heels of the Senate passing a massive $1.1 Trillion tax cut bill, the Trump administration is gearing up to announce a major increase in the number of H-1B visas.
The number of foreign",February,Q1,29,"['heels', 'senate', 'passing', 'massive', '11', 'trillion', 'tax', 'cut', 'bill', 'trump', 'administration', 'gearing', 'announce', 'major', 'increase', 'number', 'h1b', 'visasthe', 'number', 'foreign']"
"Support us on Patreon
Thank you to all of our wonderful Patrons!
What a ride!
They will not stop. Thank you!
Thank you!
Thank you!
Thank you!
Thank you!",February,Q1,29,"['support', 'patreonthank', 'wonderful', 'patronswhat', 'ridethey', 'stop', 'thank', 'youthank', 'youthank', 'youthank', 'youthank']"
"It was an interesting conversation yesterday with Senator Joe Manchin of West Virginia.  They both want to be part of the 1 percent and they both want to make money...
...and they both want to get richer. They",February,Q1,29,"['interesting', 'conversation', 'yesterday', 'senator', 'joe', 'manchin', 'west', 'virginia', 'part', '1', 'percent', 'moneyand', 'richer']"
"Proud to announce our new brand new store! #KelvinGrove
I am proud to announce that we will be adding 100 Grand in the next 2 weeks! #KelvinGrove
I am proud",February,Q1,29,"['proud', 'announce', 'new', 'brand', 'new', 'store', '#kelvingrovei', 'proud', 'announce', 'adding', '100', 'grand', 'next', '2', 'weeks', '#kelvingrovei', 'proud']"
We have just launched a $2.5M grant program to help small businesses in Pennsylvania. This is an important addition to the $2.5M Economic Development Fund that we are already using to support the economic recovery in,February,Q1,29,"['launched', '25m', 'grant', 'program', 'help', 'businesses', 'pennsylvania', 'important', 'addition', '25m', 'economic', 'development', 'fund', 'using', 'support', 'economic', 'recovery']"
"We have been working to understand why the Times has been so hostile to us. They have been wrong 2/3 of the time in the past 10 years.
Since being elected I have been greatly reducing the size of Government",February,Q1,29,"['working', 'understand', 'times', 'hostile', 'wrong', '23', 'past', '10', 'yearssince', 'elected', 'greatly', 'reducing', 'size', 'government']"
The Federal Reserve has today raised interest rates for the first time in more than four years. It will be interesting to see how much of a reaction to the news the market will be to this decision. The Federal Reserve has been,February,Q1,29,"['federal', 'reserve', 'raised', 'interest', 'rates', 'four', 'interesting', 'reaction', 'news', 'market', 'decision', 'federal', 'reserve']"
"The United Nations Human Rights Council has unanimously adopted a series of recommendations to improve the physical and mental health of people living with HIV/AIDS.
The United States stands with the people of Sierra Leone as they demonstrate courage, resolve",February,Q1,29,"['united', 'nations', 'human', 'rights', 'council', 'unanimously', 'adopted', 'series', 'recommendations', 'improve', 'physical', 'mental', 'health', 'people', 'living', 'hivaidsthe', 'united', 'states', 'stands', 'people', 'sierra', 'leone', 'demonstrate', 'courage', 'resolve']"
"The Australian Competition and Consumer Commission has fined Google $US0.005 billion ($A2.15 billion) for failing to take action against its self-described ""bot"" that was found to be actively manipulating search results.",February,Q1,29,"['australian', 'competition', 'consumer', 'commission', 'fined', 'google', 'us0005', 'billion', 'a215', 'billion', 'failing', 'take', 'action', 'selfdescribed', 'bot', 'found', 'actively', 'manipulating', 'search', 'results']"
"This brief survey is not about feelings!
*CrowdsGathers*
The mainstream media is FAKE NEWS. They say I talked about Judge Curiel. I didn’t. I was 20 feet",February,Q1,29,"['brief', 'survey', 'feelingscrowdsgathersthe', 'mainstream', 'media', 'fake', 'news', 'talked', 'judge', 'curiel', '20', 'feet']"
"The People's Liberation Army (PLA) has conducted a series of spectacular and decisive air strikes against the terrorist group the Islamic State (IS).
The United States has conducted over 200 very successful air strikes against the terrorists and the",February,Q1,29,"['peoples', 'liberation', 'army', 'pla', 'conducted', 'series', 'spectacular', 'decisive', 'air', 'strikes', 'terrorist', 'group', 'islamic', 'state', 'isthe', 'united', 'states', 'conducted', '200', 'successful', 'air', 'strikes', 'terrorists']"
"It is easy to see why Hillary Clinton's supporters are so angry — they are being told repeatedly that Donald J. Trump is not fit to be President of the United States.
They are right!
The great people of",February,Q1,29,"['easy', 'hillary', 'clintons', 'supporters', 'angry', 'told', 'repeatedly', 'donald', 'j', 'trump', 'fit', 'president', 'united', 'statesthey', 'rightthe', 'great', 'people']"
"You can't have it both ways.
Democrats want to go to war with China. Republicans want to go to war with Russia. The Dems are making a terrible miscalculation. They are attacking the very nation they claim",February,Q1,29,"['cant', 'waysdemocrats', 'war', 'china', 'republicans', 'war', 'russia', 'dems', 'making', 'terrible', 'miscalculation', 'attacking', 'nation', 'claim']"
