Tweets,Month,Quarter,sampling,TweetsTokenized
"The Pennsylvania Department of State is investigating whether a group of Democratic political operatives illegally coordinated with a super PAC supporting Hillary Clinton before the July 30 Pennsylvania primary.
At issue is a pair of emails that a Democratic consultant sent to another",June,Q2,29,"['pennsylvania', 'department', 'state', 'investigating', 'whether', 'group', 'democratic', 'political', 'operatives', 'illegally', 'coordinated', 'super', 'pac', 'supporting', 'hillary', 'clinton', 'july', '30', 'pennsylvania', 'primaryat', 'issue', 'pair', 'emails', 'democratic', 'consultant', 'sent', 'another']"
"The brand new list of 'strongest' cities in America includes Chicago and Detroit.
The brand new list of 'strongest' cities in America includes Chicago and Detroit.
I've been doing a great job as the",June,Q2,29,"['brand', 'new', 'list', 'strongest', 'cities', 'america', 'includes', 'chicago', 'detroitthe', 'brand', 'new', 'list', 'strongest', 'cities', 'america', 'includes', 'chicago', 'detroitive', 'great', 'job']"
"SINGAPORE - A court on Sunday ordered the deportation of an illegal immigrant from the Philippines after the Federal Government failed to take action during the man's application to remain in the country.
The Federal Government failed to take",June,Q2,29,"['singapore', 'court', 'sunday', 'ordered', 'deportation', 'illegal', 'immigrant', 'philippines', 'federal', 'government', 'failed', 'take', 'action', 'mans', 'application', 'remain', 'countrythe', 'federal', 'government', 'failed', 'take']"
"with a much lower profile than the other two. Also it is not a part of the regular uniform code.
....the FBI is also looking into reports that the NYPD has targeted many of its own with much harsher prosecution than",June,Q2,29,"['lower', 'profile', 'part', 'regular', 'uniform', 'codethe', 'fbi', 'looking', 'reports', 'nypd', 'targeted', 'harsher', 'prosecution']"
"A big thank you to the Florida Keys Patriots for all of their help this week.
A little over a week after Hurricane Irma devastated the Caribbean and Florida the United States continues to recover from the storm. New figures released Friday",June,Q2,29,"['big', 'thank', 'florida', 'keys', 'patriots', 'help', 'weeka', 'little', 'week', 'hurricane', 'irma', 'devastated', 'caribbean', 'florida', 'united', 'states', 'continues', 'recover', 'storm', 'new', 'figures', 'released', 'friday']"
"There are many wonderful Democrats running for Congress in 2018! Join them by voting for Jon Ossoff today!
...but then he just came back with even WORSE reasons for not voting than theirs. They hate us even",June,Q2,29,"['wonderful', 'democrats', 'running', 'congress', '2018', 'join', 'voting', 'jon', 'ossoff', 'todaybut', 'came', 'worse', 'reasons', 'voting', 'hate']"
"Practical use of the Combination Single Pointed Firearm.
Fires more than 1100 rounds of ammunition a minute to bring the rate down to less than 2 per minute.
Fires over 2 Million rounds of ammunition",June,Q2,29,"['practical', 'use', 'combination', 'single', 'pointed', 'firearmfires', '1100', 'rounds', 'ammunition', 'minute', 'bring', 'rate', 'less', '2', 'per', 'minutefires', '2', 'million', 'rounds', 'ammunition']"
"A little-known but very important provision of the Patriot Act, Pub. L. 107-296 provides important legal protections to citizens of the United States. The provision also provides important legal protections to law enforcement to combat terrorism.",June,Q2,29,"['littleknown', 'important', 'provision', 'patriot', 'act', 'pub', 'l', '107296', 'provides', 'important', 'legal', 'protections', 'citizens', 'united', 'states', 'provision', 'provides', 'important', 'legal', 'protections', 'law', 'enforcement', 'combat', 'terrorism']"
The day after the tragic shooting in Las Vegas I was contacted by a very special man who I greatly admire. He is a great friend and a very nice and generous man. He reached out to me last night and told me,June,Q2,29,"['tragic', 'shooting', 'las', 'vegas', 'contacted', 'special', 'man', 'greatly', 'admire', 'great', 'friend', 'nice', 'generous', 'man', 'reached', 'night', 'told']"
"This is Google's AD!
#BREAKING
“President Trump continues to be the most popular President in Gallup polling history.”
“President Trump is holding his ground in the polls.”
",June,Q2,29,"['googles', 'ad#breakingpresident', 'trump', 'continues', 'popular', 'president', 'gallup', 'polling', 'historypresident', 'trump', 'holding', 'ground', 'polls']"
"They thought they were doing a great job in Afghanistan. They were killing our soldiers and Afghanis. They were so incompetent! What about the Taliban?
The Obama Administration has done more for the people of Afghanistan than any President",June,Q2,29,"['thought', 'great', 'job', 'afghanistan', 'killing', 'soldiers', 'afghanis', 'incompetent', 'talibanthe', 'obama', 'administration', 'people', 'afghanistan', 'president']"
"A group of GOP Senators are set to vote this afternoon on a bill that would allow states to ignore federal immigration laws and instead target dangerous criminal aliens.
Democrats have been talking about this for months and it just keeps getting worse",June,Q2,29,"['group', 'gop', 'senators', 'set', 'vote', 'afternoon', 'bill', 'allow', 'states', 'ignore', 'federal', 'immigration', 'laws', 'instead', 'target', 'dangerous', 'criminal', 'aliensdemocrats', 'talking', 'months', 'keeps', 'worse']"
"The so-called 'alt-left' is a virulently anti-American and unconstitutional political movement that has no place in a functioning democracy.


Witch-Hunts Democrats hate us just as much as the",June,Q2,29,"['socalled', 'altleft', 'virulently', 'antiamerican', 'unconstitutional', 'political', 'movement', 'place', 'functioning', 'democracywitchhunts', 'democrats', 'hate']"
"Nightly News - Thursday October 21, 2018 @12:00 am

World War 3 is a real possibility. There is a lot of money to be made making money. Nobody really knows for sure what the cause is",June,Q2,29,"['nightly', 'news', 'thursday', 'october', '21', '2018', '@1200', 'amworld', 'war', '3', 'real', 'possibility', 'lot', 'money', 'making', 'money', 'nobody', 'knows', 'cause']"
"WASHINGTON (Reuters) - The Senate judiciary committee on Monday asked the NSA to explain whether it had found a way to stop a U.S. citizen on a terrorism watch list from purchasing a weapon.
Senator Ron Wyden",June,Q2,29,"['washington', 'reuters', 'senate', 'judiciary', 'committee', 'monday', 'asked', 'nsa', 'explain', 'whether', 'found', 'stop', 'citizen', 'terrorism', 'watch', 'list', 'purchasing', 'weaponsenator', 'ron', 'wyden']"
"Big Ben will be going off for the 5th time in the next few days! It will be VERY interesting!
Big Ben will be going off for the 5th time in the next few days! It will be VERY",June,Q2,29,"['big', 'ben', '5th', 'next', 'days', 'interestingbig', 'ben', '5th', 'next', 'days']"
"In this episode of the Firebase Reference Lab Podcast we discuss the Firebase References API! As a bonus we cover:
Rationale: Use them where you can.
Feature requests: Once we get them working we",June,Q2,29,"['episode', 'firebase', 'reference', 'lab', 'podcast', 'discuss', 'firebase', 'references', 'api', 'bonus', 'coverrationale', 'use', 'canfeature', 'requests', 'working']"
"I'm running for Congress in the GREAT State of Arizona. Please help me get to 300000 – 400000 Early Vote- I need EVERYONE TO VOTE I WILL WIN!
.@MariaBartiromo ",June,Q2,29,"['running', 'congress', 'great', 'state', 'arizona', 'please', 'help', '300000', '400000', 'early', 'vote', 'everyone', 'vote', 'win@mariabartiromo']"
"Hillary Clinton has made plenty of money as a lobbyist. She has repeatedly violated the law. She is a corrupt candidate who will be the Antichrist and we must get her out of office asap!
I have reached",June,Q2,29,"['hillary', 'clinton', 'plenty', 'money', 'lobbyist', 'repeatedly', 'violated', 'law', 'corrupt', 'candidate', 'antichrist', 'office', 'asapi', 'reached']"
People who believe in the Second Amendment should talk to their Senators. We need them to take Action to keep our bad Elites in power. I am pushing for a Second Ammendment Convention to Reform our broken Gun Laws.,June,Q2,29,"['people', 'believe', 'second', 'amendment', 'talk', 'senators', 'take', 'action', 'bad', 'elites', 'power', 'pushing', 'second', 'ammendment', 'convention', 'reform', 'broken', 'gun', 'laws']"
"Israel and the United States should avoid using the term ""occupation"" in describing the US-Israel military cooperation. This is a euphemism for a state of war.
This is why I withdrew the United States from the",June,Q2,29,"['israel', 'united', 'states', 'avoid', 'using', 'term', 'occupation', 'describing', 'usisrael', 'military', 'cooperation', 'euphemism', 'state', 'warthis', 'withdrew', 'united', 'states']"
"The New York Giants are getting ready to take on the St. Louis Rams. A lot of good stuff is about to happen.
THEY WILL.””
Hey @MackSchumer @SenatorTim",June,Q2,29,"['new', 'york', 'giants', 'ready', 'take', 'st', 'louis', 'rams', 'lot', 'good', 'stuff', 'happenthey', 'willhey', '@mackschumer', '@senatortim']"
It's been a busy couple of days for the New York Jets. First it was reported that they were willing to part ways with their legendary defensive end Ndamukong Suh. Then it was reported that they were willing to,June,Q2,29,"['busy', 'couple', 'days', 'new', 'york', 'jets', 'reported', 'willing', 'part', 'ways', 'legendary', 'defensive', 'end', 'ndamukong', 'suh', 'reported', 'willing']"
"Thank you for supporting the journalism that our community needs!
“Trump is finally taking care of the Great American Worker” by Hiring Steve Mnuchin as Secretary of the Treasury. Great idea!
“GOP",June,Q2,29,"['thank', 'supporting', 'journalism', 'community', 'needstrump', 'finally', 'taking', 'care', 'great', 'american', 'worker', 'hiring', 'steve', 'mnuchin', 'secretary', 'treasury', 'great', 'ideagop']"
"The great thing about the internet is that you can write whatever you want and people will read it. However, there are a lot of things out there that are fabricated and hurtful.
“The Fake News is getting",June,Q2,29,"['great', 'thing', 'internet', 'write', 'whatever', 'people', 'however', 'lot', 'fabricated', 'hurtfulthe', 'fake', 'news']"
"I love all things geeky and geeky stuff! I am always on the lookout for new ways to entertain and I LOVE stories!
I cannot believe how Many people signed the petition! Thank you!
.@T",June,Q2,29,"['love', 'geeky', 'geeky', 'stuff', 'lookout', 'new', 'ways', 'entertain', 'love', 'storiesi', 'cannot', 'believe', 'people', 'signed', 'petition', 'thank', 'you@t']"
"Thousands of people gathered in New York on Monday to protest President-elect Donald Trump.
One of them was Rolling Stone reporter Sabrina Rubin Erdely .
THESE TWO ARE NOT EXACT PARTS OF THE S",June,Q2,29,"['thousands', 'people', 'gathered', 'new', 'york', 'monday', 'protest', 'presidentelect', 'donald', 'trumpone', 'rolling', 'stone', 'reporter', 'sabrina', 'rubin', 'erdely', 'exact', 'parts']"
"The Philadelphia Eagles are slowly improving, but it won't happen overnight.
The Eagles should be playing for a win against the Tampa Bay Buccaneers on Sunday Night Football.   The Birds are 12-3 when they do it",June,Q2,29,"['philadelphia', 'eagles', 'slowly', 'improving', 'wont', 'overnightthe', 'eagles', 'playing', 'win', 'tampa', 'bay', 'buccaneers', 'sunday', 'night', 'football', 'birds', '123']"
"President Trump applauded Florida Gov. Rick Scott (R) on Twitter on Thursday after Scott said he would not support the Republican tax bill because it did not go far enough in the Senate.
Proud to be with Great Republican",June,Q2,29,"['president', 'trump', 'applauded', 'florida', 'gov', 'rick', 'scott', 'r', 'twitter', 'thursday', 'scott', 'support', 'republican', 'tax', 'bill', 'enough', 'senateproud', 'great', 'republican']"
The Green Bay Packers are one of the hottest teams in the NFL right now. Last night they beat the Seattle Seahawks 23-17. In Week 4 they host the New York Giants. The Green Bay Packers are unstoppable right now,June,Q2,29,"['green', 'bay', 'packers', 'hottest', 'teams', 'nfl', 'night', 'beat', 'seattle', 'seahawks', '2317', 'week', '4', 'host', 'new', 'york', 'giants', 'green', 'bay', 'packers', 'unstoppable']"
"The Secret Service is investigating after a man wearing a fake gun was seen chasing after a Secret Service agent in New York City shortly after the agency released a series of disturbing photos of its operations inside the White House.
The man",June,Q2,29,"['secret', 'service', 'investigating', 'man', 'wearing', 'fake', 'gun', 'seen', 'chasing', 'secret', 'service', 'agent', 'new', 'york', 'city', 'shortly', 'agency', 'released', 'series', 'disturbing', 'photos', 'operations', 'inside', 'white', 'housethe', 'man']"
"Pep Guardiola has admitted that Manchester City are in the best position they have been since his arrival almost a year ago. The European champions sit in second position in the Premier League having won all of their last eight games.
",June,Q2,29,"['pep', 'guardiola', 'admitted', 'manchester', 'city', 'best', 'position', 'arrival', 'almost', 'year', 'european', 'champions', 'sit', 'second', 'position', 'premier', 'league', 'eight', 'games']"
We are a proud Canadian company that started our small Canadian operation in 1991. We specialize in making and repairing precision machined and finished parts for military and law enforcement applications. We also make quick prototyping parts for companies such as,June,Q2,29,"['proud', 'canadian', 'company', 'started', 'canadian', 'operation', '1991', 'specialize', 'making', 'repairing', 'precision', 'machined', 'finished', 'parts', 'military', 'law', 'enforcement', 'applications', 'quick', 'prototyping', 'parts', 'companies']"
"The Trump administration has asked the Supreme Court to make temporary a lower court ruling that said schools are too expensive to educate the mentally ill.
41 year old James Holmes of CO did in fact have a long criminal record. After",June,Q2,29,"['trump', 'administration', 'asked', 'supreme', 'court', 'temporary', 'lower', 'court', 'ruling', 'schools', 'expensive', 'educate', 'mentally', 'ill41', 'year', 'old', 'james', 'holmes', 'co', 'fact', 'criminal', 'record']"
"The world is facing a new pandemic, and those of us who love our Country are bracing for the worst. The President is now warning that if we do not act quickly we will see an even bigger and better kind",June,Q2,29,"['world', 'facing', 'new', 'pandemic', 'love', 'country', 'bracing', 'worst', 'president', 'warning', 'act', 'quickly', 'bigger', 'kind']"
"A few weeks ago I was on a plane to Orlando. I had a wonderful time there. I love the people of Kentucky!

Thank you to our great medical professionals and first responders. We have been doing well",June,Q2,29,"['weeks', 'plane', 'orlando', 'wonderful', 'love', 'people', 'kentuckythank', 'great', 'medical', 'professionals', 'responders']"
"Mysterious black hole could be the 'heart of the universe'
The mysterious black hole at the center of our solar system could have been even more massive than previously thought and could be far more massive than scientists previously thought",June,Q2,29,"['mysterious', 'black', 'hole', 'could', 'heart', 'universethe', 'mysterious', 'black', 'hole', 'center', 'solar', 'system', 'could', 'massive', 'previously', 'thought', 'could', 'massive', 'scientists', 'previously', 'thought']"
"Angela is a successful existence. She is also a wonderful wife and mother. She will be deeply missed by our whole family. God bless you and keep you in your prayers!
Intel chief says that Russia tampered with",June,Q2,29,"['angela', 'successful', 'existence', 'wonderful', 'wife', 'mother', 'deeply', 'missed', 'whole', 'family', 'god', 'bless', 'prayersintel', 'chief', 'says', 'russia', 'tampered']"
"Somebody please explain to this dumbass!
This is the dumbest woman in the Republican Party. She should never have the honor of being with us!
GREAT NEWS!
Great news!
Thank you!",June,Q2,29,"['somebody', 'please', 'explain', 'dumbassthis', 'dumbest', 'woman', 'republican', 'party', 'honor', 'usgreat', 'newsgreat', 'newsthank']"
"The NHL has agreed to give the NHLPA an additional $550,000 to help cover the costs of the 2016 All-Star Game. That money will go towards the first 2 days of the event in Florida. If we",June,Q2,29,"['nhl', 'agreed', 'give', 'nhlpa', 'additional', '550000', 'help', 'cover', 'costs', '2016', 'allstar', 'game', 'money', 'towards', '2', 'days', 'event', 'florida']"
"It has been said that there are 3 kinds of Americans: those who want their taxes raised and those who don't. That is a true statement of fact.

There are many Americans that are working hard and paying their fair",June,Q2,29,"['3', 'kinds', 'americans', 'taxes', 'raised', 'statement', 'factthere', 'americans', 'working', 'hard', 'paying', 'fair']"
"The long awaited Slingfire is here! This cable system will vastly increase the amount of entertainment and sports that you can watch with TV on the go. The Sling will be the best TV experience ever!
The DNC",June,Q2,29,"['awaited', 'slingfire', 'cable', 'system', 'vastly', 'increase', 'amount', 'entertainment', 'sports', 'watch', 'tv', 'sling', 'best', 'tv', 'experience', 'everthe', 'dnc']"
The debate over the Keystone XL Pipeline has been going on for years. I opposed the Pipeline from the beginning. I sent letters to both North Dakota and Canada both with many questions. We now know better since Obama cancelled the Pipeline,June,Q2,29,"['debate', 'keystone', 'xl', 'pipeline', 'opposed', 'pipeline', 'beginning', 'sent', 'letters', 'north', 'dakota', 'canada', 'questions', 'obama', 'cancelled', 'pipeline']"
"The United States must aggressively pursue efforts to address the crisis in Colombia. Our members are doing an incredible job and I look forward to working with President Santos as we move forward.
...That the United States strongly supports Colombia's",June,Q2,29,"['united', 'states', 'aggressively', 'pursue', 'efforts', 'address', 'crisis', 'colombia', 'members', 'incredible', 'job', 'forward', 'working', 'president', 'santos', 'move', 'forwardthat', 'united', 'states', 'strongly', 'supports', 'colombias']"
"Councilwoman Susan Stotts: 'I've Never Heard Of This' — But So Have Many — And So Does Trump

White House Press Secretary Sean Spicer is under fire after it was revealed that he repeatedly lied about",June,Q2,29,"['councilwoman', 'susan', 'stotts', 'ive', 'heard', 'trumpwhite', 'house', 'press', 'secretary', 'sean', 'spicer', 'fire', 'revealed', 'repeatedly', 'lied']"
The New York Times Editorial Board lashed out at President Trump's tweet on Monday night that he had won the popular vote if the media didn’t give him the benefit of the doubt.” They expressed astonishment that,June,Q2,29,"['new', 'york', 'times', 'editorial', 'board', 'lashed', 'president', 'trumps', 'tweet', 'monday', 'night', 'popular', 'vote', 'media', 'give', 'benefit', 'doubt', 'expressed', 'astonishment']"
The Senate Judiciary Committee will not be holding a hearing on the now infamous Trump dossier. It is a complete waste of time and money. The Democrats do not like hearing anything but the Radical Left Do Nothing Dems want nothing to do,June,Q2,29,"['senate', 'judiciary', 'committee', 'holding', 'hearing', 'infamous', 'trump', 'dossier', 'complete', 'waste', 'money', 'democrats', 'hearing', 'anything', 'radical', 'left', 'nothing', 'dems', 'nothing']"
"The Boring Company: Google
So probably no surprise that Google is in the middle of this.
This is not good.
HAPPY Mardi Gras! Merry Christmas and a Happy New Year to all!",June,Q2,29,"['boring', 'company', 'googleso', 'probably', 'surprise', 'google', 'middle', 'thisthis', 'goodhappy', 'mardi', 'gras', 'merry', 'christmas', 'happy', 'new', 'year']"
"But it wouldn't be a Hollywood movie if the President wasn't a big star too!
THE NEW YORK TIMES!
RT @FoxNews: “Trump Has Signed $100B in New Financial Aid Bills Into",June,Q2,29,"['wouldnt', 'hollywood', 'movie', 'president', 'wasnt', 'big', 'star', 'toothe', 'new', 'york', 'timesrt', '@foxnews', 'trump', 'signed', '100b', 'new', 'financial', 'aid', 'bills']"
"Suffragette Hill has defined the term ""Democrat Bashing."" As a result of this she has been called everything from a ""nasty woman"" to a ""liar"" and worse. Now this!
",June,Q2,29,"['suffragette', 'hill', 'defined', 'term', 'democrat', 'bashing', 'result', 'called', 'nasty', 'woman', 'liar', 'worse']"
"The Heritage Foundation has recruited a new senior fellow to help shape its National Security Strategy: James Lewis.
The—the Heritage Foundation!
Thank you @SenCapito!
Fantastic book!
Interesting!",June,Q2,29,"['heritage', 'foundation', 'recruited', 'new', 'senior', 'fellow', 'help', 'shape', 'national', 'security', 'strategy', 'james', 'lewisthethe', 'heritage', 'foundationthank', '@sencapitofantastic', 'bookinteresting']"
"PITTSBURGH — It was the perfect storm.

The International Space Station was resupplying the International Community from the Russian Cosmonaut Village in Kazakhstan.
The United States had just just launched its very",June,Q2,29,"['pittsburgh', 'perfect', 'stormthe', 'international', 'space', 'station', 'resupplying', 'international', 'community', 'russian', 'cosmonaut', 'village', 'kazakhstanthe', 'united', 'states', 'launched']"
"The Pirates have announced that they have designated infielder-outfielder Ryan McMahon from their active roster. He will be claimed off of the Pirates active roster.
I think the best thing the Democrats can do right now is",June,Q2,29,"['pirates', 'announced', 'designated', 'infielderoutfielder', 'ryan', 'mcmahon', 'active', 'roster', 'claimed', 'pirates', 'active', 'rosteri', 'think', 'best', 'thing', 'democrats']"
"Aftermath

Aftermath of the Vault 7 Earthquake in the Dominican Republic.

I will be making a statement today at 10:30 A.M. from the @WhiteHouse on the destruction caused by the Earthquake",June,Q2,29,"['aftermathaftermath', 'vault', '7', 'earthquake', 'dominican', 'republici', 'making', 'statement', '1030', '@whitehouse', 'destruction', 'caused', 'earthquake']"
"NDP Leader Thomas Mulcair said Thursday that the United States should be more involved in supporting Canada's dairy farmers.
""We look at the United States very much as a source of assistance and advice,"" he told CBC Radio's",June,Q2,29,"['ndp', 'leader', 'thomas', 'mulcair', 'thursday', 'united', 'states', 'involved', 'supporting', 'canadas', 'dairy', 'farmerswe', 'united', 'states', 'source', 'assistance', 'advice', 'told', 'cbc', 'radios']"
"And now for something completely different...
And the President of the United States has just signed an Executive Order which basically says that he is not going to answer any questions about this President's outrageous wiretapping or any of the other",June,Q2,29,"['something', 'completely', 'differentand', 'president', 'united', 'states', 'signed', 'executive', 'order', 'basically', 'says', 'answer', 'questions', 'presidents', 'outrageous', 'wiretapping']"
"The President of the United States is saying that he wants to talk to the leaders of Australia and other countries that voted to protect our Country. They said No to the bad (and often Radical) Vote!
Australia wants to",June,Q2,29,"['president', 'united', 'states', 'saying', 'wants', 'talk', 'leaders', 'australia', 'countries', 'voted', 'protect', 'country', 'bad', 'often', 'radical', 'voteaustralia', 'wants']"
"More information: Realistic tattoo of a horse with reaction face style of the Russian Army and World Championship soccer team by Alexey Stolyarov from St. Petersburg, Russia

Tags:<|endoftext|>A lot has happened since the",June,Q2,29,"['information', 'realistic', 'tattoo', 'horse', 'reaction', 'face', 'style', 'russian', 'army', 'world', 'championship', 'soccer', 'team', 'alexey', 'stolyarov', 'st', 'petersburg', 'russiatagsendoftexta', 'lot', 'happened']"
"LONDON — The British government is ready to pay up to $100 million to Turkey to help resolve the refugee crisis engulfing the European Union.
The money would come from EU funds and be available to Turkey as soon as",June,Q2,29,"['london', 'british', 'government', 'ready', 'pay', '100', 'million', 'turkey', 'help', 'resolve', 'refugee', 'crisis', 'engulfing', 'european', 'unionthe', 'money', 'eu', 'funds', 'available', 'turkey', 'soon']"
"The Michigan Supreme Court has ruled that a man cannot be convicted for having a glass of wine with his wife.
A Michigan judge has ruled that a man cannot be convicted of having a glass of wine with his wife. This",June,Q2,29,"['michigan', 'supreme', 'court', 'ruled', 'man', 'cannot', 'convicted', 'glass', 'wine', 'wifea', 'michigan', 'judge', 'ruled', 'man', 'cannot', 'convicted', 'glass', 'wine', 'wife']"
"This is a photo of my husband William the Puppet! He just turned 33 years old yesterday and he is ready to go bigger and better than ever! Our family is so proud of him!
“I am proud of",June,Q2,29,"['photo', 'husband', 'william', 'puppet', 'turned', '33', 'old', 'yesterday', 'ready', 'bigger', 'family', 'proud', 'himi', 'proud']"
"Lowest Ratings SORT BY: | Highest Ratings 32 Reviews. Average Rating: 4.4 of 5 Stars! 532 Reviews. Sign Up Today!
Hate to mention this but it was suggested to me by my",June,Q2,29,"['lowest', 'ratings', 'sort', 'highest', 'ratings', '32', 'reviews', 'average', 'rating', '44', '5', 'stars', '532', 'reviews', 'sign', 'todayhate', 'mention', 'suggested']"
"Another year! Another successful launch.
Hit the streets and show your support for @RepDennyBiden! Join thousands of other Democrats in urging Governor @MikeDeWine to award @DevinULAW a Purple",June,Q2,29,"['another', 'year', 'another', 'successful', 'launchhit', 'streets', 'show', 'support', '@repdennybiden', 'join', 'thousands', 'democrats', 'urging', 'governor', '@mikedewine', 'award', '@devinulaw', 'purple']"
