Tweets,Month,Quarter,sampling,TweetsTokenized
"But the most important thing is that everyone realizes how important the Affordable Care Act is for our country!
My great honor!
Hopefully we can work this out. The Fake News Media is doing everything possible to make Democrats look",May,Q2,41,"['important', 'thing', 'everyone', 'realizes', 'important', 'affordable', 'care', 'act', 'countrymy', 'great', 'honorhopefully', 'work', 'fake', 'news', 'media', 'possible', 'democrats']"
"Jake Tapper is totally off.
Yesterday while interviewing the lovely Lindsay Graham about the Obamacare Locker Room Accident that killed as many as 40 people Jake Tapper went crazy and claimed that the video was manipulated by the Obama",June,Q2,41,"['jake', 'tapper', 'totally', 'offyesterday', 'interviewing', 'lovely', 'lindsay', 'graham', 'obamacare', 'locker', 'room', 'accident', 'killed', '40', 'people', 'jake', 'tapper', 'went', 'crazy', 'claimed', 'video', 'manipulated', 'obama']"
"The only way to stop the bleeding. RESPECT OUR POLICE.


Honored to be joining the President and the Republicans in thanking our great Law Enforcement Officers from all over the Country. They work hard for our great",June,Q2,41,"['stop', 'bleeding', 'respect', 'policehonored', 'joining', 'president', 'republicans', 'thanking', 'great', 'law', 'enforcement', 'officers', 'country', 'work', 'hard', 'great']"
This paper documents the rapid evolution of the Arena Football League from the fledgling National Professional Basketball League into a multi-billion dollar business that is now worth more than the entire global GDP of the United States. In the process the Arena,June,Q2,41,"['paper', 'documents', 'rapid', 'evolution', 'arena', 'football', 'league', 'fledgling', 'national', 'professional', 'basketball', 'league', 'multibillion', 'dollar', 'business', 'worth', 'entire', 'global', 'gdp', 'united', 'states', 'process', 'arena']"
"A federal appeals court on Monday upheld a Texas law that many say will lead to the prosecution of many peaceful protesters.
A very crowded Supreme Court.
The Democrat Party is working overtime to destroy the reputation of a great man",June,Q2,41,"['federal', 'appeals', 'court', 'monday', 'upheld', 'texas', 'law', 'lead', 'prosecution', 'peaceful', 'protestersa', 'crowded', 'supreme', 'courtthe', 'democrat', 'party', 'working', 'overtime', 'destroy', 'reputation', 'great', 'man']"
"There is no way around it. Hillary Clinton lost the 2016 election. She should be forced to return all of her over $100 million salary. She is corrupt and a disaster for our Country!
Democrats suck. They want",June,Q2,41,"['hillary', 'clinton', 'lost', '2016', 'election', 'forced', 'return', '100', 'million', 'salary', 'corrupt', 'disaster', 'countrydemocrats', 'suck']"
Guardians of the Galaxy Vol. 2 is shaping up to be another solid film from Marvel. It is a deeply personal story about the intersection of faith and entertainment that I never thought I'd see. It is a story about,June,Q2,41,"['guardians', 'galaxy', 'vol', '2', 'shaping', 'another', 'solid', 'film', 'marvel', 'deeply', 'personal', 'story', 'intersection', 'faith', 'entertainment', 'thought', 'id', 'story']"
I am writing to you today to share with you the latest news which will have a devastating impact on our Country. The call for Civility from the President of the United States yesterday was not recognized by the Radical Left Democrats in,June,Q2,41,"['writing', 'share', 'latest', 'news', 'devastating', 'impact', 'country', 'call', 'civility', 'president', 'united', 'states', 'yesterday', 'recognized', 'radical', 'left', 'democrats']"
Mike Pence Takes the Stage to Celebrate the Second Amendment. He is Doing So on a Budget of Over $3 Billion a Year. This is a Huge Blow to the Radical Left Democrats. They Lost the House and they will,June,Q2,41,"['mike', 'pence', 'takes', 'stage', 'celebrate', 'second', 'amendment', 'budget', '3', 'billion', 'year', 'huge', 'blow', 'radical', 'left', 'democrats', 'lost', 'house']"
"Canada will not allow Iran to obtain a nuclear weapon, Prime Minister Justin Trudeau has said.

The United States had threatened to impose economic sanctions on Iran over its nuclear programme and Mr Trudeau said this week: ""I will",June,Q2,41,"['canada', 'allow', 'iran', 'obtain', 'nuclear', 'weapon', 'prime', 'minister', 'justin', 'trudeau', 'saidthe', 'united', 'states', 'threatened', 'impose', 'economic', 'sanctions', 'iran', 'nuclear', 'programme', 'mr', 'trudeau', 'week']"
"There are many things I love more than peanuts. I love a good story more than anything else in the world. So much of it is just bravado!
Will be interviewed by @MariaBartiromo at 9",June,Q2,41,"['love', 'peanuts', 'love', 'good', 'story', 'anything', 'else', 'world', 'bravadowill', 'interviewed', '@mariabartiromo', '9']"
"The Post-it Note is a fad. It's not going away.
I was just given the job of running for President by the American People!
A great man. A GREAT MAN!
Great news!",June,Q2,41,"['postit', 'note', 'fad', 'awayi', 'given', 'job', 'running', 'president', 'american', 'peoplea', 'great', 'man', 'great', 'mangreat', 'news']"
"So you want to be a better citizen than the bunch of people who run the Federal Government?
“If you want to be a better American than we are, you've got to be willing to stand up for what",June,Q2,41,"['citizen', 'bunch', 'people', 'run', 'federal', 'governmentif', 'american', 'youve', 'willing', 'stand']"
"MEXICO CITY (Reuters) - Federal prosecutors on Thursday sought the death penalty against former Mexican drug lord Joaquin ""El Chapo"" Guzman for a 1993 rape and killing.
Mexican President Enrique Pena Nieto",June,Q2,41,"['mexico', 'city', 'reuters', 'federal', 'prosecutors', 'thursday', 'sought', 'death', 'penalty', 'former', 'mexican', 'drug', 'lord', 'joaquin', 'el', 'chapo', 'guzman', '1993', 'rape', 'killingmexican', 'president', 'enrique', 'pena', 'nieto']"
"The Sierra Club today called for a ""major public hearing"" before the Senate Intelligence Committee into the Russian interference in our 2016 Presidential Election.
Sierra Club Executive Director Michael Brune said:
""The results of the 2016 Presidential",June,Q2,41,"['sierra', 'club', 'called', 'major', 'public', 'hearing', 'senate', 'intelligence', 'committee', 'russian', 'interference', '2016', 'presidential', 'electionsierra', 'club', 'executive', 'director', 'michael', 'brune', 'saidthe', 'results', '2016', 'presidential']"
"From Bulbapedia, the community-driven Pokémon encyclopedia.

This article is incomplete.

Please feel free to edit this article to add missing information and complete it.

Tigress (Japanese:",June,Q2,41,"['bulbapedia', 'communitydriven', 'pokémon', 'encyclopediathis', 'article', 'incompleteplease', 'feel', 'free', 'edit', 'article', 'add', 'missing', 'information', 'complete', 'ittigress', 'japanese']"
"SHARE THIS ARTICLE Share Tweet Post Email

There was a time when the U.S. Treasury Department was as much a player in the Senate as the House was in the House. President Trump was looking for answers on everything",June,Q2,41,"['share', 'article', 'share', 'tweet', 'post', 'emailthere', 'treasury', 'department', 'player', 'senate', 'house', 'house', 'president', 'trump', 'looking', 'answers']"
"Our partners at the World Trade Center Health and Safety Command have provided us with video and images from the scene of yesterday's attack. Check it out!
.@CDCgov is leading the way in helping us protect our citizens",June,Q2,41,"['partners', 'world', 'trade', 'center', 'health', 'safety', 'command', 'provided', 'video', 'images', 'scene', 'yesterdays', 'attack', 'check', 'out@cdcgov', 'leading', 'helping', 'protect', 'citizens']"
The world is at war and only Russia is fighting it but they are both in war with the United States. They are both being run by Radical Islamic Terrorists. Russia has done an incredible job. I only wish they would,June,Q2,41,"['world', 'war', 'russia', 'fighting', 'war', 'united', 'states', 'run', 'radical', 'islamic', 'terrorists', 'russia', 'incredible', 'job', 'wish']"
"We know that students are frustrated with the CFPB.
We know that student loan defaults are soaring.
We know that when we cut taxes the economy thrives.
And now we know that when we raise taxes",June,Q2,41,"['students', 'frustrated', 'cfpbwe', 'student', 'loan', 'defaults', 'soaringwe', 'cut', 'taxes', 'economy', 'thrivesand', 'raise', 'taxes']"
"Just before Christmas, the US military dropped another bomb on the Syrian town of Khan Sheikhoun. The US military said that the attack was a ""mixed bag"" and that more information would be released as to what led to",June,Q2,41,"['christmas', 'military', 'dropped', 'another', 'bomb', 'syrian', 'town', 'khan', 'sheikhoun', 'military', 'attack', 'mixed', 'bag', 'information', 'released', 'led']"
"The two candidates in the Republican presidential primary are virtually tied in the polls. Who is right?
Great work @MariaBartiromo, great job!
Thank you @FBI. The American people will not be lied",June,Q2,41,"['candidates', 'republican', 'presidential', 'primary', 'virtually', 'tied', 'polls', 'rightgreat', 'work', '@mariabartiromo', 'great', 'jobthank', '@fbi', 'american', 'people', 'lied']"
The European Union (EU) is moving to undermine the United States by imposing a ban on all mobile roaming in the United States. This is wrong and will hurt the United States. Please call &amp; email your Senators today,June,Q2,41,"['european', 'union', 'eu', 'moving', 'undermine', 'united', 'states', 'imposing', 'ban', 'mobile', 'roaming', 'united', 'states', 'wrong', 'hurt', 'united', 'states', 'please', 'call', 'email', 'senators']"
"CHARLOTTE, N.C. -- When we think of the Carolina Panthers we think of the team's Super Bowl run. We also think of Cam Newton's incredible play. I'm proud that Cam has been able",June,Q2,41,"['charlotte', 'nc', 'think', 'carolina', 'panthers', 'think', 'teams', 'super', 'bowl', 'run', 'think', 'cam', 'newtons', 'incredible', 'play', 'proud', 'cam', 'able']"
"The jarring video has outraged the Republican Party and has left a woman in a hospital in serious condition.
This is not ok!
I was shocked and saddened by the terrible accident in Minnesota this afternoon. My heart goes out",June,Q2,41,"['jarring', 'video', 'outraged', 'republican', 'party', 'left', 'woman', 'hospital', 'serious', 'conditionthis', 'oki', 'shocked', 'saddened', 'terrible', 'accident', 'minnesota', 'afternoon', 'heart', 'goes']"
"The National Security Agency abandoned its plan to build a $300 million data center in Utah and instead leased space from a local company, a move that could lead to thousands of jobs and billions of dollars in economic activity, according to",June,Q2,41,"['national', 'security', 'agency', 'abandoned', 'plan', 'build', '300', 'million', 'data', 'center', 'utah', 'instead', 'leased', 'space', 'local', 'company', 'move', 'could', 'lead', 'thousands', 'jobs', 'billions', 'dollars', 'economic', 'activity', 'according']"
"A new poll conducted by the Los Angeles Times and the University of Southern California found that 74 percent of Californians are in favor of a single payer healthcare system.
I will be having a White House Press Conference today at",June,Q2,41,"['new', 'poll', 'conducted', 'los', 'angeles', 'times', 'university', 'southern', 'california', 'found', '74', 'percent', 'californians', 'favor', 'single', 'payer', 'healthcare', 'systemi', 'white', 'house', 'press', 'conference']"
"The Portland Trail Blazers have acquired guard Josh Selby from the Los Angeles Clippers in exchange for guard C.J. McCollum and a second-round pick.
THREE POINTS FOR THE BROWNS?",June,Q2,41,"['portland', 'trail', 'blazers', 'acquired', 'guard', 'josh', 'selby', 'los', 'angeles', 'clippers', 'exchange', 'guard', 'cj', 'mccollum', 'secondround', 'pickthree', 'points', 'browns']"
"After much deliberation, the Board of Governors of the Federal Reserve has agreed to increase the Official Rate to an even faster 2.25%. This will help the United States economy by further stimulating the economy and will help ensure that",June,Q2,41,"['deliberation', 'board', 'governors', 'federal', 'reserve', 'agreed', 'increase', 'official', 'rate', 'faster', '225', 'help', 'united', 'states', 'economy', 'stimulating', 'economy', 'help', 'ensure']"
"Myanmar has just announced that it will be joining the Shanghai Cooperation Organization (SCO). This will be good news for the people of China and the World.
China is now joining the Shanghai Cooperation Organization (SCO).",June,Q2,41,"['myanmar', 'announced', 'joining', 'shanghai', 'cooperation', 'organization', 'sco', 'good', 'news', 'people', 'china', 'worldchina', 'joining', 'shanghai', 'cooperation', 'organization', 'sco']"
"Welp, looks like Jared was right; we can finally rest easy!
Morning everyone. It's been a busy few days for us! Looking forward to seeing all of you soon!
HealthCare is on its",June,Q2,41,"['welp', 'looks', 'jared', 'finally', 'rest', 'easymorning', 'everyone', 'busy', 'days', 'looking', 'forward', 'seeing', 'soonhealthcare']"
"The Republican Party is very divided on whether to nominate former reality TV star Donald Trump for President of the United States.
After watching what happened to John McCain in 2016 I will not be using or accepting any VP (Pled",June,Q2,41,"['republican', 'party', 'divided', 'whether', 'nominate', 'former', 'reality', 'tv', 'star', 'donald', 'trump', 'president', 'united', 'statesafter', 'watching', 'happened', 'john', 'mccain', '2016', 'using', 'accepting', 'vp', 'pled']"
"One of the most impressive things about the Trump administration is how it is deliberately not doing the job that its repeated critics have put it up to do.
...
I will be totally open with Great Britain about the fact that",June,Q2,41,"['impressive', 'trump', 'administration', 'deliberately', 'job', 'repeated', 'critics', 'put', 'doi', 'totally', 'great', 'britain', 'fact']"
"The Chipotle Mexican Grill in Austin, Texas has been found to be in violation of the Americans With Disabilities Act (ADA) for failing to provide a non-retaliatory step for customers to cover up their food.",June,Q2,41,"['chipotle', 'mexican', 'grill', 'austin', 'texas', 'found', 'violation', 'americans', 'disabilities', 'act', 'ada', 'failing', 'provide', 'nonretaliatory', 'step', 'customers', 'cover', 'food']"
This is what we are seeing in North Carolina: ...for decades Republicans have worked hand-in-hand with Democrats to destroy the 2nd Amendment. Now they want to take it away again. Bad for hunters &amp;,June,Q2,41,"['seeing', 'north', 'carolina', 'decades', 'republicans', 'worked', 'handinhand', 'democrats', 'destroy', '2nd', 'amendment', 'take', 'away', 'bad', 'hunters']"
The Obama campaign is putting a great deal of effort into trying to confuse the American people here in Wisconsin. They are constantly claiming that Governor Romney has raised $200 million dollars. That is a total falsehood which they will surely retract,June,Q2,41,"['obama', 'campaign', 'putting', 'great', 'deal', 'effort', 'trying', 'confuse', 'american', 'people', 'wisconsin', 'constantly', 'claiming', 'governor', 'romney', 'raised', '200', 'million', 'dollars', 'falsehood', 'surely', 'retract']"
"The UESPWiki – Your source for The Elder Scrolls since 1995

For the quest in the same name, see The Edicts of Magnus.

For the race in the game, see Nord animal husbandry",June,Q2,41,"['uespwiki', 'source', 'elder', 'scrolls', '1995for', 'quest', 'name', 'edicts', 'magnusfor', 'race', 'game', 'nord', 'animal', 'husbandry']"
"We all know the importance of education, but what about the younger generations? They need our support and they are the ones who will be making the difference!

Are you a young Black male living in your community? Our",June,Q2,41,"['importance', 'education', 'younger', 'generations', 'support', 'ones', 'making', 'differenceare', 'young', 'black', 'male', 'living', 'community']"
"To view this video please enable JavaScript, and consider upgrading to a web browser that supports HTML5 video Your browser does not support JavaScript. do you think he should be fired or suspended?

This is a fake news video",June,Q2,41,"['view', 'video', 'please', 'enable', 'javascript', 'consider', 'upgrading', 'web', 'browser', 'supports', 'html5', 'video', 'browser', 'support', 'javascript', 'think', 'fired', 'suspendedthis', 'fake', 'news', 'video']"
"Falling Rainfall Leaves Apple to Pay $13.5 Billion in Unearned Profits
Apple is next in a long line of the Great American Machine Machine and the State to pay a very heavy price for not being able",June,Q2,41,"['falling', 'rainfall', 'leaves', 'apple', 'pay', '135', 'billion', 'unearned', 'profitsapple', 'next', 'line', 'great', 'american', 'machine', 'machine', 'state', 'pay', 'heavy', 'price', 'able']"
"The Sacramento Kings have acquired forward DeMarcus Cousins from the Washington Wizards in exchange for forward Garrett Temple and a 2016 first round draft pick.
Cousins is a versatile big man who will be a great addition to our team",June,Q2,41,"['sacramento', 'kings', 'acquired', 'forward', 'demarcus', 'cousins', 'washington', 'wizards', 'exchange', 'forward', 'garrett', 'temple', '2016', 'round', 'draft', 'pickcousins', 'versatile', 'big', 'man', 'great', 'addition', 'team']"
"The FBI raided the home of a California man who was accused of stealing an AR-15-style weapon from a Las Vegas hotel room.
The FBI is in the process of cutting off funds to a Nevada man after the",June,Q2,41,"['fbi', 'raided', 'home', 'california', 'man', 'accused', 'stealing', 'ar15style', 'weapon', 'las', 'vegas', 'hotel', 'roomthe', 'fbi', 'process', 'cutting', 'funds', 'nevada', 'man']"
"There are still quite a few things to do in the San Antonio area this weekend.
“The FBI has launched an investigation into whether there was any collusion between the Trump campaign and Russia.” @foxandfriends",June,Q2,41,"['still', 'quite', 'san', 'antonio', 'area', 'weekendthe', 'fbi', 'launched', 'investigation', 'whether', 'collusion', 'trump', 'campaign', 'russia', '@foxandfriends']"
Australians are fed up with the way they are being treated by the Federal Government. The Government has taken the worst of both worlds – they have failed to deliver our nation with its greatest ever job numbers and now they are failing,June,Q2,41,"['australians', 'fed', 'treated', 'federal', 'government', 'government', 'taken', 'worst', 'worlds', 'failed', 'deliver', 'nation', 'greatest', 'job', 'numbers', 'failing']"
"The Trump administration on Monday denied an Early Release request submitted by Massachusetts Sen. Elizabeth Warren to be released from a fast track trade promotion authority (TPA) authority vote.
The vote has now been called and the Democrats have",June,Q2,41,"['trump', 'administration', 'monday', 'denied', 'early', 'release', 'request', 'submitted', 'massachusetts', 'sen', 'elizabeth', 'warren', 'released', 'track', 'trade', 'promotion', 'authority', 'tpa', 'authority', 'votethe', 'vote', 'called', 'democrats']"
"He came to save us. He came to save our Country. He came to save our Vets. And he COME BACK.
He is the most Anti-American President in our history. He is a disaster for",June,Q2,41,"['came', 'save', 'came', 'save', 'country', 'came', 'save', 'vets', 'backhe', 'antiamerican', 'president', 'history', 'disaster']"
"Time to end the Death Penalty in the United States!
Thank you @SenBillCassidy! You are a big reason why I'm doing what I am doing: Electing our very first female Naval Officer this November.",June,Q2,41,"['end', 'death', 'penalty', 'united', 'statesthank', '@senbillcassidy', 'big', 'reason', 'electing', 'female', 'naval', 'officer', 'november']"
"I am so (so) sorry that Brian is having to endure this!
COOPER: Thank you!
COOPER: We appreciate it so much!
COOPER: Thank you!
COOPER: I agree",June,Q2,41,"['sorry', 'brian', 'endure', 'thiscooper', 'thank', 'youcooper', 'appreciate', 'muchcooper', 'thank', 'youcooper', 'agree']"
"The cost of living in Richmond, Virginia is now $7.29 per hour which is 7.25% higher than the national average.
President Trump has done an amazing job on Tax Cuts and Reform.
Big",June,Q2,41,"['cost', 'living', 'richmond', 'virginia', '729', 'per', 'hour', '725', 'higher', 'national', 'averagepresident', 'trump', 'amazing', 'job', 'tax', 'cuts', 'reformbig']"
"Now that the President has signed the Protect IP Act with bipartisan support in the Senate and with strong bipartisan support in the House, I look forward to working with both parties as we move forward to keep our nation OPEN and SAFE",June,Q2,41,"['president', 'signed', 'protect', 'ip', 'act', 'bipartisan', 'support', 'senate', 'strong', 'bipartisan', 'support', 'house', 'forward', 'working', 'parties', 'move', 'forward', 'nation', 'safe']"
"Senator Bernie Sanders of Vermont is surging ahead of Hillary Clinton in the New Hampshire polls.
I thought it would be good to denounce the corrupting influence of special interest money in politics. It is a problem in all walks of",June,Q2,41,"['senator', 'bernie', 'sanders', 'vermont', 'surging', 'ahead', 'hillary', 'clinton', 'new', 'hampshire', 'pollsi', 'thought', 'good', 'denounce', 'corrupting', 'influence', 'special', 'interest', 'money', 'politics', 'problem', 'walks']"
"What's the point of sending young people to school when you can just send them the hell out of town?
The greatest nation in the history of the world is under attack. Let them come in peace.I said they",June,Q2,41,"['whats', 'point', 'sending', 'young', 'people', 'school', 'send', 'hell', 'townthe', 'greatest', 'nation', 'history', 'world', 'attack', 'peacei']"
"The three people who were killed in a crash in Chesterfield County were two men who had just moved to the area from Colorado and were attending a baseball game.
a) You look at the data and the people who died",June,Q2,41,"['people', 'killed', 'crash', 'chesterfield', 'county', 'men', 'moved', 'area', 'colorado', 'attending', 'baseball', 'gamea', 'data', 'people', 'died']"
"And if you're a Democrat who voted against the Iraq War and supported the invasion of Iraq, you can go to jail!
'The Left wing of the Republican Party has taken over the Republican Party. They want to take",June,Q2,41,"['democrat', 'voted', 'iraq', 'war', 'supported', 'invasion', 'iraq', 'jailthe', 'left', 'wing', 'republican', 'party', 'taken', 'republican', 'party', 'take']"
The Ghost of Ulysses S. Grant should be on every American family tree. A true patriot who served our Country in its Mightiest Form was a true American HERO. He was a true statesman who fought for our,June,Q2,41,"['ghost', 'ulysses', 'grant', 'american', 'family', 'tree', 'patriot', 'served', 'country', 'mightiest', 'form', 'american', 'hero', 'statesman', 'fought']"
"The following is an updated version of a story originally published by the Las Vegas Review Journal on Oct. 28.

The owners of two strip clubs are furious after the Trump Organization pulled out of their businesses.
Hilton",June,Q2,41,"['following', 'updated', 'version', 'story', 'originally', 'published', 'las', 'vegas', 'review', 'journal', 'oct', '28the', 'owners', 'strip', 'clubs', 'furious', 'trump', 'organization', 'pulled', 'businesseshilton']"
"The Giants have officially parted ways with their starting right fielder, who they had hoped would prove to be their franchise player. Hunter Pence is hopefully going to be replaced by someone who can hit better than his teammate.
I am",June,Q2,41,"['giants', 'officially', 'parted', 'ways', 'starting', 'fielder', 'hoped', 'prove', 'franchise', 'player', 'hunter', 'pence', 'hopefully', 'replaced', 'someone', 'hit', 'teammatei']"
"Roger Goodell has done a tremendous job as Commissioner. He has been very transparent with the American people and I fully support his decision to leave the NFL.
Just finished a very good meeting with President Xi of China. We both",June,Q2,41,"['roger', 'goodell', 'tremendous', 'job', 'commissioner', 'transparent', 'american', 'people', 'fully', 'support', 'decision', 'leave', 'nfljust', 'finished', 'good', 'meeting', 'president', 'xi', 'china']"
At the heart of our Unite the Right movement is the belief that the only way to truly protect our 2nd Amendment is to defeat the corrupt Democrat Machine (Dems)! We are going to win BIG in November. Our,June,Q2,41,"['heart', 'unite', 'movement', 'belief', 'truly', 'protect', '2nd', 'amendment', 'defeat', 'corrupt', 'democrat', 'machine', 'dems', 'win', 'big', 'november']"
The U.S. Army is giving tactical soldiers the option to wear full body protective gear which covers from the stomach down. This is necessary to help with pain and bleeding during combat. Full Body Protective Gear is an option for,June,Q2,41,"['army', 'giving', 'tactical', 'soldiers', 'option', 'wear', 'full', 'body', 'protective', 'gear', 'covers', 'stomach', 'necessary', 'help', 'pain', 'bleeding', 'combat', 'full', 'body', 'protective', 'gear', 'option']"
"I have been thinking a lot about this for some time.
The greatest Hoax in American History!
Thank you @WhiteHouse for sharing the picture of my two beautiful beautiful Grandchildren. You are a fantastic picture opp",June,Q2,41,"['thinking', 'lot', 'timethe', 'greatest', 'hoax', 'american', 'historythank', '@whitehouse', 'sharing', 'picture', 'beautiful', 'beautiful', 'grandchildren', 'fantastic', 'picture', 'opp']"
"I get asked this question all the time: How did the New England Patriots get to this point? The simple answer is we made them. After years of neglect and incompetence, with our entire rust belt economy falling apart, we",June,Q2,41,"['asked', 'question', 'new', 'england', 'patriots', 'point', 'simple', 'answer', 'neglect', 'incompetence', 'entire', 'rust', 'belt', 'economy', 'falling', 'apart']"
