Tweets,Month,Quarter,sampling,TweetsTokenized
"The Board of Governors of the Federal Reserve has told Congress it is in full agreement with the Senate's approval of the bipartisan Tax Cuts and Jobs Act.
As always we will continue to monitor the developments.
REPU",April,Q2,27,"['board', 'governors', 'federal', 'reserve', 'told', 'congress', 'full', 'agreement', 'senates', 'approval', 'bipartisan', 'tax', 'cuts', 'jobs', 'actas', 'continue', 'monitor', 'developmentsrepu']"
"FARMINGTON, N.Y. (WKBW) - Because of the incredible work of two incredible individuals our county is in good hands. Our amazing Senator @Jerry Moran just finished a marathon campaign and is now running",April,Q2,27,"['farmington', 'ny', 'wkbw', 'incredible', 'work', 'incredible', 'individuals', 'county', 'good', 'hands', 'amazing', 'senator', '@jerry', 'moran', 'finished', 'marathon', 'campaign', 'running']"
"Here we go again!
The New York Times is reporting that the Democratic National Committee (DNC) and Hillary Clinton's campaign are in talks to create a joint television and radio advertising campaign that would air on cable news networks",April,Q2,27,"['againthe', 'new', 'york', 'times', 'reporting', 'democratic', 'national', 'committee', 'dnc', 'hillary', 'clintons', 'campaign', 'talks', 'create', 'joint', 'television', 'radio', 'advertising', 'campaign', 'air', 'cable', 'news', 'networks']"
"The Toronto Argonauts are currently in the hunt to win the 2018 NFL Draft.
Links:
The Argos owner Fiona McCormick is an infamous liar who has lied to the American people on the Trans-Pacific Partnership and",April,Q2,27,"['toronto', 'argonauts', 'currently', 'hunt', 'win', '2018', 'nfl', 'draftlinksthe', 'argos', 'owner', 'fiona', 'mccormick', 'infamous', 'liar', 'lied', 'american', 'people', 'transpacific', 'partnership']"
"What is the ""Active Duty Family""?
Posted by Tom at 10:00 AM
This is so cool! @iHeart_US A photo posted by @jenniferjolie on Jul 7, 2015 at",April,Q2,27,"['active', 'duty', 'familyposted', 'tom', '1000', 'amthis', 'cool', '@iheart_us', 'photo', 'posted', '@jenniferjolie', 'jul', '7', '2015']"
"A new study from Stanford University researchers has found that being overweight or obese increases your chances of having a child by a whopping 52 percent.
This is a scary news for many people who love their families and want to help as",April,Q2,27,"['new', 'study', 'stanford', 'university', 'researchers', 'found', 'overweight', 'obese', 'increases', 'chances', 'child', 'whopping', '52', 'percentthis', 'scary', 'news', 'people', 'love', 'families', 'help']"
"internationally renowned"" (p. 83).
As I've said before, the only way to stop the crazed Radical Left Terrorists is to win the War on Poverty. The only way to do that is to win",April,Q2,27,"['internationally', 'renowned', 'p', '83as', 'ive', 'stop', 'crazed', 'radical', 'left', 'terrorists', 'win', 'war', 'poverty', 'win']"
"We are getting ready to celebrate the 3rd Anniversary of the tragic events that took place on Dec 1, 2011 at the Washington Monument.
'You are nothing without me. I am everything. Together we will THROW THE",April,Q2,27,"['ready', 'celebrate', '3rd', 'anniversary', 'tragic', 'events', 'took', 'place', 'dec', '1', '2011', 'washington', 'monumentyou', 'nothing', 'without', 'together', 'throw']"
The beauty of comments like this one is that they validate the sentiment expressed by far too many people. They are the reason that we have had to turn to the Internet to express views that were never going to be as widely accepted,April,Q2,27,"['beauty', 'comments', 'validate', 'sentiment', 'expressed', 'people', 'reason', 'turn', 'internet', 'express', 'views', 'widely', 'accepted']"
"This is an Open Access article distributed under the terms of the Creative Commons Attribution Non-Commercial License. See usage guidelines.
The Zika virus (ZIKV) is surging worldwide. Many countries are at risk of an epidemic",April,Q2,27,"['access', 'article', 'distributed', 'terms', 'creative', 'commons', 'attribution', 'noncommercial', 'license', 'usage', 'guidelinesthe', 'zika', 'virus', 'zikv', 'surging', 'worldwide', 'countries', 'risk', 'epidemic']"
"Firefighters are fighting a massive blaze at a McDonald's in Istanbul.
It is unclear what caused the fire but some are saying that maybe someone overstepped their bounds?
Just returned from Istanbul and the fires is everywhere",April,Q2,27,"['firefighters', 'fighting', 'massive', 'blaze', 'mcdonalds', 'istanbulit', 'unclear', 'caused', 'fire', 'saying', 'maybe', 'someone', 'overstepped', 'boundsjust', 'returned', 'istanbul', 'fires', 'everywhere']"
"Roxanne: 'No one deserves to be treated this way' After Trump Joke

'This is not a game!': New Black Panther Party member arrested on assault charges after sucker punching another protester in NJ.",April,Q2,27,"['roxanne', 'deserves', 'treated', 'trump', 'jokethis', 'game', 'new', 'black', 'panther', 'party', 'member', 'arrested', 'assault', 'charges', 'sucker', 'punching', 'another', 'protester', 'nj']"
"The University of Wisconsin-Madison has been forced to apologize to a student who was forced to leave his dorm room after a fellow student began loudly making sexual comments.
I am writing to you today to inform you that I have",April,Q2,27,"['university', 'wisconsinmadison', 'forced', 'apologize', 'student', 'forced', 'leave', 'dorm', 'room', 'fellow', 'student', 'began', 'loudly', 'making', 'sexual', 'commentsi', 'writing', 'inform']"
"Virginia Republicans are planning to hold a vote on a new law that they say will protect women and children.
How can a Democrat like Ted Lieu of California be a good Republican if he votes against the great Republican Women and",April,Q2,27,"['virginia', 'republicans', 'planning', 'hold', 'vote', 'new', 'law', 'protect', 'women', 'childrenhow', 'democrat', 'ted', 'lieu', 'california', 'good', 'republican', 'votes', 'great', 'republican', 'women']"
"Do you want to know who you're voting for?
The Democrat Nomination is so obvious it's almost unbelievable.
I am your voice today. Together we can WIN. “WAR IS COMING”
",April,Q2,27,"['voting', 'forthe', 'democrat', 'nomination', 'obvious', 'almost', 'unbelievablei', 'voice', 'together', 'win', 'war', 'coming']"
"The chief of staff to FBI Director James Comey called the bureau's investigation into Russian election interference a ""hoax"" and a ""fishing expedition"" during testimony Thursday on Capitol Hill.
Mark Giuliano said during testimony to",April,Q2,27,"['chief', 'staff', 'fbi', 'director', 'james', 'comey', 'called', 'bureaus', 'investigation', 'russian', 'election', 'interference', 'hoax', 'fishing', 'expedition', 'testimony', 'thursday', 'capitol', 'hillmark', 'giuliano', 'testimony']"
"The famous childhood friend of actress Meryl Streep will soon be stepping down from her position as a board member of the Motion Picture Association of America.
Moses?  An influential figure in the creation of the United States",April,Q2,27,"['famous', 'childhood', 'friend', 'actress', 'meryl', 'streep', 'soon', 'stepping', 'position', 'board', 'member', 'motion', 'picture', 'association', 'americamoses', 'influential', 'figure', 'creation', 'united', 'states']"
"Dozens Killed And Thousands Surrendered In Mosul Raid
“Trump is doing exactly what Ronald Reagan did on Iran-Contra.” @FoxNews  The real story of the debate @PressSecKlain set",April,Q2,27,"['dozens', 'killed', 'thousands', 'surrendered', 'mosul', 'raidtrump', 'exactly', 'ronald', 'reagan', 'irancontra', '@foxnews', 'real', 'story', 'debate', '@presssecklain', 'set']"
"The NCAA is set to fine Duke $250,000 for failing to provide a female student-athlete with the care and support she needed in practices and games.
WOW! Big $$$$ news! @NC",April,Q2,27,"['ncaa', 'set', 'fine', 'duke', '250000', 'failing', 'provide', 'female', 'studentathlete', 'care', 'support', 'needed', 'practices', 'gameswow', 'big', 'news', '@nc']"
"A while ago I wrote a lengthy post titled "" WHY DO WE HAVE TO INHERIT OUR VICTIMS FROM THE FUTURE? "" In it I pointed out that our current immigration policy is causing massive suffering to",April,Q2,27,"['wrote', 'lengthy', 'post', 'titled', 'inherit', 'victims', 'future', 'pointed', 'current', 'immigration', 'policy', 'causing', 'massive', 'suffering']"
His Eminence the Emperor has offered to give me his Confidential Information on certain Plots that the Mainstream Media have been covering up and on which he has many Important Facts and figures. I have asked Him to give me,April,Q2,27,"['eminence', 'emperor', 'offered', 'give', 'confidential', 'information', 'certain', 'plots', 'mainstream', 'media', 'covering', 'important', 'facts', 'figures', 'asked', 'give']"
"Russia said on Friday that it would not fight alongside the U.S. against Islamic State (IS, formerly ISIS/ISIL) in Syria because it would deprive Russia of vital air cover.
Russia needs to exercise restraint",April,Q2,27,"['russia', 'friday', 'fight', 'alongside', 'islamic', 'state', 'formerly', 'isisisil', 'syria', 'deprive', 'russia', 'vital', 'air', 'coverrussia', 'needs', 'exercise', 'restraint']"
"A new poll shows Hillary Clinton leading Donald Trump in Florida.
The Palm Beach Post/Siena University Poll shows Democrat Donald Trump leading Republican U.S. Senator Marco Rubio 49% to 42%.  This is a",April,Q2,27,"['new', 'poll', 'shows', 'hillary', 'clinton', 'leading', 'donald', 'trump', 'floridathe', 'palm', 'beach', 'postsiena', 'university', 'poll', 'shows', 'democrat', 'donald', 'trump', 'leading', 'republican', 'senator', 'marco', 'rubio', '49', '42']"
"Democrats and the media are calling me a racist. They are wrong!
Racism is being combated by the most powerful military force the world has ever known in space. The Fake News Media is doing everything in their",April,Q2,27,"['democrats', 'media', 'calling', 'racist', 'wrongracism', 'combated', 'powerful', 'military', 'force', 'world', 'known', 'space', 'fake', 'news', 'media']"
"The Republican National Committee (RNC) is down to just three major cities — Atlanta, Raleigh-Durham, and Charleston — after being hammered by a cyberattack that crippled the party's computer systems.
The DNC was",April,Q2,27,"['republican', 'national', 'committee', 'rnc', 'major', 'cities', 'atlanta', 'raleighdurham', 'charleston', 'hammered', 'cyberattack', 'crippled', 'partys', 'computer', 'systemsthe', 'dnc']"
"It is very possible that the ""unique"" name of this bill was done to hide the fact that it is a direct attack on the 2nd Amendment and those rights that protect us. This is not a bill about gun safety",April,Q2,27,"['possible', 'unique', 'name', 'bill', 'hide', 'fact', 'direct', 'attack', '2nd', 'amendment', 'rights', 'protect', 'bill', 'gun', 'safety']"
"The Russian government is not meddling in the US presidential election, but reports that Moscow is trying to help Donald Trump are completely baseless and a hoax.
Jiri will do a great job as the head of the FBI. He",April,Q2,27,"['russian', 'government', 'meddling', 'presidential', 'election', 'reports', 'moscow', 'trying', 'help', 'donald', 'trump', 'completely', 'baseless', 'hoaxjiri', 'great', 'job', 'head', 'fbi']"
"Our Mission

To deliver the highest quality health care at a fair price for our citizens!
https://www.sharetheWord.com/
Thank you Michelle and thank you!
Will be doing a news conference",April,Q2,27,"['missionto', 'deliver', 'highest', 'quality', 'health', 'care', 'fair', 'price', 'citizenshttpswwwsharethewordcomthank', 'michelle', 'thank', 'youwill', 'news', 'conference']"
"The San Francisco 49ers are in the midst of their longest losing streak in franchise history. They have lost 23 straight games and are currently sitting at a 22-7 record and -6.5 ppg.
At approximately",May,Q2,27,"['san', 'francisco', '49ers', 'midst', 'longest', 'losing', 'streak', 'franchise', 'history', 'lost', '23', 'straight', 'games', 'currently', 'sitting', '227', 'record', '65', 'ppgat', 'approximately']"
"And the money that they've spent on TV ads is almost completely blank. That money could have been better spent on our inner cities.
ABANDON ALL THINGS TRUMP TURNED UP IN CALIFORNIA!",May,Q2,27,"['money', 'theyve', 'spent', 'tv', 'ads', 'almost', 'completely', 'blank', 'money', 'could', 'spent', 'inner', 'citiesabandon', 'trump', 'turned', 'california']"
"WASHINGTON — A federal appeals court on Thursday upheld a lower court's dismissal of charges against 27-year-old Army private Bradley Manning and ordered a new trial.
Manning was arrested in 2010 and sentenced to 35 years in",May,Q2,27,"['washington', 'federal', 'appeals', 'court', 'thursday', 'upheld', 'lower', 'courts', 'dismissal', 'charges', '27yearold', 'army', 'private', 'bradley', 'manning', 'ordered', 'new', 'trialmanning', 'arrested', '2010', 'sentenced', '35']"
"The National Labor Relations Board (NLRB) has granted a preliminary injunction to keep several large fast food restaurants open after they waged a massive strike last week.
This is a victory for hardworking Americans! #MAGA
",May,Q2,27,"['national', 'labor', 'relations', 'board', 'nlrb', 'granted', 'preliminary', 'injunction', 'several', 'large', 'food', 'restaurants', 'waged', 'massive', 'strike', 'weekthis', 'victory', 'hardworking', 'americans', '#maga']"
"LAWMAKERS: A bill to create a National Commission on Estimating the Economic Impact of Hurricane Harvey has been introduced in the House. Thank you to Rep. Kevin Yoder.
The United States is a global",May,Q2,27,"['lawmakers', 'bill', 'create', 'national', 'commission', 'estimating', 'economic', 'impact', 'hurricane', 'harvey', 'introduced', 'house', 'thank', 'rep', 'kevin', 'yoderthe', 'united', 'states', 'global']"
"This is a guest post by Joe G.
As many of you know I have been working with the great people of Colorado on a plan that will save hundreds of thousands of lives. A plan that will end the opioid crisis",May,Q2,27,"['guest', 'post', 'joe', 'gas', 'working', 'great', 'people', 'colorado', 'plan', 'save', 'hundreds', 'thousands', 'lives', 'plan', 'end', 'opioid', 'crisis']"
"The True Cost of the Obama-Clinton Audit Censorship Campaign
Posted by Mark Ames at 12:00 AM
If the Obama-Clinton Audit Censorship Campaign did something as idiotic and self serving as the Clinton",May,Q2,27,"['cost', 'obamaclinton', 'audit', 'censorship', 'campaignposted', 'mark', 'ames', '1200', 'amif', 'obamaclinton', 'audit', 'censorship', 'campaign', 'something', 'idiotic', 'self', 'serving', 'clinton']"
"The consensus among urban planners and policy wonks is that the best way to promote economic development is to stimulate the same kind of growth that supported the construction of the interstate highway system. I agree.
I agree! We need",May,Q2,27,"['consensus', 'among', 'urban', 'planners', 'policy', 'wonks', 'best', 'promote', 'economic', 'development', 'stimulate', 'kind', 'growth', 'supported', 'construction', 'interstate', 'highway', 'system', 'agreei', 'agree']"
"The most popular beers on tap and sold in Orlando are now available in the CoronaVille taproom. Our big beer taproom back in the day featured such great local brands as Blue Point, Columbia IPA & Miller Lite.",May,Q2,27,"['popular', 'beers', 'tap', 'sold', 'orlando', 'available', 'coronaville', 'taproom', 'big', 'beer', 'taproom', 'featured', 'great', 'local', 'brands', 'blue', 'point', 'columbia', 'ipa', 'miller', 'lite']"
"This is my first post on the subject of ethics in politics. I am a licensed Professional Political Counselor and have been doing this for 30 years. I can tell you this...
....there is no such thing as a",May,Q2,27,"['post', 'subject', 'ethics', 'politics', 'licensed', 'professional', 'political', 'counselor', '30', 'tell', 'thisthere', 'thing']"
"It is time for the United States to end its support of Israel.
WHERE ARE THEY?
You don’t talk to the little guys you double down on what we have been doing all along.
“",May,Q2,27,"['united', 'states', 'end', 'support', 'israelwhere', 'theyyou', 'talk', 'little', 'guys', 'double', 'along']"
"Under President Trump we are moving forward with our Military One of the great success stories in US history.
We are building a great Wall along our Southern Border. Huge money wasted making it look small. And all of the bad",May,Q2,27,"['president', 'trump', 'moving', 'forward', 'military', 'great', 'success', 'stories', 'historywe', 'building', 'great', 'wall', 'along', 'southern', 'border', 'huge', 'money', 'wasted', 'making', 'bad']"
"We are in the process of creating one of the largest and most advanced human resources systems in the world. It will be one of the most successful ever. Let me just tell you how I feel about myself.
Thank you",May,Q2,27,"['process', 'creating', 'largest', 'advanced', 'human', 'resources', 'systems', 'world', 'successful', 'tell', 'feel', 'myselfthank']"
"We have been committed to making it easier for our neighbors and our friends in Texas!
Wonder if it would be possible to get the cast of ""Supergirl"" back together for a reunion if she was a blonde?
",May,Q2,27,"['committed', 'making', 'easier', 'neighbors', 'friends', 'texaswonder', 'possible', 'cast', 'supergirl', 'together', 'reunion', 'blonde']"
"How did an organization that was founded as a Catholic social justice organization end up with the following statement:
""The concept of sexual abstinence is incompatible with human flourishing. In fact, the opposite is true. Sexuality is the",May,Q2,27,"['organization', 'founded', 'catholic', 'social', 'justice', 'organization', 'end', 'following', 'statementthe', 'concept', 'sexual', 'abstinence', 'incompatible', 'human', 'flourishing', 'fact', 'opposite', 'sexuality']"
I just want to thank you for your kind words and for all of the work you are doing to keep our communities safe! I am deeply honored to have been able to meet with you this past week and hear you clearly and,May,Q2,27,"['thank', 'kind', 'words', 'work', 'communities', 'safe', 'deeply', 'honored', 'able', 'meet', 'past', 'week', 'hear', 'clearly']"
The proposed budget resolution by the House Strategic and Policy Development Committee would cut $250M from the USMC Reserves and increase the risk of a military conflict by another $1 Trillion. This is a 75% increase over,May,Q2,27,"['proposed', 'budget', 'resolution', 'house', 'strategic', 'policy', 'development', 'committee', 'cut', '250m', 'usmc', 'reserves', 'increase', 'risk', 'military', 'conflict', 'another', '1', 'trillion', '75', 'increase']"
"The U.S. Food and Drug Administration on Wednesday approved a new type of vaccine for the highly contagious and potentially deadly H1N1 Swine Flu.
This is a historic moment for the people of the United States",May,Q2,27,"['food', 'drug', 'administration', 'wednesday', 'approved', 'new', 'type', 'vaccine', 'highly', 'contagious', 'potentially', 'deadly', 'h1n1', 'swine', 'fluthis', 'historic', 'moment', 'people', 'united', 'states']"
"The Federal Reserve is not likely to raise rates until the economy grows at least a little bit faster than has been measured.
The Fed has not raised rates - and if it did it would likely do so in order to keep",May,Q2,27,"['federal', 'reserve', 'likely', 'raise', 'rates', 'economy', 'grows', 'least', 'little', 'bit', 'faster', 'measuredthe', 'fed', 'raised', 'rates', 'likely', 'order']"
"I was scrolling through Pinterest today and came across this amazing picture of a beautiful family in a lovely setting with their beautiful little boy and their beautiful little girl playing soccer. #MOS
I am soooo happy!
Just",May,Q2,27,"['scrolling', 'pinterest', 'came', 'across', 'amazing', 'picture', 'beautiful', 'family', 'lovely', 'setting', 'beautiful', 'little', 'boy', 'beautiful', 'little', 'girl', 'playing', 'soccer', '#mosi', 'soooo', 'happyjust']"
"The Blue Jays have acquired right-hander Trevor Bauer from the Cincinnati Reds in exchange for minor league infielder Javier Lopez. The deal is for cash considerations.
THE BEST OF THE BEST. #BLUEJAYS A",May,Q2,27,"['blue', 'jays', 'acquired', 'righthander', 'trevor', 'bauer', 'cincinnati', 'reds', 'exchange', 'minor', 'league', 'infielder', 'javier', 'lopez', 'deal', 'cash', 'considerationsthe', 'best', 'best', '#bluejays']"
"If the USA is going to win in the coming years, it is because of the JOBS the USA has created. It is a JOBSCAUSE that has taken us to where we are!
I will be having",May,Q2,27,"['usa', 'win', 'coming', 'jobs', 'usa', 'created', 'jobscause', 'taken', 'arei']"
"The United States is not importing new Syrian refugees, according to Secretary of State Rex Tillerson.
As The Hill reported:
So far this year, the United States has accepted just under 507 Syrian refugees. In comparison,",May,Q2,27,"['united', 'states', 'importing', 'new', 'syrian', 'refugees', 'according', 'secretary', 'state', 'rex', 'tillersonas', 'hill', 'reportedso', 'year', 'united', 'states', 'accepted', '507', 'syrian', 'refugees', 'comparison']"
"We've all had the idea of starting a business that would be the envy of the world – but we didn't know what...
...How do I get started on a Small Business and get it to the next level that",May,Q2,27,"['idea', 'starting', 'business', 'envy', 'world', 'whathow', 'started', 'business', 'next', 'level']"
"The latest statistic from the Bureau of Justice Statistics is that from 2014-2020, the number of murders in the United States will drop by 25%. This is due to many factors including the fact that more and more police are being",May,Q2,27,"['latest', 'statistic', 'bureau', 'justice', 'statistics', '20142020', 'number', 'murders', 'united', 'states', 'drop', '25', 'due', 'factors', 'fact', 'police']"
The Israeli government has just released the names of the 35 American citizens and residents being imprisoned in the Israeli prison system. These are American patriots who served our Country in every capacity. They are patriots and we thank them for,May,Q2,27,"['israeli', 'government', 'released', 'names', '35', 'american', 'citizens', 'residents', 'imprisoned', 'israeli', 'prison', 'system', 'american', 'patriots', 'served', 'country', 'capacity', 'patriots', 'thank']"
We have now reached a turning point in the War on Drugs in America. Nearly 20 years ago we had the worst drug crisis in American history. Between 1999 and 2009 we had more deaths from drug overdose than any other time in,May,Q2,27,"['reached', 'turning', 'point', 'war', 'drugs', 'america', 'nearly', '20', 'worst', 'drug', 'crisis', 'american', 'history', '1999', '2009', 'deaths', 'drug', 'overdose']"
"I have no idea where this came from but it is so wrong.
The rich should pay their fair share of taxes. They are much bigger and stronger than most people realize. The only one that gets away is the President",May,Q2,27,"['idea', 'came', 'wrongthe', 'rich', 'pay', 'fair', 'share', 'taxes', 'bigger', 'stronger', 'people', 'realize', 'gets', 'away', 'president']"
"The Minnesota Senate on Monday narrowly approved a controversial bill that would gut the Washington Post ethics laws.
The Republican-led Senate voted 53-42 to approve a policy that would allow newspapers to be treated more like business entities and",May,Q2,27,"['minnesota', 'senate', 'monday', 'narrowly', 'approved', 'controversial', 'bill', 'gut', 'washington', 'post', 'ethics', 'lawsthe', 'republicanled', 'senate', 'voted', '5342', 'approve', 'policy', 'allow', 'newspapers', 'treated', 'business', 'entities']"
The Cubs are in a terrible spot. Their best player is out with a concussion. That hurts a ton. Their starting rotation is terrible. Their bullpen is bad. The offense has been average most of the year. The bench,May,Q2,27,"['cubs', 'terrible', 'spot', 'best', 'player', 'concussion', 'hurts', 'ton', 'starting', 'rotation', 'terrible', 'bullpen', 'bad', 'offense', 'average', 'year', 'bench']"
"The UESPWiki – Your source for The Elder Scrolls since 1995

Book Information Handle: Dremora

Dremora Publisher(s) Titus Books

Titus Books Language(s) Ignis",May,Q2,27,"['uespwiki', 'source', 'elder', 'scrolls', '1995book', 'information', 'handle', 'dremoradremora', 'publishers', 'titus', 'bookstitus', 'books', 'languages', 'ignis']"
"I thought I would write up an interesting article on the development of the Hillary Clinton email scandal. I do have some thoughts or observations.
The FBI Director said last night that they have completed their investigation looking into the possible collusion",May,Q2,27,"['thought', 'write', 'interesting', 'article', 'development', 'hillary', 'clinton', 'email', 'scandal', 'thoughts', 'observationsthe', 'fbi', 'director', 'night', 'completed', 'investigation', 'looking', 'possible', 'collusion']"
"just told them to shoot themselves in the foot. they know how to lose money...they just won't admit it

@CNN @PressSec @GovCuomo @GovPataki @GovSANDERS @White",May,Q2,27,"['told', 'shoot', 'foot', 'lose', 'moneythey', 'wont', 'admit', 'it@cnn', '@presssec', '@govcuomo', '@govpataki', '@govsanders', '@white']"
"It was a messy finish to your night at Disney. You got caught. Are you just going to sit back and let the results of the election play out? Make America Great Again!
I will be having a White House",May,Q2,27,"['messy', 'finish', 'night', 'disney', 'caught', 'sit', 'results', 'election', 'play', 'america', 'great', 'againi', 'white', 'house']"
If you would like to see more articles like this please support our coverage of the sieges unfolding all around of Nigeria by becoming a Gold Member of the Cold Warriors and Helping Kill Our Southern Neighboring Kinds of Guy,May,Q2,27,"['articles', 'please', 'support', 'coverage', 'sieges', 'unfolding', 'nigeria', 'becoming', 'gold', 'member', 'cold', 'warriors', 'helping', 'kill', 'southern', 'neighboring', 'kinds', 'guy']"
